"astro-ph/0207066","Martin Pohl","R. Schlickeiser, R. Vainio, M. Boettcher, I. Lerche, M. Pohl, C.
  Schuster","Conversion of relativistic pair energy into radiation in the jets of
  active galactic nuclei","A&A in press","Astron.Astrophys. 393 (2002) 69-88","10.1051/0004-6361:20020975",,"astro-ph",,"  It is generally accepted that relativistic jet outflows power the nonthermal
emission from active galactic nuclei (AGN). The composition of these jets --
leptonic versus hadronic -- is still under debate. We investigate the
microphysical details of the conversion process of the kinetic energy in
collimated relativistic pair outflows into radiation through interactions with
the ambient interstellar medium. Viewed from the coordinate system comoving
with the pair outflow, the interstellar protons and electrons represent a
proton-electron beam propagating with relativistic speed in the pair plasma. We
demonstrate that the beam excites both electrostatic and low-frequency
magnetohydrodynamic Alfven-type waves via a two-stream instability in the pair
background plasma, and we calculate the time evolution of the distribution
functions of the beam particles and the generated plasma wave turbulence power
spectra. For standard AGN jet outflow and environment parameters we show that
the initial beam distributions of interstellar protons and electrons quickly
relax to plateau-distributions in parallel momentum, transferring thereby
one-half of the initial energy density of the beam particles to electric field
fluctuations of the generated electrostatic turbulence. On considerably longer
time scales, the plateaued interstellar electrons and protons will isotropise
by their self-generated transverse turbulence and thus be picked-up in the
outflow pair plasma. These longer time scales are also characteristic for the
development of transverse hydromagnetic turbulence from the plateaued electrons
and protons. This hydromagnetic turbulence upstream and downstream is crucial
for diffusive shock acceleration to operate at external or internal shocks
associated with pair outflows.
","[{""version"":""v1"",""created"":""Tue, 2 Jul 2002 14:01:48 GMT""}]","2009-11-07"
"astro-ph/0207067","Hideyuki Umeda","Hideyuki Umeda (1), Ken'ichi Nomoto (1), Takeshi Go Tsuru (2),
  Hironori Matsumoto (2) ((1) University of Tokyo, (2)Kyoto University)","Peculiar Chemical Abundances in the Starburst Galaxy M82 and Hypernova
  Nucleosynthesis","11 pages, 6 figures, To appear in the Astrophysical Journal 578, 2002","Astrophys.J. 578 (2002) 855-861","10.1086/342650",,"astro-ph",,"  X-ray observations have shown that the chemical abundance in the starburst
galaxy M82 is quite rich in Si and S compared with oxygen. Such an abundance
pattern cannot be explained with any combination of conventional Type I and II
supernova yields. Also the energy to heavy element mass ratio of the observed
hot plasma is much higher than the value resulted from normal supernovae. We
calculate explosive nucleosynthesis in core-collapse hypernovae and show that
the abundance pattern and the large ratio between the energy and the heavy
element mass can be explained with the hypernova nucleosynthesis. Such
hypernova explosions are expected to occur for stars more massive than >~ 20-25
Msun, and likely dominating the starburst, because the age after the starburst
in M82 is estimated to be as short as ~ 10^6 - 10^7 yr. We also investigate
pair-instability supernovae (~ 150-300 Msun) and conclude that the energy to
heavy element mass ratio in these supernovae is too small to explain the
observation.
","[{""version"":""v1"",""created"":""Tue, 2 Jul 2002 14:12:48 GMT""}]","2009-11-07"
"astro-ph/0207068","R. Schlickeiser","R. Schlickeiser, I. Lerche","Kinetic theory of interstellar density and magnetic field fluctuations.
  Relations between interstellar density and magnetic field fluctuations","11 pages. J. Plasma Phys., in press",,,,"astro-ph",,"  Using linear kinetic plasma theory the relation between electron density and
magnetic field fluctuations for low-frequency plasma waves for Maxwellian
background distribution functions of arbitrary temperatures in an uniform
magnetic field is derived. By taking the non-relativistic temperature limit
this relation is calculated for the diffuse intercloud medium in our Galaxy.
The diffuse intercloud medium is the dominant phase of the interstellar medium
with respect to radio wave propagation, dispersion and rotation measure
studies. The differences between the relation of electron density and magnetic
field fluctuations from the linear kinetic theory as compared to the classical
MHD theory are established and discussed.
","[{""version"":""v1"",""created"":""Tue, 2 Jul 2002 14:41:06 GMT""}]","2007-05-23"
"cond-mat/0207014","Risto Tammelo","Risto Tammelo, Romi Mankin, Dmitri Martila","Three and four current reversals versus temperature in correlation
  ratchets with a simple sawtooh potential","4 pages, 5 figures; some changes introduced; accepted for publication
  in Physical Review E","Phys. Rev. E 66, 051101 (2002)","10.1103/PhysRevE.66.051101",,"cond-mat.soft",,"  Transport of Brownian particles on a simple sawtooth potential subjected to
both unbiased thermal and nonequilibrium symmetric three-level Markovian noise
is considered. The new effects of three and four current reversals as a
function of temperature are established in such correlation ratchets. The
parameter space coordinates of the fixed points associated with these current
reversals and the necessary and sufficient conditions for the existence of the
novel current reversals are found.
","[{""version"":""v1"",""created"":""Mon, 1 Jul 2002 17:21:17 GMT""},{""version"":""v2"",""created"":""Tue, 1 Oct 2002 14:57:52 GMT""}]","2009-11-07"
"cond-mat/0207021","S. Haddad","S. Haddad (1), S. Charfi-Kaddour (1), C. Nickel (2), M. H\'eritier (2)
  and R. Bennaceur (1) ((1) LPMC, Facult\'e des Sciences de Tunis, Tunisia, (2)
  LPS, associ\'e au CNRS, Universite Paris-Sud, Orsay, France)","Competing phases in the high field phase diagram of (TMTSF)$_2$ClO$_4$","5 pages, 3 figures (to appear in Phys. Rev. Lett.)",,"10.1103/PhysRevLett.89.087001",,"cond-mat.str-el",,"  A model is presented for the high field phase diagram of (TMTSF)$_2$ClO$_4$,
taking into account the anion ordering, which splits the Fermi surface in two
bands. For strong enough field, the largest metal-SDW critical temperature
corresponds to the N=0 phase, which originates from two intraband nesting
processes. At lower temperature, the competition between these processes puts
at disadvantage the N=0 phase vs. the N=1 phase, which is due to interband
nesting. A first order transition takes then place from the N=0 to N=1 phase.
We ascribe to this effect the experimentally observed phase diagrams.
","[{""version"":""v1"",""created"":""Mon, 1 Jul 2002 16:34:39 GMT""}]","2009-11-07"
"cond-mat/0207040","Ignacio Cirac","B. Paredes and J. I. Cirac","From Cooper pairs to Luttinger liquids with bosonic atoms in optical
  lattices","5 pages, 4 figures",,"10.1103/PhysRevLett.90.150402",,"cond-mat",,"  We propose a scheme to observe typical strongly correlated fermionic
phenomena with bosonic atoms in optical lattices. For different values of the
sign and strength of the scattering lengths it is possible to reach a
""superconducting"" regime, where the system exhibits atomic pairing, or a
Luttinger liquid behavior. We identify the range of parameters where these
phenomena appear, illustrate our predictions with numerical calculations, and
show how to detect the presence of pairing.
","[{""version"":""v1"",""created"":""Mon, 1 Jul 2002 16:04:52 GMT""}]","2009-11-07"
"cond-mat/0207041","Fei Zhou","F. Zhou (ITP, Utrecht)","Spin-one bosons in low dimensional Mott insulating states","5 pages; discussions on non-integer case have been shortened",,"10.1209/epl/i2003-00555-0","Report ITP-UU-02/19(2002)","cond-mat.stat-mech cond-mat.str-el",,"  We analyze the strong coupling limit of spin-one bosons in low dimensional
Mott insulating states. In 1D lattices, for an odd number of bosons per site
($N_0$), the ground state is a dimerized valence bond crystal state with a
two-fold degeneracy; the low lying elementary spin excitations carry spin one.
For an even number of bosons per site, the ground state is a nondegenerate spin
singlet Mott state. We also argue that in a square lattice in a quantum
disordered limit the ground states should be dimerized valence bond crystals
for an odd integer $N_0$. Finally, we briefly report results for non-integer
numbers of bosons per site in one-dimensional lattices.
","[{""version"":""v1"",""created"":""Mon, 1 Jul 2002 19:02:07 GMT""},{""version"":""v2"",""created"":""Sat, 17 Aug 2002 14:05:18 GMT""},{""version"":""v3"",""created"":""Mon, 23 Dec 2002 19:44:26 GMT""},{""version"":""v4"",""created"":""Thu, 5 Jun 2003 09:06:59 GMT""}]","2009-11-07"
"cond-mat/0207042","Eli Eisenberg","Eli Eisenberg and Elliott H. Lieb","Polarization of interacting bosons with spin","v4: as published in PRL","Phys. Rev. Lett. 89, 220403 (2002) .","10.1103/PhysRevLett.89.220403",,"cond-mat.stat-mech math-ph math.MP",,"  We demonstrate rigorously that in the absence of explicit spin-dependent
forces one of the ground states of interacting bosons with spin is always fully
polarized -- however complicated the many-body interaction potential might be.
Depending on the particle spin, the polarized ground state will generally be
degenerate with other states, but one can specify the exact degeneracy. For T>0
the magnetization and susceptibility necessarily exceed that of a pure
paramagnet. These results are relevant to recent experiments exploring the
relation between triplet superconductivity and ferromagnetism, and the
Bose-Einstein condensation of atoms with spin. They eliminate the possibility,
raised in some theoretical speculations, that the ground state or positive
temperature state might be antiferromagnetic.
","[{""version"":""v1"",""created"":""Mon, 1 Jul 2002 19:55:16 GMT""},{""version"":""v2"",""created"":""Mon, 1 Jul 2002 20:01:03 GMT""},{""version"":""v3"",""created"":""Wed, 3 Jul 2002 18:10:39 GMT""},{""version"":""v4"",""created"":""Thu, 31 Oct 2002 10:23:38 GMT""}]","2009-11-07"
"cond-mat/0207043","Andreas Wagner","A. Wagner","How the global structure of protein interaction networks evolves",,,,,"cond-mat.stat-mech cond-mat.dis-nn q-bio",,"  Two processes can influence the evolution of protein interaction networks:
addition and elimination of interactions between proteins, and gene
duplications increasing the number of proteins and interactions. The rates of
these processes can be estimated from available Saccharomyces cerevisiae genome
data and are sufficiently high to affect network structure on short time
scales. For instance, more than 100 interactions may be added to the yeast
network every million years, a substantial fraction of which adds previously
unconnected proteins to the network. Highly connected proteins show a greater
rate of interaction turnover than proteins with few interactions. From these
observations one can explain ? without natural selection on global network
structure ? the evolutionary sustenance of the most prominent network feature,
the distribution of the frequency P(d) of proteins with d neighbors, which is a
broad-tailed distribution. This distribution is independent of the experimental
approach providing nformation on network structure.
","[{""version"":""v1"",""created"":""Mon, 1 Jul 2002 20:44:22 GMT""}]","2007-05-23"
"cond-mat/0207044","Yigal Meir","Yigal Meir, Kenji Hirose and Ned S. Wingreen","Kondo model for the ""0.7 anomaly"" in transport through a quantum point
  contact","4 pages",,"10.1103/PhysRevLett.89.196802",,"cond-mat.mes-hall",,"  Experiments on quantum point contacts have highlighted an anomalous
conductance plateau at $0.7 (2e^2/h)$, with features suggestive of the Kondo
effect. Here we present an Anderson model for transport through a point contact
which we analyze in the Kondo limit. Hybridization to the band increases
abruptly with energy but decreases with valence, so that the background
conductance and the Kondo temperature $T_K$ are dominated by different valence
transitions. This accounts for the high residual conductance above $T_K$. A
spin-polarized current is predicted for Zeeman splitting $g^* \mu_B B > k_B
T_K,k_BT$.
","[{""version"":""v1"",""created"":""Mon, 1 Jul 2002 21:10:39 GMT""}]","2009-11-07"
"cond-mat/0207045","Yoshio Kuramoto","Yoshio Kuramoto and Katsunori Kubo","Interpocket polarization model for magnetic structures in rare-earth
  hexaborides","5 pages, 3 figures, submitted to J.Phys.Soc.Jpn",,"10.1143/JPSJ.71.2633",,"cond-mat.str-el",,"  The origin of peculiar magnetic structures in cubic rare-earth (R)
hexaborides RB_6 is traced back to their characteristic band structure. The
three sphere-like Fermi surfaces induce interpocket polarization of the
conduction band as a part of a RKKY-type interaction. It is shown for the
free-electron-like model that the interpocket polarization gives rise to a
broad maximum in the intersite interaction I(q) around q=(1/4,1/4,1/2) in the
Brillouin zone. This maximum is consistent with the superstructure observed in
R=Ce, Gd and Dy. The wave-number dependence of I(q) is independently extracted
from analysis of the spin-wave spectrum measured for NdB_6. It is found that
I(q) obtained from fitting the data has a similarly to that derived by the
interpocket polarization model, except that the absolute maximum now occurs at
(0,0,1/2) in consistency with the A-type structure. The overall shape of I(q)
gives a hint toward understanding an incommensurate structure in PrB_6 as well.
","[{""version"":""v1"",""created"":""Tue, 2 Jul 2002 02:20:35 GMT""}]","2009-11-07"
"cond-mat/0207046","Kai Dieckmann","K. Dieckmann, C. A. Stan, S. Gupta, Z. Hadzibabic, C. H. Schunck, and
  W. Ketterle","Decay of an ultracold fermionic lithium gas near a Feshbach resonance","4 pages, 2 figures","Phys. Rev. Lett. 89, 203201 (2002)","10.1103/PhysRevLett.89.203201",,"cond-mat",,"  We studied the magnetic field dependence of the inelastic decay of an
ultracold, optically trapped 6-Li gas of different spin compositions. The spin
mixture of the two lowest hyperfine states showed two decay resonances at 550 G
and 680 G due to two-body collisions, close to the predicted Feshbach resonance
of the elastic s-wave collisions at 800 G. The rapid decay near Feshbach
resonances found in bosonic gases was found to be suppressed by the Pauli
exclusion principle. The observed lifetimes of several hundred milliseconds are
much longer than the expected time for Cooper pair formation and the phase
transition to superfluidity in the vicinity of the Feshbach resonance.
","[{""version"":""v1"",""created"":""Tue, 2 Jul 2002 04:56:31 GMT""},{""version"":""v2"",""created"":""Mon, 8 Jul 2002 01:46:18 GMT""},{""version"":""v3"",""created"":""Mon, 25 Nov 2002 03:47:52 GMT""}]","2009-11-07"
"cond-mat/0207047","Kyungsik Kim","Kyungsik Kim, Y.S. Kong","Anomalous Behaviors in Fractional Fokker-Planck Equation","10 pages, Latex","J. Korean Phys. Soc. 40, 979 (2002)",,,"cond-mat.stat-mech",,"  We introduce a fractional Fokker-Planck equation with a temporal power-law
dependence on the drift force fields. For this case, the moments of the tracer
from the force-force correlation in terms of the time-dependent drift force
fields are discussed analytically. The long-time asymptotic behavior of the
second moment is determined by the scaling exponent $\xi$ imposed by the drift
force fields. In the special case of the space scaling value $\nu=1$ and the
time scaling value $\tau=1$, our result can be classified according to the
temporal scaling of the mean second moment of the tracer for large $t$: $<
\bar{x^2(t)} >$ $\propto$ $t$ with $\xi={1/4}$ for normal diffusion, and $<
\bar{x^2(t)} >$ $\propto$ $t^{\eta}$ with $\eta>1$ and $\xi>{1/4}$ for
superdiffusion.
","[{""version"":""v1"",""created"":""Tue, 2 Jul 2002 04:39:54 GMT""}]","2007-05-23"
"cond-mat/0207048","Dvira Segal","Dvira Segal, Abraham Nitzan","Conduction in molecular junctions: Inelastic effects","42 pages, 9 figures, Chem. Phys., in press",,"10.1016/S0301-0104(02)00504-9",,"cond-mat",,"  The effect of a thermal environment on electron (or hole) transfer through
molecular bridges and on the electron conduction properties of such bridges is
studied. Our steady state formalism based on an extension of the Redfield
theory (D. Segal et al, J. Phys. Chem. B 104 (2000) 3817; Chem. Phys. 268
(2001) 315) is extended in two ways: First, a better description of the weak
coupling limit, which accounts for the asymmetry of the energy dependence of
the quasi-elastic component of the transmission is employed. Secondly, for
strong coupling to the thermal bath the small polaron transformation is
employed prior to the Redfield expansion. It is shown that the thermal coupling
is mainly characterized by two physical parameters: The reorganization energy
that measures the coupling strength and the correlation time (or its inverse -
the spectral width) of the thermal bath. Implications for the observed
dependence of the bridge-length dependence of the transmissions are discussed.
It is argued that in the intermediate regime between tunneling behavior and
site-to-site thermally induced hopping, the transport properties may depend on
the interplay between the local relaxation rate and the transmission dynamics.
","[{""version"":""v1"",""created"":""Tue, 2 Jul 2002 08:16:22 GMT""}]","2009-11-07"
"cond-mat/0207049","Antonio Prados","A. Prados and J. Javier Brey","Effective dynamics and steady state of an Ising model submitted to
  tapping processes","28 pages, 6 figures; Revtex4 preprint style;accepted version (minor
  changes); to appear in Phys. Rev. E","Physical Review E 66, 041308 (2002)","10.1103/PhysRevE.66.041308",,"cond-mat.stat-mech cond-mat.soft",,"  A one-dimensional Ising model with nearest neighbour interactions is applied
to study compaction processes in granular media. An equivalent particle-hole
picture is introduced, with the holes being associated to the domain walls of
the Ising model. Trying to mimic the experiments, a series of taps separated by
large enough waiting times, for which the system freely relaxes, is considered.
The free relaxation of the system corresponds to a T=0 dynamics which can be
analytically solved. There is an extensive number of metastable states,
characterized by all the holes being isolated. In the limit of weak tapping, an
effective dynamics connecting the metastable states is obtained. The steady
state of this dynamics is analyzed, and the probability distribution function
is shown to have the canonical form. Then, the stationary state is described by
Edwards thermodynamic granular theory. Spatial correlation functions in the
steady state are also studied.
","[{""version"":""v1"",""created"":""Tue, 2 Jul 2002 08:48:47 GMT""},{""version"":""v2"",""created"":""Wed, 4 Sep 2002 09:05:52 GMT""}]","2009-11-07"
"cond-mat/0207050","L. M. Sandratskii","L.M. Sandratskii and P. Bruno","Exchange interactions and Curie temperature in (GaMn)As",,,"10.1103/PhysRevB.66.134435",,"cond-mat.mtrl-sci",,"  We use supercell and frozen-magnon approaches to study the dependence of the
magnetic interactions in (Ga,Mn)As on the Mn concentration. We report the
parameters of the exchange interaction between Mn spins and the estimates of
the Curie temperature within the mean-field and random-phase approximations. In
agreement with experiment we obtain a nonmonotonous dependence of the Curie
temperature on the Mn concentration. We estimate the dependence of the Curie
temperature on the concentration of the carries in the system and show that the
decrease of the number of holes in the valence band leads to fast decrease of
the Curie temperature. We show that the hole states of the valence band are
more efficient in mediating the exchange interaction between Mn spins than the
electron states of the conduction band.
","[{""version"":""v1"",""created"":""Tue, 2 Jul 2002 09:18:28 GMT""}]","2009-11-07"
"cond-mat/0207051","Ludger Harnau","L. Harnau and S. Dietrich","Wetting and capillary nematization of binary hard-platelet and hard-rod
  fluids","11 pages, 11 figures",,"10.1103/PhysRevE.66.051702",,"cond-mat.stat-mech cond-mat.soft",,"  Density-functional theory is used to investigate the phase behavior of
colloidal binary hard-platelet and hard-rod fluids near a single hard wall or
confined in a slit pore. The Zwanzig model, in which the orientations of the
particles of rectangular shape are restricted to three orthogonal orientations,
is analyzed by numerical minimization of the grand potential functional. The
density and orientational profiles as well as the surface contributions to the
grand potential are determined. The calculations exhibit a wall-induced
continuous surface transition from uniaxial to biaxial symmetry for the
hard-rod fluid. Complete wetting of the wall -- isotropic liquid interface by a
biaxial nematic film for rods and a uniaxial nematic film for platelets is
found. For the fluids confined by two parallel hard walls we determine a
first-order capillary nematization transition for large slit widths, which
terminates in a capillary critical point upon decreasing the slit width.
","[{""version"":""v1"",""created"":""Tue, 2 Jul 2002 09:48:43 GMT""}]","2009-11-07"
"cond-mat/0207052","G. Sergeeva","G.G.Sergeeva (Kharkov Institute of Physics and Technology, Ukraine),
  V.L.Vakula (Institute for Low Temperature Physics and Engineering, Ukraine)","Three Component Model of Pseudogap State for Hihg Temperature
  Superconductors","5 pages",,,"KIPT-02-05","cond-mat.supr-con",,"  Three Component Model of Pseudogap State for Hihg Temperature Superconductors
G.G.Sergeeva (Kharkov Institute of Physics and Technology, Ukraine),
  V.L.Vakula (Institute for Low Temperature Physics and Engineering, Ukraine)
  Abstract For underdoped cuprate HTS three component model of pseudogap state
is proposed where it is shown that at T<T* the zero-dimensional superconducting
fluctuations are developing in copper-oxygen planes in the addition to
Jahn-Teller small polarons (with total spin 1/2) and holes. These
superconducting fluctuations are the local ""hole-Jahn-Teller small polaron""
pairs with BCS pairing. At T<T* (T* is the pseudogap temperature) the crossover
of three-dimensional charge to ""two-dimensional"" one occurs, and polaron shift
of the energy leads to the compensation of Coulomb repulsion between the
polaron and the hole, and to their on-site attraction in in copper-oxygen
planes. Some experimental evidences of the local ""hole-Jahn-Teller small
polaron"" pairing at T<T* are discussed.
","[{""version"":""v1"",""created"":""Tue, 2 Jul 2002 09:50:19 GMT""}]","2007-05-23"
"cond-mat/0207053","Sang Wook Kim","Sang Wook Kim and Seunghwan Kim","Internal localized eigenmodes on spin discrete breathers in
  antiferromagnetic chains with on-site easy axis anisotropy","4 pages including 5 figures","Phys. Rev. B, vol.66, 212408 (2002)","10.1103/PhysRevB.66.212408",,"cond-mat.dis-nn nlin.PS",,"  We investigate internal localized eigenmodes of the linearized equation
around spin discrete breathers in 1D antiferromagnets with on-site easy axis
anisotropy. The threshold of occurrence of the internal localized eigenmodes
has a typical structure in parameter space depending on the frequency of the
spin discrete breather. We also performed molecular dynamics simulation in
order to show the validity of our linear analysis.
","[{""version"":""v1"",""created"":""Tue, 2 Jul 2002 10:07:08 GMT""}]","2009-11-07"
"cond-mat/0207054","Tullio Scopigno","T. Scopigno, G. Ruocco, F. Sette, G. Viliani","Evidence of short time dynamical correlations in simple liquids","7 pages, 7 .eps figs. To appear in Phys. Rev. E","Phys. Rev. E 66, 031205 (2002)","10.1103/PhysRevE.66.031205",,"cond-mat.dis-nn",,"  We report a molecular dynamics (MD) study of the collective dynamics of a
simple monatomic liquid -interacting through a two body potential that mimics
that of lithium- across the liquid-glass transition. In the glassy phase we
find evidences of a fast relaxation process similar to that recently found in
Lennard-Jones glasses. The origin of this process is ascribed to the
topological disorder, i.e. to the dephasing of the different momentum $Q$
Fourier components of the actual normal modes of vibration of the disordered
structure. More important, we find that the fast relaxation persists in the
liquid phase with almost no temperature dependence of its characteristic
parameters (strength and relaxation time). We conclude, therefore, that in the
liquid phase well above the melting point, at variance with the usual
assumption of {\it un-correlated} binary collisions, the short time particles
motion is strongly {\it correlated} and can be described via a normal mode
expansion of the atomic dynamics.
","[{""version"":""v1"",""created"":""Tue, 2 Jul 2002 10:29:03 GMT""}]","2009-11-07"
