"cond-mat/0207189","Alfonso Romano","J. Ranninger and A. Romano","From local to macroscopic coherence in systems with composite
  quasi-particles","12 pages, 12 figures, to appear in Phys. Rev. B","Phys. Rev. B 66, 094508 (2002)","10.1103/PhysRevB.66.094508",,"cond-mat.supr-con",,"  Strongly interacting systems are characterized by heavily dressed entities
with internal degrees of freedom, which, on a local level, can be described in
terms of coherent quantum states. We examine the modification of these local
coherent quantum states when such entities condense into a macroscopic coherent
quantum state, such as superfluidity. As an example, we consider a system of
electrons coupled to local lattice deformations. Significant changes in the
phonon clouds surrounding the charge carriers occur when the system develops
into a spatially phase-locked state. The question of localized self-trapped
charge carriers (bipolarons) in the normal state becoming delocalized upon
entering the superconducting phase is discussed in terms of squeezing of the
local coherent phonon states. Suggestions for experimental verifications of
these features associated with the lattice dynamics are made.
","[{""version"":""v1"",""created"":""Sun, 7 Jul 2002 22:18:59 GMT""}]","2009-11-07"
"cond-mat/0207190","A. J. Millis","S. Kos, A. J. Millis and A. I. Larkin","Gaussian fluctuation corrections to the BCS mean field gap amplitude at
  zero temperature","New author added. Incorrect calculations of previous version
  corrected and conclusions revised Rev 2: New references added, minor
  misprints corrected",,,,"cond-mat.str-el cond-mat.supr-con",,"  The leading (Gaussian) fluctuation correction to the weak coupling zero
temperature BCS superconducting gap equation is computed. We find that the
dominant contribution comes from the high energies and momenta (compared to the
gap) and gives a correction smaller by the weak-coupling factor $gN_0$ than the
mean-field terms. This correction is small due to cancellation of singular
contributions from the amplitude and phase mode at high energies and momenta.
","[{""version"":""v1"",""created"":""Sun, 7 Jul 2002 21:59:25 GMT""},{""version"":""v2"",""created"":""Mon, 21 Jun 2004 11:30:47 GMT""},{""version"":""v3"",""created"":""Thu, 30 Sep 2004 12:46:20 GMT""}]","2007-05-23"
"cond-mat/0207191","Olivier Cepas","O. Cepas, T. Ziman","Static and Dynamical Dzyaloshinsky-Moriya interactions in gapped spin
  systems","8 pages, 3 figures. Proceedings of the conference in Fukuoka, Nov.
  2001, to appear in Fukuoka University Press",,,,"cond-mat.str-el",,"  Anisotropic spin-spin interactions of Dzyaloshinsky and Moriya symmetry are
generally considered weak, as they depend on the spin-orbit couplings. In spin
systems with gapped ground states they can, however, have rather strong
effects. We will discuss recent results related to the results of neutron
scattering and ESR for $\rm SrCu_2(BO_3)_2$. Inclusion of the
Dzyaloshinsky-Moriya interactions can explain much of the dynamics of the
systems discussed, in particular the splitting and dispersion of the triplet
modes. Some effects remain to be explained, however. Symmetries of the crystal
lead to the prediction of zero intensity for transitions, for example between
the ground state and the triplets observed in ESR.
  We present recent calculations of the effects of anisotropic terms generated
dynamically, ie linearly in the phonon coordinates. We discuss how this leads
to a novel mechanism to explain the ESR intensities. For polarized neutron
scattering experiments, we can calculate the mixing of nuclear and magnetic
scattering amplitudes by such a term and how such mixing should be observed.
","[{""version"":""v1"",""created"":""Mon, 8 Jul 2002 00:30:36 GMT""}]","2007-05-23"
"cond-mat/0207192","Kenichi Sasaki","K. Sasaki","Instability of capacitance mode in multi-walled nanotubes","6 pages, 2 figures",,,"TU-662","cond-mat.mes-hall cond-mat.str-el",,"  Conditions for intra and inter layer Coulomb interactions in multi-walled
carbon nanotubes are derived from stability of capacitance excitations. It is
pointed out, supposing the stability conditions are not satisfied, that the
system has unstable modes which correspond to a charge transfer between layers
or charge density oscillation in each layer depending on zero mode or non-zero
modes. It is argued that the stability conditions can be broken when the vacuum
polarization processes due to the massive bands are taken into account.
","[{""version"":""v1"",""created"":""Mon, 8 Jul 2002 04:45:20 GMT""}]","2007-05-23"
"cond-mat/0207193","Mayumi Yakiyama","M.Yakiyama and Y.Hasegawa","Coherence peak in the spin susceptibility from nesting in spin-triplet
  superconductors; A probe for line nodes in Sr$_2$RuO$_4$","7 pages, 9 figures","Phys. Rev. B 67, 014512 (2003)","10.1103/PhysRevB.67.014512",,"cond-mat",,"  We study the dynamical spin susceptibility $\chi ({\bf q},\omega)$ for
spin-triplet superconductivity. We show that a large peak at $\omega = 2
\Delta$ appears in $\textrm{Im} \chi_{zz}({\mathbf{Q}}, \omega)$, where $z$ is
the direction of the $\mathbf{d}$ vector for triplet pairing, if Fermi surface
has a nested part with the nesting vector $\mathbf{Q}$ and the order parameter
is $+\Delta$ and $-\Delta$ in this part of the Fermi surface. If there are line
nodes in the nested part of the Fermi surface, a peak appears in either
$\textrm{Im} \chi_{zz}(\mathbf{Q}, \omega)$ or
  $\textrm{Im} \chi_{+-}(\mathbf{Q}, \omega)$, or both, depending on the
perpendicular component of the nesting vector. The comparison with inelastic
neutron scattering experiments can determine the position of the line nodes in
triplet superconductor Sr$_2$RuO$_4$.
","[{""version"":""v1"",""created"":""Mon, 8 Jul 2002 06:43:49 GMT""},{""version"":""v2"",""created"":""Tue, 28 Jan 2003 07:11:02 GMT""}]","2016-08-31"
"cond-mat/0207194","Marc Mezard","Marc Mezard and Riccardo Zecchina","The random K-satisfiability problem: from an analytic solution to an
  efficient algorithm","38 pages, 13 figures; corrected typos","Phys. Rev. E 66 (2002) 056126","10.1103/PhysRevE.66.056126",,"cond-mat.dis-nn cond-mat.stat-mech",,"  We study the problem of satisfiability of randomly chosen clauses, each with
K Boolean variables. Using the cavity method at zero temperature, we find the
phase diagram for the K=3 case. We show the existence of an intermediate phase
in the satisfiable region, where the proliferation of metastable states is at
the origin of the slowdown of search algorithms. The fundamental order
parameter introduced in the cavity method, which consists of surveys of local
magnetic fields in the various possible states of the system, can be computed
for one given sample. These surveys can be used to invent new types of
algorithms for solving hard combinatorial optimizations problems. One such
algorithm is shown here for the 3-sat problem, with very good performances.
","[{""version"":""v1"",""created"":""Mon, 8 Jul 2002 08:06:28 GMT""},{""version"":""v2"",""created"":""Tue, 3 Sep 2002 09:26:22 GMT""},{""version"":""v3"",""created"":""Tue, 19 Nov 2002 18:10:38 GMT""}]","2009-11-07"
"cond-mat/0207195","John Schliemann","John Schliemann, Alexander V. Khaetskii, Daniel Loss","Spin decay and quantum parallelism","6 pages, 4 figures included, version to appear in Phys. Rev. B","Phys. Rev. B 66, 245303 (2002)","10.1103/PhysRevB.66.245303",,"cond-mat.mes-hall quant-ph",,"  We study the time evolution of a single spin coupled inhomogeneously to a
spin environment. Such a system is realized by a single electron spin bound in
a semiconductor nanostructure and interacting with surrounding nuclear spins.
We find striking dependencies on the type of the initial state of the nuclear
spin system. Simple product states show a profoundly different behavior than
randomly correlated states whose time evolution provides an illustrative
example of quantum parallelism and entanglement in a decoherence phenomenon.
","[{""version"":""v1"",""created"":""Mon, 8 Jul 2002 09:27:28 GMT""},{""version"":""v2"",""created"":""Thu, 10 Oct 2002 10:13:42 GMT""}]","2009-11-07"
"cond-mat/0207196","Markus Greiner","Markus Greiner (1 and 2), Olaf Mandel (1 and 2), Theodor W. Haensch (1
  and 2) and Immanuel Bloch (1 and 2) ((1) Ludwig-Maximilians-Universitaet,
  Munich, (2) Max-Planck-Institut fuer Quantenoptik, Garching, Germany)","Collapse and Revival of the Matter Wave Field of a Bose-Einstein
  Condensate",,,"10.1038/nature00968",,"cond-mat.soft",,"  At the heart of a Bose-Einstein condensate lies its description as a single
giant matter wave. Such a Bose-Einstein condensate represents the most
""classical"" form of a matter wave, just as an optical laser emits the most
classical form of an electromagnetic wave. Beneath this giant matter wave,
however, the discrete atoms represent a crucial granularity, i.e. a
quantization of this matter wave field. Here we show experimentally that this
quantization together with the cold collisions between atoms lead to a series
of collapses and revivals of the coherent matter wave field of a Bose-Einstein
condensate. We observe such collapses and revivals directly in the dynamical
evolution of a multiple matter wave interference pattern, and thereby
demonstrate a striking new behaviour of macroscopic quantum matter.
","[{""version"":""v1"",""created"":""Mon, 8 Jul 2002 10:24:58 GMT""}]","2009-11-07"
"cond-mat/0207197","Gavrilov Sergey","V.P. Plakhty (Petersburg Nuclear Physics Institute), S.V. Maleyev
  (Petersburg Nuclear Physics Institute), S.V. Gavrilov (Petersburg Nuclear
  Physics Institute), F.Bourdarot (Institut Laue-Langevin), S.Pouget (Institut
  Laue-Langevin), S.N.Barilo (Institute for Solid State and Semiconductor
  Physics)","Quantum Phase Transition in Pr2CuO4 to Collinear Spin State in Inclined
  Magnetic Field: A Neutron Diffraction Observation",,,"10.1209/epl/i2003-00162-1",,"cond-mat.str-el",,"  In the external field slightly inclined to the $x$- or y-axis of the
frustrated tetragonal atiferromagnet Pr2CuO4, a transition is discovered from
the phase with orthogonal antiferromagnetic spin subsystems along [1,0,0] and
[0,1,0] to the phase with the collinear spins. This phase is shown to be due to
the pseudodipolar interaction, and transforms into the spin-flop phase S perp H
asymptotically at very high field. The discovered phase transition holds at T=0
and is a quantum one, with the transition field being the critical point and
the angle between two subsystems being the order parameter.
","[{""version"":""v1"",""created"":""Mon, 8 Jul 2002 10:41:21 GMT""}]","2009-11-07"
"cond-mat/0207198","Dudek","Aleksandra Nowicka, Artur Duda, and Miroslaw R. Dudek","Effect of Variable Surrounding on Species Creation","contributed talk at Conference on Mathematical Modelling of
  Population Dunamics, Bedlewo, Poland, June 24-28, 2002",,,,"cond-mat.soft cond-mat.dis-nn q-bio",,"  We construct a model of speciation from evolution in an ecosystem consisting
of a limited amount of energy recources. The species posses genetic
information, which is inherited according to the rules of the Penna model of
genetic evolution. The increase in number of the individuals of each species
depends on the quality of their genotypes and the available energy resources.
The decrease in number of the individuals results from the genetic death or
reaching the maximum age by the individual. The amount of energy resources is
represented by a solution of the differential logistic equation, where the
growth rate of the amount of the energy resources has been modified to include
the number of individuals from all species in the ecosystem under
consideration. We observe that small evolutionary changes of the inherited
genetic information lead to spontaneous bursts of the evolutionary activity
when many new species may appear in a short period.
","[{""version"":""v1"",""created"":""Mon, 8 Jul 2002 11:10:08 GMT""}]","2007-05-23"
"cond-mat/0207199","E. V. sampathkumaran","E.V. Sampathkumaran, H. Bitterlich, K. K. Iyer, W. L\""oser and G. Behr","Magnetic behavior of single crystalline Ho$_2$PdSi$_3$","Physical Review B, in press",,"10.1103/PhysRevB.66.052409",,"cond-mat.str-el cond-mat.mtrl-sci",,"  The magnetic behavior of single-crystal Ho$_2$PdSi$_3$, crystallizing in an
AlB$_2$-derived hexagonal structure, is investigated by magnetic susceptibility
($\chi$) and electrical resistivity ($\rho$) measurements along two directions.
There is no dramatic anisotropy in the high temperature Curie-Weiss parameter
or in the $\rho$ and isothermal magnetization data, though there is a
noticeable anisotropy in the magnitude of $\rho$ between two perpendicular
orientations. The degree of anisotropy is overall less prominent than in the Gd
(which is an S-state ion!) and Tb analogues. A point of emphasis is that this
compound undergoes long range magnetic ordering below 8 K as in the case of
analogous Gd and Dy compounds. Considering this fact for these compounds with
well-localised f-orbital, the spin glass freezing noted for isomorphous U
compounds in the recent literature could be attributed to the role of the
f-ligand hybridization, rather than just Pd-Si disorder.
","[{""version"":""v1"",""created"":""Mon, 8 Jul 2002 11:49:36 GMT""}]","2009-11-07"
"cond-mat/0207200","Yury M. Zinoviev","Yury M. Zinoviev","The Magnetization by the Finite Energy Constant Magnetic Field in the
  Two - Dimentional Ising Model","LaTeX, 17 pages",,,"SMU - 02 - 117","cond-mat.stat-mech",,"  We suggest the new definition of the magnetization. For the two - dimensional
Ising model with the free boundary conditions we calculate this magnetization.
","[{""version"":""v1"",""created"":""Mon, 8 Jul 2002 11:53:22 GMT""}]","2007-05-23"
"cond-mat/0207201","Mark Srednicki","Mark Srednicki","Spectral statistics of the k-body random-interaction model","17 pages, no figures",,"10.1103/PhysRevE.66.046138",,"cond-mat.stat-mech nlin.CD",,"  We reconsider the question of the spectral statistics of the k-body
random-interaction model, investigated recently by Benet, Rupp, and
Weidenmueller, who concluded that the spectral statistics are Poissonian. The
binary-correlation method that these authors used involves formal manipulations
of divergent series. We argue that Borel summation does not suffice to define
these divergent series without further (arbitrary) regularization, and that
this constitutes a significant gap in the demonstration of Poissonian
statistics. Our conclusion is that the spectral statistics of the k-body
random-interaction model remains an open question.
","[{""version"":""v1"",""created"":""Mon, 8 Jul 2002 12:48:53 GMT""}]","2009-11-07"
"cond-mat/0207202","Ayse Erzan","Y. Yilmaz, A. Erzan, O. Pekcan","Slow regions percolate near glass transition","7 pages, 3 figures",,"10.1140/epje/i2002-10069-1",,"cond-mat.soft cond-mat.stat-mech",,"  A nano-second scale in situ probe reveals that a bulk linear polymer
undergoes a sharp phase transition as a function of the degree of conversion,
as it nears the glass transition. The scaling behaviour is in the same
universality class as percolation. The exponents \gamma and \beta are found to
be 1.7 \pm .1 and 0.41\pm 0.01 in agreement with the best percolation results
in three dimensions.
","[{""version"":""v1"",""created"":""Mon, 8 Jul 2002 12:43:18 GMT""}]","2009-11-07"
"cond-mat/0207203","Zbigniew Koza","Zbigniew Koza","General relation between drift velocity and dispersion of a molecular
  motor","3 pages, RevTeX 4","Acta Physica Polonica B 33, 1025 (2002)",,,"cond-mat.stat-mech",,"  We model a processive linear molecular motor as a particle diffusing in a
one-dimensional periodic lattice with arbitrary transition rates between its
sites. We present a relatively simple proof of a theorem which states that the
ratio of the drift velocity V to the diffusion coefficient D has the upper
bound 2N/d, where N is the number of nodes in an elementary cell and d denotes
its length. This relation can be used to estimate the minimal value of internal
states of the motor and the maximal value of the so called Einstein force,
which approximately equals to the maximal force exerted by a molecular motor.
","[{""version"":""v1"",""created"":""Mon, 8 Jul 2002 13:15:05 GMT""}]","2007-05-23"
"cond-mat/0207204","Edward G. Timoshenko","E.G. Timoshenko, Yu.A. Kuznetsov","Improved Gaussian self-consistent method - Applications to homopolymers
  with different architectures in dilute solution","RevTeX 13 pages, 9 PS figures. Accepted for publication in J. Chem.
  Phys",,"10.1063/1.1500357",,"cond-mat.soft cond-mat.stat-mech",,"  A version of the Gaussian self-consistent (GSC) method, which avoids the use
of the Edwards' virial expansion, is presented. Instead, the mean energy is
evaluated directly via a convolution of the attractive part of the pair-wise
non-bonded potential with the Gaussian trial radial distribution function. The
hard sphere repulsion is taken into account via a suitably generalised
Carnahan-Starling term. Comparison of the mean-squared inter-monomer distances
and radius of gyration, as well as of the mean energy, between the results from
the GSC calculations and Monte Carlo (MC) simulation in continuous space are
made across the coil-to-globule transition for isolated ring, open and star
homopolymers of varied lengths and flexibility. Importantly, both techniques
utilise the same polymer model so that the data points could be directly
superimposed. A surprisingly good overall agreement is found between these GSC
and MC results. Caveats of the Gaussian technique and ways for going beyond it
are also discussed.
","[{""version"":""v1"",""created"":""Mon, 8 Jul 2002 13:32:27 GMT""}]","2009-11-07"
"cond-mat/0207205","M. Ghidini","G. Asti, M. Ghidini, R. Pellicelli, M. Solzi (INFM and University of
  Parma)","The activated torsion oscillation magnetometer","Invited Talk at the Moscow International Symposium on Magnetism, 2002
  to appear in the J. Mag. Mag. Mat Revised version",,"10.1016/S0304-8853(02)01061-2",,"cond-mat",,"  The activated torsion oscillation magnetometer exploits the mechanical
resonance of a cantilever beam, driven by the torque exerted on the sample by
an ac field applied perpendicularly to the film plane. We describe a model for
the cantilever dynamics which leads to the calculation of the cantilever
dynamic profile and allows the mechanical sensitivity of the instrument to be
expressed in terms of the minimum electronically detectable displacement. We
have developed a capacitance detector of small oscillations which is able to
detect displacements of the order of 0.1 nm. We show that sensitivities of the
order of 0.5(10-11 Am2 can be in principle achieved. We will subsequently
describe the main features of the ATOM prototype which we have built and
tested, with particular attention to the design solutions which have been
adopted in order to reduce the effects of parasitic vibrations due either to
acoustic noise, originating from the ac field coil, or to eddy currents in the
capacitor electrodes. The instrument is mounted in a continuous flow cryostat
and can work in the 4.2-300 K temperature range. Finally, we will show that our
experimental set-up has a second mode of operation, named Torsion Induction
Magnetometer (TIM).
","[{""version"":""v1"",""created"":""Mon, 8 Jul 2002 14:17:37 GMT""},{""version"":""v2"",""created"":""Tue, 23 Jul 2002 08:10:56 GMT""}]","2009-11-07"
"cond-mat/0207206","Jose Lorenzana","J. Lorenzana and G. Seibold","Metallic mean-field stripes, incommensurability and chemical potential
  in cuprates","submitted to PRL","Phys. Rev. Lett. 89, 136401 (2002)","10.1103/PhysRevLett.89.136401",,"cond-mat.str-el cond-mat.mtrl-sci cond-mat.supr-con",,"  We perform a systematic slave-boson mean-field analysis of the three-band
model for cuprates with first-principle parameters. Contrary to widespread
believe based on earlier mean-field computations low doping stripes have a
linear density close to 1/2 added hole per lattice constant. We find a
dimensional crossover from 1D to 2D at doping $\sim 0.1$ followed by a breaking
of particle-hole symmetry around doping 1/8 as doping increases. Our results
explain in a simple way the behavior of the chemical potential, the magnetic
incommensurability, and transport experiments as a function of doping. Bond
centered and site-centered stripes become degenerate for small overdoping.
","[{""version"":""v1"",""created"":""Mon, 8 Jul 2002 14:49:46 GMT""}]","2009-11-07"
"cond-mat/0207207","Ronald Dickman","Ronald Dickman and Daniel ben-Avraham","Compact directed percolation with movable partial reflectors","12 pages, 4 figures","J. Phys. A35, 7983 (2002)","10.1088/0305-4470/35/38/302",,"cond-mat.stat-mech cond-mat.soft",,"  We study a version of compact directed percolation (CDP) in one dimension in
which occupation of a site for the first time requires that a ""mine"" or
antiparticle be eliminated. This process is analogous to the variant of
directed percolation with a long-time memory, proposed by Grassberger, Chate
and Rousseau [Phys. Rev. E 55, 2488 (1997)] in order to understand spreading at
a critical point involving an infinite number of absorbing configurations. The
problem is equivalent to that of a pair of random walkers in the presence of
movable partial reflectors. The walkers, which are unbiased, start one lattice
spacing apart, and annihilate on their first contact. Each time one of the
walkers tries to visit a new site, it is reflected (with probability r) back to
its previous position, while the reflector is simultaneously pushed one step
away from the walker. Iteration of the discrete-time evolution equation for the
probability distribution yields the survival probability S(t). We find that
S(t) \sim t^{-delta}, with delta varying continuously between 1/2 and 1.160 as
the reflection probability varies between 0 and 1.
","[{""version"":""v1"",""created"":""Mon, 8 Jul 2002 14:51:03 GMT""}]","2009-11-07"
"cond-mat/0207208","Martin van Hecke","Ren\'e Mikkelsen, Martin van Hecke and Tomas Bohr","Universal and non-universal properties of transitions to spatio-temporal
  chaos in coupled map lattices","15 pages, 17 Figs, submitted",,,,"cond-mat.stat-mech cond-mat.dis-nn",,"  We study the transition from laminar to chaotic behavior in deterministic
chaotic coupled map lattices and in an extension of the stochastic
Domany--Kinzel cellular automaton [DK]. For the deterministic coupled map
lattices we find evidence that ``solitons'' can change the {\em nature} of the
transition: for short soliton lifetimes it is of second order, while for longer
but {\em finite} lifetimes, it is more reminiscent of a first order transition.
In the second order regime the deterministic model behaves like Directed
Percolation with infinitely many absorbing states; we present evidence obtained
from the study of bulk properties and the spreading of chaotic seeds in a
laminar background. To study the influence of the solitons more specifically,
we introduce a soliton including variant of the stochastic Domany--Kinzel
cellular automaton. Similar to the deterministic model, we find a transition
from second to first order behavior due to the solitons, both in a mean field
analysis and in a numerical study of the statistical properties of this
stochastic model. Our study illustrates that under the appropriate mapping some
deterministic chaotic systems behave like stochastic models; but it is hard to
know precisely which degrees of freedom need to be included in such
description.
","[{""version"":""v1"",""created"":""Mon, 8 Jul 2002 15:21:10 GMT""}]","2007-05-23"
"cond-mat/0207209","Manoj Gopalakrishnan","G. Manoj and Mustansir Barma","Phase separation driven by a fluctuating two-dimensional self-affine
  potential field","6 pages in RevTeX 2 column, 6 figures, submitted to J. Stat. Phys","J. Stat. Phys. 110(3):1305-1316 (2003)",,,"cond-mat.stat-mech",,"  We study phase separation in a system of hard-core particles driven by a
fluctuating two-dimensional self-affine potential landscape which evolves
through Kardar-Parisi-Zhang (KPZ) dynamics. We find that particles tend to
cluster together on a length scale which grows in time. The final
phase-separated steady state is characterized by an unusual cusp singularity in
the scaled correlation function and a broad distribution for the order
parameter. Unlike the one-dimensional case studied earlier, the cluster-size
distribution is asymmetric between particles and holes, reflecting the broken
reflection symmetery of the KPZ dynamics, and has a contribution from an
infinite cluster in addition to a power law part. A study of the surface in
terms of coarse-grained depth variables helps understand many of these
features.
","[{""version"":""v1"",""created"":""Mon, 8 Jul 2002 15:24:04 GMT""}]","2007-05-23"
"cond-mat/0207210","Alessandro Giuliani","Giuseppe Benfatto, Alessandro Giuliani, Vieri Mastropietro","Low temperature analysis of two dimensional Fermi systems with symmetric
  Fermi surface","60 pages, 3 figures","Ann. Henri Poincare 4, 137-193 (2003)","10.1007/s00023-003-0125-9",,"cond-mat.stat-mech",,"  We prove the convergence of the perturbative expansion, based on
Renormalization Group, of the two point Schwinger function of a system of
weakly interacting fermions in d=2, with symmetric Fermi surface and up to
exponentially small temperatures, close to the expected onset of
superconductivity
","[{""version"":""v1"",""created"":""Mon, 8 Jul 2002 15:25:18 GMT""}]","2015-06-24"
