"hep-th/0207067","Kazumi Okuyama","Kazumi Okuyama","N=4 SYM on R times S^3 and PP-Wave","18 pages, lanlmac; v3: added a comment on Weyl anomaly","JHEP 0211 (2002) 043","10.1088/1126-6708/2002/11/043","EFI-02-92","hep-th",,"  We consider the radial quantization of N=4 super Yang-Mills (SYM) in 4
dimensions, i.e., N=4 SYM on a cylinder R times S^3. We construct the
generators of superconformal symmetry in the case of U(N) gauge group,
generalizing the earlier work by Nicolai et al. for U(1) gauge group. We study
how these generators contract to the symmetry of pp-wave when they act on a
state with large R-charge.
","[{""version"":""v1"",""created"":""Mon, 8 Jul 2002 13:36:15 GMT""},{""version"":""v2"",""created"":""Mon, 22 Jul 2002 12:10:09 GMT""},{""version"":""v3"",""created"":""Thu, 22 Aug 2002 22:08:58 GMT""}]","2009-11-07"
"hep-th/0207068","Kentaro Hori","Kentaro Hori","Mirror Symmetry And Quantum Geometry","12 pages, ICM 2002 at Beijin",,,,"hep-th",,"  Recently, mirror symmetry is derived as T-duality applied to gauge systems
that flow to non-linear sigma models. We present some of its applications to
study quantum geometry involving D-branes. In particular, we show that one can
employ D-branes wrapped on torus fibers to reproduce the mirror duality itself,
realizing the program of Strominger-Yau-Zaslow in a slightly different context.
Floer theory of intersecting Lagrangians plays an essential role.
","[{""version"":""v1"",""created"":""Mon, 8 Jul 2002 14:31:38 GMT""}]","2007-05-23"
"hep-th/0207070","Aninda Sinha","Aninda Sinha (Cambridge University)","The $\hat{G}^{4}\lambda^{16}$ Term in IIB Supergravity","17 pages, 1 figure","JHEP 0208 (2002) 017","10.1088/1126-6708/2002/08/017",,"hep-th",,"  The supersymmetry constraints on the $\hat{G}^{4}\lamda^{16}$ term in the
effective action of type IIB superstring theory are studied in order to
determine the dependence of its coefficient on the complex scalar field,
$\tau$. The resulting expression is consistent with the $SL(2,{\Bbb Z})$
invariant conjectures in the literature.
","[{""version"":""v1"",""created"":""Mon, 8 Jul 2002 15:21:33 GMT""}]","2009-11-07"
"math/0207069","Peter Schauenburg","Peter Schauenburg","Two characterizations of finite quasi-Hopf algebras","11 pages",,,,"math.QA",,"  Let H be a finite-dimensional quasibialgebra. We show that H is a quasi-Hopf
algebra if and only if the category of its finite-dimensional left modules is
rigid if and only if a structure theorem for Hopf modules over H holds. We also
show that a dual structure theorem for Hopf modules over a coquasibialgebra H
holds if and only if the category of finite-dimensional right H-comodules is
rigid; this is not equivalent to H being a coquasi-Hopf algebra.
","[{""version"":""v1"",""created"":""Mon, 8 Jul 2002 07:43:03 GMT""}]","2007-05-23"
"math/0207070","Ostrover Yaron","Yaron Ostrover","A Comparison of Hofer's Metrics on Hamiltonian Diffeomorphisms and
  Lagrangian Submanifolds","Latex, 8 pages",,,,"math.SG",,"  We compare Hofer's geometries on two spaces associated with a closed
symplectic manifold M. The first space is the group of Hamiltonian
diffeomorphisms. The second space L consists of all Lagrangian submanifolds of
$M \times M$ which are exact Lagrangian isotopic to the diagonal. We show that
in the case of a closed symplectic manifold with $\pi_2(M) = 0$, the canonical
embedding of Ham(M) into L, f $\mapsto$ graph(f) is not an isometric embedding,
although it preserves Hofer's length of smooth paths.
","[{""version"":""v1"",""created"":""Mon, 8 Jul 2002 11:34:11 GMT""}]","2007-05-23"
"math/0207071","Brian Forbes","Brian Forbes","A dual polytope from the SYZ construction","5 pages, no figures",,,,"math.AG",,"  For a particular toric variety, I explore to what extent the SYZ conjecture
applied to the orbits of the torus action gives the mirror manifold, in the
sense of Batyrev's mirror construction using reflexive polytopes.
","[{""version"":""v1"",""created"":""Mon, 8 Jul 2002 13:13:29 GMT""}]","2007-05-23"
"math/0207072","Dana P. Williams","Siegfried Echterhoff (Westf\""alische Wilhelms-Universit\""at
  M\""unster), Dana P. Williams (Dartmouth College)","Central twisted transformation groups and group $C^*$-algebras of
  central group extensions","22 pages. To appear in the Indiana U. Math. J",,,,"math.OA",,"  We examine the structure of central twisted transformation group \cs-algebras
$C_{0}(X)\rtimes_{\id,u}G$, and apply our results to the group \cs-algebras of
central group extensions. Our methods require that we study Moore's cohomology
group $H^{2}\bigl(G,C(X,\T)\bigr)$, and, in particular, we prove an inflation
result for pointwise trivial cocyles which may be of use elsewhere.
","[{""version"":""v1"",""created"":""Mon, 8 Jul 2002 13:51:08 GMT""}]","2007-05-23"
"math/0207073","Lionel Richard","Lionel Richard","Homologie et cohomologie de Hochschild de certaines algebres
  polynomiales classiques et quantiques","41 pages, article in french","Journal of Pure and Applied Algebra, Volume 187, Issues 1-3 , 1
  March 2004, Pages 255-294","10.1016/S0022-4049(03)00146-4",,"math.QA",,"  We study Hochschild homology and cohomology for some polynomial algebras
mixing both ``classical'' relations ($XY-YX=1$) and ``quantum'' relations
($XY={\l}YX$). More specifically, we prove that the algebra of differential
operators on any quantum affine space (quantum Weyl algebra) have the same
Hochschild homology, and satisfy the same duality relation, as the classical
Weyl algebra does.
","[{""version"":""v1"",""created"":""Mon, 8 Jul 2002 15:24:23 GMT""}]","2007-05-23"
"nlin/0207014","Yair Zarmi","Alex Veksler and Yair Zarmi","Travelling Wave Solutions of a Simple Non-Local Burgers-Like Equation","9 pages, including 3 figures",,,,"nlin.SI",,"  A Lax pair consisting of the Forsyth-Hopf-Cole transformation and a linear
differential (in time) - difference (in continuous space) equation generates
the whole hierarchy of the Burgers equation and admits exact moving front
solutions. This model mimics finite-distance spatial correlations or nearest
neighbor interactions in a physical situation
","[{""version"":""v1"",""created"":""Mon, 8 Jul 2002 11:03:01 GMT""}]","2007-05-23"
"nucl-ex/0207004","Boris Tatischeff","B. Tatischeff (IPN Orsay)","Low Mass Exotic Baryons: Myth or Reality ?","9 pages, 9 figures, 1 table, revtex, to be published in Proceedings
  of the XVI International Baldin Seminar on High Energy Physics Problems,
  Dubna 10-15 june 2002",,,"IPNO DR 02-017","nucl-ex",,"  Using mainly $\vec{p}$ p $\to$ p ${\pi^+}X$ and $\vec{p}$ p $\to$
p$_{f}$~p$_{s}$ X reactions, narrow baryonic structures were observed in the
mass range 950$\le$ M $\le$ 1800 MeV.
","[{""version"":""v1"",""created"":""Mon, 8 Jul 2002 09:39:55 GMT""}]","2007-05-23"
"physics/0207028","Igor M. Savukov","I. M. Savukov, W. R. Johnson, and H. G. Berry","Mixed configuration-interaction and many-body perturbation theory
  calculations of energies and oscillator strengths of J=1 odd states of neon","5 pages, 1 figure, 4 tables","Phys. Rev. A 66, 052501, 1-5 (2002)","10.1103/PhysRevA.66.052501",,"physics.atom-ph",,"  Ab-initio theory is developed for energies of J=1 particle-hole states of
neutral neon and for oscillator strengths of transitions from such states to
the J=0 ground state. Hole energies of low-Z neonlike ions are evaluated.
","[{""version"":""v1"",""created"":""Mon, 8 Jul 2002 15:29:22 GMT""}]","2009-11-07"
"quant-ph/0207038","Antonio Cesar Aguiar Pinto","A.C. Aguiar Pinto and M.T. Thomaz","Imaginary Phases in Two-Level Model with Spontaneous Decay","11 pages, new version, to appear in J. Phys. A","J.Phys.A36:7461-7467,2003","10.1088/0305-4470/36/26/316",,"quant-ph",,"  We study a two-level model coupled to the electromagnetic vacuum and to an
external classic electric field with fixed frequency. The amplitude of the
external electric field is supposed to vary very slow in time. Garrison and
Wright [{\it Phys. Lett.} {\bf A128} (1988) 177] used the non-hermitian
Hamiltonian approach to study the adiabatic limit of this model and obtained
that the probability of this two-level system to be in its upper level has an
imaginary geometric phase. Using the master equation for describing the time
evolution of the two-level system we obtain that the imaginary phase due to
dissipative effects is time dependent, in opposition to Garrison and Wright
result. The present results show that the non-hermitian hamiltonian method
should not be used to discuss the nature of the imaginary phases in open
systems.
","[{""version"":""v1"",""created"":""Mon, 8 Jul 2002 15:32:29 GMT""},{""version"":""v2"",""created"":""Tue, 13 May 2003 16:23:26 GMT""}]","2008-11-26"
"quant-ph/0207039","Perola Milman","P. Milman, H. Ollivier and J. M. Raimond","Universal Quantum Cloning in Cavity QED",,,"10.1103/PhysRevA.67.012314",,"quant-ph",,"  We propose an implementation of an universal quantum cloning machine [UQCM,
Hillery and Buzek, Phys. Rev. A {\bf 56}, 3446 (1997)] in a Cavity Quantum
Electrodynamics (CQED) experiment. This UQCM acts on the electronic states of
atoms that interact with the electromagnetic field of a high $Q$ cavity. We
discuss here the specific case of the $1 \to 2$ cloning process using either a
one- or a two-cavity configuration.
","[{""version"":""v1"",""created"":""Mon, 8 Jul 2002 12:08:19 GMT""}]","2009-11-07"
"quant-ph/0207040","Giuseppe Vitiello","A.Iorio (Physics Dept. ""E.R.Caianiello"", University of Salerno,
  Italy), G.Lambiase (Physics Dept. ""E.R.Caianiello"", University of Salerno,
  Italy), G.Vitiello (Physics Dept. ""E.R.Caianiello"", University of Salerno,
  Italy)","Hopf algebra, thermodynamics and entanglement in quantum field theory","6 pages, to appear in Proceedings of the First International
  Conference on Quantum Limits to the Second Law, July 29-31, 2002, University
  of San Diego, San Diego, California, USA","AIP Conf.Proc. 643 (2003) 53-58",,,"quant-ph",,"  The quantum deformation of the Hopf algebra describes the skeleton of quantum
field theory, namely its characterizing feature consisting in the existence of
infinitely many unitarily inequivalent representations of the canonical
commutation relations. From this we derive the thermal properties of quantum
field theory, with the entropy playing the role of the generator of the
non-unitary time evolution. The entanglement of the quantum vacuum appears to
be robust against interaction with the environment: on cannot ``unknot the
knots"" in the infinite volume limit.
","[{""version"":""v1"",""created"":""Mon, 8 Jul 2002 12:43:12 GMT""}]","2007-05-23"
