"cond-mat/0207211","C. Fusco","C. Fusco, A. Fasolino, P. Gallo, A. Petri and M. Rovere","A microscopic 2D lattice model of dimer granular compaction with
  friction","10 pages, 15 figures, to be published in Phys. Rev. E","Phys. Rev. E 66, 031301 (2002)","10.1103/PhysRevE.66.031301",,"cond-mat.stat-mech",,"  We study by Monte Carlo simulation the compaction dynamics of hard dimers in
2D under the action of gravity, subjected to vertical and horizontal shaking,
considering also the case in which a friction force acts for horizontal
displacements of the dimers. These forces are modeled by introducing effective
probabilities for all kinds of moves of the particles. We analyze the dynamics
for different values of the time $\tau$ during which the shaking is applied to
the system and for different intensities of the forces. It turns out that the
density evolution in time follows a stretched exponential behavior if $\tau$ is
not very large, while a power law tail develops for larger values of $\tau$.
Moreover, in the absence of friction, a critical value $\tau^*$ exists which
signals the crossover between two different regimes: for $\tau < \tau^*$ the
asymptotic density scales with a power law of $\tau$, while for $\tau > \tau^*$
it reaches logarithmically a maximal saturation value. Such behavior smears out
when a finite friction force is present. In this situation the dynamics is
slower and lower asymptotic densities are attained. In particular, for
significant friction forces, the final density decreases linearly with the
friction coefficient. We also compare the frictionless single tap dynamics to
the sequential tapping dynamics, observing in the latter case an inverse
logarithmic behavior of the density evolution, as found in the experiments.
","[{""version"":""v1"",""created"":""Mon, 8 Jul 2002 15:41:27 GMT""}]","2016-08-31"
"cs/0207023","Tran Cao Son","Tran Cao Son, Chitta Baral, Nam Tran, and Sheila McIlraith","Domain-Dependent Knowledge in Answer Set Planning","70 pages, accepted for publication, TOCL Version with all proofs",,,,"cs.AI",,"  In this paper we consider three different kinds of domain-dependent control
knowledge (temporal, procedural and HTN-based) that are useful in planning. Our
approach is declarative and relies on the language of logic programming with
answer set semantics (AnsProlog*). AnsProlog* is designed to plan without
control knowledge. We show how temporal, procedural and HTN-based control
knowledge can be incorporated into AnsProlog* by the modular addition of a
small number of domain-dependent rules, without the need to modify the planner.
We formally prove the correctness of our planner, both in the absence and
presence of the control knowledge. Finally, we perform some initial
experimentation that demonstrates the potential reduction in planning time that
can be achieved when procedural domain knowledge is used to solve planning
problems with large plan length.
","[{""version"":""v1"",""created"":""Mon, 8 Jul 2002 00:31:54 GMT""},{""version"":""v2"",""created"":""Mon, 29 Aug 2005 20:46:16 GMT""}]","2007-05-23"
"cs/0207024","Paul E. Dunne","Paul E. Dunne","On Concise Encodings of Preferred Extensions","Proc. 9th Worskhop on Non-monotonic reasoning, Toulouse, 2002
  (NMR'02) (7 pages)",,,"Dept. of Comp. Sci., Univ. of Liverpool, Tech. Report ULCS-02-003","cs.AI cs.CC cs.DS",,"  Much work on argument systems has focussed on preferred extensions which
define the maximal collectively defensible subsets. Identification and
enumeration of these subsets is (under the usual assumptions) computationally
demanding. We consider approaches to deciding if a subset S is a preferred
extension which query a representations encoding all such extensions, so that
the computational effort is invested once only (for the initial enumeration)
rather than for each separate query.
","[{""version"":""v1"",""created"":""Mon, 8 Jul 2002 13:24:07 GMT""}]","2007-05-23"
"cs/0207025","Sylvie Doutre","C. Cayrol, S. Doutre, M.-C. Lagasquie-Schiex, J. Mengin","""Minimal defence"": a refinement of the preferred semantics for
  argumentation frameworks","8 pages, 3 figures","Proceedings of the 9th International Workshop on Non-Monotonic
  Reasoning, 2002, pp. 408-415",,,"cs.AI",,"  Dung's abstract framework for argumentation enables a study of the
interactions between arguments based solely on an ``attack'' binary relation on
the set of arguments. Various ways to solve conflicts between contradictory
pieces of information have been proposed in the context of argumentation,
nonmonotonic reasoning or logic programming, and can be captured by appropriate
semantics within Dung's framework. A common feature of these semantics is that
one can always maximize in some sense the set of acceptable arguments. We
propose in this paper to extend Dung's framework in order to allow for the
representation of what we call ``restricted'' arguments: these arguments should
only be used if absolutely necessary, that is, in order to support other
arguments that would otherwise be defeated. We modify Dung's preferred
semantics accordingly: a set of arguments becomes acceptable only if it
contains a minimum of restricted arguments, for a maximum of unrestricted
arguments.
","[{""version"":""v1"",""created"":""Mon, 8 Jul 2002 13:30:16 GMT""}]","2007-05-23"
"cs/0207026","Hsueh-I. Lu","Michael H. Goldwasser, Ming-Yang Kao, Hsueh-I Lu","Linear-Time Algorithms for Computing Maximum-Density Sequence Segments
  with Bioinformatics Applications","23 pages, 13 figures. A significant portion of these results appeared
  under the title, ""Fast Algorithms for Finding Maximum-Density Segments of a
  Sequence with Applications to Bioinformatics,"" in Proceedings of the Second
  Workshop on Algorithms in Bioinformatics (WABI), volume 2452 of Lecture Notes
  in Computer Science (Springer-Verlag, Berlin), R. Guigo and D. Gusfield
  editors, 2002, pp. 157--171","Journal of Computer and System Sciences, 70(2):128-144, 2005","10.1016/j.jcss.2004.08.001",,"cs.DS cs.DM",,"  We study an abstract optimization problem arising from biomolecular sequence
analysis. For a sequence A of pairs (a_i,w_i) for i = 1,..,n and w_i>0, a
segment A(i,j) is a consecutive subsequence of A starting with index i and
ending with index j. The width of A(i,j) is w(i,j) = sum_{i <= k <= j} w_k, and
the density is (sum_{i<= k <= j} a_k)/ w(i,j). The maximum-density segment
problem takes A and two values L and U as input and asks for a segment of A
with the largest possible density among those of width at least L and at most
U. When U is unbounded, we provide a relatively simple, O(n)-time algorithm,
improving upon the O(n \log L)-time algorithm by Lin, Jiang and Chao. When both
L and U are specified, there are no previous nontrivial results. We solve the
problem in O(n) time if w_i=1 for all i, and more generally in
O(n+n\log(U-L+1)) time when w_i>=1 for all i.
","[{""version"":""v1"",""created"":""Mon, 8 Jul 2002 14:45:49 GMT""},{""version"":""v2"",""created"":""Mon, 4 Nov 2002 18:04:54 GMT""}]","2007-05-23"
"gr-qc/0207035","Beverly K. Berger","Beverly K. Berger","Asymptotic Behavior of a Class of Expanding Gowdy Spacetimes","21 pages, 14 figures, uses RevTeX 4, submitted to Phys. Rev. D",,,,"gr-qc",,"  A systematic asymptotic expansion is developed for the gravitational wave
degrees of freedom of a class of expanding, vacuum Gowdy cosmological
spacetimes. In the wave map description of these models, the evolution of the
gravitational wave amplitudes defines an orbit in the target space. The
circumference of this orbit decays to zero indicating that the asymptotic
spacetime is spatially homogeneous. A prescription is given to identify the
asymptotic cosmological model for the gravitational wave degrees of freedom
using the asymptotic point in the target space. The remaining metric function
of the asymptotic cosmological model, found by solving the constraints, is
determined by an effective energy of the gravitational waves rather than from
the asymptotic point in the target space.
","[{""version"":""v1"",""created"":""Sun, 7 Jul 2002 23:35:51 GMT""}]","2007-05-23"
"gr-qc/0207036","Enore Guadagnini","Enore Guadagnini","Gravitational deflection of light and helicity asymmetry","6 pages, 1 figure","Phys.Lett.B548:19-23,2002","10.1016/S0370-2693(02)02811-3","IFUP-TH 2002-26","gr-qc",,"  The helicity modification of light polarization which is induced by the
gravitational deflection from a classical heavy rotating body, like a star or a
planet, is considered. The expression of the helicity asymmetry is derived;
this asymmetry signals the gravitationally induced spin transfer from the
rotating body to the scattered photons.
","[{""version"":""v1"",""created"":""Mon, 8 Jul 2002 11:46:09 GMT""}]","2010-11-19"
"gr-qc/0207037","Luc Blanchet","Luc Blanchet","On the accuracy of the post-Newtonian approximation","20 pages, in ""2001: a relativistic spacetime odyssey"", Proc. of the
  25th Johns Hopkins Workshop, I. Ciufolini, D. Dominici and L. Lusanna (eds.),
  World Scientific, p. 411 (2001)",,"10.1142/9789812791368_0022",,"gr-qc",,"  We apply standard post-Newtonian methods in general relativity to locate the
innermost circular orbit (ICO) of irrotational and corotational binary
black-hole systems. We find that the post-Newtonian series converges well when
the two masses are comparable. We argue that the result for the ICO which is
predicted by the third post-Newtonian (3PN) approximation is likely to be very
close to the ``exact'' solution, within 1% of fractional accuracy or better.
The 3PN result is also in remarkable agreement with a numerical calculation of
the ICO in the case of two corotating black holes moving on exactly circular
orbits. The behaviour of the post-Newtonian series suggests that the
gravitational dynamics of two bodies of comparable masses does not resemble
that of a test particle on a Schwarzschild background. This leads us to
question the validity of some post-Newtonian resummation techniques that are
based on the idea that the field generated by two black holes is a deformation
of the Schwarzschild space-time.
","[{""version"":""v1"",""created"":""Mon, 8 Jul 2002 13:23:52 GMT""},{""version"":""v2"",""created"":""Mon, 15 Jul 2002 15:35:19 GMT""},{""version"":""v3"",""created"":""Tue, 29 Apr 2003 18:33:13 GMT""}]","2017-08-23"
"hep-ex/0207027","Collaboration Secretariat Opal","The OPAL collaboration, G. Abbiendi, et al","Search for Associated Production of Massive States Decaying into Two
  Photonsin e+e- Annihilations at sqrt(s) = 88-209 GeV","17 pages, 4 figures","Phys.Lett.B544:44-56,2002","10.1016/S0370-2693(02)02472-3","CERN-EP-2002-045","hep-ex",,"  A search is performed for production of short-lived particles in e+e- -> XY,
with X -> gamma gamma and Y -> ffbar, for scalar X and scalar or vector Y.
Model-independent limits in the range of 25-60 femtobarns are presented on
sigma (e+e- -> XY) x B(X -> ffbar) for centre-of-mass energies in the range
205-207 GeV. The data from all LEP centre-of-mass energies 88-209 GeV are also
interpreted in the context of fermiophobic Higgs boson models, for which a
lower mass limit of 105.5 GeV is obtained for a ""benchmark"" fermiophobic Higgs
boson.
","[{""version"":""v1"",""created"":""Mon, 8 Jul 2002 08:18:01 GMT""}]","2008-11-26"
"hep-ph/0207102","J. W. van Holten","J.W. van Holten","Cosmological Higgs fields","5 pages, no figures. Version to be published in Phys. Rev. Lett.
  Changes: references and citations added; introduction partly modified;
  expanded discussion of relations between parameters in the Higgs potential","Phys.Rev.Lett. 89 (2002) 201301","10.1103/PhysRevLett.89.201301","NIKHEF/02-010","hep-ph",,"  We present a time-dependent solution to the coupled Einstein-Higgs equations
for general Higgs-type potentials in the context of flat FRW cosmological
models. Possible implications are discussed.
","[{""version"":""v1"",""created"":""Sun, 7 Jul 2002 21:40:42 GMT""},{""version"":""v2"",""created"":""Tue, 24 Sep 2002 09:10:46 GMT""}]","2009-11-07"
"hep-ph/0207103","Vladislav Korotkov","V.A. Korotkov, W.-D. Nowak","Extraction of the Generalized Parton Distribution H(xi,xi,t) from DVCS","6 pages, 5 figures, espcrc1.sty. Contribution to the European
  Workshop on the QCD Structure of the Nucleon (QCD - N'02), Ferrara, Italy,
  3-6 Apr 2002","Nucl.Phys. A711 (2002) 175-180","10.1016/S0375-9474(02)01211-3",,"hep-ph",,"  A simple way to extract the Generalized Parton Distribution H(xi,xi,t) at
small t from the single beam-spin asymmetry in Deeply Virtual Compton
Scattering is proposed. Projections are given for future measurements at the
HERMES experiment upgraded with a recoil detector.
","[{""version"":""v1"",""created"":""Mon, 8 Jul 2002 08:39:54 GMT""}]","2009-11-07"
"hep-ph/0207104","Joerg Eilers","Joerg Eilers Bodo Geyer","Twist cut-off for scalar off-cone operators in q-space","7 pages","Phys.Lett. B546 (2002) 78-85","10.1016/S0370-2693(02)02666-7",,"hep-ph",,"  We show that the twist decomposition of non-local scalar off-cone
QCD-operators, which in $x-$space is infinite, after Fourier transformation
with the singular functions $1/(x^2 - {\text{i}} \epsilon)^\lambda$ for
$\lambda = 1$ and 2 terminates at leading and sub-leading twist, respectively.
Therefore, only a finite number of twists contribute to the target mass
corrections of light-cone dominated scattering processes. Their explicit
expressions may be read off directly from the twist decomposition in $x-$space.
","[{""version"":""v1"",""created"":""Mon, 8 Jul 2002 08:53:18 GMT""}]","2010-04-05"
"hep-ph/0207105","Ali Khorramian","S. Atashbar Tehrani, Ali N. Khorramian","Polarized Parton Distributions in the Valon Model","16 pages, latex, 7 figures",,,,"hep-ph",,"  We calculated the polarized parton distributions in leading order
approximation in QCD from valon model. Polarized structure function of the
nucleon are analyzed in the polarized valon model in which a nucleon is assumed
to be a bound state of three polarized valence quark cluster(valons). It is
shown that the results of the model calculation agree rather well with the SMC
and available experimental data . Our results for $\Gamma_{1}$ of hadron and
deuteron are in good agreement with experimental data for some value of
$Q^{2}$.
","[{""version"":""v1"",""created"":""Mon, 8 Jul 2002 14:50:48 GMT""}]","2007-05-23"
"hep-ph/0207106","Wei Zhengtao","Zheng-Tao Wei, Mao-Zhi Yang","The reliability of pQCD approach in pion electromagnetic form factor","12 pages, 5 figures, the preprint of hep-ph/0207127 is canceled and
  this work is under collaboration of us",,,,"hep-ph",,"  The pion electromagnetic form factor with leading and next-to-leading twist
corrections are studied in the framework of pQCD approach. We find that, at
small momentum transfer regions, Sudakov effects cannot provide a strong enough
suppression of the non-perturbative contributions coming from large transverse
separations, but at large momentum transfer region, non-perturbative
contributions can be effectively suppressed. So pQCD approach can be applied at
large momentum transfer region. At the energy region where experiment can
access so far, i.e. Q < 4GeV, pQCD prediction can not be precise because there
may be a quite large part of contributions coming from non-perturbative region.
The calculation of power corrections may not be performed systematically in
pQCD framework.
","[{""version"":""v1"",""created"":""Mon, 8 Jul 2002 12:09:27 GMT""},{""version"":""v2"",""created"":""Wed, 17 Jul 2002 07:59:43 GMT""}]","2007-05-23"
"hep-ph/0207107","Jean-Rene Cudell","F. Bissey, J. R. Cudell, J. Cugnon, M. Jaminon, J. P. Lansberg and P.
  Stassart","A Model for the Pion Structure Function","14 pages, 6 figures, LaTeX, elsart class","Phys.Lett. B547 (2002) 210-218","10.1016/S0370-2693(02)02775-2",,"hep-ph",,"  The pion structure function is investigated in a simple model, where pion and
constituent quark fields are coupled through the simplest pseudoscalar
coupling. The imaginary part of the forward gamma* pi-> gamma* pi scattering
amplitude is evaluated and related to the structure functions. It is shown that
the introduction of non-perturbative effects, linked to the size of the pion
and preserving gauge invariance, allows a connection with the quark
distribution. It is predicted that higher-twist terms become negligible for Q2
larger than about 2 GeV2 and that quarks in the pion have a momentum fraction
smaller than in the proton case.
","[{""version"":""v1"",""created"":""Mon, 8 Jul 2002 12:32:35 GMT""}]","2009-11-07"
"hep-ph/0207108","Robert Fleischer","Robert Fleischer (DESY Hamburg)","CP Violation in the B System and Relations to $K\to\pi\nu\bar{\nu}$
  Decays","LaTeX, 173 pages, 38 figures, to appear in Physics Reports
  (Habilitation Thesis, Hamburg Univ., July 2001)","Phys.Rept.370:537-680,2002","10.1016/S0370-1573(02)00274-0","DESY-THESIS-2002-022","hep-ph",,"  A review of CP violation in the $B$ system and strategies to determine the
unitarity triangle of the CKM matrix is given. We begin with an introduction to
the description of CP violation in the Standard Model of electroweak
interactions, and discuss the basic features of the theoretical framework to
deal with non-leptonic B decays, which play the main role in this review. After
a brief look at CP violation in the kaon system and a discussion of the rare
decays $K^+\to\pi^+\nu\bar{\nu}$ and $K_L\to\pi^0\nu\bar{\nu}$, we turn to the
formalism of $B^0_{d,s}$--$\bar{B^0_{d,s}}$ mixing, allowing us to explore
important $B$-factory benchmark modes and the $B_s$-meson system. We then focus
on charged B decays, $B\to\pi K$ modes and the phenomenology of $U$-spin
related B decays, including the $B_d\to\pi^+\pi^-$, $B_s\to K^+K^-$ system.
Finally, we discuss a particularly simple -- but very predictive -- scenario
for new physics, which is provided by models with ``minimal flavour
violation''. In this framework, various bounds can be derived and interesting
connections between the $B$ system and the rare kaon decays
$K^+\to\pi^+\nu\bar{\nu}$ and $K_L\to\pi^0\nu\bar{\nu}$ arise.
","[{""version"":""v1"",""created"":""Mon, 8 Jul 2002 13:28:29 GMT""}]","2014-11-17"
"hep-ph/0207109","Sergei Rubin","S.G. Rubin (Centre for CosmoParticle Physics ''Cosmion'', Moscow
  Engineering Physics Institute), H. Kr\""oger, G. Melkonian (D\'epartement de
  Physique, Universit\'e Laval, Qu\'ebec)","Role of quantum fluctuations at high energies","5 pages, 1 figure","Grav.Cosmol.Suppl. 8N1 (2002) 27-31",,,"hep-ph",,"  We investigate an influence of virtual particles on the classical motion of a
system in Minkowski and Euclidean spaces. Our results indicate that
fluctuations of fields different from the main field decelerate significantly
its motion at high energies. The formalism described here is applicable to the
majority of inflationary models. We show also that the quantum fluctuations
suppress false vacuum decay in first-order phase transitions at high energies.
","[{""version"":""v1"",""created"":""Mon, 8 Jul 2002 13:53:22 GMT""}]","2016-08-16"
"hep-th/0207058","Thomas Curtright","Thomas Curtright","Areal Theory","December 2001 ""Coral Gables"" conference contribution; Scientific
  Workplace Latex",,"10.1063/1.1492175",,"hep-th",,"  New features are described for models with multi-particle area-dependent
potentials, in any number of dimensions. The corresponding many-body field
theories are investigated for classical configurations. Some explicit solutions
are given, and some conjectures are made about chaos in such field theories.
","[{""version"":""v1"",""created"":""Sun, 7 Jul 2002 17:48:02 GMT""}]","2009-11-07"
"hep-th/0207060","Konstantinos Anagnostopoulos","E. Kiritsis (1,2,4), G. Kofinas (1), N. Tetradis (3), T.N. Tomaras
  (1,4) and V. Zarikas (4) ((1) U. Crete, (2) ENS, (3) U. Athens, (4) FORTH
  Crete)","Cosmological evolution with brane-bulk energy exchange","20 Pages, JHEP class","JHEP0302:035,2003","10.1088/1126-6708/2003/02/035",,"hep-th gr-qc",,"  The consequences for the brane cosmological evolution of energy exchange
between the brane and the bulk are analysed in detail, in the context of a
non-factorizable background geometry with vanishing effective cosmological
constant on the brane. A rich variety of brane cosmologies is obtained,
depending on the precise mechanism of energy transfer, the equation of state of
brane-matter and the spatial topology. An accelerating era is generically a
feature of our solutions. In the case of low-density flat universe more dark
matter than in the conventional FRW picture is predicted. Spatially compact
solutions are found to delay their recollapse.
","[{""version"":""v1"",""created"":""Sun, 7 Jul 2002 21:09:06 GMT""},{""version"":""v2"",""created"":""Fri, 25 Jul 2003 12:58:05 GMT""}]","2009-11-07"
"hep-th/0207062","Gilson Dallabona","O.A. Battistel (UFSM) and G. Dallabona (UFMG)","From arbitrariness to ambiguities in the evaluation of perturbative
  physical amplitudes and their symmetry relations","16 pages, no figures","Phys.Rev.D65:125017,2002","10.1103/PhysRevD.65.125017",,"hep-th",,"  A very general calculational strategy is applied to the evaluation of the
divergent physical amplitudes which are typical of perturbative calculations.
With this approach in the final results all the intrinsic arbitrariness of the
calculations due to the divergent character is still present. We show that by
using the symmetry properties as a guide to search for the (compulsory) choices
in such a way as to avoid ambiguities, a deep and clear understanding of the
role of regularization methods emerges. Requiring then an universal point of
view for the problem, as allowed by our approach, very interesting conclusions
can be stated about the possible justifications of most intriguing aspect of
the perturbative calculations in quantum field theory: the triangle anomalies.
","[{""version"":""v1"",""created"":""Mon, 8 Jul 2002 05:06:25 GMT""}]","2011-07-19"
"hep-th/0207063","Miyuki Nishikawa","Miyuki Nishikawa","Alternative to Higgs and Unification","23 pages, no figures, PTPTeX v6: formal changes",,,,"hep-th",,"  In this paper, we discuss the self-consistency condition for the spherical
symmetric Klein-Gordon equation, and then discuss a natural possibility that
gravity and weak coupling constants g_G and g_W may be defined after g_{EM}. In
this point of view, gravity and the weak force are subsidiary derived from
electricity. Particularly, SU(2)_L * U(1) unification is derived without
assuming a phase transition.
  A possible origin of the Higgs mechanism is proposed. Each particle pair of
the standard model is associated with the corresponding asymptotic expansion of
an eigen function.
","[{""version"":""v1"",""created"":""Mon, 8 Jul 2002 12:21:55 GMT""},{""version"":""v2"",""created"":""Tue, 9 Jul 2002 01:37:14 GMT""},{""version"":""v3"",""created"":""Wed, 10 Jul 2002 15:40:59 GMT""},{""version"":""v4"",""created"":""Fri, 19 Jul 2002 11:59:57 GMT""},{""version"":""v5"",""created"":""Tue, 1 Oct 2002 09:06:27 GMT""},{""version"":""v6"",""created"":""Fri, 14 Feb 2003 23:55:04 GMT""}]","2016-09-06"
"hep-th/0207064","Miguel Angel Gonzalez Leon","A. Alonso Izquierdo, M.A. Gonzalez Leon, J. Mateos Guilarte and M. de
  la Torre Mayado","Adiabatic motion of two-component BPS kinks","15 pages, 9 figures. Final version to appear in Phys. Rev. D","Phys.Rev. D66 (2002) 105022",,,"hep-th",,"  The low energy dynamics of degenerated BPS domain walls arising in a
generalized Wess-Zumino model is described as geodesic motion in the space of
these topological walls.
","[{""version"":""v1"",""created"":""Mon, 8 Jul 2002 09:50:22 GMT""},{""version"":""v2"",""created"":""Fri, 4 Oct 2002 10:08:38 GMT""}]","2007-05-23"
"hep-th/0207065","Soumitra SenGupta","Soumitra SenGupta, Saurabh Sur","Does curvature-dilaton coupling with Kalb Ramond field lead to an
  accelerating Universe ?","10 pages, latex, 3 figures, version thoroughly revised","JCAP 0312:001,2003","10.1088/1475-7516/2003/12/001",,"hep-th",,"  In this work we show that the Universe evolving in a spacetime with torsion
(originated from a second rank antisymmetric Kalb-Ramond field) and dilaton is
free from any big bang singularity and can have acceleration during the
evolution. Both the matter and radiation dominated era have been considered and
the role of the dilaton to explain the decelerating phase in the earlier epoch
has also been discussed.
","[{""version"":""v1"",""created"":""Mon, 8 Jul 2002 10:21:54 GMT""},{""version"":""v2"",""created"":""Wed, 24 Jul 2002 12:48:47 GMT""},{""version"":""v3"",""created"":""Tue, 2 Dec 2003 11:46:23 GMT""}]","2014-11-18"
"hep-th/0207066","Frank Ferrari","Frank Ferrari (University of Neuchatel and Ecole Normale Superieure)","Spectral asymmetry and supersymmetry","9 pages; v2: typos corrected","Phys.Lett. B548 (2002) 68-72","10.1016/S0370-2693(02)02820-4","NEIP-02-005, LPTENS-02/38","hep-th cond-mat math-ph math.MP",,"  Fractional charges, and in particular the spectral asymmetry eta of certain
Dirac operators, can appear in the central charge of supersymmetric field
theories. This yields unexpected analyticity constraints on eta from which
classic results can be recovered in an elegant way. The method could also be
applied in the context of string theory.
","[{""version"":""v1"",""created"":""Mon, 8 Jul 2002 13:35:56 GMT""},{""version"":""v2"",""created"":""Thu, 17 Oct 2002 10:37:29 GMT""}]","2009-11-07"
