"math/0212375","Serdobolski Andrei","A.V.Serdobolski","Unimprovable Solution to Systems of Empirical Linear Algebraic Equations",,"Elsevier Science, Statistics & Probability Letters, Volume 60 (1),
  p.1-6, 2002",,,"math.PR",,"  An optimum solution free from degeneration is found to the system of linear
algebraic equations with empirical coefficients and right-hand sides. The
quadratic risk of estimators of the unknown solution vector is minimized over a
class of linear systems with given square norm of the coefficient matrix and
length of the right-hand side vector. Empirical coefficients and right-hand
sides are assumed to be independent and normal with known variance. It is found
that the optimal estimator has the form of a regularized minimum square
solution with an extension multiple. A simple formula is derived showing
explicitly the dependence of the minimal risk on parameters.
","[{""version"":""v1"",""created"":""Mon, 30 Dec 2002 15:29:21 GMT""}]","2007-05-23"
"math/0212376","YanYan Li","Aobing Li and YanYan Li","A Liouville type theorem for some conformally invariant fully nonlinear
  equations",,,,,"math.AP",,"  We establish a Liouville type theorem for some conformally invariant fully
nonlinear equations
","[{""version"":""v1"",""created"":""Mon, 30 Dec 2002 15:57:35 GMT""}]","2007-05-23"
"nlin/0212052","Igor Barashenkov","I.V. Barashenkov, S.R. Woodford, E.V. Zemlyanaya","Parametrically Driven Dark Solitons","4 pages; 2 figures; to appear in PRL",,"10.1103/PhysRevLett.90.054103","Preprint of JINR-Dubna No. E17-2002-158; published July 2002","nlin.PS cond-mat.stat-mech cond-mat.str-el nlin.SI physics.flu-dyn physics.optics",,"  We show that unlike the bright solitons, the parametrically driven kinks are
immune from instabilities for all dampings and forcing amplitudes; they can
also form stable bound states. In the undamped case, the two types of stable
kinks and their complexes can travel with nonzero velocities.
","[{""version"":""v1"",""created"":""Mon, 30 Dec 2002 10:41:02 GMT""}]","2016-09-08"
"nucl-th/0212106","Wen-Tai Chiang","Wen-Tai Chiang, Shin Nan Yang, L. Tiator, M. Vanderhaeghen, D.
  Drechsel","A reggeized model for eta and eta-prime photoproduction","24 pages, 15 figures, modified version to appear in Phys. Rev. C","Phys.Rev. C68 (2003) 045202","10.1103/PhysRevC.68.045202",,"nucl-th hep-ph",,"  A reggeized model for \eta and \eta' photoproduction on the nucleon is
presented. In this model, t-channel vector meson exchanges are described in
terms of Regge trajectories to comply with the correct high energy behavior. We
compare this reggeized model with an isobar model (\eta-MAID), where the
t-channel exchanges are described by \rho and \omega poles. Both models contain
the same resonance contributions, and describe current \gamma p \to \eta p data
up to E_\gamma^{lab} = 2 GeV quite well, but only the reggeized model can be
successfully extended to higher energies. For the \gamma p \to \eta' p
reaction, the reggeized model is found to be able to give a satisfactory
description. For the differential cross section data from SAPHIR, we find that
the observed linear forward rise in cos(theta) near E_\gamma^{lab} = 1.6 GeV
can be well described by the interference of an S11 resonance and the Regge
trajectory exchanges without any need for an additional P-wave resonance.
","[{""version"":""v1"",""created"":""Mon, 30 Dec 2002 10:35:08 GMT""},{""version"":""v2"",""created"":""Fri, 29 Aug 2003 12:56:57 GMT""}]","2016-09-08"
"nucl-th/0212107","Thomas Falter","T. Falter, K. Gallmeister, U. Mosel","Incoherent rho^0 electroproduction off nuclei","17 pages, 4 figures, submitted to Phys. Rev. C. Comparison with
  latest HERMES data; line style in Fig. 1 and some references corrected","Phys.Rev.C67:054606,2003; Erratum-ibid.C68:019903,2003","10.1103/PhysRevC.67.054606 10.1103/PhysRevC.68.019903",,"nucl-th hep-ph",,"  In the present paper we investigate incoherent rho^0 electroproduction off
complex nuclei. We derive a novel, simple expression for the incoherent
electroproduction cross section in which one can clearly separate the final
state interactions of the reaction products from the 'initial state
interactions' of the photon that give rise to nuclear shadowing. In the special
case of purely absorptive final state interactions we deduce from our
expression the known Glauber result. A more realistic treatment of the final
state interactions within a transport model is then used to compare our
predictions with experimental data from the HERMES experiment.
","[{""version"":""v1"",""created"":""Mon, 30 Dec 2002 13:01:31 GMT""},{""version"":""v2"",""created"":""Tue, 11 Mar 2003 18:41:05 GMT""}]","2014-11-18"
"physics/0212107","Eugene Savov","Eugene Savov","The Interplanetary Magnetic Field and Solar Wind Driven Magnetospheric
  Reconfiguration","9 pages, 4 figures",,,,"physics.space-ph physics.gen-ph",,"  The magnetic disturbances are associated with electric currents as it is well
checked at laboratory room scales and described by the Maxwell's equations of
electromagnetic field. The analysis of spacecraft observations for more than a
quarter of a century failed to provide a self-consistent three-dimensional
picture of the solar wind-magnetosphere dynamo generated magnetospheric and
ionospheric current systems. The proposed solar wind and the interplanetary
magnetic field (IMF) driven reconfiguration of the earth's magnetosphere
directly accounts for the observed magnetic disturbances. So role of the
magnetospheric currents in creation of the magnetic disturbances is
reconsidered in accordance with some poorly understood observations. A
quantitative agreement with observations is demonstrated and a laboratory
experiment to test the suggested model of the solar wind/IMF-magnetosphere
interaction is described.
","[{""version"":""v1"",""created"":""Mon, 30 Dec 2002 13:22:54 GMT""},{""version"":""v2"",""created"":""Thu, 2 Jan 2003 10:28:52 GMT""}]","2007-05-23"
"quant-ph/0212151","Sven Aerts","S. Aerts","The Born rule from a consistency requirement on hidden measurements in
  complex Hilbert space","10 pages, no figures, accepted for publication in Int. J. Theor. Phys",,,,"quant-ph",,"  We formalize the hidden measurement approach within the very general notion
of an interactive probability model. We narrow down the model by assuming the
state space of a physical entity is a complex Hilbert space and introduce the
principle of consistent interaction which effectively partitions the space of
apparatus states. The normalized measure of the set of apparatus states that
interact with a pure state giving rise to a fixed outcome is shown to be in
accordance with the probability obtained using the Born rule.
","[{""version"":""v1"",""created"":""Sun, 29 Dec 2002 21:14:45 GMT""}]","2007-05-23"
"quant-ph/0212152","Cen LiXiang","Li-Xiang Cen, Xin-Qi Li, YiJing Yan","Characterization of entanglement transformation via group representation
  theory","5 pages, no figures","J. Phys. A 36, 12267 (2003)","10.1088/0305-4470/36/49/009",,"quant-ph",,"  Entanglement transformation of composite quantum systems is investigated in
the context of group representation theory. Representation of the direct
product group $SL(2,C)\otimes SL(2,C)$, composed of local operators acting on
the binary composite system, is realized in the four-dimensional complex space
in terms of a set of novel bases that are pseudo orthonormalized. The
two-to-one homomorphism is then established for the group $SL(2,C)\otimes
SL(2,C)$ onto the $SO(4,C)$. It is shown that the resulting representation
theory leads to the complete characterization for the entanglement
transformation of the binary composite system.
","[{""version"":""v1"",""created"":""Mon, 30 Dec 2002 02:30:53 GMT""}]","2009-11-07"
"quant-ph/0212153","Robin Blume-Kohout","Robin Blume-Kohout and Wojciech H. Zurek","Decoherence from a Chaotic Environment: An Upside Down ""Oscillator"" as a
  Model","RevTeX, 29 pages, 5 EPS figures. Substantially rewritten analysis,
  improved figures, additional references, and errors fixed. Final version (to
  appear in PRA)","Phys. Rev. A 68, 032104 (2003)","10.1103/PhysRevA.68.032104","LA-UR-02-7243","quant-ph",,"  Chaotic evolutions exhibit exponential sensitivity to initial conditions.
This suggests that even very small perturbations resulting from weak coupling
of a quantum chaotic environment to the position of a system whose state is a
non-local superposition will lead to rapid decoherence. However, it is also
known that quantum counterparts of classically chaotic systems lose exponential
sensitivity to initial conditions, so this expectation of enhanced decoherence
is by no means obvious. We analyze decoherence due to a ""toy"" quantum
environment that is analytically solvable, yet displays the crucial phenomenon
of exponential sensitivity to perturbations. We show that such an environment,
with a single degree of freedom, can be far more effective at destroying
quantum coherence than a heat bath with infinitely many degrees of freedom.
This also means that the standard ""quantum Brownian motion"" model for a
decohering environment may not be as universally applicable as it once was
conjectured to be.
","[{""version"":""v1"",""created"":""Mon, 30 Dec 2002 05:58:29 GMT""},{""version"":""v2"",""created"":""Wed, 11 Jun 2003 02:59:54 GMT""}]","2009-11-07"
"quant-ph/0212154","Christian Raabe","Christian Raabe, Ludwig Kn\""oll and Dirk-Gunnar Welsch","Three-dimensional Casimir force between absorbing multilayer dielectrics","19 pages, 17 figures -- published in Phys. Rev. A",,"10.1103/PhysRevA.68.033810",,"quant-ph",,"  Recently the influence of dielectric and geometrical properties on the
Casimir force between dispersing and absorbing multilayered plates in the
zero-temperature limit has been studied within a 1D quantization scheme for the
electromagnetic field in the presence of causal media [R. Esquivel-Sirvent, C.
Villarreal, and G.H. Cocoletzi, Phys. Rev. Lett. 64, 052108 (2001)]. In the
present paper a rigorous 3D analysis is given, which shows that for complex
heterostructures the 1D theory only roughly reflects the dependence of the
Casimir force on the plate separation in general. Further, an extension of the
very recently derived formula for the Casimir force at zero temperature [M.S.
Toma\v{s}, Phys. Rev. A 66, 052103 (2002)] to finite temperatures is given, and
analytical expressions for specific distance laws in the zero-temperature limit
are derived. In particular, it is shown that the Casimir force between two
single-slab plates behaves asymptotically like $d^{-6}$ in place of $d^{-4}$
($d$, plate separation).
","[{""version"":""v1"",""created"":""Mon, 30 Dec 2002 12:51:05 GMT""},{""version"":""v2"",""created"":""Mon, 19 Apr 2004 13:57:50 GMT""}]","2016-08-16"
"quant-ph/0212155","Shmuel Gurvitz","S.A. Gurvitz","Quantum description of classical apparatus: Zeno effect and decoherence","Extra explanations added. Presented at the Feynman Festival, 23-28
  August, 2002. To appear in Quantum Information Processing","Quantum Information Processing 2, 15 (2003).",,,"quant-ph cond-mat",,"  We study the measurement process by treating classical detectors entirely
quantum mechanically. As a generic model we use a point-contact detector
coupled to an electron in a quantum dot and tunneling into the continuum.
Transition to the classical description and the mechanism of decoherence are
investigated. We concentrate on the influence of the measurement on the
electron decay rate to the continuum. We demonstrate that the Zeno (or the
anti-Zeno) effect requires a nonuniform density of states in the continuum. In
this case we show that the anti-Zeno effect relates only to the average decay
rate, whereas for sufficiently small time the Zeno effect always takes place.
We discuss the experimental consequences of our results and the role of the
projection postulate in a measurement process.
","[{""version"":""v1"",""created"":""Mon, 30 Dec 2002 14:53:23 GMT""},{""version"":""v2"",""created"":""Sun, 11 May 2003 09:34:58 GMT""}]","2007-05-23"
