"astro-ph/0212562","Roberto De Propris","Roberto De Propris, M. Colless, S. Driver, W. Couch, J. Peacock, I.
  Baldry, C. Baugh, C. Collins, J. Bland-Hawthorn, T. Bridges, R. Cannon, S.
  Cole, N. Cross, G. B. Dalton, G. Efstathiou, R. S. Ellis, C. S. Frenk, K.
  Glazebrook, E. Hawkins, C. Jackson, O. Lahav, I. Lewis, S. Lumsden, S.
  Maddox, D. S. Madgwick, P. Norberg, W. Percival, B. Peterson, W. Sutherland,
  K. Taylor","The 2dF Galaxy Redshift Survey: the luminosity function of cluster
  galaxies","14 pages, 8 figures, MNRAS resubmitted after referee report","Mon.Not.Roy.Astron.Soc.342:725,2003","10.1046/j.1365-8711.2003.06510.x",,"astro-ph",,"  We have determined the composite luminosity function (LF) for galaxies in 60
clusters from the 2dF Galaxy Redshift Survey. The LF spans the range
$-22.5<M_{b_{\rm J}}<-15$, and is well-fitted by a Schechter function with
${M_{b_{\rm J}}}^{*}=-20.07\pm0.07$ and $\alpha=-1.28\pm0.03$ ($H_0$=100 km
s$^{-1}$ Mpc$^{-1}$, $\Omega_M$=0.3, $\Omega_\Lambda$=0.7). It differs
significantly from the field LF of \cite{mad02}, having a characteristic
magnitude that is approximately 0.3 mag brighter and a faint-end slope that is
approximately 0.1 steeper. There is no evidence for variations in the LF across
a wide range of cluster properties. However the LF of early-type galaxies in
clusters is both brighter and steeper than its field counterpart. The
differences between the field and cluster LFs for the various spectral types
can be qualitatively explained by the suppression of star formation in the
dense cluster environment, together with mergers to produce the brightest
early-type galaxies.
","[{""version"":""v1"",""created"":""Mon, 30 Dec 2002 01:24:33 GMT""}]","2011-03-10"
"astro-ph/0212563","Masahiro Nagashima","Masahiro Nagashima (NAO), Yuzuru Yoshii (U. Tokyo)","Dynamical response to supernova-induced gas removal in two-component
  spherical galaxies","13 pages, 4 figures, to appear in MNRAS","Mon.Not.Roy.Astron.Soc. 340 (2003) 509","10.1046/j.1365-8711.2003.06314.x","NAOJ-Th-Ap 2002, No. 42","astro-ph",,"  We investigate dynamical response on size and velocity dispersion to mass
loss by supernovae in formation of two-component spherical galaxies composed of
baryon and dark matter. Three-dimensional deprojected de Vaucouleurs-like and
exponential-like profiles for baryon, embedded in truncated singular isothermal
and homogeneous profiles for dark matter, are considered. As a more realistic
case, we also consider a dark matter profile proposed by Navarro, Frenk &
  White. For simplicity we assume that dark matter distribution is not affected
by mass loss and that the change of baryonic matter distribution is homologous.
We found that the degree of the response depends on the fraction of dark matter
in the region where baryon is distributed, so that dwarf spheroidal galaxies
would be affected even in a dark halo if they are formed by galaxy mergers in
the envelope of the dark halo. Our results suggest that this scenario, combined
with dynamical response, would make not only the observed trends but the
dispersed characteristics of dwarf spheroidals.
","[{""version"":""v1"",""created"":""Mon, 30 Dec 2002 02:36:27 GMT""}]","2016-08-30"
"astro-ph/0212564","Blinnikov S.","S.I.Blinnikov (1), D.K.Nadyozhin (1), S.E.Woosley (2) and E.I.Sorokina
  (3) ((1) ITEP, Moscow; (2) UCO/Lick, Santa Cruz; (3) SAI, Moscow)","Shock breakouts in SNe Ib/c","4 pages 4 figures. 11th Workshop on ""Nuclear Astrophysics"", Ringberg
  Castle, Tegernsee, Germany, February 11-16, 2002. Minor corrections","""Nuclear Astrophysics"", W.Hillebrandt and Ewald Mueller (Eds.),
  MPA 2002, p. 144 - 147",,"MPA/P13","astro-ph",,"  Numerical modeling of shock breakout in compact presupernovae of type Ib/c is
done by two independent methods. Peak color temperatures reach 4 to 8 million K
for explosion energies 1 to 9 foe with a typical local time-scale of 0.03
seconds. In the obverver's frame the burst is smeared over few seconds due to
light travel time correction R/c.
","[{""version"":""v1"",""created"":""Mon, 30 Dec 2002 09:21:22 GMT""}]","2007-05-23"
"astro-ph/0212565","Ibrahim Arbab Arbab","Arbab I. Arbab","Cosmological consequences of a built-in cosmological constant model","9 LaTex pages, 5 figures","JCAP 0305 (2003) 008","10.1088/1475-7516/2003/05/008",,"astro-ph",,"  We have analyzed the implications of a phenomenological model of a built-in
cosmological constant of Rastall and Al-Rawaf -Taha type. We have produced the
presently observed cosmic acceleration with the aid of introducing a positive
cosmological constant. We have shown that the cosmological models of the type
$\Lambda\propto\frac{\ddot R}{R}, \Lambda\propto H^2$ or $\Lambda\propto 8\pi
G\rho$ are equivalent to a built-in cosmological constant model of Al-Rawaf and
Taha type. Such models are compatible with the recent observational data and do
not suffer from fine tuning problems. We predict a higher lensing probability
than in Einstein de Sitter and Abdel Rahman models. We also predict a higher
value for the luminosity and angular diameter distances than that of Abdel
Rahman model. The lens distribution peaks at relatively smaller values of the
lens red-shift and occurs at higher red-shift.
","[{""version"":""v1"",""created"":""Mon, 30 Dec 2002 11:16:27 GMT""}]","2009-11-07"
"astro-ph/0212566","Alessandro Melchiorri","Alessandro Melchiorri, Carolina Odman","Dark Energy: Is it Q or Lambda ?","4 pages, 2 figures, to appear in proceedings of the XVIIIth IAP
  Colloquium `On the Nature of Dark Energy', IAP, Paris",,,,"astro-ph",,"  New observations of Cosmic Microwave Background Anisotropies, Supernovae
luminosity distances and Galaxy Clustering are sharpening our knowledge about
dark energy. Here we present the latest constraints.
","[{""version"":""v1"",""created"":""Mon, 30 Dec 2002 12:27:05 GMT""}]","2007-05-23"
"astro-ph/0212567","Blinnikov S.","S. Blinnikov (1,2), E. Sorokina (2) ((1) ITEP, Moscow, (2) SAI,
  Moscow)","Lightcurves of thermonuclear supernovae as a probe of the explosion
  mechanism and their use in cosmology","9 pages, 2 figures; presented at the 3rd Sakharov Conference (Moscow,
  June 2002) and at the 4th Workshop ""New Worlds in Astroparticle Physic""
  (Faro, Portugal, September 2002)",,,,"astro-ph",,"  Thermonuclear supernovae are valuable for cosmology but their physics is not
yet fully understood. Modeling the development and propagation of nuclear flame
is complicated by numerous instabilities. The predictions of supernova light
curves still involve some simplifying assumptions, but one can use the
comparison of the computed fluxes with observations to constrain the explosion
mechanism. In spite of great progress in recent years, a number of issues
remains unsolved both in flame physics and light curve modeling.
","[{""version"":""v1"",""created"":""Mon, 30 Dec 2002 13:40:01 GMT""}]","2007-05-23"
"astro-ph/0212568","Postnov K. A.","K.A. Postnov (Sternberg Astronomical Institute, Moscow)","On the universal X-ray luminosity function of binary X-ray sources in
  galaxies","4 pages, plain LaTeX, no figures. Submitted to Astronomy Letters","Astron.Lett. 29 (2003) 372-373","10.1134/1.1579783",,"astro-ph",,"  The empirically determined universal power-law shape of X-ray luminosity
function of high mass X-ray binaries in galaxies is explained by fundamental
mass-luminosity and mass-radius relations for massive stars.
","[{""version"":""v1"",""created"":""Mon, 30 Dec 2002 13:55:35 GMT""}]","2009-11-07"
"astro-ph/0212569","Blinnikov S.","S.Blinnikov (1,6), N.Chugai (2), P.Lundqvist (3), D.Nadyozhin (1,6),
  S.Woosley (4), and E.Sorokina (5,6) ((1) ITEP; (2) INASAN; (3) Stockholm
  Observatory; (4) UCO/Lick; (5) SAI; (6) MPA)","Observable Effects of Shocks in Compact and Extended Presupernovae","4 pages, 2 figures, presented at ESO/MPA/MPE Workshop ``From Twilight
  to Highlight: The Physics of Supernovae'', Garching, July 2002. Proc.
  W.Hillebrandt and B.Leibundgut (Eds.), Springer Series ``ESO Astrophysics
  Symposia'', Berlin; minor corrections",,"10.1007/10828549_4",,"astro-ph",,"  We simulate shock propagation in a wide range of core-collapsing
presupernovae: from compact WR stars exploding as SNe Ib/c through very
extended envelopes of the narrow-line SNe IIn. We find that the same physical
phenomenon of radiating shocks can produce outbursts of X-ray radiation (with
photon energy $3kT \sim 1$ keV) lasting only a second in SNe Ib/c, as well as a
very high flux of visual light, lasting for months, in SNe IIn.
","[{""version"":""v1"",""created"":""Mon, 30 Dec 2002 14:20:37 GMT""},{""version"":""v2"",""created"":""Sun, 5 Jan 2003 12:45:00 GMT""}]","2009-11-07"
"astro-ph/0212570","Hujeirat","A. Hujeirat, M. Camenzind, M. Livio","Ion-dominated plasma and the origin of jets in quasars","5 pages, 4 figures","Astron.Astrophys. 394 (2002) L9-13","10.1051/0004-6361:20021282","MPIA-021230","astro-ph",,"  Low cooling plasmas associated with large kinetic energies are likely to be
the origin of the kpc-extended and well collimated extra-galactic jets. It is
proposed that jets are launched from a layer, governed by a highly diffusive,
super-Keplerian rotating and thermally dominated by virial-hot and magnetized
ion-plasma. The launching layer is located between the accretion disk and the
corona surrounding the nucleus. The matter in the layer is causally connected
to both the disk and to the central engine. Moreover we find that coronae, in
the absence of heating from below, are dynamically unstable to thermal
ion-conduction, and that accretion disks become intrinsically
advection-dominated. We confirm the capability of this multi-layer model to
form jets by carrying out 3D axisymmetric quasi-stationary MHD calculations
with high spatial resolution, and taking into account turbulent and magnetic
diffusion. The new multi-layer topology accommodates several previously
proposed elements for jet-initiation, in particular the ion-torus, the
magneto-centrifugal and the truncated disk - advective tori models.
","[{""version"":""v1"",""created"":""Mon, 30 Dec 2002 15:07:29 GMT""}]","2009-11-07"
"astro-ph/0212571","Estelle Moraux","E. Moraux (1), J. Bouvier (1), J.R. Stauffer (2) and J-C. Cuillandre
  (3) ((1) LAOG, Grenoble, France, (2) CalTech, Pasadena, (3) CFHT, Hawaii)","Brown dwarfs in the Pleiades cluster : clues to the substellar mass
  function","13 pages, 9 pages, accepted in A&A","Astron.Astrophys. 400 (2003) 891-902","10.1051/0004-6361:20021903",,"astro-ph",,"  We present the results of a 6.4 square degrees imaging survey of the Pleiades
cluster in the I and Z-bands. The survey extends up to 3 degrees from the
cluster center and is 90% complete down to I~22. It covers a mass range from
0.03 Msun to 0.48 Msun and yields 40 brown dwarf candidates (BDCs) of which 29
are new. The spatial distribution of BDCs is fitted by a King profile in order
to estimate the cluster substellar core radius. The Pleiades mass function is
then derived accross the stellar-substellar boundary and we find that, between
0.03 Msun and 0.48 Msun, it is well represented by a single power-law, dN/dM
\propto M^{-alpha}, with an index alpha=0.60 +/- 0.11. Over a larger mass
domain, however, from 0.03 Msun to 10 Msun, the mass function is better fitted
by a log-normal function. We estimate that brown dwarfs represent about 25% of
the cluster population which nevertheless makes up less than 1.5% of the
cluster mass. The early dynamical evolution of the cluster appears to have had
little effect on its present mass distribution at an age of 120 Myr. Comparison
between the Pleiades mass function and the Galactic field mass function
suggests that apparent differences may be mostly due to unresolved binary
systems.
","[{""version"":""v1"",""created"":""Mon, 30 Dec 2002 15:47:09 GMT""}]","2009-11-07"
"cond-mat/0212619","Daniele Passerone","Daniele Passerone, Matteo Ceccarelli and Michele Parrinello","A Concerted Variational Strategy for Investigating Rare Events","3 figures, accepted for publication in Journal of Chemical Physics",,"10.1063/1.1533783",,"cond-mat.mtrl-sci",,"  A strategy for finding transition paths connecting two stable basins is
presented. The starting point is the Hamilton principle of stationary action;
we show how it can be transformed into a minimum principle through the addition
of suitable constraints like energy conservation. Methods for improving the
quality of the paths are presented: for example, the Maupertuis principle can
be used for determining the transition time of the trajectory and for coming
closer to the desired dynamic path. A saddle point algorithm (conjugate
residual method) is shown to be efficient for reaching a ``true'' solution of
the original variational problem.
","[{""version"":""v1"",""created"":""Mon, 30 Dec 2002 10:29:23 GMT""}]","2009-11-07"
"cond-mat/0212627","Aviad Frydman","A. Cohen, A. Frydman and R. Berkovits","Magneto-transport properties of dilute granular ferromagnets","5 pages, 4 figures","Solid State Commun., 129/5, 291 (2004)","10.1016/j.ssc.2003.10.028",,"cond-mat.mes-hall",,"  We present magnetoresistance (MR) measurements performed on quench condensed
granular Ni thin films which are on the verge of electric continuity. In these
systems the electric conductivity is believed to be governed by the resistance
between a very small number of grains. The films exihibit sharp resistance
jumps as a function of magnetic field. We interpret these findings as being the
result of magneto-mechanical distortions that occour in single grains which act
as bottlenecks in the dilute percolation network. The observed features provide
a unique measure of magnetostriction effects in nano-grain structures as well
as being able to shed light on some of the properties of regular granular
magnetic films.
","[{""version"":""v1"",""created"":""Mon, 30 Dec 2002 06:39:59 GMT""}]","2015-06-24"
"cond-mat/0212628","Maxim Khodas","M. Khodas and A. M. Finkel'stein","Hall Coefficient in an Interacting Electron Gas","23 pages, 15 figures","Phys. Rev. B 68, 155114 (2003)","10.1103/PhysRevB.68.155114",,"cond-mat.str-el",,"  The Hall conductivity in a weak homogeneous magnetic field, $\omega_{c}\tau
\ll 1$, is calculated. We have shown that to leading order in
$1/\epsilon_{F}\tau$ the Hall coefficient $R_{H}$ is not renormalized by the
electron-electron interaction. Our result explains the experimentally observed
stability of the Hall coefficient in a dilute electron gas not too close to the
metal-insulator transition. We avoid the currently used procedure that
introduces an artificial spatial modulation of the magnetic field. The problem
of the Hall effect is reformulated in a way such that the magnetic flux
associated with the scattering process becomes the central element of the
calculation.
","[{""version"":""v1"",""created"":""Mon, 30 Dec 2002 00:42:32 GMT""},{""version"":""v2"",""created"":""Sun, 18 Jan 2004 19:44:34 GMT""}]","2007-05-23"
"cond-mat/0212629","Denis Khomitskiy","V.Ya. Demikhovskii and D.V. Khomitskiy","Quantum Hall effect in a p-type heterojunction with a lateral surface
  quantum dot superlattice","12 pages, 5 figures; reported at the 15th Int. Conf. on High Magnetic
  Fields in Semicond. Phys. (Oxford, UK, 2002)",,"10.1103/PhysRevB.68.165301",,"cond-mat.mes-hall",,"  The quantization of Hall conductance in a p-type heterojunction with lateral
surface quantum dot superlattice is investigated. The topological properties of
the four-component hole wavefunction are studied both in r- and k-spaces. New
method of calculation of the Hall conductance in a 2D hole gas described by the
Luttinger Hamiltonian and affected by lateral periodic potential is proposed,
based on the investigation of four-component wavefunction singularities in
k-space. The deviations from the quantization rules for Hofstadter ""butterfly""
for electrons are found, and the explanation of this effect is proposed. For
the case of strong periodic potential the mixing of magnetic subbands is taken
into account, and the exchange of the Chern numbers between magnetic subands is
discussed.
","[{""version"":""v1"",""created"":""Mon, 30 Dec 2002 09:12:02 GMT""}]","2009-11-07"
"cond-mat/0212631","Ingo Peschel","Ingo Peschel","Calculation of reduced density matrices from correlation functions","4 pages","J.Phys.A: Math.Gen. 36, L205 (2003)","10.1088/0305-4470/36/14/101",,"cond-mat",,"  It is shown that for solvable fermionic and bosonic lattice systems, the
reduced density matrices can be determined from the properties of the
correlation functions. This provides the simplest way to these quantities which
are used in the density-matrix renormalization group method.
","[{""version"":""v1"",""created"":""Mon, 30 Dec 2002 11:28:23 GMT""}]","2009-11-07"
"cond-mat/0212632","Sinder Misha","M. Sinder and J. Pelleg (Ben-Gurion University of the Negev, Beer
  Sheva, Israel)","Preparation of the Silver Boride: Preliminary Results","PDF, 10 pages, 4 figures",,,,"cond-mat.supr-con cond-mat.mtrl-sci",,"  Bulk and thin film specimens of AgB2 were prepared. The bulk pellets were
obtained from the powders of the constituents and the films were produced by
cosputtering and sequential sputtering. The specimens were annealed and
subjected for X-ray and Auger analysis. Preliminary results seems to indicate
that AgB2 is an instable phase.
","[{""version"":""v1"",""created"":""Mon, 30 Dec 2002 13:38:00 GMT""}]","2007-05-23"
"cond-mat/0212633","S. V. Zaitsev-Zotov","S.V. Zaitsev-Zotov, Yu.A. Kumzerov, Yu.A. Firsov, and P. Monceau","Unconventional magnetoresistance in long InSb nanowires","To be published in JETP Letters, vol. 77 (2003)",,"10.1134/1.1567775",,"cond-mat.str-el cond-mat.mes-hall",,"  Magnetoresistance in long correlated nanowires of degenerate semiconductor
InSb in asbestos matrix (wire diameter of around 5 nm, length 0.1 - 1 mm) is
studied over temperature range 2.3 - 300 K. At zero magnetic field the electric
conduction $G$ and the current-voltage characteristics of such wires obey the
power laws $G\propto T^\alpha$, $I\propto V^\beta$, expected for
one-dimensional electron systems. The effect of magnetic field corresponds to a
20% growth of the exponents $\alpha$, $\beta$ at H=10 T. The observed
magnetoresistance is caused by the magnetic-field-induced breaking of the
spin-charge separation and represents a novel mechanism of magnetoresistance.
","[{""version"":""v1"",""created"":""Mon, 30 Dec 2002 15:48:36 GMT""}]","2009-11-07"
"gr-qc/0212119","Saibal Ray","Saibal Ray and Sumana Bhadra","Energy density in general relativity: a possible role for cosmological
  constant","12 Latex pages","Phys.Lett. A322 (2004) 150-155","10.1016/j.physleta.2004.01.029",,"gr-qc",,"  We consider a static spherically symmetric charged anisotropic fluid source
of finite physical radius (\sim 10^{-16} cm) by introducing a scalar variable
\Lambda dependent on the radial coordinate r under general relativity. From the
solution sets a possible role of the cosmological constant is investigated
which indicates the dependency of energy density of electron on the variable
\Lambda.
","[{""version"":""v1"",""created"":""Sun, 29 Dec 2002 16:53:49 GMT""},{""version"":""v2"",""created"":""Thu, 19 Jun 2003 15:05:10 GMT""},{""version"":""v3"",""created"":""Tue, 18 Oct 2005 16:18:16 GMT""}]","2009-11-07"
"gr-qc/0212120","Saibal Ray","Saibal Ray and Sumana Bhadra","Classical Electron Model with Negative Energy Density in Einstein-Cartan
  Theory of Gravitation","12 Latex pages, added refs and conclusions","Int.J.Mod.Phys. D13 (2004) 555-566","10.1142/S0218271804004712",,"gr-qc",,"  Experimental result regarding the maximum limit of the radius of the electron
\sim 10^{-16} cm and a few of the theoretical works suggest that the
gravitational mass which is a priori a positive quantity in Newtonian mechanics
may become negative in general theory of relativity. It is argued that such a
negative gravitational mass and hence negative energy density also can be
obtained with a better physical interpretation in the framework of
Einstein-Cartan theory.
","[{""version"":""v1"",""created"":""Sun, 29 Dec 2002 17:38:52 GMT""},{""version"":""v2"",""created"":""Fri, 21 Oct 2005 07:30:51 GMT""}]","2009-11-07"
"gr-qc/0212121",,"Sergei M. Kopeikin (Department of Physics and Astronomy, University of
  Missouri-Columbia, USA)","The Post-Newtonian Treatment of the VLBI Experiment on September 8, 2002","15 pages, 2 figures, final version accepted to Phys. Lett. A","Phys.Lett. A312 (2003) 147-157","10.1016/S0375-9601(03)00613-3",,"gr-qc astro-ph hep-ph hep-th",,"  Gravitational physics of VLBI experiment conducted on September 8, 2002 and
dedicated to measure the speed of gravity (a fundamental constant in the
Einstein equations) is treated in the first post-Newtonian approximation.
Explicit speed-of-gravity parameterization is introduced to the Einstein
equations to single out the retardation effect caused by the finite speed of
gravity in the relativistic time delay of light, passing through the variable
gravitational field of the solar system. The speed-of-gravity 1.5
post-Newtonian correction to the Shapiro time delay is derived and compared
with our previous result obtained by making use of the post-Minkowskian
approximation. We confirm that the 1.5 post-Newtonian correction to the Shapiro
delay depends on the speed of gravity $c_g$ that is a directly measurable
parameter in the VLBI experiment.
","[{""version"":""v1"",""created"":""Mon, 30 Dec 2002 03:01:05 GMT""},{""version"":""v2"",""created"":""Fri, 10 Jan 2003 19:09:57 GMT""},{""version"":""v3"",""created"":""Tue, 18 Feb 2003 21:39:22 GMT""},{""version"":""v4"",""created"":""Fri, 28 Mar 2003 21:59:09 GMT""}]","2007-05-23"
"gr-qc/0212122","Richard Gass","Andrew Royston and Richard Gass","An Optical Analog of a Black Holes","four pages, 1 figure",,,,"gr-qc",,"  Using media with extremely low group velocities one can create an optical
analog of a curved space-time. Leonhardt and Piwnicki have proposed that a
vortex flow will act as an optical black hole. We show that although the
Leonhardt - Piwnicki flow has an orbit of no return and an infinite red-shift
surface, it is not a true black hole since it lacks a null hypersurface.
However a radial flow will produce a true optical black hole that has a Hawking
temperature and obeys the first law of black hole mechanics. By combining the
Leonhardt - Piwnicki flow with a radial flow we obtain the analog of the Kerr
black hole.
","[{""version"":""v1"",""created"":""Mon, 30 Dec 2002 14:16:33 GMT""}]","2007-05-23"
"hep-ex/0212067","Yoshihito Gando","Super-Kamiokande collaboration: Y.Gando, et al","Search for anti-electron-neutrinos from the Sun at Super-Kamiokande-I","5 pages(LaTex), 5 figures, submitted to Phys. Rev. Letters","Phys.Rev.Lett.90:171302,2003","10.1103/PhysRevLett.90.171302",,"hep-ex",,"  We present the results of a search for low energy $\bar{\nu}_e$ from the Sun
using 1496 days of data from Super-Kamiokande-I. We observe no significant
excess of events and set an upper limit for the conversion probability to
$\bar{\nu}_e$ of the $^8$B solar neutrino. This conversion limit is 0.8% (90%
C.L.) of the standard solar model's neutrino flux for total energy = 8 MeV --
20 MeV. We also set a flux limit for monochromatic $\bar{\nu}_e$ for
$E_{\bar{\nu}_e}$ = 10 MeV -- 17 MeV.
","[{""version"":""v1"",""created"":""Mon, 30 Dec 2002 07:23:47 GMT""},{""version"":""v2"",""created"":""Thu, 29 May 2003 08:27:28 GMT""}]","2012-08-27"
"hep-lat/0212039","Takashi Kaneko","JLQCD Collaboration: S.Aoki, R.Burkhalter, M.Fukugita, S.Hashimoto,
  K-I.Ishikawa, N.Ishizuka, Y.Iwasaki, K.Kanaya, T.Kaneko, Y.Kuramashi,
  M.Okawa, T.Onogi, N.Tsutsui, A.Ukawa, N.Yamada, and T.Yoshie","Light hadron spectroscopy with two flavors of $O(a)$-improved dynamical
  quarks","52 pages, LaTeX2e with RevTeX4; a new figure (Fig.5) added, Fig.20
  and typos corrected, the final version to appear in PRD","Phys.Rev.D68:054502,2003","10.1103/PhysRevD.68.054502","KEK-CP-136","hep-lat",,"  We present a high statistics study of the light hadron spectrum and quark
masses in QCD with two flavors of dynamical quarks. Numerical simulations are
carried out using the plaquette gauge action and the O(a)-improved Wilson quark
action at \beta=5.2, where the lattice spacing is found to be a=0.0887(11)fm
from \rho meson mass, on a 20^3\times 48 lattice. At each of five sea quark
masses corresponding to m_{PS}/m_{V} \simeq 0.8-0.6, we generate 12000
trajectories using the symmetrically preconditioned Hybrid Monte Carlo
algorithm. Finite spatial volume effects are investigated employing 12^3 \times
48, 16^3 \times 48 lattices. We also perform a set of simulations in quenched
QCD with the same lattice actions at a similar lattice spacing to those for the
full QCD runs. In the meson sector we find clear evidence of sea quark effects.
The J parameter increases for lighter sea quark masses, and the full QCD meson
masses are systematically closer to experiment than in quenched QCD. Careful
finite-size studies are made to ascertain that these are not due to finite-size
effects. Evidence of sea quark effects is less clear in the baryon sector due
to larger finite-size effects. We also calculate light quark masses and find
m_{ud}^{MS}(2GeV) =3.223(+0.046/-0.069)MeV and
m_s^{MS}(2GeV)=84.5(+12.0/-1.7)MeV which are about 20% smaller than in quenched
QCD.
","[{""version"":""v1"",""created"":""Mon, 30 Dec 2002 08:22:19 GMT""},{""version"":""v2"",""created"":""Tue, 12 Aug 2003 09:10:04 GMT""}]","2008-11-26"
