"hep-ph/0212386","Fred Jegerlehner","J. Gluza (Silesia U., DESY Zeuthen), A. Hoefer, S. Jadach (Cracow,
  INP), F. Jegerlehner (DESY Zeuthen)","Measuring the FSR--inclusive pi+pi- cross section","18 pages, 13 Figures","Eur.Phys.J. C28 (2003) 261-278","10.1140/epjc/s2003-01146-0","DESY 02-155","hep-ph",,"  Final state radiation (FSR) in pion--pair production cannot be calculated
reliably because of the composite structure of the pions. However, FSR
corrections have to be taken into account for a precise evaluation of the
hadronic contribution to g-2 of the muon. The role of FSR in both energy scan
and radiative return experiments is discussed. It is shown how FSR influences
the pion form factor extraction from experimental data and, as a consequence,
the evaluation of a_mu^had. In fact the O(alpha) FSR corrections should be
included to reach the precision we are aiming at. We argue that for an
extraction of the desired FSR--inclusive cross section sigma^(gamma)_had a
photon--inclusive scan measurement of the ``e+e- to pi+pi- + photons'' cross
section is needed. For exclusive scan and radiative return measurements in
contrast we have to rely on ad hoc FSR models if we want to obtain either
sigma^(gamma)_had or the FSR--exclusive cross section sigma^(0)_had. We thus
advocate to consider seriously precise photon--inclusive energy scan
measurements at present and future low energy e+e- facilities. Then together
with radiative return measurements from DAFNE and BABAR and forthcoming scan
measurements at VEPP-2000 we have a good chance to substantially improve the
evaluation of a_mu^had in the future.
","[{""version"":""v1"",""created"":""Mon, 30 Dec 2002 00:39:48 GMT""}]","2009-11-07"
"hep-ph/0212387","Athar Hussain","H. Athar (NCTS)","Some aspects of neutrino astrophysics","25 pages, 4 figs, summary of lectures given at The Sixth Constantine
  High Energy Physics School, 6-12 April, 2002, Constantine, Algeria (to appear
  in its proceedings edited by N. Mebarki and J. Mimouni)",,,,"hep-ph astro-ph",,"  Selected topics in neutrino astrophysics are reviewed. These include the
production of low energy neutrino flux from cores of collapsing stars and the
expected high energy neutrino flux from some other astrophysical sites such as
the galactic plane as well as the center of some distant galaxies. The expected
changes in these neutrino fluxes because of neutrino oscillations during their
propagation to us are described. Observational signatures for these neutrino
fluxes with and without neutrino oscillations are discussed.
","[{""version"":""v1"",""created"":""Mon, 30 Dec 2002 03:31:16 GMT""}]","2007-05-23"
"hep-ph/0212388","Jan Kalinowski","Jan Kalinowski","Supersymmetry Parameter Analysis","13 pages, latex, 8 figures, invited talk at the 10th International
  Conference on Supersymmetry and Unification of Fundamental Interactions
  (SUSY02), 17-23 June 2002, DESY Hamburg, Germany",,,"IFT-02/43","hep-ph",,"  Supersymmetric particles can be produced copiously at future colliders. From
the high-precision data taken at e+e- linear colliders, TESLA in particular,
and combined with results from LHC, and CLIC later, the low-energy parameters
of the supersymmetric model can be determined. Evolving the parameters from the
low-energy scale to the high-scale by means of renormalization group techniques
the fundamental supersymmetry parameters at the high scale, GUT or Planck, can
be reconstructed to reveal the origin of supersymmetry breaking.
","[{""version"":""v1"",""created"":""Mon, 30 Dec 2002 09:08:50 GMT""}]","2007-05-23"
"hep-ph/0212389","Stefan Recksiegel","S. Recksiegel and Y. Sumino","Comparing the QCD potential in Perturbative QCD and Lattice QCD at large
  distances","Version to appear in Eur.J.Phys; 16 pages, 7 figures","Eur.Phys.J. C31 (2003) 187-196","10.1140/epjc/s2003-01319-9","TU-673, KEK-TH-860","hep-ph hep-lat",,"  We compare the perturbatively calculated QCD potential to that obtained from
lattice calculations in the theory without light quark flavours. We examine
E_tot(r) = 2 m_pole + V_QCD(r) by re-expressing it in the MSbar mass m =
m^MSbar(m^MSbar) and by choosing specific prescriptions for fixing the scale mu
(dependent on r and m). By adjusting m so as to maximise the range of
convergence, we show that perturbative and lattice calculations agree up to
3*r_0 ~ 7.5 GeV^-1 (r_0 is the Sommer scale) within the uncertainty of order
Lambda^3 r^2.
","[{""version"":""v1"",""created"":""Mon, 30 Dec 2002 11:23:53 GMT""},{""version"":""v2"",""created"":""Wed, 30 Jul 2003 06:19:21 GMT""}]","2009-11-07"
"hep-ph/0212390","Yan QiShu","Qi-Shu Yan and Dong-Sheng Du","The one loop renormalization of the effective Higgs sector and its
  implications","ReVTeX, 18 pages; in the sequel to hep-ph/0211258, hep-ph/0211301,
  and hep-ph/0212367",,,,"hep-ph",,"  We study the one-loop renormalization the standard model with anomalous Higgs
couplings ($O(p^2)$) by using the background field method, and provide the
whole divergence structure at one loop level. The one-loop divergence structure
indicates that, under the quantum corrections, only after taking into account
the mass terms of Z bosons ($O(p^2)$) and the whole bosonic sector of the
electroweak chiral Lagrangian ($O(p^4)$), can the effective Lagrangian be
complete up to $O(p^4)$.
","[{""version"":""v1"",""created"":""Mon, 30 Dec 2002 11:47:03 GMT""}]","2007-05-23"
"hep-ph/0212391","Arcadi Santamaria","J.F. Oliver, J. Papavassiliou and A. Santamaria","Universal extra dimensions and Z->b bar-b","16 pages, 4 figures, revtex4","Phys.Rev. D67 (2003) 056002","10.1103/PhysRevD.67.056002","FTUV-02-1230, IFIC/02-65","hep-ph",,"  We study, at the one loop level, the dominant contributions from a single
universal extra dimension to the process (Z\to b\bar{b}). By resorting to the
gaugeless limit of the theory we explain why the result is expected to display
a strong dependence on the mass of the top-quark, not identified in the early
literature. A detailed calculation corroborates this expectation, giving rise
to a lower bound for the compactification scale which is comparable to that
obtained from the $\rho$ parameter. An estimate of the subleading corrections
is furnished, together with a qualitative discussion on the difference between
the present results and those derived previously for the non-universal case.
","[{""version"":""v1"",""created"":""Mon, 30 Dec 2002 12:07:54 GMT""}]","2009-11-07"
"hep-ph/0212393","Alexander Studenikin","A.Lobanov, A.Studenikin","Spin light of neutrino in matter and electromagnetic fields","accepted for publication in Phys.Lett.B","Phys.Lett. B564 (2003) 27-34","10.1016/S0370-2693(03)00570-7",,"hep-ph",,"  A new type of electromagnetic radiation by a neutrino with non-zero magnetic
(and/or electric) moment moving in background matter and electromagnetic field
is considered. This radiation originates from the quantum spin flip transitions
and we have named it as ""spin light of neutrino""($SL\nu$). The neutrino
initially unpolarized beam (equal mixture of $\nu_{L}$ and $\nu_{R}$) can be
converted to the totally polarized beam composed of only $\nu_{R}$ by the
neutrino spin light in matter and electromagnetic fields. The quasi-classical
theory of this radiation is developed on the basis of the generalized
Bargmann-Michel-Telegdi equation. The considered radiation is important for
environments with high effective densities, $n$, because the total radiation
power is proportional to $n^{4}$. The spin light of neutrino, in contrast to
the Cherenkov or transition radiation of neutrino in matter, does not vanish in
the case of the refractive index of matter is equal to unit. The specific
features of this new radiation are: (i) the total power of the radiation is
proportional to $\gamma ^{4}$, and (ii) the radiation is beamed within a small
angle $\delta \theta \sim \gamma^{-1}$, where $\gamma$ is the neutrino Lorentz
factor. Applications of this new type of neutrino radiation to astrophysics, in
particular to gamma-ray bursts, and the early universe should be important.
","[{""version"":""v1"",""created"":""Mon, 30 Dec 2002 14:15:02 GMT""},{""version"":""v2"",""created"":""Mon, 6 Jan 2003 12:46:38 GMT""},{""version"":""v3"",""created"":""Thu, 10 Apr 2003 17:30:03 GMT""}]","2009-11-07"
"hep-th/0212326","Namil Park","Yoonbai Kim, Chae Young Oh, Namil Park (Sungkyunkwan U.)","Classical Geometry of De Sitter Spacetime : An Introductory Review","40 pages, 12 figures (ps or eps)",,,,"hep-th astro-ph gr-qc hep-ph",,"  Classical geometry of de Sitter spacetime is reviewed in arbitrary
dimensions. Topics include coordinate systems, geodesic motions, and Penrose
diagrams with detailed calculations.
","[{""version"":""v1"",""created"":""Sun, 29 Dec 2002 16:48:50 GMT""}]","2007-05-23"
"hep-th/0212328","Xingang Chen","Xingang Chen and Erick J. Weinberg","ADHMN boundary conditions from removing monopoles","37 pages, 6 figures","Phys.Rev. D67 (2003) 065020","10.1103/PhysRevD.67.065020","CU-TP-1076","hep-th",,"  Boundary conditions play an important role in the ADHMN construction of BPS
monopole solutions. In this paper we show how different types of boundary
conditions can be related to each other by removing monopoles to spatial
infinity. In particular, we use this method to show how the jumping data
naturally emerge. The results can be interpreted in the D-brane picture and
provide a better understanding of the derivation of the ADHMN construction from
D-branes. We comment briefly on the cases with non-Abelian unbroken symmetry
and massless monopoles.
","[{""version"":""v1"",""created"":""Sun, 29 Dec 2002 22:52:04 GMT""}]","2009-11-07"
"hep-th/0212329","Hitoshi Nishino","Hitoshi Nishino and Subhash Rajpoot","Noncommutative Nonlinear Supersymmetry","18 pages, no figures, the misleading expression ""D=2,3,4 and 6 (mod
  8)"" in Abstract, the main text and Concluding Remarks corrected, and one
  reference [21] added",,,"CSULB-PA-02-6","hep-th",,"  We present noncommutative nonlinear supersymmetric theories. The first
example is a non-polynomial Akulov-Volkov-type lagrangian with noncommutative
nonlinear global supersymmetry in arbitrary space-time dimensions. The second
example is the generalization of this lagrangian to Dirac-Born-Infeld
lagrangian with nonlinear supersymmetry realized in dimensions D=2,3,4, 6 and
10.
","[{""version"":""v1"",""created"":""Sun, 29 Dec 2002 22:41:03 GMT""},{""version"":""v2"",""created"":""Wed, 19 Feb 2003 03:26:09 GMT""}]","2007-05-23"
"hep-th/0212330","Manoel Messias Ferreira Junior","H. Belich, M.M. Ferreira Jr, J.A. Helayel-Neto and M.T.D. Orlando","Dimensional Reduction of a Lorentz and CPT-violating
  Maxwell-Chern-Simons Model","11 pages, 1 table, style revtex, revised version, unitarity section
  included","Phys.Rev.D67:125011,2003; Erratum-ibid.D69:109903,2004","10.1103/PhysRevD.67.125011 10.1103/PhysRevD.69.109903",,"hep-th",,"  Taking as starting point a Lorentz and CPT non-invariant Chern-Simons-like
model defined in 1+3 dimensions, we proceed realizing its dimensional reduction
to D=1+2. One then obtains a new planar model, composed by the
Maxwell-Chern-Simons (MCS) sector, a Klein-Gordon massless scalar field, and a
coupling term that mixes the gauge field to the external vector, $v^{\mu}$. In
spite of breaking Lorentz invariance in the particle frame, this model may
preserve the CPT symmetry for a single particular choice of $v^{\mu}$.
Analyzing the dispersion relations, one verifies that the reduced model
exhibits stability, but the causality can be jeopardized by some modes. The
unitarity of the gauge sector is assured without any restriction, while the
scalar sector is unitary only in the space-like case.
  PACS numbers: 11.10.Kk; 11.30.Cp; 11.30.Er; 12.60.-i
","[{""version"":""v1"",""created"":""Sun, 29 Dec 2002 22:55:26 GMT""},{""version"":""v2"",""created"":""Mon, 27 Jan 2003 21:59:57 GMT""}]","2014-11-18"
"hep-th/0212331","Tetsuya Shiromizu","Tetsuya Shiromizu, Kazuya Koyama, Keitaro Takahashi","Effective theory for close limit of two branes","6 pages, a version to be published in Phy.Rev.D","Phys.Rev. D67 (2003) 104011","10.1103/PhysRevD.67.104011",,"hep-th astro-ph gr-qc hep-ph",,"  We discuss the effective theory for the close limit of two branes in a
covariant way. To do so we solve the five dimensional Einstein equation along
the direction of the extra dimension. Using the Taylor expansion we solve the
bulk spacetimes and derive the effective theory describing the close limit. We
also discuss the radion dynamics and braneworld black holes for the close limit
in our formulation.
","[{""version"":""v1"",""created"":""Mon, 30 Dec 2002 02:43:59 GMT""},{""version"":""v2"",""created"":""Mon, 21 Apr 2003 23:35:02 GMT""}]","2009-11-07"
"hep-th/0212332","Stefano Kovacs","Michael B. Green (DAMTP) and Stefano Kovacs (AEI)","Instanton-induced Yang-Mills correlation functions at large N and their
  AdS_5xS^5 duals","LaTeX, 84 pages, 12 eps figures","JHEP 0304:058,2003","10.1088/1126-6708/2003/04/058","DAMTP-2002-159, AEI-2002-103","hep-th",,"  Correlation functions of chiral primary operators and their superconformal
descendants in the N=4 supersymmetric SU(N) Yang-Mills theory are studied in
detail in a one-instanton background and at large N. Whereas earlier
calculations were restricted to correlation functions that are saturated by the
16 exact superconformal fermionic moduli, here the effect of the set of
additional fermionic moduli associated with the embeddings of the SU(2)
instanton in SU(N) is considered. The presence of the extra fermionic modes is
essential for matching Yang-Mills instanton effects in various correlation
functions with D-instanton effects in type IIB string theory via the AdS/CFT
conjecture. The leading terms of this kind on the string side contribute at
order 1/(alpha'), which is the same order as the R^4 interaction. For example,
the instanton contributions to correlation functions of higher dimensional
chiral primary operators are seen to match amplitudes involving Kaluza-Klein
excitations of the supergravity fields, as expected. Another example is the
matching of certain multi-fermion correlation functions which correspond to
certain multi-fermion interactions required by supersymmetry of the IIB string
effective action. Careful analysis of a variety of competing effects makes it
possible to decipher contributions corresponding to higher derivative
interactions in the IIB effective action. In this manner it is possible to
check for the presence of terms of order alpha'. Comments are also made on the
structure of instanton contributions to near-extremal correlation functions of
chiral primary operators.
","[{""version"":""v1"",""created"":""Mon, 30 Dec 2002 04:33:19 GMT""}]","2014-11-18"
"hep-th/0212333","Matt Visser","Matt Visser (Victoria University of Wellington), David L. Wiltshire
  (University of Canterbury)","On-brane data for braneworld stars","5 pages, RevTeX4, v2: Main algorithm and results substantially
  simplified, further discussion and references added","Phys.Rev. D67 (2003) 104004","10.1103/PhysRevD.67.104004",,"hep-th astro-ph gr-qc",,"  Stellar structure in braneworlds is markedly different from that in ordinary
general relativity. As an indispensable first step towards a more general
analysis, we completely solve the ``on brane'' 4-dimensional Gauss and Codazzi
equations for an arbitrary static spherically symmetric star in a
Randall--Sundrum type II braneworld. We then indicate how this on-brane
boundary data should be propagated into the bulk in order to determine the full
5-dimensional spacetime geometry. Finally, we demonstrate how this procedure
can be generalized to solid objects such as planets.
","[{""version"":""v1"",""created"":""Mon, 30 Dec 2002 04:52:45 GMT""},{""version"":""v2"",""created"":""Thu, 20 Feb 2003 02:50:13 GMT""}]","2009-11-07"
"hep-th/0212334","Saurya Das","Saurya Das (Univ of New Brunswick), Gabor Kunstatter (Univ of
  Winnipeg)","Varying Fine Structure Constant and Black Hole Physics","7 Pages, Revtex. Reference added, minor changes. Version to appear in
  Class. Quant. Grav","Class.Quant.Grav.20:2015-2024,2003","10.1088/0264-9381/20/11/304",,"hep-th astro-ph gr-qc hep-ph",,"  Recent astrophysical observations suggest that the value of fine structure
constant $\alpha=e^2/\hbar c$ may be slowly increasing with time. This may be
due to an increase of $e$ or a decrease of $c$, or both. In this article, we
argue from model independent considerations that this variation should be
considered adiabatic. Then, we examine in detail the consequences of such an
adiabatic variation in the context of a specific model of quantized charged
black holes. We find that the second law of black hole thermodynamics is
obeyed, regardless of the origin of the variation, and that interesting
constraints arise on the charge and mass of black holes. Finally, we estimate
the work done on a black hole of mass $M$ due to the proposed $\alpha$
variation.
","[{""version"":""v1"",""created"":""Mon, 30 Dec 2002 15:06:56 GMT""},{""version"":""v2"",""created"":""Mon, 14 Apr 2003 20:51:33 GMT""}]","2014-11-18"
"math-ph/0212075","Wen Chen","W. Chen, S. Holm","Fractional Laplacian, Levy stable distribution, and time-space models
  for linear and nonlinear frequency-dependent lossy media",,,,"Simula Research Laboratory Report, 2002-09","math-ph math.AP math.MP",,"  The frequency-dependent attenuation typically obeys an empirical power law
with an exponent ranging from 0 to 2. The standard time-domain partial
differential equation models can describe merely two extreme cases of frequency
independent and frequency-squared dependent attenuations. The otherwise
non-zeor and non-square frequency dependency occuring in many cases of
practical interest is thus often called the anomalous attenuation. In this
study, we developed a linear integro-differential equation wave model for the
anomalous attenuation by using the space fractional Laplacian operation, and
the strategy is then extended to the nonlinear Burgers, KZK, and Westervelt
equations. A new definition of the fractional Laplacian is also introduced
which naturally includes the boundary conditions and has inherent
regularization to ease the hyper-singularity in the conventional fractional
Laplacian. Under the Szabo's smallness approximation where attenuation is
assumed to be much smaller than the wave number, our linear model is found
consistent with arbitrary frequency dependencies. According to the fact that
the physical attenuation can be understood a statistic process, the empirical
range [0,2] of the power law exponent is explained via the Levy stable
distribution theory. It is noted that the power law attentuation underlies
fractal microstructures of anomalously attenuative media.
","[{""version"":""v1"",""created"":""Mon, 30 Dec 2002 09:44:14 GMT""}]","2007-05-23"
"math-ph/0212076","Wen Chen","W. Chen, S. Holm","Modified Szabo's wave equation models for lossy media obeying frequency
  power law",,,"10.1121/1.1621392","Simula Research Laboratory Report, 2002-10","math-ph math.AP math.MP",,"  Szabo's models of acoustic attenuation (Szabo 1994a) comply well with the
empirical frequency power law involving non-integer and odd integer exponent
coefficients while guaranteering causality, but nevertheless encounter the
troublesome issues of hyper-singular improper integral and obscurity in
implementing initial conditions. The purpose of this paper is to ease or remove
these drawbacks of the Szabo's models via the Caputo fractional derivative
concept. The positive time fractional derivative is also first introduced to
include the positivity of the attenuation possesses.
","[{""version"":""v1"",""created"":""Mon, 30 Dec 2002 09:54:54 GMT""}]","2009-11-07"
"math/0212369","Vladimir Dergachev","Vladimir Dergachev","A non radical based approach to study of associative algebras","40 pages; text has been significantly expanded. Added new sections
  discussing interaction with radical methods and open problems",,,,"math.RA math.RT",,"  We study pairs of associative algebras and linear functionals. New results
together with corrected proofs for previously published material are presented.
In particular, we prove the identity ind Mat(n) (#) A=n * ind A$ for
finite-dimensional unital associative algebra A with index 1. [ Symbol (#)
denotes tensor product ]
","[{""version"":""v1"",""created"":""Mon, 30 Dec 2002 00:21:08 GMT""},{""version"":""v2"",""created"":""Thu, 2 Jan 2003 19:08:18 GMT""},{""version"":""v3"",""created"":""Fri, 18 Apr 2003 15:23:22 GMT""}]","2007-05-23"
"math/0212370","Valeriy Tolstoy","V.N. Tolstoy","From quantum affine Kac-Moody algebras to Drinfeldians and Yangians","22 pages. Contribution to the Proceedings of the Ramanujan
  International Symposium on Kac-Moody Algebras and Applications, ISKMAA-2002,
  Jan. 28--31, Chennai,India. Final version to be published in Contemporary
  Mathematics, v2: minor corrections",,,,"math.QA math-ph math.MP math.RT",,"  A general scheme of construction of Drinfeldians and Yangians from quantum
non-twisted affine Kac-Moody algebras is presented. Explicit description of
Drinfeldians and Yangians for all Lie algebras of the classical series A, B, C,
D are given in terms of a Cavalley basis.
","[{""version"":""v1"",""created"":""Mon, 30 Dec 2002 02:41:47 GMT""},{""version"":""v2"",""created"":""Thu, 3 Apr 2003 13:36:05 GMT""}]","2007-05-23"
"math/0212371","Valeriy Tolstoy","V.N. Tolstoy","About rational-trigonometric deformation","7 pages, LaTeX; the talk given at the 24-th International Colloquium
  ""Group Theoretical Methods in Physics"" ICGTMP-24 (Paris, July. 14-21, 2002)",,,,"math.QA math-ph math.MP math.RT",,"  We consider a rational-trigonometric deformation in context of rational and
trigonometric deformations. The simplest examples of these deformations are
presented in different fields of mathematics. Rational-trigonometric
differential Knizhnik-Zamolodchikov and dynamical equations are introduced.
","[{""version"":""v1"",""created"":""Mon, 30 Dec 2002 05:43:01 GMT""}]","2007-05-23"
"math/0212372","Chuu-Lian Terng","Chuu-Lian Terng","Geometries and Symmetries of Soliton equations and Integrable Elliptic
  equations","67 pages, to appear in Surveys on Geometry and Integrable Systems,
  Advanced Studies in Pure Mathematics, Mathematical Society of Japan",,,,"math.DG nlin.SI",,"  We give a review of the systematic construction of hierarchies of soliton
flows and integrable elliptic equations associated to a complex semi-simple Lie
algebra and finite order automorphisms. For example, the non-linear
Schr\""odinger equation, the n-wave equation, and the sigma-model are soliton
flows; and the equation for harmonic maps from the plane to a compact Lie
group, for primitive maps from the plane to a $k$-symmetric space, and constant
mean curvature surfaces and isothermic surfaces in space forms are integrable
elliptic systems. We also give a survey of
  (i) construction of solutions using loop group factorizations,
  (ii) PDEs in differential geometry that are soliton equations or elliptic
integrable systems,
  (iii) similarities and differences of soliton equations and integrable
elliptic systems.
","[{""version"":""v1"",""created"":""Mon, 30 Dec 2002 05:46:14 GMT""}]","2007-05-23"
"math/0212373","Raphael Yuster","Yair Caro and Raphael Yuster","The order of monochromatic subgraphs with a given minimum degree",,,,,"math.CO",,"  Let $G$ be a graph. For a given positive integer $d$, let $f_G(d)$ denote the
largest integer $t$ such that in every coloring of the edges of $G$ with two
colors there is a monochromatic subgraph with minimum degree at least $d$ and
order at least $t$. For $n > k > d$ let $f(n,k,d)$ denote the minimum of
$f_G(d)$ where $G$ ranges over all graphs with $n$ vertices and minimum degree
at least $k$. In this paper we establish $f(n,k,d)$ whenever $k$ or $n-k$ are
fixed, and $n$ is sufficiently large. We also consider the case where more than
two colors are allowed.
","[{""version"":""v1"",""created"":""Mon, 30 Dec 2002 06:53:26 GMT""}]","2007-05-23"
"math/0212374","Valentin Vankov Iliev","Valentin Vankov Iliev","On certain organic compounds with one mono-substitution and at least
  three di-substitution homogeneous derivatives","13 pages",,,,"math.CO physics.chem-ph",,"  In this paper parent substances with molecules which can be divided into a
skeleton and six univalent substituents, and that have the properties mentioned
in the title, are considered. Two instances are the molecules of benzene and
cyclopropane. The Lunn-Senior's symmetry groups of substitution isomerism of
these compounds are described and upper bounds of the numbers of their
di-substitution and tri-substitution homogeneous derivatives are found. Lists
of the possible simple substitution reactions among di-substitution homogeneous
derivatives, on one hand, and di-substitution heterogeneous, and
tri-substitution homogeneous derivatives, on the other, are given. These
substitution reactions allow for some derivatives to be identified with their
structural formulae.
","[{""version"":""v1"",""created"":""Mon, 30 Dec 2002 09:33:09 GMT""}]","2007-05-23"
