"nlin/0202006","Jesus Cuevas","A. Alvarez, J.F.R. Archilla, J. Cuevas and F.R. Romero","Dark breathers in Klein-Gordon lattices. Band analysis of their
  stability properties","20 pages, 21 figures","New. Jou. Phys., 4 (2002) 72.","10.1088/1367-2630/4/1/372",,"nlin.PS",,"  Discrete bright breathers are well known phenomena. They are localized
excitations that consist of a few excited oscillators in a lattice and the rest
of them having very small amplitude or none. In this paper we are interested in
the opposite kind of localization, or discrete dark breathers, where most of
the oscillators are excited and one or a few units of them have very small
amplitude. We investigate using band analysis, Klein--Gordon lattices at
frequencies not close to the linear ones. Dark breathers at low coupling are
shown to be stable for Klein--Gordon chains with soft on--site potentials and
repulsive dispersive interaction, and with hard on--site potentials and
attractive dispersive interactions. At higher coupling dark breathers lose
their stability via subharmonic, harmonic or oscillatory bifurcations,
depending on the model. However, most of these bifurcations are harmless in the
sense that they preserve dark localization. None of these bifurcations
disappear when the system is infinite. Dark breathers in dissipative systems
are found to be stable for both kinds of dispersive interaction.
","[{""version"":""v1"",""created"":""Sat, 2 Feb 2002 12:21:33 GMT""},{""version"":""v2"",""created"":""Wed, 31 Jul 2002 09:24:09 GMT""}]","2009-11-07"
"nlin/0202007","Jesus Cuevas","J. Cuevas, F. Palmero, J.F.R. Archilla, F.R. Romero","Moving breathers in a bent DNA-related model","13 pages, 8 figures","Phys. Lett. A, 299 (2002) 221","10.1016/S0375-9601(02)00731-4",,"nlin.PS",,"  We study the properties of moving breathers in a bent DNA-related model with
short range interaction, due to the stacking of the base pairs, and long range
interaction, due to the finite dipole moment of the bonds within each base
pair. We show that the movement of a breather is hindered by the bending of the
chain as a particle in a potential barrier. We have also found that the
behaviour of moving breathers in an homogeneous bent chain and in a straight
chain with a small impurity is qualitatively equivalent.
","[{""version"":""v1"",""created"":""Sat, 2 Feb 2002 12:35:37 GMT""},{""version"":""v2"",""created"":""Sat, 26 Jul 2003 11:03:04 GMT""}]","2015-06-26"
"quant-ph/0202011","Valery N. Gorbachev","V.N. Gorbachev, A.I. Zhiliba, A.I. Trubilko","Master Equation for Light emitted by correlated Atoms","7 pages, latex, no figures, revised version",,,,"quant-ph",,"  A master equation for light generated by atoms, which states are prepared by
a pumping mechanism that produces atomic correlations, is derived in the
Fokker-Planck approximation. It has been found that two-particle correlations
only play the role under this approach. Then the equation is applied for
describing micromaser operations and light noise is discussed. We consider the
correlated atomic states prepared by telecloning protocols.
","[{""version"":""v1"",""created"":""Fri, 1 Feb 2002 17:13:13 GMT""},{""version"":""v2"",""created"":""Tue, 22 Oct 2002 08:24:12 GMT""}]","2007-05-23"
"quant-ph/0202012","Thomas Gasenzer","T. Gasenzer (U Oxford)","Limitations of squeezing due to collisional decoherence in Bose-Einstein
  condensates","16 pages RevTeX, 3 figures","J. Phys. B: At. Mol. Opt. Phys. 35: 2337-2356, 2002","10.1088/0953-4075/35/10/312",,"quant-ph",,"  We study the limitations for entanglement due to collisional decoherence in a
Bose-Einstein condensate. Specifically we consider relative number squeezing
between photons and atoms coupled out from a homogeneous condensate. We study
the decay of excited quasiparticle modes due to collisions, in condensates of
atoms with one or two internal degrees of freedom. The time evolution of these
modes is determined in the linear response approximation to the deviation from
equilibrium. We use Heisenberg-Langevin equations to derive equations of motion
for the densities and higher correlation functions which determine the
squeezing. In this way we can show that decoherence due to quasiparticle
interactions imposes an important limit on the degree of number squeezing which
may be achieved. Our results are also relevant for the determination of
decoherence times in other experiments based on entanglement, e.g. the slowing
and stopping of light in condensed atomic gases using dark states.
","[{""version"":""v1"",""created"":""Fri, 1 Feb 2002 17:24:54 GMT""}]","2009-11-07"
"quant-ph/0202013","Navin Khaneja","Navin Khaneja and Steffen Glaser","Spin Solitons and Quantum Control of Spin Chain Dynamics",,,,,"quant-ph",,"  Experiments in coherent spectroscopy correspond to control of quantum
mechanical ensembles guiding them from initial to final target states by
unitary transformations. The control inputs (pulse sequences) that accomplish
these unitary transformations should take as little time as possible so as to
minimize the effects of relaxation and to optimize the sensitivity of the
experiments. Here, we present a radically different and generally applicable
approach to efficient control of dynamics in spin chains of arbitrary length.
The approach relies on the creation of localized spin waves, ``spin solitons'',
and efficient propagation of these soliton states through the spin chain. The
methods presented are expected to find immediate applications in control of
spin dynamics in coherent spectroscopy and quantum information processing.
","[{""version"":""v1"",""created"":""Fri, 1 Feb 2002 23:05:54 GMT""},{""version"":""v2"",""created"":""Fri, 12 Apr 2002 01:30:18 GMT""}]","2007-05-23"
