"astro-ph/0202053","Kunihito Ioka","Kunihito Ioka, Takashi Nakamura","Possible Origin of Lognormal Distributions in Gamma-Ray Bursts","11 pages, 3 figures, accepted for publication in ApJL",,"10.1086/340815",,"astro-ph",,"  We show that if the intrinsic break energy of Gamma-Ray Bursts (GRBs) is
determined by the product of more than three random variables the observed
break energy distribution becomes almost lognormal including the redshift
effect because of the central limit theorem. The excess from the lognormal
distribution at the low break energy is possibly due to the high redshift GRBs.
The same argument may also apply to the pulse duration, the interval between
pulses and so on.
","[{""version"":""v1"",""created"":""Sat, 2 Feb 2002 08:45:45 GMT""},{""version"":""v2"",""created"":""Fri, 22 Mar 2002 04:14:08 GMT""}]","2009-11-07"
"astro-ph/0202054","Sanjay M. Wagh","Sanjay M Wagh","Spherical Gravitational Collapse and Accretion - Exact General
  Relativistic Description","Revtex4, No figures",,,,"astro-ph",,"  In this paper, we consider the problems of spherical gravitational collapse
and accretion using a spherically symmetric, spatially homothetic spacetime,
that is, as an exact solution (cqg1) of the field equations of general
relativity. Properties of matter like its equation of state determine whether
the collapse becomes unstoppable or not since the spacetime under consideration
admits any equation of state for matter in it. We can therefore describe the
formation of a semi-stable object here. {\bf A black hole may form in the
unstoppable gravitational collapse and/or accretion but only as an infinite
red-shift surface that is, however, not a null hyper-surface.} Therefore,
spherical, astrophysical black holes will always be of this type. This result
will have important implications for observational astrophysics and other
considerations in General Relativity based on the conception of black hole as a
null hyper-surface.
","[{""version"":""v1"",""created"":""Sat, 2 Feb 2002 14:22:39 GMT""}]","2007-05-23"
"cond-mat/0202019","Pierre Evesque","F. Adj\'emian & P. Evesque","Stress fluctuations in granular matter: normal vs. seismic regimes in
  uniaxial compression tests","2 pages, 2 figures","poudres & grains 13(1) 4-5, (2002)",,,"cond-mat.dis-nn cond-mat.stat-mech",,"  This paper is concerned with the trends of stress fluctuations in dry
granular materials as functions of the sample size D and of the grain diameter
d. Results are obtained in the plateau regime of large axial deformation,
during axi-symmetric uni-axial compression. Two cases have to be distinguished
depending on whether the material generates or does not generate stick-slip.
When no stick-slip is generated (Fig.1), it is found that the relative stress
fluctuations dq/q of the deviatoric stress q scales linearly with the ratio d/D
>. The coefficient A relating dq/q and d/D ranges from 1 to 3 about, depending
on the grain size d; this is probably due to the effect of the piston
roughness. This result is compatible with a contact force network with a random
force distribution and a short range correlation length L,i.e. L<3d; this leads
to estimate the representative elementary volume REV to contain few grains
(from 1 to 30) as it has been defended already in [1].
  We turn now to cases exhibiting stick-slip (Fig. 2). It has been shown in [2]
that the distribution of delays between events is rather ""exponential"" when the
sample is small, and Gaussian-like when the sample is larger. The cross-over
between the random to quasi periodic regime occurs for a typical sample which
contains 10 000 000 grains [2]. In this paper we show an analogy between the
statistics of stick-slip amplitude Dq/q and the seismicity of the Los Angeles
area during 1979-1997 period [3]. Similarity of the two trends is quite
surprising. The seismicity has been cut off at Magnitude M=3.5.
  These results have to be handled with care since similarity may be
fortuitous.
","[{""version"":""v1"",""created"":""Fri, 1 Feb 2002 17:16:20 GMT""}]","2007-05-23"
"cond-mat/0202020","Sergio L. A. de Queiroz","S.L.A. de Queiroz","Finite-size investigation of scaling corrections in the square-lattice
  three-state Potts antiferromagnet square-lattice three-state Potts
  antiferromagnet","RevTex4, 5 pages, 2 .eps figures included","Physical Review E 65, article # 056104 (2002)","10.1103/PhysRevE.65.056104",,"cond-mat.stat-mech",,"  We investigate the finite-temperature corrections to scaling in the
three-state square-lattice Potts antiferromagnet, close to the critical point
at T=0. Numerical diagonalization of the transfer matrix on semi-infinite
strips of width $L$ sites, $4 \leq L \leq 14$, yields finite-size estimates of
the corresponding scaled gaps, which are extrapolated to $L\to\infty$. Owing to
the characteristics of the quantities under study, we argue that the natural
variable to consider is $x \equiv L e^{-2\beta}For the extrapolated scaled gaps
we show that square-root corrections, in the variable $x$, are present, and
provide estimates for the numerical values of the amplitudes of the first-- and
second--order correction terms, for both the first and second scaled gaps. We
also calculate the third scaled gap of the transfer matrix spectrum at T=0, and
find an extrapolated value of the decay-of-correlations exponent,
$\eta_3=2.00(1)$. This is at odds with earlier predictions, to the effect that
the third relevant operator in the problem would give $\eta_{{\bf P}_{\rm
stagg}}=3$, corresponding to the staggered polarization.
","[{""version"":""v1"",""created"":""Fri, 1 Feb 2002 18:52:39 GMT""}]","2009-11-07"
"cond-mat/0202021","Eric Yang S.-R.","S.-R. Eric Yang and A.H. MacDonald","Metal-Insulator Transition and Ferromagnetism in Diluted Magnetic
  Semiconductors","5 pages, 4 figures",,"10.1103/PhysRevB.67.155202",,"cond-mat",,"  We have investigated the interplay between the metal-insulator transition and
ferromagnetism in $({\rm III}_{1-x},{\rm Mn}_x){\rm V}$ ferromagnetic
semiconductors. Our study is based on a model in which $S=5/2$ Mn local moments
are exchange-coupled to band electrons that interact via Coulomb interactions
which each other, with ionized Mn acceptors, and with the antisite defects
present in these materials. We find quasiparticle participation ratios that are
consistent with a metal-insulator transition that occurs in the ferromagnetic
state near $x \sim 0.01$. By evaluating the distribution of mean-field exchange
coupling strengths at Mn moment sites, we provide evidence in favor of the
applicability of small polaron and hole gas models on insulating and metallic
sides of the phase transition respectively.
","[{""version"":""v1"",""created"":""Fri, 1 Feb 2002 19:07:19 GMT""}]","2009-11-07"
"cond-mat/0202022","P. Grassberger","Peter Grassberger","Critical Behaviour of the Drossel-Schwabl Forest Fire Model","8 pages, including 9 figures, RevTeX",,"10.1088/1367-2630/4/1/317",,"cond-mat.stat-mech cond-mat.dis-nn",,"  We present high statistics Monte Carlo results for the Drossel-Schwabl forest
fire model in 2 dimensions. They extend to much larger lattices (up to
$65536\times 65536$) than previous simulations and reach much closer to the
critical point (up to $\theta \equiv p/f = 256000$). They are incompatible with
all previous conjectures for the (extrapolated) critical behaviour, although
they in general agree well with previous simulations wherever they can be
directly compared. Instead, they suggest that scaling laws observed in previous
simulations are spurious, and that the density $\rho$ of trees in the critical
state was grossly underestimated. While previous simulations gave $\rho\approx
0.408$, we conjecture that $\rho$ actually is equal to the critical threshold
$p_c = 0.592...$ for site percolation in $d=2$. This is however still far from
the densities reachable with present day computers, and we estimate that we
would need many orders of magnitude higher CPU times and storage capacities to
reach the true critical behaviour -- which might or might not be that of
ordinary percolation.
","[{""version"":""v1"",""created"":""Fri, 1 Feb 2002 19:27:18 GMT""}]","2009-11-07"
"cond-mat/0202023","In\'es Samengo","Ines Samengo","Independent neurons representing a finite set of stimuli: dependence of
  the mutual information on the number of units sampled","13 pages, 5 figures, Network: Computation in Neural Systems, vol 12
  (1) 21 - 31 (2000)",,,,"cond-mat.dis-nn q-bio.NC",,"  We study the capacity with which a system of independent neuron-like units
represents a given set of stimuli. We assume that each neuron provides a fixed
amount of information, and that the information provided by different neurons
has a random overlap. We derive analytically the dependence of the mutual
information between the set of stimuli and the neural responses on the number
of units sampled. For a large set of stimuli, the mutual information rises
linearly with the number of neurons, and later saturates exponentially at its
maximum value.
","[{""version"":""v1"",""created"":""Fri, 1 Feb 2002 20:00:53 GMT""}]","2007-05-23"
"cond-mat/0202024","Pedro Orellana","Gustavo A. Lara, Pedro A. Orellana, Enrique V. Anda","Tristability in a non-equilibrium double-quantum-dot in Kondo regime","4 pages, 4 figures. To appear in Sol. State. Comm",,"10.1016/S0038-1098(02)00766-4",,"cond-mat.mes-hall cond-mat.str-el",,"  Electron tunneling through a non-equilibrium double quantum dot in the Kondo
regime is studied. In the region of negative differential resistance, it is
shown that this system possesses a complex response to the applied potential
characterized by a tristable solution for the current. Increasing the applied
potential or reducing the inter-dot coupling, the system goes through a
transition from a coherent inter-dot regime to an incoherent one. The different
nature of the solutions are characterized and it is shown that the effects of
the asymmetry in the dot-lead coupling can be used to control the region of
multistability. The mean-field slave-boson formalism is used to obtain the
solution of the problem.
","[{""version"":""v1"",""created"":""Fri, 1 Feb 2002 20:44:52 GMT""},{""version"":""v2"",""created"":""Fri, 22 Nov 2002 13:10:28 GMT""}]","2009-11-07"
"cond-mat/0202025","P. Capuzzi","D. M. Jezek and P. Capuzzi","Interaction-driven effects on two-component Bose-Einstein condensates","4 pages, 2 figures, revtex4","Phys. Rev. A 66, 015602 (2002).","10.1103/PhysRevA.66.015602",,"cond-mat.soft",,"  We investigate the role of the interparticle-interaction strength in the
distribution of two species of atoms inside a condensate. We focus upon the
study of systems for which the minima of the trapping potentials for the
species are displaced from each other by a distance that is small compared to
the size of the total condensate. We show that in a small range of the
interparticle-interaction strength the distribution of species undergoes
dramatic changes, and exhibits a variety of different features. We demonstrate
that this behavior can be easily understood in terms of the Thomas-Fermi
approximation. This effect may be useful in experimentally determining the
values of the scattering lengths.
","[{""version"":""v1"",""created"":""Fri, 1 Feb 2002 21:09:53 GMT""}]","2009-11-07"
"cond-mat/0202026","Jaeup U. Kim","Jaeup U. Kim and Ben O'Shaughnessy (Columbia University)","Morphology Selection of Nanoparticle Dispersions by Polymer Media","8 pages, 4 figures, submitted to Phys. Rev. Lett",,"10.1103/PhysRevLett.89.238301",,"cond-mat.soft cond-mat.stat-mech physics.chem-ph",,"  Designable media can control properties of nanocomposite materials by
spatially organizing nanoparticles. Here we theoretically study particle
organization by ultrathin polymer films of grafted chains (``brushes'').
Polymer-soluble nanoparticles smaller than a brush-determined threshold
disperse in the film to a depth scaling inversely with particle volume. In the
polymer-insoluble case, aggregation is directed: provided particles are
non-wetting at the film surface, the brush stabilizes the dispersion and
selects its final morphology of giant elongated aggregates with a
brush-selected width.
","[{""version"":""v1"",""created"":""Fri, 1 Feb 2002 23:07:37 GMT""}]","2009-11-07"
"cond-mat/0202027","Jijun Zhao","Baolin Wang, Guanghou Wang, Jijun Zhao","Magic structures of helical multi-shell zirconium nanowires","14 pages, 4 figures",,"10.1103/PhysRevB.65.235406",,"cond-mat.mtrl-sci",,"  The structures of free-standing zirconium nanowires with 0.6$-$2.8 nm in
diameter are systematically studied by using genetic algorithm simulations with
a tight-binding many body potential. Several multi-shell growth sequences with
cylindrical structures are obtained. These multi-shell structures are composed
of coaxial atomic shells with the three- and four-strands helical, centered
pentagonal and hexagonal, and parallel double-chain-core curved surface
epitaxy. Under the same growth sequence, the numbers of atomic strands in
inner- and outer-shell show even-odd coupling and usually differ by five. The
size and structure dependence of angular correlation functions and vibrational
properties of zirconium nanowire are also discussed.
","[{""version"":""v1"",""created"":""Sat, 2 Feb 2002 00:19:44 GMT""}]","2009-11-07"
"cond-mat/0202028","Kaushik Matia","Kaushik Matia, Luis A. Nunes Amaral, Stephen P. Goodwin and H. Eugene
  Stanley","Non-L\'evy Distribution of Commodity Price Fluctuations","4 pages 5 figures",,,,"cond-mat.stat-mech q-fin.ST",,"  Price fluctuations of commodities like cotton and wheat are thought to
display probability distributions of returns that follow a L\'evy stable
distribution. Recent analysis of stocks and foreign exchange markets show that
the probability distributions are not L\'evy stable, a plausible result since
commodity markets have quite different features than stock markets. We analyze
daily returns of 29 commodities over typically 20 years and find that the
distributions of returns decay as power laws with exponents $\alpha$ which have
values $\alpha > 2$, outside the L\'evy-stable domain. We also find that the
amplitudes of the returns display long-range time correlations, like stocks,
while the returns themselves are uncorrelated for time lags $\approx$ 2 days,
much larger than for stocks ($\approx$ 4 min).
","[{""version"":""v1"",""created"":""Sat, 2 Feb 2002 00:26:37 GMT""}]","2008-12-02"
"cond-mat/0202029","Markus Deserno","Markus Deserno, Hans-Hennig von Grunberg","The osmotic pressure of charged colloidal suspensions: A unified
  approach to linearized Poisson-Boltzmann theory","16 pages, 5 figures, REVTeX4 style",,"10.1103/PhysRevE.66.011401",,"cond-mat.soft cond-mat.stat-mech",,"  We study theoretically the osmotic pressure of a suspension of charged
objects (e.g., colloids, polyelectrolytes, clay platelets, etc.) dialyzed
against an electrolyte solution using the cell model and linear
Poisson-Boltzmann (PB) theory. From the volume derivative of the grand
potential functional of linear theory we obtain two novel expressions for the
osmotic pressure in terms of the potential- or ion-profiles, neither of which
coincides with the expression known from nonlinear PB theory, namely, the
density of microions at the cell boundary. We show that the range of validity
of linearization depends strongly on the linearization point and proof that
expansion about the selfconsistently determined average potential is optimal in
several respects. For instance, screening inside the suspension is
automatically described by the actual ionic strength, resulting in the correct
asymptotics at high colloid concentration. Together with the analytical
solution of the linear PB equation for cell models of arbitrary dimension and
electrolyte composition explicit and very general formulas for the osmotic
pressure ensue. A comparison with nonlinear PB theory is provided. Our analysis
also shows that whether or not linear theory predicts a phase separation
depends crucially on the precise definition of the pressure, showing that an
improper choice could predict an artificial phase separation in systems as
important as DNA in physiological salt solution.
","[{""version"":""v1"",""created"":""Sat, 2 Feb 2002 00:32:07 GMT""}]","2009-11-07"
"cond-mat/0202030","Tetsuo Matsui","Ikuo Ichinose, Tetsuo Matsui","Particle-Flux Separation and Quasiexcitations in Quantum Hall Systems","4pages, 1figure","Journal of the Physical Society of Japan, Letters, 71(2002)
  1828-1831","10.1143/JPSJ.71.1828",,"cond-mat.mes-hall",,"  The quasiexcitations of quantum Hall systems at the filling factor $\nu =
p/(2pq \pm 1)$ are studied in terms of chargeon and fluxon introduced
previously as constituents of an electron at $\nu = 1/2$. At temperatures $T <
T_{\rm PFS}(\nu)$, the phenomenon so-called particle-flux separation takes
place, and chargeons and fluxons are deconfined to behave as quasiparticles.
Bose condensation of fluxons justify the (partial) cancellation of external
magnetic field. Fluxons describe correlation holes, while chargeons describe
composite fermions. They contribute to the resistivity $\rho_{xy} = h/(\nu
e^2)$ additively.
","[{""version"":""v1"",""created"":""Sat, 2 Feb 2002 02:27:06 GMT""},{""version"":""v2"",""created"":""Wed, 16 Oct 2002 19:36:03 GMT""}]","2009-11-07"
"cond-mat/0202031","A. Bharathi","A. Bharathi, S.Jemima Balaselvi, S. Kalavathi, G.L.N. Reddy, V.
  Sankara Sastry, Y.Hariharan and T.S. Radhakrishnan","Carbon solubility and superconductivity in MgB2","13 pages including figures in PDF format",,"10.1016/S0921-4534(02)01139-5",,"cond-mat.supr-con",,"  Successful replacement of B by C in the series MgB2-xCx for values of x upto
0.3 are reported. Resistivity and ac susceptibility measurements have been
carried out in the samples. Solubility of carbon, inferred from the observed
change in the lattice parameter with carbon content indicates that carbon
substitutes upto x=0.30 into the MgB2 lattice. The superconducting transition
temperature, TC measured both by zero resistivity and the onset of the
diamagnetic signal shows a systematic decrease with increase in carbon content
upto x=0.30, beyond which the volume fraction decreases drastically. The
temperature dependence of resistivity in the normal state fits to the
Bloch-Gruneisen formula for all the carbon compositions studied. The Debye
temperatures, extracted from the fit is seen to decrease with carbon content
from 900K to 525K, whereas the electron-phonon interaction parameter, obtained
from the McMillan equation using the measured TC and the Debye temperature, is
seen to increase monotonically from 0.8 in MgB2 to 0.9 in the x=0.50 sample.
The ratio of the resistivities between 300K and 40K versus TC is seen to follow
the Testardi correlation for the C substituted samples. The decrease in TC is
argued to mainly arise due to large decrease in the Debye temperature with C
concentration and a decrease in the hole density of states at N(EF).
","[{""version"":""v1"",""created"":""Sat, 2 Feb 2002 05:46:39 GMT""}]","2015-06-24"
"cond-mat/0202032","Jeong Won Kang","Jeong Won Kang and Ho Jung Hwang","Molecular Dynamics Simulations Study on Ultrathin Cu Nanowires",,"Computational Materials Science, Volume 27, Issue 3, May 2003,
  Pages 305-312",,,"cond-mat.mtrl-sci",,"  In order to understand properties of ultrathin copper nanowires, we have
simulated several copper nanowires using classical molecular dynamic
simulations. As the temperature increases, copper nanowires were transformed
into structures of the lowest surface stresses and surface energy, circular
cross-section with {111}-like surface. As thickness of copper nanowire
increases, the breaking of nanowire and the structural transition hardly
occurrs. From studies of angular correlation and radial distribution functions,
it was shown that ultrathin {111} nanowires was more stable than that of {100}
nanowires. The vibrational frequency of nanowires was different to that of bulk
about 3 THz and above 8 THz. The structural properties of cylindrical
multi-shell nanowires were greatly different from that of face centered cubic.
","[{""version"":""v1"",""created"":""Sat, 2 Feb 2002 06:34:45 GMT""}]","2007-05-23"
"cond-mat/0202033","Jeong Won Kang","Won Woo Kim, Jeong Won Kang, Tae Won Kim, Ho Jung Hwang, and Gyu Young
  Lee","Tensile testing of cylindrical multi-shell Cu nanowire",,"Journal of the Korean Physical Society Vol. 40 no. 5 pp.889-892
  May 2002",,,"cond-mat.mtrl-sci",,"  We have simulated the tensile testing of cylindrical multi-shell Cu nanowire.
Elongated cylindrical multi-shell Cu nanowire was transformed into a pentagonal
structure. Pentagonal nanowires are composed of a central atomic strand and
pentagonal tubes made of five-times-folded <110>{100} sheets.
","[{""version"":""v1"",""created"":""Sat, 2 Feb 2002 06:38:37 GMT""}]","2007-05-23"
"cond-mat/0202034","Jiunn-Yuan Lin","J.-Y. Lin, P. L. Ho, H. L. Huang, P. H. Lin, Y.-L. Zhang, R.-C. Yu,
  C.-Q. Jin, and H. D. Yang","BCS-like Superconductivity in MgCNi3","9 pages, 4 figures, 1 table; Physical Review B, in press",,"10.1103/PhysRevB.67.052501",,"cond-mat.supr-con",,"  The low-temperature specific heat C(T,H) of a new superconductor MgCNi3 has
been measured in detail. (C/gammasub_nTc=1.97 is estimated from the anomaly at
Tc. At low temperatures, the electronic contribution in the superconducting
state follows Ces/gammasub_nTc=7.96exp(-1.46Tc/T). The magnetic field
dependence of gamma(H) is found to be linear with respect to H. Tc estimated
from the McMillan formula agrees well with the observed value. All the specific
heat data appear to be consistent with each other within the moderate-coupling
BCS context. It is amazing that such a superconductor unstable to
ferromagnetism behaves so conventionally. The Debye temperature Thetasub_D=287
K and the normal state gammasub_n=33.6 mJ/mol K2 are determined for the present
sample. Discussions on the existence of a small magnetic coupling and
unconventional order parameter are also presented.
","[{""version"":""v1"",""created"":""Sat, 2 Feb 2002 06:53:21 GMT""},{""version"":""v2"",""created"":""Mon, 30 Dec 2002 04:14:56 GMT""}]","2009-11-07"
"cond-mat/0202035","Dietrich Stauffer","Dietrich Stauffer","Monte Carlo simulations of Sznajd models","Review, abstract only since full paper published",,,,"cond-mat.stat-mech",,"  The Sznajd model in less than a year has found several followers. An isolated
person does not convince others; a group of people sharing the same opinions
influences the neighbours much more easily. Thus on a square lattice, with
variables +1 (Democrats) and --1 (Republicans) on every lattice site, a pair
(or plaquette) of neighbours convinces its six (eight) nearest neighbours of
its own opinion if and only if all members of the pair (plaquette) share the
same opinion. The generalization to many possible states is used to explain the
distribution of votes among candidates in Brazilian local elections.
  Review; published in Journal of Artificial Societies and Social Simulation 5,
No. 1, paper 4 (2002), available only electronically
","[{""version"":""v1"",""created"":""Sat, 2 Feb 2002 09:01:15 GMT""}]","2007-05-23"
"gr-qc/0202002","Gil de Oliveira-Neto","G. Oliveira-Neto","Naked singularities in three-dimensions","Revtex version, 11 pages and 1 eps figure","Int.J.Mod.Phys.D12:791-800,2003","10.1142/S0218271803003335",,"gr-qc",,"  We study an analytical solution to the Einstein's equations in
2+1-dimensions, representing the self-similar collapse of a circularly
symmetric, minimally coupled, massless, scalar field. Depending on the value of
certain parameters, this solution represents the formation of naked
singularities. Since our solution is asymptotically flat, these naked
singularities may be relevant for the weak cosmic censorship conjecture in
2+1-dimensions.
","[{""version"":""v1"",""created"":""Fri, 1 Feb 2002 17:57:19 GMT""}]","2014-11-17"
"gr-qc/0202003","Marc Mars","Marc Mars, M.M. Martin-Prats, Jose M.M. Senovilla","The 2m <= r property of spherically symmetric static spacetimes","Latex, no figures","Phys.Lett. A218 (1996) 147-150","10.1016/0375-9601(96)00391-X",,"gr-qc",,"  We prove that all spherically symmetric static spacetimes which are both
regular at r=0 and satisfying the single energy condition rho + p_r + p_t >= 0
cannot contain any black hole region (equivalently, they must satisfy 2m/r <= 1
everywhere). This result holds even when the spacetime is allowed to contain a
finite number of matching hypersurfaces. This theorem generalizes a result by
Baumgarte and Rendall when the matter contents of the space-time is a perfect
fluid and also complements their results in the general non-isotropic case.
","[{""version"":""v1"",""created"":""Fri, 1 Feb 2002 17:42:42 GMT""}]","2009-11-07"
"gr-qc/0202004","Leonid V. Verozub","L.V.Verozub","Metric-Field Approach to Gravitation and the Problem of the Universe
  Acceleration","LaTex2e, 10 pages, 2 figures. To appear in the Proc.of the
  Conf.""Cosmology and Elementary particle physics"" at Coral Gables, December
  11-16,2001",,"10.1063/1.1492151",,"gr-qc",,"  A metric-field approach to gravitation is presented. It is based on an idea
of dependency of space-time properties on measuring instruments. Some bimetric
equations that realize this idea are considered. They were tested by the binary
pulsar PSR1913+16. The spherically - symmetric solution of the equations has no
event horizon and no physical singularity in the center. The proper energy of a
point particle is finite. There can exist supermassive compact configurations
of degenerated Fermi-gas which can be identified with observed objects in
galactic centers. The problem of the Universe acceleration has a natural
explanation.
","[{""version"":""v1"",""created"":""Sat, 2 Feb 2002 12:04:24 GMT""}]","2009-11-07"
