"gr-qc/0202005","Sanjay M. Wagh","Sanjay M Wagh","Mach's Principle and Spatial Scale-Invariance of Gravity","Revtex4, No figures",,,,"gr-qc",,"  Gravity does not provide any scale for matter properties. We argue that this
is also the implication of Mach's hypothesis of the relativity of inertia. The
most general spacetime compatible with this property of gravity is that
admitting three, independent spatial homothetic Killing vectors generating an
arbitrary function of each one of the three spatial coordinates. The matter
properties for such a spacetime are (spatially) arbitrary and the matter
generating the spacetime admits {\it any} equation of state. This is also the
most general spacetime containing the weak gravity physics in its entirety.
This spacetime is machian in that it is {\em globally} degenerate for
anti-machian situations such as vacuum, a single matter particle etc. and,
hence, has no meaning in the absence of matter.
","[{""version"":""v1"",""created"":""Sat, 2 Feb 2002 14:27:40 GMT""}]","2007-05-23"
"hep-ex/0202006","Elena Korolkova","LVD Collaboration","Study of single muons with the Large Volume Detector at Gran Sasso
  Laboratory","13 pages, 2 figures, accepted for publication in ""Physics of Atomic
  Nuclei""","Phys.Atom.Nucl. 66 (2003) 123-129; Yad.Fiz. 66 (2003) 125-132","10.1134/1.1540666",,"hep-ex",,"  The present study is based on the sample of about 3 mln single muons observed
by LVD at underground Gran Sasso Laboratory during 36500 live hours from June
1992 to February 1998. We have measured the muon intensity at slant depths from
3 km w.e. to 20 km w.e. Most events are high energy downward muons produced by
meson decay in the atmosphere. The analysis of these muons has revealed the
power index of pion and kaon spectrum: 2.76 \pm 0.05. The reminders are
horizontal muons produced by the neutrino interactions in the rock surrounding
LVD. The value of this flux is obtained. The results are compared with Monte
Carlo simulations and the world data.
","[{""version"":""v1"",""created"":""Fri, 1 Feb 2002 16:30:19 GMT""}]","2015-06-25"
"hep-ex/0202007","Wolfgang Lohmann","Wolfgang Lohmann","e^+e^- Physics at LEP and a Future Linear Collider",,,,"DESY 01-218","hep-ex",,"  A summary of results obtained from e^+e^- annihilations at LEP is given. The
precision measurements around the Z resonance, the results from charged gauge
boson production and searches for new particles are reviewed. Particular
emphasis is devoted to the Higgs boson. The prospects of an e^+e^- linear
collider in the energy range of about 1 TeV are discussed.
","[{""version"":""v1"",""created"":""Fri, 1 Feb 2002 20:08:14 GMT""}]","2009-09-29"
"hep-ex/0202008","Eric G. Adelberger","E. G. Adelberger (for the Eot-Wash group)","Sub-mm tests of the gravitational inverse-square law","7 pages, 2figs",,"10.1142/9789812778123_0002",,"hep-ex",,"  Sub-mm tests of the gravitational inverse-square law are interesting from
several quite different perspectives. This paper discusses work by the Eot-Wash
group performed since the publication of our initial result in February 2001.
We find no evidence for short-range Yukawa interactions. Our results provide an
upper limit of 200 micrometers on the size of the largest ``extra'' dimension,
and for the unification scenario with 2 large extra dimensions, set an upper
limit of 150 micrometers on the size of those dimensions.
","[{""version"":""v1"",""created"":""Sat, 2 Feb 2002 01:11:47 GMT""}]","2017-08-23"
"hep-ex/0202009","Takeo Higuchi","Belle collaboration: K.Abe, et al","Precise Measurement of B Meson Lifetimes with Hadronic Decay Final
  States","10 pages, 2 figures, and 1 table. (To be) published in Phys. Rev.
  Lett","Phys.Rev.Lett.88:171801,2002","10.1103/PhysRevLett.88.171801","KEK Preprint 2001-165, Belle Preprint 2002-2","hep-ex",,"  The lifetimes of the B0bar and B- mesons are extracted from 29.1/fb of data
collected with the Belle detector at the KEK B-factory. A fit to the decay
length differences of neutral and charged B meson pairs, measured in events
where one of the B mesons is fully reconstructed in several hadronic modes,
yields tau_B0bar = 1.554 +/- 0.030(stat) +/- 0.019(syst) ps, tau_B- = 1.695 +/-
0.026(stat) +/- 0.015(syst) ps, and tau_B-/tau_B0bar = 1.091 +/- 0.023(stat)
+/- 0.014(syst).
","[{""version"":""v1"",""created"":""Sat, 2 Feb 2002 05:48:18 GMT""},{""version"":""v2"",""created"":""Wed, 6 Feb 2002 12:49:07 GMT""},{""version"":""v3"",""created"":""Sat, 30 Mar 2002 08:58:48 GMT""}]","2016-08-31"
"hep-ph/0202008","Fuming Liu","F.M. Liu, J.Aichelin, M.Bleicher, H.J. Drescher, S. Ostapchenko, T.
  Pierog, K. Werner","Constraints on Models for Proton-Proton Scattering from Multi-strange
  Baryon Data","8 pages, 17 figures","Phys. Rev. D67, 034011 (2003)","10.1103/PhysRevD.67.034011",,"hep-ph",,"  The recent data on pp collisions at 158 GeV provide severe constraints on
string models: These measurements allow for the first time to determine how
color strings are formed in ultrarelativistic proton-proton collisions.
","[{""version"":""v1"",""created"":""Fri, 1 Feb 2002 19:53:22 GMT""},{""version"":""v2"",""created"":""Tue, 25 Jun 2002 18:00:39 GMT""},{""version"":""v3"",""created"":""Tue, 18 Feb 2003 10:26:52 GMT""}]","2009-11-07"
"hep-ph/0202009","Takeshi Nihei","Takeshi Nihei, Leszek Roszkowski, Roberto Ruiz de Austri","Exact Cross Sections for the Neutralino WIMP Pair-Annihilation","LaTeX, 46 pages, no figures. Several minor typographical errors
  corrected","JHEP 0203:031,2002","10.1088/1126-6708/2002/03/031",,"hep-ph",,"  We derive a full set of exact, analytic expressions for the annihilation of
the lightest neutralino pairs into all two-body tree-level final states in the
framework of minimal supersymmetry. We make no simplifying assumptions about
the neutralino nor about sfermion masses and mixings other than the absence of
explicit CP--violating terms. The expressions should be particularly useful in
computing the neutralino WIMP relic abundance without the usual approximation
of partial wave expansion.
","[{""version"":""v1"",""created"":""Sat, 2 Feb 2002 08:11:59 GMT""},{""version"":""v2"",""created"":""Wed, 8 May 2002 13:27:09 GMT""}]","2014-11-17"
"hep-th/0202003","Stefano Kovacs, Damtp","Massimo Bianchi, Michael B. Green and Stefano Kovacs","Instanton corrections to circular Wilson loops in N=4 Supersymmetric
  Yang-Mills","LaTeX, 48 pages, 1 figure","JHEP 0204 (2002) 040","10.1088/1126-6708/2002/04/040","DAMTP-2001-59, ROM2F/2001/28","hep-th",,"  It is argued that whereas supersymmetry requires the instanton contribution
to the expectation value of a straight Wilson line in the N=4 supersymmetric
SU(2) Yang-Mills theory to vanish, it is not required to vanish in the case of
a circular Wilson loop. A non-vanishing value can arise from a subtle interplay
between a divergent integral over bosonic moduli and a vanishing integral over
fermionic moduli. The one-instanton contribution to such Wilson loops is
explicitly evaluated in semi-classical approximation. The method utilizes the
symmetries of the problem to perform the integration over the bosonic and
fermionic collective coordinates of the instanton. The integral is singular for
small instantons touching the loop and is regularized by introducing a cutoff
at the boundary of the (euclidean) AdS_5 moduli space. In the case of a
circular loop a nonzero finite result is obtained when the cutoff is removed
and a perimeter divergence subtracted. This is contrasted with the case of the
straight line where the result is zero after subtraction of an identical
divergence per unit length. The linear divergence is an artifact of our non
supersymmetric regulator that deserves further consideration. The
generalization to gauge group SU(N) with arbitrary N is straightforward in the
limit of small 't Hooft coupling. The extension to strong 't Hooft coupling is
more challenging and only a qualitative discussion is given of the AdS/CFT
correspondence
","[{""version"":""v1"",""created"":""Fri, 1 Feb 2002 20:07:03 GMT""},{""version"":""v2"",""created"":""Sun, 3 Feb 2002 20:20:06 GMT""}]","2009-11-07"
"hep-th/0202010","Paolo Carta","M. Cadoni, P. Carta, S. Mignemi","Quantum dilaton gravity as a linear dilaton conformal field theory","7 pages, RevTeX4 file. v2: some comments and one reference added","Phys.Rev. D65 (2002) 104024","10.1103/PhysRevD.65.104024","INFNCA-TH0201","hep-th",,"  A model of matter-coupled gravity in two dimensions is quantized. The crucial
requirement for performing the quantization is the vanishing of the conformal
anomaly, which is achieved by tuning a parameter in the interaction potential.
The spectrum of the theory is determined by mapping the model first onto a
field theory with a Liouville interaction, then onto a linear dilaton conformal
field theory. In absence of matter fields a pure gauge theory with massless
ground state is found; otherwise it is possible to minimally couple up to 11
matter scalar fields: in this case the ground state is tachyonic and the matter
sector decouples, like the transverse oscillators in the critical bosonic
string.
","[{""version"":""v1"",""created"":""Fri, 1 Feb 2002 17:31:30 GMT""},{""version"":""v2"",""created"":""Tue, 19 Mar 2002 08:43:49 GMT""}]","2009-11-07"
"hep-th/0202011","Fernando Ruiz","F. Ruiz Ruiz","UV/IR mixing and the Goldstone theorem in noncommutative field theory","30 pages, 7 eps figures. V2: references added","Nucl.Phys. B637 (2002) 143-167","10.1016/S0550-3213(02)00447-9","UCM-FT/2002-13-0","hep-th",,"  Noncommutative IR singularities and UV/IR mixing in relation with the
Goldstone theorem for complex scalar field theory are investigated. The
classical model has two coupling constants, $\lambda_1$ and $\lambda_2$,
associated to the two noncommutative extensions
$\phi^*\star\phi\star\phi^*\star\phi$ and $\phi^*\star\phi^*\star\phi\star\phi$
of the interaction term $|\phi|^4$ on commutative spacetime. It is shown that
the symmetric phase is one-loop renormalizable for all $\lambda_1$ and
$\lambda_2$ compatible with perturbation theory, whereas the broken phase is
proved to exist at one loop only if $\lambda_2=0$, a condition required by the
Ward identities for global U(1) invariance. Explicit expressions for the
noncommutative IR singularities in the 1PI Green functions of both phases are
given. They show that UV/IR duality does not hold for any of the phases and
that the broken phase is free of quadratic noncommutative IR singularities.
More remarkably, the pion selfenergy does not have noncommutative IR
singularities at all, which proves essential to formulate the Goldstone theorem
at one loop for all values of the spacetime noncommutativity parameter
$\theta$.
","[{""version"":""v1"",""created"":""Fri, 1 Feb 2002 19:09:23 GMT""},{""version"":""v2"",""created"":""Mon, 27 May 2002 09:49:18 GMT""}]","2009-11-07"
"hep-th/0202012","David Tong","David Tong","The Moduli Space of BPS Domain Walls","16 pages, LaTex, 2 figures; factors of zeta corrected, meaning of
  cross-terms elucidated, further clarifying comments; (more) references added","Phys.Rev. D66 (2002) 025013","10.1103/PhysRevD.66.025013",,"hep-th hep-ph nlin.PS",,"  N=2 SQED with several flavors admits multiple, static BPS domain wall
solutions. We determine the explicit two-kink metric and examine the dynamics
of colliding domain walls. The multi-kink metric has a toric Kahler structure
and we reduce the Kahler potential to quadrature. In the second part of this
paper, we consider semi-local vortices compactified on circle. We argue that,
in the presence of a suitable Wilson line, the vortices separate into domain
wall constituents. These play the role of fractional instantons in
two-dimensional gauge theories and sigma-models.
","[{""version"":""v1"",""created"":""Fri, 1 Feb 2002 19:17:01 GMT""},{""version"":""v2"",""created"":""Wed, 6 Feb 2002 15:47:02 GMT""},{""version"":""v3"",""created"":""Sun, 10 Feb 2002 21:49:12 GMT""},{""version"":""v4"",""created"":""Thu, 25 Apr 2002 10:54:01 GMT""}]","2009-11-07"
"hep-th/0202013","Han-xin He","Han-xin He","Nonperturbative Fermion-Boson Vertex Function in Gauge Theories","11 pages, RevTax",,,,"hep-th",,"  The nonperturbative fermion-boson vertex function in four-dimensional Abelian
gauge theories is self-consistently and exactly derived in terms of a complete
set of normal (longitudinal) and transverse Ward-Takahashi relations for the
The nonperturbative fermion-boson vertex function in four-dimensional Abelian
gauge theories is self-consistently and exactly derived in terms of a complete
set of normal(longitudinal) and transverse Ward-Takahashi relations for the
fermion-boson and the axial-vector vertices in the case of massless fermion, in
which the possible quantum anomalies and perturbative corrections are taken
into account simultaneously. We find that this nonperturbative fermion-boson
vertex function is expressed nonperturbatively in terms of the full fermion
propagator and contains the contributions of the transverse axial anomaly and
perturbative corrections. The result that the transverse axial anomaly
contributes to the nonperturbative fermion-boson vertex arises from the
coupling between the fermion-boson and the axial-vector vertices through the
transverse Ward-Takahashi relations for them and is a consequence of gauge
invariance.
","[{""version"":""v1"",""created"":""Sat, 2 Feb 2002 07:46:29 GMT""}]","2007-05-23"
"hep-th/0202014","Corneliu Sochichiu","Corneliu Sochichiu","Gauge Invariance and Noncommutativity","45 pages, 2 figures",,,,"hep-th",,"  The role of the gauge invariance in noncommutative field theory is discussed.
A basic introduction to noncommutative geometry and noncommutative field theory
is given. Background invariant formulation of Wilson lines is proposed. Duality
symmetries relating various noncommutative gauge models are being discussed.
","[{""version"":""v1"",""created"":""Sat, 2 Feb 2002 14:27:11 GMT""}]","2007-05-23"
"math-ph/0202001","Christian Hainzl","Christian Hainzl","One non-relativistic particle coupled to a photon field","final version, to appear in Ann. Henri Poincare",,"10.1007/s00023-003-0128-6",,"math-ph math.MP",,"  We investigate the ground state energy of an electron coupled to a photon
field. First, we regard the self-energy of a free electron, which we describe
by the Pauli-Fierz Hamiltonian. We show that, in the case of small values of
the coupling constant $\alpha$, the leading order term is represented by
$2\pi^{-1} \alpha (\Lambda - \ln[1 + \Lambda])$.
  Next we put the electron in the field of an arbitrary external potential $V$,
such that the corresponding Schr\""odinger operator $p^2 + V$ has at least one
eigenvalue, and show that by coupling to the radiation field the binding energy
increases, at least for small enough values of the coupling constant $\alpha$.
Moreover, we provide concrete numbers for $\alpha$, the ultraviolet cut-off
$\Lambda$, and the radiative correction for which our procedure works.
","[{""version"":""v1"",""created"":""Fri, 1 Feb 2002 16:57:48 GMT""},{""version"":""v2"",""created"":""Tue, 28 May 2002 17:44:30 GMT""},{""version"":""v3"",""created"":""Thu, 20 Feb 2003 08:31:13 GMT""}]","2016-11-23"
"math/0202010","Drastich Stanislav","Drastich Stanislav","Rapid growth sequences","6 pages",,,,"math.GM",,"  Studying Fermat sequence we can simply find infinitely many other rapidly
growing sequences of similar properties. On the other hand this approach allows
us simple construction of such sequences.
","[{""version"":""v1"",""created"":""Fri, 1 Feb 2002 17:39:32 GMT""},{""version"":""v2"",""created"":""Sat, 2 Feb 2002 14:05:29 GMT""}]","2007-05-23"
"math/0202011","Mu-Tao Wang","Mu-Tao Wang","On graphic Bernstein type results in higher codimension",,,,,"math.DG math.AP",,"  Let \Sigma be a minimal submanifold of \R^{n+m} that can be represented as
the graph of a smooth map f:\R^n-->\R^m. We apply a formula we derived in the
study of mean curvature flow to obtain conditions under which \Sigma must be an
affine subspace. Our result covers all known ones in the general case. The
conditions are stated in terms of the singular values of $df$.
","[{""version"":""v1"",""created"":""Fri, 1 Feb 2002 16:24:19 GMT""}]","2007-05-23"
"math/0202012","Vladimir Voevodsky","Vladimir Voevodsky","Cancellation theorem",,,,,"math.AG math.AT math.KT",,"  In this paper we give a direct geometric proof of the fact that tensoring
with the Tate motive in the triangulated category of effective motives DM is a
full embedding. The main part of the proof is given in the context of schemes
of finite type over a noetherian base scheme.
","[{""version"":""v1"",""created"":""Fri, 1 Feb 2002 19:06:55 GMT""}]","2007-05-23"
"math/0202013","Martintxo Saralegi-Aranguren","M. Saralegi-Aranguren and R. Wolak","The BIC of a conial fibration","22 pages","Mat. Zametki 77(2005), 235-257 & Translation in Math. Notes(2005),
  213-231.",,,"math.DG math.AT",,"  In the paper we introduce the notions of a singular fibration and a singular
Seifert fibration. These notions are natural generalizations of the notion of a
locally trivial fibration to the category of stratified pseudomanifolds. For
singular foliations defined by such fibrations we prove a de Rham type theorem
for the basic intersection cohomology introduced the authors in a recent paper.
One of important examples of such a structure is the natural projection onto
the leaf space for the singular Riemannian foliation defined by an action of a
compact Lie group on a compact smooth manifold.
","[{""version"":""v1"",""created"":""Fri, 1 Feb 2002 23:54:31 GMT""}]","2008-01-29"
"math/0202014","Shinobu Hosono","Shinobu Hosono, Bong H. Lian, Keiji Oguiso, Shing-Tung Yau","Fourier-Mukai number of a K3 surface","AMS LaTeX, 16 pages; title changed, submitted to the proceedings of
  ""Workshop on Algebraic Structures and Moduli Spaces"" (Jul.14-20,2003 at CRM,
  Montreal)",,,,"math.AG",,"  We shall give a Counting Formula for the number of Fourier-Mukai partners of
a K3 surface and consider three applications.
","[{""version"":""v1"",""created"":""Sat, 2 Feb 2002 00:29:37 GMT""},{""version"":""v2"",""created"":""Sat, 9 Feb 2002 18:49:31 GMT""},{""version"":""v3"",""created"":""Mon, 8 Jul 2002 18:35:07 GMT""},{""version"":""v4"",""created"":""Fri, 18 Oct 2002 09:55:38 GMT""},{""version"":""v5"",""created"":""Tue, 4 Nov 2003 02:40:13 GMT""}]","2007-05-23"
"math/0202015","Piotr Chrusciel","Piotr T. Chrusciel, O. Lengard","Solutions of wave equations in the radiation regime","70 pages, latex2e, several style files, several misprints corrected,
  section ordering changed as requested by a referee, to appear in Bulletin de
  la Societe Mathematique de France",,,,"math.AP gr-qc",,"  We study the ``hyperboloidal Cauchy problem'' for linear and semi-linear wave
equations on Minkowski space-time, with initial data in weighted Sobolev spaces
allowing singular behaviour at the boundary, or with polyhomogeneous initial
data. Specifically, we consider nonlinear symmetric hyperbolic systems of a
form which includes scalar fields with a $\lambda\phi^p$ nonlinearity, as well
as wave maps, with initial data given on a hyperboloid; several of the results
proved apply to general space-times admitting conformal completions at null
infinity, as well to a large class of equations with a similar non-linearity
structure. We prove existence of solutions with controlled asymptotic
behaviour, and asymptotic expansions for solutions when the initial data have
such expansions. In particular we prove that polyhomogeneous initial data
(satisfying compatibility conditions) lead to solutions which are
polyhomogeneous at the conformal boundary Scri of the Minkowski space-time.
","[{""version"":""v1"",""created"":""Sat, 2 Feb 2002 09:14:18 GMT""},{""version"":""v2"",""created"":""Sun, 13 Jul 2003 14:32:34 GMT""}]","2007-05-23"
"math/0202016","Michele Grassi","Michele Grassi","Mirror symmetry and self-dual manifolds","22 pages",,,,"math.DG",,"  We introduce self-dual manifolds and show that they can be used to encode
mirror symmetry for affine-K\""{a}hler manifolds and for elliptic curves. Their
geometric properties, especially the link with special lagrangian fibrations
and the existence of a transformation similar to the Fourier-Mukai functor,
suggest that this approach may be able to explain mirror symmetry also in other
situations
","[{""version"":""v1"",""created"":""Sat, 2 Feb 2002 12:40:18 GMT""}]","2007-05-23"
"nlin/0202003","M. Cristina Depassier","R. D. Benguria and M. C. Depassier","Linear and nonlinear marginal stability for fronts of hyperbolic
  reaction diffusion equations","5 pages + 1 figure, Revtex file","Phys. Rev. E 66, 026607 (2002)","10.1103/PhysRevE.66.026607",,"nlin.PS",,"  We study travelling fronts of equations of the form $u_{tt} + \phi(u) u_x =
u_{xx} + f(u)$. A criterion for the transition from linear to nonlinear
marginal stability is established for positive functions $\phi(u)$ and for any
reaction term $f(u)$ for which the usual parabolic reaction diffusion equation
$u_t = u_{xx} + f(u)$ admits a front. As an application, we treat reaction
diffusion systems with transport memory.
","[{""version"":""v1"",""created"":""Fri, 1 Feb 2002 17:54:27 GMT""}]","2009-11-07"
"nlin/0202004","Jack Xin","Jack Xin (University of Texas at Austin), Yingyong Qi (Qualcomm Inc.),
  Li Deng (Microsoft Research)","Time Domain Computation of a Nonlinear Nonlocal Cochlear Model with
  Applications to Multitone Interaction in Hearing","23 pages,7 figures; added references",,"10.1121/1.4779257",,"nlin.PS",,"  A nonlinear nonlocal cochlear model of the transmission line type is studied
in order to capture the multitone interactions and resulting tonal suppression
effects. The model can serve as a module for voice signal processing, it is a
one dimensional (in space) damped dispersive nonlinear PDE based on mechanics
and phenomenology of hearing. It describes the motion of basilar membrane (BM)
in the cochlea driven by input pressure waves. Both elastic damping and
selective longitudinal fluid damping are present. The former is nonlinear and
nonlocal in BM displacement, and plays a key role in capturing tonal
interactions. The latter is active only near the exit boundary (helicotrema),
and is built in to damp out the remaining long waves. The initial boundary
value problem is numerically solved with a semi-implicit second order finite
difference method. Solutions reach a multi-frequency quasi-steady state.
Numerical results are shown on two tone suppression from both high-frequency
and low-frequency sides, consistent with known behavior of two tone
suppression. Suppression effects among three tones are demonstrated by showing
how the response magnitudes of the fixed two tones are reduced as we vary the
third tone in frequency and amplitude. We observe qualitative agreement of our
model solutions with existing cat auditory neural data. The model is thus
simple and efficient as a processing tool for voice signals.
","[{""version"":""v1"",""created"":""Fri, 1 Feb 2002 22:06:40 GMT""},{""version"":""v2"",""created"":""Wed, 27 Feb 2002 20:40:21 GMT""},{""version"":""v3"",""created"":""Fri, 20 Sep 2002 18:17:01 GMT""}]","2015-06-26"
"nlin/0202005","Srihari Keshavamurthy","Srihari Keshavamurthy, Nicholas R. Cerruti, and Steven Tomsovic","Analyzing intramolecular vibrational energy redistribution via the
  overlap intensity-level velocity correlator","16 pages, 13 figures (low resolution)",,"10.1063/1.1496471",,"nlin.CD physics.chem-ph",,"  Numerous experimental and theoretical studies have established that
intramolecular vibrational energy redistribution (IVR) in isolated molecules
has a heirarchical tier structure. The tier structure implies strong
correlations between the energy level motions of a quantum system and its
intensity-weighted spectrum. A measure, which explicitly accounts for this
correaltion, was first introduced by one of us as a sensitive probe of phase
space localization. It correlates eigenlevel velocities with the overlap
intensities between the eigenstates and some localized state of interest. A
semiclassical theory for the correlation is developed for systems that are
classically integrable and complements earlier work focusing exclusively on the
chaotic case. Application to a model two dimensional effective spectroscopic
Hamiltonian shows that the correlation measure can provide information about
the terms in the molecular Hamiltonian which play an important role in an
energy range of interest and the character of the dynamics. Moreover, the
correlation function is capable of highlighting relevant phase space structures
including the local resonance features associated with a specific bright state.
In addition to being ideally suited for multidimensional systems with a large
density of states, the measure can also be used to gain insights into the phase
space transport and localization. It is argued that the overlap intensity-level
velocity correlation function provides a novel way of studying vibrational
energy redistribution in isolated molecules. The correlation function is
ideally suited to analyzing the parametric spectra of molecules in external
fields.
","[{""version"":""v1"",""created"":""Sat, 2 Feb 2002 11:27:34 GMT""}]","2009-11-07"
