"cond-mat/0202229","Shchur Lev N.","Lev N. Shchur","On the distribution function of the information speed in computer
  network","cpcauth.cls included, 6 pages, 3 eps figures, Proceeding CCP 2001
  Aachen, to appear in Comp. Phys. Comm","Comp. Phys. Comm. 147 (2002) 595-599","10.1016/S0010-4655(02)00326-0",,"cond-mat.stat-mech cond-mat.dis-nn",,"  We review a study of the Internet traffic properties. We analyze under what
conditions the reported results could be reproduced. Relations of results of
passive measurements and those of modelling are also discussed. An example of
the first-order phase transitions in the Internet traffic is presented.
","[{""version"":""v1"",""created"":""Thu, 14 Feb 2002 07:52:59 GMT""}]","2009-11-07"
"cond-mat/0202230","Andrej Zvyagin","A.A.Zvyagin","Comment on ""Exact Spectral Functions of a Non Fermi Liquid in 1
  Dimension""","4 pages, LaTeX, corrected minor typos",,,,"cond-mat.str-el",,"  I point out the incorrect statement of the recent manuscript by K.Penc and
B.S.Shastry.
","[{""version"":""v1"",""created"":""Thu, 14 Feb 2002 10:38:58 GMT""}]","2007-05-23"
"cond-mat/0202231","Ronald Blaak","Ronald Blaak and David Dubbeldam","Regular binary thermal lattice-gases","20 pages including 9 figures in RevTex4","J. Stat. Phys. 108, 283-315 (2002)",,,"cond-mat.stat-mech",,"  We analyze the power spectrum of a regular binary thermal lattice gas in two
dimensions and derive a Landau-Placzek formula, describing the power spectrum
in the low-wavelength, low frequency domain, for both the full mixture and a
single component in the binary mixture. The theoretical results are compared
with simulations performed on this model and show a perfect agreement. The
power spectrums are found to be similar in structure as the ones obtained for
the continuous theory, in which the central peak is a complicated superposition
of entropy and concentration contributions, due to the coupling of the
fluctuations in these quantities. Spectra based on the relative difference
between both components have in general additional Brillouin peaks as a
consequence of the equipartition failure.
","[{""version"":""v1"",""created"":""Thu, 14 Feb 2002 11:15:12 GMT""}]","2007-05-23"
"cond-mat/0202232","Walter Kob","Claudio Brangian (Institute of Physics, Mainz, Germany), Walter Kob
  (Laboratoire des Verres, Montpellier, France), and Kurt Binder (Institute of
  Physics, Mainz, Germany)","Evidence against a glass transition in the 10-state short range Potts
  glass","9 pages of Latex, 4 figures",,"10.1209/epl/i2002-00140-7","KOMA-02-01","cond-mat.stat-mech cond-mat.dis-nn",,"  We present the results of Monte Carlo simulations of two different 10-state
Potts glasses with random nearest neighbor interactions on a simple cubic
lattice. In the first model the interactions come from a \pm J distribution and
in the second model from a Gaussian one, and in both cases the first two
moments of the distribution are chosen to be equal to J_0=-1 and Delta J=1. At
low temperatures the spin autocorrelation function for the \pm J model relaxes
in several steps whereas the one for the Gaussian model shows only one. In both
systems the relaxation time increases like an Arrhenius law. Unlike the
infinite range model, there are only very weak finite size effects and there is
no evidence that a dynamical or a static transition exists at a finite
temperature.
","[{""version"":""v1"",""created"":""Thu, 14 Feb 2002 11:30:40 GMT""}]","2009-11-07"
"cond-mat/0202233","Luis Carlos Malacarne","I. T. Pedron, R. S. Mendes, L. C. Malacarne, and E. K. Lenzi","Nonlinear anomalous diffusion equation and fractal dimension: Exact
  generalized gaussian solution","Latex, 6 pages. To appear in Phys. Rev. E","Phys. Rev. E 65, 041108 (2002)","10.1103/PhysRevE.65.041108",,"cond-mat.stat-mech",,"  In this work we incorporate, in a unified way, two anomalous behaviors, the
power law and stretched exponential ones, by considering the radial dependence
of the $N$-dimensional nonlinear diffusion equation $\partial\rho
/\partial{t}={\bf \nabla} \cdot (K{\bf \nabla} \rho^{\nu})-{\bf
\nabla}\cdot(\mu{\bf F} \rho)-\alpha \rho ,$ where $K=D r^{-\theta}$, $\nu$,
$\theta$, $\mu$ and $D$ are real parameters and $\alpha$ is a time-dependent
source. This equation unifies the O'Shaugnessy-Procaccia anomalous diffusion
equation on fractals ($\nu =1$) and the spherical anomalous diffusion for
porous media ($\theta=0$). An exact spherical symmetric solution of this
nonlinear Fokker-Planck equation is obtained, leading to a large class of
anomalous behaviors. Stationary solutions for this Fokker-Planck-like equation
are also discussed by introducing an effective potential.
","[{""version"":""v1"",""created"":""Thu, 14 Feb 2002 11:43:03 GMT""}]","2009-11-07"
"cond-mat/0202234","Alberto Montina","A. Montina, F. T. Arecchi","Bistability and macroscopic quantum coherence in a BEC of ^7Li","8 pages, 11 figures. e-mail: almont@ino.it","Phys. Rev. A 66, 013605 (2002)","10.1103/PhysRevA.66.013605",,"cond-mat",,"  We consider a Bose-Einstein condensate (BEC) of $^7Li$ in a situation where
the density undergoes a symmetry breaking in real space. This occurs for a
suitable number of condensed atoms in a double well potential, obtained by
adding a standing wave light field to the trap potential. Evidence of
bistability results from the solution of the Gross-Pitaevskii equation. By
second quantization, we show that the classical bistable situation is in fact a
Schr\""odinger cat (SC) and evaluate the tunneling rate between the two SC
states. The oscillation between the two states is called MQC (macroscopic
quantum coherence); we study the effects of losses on MQC.
","[{""version"":""v1"",""created"":""Thu, 14 Feb 2002 11:45:47 GMT""},{""version"":""v2"",""created"":""Tue, 19 Mar 2002 08:40:00 GMT""},{""version"":""v3"",""created"":""Mon, 12 Aug 2002 15:00:58 GMT""}]","2009-11-07"
"cond-mat/0202235","Dr. Parongama Sen","Parongama Sen and Subinay Dasgupta","Short-time scaling in the critical dynamics of an antiferromagnetic
  Ising system with conserved magnetisation","To appear in Journal of Physics A",,,,"cond-mat.stat-mech",,"  We study by Monte Carlo simulations the short-time exponent $\theta$ in an
antiferromagnetic Ising system for which the magnetisation is conserved but the
sublattice magnetisation (which is the order parameter in this case) is not.
This system belongs to the dynamic class of model C. We use nearest neighbour
Kawasaki dynamics so that the magnetisation is conserved {\em locally}. We find
that in three dimensions $\theta$ is independent of the conserved
magnetisation. This is in agreement with the available theoretical studies, but
in disagreement with previous simulation studies with global conservation
algorithm. However, we agree with both these studies regarding the result
$\theta_C \ne \theta_A$. We also find that in two dimensions, $\theta_C =
\theta_A$.
","[{""version"":""v1"",""created"":""Thu, 14 Feb 2002 12:00:20 GMT""}]","2007-05-23"
"cond-mat/0202236","Davide Marenduzzo","D. Marenduzzo, A. Maritan, F. Seno","Force-induced unfolding of a homopolymer on fractal lattice: exact
  results vs. mean field predictions","15 pages, 5 eps figures","J. Phys. A 35, L233 (2002).","10.1088/0305-4470/35/18/101",,"cond-mat.stat-mech cond-mat.soft",,"  We study the force-induced unfolding of a homopolymer on the three
dimensional Sierpinski gasket. The polymer is subject to a contact energy
between nearest neighbour sites not consecutive along the chain and to a
stretching force. The hierarchical nature of the lattice we consider allows for
an exact treatment which yields the phase diagram and the critical behaviour.
We show that for this model mean field predictions are not correct, in
particular in the exact phase diagram there is {\em not} a low temperature
reentrance and we find that the force induced unfolding transition below the
theta temperature is second order.
","[{""version"":""v1"",""created"":""Thu, 14 Feb 2002 13:41:50 GMT""}]","2009-11-07"
"cond-mat/0202237","Sigurdur I. Erlingsson","Sigurdur I. Erlingsson, Yuli V. Nazarov","Hyperfine-mediated transitions between a Zeeman split doublet in GaAs
  quantum dots: The role of the internal field","8 pages, 3 figures",,"10.1103/PhysRevB.66.155327",,"cond-mat.mes-hall",,"  We consider the hyperfine-mediated transition rate between Zeeman split spin
states of the lowest orbital level in a GaAs quantum dot. We separate the
hyperfine Hamiltonian into a part which is diagonal in the orbital states and
another one which mixes different orbitals. The diagonal part gives rise to an
effective (internal) magnetic field which, in addition to an external magnetic
field, determines the Zeeman splitting. Spin-flip transitions in the dots are
induced by the orbital mixing part accompanied by an emission of a phonon. We
evaluate the rate for different regimes of applied magnetic field and
temperature. The rates we find are bigger that the spin-orbit related rates
provided the external magnetic field is sufficiently low.
","[{""version"":""v1"",""created"":""Thu, 14 Feb 2002 14:07:41 GMT""}]","2009-11-07"
"cond-mat/0202238","Thomas Voigtmann","T. Franosch and Th. Voigtmann","Completely monotone solutions of the mode-coupling theory for mixtures",,"J. Stat. Phys. 109, 237-259 (2002)","10.1023/A:1019991729106",,"cond-mat.soft",,"  We establish that a mode-coupling approximation for the dynamics of
multi-component systems obeying Smoluchowski dynamics preserves a subtle yet
fundamental property: the matrices of partial density correlation functions are
completely monotone, i.e. they can exactly be written as superpositions of
decaying exponentials only. This statement holds, no matter what further
approximations are needed to calculate the theory's coupling parameters. The
long-time limit of these functions fulfills a maximum property, and an
iteration scheme for its numerical determination is given. We also show the
existence of a unique solution to the equations of motion for which power
series both for short times and small frequencies exist, the latter except at
special points where ergodic-to-nonergodic transitions occur. These transitions
are bifurcations that are proven to be of the cuspoid family.
","[{""version"":""v1"",""created"":""Thu, 14 Feb 2002 14:19:33 GMT""}]","2011-08-12"
"cond-mat/0202240","trambly de Laissardiere","G. Trambly de Laissardiere","Stability and electronic structure in hexagonal beta-Al9Mn3Si and
  phi-Al10Mn3 crystals","revised version with more details and new results","Phys. Rev. B 68, 045117 (2003)","10.1103/PhysRevB.68.045117",,"cond-mat.mtrl-sci cond-mat.dis-nn",,"  The electronic structures of hexagonal beta-Al9Mn3Si and phi-Al10Mn3 are
investigated through self-consistent calculations carried out using the LMTO
method. This ab-initio approach is combined with an analysis of a simplified
hamiltonian model for Al based alloys containing transition metal atoms.
Results show a strong effect on an atomic structure stabilisation by an
indirect Mn-Mn interaction mediated by conduction electrons over medium range
distances (5 Angstrom and more). Both the role and position of Si atoms are
explained as well as the origin of large vacancies which characterises these
atomic structures. As beta and phi phases are related to Al based quasicrystals
and related approximant structures, it yields arguments on the stabilisation of
such complex phases.
","[{""version"":""v1"",""created"":""Thu, 14 Feb 2002 14:49:09 GMT""},{""version"":""v2"",""created"":""Fri, 5 Jul 2002 20:21:54 GMT""}]","2013-10-02"
"cond-mat/0202241","Mikhail L. Polianski","M. L. Polianski, M. G. Vavilov, and P. W. Brouwer","Noise through Quantum Pumps","10 pages, 5 Postscript figures","Phys. Rev. B 65, 245314 (2002)","10.1103/PhysRevB.65.245314",,"cond-mat.mes-hall",,"  We study the current noise through an unbiased quantum electron pump and its
mesoscopic fluctuations for arbitrary temperatures and beyond the bilinear
response. In the bilinear regime, we find the full distributions of the noise
power and the current-to-noise ratio for a chaotic quantum dots with
single-channel and many-channel ballistic point contacts. For a dot with
many-channel point contacts we also calculate the ensemble-averaged noise at
arbitrary temperature and pumping strength. In the limit of strong pumping, a
new temperature scale appears that corresponds to the broadening of the
electron distribution function in the dot as a result of the time-dependent
perturbations.
","[{""version"":""v1"",""created"":""Thu, 14 Feb 2002 14:59:08 GMT""}]","2009-11-07"
"cond-mat/0202243","C. J. van der Beek","C.J. van der Beek, M. Konczykowski, A. Abaloshev, I. Abalosheva, P.
  Gierlowski, S. Lewandowski, M.V. Indenbom, S. Barbanera","Strong Pinning in High Temperature Superconductors","11 pages; 8 Figures; Published Phys. Rev. B 66, 024523 (2002)","PHYSICAL REVIEW B 66, 024523 (2002)","10.1103/PhysRevB.66.024523",,"cond-mat.supr-con",,"  Detailed measurements of the critical current density jc of YBa2Cu3O7 films
grown by pulsed laser deposition reveal the increase of jc as function of the
filmthickness. Both this thickness dependence and the field dependence of the
critical current are consistently described using a generalization of the
theory of strong pinning of Ovchinnikov and Ivlev [Phys. Rev. B 43, 8024
(1991)]. From the model, we deduce values of the defect density (10^21 m^-3)
and the elementary pinning force, which are in good agreement with the
generally accepted values for Y2O3-inclusions. In the absence of clear evidence
that the critical current is determined by linear defects or modulations of the
film thickness, our model provides an alternative explanation for the rather
universal field dependence of the critical current density found in YBa2Cu3O7
films deposited by different methods.
","[{""version"":""v1"",""created"":""Thu, 14 Feb 2002 15:41:19 GMT""},{""version"":""v2"",""created"":""Thu, 22 Aug 2002 09:01:30 GMT""}]","2009-11-07"
"gr-qc/0202047","Henrique P. de Oliveira","H. P. de Oliveira, A. M. Ozorio de Almeida, I. Dami\~ao Soares and E.
  V. Tonini","Homoclinic chaos in the dynamics of a general Bianchi IX model","11 pages, 6 ps figures. Accepted for publication in Phys. Rev. D","Phys.Rev. D65 (2002) 083511","10.1103/PhysRevD.65.083511",,"gr-qc",,"  The dynamics of a general Bianchi IX model with three scale factors is
examined. The matter content of the model is assumed to be comoving dust plus a
positive cosmological constant. The model presents a critical point of
saddle-center-center type in the finite region of phase space. This critical
point engenders in the phase space dynamics the topology of stable and unstable
four dimensional tubes $R \times S^3$, where $R$ is a saddle direction and
$S^3$ is the manifold of unstable periodic orbits in the center-center sector.
A general characteristic of the dynamical flow is an oscillatory mode about
orbits of an invariant plane of the dynamics which contains the critical point
and a Friedmann-Robertson-Walker (FRW) singularity. We show that a pair of
tubes (one stable, one unstable) emerging from the neighborhood of the critical
point towards the FRW singularity have homoclinic transversal crossings. The
homoclinic intersection manifold has topology $R \times S^2$ and is constituted
of homoclinic orbits which are bi-asymptotic to the $S^3$ center-center
manifold. This is an invariant signature of chaos in the model, and produces
chaotic sets in phase space. The model also presents an asymptotic DeSitter
attractor at infinity and initial conditions sets are shown to have fractal
basin boundaries connected to the escape into the DeSitter configuration
(escape into inflation), characterizing the critical point as a chaotic
scatterer.
","[{""version"":""v1"",""created"":""Thu, 14 Feb 2002 10:12:34 GMT""}]","2009-11-07"
"gr-qc/0202048","Carlos Palenzuela","C.Bona and C.Palenzuela","Explicit Gravitational Radiation in Hyperbolic Systems for Numerical
  Relativity","9 pages, no figures",,,,"gr-qc",,"  A method for studying the causal structure of space-time evolution systems is
presented. This method, based on a generalization of the well known Riemann
problem, provides intrinsic results which can be interpreted from the
geometrical point of view. A one-parameter family of hyperbolic evolution
systems is presented and the physical relevance of their characteristic speeds
and eigenfields is discussed. The two degrees of freedom corresponding to
gravitational radiation are identified in an intrinsic way, independent of the
space coordinate system. A covariant interpretation of these degrees of freedom
is provided in terms of the geometry of the wave fronts. The requirement of a
consistent geometrical interpretation of the gravitational radiation degrees of
freedom is used to solve the ordering ambiguity that arises when obtaining
first order evolution systems from the second order field equations. This
achievement provides a benchmark which can be used to check both the existing
and future first order hyperbolic formalisms for Numerical Relativity.
","[{""version"":""v1"",""created"":""Thu, 14 Feb 2002 12:20:02 GMT""},{""version"":""v2"",""created"":""Thu, 28 Feb 2002 15:18:13 GMT""}]","2007-05-23"
"gr-qc/0202049","Amir H. Abbassi","Amir H. Abbassi & Amir M. Abbassi","Relational Relativity","12 pages, no figure,published version","Apeiron,Vol.9,No.2,(April 2002)44-61 pp",,,"gr-qc",,"  According to a simple model of inertia a Machianized theory of special and
general relativity named as relational relativity is presented.
","[{""version"":""v1"",""created"":""Thu, 14 Feb 2002 14:12:27 GMT""},{""version"":""v2"",""created"":""Thu, 16 May 2002 09:34:26 GMT""}]","2007-05-23"
"hep-ex/0202028","Stephen E. Schrenk","Belle Collaboration","Observation of chi_c2 Production in B-meson Decay","5 pages with 2 figures","Phys.Rev.Lett.89:011803,2002","10.1103/PhysRevLett.89.011803","KEK Preprint 2001-171, Belle Preprint 2002-5","hep-ex",,"  We report the first observation of chi_c2 production in B-meson decays. We
find an inclusive B -> chi_c2 X branching fraction of (1.80^{+0.23}_{-0.28}+/-
0.26) 10^-3. The data set, collected with the Belle detector at the KEKB e^+e^-
collider, consists of 31.9 million B\bar B events. We also present branching
fractions and momentum spectra for both chi_c1 and chi_c2 production.
","[{""version"":""v1"",""created"":""Wed, 13 Feb 2002 17:31:43 GMT""}]","2012-08-27"
"hep-ex/0202029","Roy A. Briere","Roy A. Briere (Carnegie Mellon) (for the CLEO Collaboration)","New CLEO Results for |V_cb| and |V_ub|","To appear in the Proceedings of the 9th Int'l Symposium on Heavy
  Flavor Physics; some references updated here","AIP Conf.Proc.618:159-168,2002","10.1063/1.1478833",,"hep-ex",,"  We report recent measurements from CLEO of the first two moments of the
photon energy spectrum for b -> s gamma decays and the hadronic recoil mass in
B -> X_c l nu. These physical quantities allow one to fix non-perturbative
parameters occurring in calculations based on HQET and QCD. Predictions for
semileptonic decay rates within this same framework depend in addition on the
CKM matrix elements V_qq' governing quark mixing. We can thus extract |V_cb|
from the inclusive semileptonic decay rate of B mesons, and |V_ub| from the
lepton endpoint spectrum of B -> X_u l nu. Model dependence is reduced except
for the assumption of quark-hadron duality. Finally, we update the classic
measurement of |V_cb| from B -> D* l nu at zero recoil.
","[{""version"":""v1"",""created"":""Wed, 13 Feb 2002 18:48:58 GMT""}]","2019-08-14"
"hep-ex/0202030","Vladimir L. Rykov","R. Bellwied, D. Cinabro, V. L. Rykov","Track Timing at $e^{+}e^{-}$ Linear Colliders with a Silicon Drift
  Detector Main Tracker","10 pages, 6 figures; Reported to the Chicago Linear Collider
  Workshop, January 7-9, 2002; Submitted to NIM-A",,,,"hep-ex",,"  The track timing capabilities of a silicon drift detector based tracker for a
future linear electron-positron collider are evaluated. We show such a detector
can time tracks at the nanosecond, and for high-$P_{T}$, sub-nanosecond level.
This implies that, even for collider designs with the bunch spacing at 1.4 ns,
every track can be assigned to a particular bunch crossing at a confidence
level of up to two standard deviations. We suggest a choice for the drift axes
in the tracker layers to simultaneously optimize the momentum resolution and
track timing.
","[{""version"":""v1"",""created"":""Wed, 13 Feb 2002 20:59:17 GMT""}]","2007-05-23"
"hep-ex/0202031","Phil Burrows","Koya Abe, et al (the SLD Collaboration)","Measurement of the b-quark fragmentation function in Z0 decays","32 pages: latex and 11 figures in eps format (submitted to Physical
  Review D)","Phys.Rev.D65:092006,2002; Erratum-ibid.D66:079905,2002","10.1103/PhysRevD.65.092006 10.1103/PhysRevD.66.079905","SLAC-PUB-9087","hep-ex",,"  We present a measurement of the b-quark inclusive fragmentation function in
Z0 decays using a novel kinematic B-hadron energy reconstruction technique. The
measurement was performed using 350,000 hadronic Z0 events recorded in the SLD
experiment at SLAC between 1997 and 1998. We compared the sacled B-hadron
energy distribution with models of b-quark fragmentation and with several ad
hoc functional forms. A number of models and functions are excluded by the
data. The average scaled energy of weakly-decaying B hadrons was measured to be
<x_B>= 0.709 +-0.003 (stat) +-0.003 (syst) +-0.002 (model).
","[{""version"":""v1"",""created"":""Thu, 14 Feb 2002 09:14:07 GMT""}]","2014-11-17"
"hep-ex/0202032","Alexey Berdyugin","M.N.Achasov, S.E.Baru, K.I.Beloborodov, A.V.Berdyugin, A.V.Bozhenok,
  A.G.Bogdanchikov, D.A.Bukin, S.V.Burdin, A.V.Vasiljev, Yu.S.Velikzhanin,
  T.V.Dimova, V.P.Druzhinin, M.S.Dubrovin, D.I.Ganyushin, I.A.Gaponenko,
  V.B.Golubev, V.N.Ivanchenko, I.A.Koop, A.A.Korol, S.V.Koshuba, G.A.Kukartsev,
  E.V.Pakhtusova, A.A.Salnikov, S.I.Serednyakov, V.V.Shary, Yu.M.Shatunov,
  V.A.Sidorov, and Z.K.Silagadze","Study of the $\rho$, $\omega$, $\phi\to\eta\gamma\to 7\gamma$ Decays
  with an SND Detector on a VEPP-2M Collider","5 pages, 4 figures","JETPLett.72:282-285,2000; PismaZh.Eksp.Teor.Fiz.72:411-415,2000","10.1134/1.1328437",,"hep-ex",,"  The $e^+e^-\to\eta\gamma\to 7\gamma$ process was studied in the energy range
$2E=600\div 1060$ MeV with an SND detector on a VEPP-2M $e^+e^-$ collider. The
decay branching ratios $B(\phi\to\eta\gamma)=(1.343\pm 0.012\pm 0.055)\cdot
10^{-2}$, $B(\omega\to\eta\gamma)=(4.60\pm 0.72\pm 0.19)\cdot 10^{-4}$, and
$B(\rho\to\eta\gamma)=(2.69\pm 0.32\pm 0.16)\cdot 10^{-4}$ were measured.
","[{""version"":""v1"",""created"":""Thu, 14 Feb 2002 09:58:48 GMT""},{""version"":""v2"",""created"":""Fri, 15 Feb 2002 11:01:36 GMT""}]","2008-11-26"
"hep-lat/0202017","Ishibashi Masato","Kazuo Fujikawa, Masato Ishibashi, Hiroshi Suzuki","Ginsparg-Wilson operators and a no-go theorem","8 pages, Latex, references updated, version to appear in Phys. Lett.
  B","Phys.Lett. B538 (2002) 197-201","10.1016/S0370-2693(02)01936-6","UT-02-07, IU-MSTP/46","hep-lat hep-ph hep-th",,"  If one uses a general class of Ginsparg-Wilson operators, it is known that CP
symmetry is spoiled in chiral gauge theory for a finite lattice spacing and the
Majorana fermion is not defined in the presence of chiral symmetric Yukawa
couplings. We summarize these properties in the form of a theorem for the
general Ginsparg-Wilson relation.
","[{""version"":""v1"",""created"":""Thu, 14 Feb 2002 07:05:14 GMT""},{""version"":""v2"",""created"":""Thu, 9 May 2002 06:57:51 GMT""}]","2015-06-25"
"hep-ph/0202123","Pierpaolo Mastrolia","M. Argeri (1), P.Mastrolia (1 and 2), E. Remiddi (1 and 3) ((1) U
  Bologna, (2) U Karlsruhe, (3) INFN Bologna)","The analytic value of the sunrise self-mass with two equal masses and
  the external invariant equal to the third squared mass","11 pages, 2 figures. Added Eq. (5.20) and reference [4]","Nucl.Phys. B631 (2002) 388-400","10.1016/S0550-3213(02)00176-1","TTP-02-01","hep-ph",,"  We consider the two-loop self-mass sunrise amplitude with two equal masses
$M$ and the external invariant equal to the square of the third mass $m$ in the
usual $d$-continuous dimensional regularization. We write a second order
differential equation for the amplitude in $x=m/M$ and show as solve it in
close analytic form. As a result, all the coefficients of the Laurent expansion
in $(d-4)$ of the amplitude are expressed in terms of harmonic polylogarithms
of argument $x$ and increasing weight. As a by product, we give the explicit
analytic expressions of the value of the amplitude at $x=1$, corresponding to
the on-mass-shell sunrise amplitude in the equal mass case, up to the $(d-4)^5$
term included.
","[{""version"":""v1"",""created"":""Wed, 13 Feb 2002 18:37:59 GMT""},{""version"":""v2"",""created"":""Thu, 21 Feb 2002 10:02:18 GMT""}]","2015-06-25"
