"astro-ph/0202269","Kenji Bekki","Kenji Bekki and Masashi Chiba","Formation of the Galactic disk globular clusters in early dissipative
  minor merging","18 pages 5 figures, 2002, ApJ 566, 245",,"10.1086/337984",,"astro-ph",,"  The origin of metal-rich, highly flattened, and rapidly rotating disk
globular cluster system in the Galaxy is one of longstanding issues in the
context of the Galaxy formation. Our numerical simulations suggest a new
``two-fold'' scenario that the disk globular clusters are firstly formed in the
high-pressure, dense central region of a gas-rich dwarf galaxy, as induced
during the tidal interaction with the pre-existing, young thin disk of the
Galaxy, and then dispersed into the disk region owing to the final tidal
destruction of the merging dwarf. We also demonstrate that spatial
distribution, total number, and metallicity distribution of the clusters formed
in this minor merging depend on the mass ratio of the host to dwarf galaxy and
the orbital configuration of merging. Based on these results, we discuss
whether a minor merging event about 10 Gyr ago can explain both the Galactic
thick disk and the disk globular clusters. Several other implications for the
possible relation between the properties of disk galaxies and their disk
globular clusters are also discussed.
","[{""version"":""v1"",""created"":""Thu, 14 Feb 2002 09:10:28 GMT""}]","2009-11-07"
"astro-ph/0202270","Shardha Jogee","Shardha Jogee, Isaac Shlosman, Seppo Laine, Peter Englmaier, Johan H.
  Knapen, Nick Z. Scoville, and Christine D. Wilson","Gas Dynamics in NGC 5248: Fueling a Circumnuclear Starburst Ring of
  Super Star Clusters","Accepted by ApJ. Figures 6, 7, 8, and 13 are color jpeg files. For a
  version of the paper with high resolution figures see
  ftp://ftp.astro.caltech.edu/users/sj/astroph/n5248-p2-highres.ps.gz",,"10.1086/341196",,"astro-ph",,"  Through observations and modeling, we demonstrate how the recently discovered
large-scale bar in NGC 5248 generates spiral structure which extends from 10
kpc down to 100 pc, fuels star formation on progressively smaller scales, and
drives disk evolution. Deep inside the bar, two massive molecular spirals cover
nearly 180 degrees in azimuth, show streaming motions of 20--40 km/s and feed a
starburst ring of super star clusters at 375 pc. They also connect to two
narrow K-band spirals which delineate the UV-bright star clusters in the ring.
The data suggest that the K-band spirals are young, and the starburst has been
triggered by a bar-driven spiral density wave (SDW). The latter may even have
propagated closer to the center where a second Halpha ring and a dust spiral
are found. The molecular and HST data support a scenario where stellar winds
and supernovae efficiently clear out gas from dense star-forming regions on
timescales less than a few Myrs. We have investigated the properties of massive
CO spirals within the framework of bar-driven SDWs, incorporating the effect of
gas self-gravity. We find good agreement between the model predictions and the
observed morphology, kinematics, and pitch angle of the spirals. This
combination of observations and modeling provides the best evidence to date for
a strong dynamical coupling between the nuclear region and the surrounding
disk. It also confirms that a low central mass concentration, which may be
common in late-type galaxies, is particularly favorable to the propagation of a
bar-driven gaseous SDW deep into the central region of the galaxy, whereas a
large central mass concentration favors other processes, such as the formation
and decoupling of nuclear bars.
","[{""version"":""v1"",""created"":""Thu, 14 Feb 2002 11:44:52 GMT""},{""version"":""v2"",""created"":""Wed, 3 Apr 2002 05:18:53 GMT""}]","2009-11-07"
"astro-ph/0202271","Davide Maino","D.Maino, C.Burigana, K.M.Gorski, N.Mandolesi, M.Bersanelli","Removing 1/f noise stripes in cosmic microwave background anisotropy
  observations","10 pages, 5 figures, accepted for publication on A&A",,"10.1051/0004-6361:20020242",,"astro-ph",,"  Removal of systematic effects is crucial in present and future CMB
experiments mapping large fraction of the sky. Accurate CMB measurements ask
for multi-feed array instruments observing the sky with a redundant scanning
strategy covering the same region of the sky on different time scales and with
different detectors for a better control of systematic effects. We investigate
here the capability to suppress 1/f noise features in Time Ordered Data (TOD)
by using the destriping technique described in Maino et al. (1999), under
realistic assumptions for crossing condition between different scan circles and
sky signal fluctuations on small angular scales. We consider as working case,
Planck-LFI simulated observations with few arminutes pixel size convolved with
LFI beam resolutions. We also extend the analysis to high values of the
knee-frequency and found a residual additional noise rms ~31% larger than the
pure white noise rms at fk=1 Hz which could be a critical issue in the
extraction of the CMB angular power spectrum. Furthermore we verified that
destriping quality does not significantly depend on the receiver sensitivity
whereas it improves proportionally to the improvement of sampling rate.
Therefore given a noise level, the higher the sampling rate, the better the
destriping quality.
","[{""version"":""v1"",""created"":""Thu, 14 Feb 2002 10:08:01 GMT""}]","2009-11-07"
"astro-ph/0202272","Klaus Dolag","Klaus Dolag, Matthias Bartelmann & Harald Lesch","Evolution and structure of magnetic fields in simulated galaxy clusters","13 pages, 10 figures, accepted for publication in Astronomy and
  Astrophysics","Astron.Astrophys.348:351,1999",,,"astro-ph",,"  We use cosmological magneto-hydrodynamic simulations to study the evolution
of magnetic fields in galaxy clusters in two different cosmological models, a
standard-CDM and a $\Lambda$-CDM model. We show that the magnetic field
strength profiles closely follow the cluster density profiles outside a core
region of radius $\sim200\kpc$. The magnetic field has a correlation length of
order $50\kpc$ and reverses on scales of $\sim100\kpc$ along typical
lines-of-sight. The power spectrum of the magnetic field can well be
approximated by a steep power law with an exponent of $\sim-2.7$. The mean
magnetic field in the cluster cores grows roughly exponentially with decreasing
redshift, $B\sim10^{-2.5z} \muG$. Merger events have a pronounced effect on
magnetic field evolution, which is strongly reflected in measurable quantities
like the Faraday rotation. The field evolution in the two different cosmologies
proceeds virtually identically. All our cluster models very well reproduce
observed Faraday rotation measurements when starting with nG seed fields.
","[{""version"":""v1"",""created"":""Thu, 14 Feb 2002 12:25:31 GMT""}]","2008-11-26"
"astro-ph/0202274","Ulisse Munari","Ulisse Munari and Tomaz Zwitter","A multi-epoch spectrophotometric atlas of symbiotic stars","A&A, in press (264 pages, 3 tables, 256 figures). The spectra are
  available in electronic form from the authors. Only a sample of the whole
  paper is given here. The full text can be downloaded from
  http://ulisse.pd.astro.it/symbio-atlas/ where the spectra in electronic form
  of the 40 reference objects can be found too",,"10.1051/0004-6361:20011724",,"astro-ph",,"  A multi-epoch, absolute-fluxed spectral atlas extending from about 3200 to
9000 Ang is presented for 130 symbiotic stars, including members of the LMC,
SMC and Draco dwarf galaxies. The fluxes are accurate to better than 5% as
shown by comparison with Tycho and ground-based photometric data. The spectra
of 40 reference objects (MKK cool giant standards, Mira and Carbon stars,
planetary nebulae, white dwarfs, hot sub-dwarfs, Wolf-Rayet stars, classical
novae, VV Cep and Herbig Ae/Be objects) are provided to assist the
interpretation of symbiotic star spectra. Astrometric positions and
counterparts in astrometric catalogues are derived for all program symbiotic
stars.
","[{""version"":""v1"",""created"":""Thu, 14 Feb 2002 13:58:43 GMT""}]","2009-11-07"
"astro-ph/0202275","Gustavo Bruzual A.","A. Gustavo Bruzual","Modeling Stellar Populations in Star Clusters and Galaxies","5 pages, 8 figures, latex, macro included. To appear in Proceedings
  of the X Latin American Regional Meeting of the IAU, to be published by
  Revista Mexicana de Astronomia y Astrofisica, Conference Series, 2002",,,,"astro-ph",,"  Combining population synthesis models with simple Montecarlo simulations of
stochastic effects in the number of stars occupying sparsely populated stellar
evolutionary phases in the HRD, I show that the scatter observed in the
photometric magnitudes and colors of LMC and NGC 7252 star clusters can be
understood in the framework of current stellar evolution theory. The use of a
high resolution stellar spectral atlas in population synthesis models improves
considerably the quality of the fits to observed galaxy SEDs, making the
assignment of a spectroscopic age to stellar populations more reliable than
with low spectral resolution models.
","[{""version"":""v1"",""created"":""Thu, 14 Feb 2002 13:06:32 GMT""}]","2007-05-23"
"astro-ph/0202276","G. J. Savonije","G.J. Savonije and M.G. Witte","Tidal interaction of a rotating 1 Msun star with a binary companion","accepted for publ. in A&A, 11 pages, 6 figures",,"10.1051/0004-6361:20020237",,"astro-ph",,"  We calculate the tidal torque on a uniformly rotating 1 Msun star at various
stages of core hydrogen burning by an orbiting companion. We apply the
`traditional approximation' and solve the radial part of the tidal
perturbations by matrix inversion of the set of finite difference equations on
a very fine grid. We have identified resonances with gravity- and
quasi-toroidal modes with up to 1000 radial nodes in the more evolved stellar
models. For low forcing frequencies we find significant tidal response due to
viscous damping of inertial modes in the convective envelope of the solar-type
star. We conclude that effects due to stellar rotation (including resonance
locking) may considerably enhance the speed of tidal evolution in solar-type
stars.
","[{""version"":""v1"",""created"":""Thu, 14 Feb 2002 13:07:57 GMT""}]","2009-11-07"
"astro-ph/0202277","Ronald Elsner","Ronald F. Elsner, G. Randall Gladstone, J. Hunter Waite, Frank J.
  Crary, Robert R. Howell, Robert E. Johnson, Peter G. Ford, Albert E. Metzger,
  Kevin C. Hurley, Eric D. Feigelson, Gordon P. Garmire, Anil Bhardwaj, Denis
  C. Grodent, Tariq Majeed, Allyn F. Tennant, Martin C. Weisskop","Discovery of Soft X-Ray Emission from Io, Europa and the Io Plasma Torus","7 pages, 4 figures, accepted by The Astrophysical Journal",,"10.1086/340434",,"astro-ph",,"  We report the discovery of soft (0.25--2 keV) x-ray emission from the
Galilean satellites Io and Europa, probably Ganymede, and from the Io Plasma
Torus (IPT). Bombardment by energetic (>10 keV) H, O, and S ions from the
region of the IPT seems the likely source of the x-ray emission from the
Galilean satellites. According to our estimates, fluorescent x-ray emission
excited by solar x-rays, even during flares from the active Sun,
charge-exchange processes, previously invoked to explain Jupiter's x-ray aurora
and cometary x-ray emission, and ion stripping by dust grains fail to account
for the observed emission. On the other hand, bremsstrahlung emission of soft
X-rays from non-thermal electrons in the few hundred to few thousand eV range
may account for a substantial fraction of the observed x-ray flux from the IPT.
","[{""version"":""v1"",""created"":""Thu, 14 Feb 2002 15:24:06 GMT""}]","2009-11-07"
"astro-ph/0202278","Paola Merluzzi","G. Busarello (Osservatorio Astronomico di Capodimonte OAC -Napoli),
  Merluzzi (OAC), F. La Barbera (Universita` Federico II - Napoli), M.
  Massarotti (OAC), M. Capaccioli (Universita` Federico II - Napoli, OAC)","Optical (VRI) Photometry in the Field of the Galaxy Cluster AC 118 at
  z=0.31","15 pages, 6 figures, A&A in press",,"10.1051/0004-6361:20020624",,"astro-ph",,"  We present new photometric V-, R- and I-band data for the rich galaxy cluster
AC 118 at z=0.31. The new photometry covers an area of 8.6x8.6 arcmin$^2$,
corresponding to 2.9$\times$2.9 Mpc$^2$ (H$_0=50$ km s$^{-1}$ Mpc$^{-1}$,
q$_0=0.5$ and $\Lambda = 0$). The data have been collected for a project aimed
at studying galaxy evolution through the color-magnitude relation and the
fundamental plane. We provide a catalogue including all the sources (N = 1206)
detected in the cluster field. The galaxy sample is complete to V=22.8 mag
(N_gal=574), R=22.3 mag (N_gal=649) and I=20.8 mag (N_gal=419). We give
aperture magnitudes within a fixed aperture of 4.4 arcsec and Kron magnitudes.
We also give photometric redshifts for 459 sources for which additional U- and
K-band photometry is available. We derive and discuss the V- and R-band
luminosity functions. The catalogue, which is distributed in electronic form,
is intended as a tool for studies in galaxy evolution.
","[{""version"":""v1"",""created"":""Thu, 14 Feb 2002 15:29:47 GMT""},{""version"":""v2"",""created"":""Tue, 30 Apr 2002 09:20:14 GMT""}]","2009-11-07"
"cond-mat/0202217","Jens Siewert","Lara Faoro, Jens Siewert, and Rosario Fazio","Non-Abelian phases, charge pumping, and quantum computation with
  Josephson junctions","11 pages RevTex, 3 figures in eps format, revised version",,"10.1103/PhysRevLett.90.028301",,"cond-mat.mes-hall quant-ph",,"  Non-Abelian geometric phases can be generated and detected in certain
superconducting nanocircuits. Here we consider an example where the holonomies
are related to the adiabatic charge dynamics of the Josephson network. We
demonstrate that such a device can be applied both for adiabatic charge pumping
and as an implementation of a quantum computer.
","[{""version"":""v1"",""created"":""Wed, 13 Feb 2002 16:14:18 GMT""},{""version"":""v2"",""created"":""Fri, 27 Sep 2002 16:12:26 GMT""}]","2009-11-07"
"cond-mat/0202218","Robert Pelcovits","N. V. Priezjev and Robert A. Pelcovits","Coarsening Dynamics of Biaxial Nematic Liquid Crystals","6 pages, 4 figures Web reference added for animations:
  http://www.egr.msu.edu/~priezjev/biaxial/biaxial.html","Phys. Rev. E 66, 051705 (2002)","10.1103/PhysRevE.66.051705",,"cond-mat.soft",,"  We study the coarsening dynamics of two and three dimensional biaxial nematic
liquid crystals, using Langevin dynamics. Unlike previous work, we use a model
with no a priori relationship among the three elastic constants associated with
director deformations. We find a rich variety of coarsening behavior, including
the simulataneous decay of nearly equal populations of the three classes of
half-integer disclination lines. The behavior we observed can be understood on
the basis of the relative values of the elastic constants and the resulting
decay channels of the defects.
","[{""version"":""v1"",""created"":""Wed, 13 Feb 2002 16:40:55 GMT""},{""version"":""v2"",""created"":""Thu, 14 Feb 2002 21:09:14 GMT""}]","2009-11-07"
"cond-mat/0202219","Jaime Merino","M. Calandra (1), J. Merino (1) and Ross H. McKenzie (2)
  ((1)Max-Planck-Institut, (2)University of Queensland)","Metal-insulator transition and charge ordering in the extended Hubbard
  model at one-quarter filling","5 pages, 3 figures",,"10.1103/PhysRevB.66.195102",,"cond-mat.str-el",,"  We study with exact diagonalization the zero temperature properties of the
quarter-filled extended Hubbard model on a square lattice. We find that
increasing the ratio of the intersite Coulomb repulsion, $V$, to the band width
drives the system from a metal to a charge ordered insulator. The evolution of
the optical conductivity spectrum with increasing $V$ is compared to the
observed optical conductivity of several layered molecular crystals with the
theta and beta'' crystal structures.
","[{""version"":""v1"",""created"":""Wed, 13 Feb 2002 18:02:38 GMT""}]","2009-11-07"
"cond-mat/0202220","Philip W. Adams","D. P. Young, J. F. DiTusa, R. G. Goodrich, D. Hall, J. Anderson, S.
  Guo, Julia Y. Chan and P. W. Adams","Field Suppression of the Density-of-States: A Mechanism for Large Linear
  Magnetoresistance","4 pages, 4 figures",,,,"cond-mat.mtrl-sci cond-mat.str-el",,"  Hall, resistivity, magnetization, and thermoelectric power measurements were
performed on single crystals of the highly anisotropic layered metal LaSb2. A
100-fold linear magnetoresistance (MR) was observed in fields up to 45 T, with
no indication of saturation. We show that the MR is associated with a
magnetic-field-dependent holelike carrier density, n(H) \propto 1/H. The effect
is orbital, depending upon the component of the magnetic field normal to the
layers. At low temperature, a field of 9 T reduces the carrier density by more
than an order of magnitude.
","[{""version"":""v1"",""created"":""Wed, 13 Feb 2002 19:00:45 GMT""}]","2007-05-23"
"cond-mat/0202221","Nikulov Alexey","A.V.Nikulov","Fluctuation Effects in Mixed State of Type II Superconductor. Comparison
  of Experimental Results with Theoretical Predictions","11 pages, 1 figure, Talk presented at the NATO Advanced Research
  Workshop on Fluctuation Phenomena in High Temperature Superconductors.
  Trieste, Italy, 5-9 August, 1996","NATO ASI Series, Fluctuation Phenomena in High Temperature
  Superconductors. Ed. by M.Ausloos and A.A.Varlamov, Kluwer Academic
  Publishers, 1997, p.271-278",,,"cond-mat.supr-con",,"  Results of the investigation of fluctuation phenomena in bulk type-II
superconductors obtained in 1980 - 1984 years are compared with the analogous
results obtained at the investigation of high-Tc superconductors (HTSC). It is
shown the latter repeat in the main the results obtained before the HTSC
discovery. It was discovered in 1981 year that a sharp change of resistive
properties is observed below the second critical field, at H_{c4} < H_{c2}, in
high quality samples of type-II superconductors. The same was repeated at
investigation of high quality HTSC samples and was interpreted as vortex
lattice melting. The difference of the (H_{c2} - H_{c4}) values for low- and
high-Tc superconductors corresponds with the scaling law obtained in the lowest
Landau level approximation. The linear approximation region above H_{c2}, the
critical region and the Abrikosov state are considered. It is emphasized that
the rigorous Ami-Maki theory should be used for description of paraconductivity
in HTSC and ""dirty"" conventional superconductors. The approximation
dependencies obtained from popular Aslamasov-Larkin, Hikami-Larkin and
Lawrence-Doniac works do not have a validity region in these superconductors
with wide critical region.
","[{""version"":""v1"",""created"":""Wed, 13 Feb 2002 21:54:20 GMT""}]","2007-05-23"
"cond-mat/0202222","Emmanuel I. Rashba","Emmanuel I. Rashba","Complex impedance of a spin injecting junction","3 pages, 2 column REVTeX, to appear in Appl. Phys. Lett",,"10.1063/1.1465527",,"cond-mat.mes-hall",,"  Theory of the ac spin injection from a ferromagnetic electrode into a normal
conductor through a tunnel or Schottky contact is developed. Diffusion and
relaxation of non-equilibrium spins results in a frequency dependent complex
impedance controlled by the spin relaxation rates and the resistances involved.
Explicit expression for the impedance is presented. Experimental investigation
of the frequency dependence of the impedance should allow measuring spin
relaxation times in both conductors, their effective resistances, and also the
parameters of the contact controlling the spin injection.
","[{""version"":""v1"",""created"":""Thu, 14 Feb 2002 00:49:20 GMT""}]","2009-11-07"
"cond-mat/0202223","Kenichi Kasamatsu","Kenichi Kasamatsu, Makoto Tsubota, and Masahito Ueda","Giant hole and circular superflow in a fast rotating Bose-Einstein
  condensate","4 pages, 4 figures, revtex4","Phys.Rev.A66:053606,2002","10.1103/PhysRevA.66.053606",,"cond-mat.mes-hall",,"  A fast rotating Bose-Einstein condensate confined in a quadratic-plus-quartic
potential is found to dynamically generate a ""giant vortex"" that absorbs all
phase singularities into a central low density hole, thereby sustaining a
quasi-one-dimensional circular superflow at a supersonic speed.
","[{""version"":""v1"",""created"":""Thu, 14 Feb 2002 03:03:43 GMT""},{""version"":""v2"",""created"":""Tue, 12 Nov 2002 04:18:42 GMT""}]","2009-02-05"
"cond-mat/0202224","Tohru Kawamoto","Tohru Kawamoto and Shuji Abe","Conceptual design of nanostructures for efficient photoinduced phase
  transitions","4 pages, 3figures, accepted for publication in Appl. Phys. Lett",,"10.1063/1.1468263",,"cond-mat.mtrl-sci cond-mat.stat-mech",,"  By means of Monte Carlo simulations on a kinetic model, we demonstrate that
the efficiency of a photoinduced phase change can in general be enhanced
drastically by using a superstructure of an appropriate combination of two
components. This is due to the accelerated nucleation of converted domains in
the structural blocks relatively close to local instability. The present
mechanism provides a general guideline on the design of photocontrollable
materials with potential applications for memory and storage devices.
","[{""version"":""v1"",""created"":""Thu, 14 Feb 2002 05:19:39 GMT""}]","2009-11-07"
"cond-mat/0202225","Paulo F. Farinas","Paulo F. Farinas and Kevin S. Bedell","Orbital Zeeman effect: Signature of a massive spin wave mode in
  ferromagnetism",,,,,"cond-mat.str-el",,"  By deriving the quantum hydrodynamic equations for an isotropic single-band
ferromagnet in an arbitrary magnetic field, we find that a massive mode
recently predicted splits under the action of the field. The splitting is a
peculiarity of charged fermions and is linear in the field to leading order in
$q$ bearing resemblance to the Zeeman effect in this limit, and providing a
clear signature for the experimental observation of this mode.
","[{""version"":""v1"",""created"":""Thu, 14 Feb 2002 14:13:49 GMT""}]","2007-05-23"
"cond-mat/0202226","Su-Chan Park","Su-Chan Park, Doochul Kim, Jeong-Man Park","Derivation of continuum stochastic equations for discrete growth models","5 pages, no figure","Phys. Rev. E. 65, 015102(R) (2002)","10.1103/PhysRevE.65.015102",,"cond-mat.stat-mech",,"  We present a formalism to derive the stochastic differential equations (SDEs)
for several solid-on-solid growth models. Our formalism begins with a mapping
of the microscopic dynamics of growth models onto the particle systems with
reactions and diffusion. We then write the master equations for these
corresponding particle systems and find the SDEs for the particle densities.
Finally, by connecting the particle densities with the growth heights, we
derive the SDEs for the height variables. Applying this formalism to discrete
growth models, we find the Edwards-Wilkinson equation for the symmetric
body-centered solid-on-solid (BCSOS) model, the Kardar-Parisi-Zhang equation
for the asymmetric BCSOS model and the generalized restricted solid-on-solid
(RSOS) model, and the Villain--Lai--Das Sarma equation for the conserved RSOS
model. In addition to the consistent forms of equations for growth models, we
also obtain the coefficients associated with the SDEs.
","[{""version"":""v1"",""created"":""Thu, 14 Feb 2002 07:25:02 GMT""}]","2009-11-07"
"cond-mat/0202227","Yuh Tomio","Y. Tomio, Y. Kurihara and Y. Suzumura","Effects of Charge Ordering on Spin-Wave of Quarter-Filled
  Spin-Density-Wave States","8 pages, 11 figures","J. Phys. Soc. Jpn. 71, 1174 (2002)","10.1143/JPSJ.71.1174",,"cond-mat.str-el",,"  Spin-wave excitations of quarter-filled spin-density-wave state, which
coexists with charge ordering, have been studied for one-dimensional extended
Hubbard model with the nearest-neighbor repulsive interaction (V) and
next-nearest-neighbor one (V_2). We calculate dispersion relations for the
acoustic and optical spin-wave within the random phase approximation. Our
numerical calculation shows that energy spectrum of the acoustic branch is well
described by a simple sine function form. In the states coexisting with
charge-density-wave, the spin-wave velocity decreases with increasing V or V_2.
Our numerical result, that velocity reduces to zero in the limit of large V or
V_2, is analyzed in terms of a spin 1/2 Heisenberg model with effective
antiferromagnetic exchange interaction.
","[{""version"":""v1"",""created"":""Thu, 14 Feb 2002 07:25:59 GMT""},{""version"":""v2"",""created"":""Thu, 2 May 2002 13:08:31 GMT""}]","2009-11-07"
"cond-mat/0202228","Su-Chan Park","Su-Chan Park, Jeong-Man Park, Doochul Kim","Universality class of the restricted solid-on-solid model with hopping","13 pages, 3 figures","Phys. Rev. E 65, 036108 (2002)","10.1103/PhysRevE.65.036108",,"cond-mat.stat-mech",,"  We study the restricted solid-on-solid (RSOS) model with finite hopping
distance $l_{0}$, using both analytical and numerical methods. Analytically, we
use the hard-core bosonic field theory developed by the authors [Phys. Rev. E
{\bf 62}, 7642 (2000)] and derive the Villain-Lai-Das Sarma (VLD) equation for
the $l_{0}=\infty$ case which corresponds to the conserved RSOS (CRSOS) model
and the Kardar-Parisi-Zhang (KPZ) equation for all finite values of $l_{0}$.
Consequently, we find that the CRSOS model belongs to the VLD universality
class and the RSOS models with any finite hopping distance belong to the KPZ
universality class. There is no phase transition at a certain finite hopping
distance contrary to the previous result. We confirm the analytic results using
the Monte Carlo simulations for several values of the finite hopping distance.
","[{""version"":""v1"",""created"":""Thu, 14 Feb 2002 07:34:45 GMT""}]","2009-11-07"
