"math/0202247","Kiran S. Kedlaya","Kiran S. Kedlaya","Semistable reduction for overconvergent F-isocrystals on a curve","9 pages; v3: final journal version. To appear in Mathematical
  Research Letters","preprint; published version: Math. Res. Lett. 10 (2003), 151-159.",,,"math.NT math.AG",,"  Given a smooth affine curve X over a field k of positive characteristic, and
an overconvergent F-isocrystal on X, we prove after replacing k by a finite
purely inseparable extension, there exists a finite separable cover of X, the
pullback of the isocrystal along which extends to a log-F-isocrystal on a
smooth compactification. This resolves a weak form of the global version of a
conjecture of Crew; the proof uses the local version of the conjecture,
established separately by Andre, Mebkhout and the author.
","[{""version"":""v1"",""created"":""Sat, 23 Feb 2002 22:42:07 GMT""},{""version"":""v2"",""created"":""Sun, 5 Jan 2003 17:59:52 GMT""},{""version"":""v3"",""created"":""Sat, 24 May 2003 00:39:35 GMT""}]","2007-05-23"
"math/0202248","Daniel Ueltschi","Daniel Ueltschi","A self-avoiding walk with attractive interactions","13 pages, 4 figures","Probab. Th. Rel. Fields 124, 189-203 (2002)",,,"math.PR math-ph math.MP",,"  A self-avoiding walk with small attractive interactions is described here.
The existence of the connective constant is established, and the diffusive
behavior is proved using the method of the lace expansion.
","[{""version"":""v1"",""created"":""Sun, 24 Feb 2002 02:08:41 GMT""}]","2007-05-23"
"math/0202250","Jovan Stefanovski","J. Stefanovski and K. Trencevski","On a Class of Symplectic Similarity Transformation Matrices","submitted to ELA for publication",,,"formerly math.LA/0202250","math.RA",,"  We present a class of symplectic matrices which transform by similarity given
$2n\times 2n$ -dimensional matrix into Bunse-Gerstner form. If the given matrix
is skew-Hamiltonian, the transformation gives a solution of an antisymmetric
Riccati matrix equation, resulting from optimal control of linear systems.
","[{""version"":""v1"",""created"":""Sun, 24 Feb 2002 13:04:48 GMT""}]","2007-05-23"
"nlin/0202052","Xingang Wang","Xingang Wang, Ying Zhang, and Gang Hu","Transitions to equilibrium state in classical \phi ^{4} lattice","3 figures","Commun.Theor.Phys. 38 (2002) 157-162","10.1088/0253-6102/38/2/157",,"nlin.CD nlin.SI",,"  Statistical behavior of a classical $\phi ^{4}$ Hamiltonian lattice is
investigated from microscopic dynamics. The largest Lyapunov exponent and
entropies are considered for manifesting chaos and equipartition behaviors of
the system. It is found, for the first time, that for any large while finite
system size there exist two critical couplings for the transitions to
equipartitions, and the scaling behaviors of these lower and upper critical
couplings vs the system size is numerically obtained.
","[{""version"":""v1"",""created"":""Sun, 24 Feb 2002 03:04:24 GMT""}]","2018-01-17"
"physics/0202061","Alessandro Vesely","S. L. Vesely, A. A. Vesely","Concerning Hertz' photoelectric effect","14 pages, Latex",,,,"physics.gen-ph",,"  Experimental evidence of the photoelectric effect goes back to H. Hertz. It
occurred during the famous confirmation experiments of the Maxwellian theory.
It is commonly held however that it cannot be explained in the framework of
that theory. We are calling attention to some aspects linked with the
interpretation of that effect on which, in our opinion, it is worthwhile
reflecting.
","[{""version"":""v1"",""created"":""Sat, 23 Feb 2002 20:02:20 GMT""}]","2009-09-29"
