"hep-ph/0204148","Lianshou  Liu","Chen Gang and Liu Lianshou","A Monte Carlo Study of the Levy Stability and Multifractal Spectrum in
  e+e- collisions","8 pages, 3 figures","Chin.Phys.Lett. 19 (2002) 1271-1273",,,"hep-ph",,"  The Levy stability analysis is carried out for e+e- collisions at Z^0 mass
using Monte Carlo method. The Levy index \mu is found to be \mu=1.701 +- 0.043.
The self-similar generalized dimensions D(q) and multi-fractal spectrum
f(\alpha) are presented. The Renyi dimension D(q) decreases with increasing q.
The self-similar multi-fractal spectrum is a convex curve with a maximum at q =
0, \alpha = 1.169 +- 0.011. The right-side part of the spectrum, corresponding
to negative values of q is obtained through analytical continuation.
","[{""version"":""v1"",""created"":""Fri, 12 Apr 2002 23:21:01 GMT""}]","2007-05-23"
"hep-ph/0204149","Mauro Napsuciale","Mauro Napsuciale and Simon Rodriguez","$U_A(1)$ Symmetry Breaking and the Scalar Sector of QCD","14 pages, 2 figures","Int.J.Mod.Phys.A16:3011-3024,2001","10.1142/S0217751X01004189",,"hep-ph",,"  It is shown that most of the unusual properties of the lowest lying scalar
(and pseudoscalar) mesons can be understood, at the qualitative and
quantitative level, on the basis of the breakdown of the $U_A(1)$ symmetry
coupled to the vacuum expectation values of scalars by the spontaneous breaking
of chiral symmetry.
","[{""version"":""v1"",""created"":""Fri, 12 Apr 2002 23:56:33 GMT""}]","2009-09-24"
"hep-ph/0204151","Alexei P. Martynenko","R.N.Faustov (Scientific Council for Cybernetics RAS), A.P.Martynenko
  (Samara State University)","Pseudoscalar pole terms contributions to hadronic light-by-light
  corrections to the muonium hyperfine splitting","7 pages, REVTEX, 5 figures","Phys.Lett. B541 (2002) 135-141","10.1016/S0370-2693(02)02185-8","SSU-HEP-02/04","hep-ph",,"  The contribution of pseudoscalar pole diagrams to the hadronic light-by-light
corrections of order alpha^3 E_F to the ground state hyperfine splitting in
hydrogenic atom is calculated in the pseudoscalar pole terms approximation. The
vector dominance model for the form factor of the transition of a pseudoscalar
meson into two photons is used. With the account of new experimental data on
the cross sections sigma (e^+e^-\to \rho, \omega \to \pi^0(\eta)\gamma) in the
SND and CMD-2 experiments some other hadronic corrections to the muonium
hyperfine splitting are calculated.
","[{""version"":""v1"",""created"":""Sat, 13 Apr 2002 11:57:24 GMT""},{""version"":""v2"",""created"":""Tue, 23 Apr 2002 13:35:50 GMT""},{""version"":""v3"",""created"":""Sat, 6 Jul 2002 14:03:27 GMT""}]","2009-11-07"
"hep-ph/0204152","Georgios J. Gounaris","G.J. Gounaris and C. Le Mou\""el","The neutralino projector formalism for complex SUSY parameters","Version accepted in Phys. Rev. D. e-mail: gounaris@physics.auth.gr","Phys.Rev. D66 (2002) 055007","10.1103/PhysRevD.66.055007","THES-TP 2002/01","hep-ph",,"  We present a new formalism describing the neutralino physics in the context
of the minimal supersymmetric model (MSSM), where CP violation induced by
complex $M_1$ and $\mu$ parameters is allowed. The formalism is based on the
construction of neutralino projectors, and can be directly generalized to
non-minimal SUSY models involving any number of neutralinos. It extends a
previous work applied to the real SUSY parameter case. In MSSM, the method
allows to describe all physical observables related to a specific neutralino,
in terms of its
  CP eigenphase and three complex numbers called its ""reduced projector
elements"".
  As the experimental knowledge on the neutralino-chargino sectors will be
being accumulated, the problem of extracting the various SUSY parameters will
arise. Motivated by this, we consider various scenarios concerning the
quantities that could be first measured. Analytical disentangled expressions
determining the related SUSY parameters from them, are then derived, which also
emphasize the efficiency of the formalism.
","[{""version"":""v1"",""created"":""Sat, 13 Apr 2002 15:49:20 GMT""},{""version"":""v2"",""created"":""Fri, 12 Jul 2002 08:49:18 GMT""}]","2016-08-16"
"hep-th/0204103","Martin Kruczenski","Martin Kruczenski, Robert C. Myers, Amanda W. Peet, David J. Winters","Aspects of supertubes","25 pages, LaTeX. v2: References added, typos corrected","JHEP 0205:017,2002","10.1088/1126-6708/2002/05/017","UTPT-02-04","hep-th",,"  We find supersymmetric solutions of the D4 brane Born-Infeld action
describing D2 supertubes ending on an arbitrary curve inside a D4 brane. From
the D4 brane point of view, these are dyonic strings. We also consider various
higher dimensional extensions of the usual supertubes, involving expanded D4
and D3 brane configurations. Finally, considering the worldsheet theory for
open strings on a supertube, we show that this configuration is an exact
solution to all orders in alpha'. Further the causal structure of the
open-string metric provides new insight into the arbitrary cross-section of the
supertube solutions. From this point of view, it is similar to the arbitrary
profile that appears for certain null plane waves.
","[{""version"":""v1"",""created"":""Fri, 12 Apr 2002 19:07:13 GMT""},{""version"":""v2"",""created"":""Thu, 25 Apr 2002 20:13:53 GMT""}]","2011-07-19"
"hep-th/0204106","Tanmay Vachaspati","Levon Pogosian, Daniele A. Steer, Tanmay Vachaspati","Triplication of SU(5) monopoles","4 pages; version accepted for publication in PRL","Phys.Rev.Lett.90:061801,2003","10.1103/PhysRevLett.90.061801",,"hep-th hep-ph",,"  We investigate all spherically symmetric fundamental monopole solutions with
fixed topological charge in the SU(5) --> SU(3)xSU(2)xU(1)/Z_3xZ_2 symmetry
breaking. We find that there is three-fold replication of the monopoles. The
three copies correspond to bound states with ``monopole clouds'' arising from
the non-Abelian nature of the SU(3) factor. The triplication of monopoles could
help us understand the observed family structure of standard model particles.
","[{""version"":""v1"",""created"":""Fri, 12 Apr 2002 17:33:28 GMT""},{""version"":""v2"",""created"":""Tue, 16 Apr 2002 14:22:38 GMT""},{""version"":""v3"",""created"":""Thu, 6 Jun 2002 21:38:48 GMT""},{""version"":""v4"",""created"":""Fri, 4 Oct 2002 15:53:17 GMT""}]","2010-11-19"
"hep-th/0204108","Enrico Deotto","E.Deotto, G.Furlan, E.Gozzi","A New Supersymmetric Extension of Conformal Mechanics","11 pages, no figures","Phys.Lett. B481 (2000) 315-322","10.1016/S0370-2693(00)00493-7","DFT-TS 2000","hep-th",,"  In this paper a new supersymmetric extension of conformal mechanics is put
forward. The beauty of this extension is that all variables have a clear
geometrical meaning and the super-Hamiltonian turns out to be the
Lie-derivative of the Hamiltonian flow of standard conformal mechanics. In this
paper we also provide a supersymmetric extension of the other conformal
generators of the theory and find their ""square-roots"". The whole superalgebra
of these charges is then analyzed in details. We conclude the paper by showing
that, using superfields, a constraint can be built which provides the exact
solution of the system.
","[{""version"":""v1"",""created"":""Fri, 12 Apr 2002 23:14:31 GMT""}]","2009-11-07"
"hep-th/0204109","K. Lee","Chanju Kim (SNU), Kimyeong Lee (KIAS), Sang-Heon Yi (SNU)","Tales of D0 on D6 Branes: Matrix Mechanics of Identical Particles","a latex file, 11 page, no figure","Phys.Lett. B543 (2002) 107-114","10.1016/S0370-2693(02)02390-0","KIAS-P02022, SNUTP-02009","hep-th",,"  We investigate a class of matrix model which describes the dynamics of
identical particles in even dimentional space. We show that the degrees of
freedom after some constraints are implimented is proportional to particle
number and consist of those for positions and internal degrees. The particle
dynamics is given by the metric on the smooth moduli space. The moduli space
metric for two particles is found. The size of tightly packed $N$ particles
grows like $\sqrt{N}$. Our matrix model is related to the matrix model for
fractional quantum Hall effect, the ADHM formalism of U(1) instantons on
noncommutative space, and supersymmetric D0 branes on D6 branes with nonzero
B-field in type IIA theory.
","[{""version"":""v1"",""created"":""Sat, 13 Apr 2002 13:07:37 GMT""}]","2009-11-07"
"hep-th/0204111","K. Lee","Yoonbai Kim (SKKU) and Kimyeong Lee (KIAS)","First and Second Order Vortex Dynamics","a rev tex file, 22 pages, no figure","Phys.Rev. D66 (2002) 045016","10.1103/PhysRevD.66.045016","KIAS-P2010","hep-th",,"  The low energy dynamics of vortices in selfdual Abelian Higgs theory is of
second order in vortex velocity and characterized by the moduli space metric.
When Chern-Simons term with small coefficient is added to the theory, we show
that a term linear in vortex velocity appears and can be consistently added to
the second order expression. We provides an additional check of the first and
second order terms by studying the angular momentum in the field theory. We
briefly explore other first order term due to small background electric charge
density and also the harmonic potential well for vortices given by the moment
of inertia.
","[{""version"":""v1"",""created"":""Sat, 13 Apr 2002 14:27:21 GMT""}]","2009-11-07"
"hep-th/0204112","Shin'ichi Nojiri","Shin'ichi Nojiri and Sergei D. Odintsov","(Anti-) de Sitter Black Holes in higher derivative gravity and dual
  Conformal Field Theories","LaTeX 19 pages, misprints are corrected","Phys.Rev.D66:044012,2002","10.1103/PhysRevD.66.044012",,"hep-th",,"  Thermodynamics of five-dimensional Schwarzschild Anti-de Sitter (SAdS) and
SdS black holes in the particular model of higher derivative gravity is
considered. The free energy, mass (thermodynamical energy) and entropy are
evaluated. There exists the parameters region where BH entropy is zero or
negative. The arguments are given that corresponding BH solutions are not
stable. We also present the FRW-equations of motion of time (space)-like branes
in SAdS or SdS BH background. The properties of dual CFT are discussed and it
is shown that it has zero Casimir energy when BH entropy (effective
gravitational constant) is zero. The Cardy-Verlinde formula for CFT dual to
SAdS or SdS BH is found in the universal form.
","[{""version"":""v1"",""created"":""Sat, 13 Apr 2002 14:54:49 GMT""},{""version"":""v2"",""created"":""Fri, 19 Apr 2002 16:18:45 GMT""},{""version"":""v3"",""created"":""Wed, 1 May 2002 13:38:15 GMT""}]","2009-09-17"
"math/0204158","Martin Henk","Martin Henk","Successive Minima and Lattice Points",,,,,"math.MG",,"  The main purpose of this note is to prove an upper
  bound on the number of lattice points of a centrally symmetric
  convex body in terms of the successive minima of the body. This bound
  improves on former bounds and narrows the gap towards a lattice
  point analogue of Minkowski's second theorem on successive minima.
  Minkowski's proof of his second theorem is rather lengthy and it was
  also criticised as obscure. We present a short proof of Minkowski's
  second theorem on successive minima, which, however, is based on the
  ideas of Minkowski's proof.
","[{""version"":""v1"",""created"":""Fri, 12 Apr 2002 19:27:13 GMT""}]","2007-05-23"
"math/0204166","Manuel Pedreira Perez","Rosa Cid Manuel Pedreira","Classification of Incidence Scrolls (II)","22 pages",,,,"math.AG",,"  The aim of this paper is to obtain a classification of the scrolls in Pn
which are defined by a one-dimensional family of lines meeting a certain set of
linear spaces in Pn, a first classification for genus 0 and 1 is given in paper
[1]. These ruled surfaces are called incidence scrolls, and such an indicated
set is a base of the incidence scroll. In particular, we compute its degree and
genus. For this, we define the fundamental incidence scroll to be the scroll in
Pn formed by the lines which meet (2n-3) P{n-2}'s in general position. Then all
the others incidence scrolls will be portions of degenerate forms of this. In
this way, we can obtain all the incidence scrolls in Pn, n>2, with base in
general position.
","[{""version"":""v1"",""created"":""Fri, 12 Apr 2002 18:20:43 GMT""}]","2007-05-23"
"math/0204167","Lubomir Alexandrov","Lubomir Alexandrov (Joint Institute for Nuclear Research, LTP, Dubna)","Prime number logarithmic geometry on the plane","38 pages, 10 figures, 1 Table. Readability is improved",,,,"math.GM",,"  We found a regularity of the behavior of primes that allows to represent both
prime and natural numbers as infinite matrices with a common formation rule of
their rows. This regularity determines a new class of infinite cyclic groups
that permit the proposition a plane--spiral geometric concept of the
arithmetic.
","[{""version"":""v1"",""created"":""Fri, 12 Apr 2002 20:10:32 GMT""},{""version"":""v2"",""created"":""Wed, 17 Apr 2002 13:18:39 GMT""},{""version"":""v3"",""created"":""Tue, 31 Dec 2002 13:16:53 GMT""},{""version"":""v4"",""created"":""Thu, 2 Jan 2003 16:26:49 GMT""},{""version"":""v5"",""created"":""Fri, 14 Feb 2003 13:38:30 GMT""}]","2007-05-23"
"math/0204168","Naichung Conan Leung","Naichung Conan Leung","Geometric Aspects of Mirror Symmetry (with SYZ for Rigid CY manifolds)","To appear in the proceedings of International Congress of Chinese
  Mathematicians 2001, 47 pages",,,,"math.DG hep-th math.AG math.SG",,"  In this article we discuss the geometry of moduli spaces of (1) flat bundles
over special Lagrangian submanifolds and (2) deformed Hermitian-Yang-Mills
bundles over complex submanifolds in Calabi-Yau manifolds.
  These moduli spaces reflect the geometry of the Calabi-Yau itself like a
mirror. Strominger, Yau and Zaslow conjecture that the mirror Calabi-Yau
manifold is such a moduli space and they argue that the mirror symmetry duality
is a Fourier-Mukai transformation. We review various aspects of the mirror
symmetry conjecture and discuss a geometric approach in proving it.
  The existence of rigid Calabi-Yau manifolds poses a serious challenge to the
conjecture. The proposed mirror partners for them are higher dimensional
generalized Calabi-Yau manifolds. For example, the mirror partner for a certain
K3 surface is a cubic fourfold and its Fano variety of lines is birational to
the Hilbert scheme of two points on the K3. This hyperkahler manifold can be
interpreted as the SYZ mirror of the K3 by considering singular special
Lagrangian tori.
  We also compare the geometries between a CY and its associated generalized
CY. In particular we present a new construction of Lagrangian submanifolds.
","[{""version"":""v1"",""created"":""Fri, 12 Apr 2002 20:38:23 GMT""},{""version"":""v2"",""created"":""Mon, 29 Apr 2002 18:58:29 GMT""},{""version"":""v3"",""created"":""Fri, 28 Mar 2003 22:13:37 GMT""}]","2007-05-23"
"math/0204169","Nathalie Wahl","Nathalie Wahl","Infinite loop space structure(s) on the stable mapping class group","25 pages, 8 figures","Topology 43 (2004), 343-368",,,"math.AT math.GT",,"  Tillmann introduced two infinite loop space structures on the plus
construction of the classifying space of the stable mapping class group, each
with different computational advantages. The first one uses disjoint union on a
suitable cobordism category, whereas the second uses an operad which extends
the pair of pants multiplication (i.e. the double loop space structure
introduced by E. Y. Miller). She conjectured that these two infinite loop space
structures were equivalent, and managed to prove that the first delooping are
the same. In this paper, we resolve the conjecture by proving that the two
structures are indeed equivalent, exhibiting an explicit geometric map.
","[{""version"":""v1"",""created"":""Sat, 13 Apr 2002 01:33:30 GMT""}]","2007-05-23"
"math/0204170","Barry Brent","Barry Brent","3x+1 dynamics on rationals with fixed denominator","7 pages, AMS-TeX",,,,"math.DS math.NT",,"  We propose the existence of an infinite class of exact analogues of the 3x+1
conjecture for rational numbers with fixed denominators. For some other
denominators, there are several attracting cycles, which exhibit scaling and
covariance phenomena. We analyze these phenomena in terms of results of Bohm,
Sontacchi and Lagarias.
","[{""version"":""v1"",""created"":""Sat, 13 Apr 2002 02:04:03 GMT""}]","2007-05-23"
"math/0204171","Apoloniusz Tyszka","Apoloniusz Tyszka","The Beckman-Quarles theorem for continuous mappings from R^n to C^n","9 pages, added proofs of technical lemmas",,,,"math.MG",,"  Let \phi((x_1,...,x_n),(y_1,...,y_n))=(x_1-y_1)^2+...+(x_n-y_n)^2. We say
that f:R^n -> C^n preserves distance d>=0 if for each x,y \in R^n \phi(x,y)=d^2
implies \phi(f(x),f(y))=d^2. We prove that if x,y \in R^n (n>=3) and
|x-y|=(\sqrt{2+2/n})^k \cdot (2/n)^l (k,l are non-negative integers) then there
exists a finite set {x,y} \subseteq S(x,y) \subseteq R^n such that each
unit-distance preserving mapping from S(x,y) to C^n preserves the distance
between x and y. It implies that each continuous map from R^n to C^n (n>=3)
preserving unit distance preserves all distances.
","[{""version"":""v1"",""created"":""Sat, 13 Apr 2002 05:03:39 GMT""},{""version"":""v2"",""created"":""Tue, 16 Apr 2002 22:09:14 GMT""},{""version"":""v3"",""created"":""Wed, 24 Apr 2002 20:01:25 GMT""}]","2007-05-23"
"math/0204172","Martin Henk","Dimitrios I. Dais (University of Cyprus), Martin Henk (Technical
  University, Berlin)","On the Equations Defining Toric L.C.I. Singularities","Latex 2e, 31 pages, 3 eps figures, new version V2 (September 2002)
  with minor changes. To appear in ""Transactions of A.M.S.""",,,,"math.AG math.AC math.CO",,"  Based on Nakajima's Classification Theorem we describe the precise form of
the binomial equations which determine toric locally complete intersection
(""l.c.i'') singularities.
","[{""version"":""v1"",""created"":""Sat, 13 Apr 2002 09:21:05 GMT""},{""version"":""v2"",""created"":""Wed, 18 Sep 2002 18:19:57 GMT""}]","2007-05-23"
"math/0204173","Thomas Ward","Graham Everest, Yash Puri, Thomas Ward","Integer sequences counting periodic points",,"Journal of Integer Sequences, 5:Article 02.2.3, 2002",,,"math.NT math.DS",,"  An existing dialogue between number theory and dynamical systems is advanced.
A combinatorial device gives necessary and sufficient conditions for a sequence
of non-negative integers to count the periodic points in a dynamical system.
This is applied to study linear recurrence sequences which count periodic
points. Instances where the $p$-parts of an integer sequence themselves count
periodic points are studied. The Mersenne sequence provides one example, and
the denominators of the Bernoulli numbers provide another. The methods give a
dynamical interpretation of many classical congruences such as Euler-Fermat for
matrices, and suggest the same for the classical Kummer congruences satisfied
by the Bernoulli numbers.
","[{""version"":""v1"",""created"":""Sat, 13 Apr 2002 09:44:43 GMT""}]","2007-05-23"
"math/0204174","Thomas Ward","Manfred Einsiedler, Thomas Ward","Asymptotic geometry of non-mixing sequences",,"Ergodic Theory and Dynamical Systems, 23(1), 75-85 (2003)","10.1017/S0143385702000950",,"math.DS",,"  The exact order of mixing for zero-dimensional algebraic dynamical systems is
not entirely understood. Here non-Archimedean norms in function fields of
positive characteristic are used to exhibit an asymptotic shape in non-mixing
sequences for algebraic $Z^2$-actions. This gives a relationship between the
order of mixing and the convex hull of the defining polynomial. Using these
methods, we show that an algebraic dynamical system for which any shape of
cardinality three is mixing is mixing of order three, and for any $k\ge1$
exhibit examples that are $k$-fold mixing but not $(k+1)$-fold mixing.
","[{""version"":""v1"",""created"":""Sat, 13 Apr 2002 10:44:02 GMT""}]","2007-05-23"
"math/0204175","Yan Doumerc","Yan Doumerc","An asymptotic link between LUE and GUE and its spectral interpretation","15 pages, 1 figure",,,,"math.PR",,"  We use a matrix central-limit theorem which makes the Gaussian Unitary
Ensemble appear as a limit of the Laguerre Unitary Ensemble together with an
observation due to Johansson in order to derive new representations for the
eigenvalues of GUE. For instance, it is possible to recover the celebrated
equality in distribution between the maximal eigenvalue of GUE and a
last-passage time in some directed brownian percolation. Similar identities for
the other eigenvalues of GUE also appear.
","[{""version"":""v1"",""created"":""Sat, 13 Apr 2002 13:24:13 GMT""}]","2007-05-23"
"physics/0204034","J. D. Jackson","J. D. Jackson (Physics, UC Berkeley and LBNL)","From Lorenz to Coulomb and other explicit gauge transformations","pdf file, 30 pages, v-gauge references added, submitted for
  publication","Am.J.Phys.70:917-928,2002","10.1119/1.1491265","LBNL - 50079","physics.class-ph hep-ph math-ph math.MP",,"  The main purposes of this paper are (i) to illustrate explicitly by a number
of examples the gauge functions chi(x, t) whose spatial and temporal
derivatives transform one set of electromagnetic potentials into another
equivalent set; and (ii) to show that, whatever propagation or non-propagation
characteristics are exhibited by the potentials in a particular gauge, the
electric and magnetic fields are always the same and display the experimentally
verified properties of causality and propagation at the speed of light. The
example of the transformation from the Lorenz gauge (retarded solutions for
both scalar and vector potential) to the Coulomb gauge (instantaneous,
action-at-a-distance, scalar potential) is treated in detail. A transparent
expression is obtained for the vector potential in the Coulomb gauge, with a
finite nonlocality in time replacing the expected spatial nonlocality of the
transverse current. A class of gauges (v-gauge) is described in which the
scalar potential propagates at an arbitrary speed v relative to the speed of
light. The Lorenz and Coulomb gauges are special cases of the v-gauge. The last
examples of gauges and explicit gauge transformation functions are the
Hamiltonian or temporal gauge, the nonrelativistic Poincare or multipolar
gauge, and the relativistic Fock-Schwinger gauge.
","[{""version"":""v1"",""created"":""Fri, 12 Apr 2002 17:52:29 GMT""},{""version"":""v2"",""created"":""Wed, 17 Apr 2002 18:15:01 GMT""}]","2008-11-26"
"physics/0204035","Jacques Gabarro-Arpa","Jacques Gabarro-Arpa","A central partition of molecular conformational space. I. Basic
  structures",,"Computational Biology and Chemistry 27, 153-159 (2003)",,,"physics.comp-ph physics.bio-ph physics.chem-ph",,"  On the basis of empirical evidence from molecular dynamics simulations,
molecular conformational space can be described by means of a partition of
central conical regions characterized by the dominance relations between
cartesian coordinates. This work presents a geometric and combinatorial
description of this structure.
","[{""version"":""v1"",""created"":""Fri, 12 Apr 2002 20:06:12 GMT""}]","2008-12-14"
"quant-ph/0204070","XuBo Zou","XuBo Zou, K. Pahlke and W. Mathis","Generation of two-mode nonclassical states and a quantum phase gate
  operation in trapped ion cavity QED","to appear in PRA",,"10.1103/PhysRevA.65.064303",,"quant-ph",,"  We propose a scheme to generate nonclassical states of a quantum system,
which is composed of the one-dimensional trapped ion motion and a single cavity
field mode. We show that two-mode SU(2) Schr\""odinger-cat states, entangled
coherent states, two-mode squeezed vacuum states and their superposition can be
generated. If the vibration mode and the cavity mode are used to represent
separately a qubit, a quantum phase gate can be implemented.
","[{""version"":""v1"",""created"":""Sat, 13 Apr 2002 13:13:59 GMT""}]","2009-11-07"
