"cond-mat/0204286","Natalya A. Zimbovskaya","Natalya Zimbovskaya and Godfrey Gumbs","Long-Range Electron Transfer and Electronic Transport Through
  Macromolecules","4 pages, 2 figures, text edded","Appl. Phys. Lett., vol. 81, 1518-1520 (2002)","10.1063/1.1502004",,"cond-mat.soft",,"  A theory of electrical transport through molecular wires is used to estimate
the electronic factor in the intramolecular electron transfer (ET) in
porphyrin-nitrobenzene supermolecules, and to analyze its structure. The chosen
molecules have complex donor and acceptor configurations, and relatively simple
structure of the bridge, which enables us to concentrate our studies on the
donor/acceptor coupling to the bridge. We present analytical and numerical
results concerning the effect of donor/acceptor coupling to the bridge on the
ET process in molecules with complex donor/acceptor subsystems.
  PACS 05.60.Gg, 36.20.-r
","[{""version"":""v1"",""created"":""Fri, 12 Apr 2002 22:53:02 GMT""},{""version"":""v2"",""created"":""Sun, 22 May 2005 22:29:56 GMT""}]","2007-05-23"
"cond-mat/0204287","Alex Rimberg","W. Lu, K. D. Maranowski and A. J. Rimberg","Superconducting Single-Electron Transistor in a Locally Tunable
  Electromagnetic Environment: Dissipation and Charge Fluctuations",,,,,"cond-mat.mes-hall cond-mat.supr-con",,"  We have developed a novel system consisting of a superconducting
single-electron transistor (S-SET) coupled to a two-dimensional electron gas
(2DEG), for which the dissipation can be tuned in the immediate vicinity of the
S-SET. Within linear response, the S-SET conductance varies nonmonotonically
with increasing 2DEG impedance. We find good agreement between our experimental
results and a model incorporating electromagnetic fluctuations in both the
S-SET leads and the 2DEG, as well as low-frequency switching of the S-SET
offset charge.
","[{""version"":""v1"",""created"":""Fri, 12 Apr 2002 22:17:59 GMT""}]","2007-05-23"
"cond-mat/0204288","Jairo Sinova","Jairo Sinova, A.H. MacDonald, and S. M. Girvin","Disorder and interactions in quantum Hall ferromagnets: effects of
  disorder in Skyrmion physics","3 pages, 3 figures, proceedings for EP2DS-14, Prague 2001","Physica E 12, 16 (2002)","10.1016/S1386-9477(01)00263-6",,"cond-mat.mes-hall",,"  We present a Hartree-Fock study of the competition between disorder and
interactions in quantum Hall ferromagnets near $\nu=1$. We find that the ground
state at $\nu=1$ evolves with increasing interaction strength from a
quasi-metallic paramagnet, to a partially spin-polarized ferromagnetic Anderson
insulator, and to a fully spin-polarized ferromagnet with a charge gap. Away
from $\nu=1$, the ground state evolves from a conventional Anderson insulator,
to a conventional quasiparticle glass, and finally to a ferromagnetic Skyrmion
quasiparticle glass. These different regimes can be measured in low-temperature
transport and NMR experiments. We present calculations for the NMR spectra in
different disorder regimes.
","[{""version"":""v1"",""created"":""Fri, 12 Apr 2002 22:28:28 GMT""}]","2009-11-07"
"cond-mat/0204289","Brouet","V. Brouet, H. Alloul, S. Garaj, L. Forro","Gaps and excitations in fullerides with partially filled bands : NMR
  study of Na2C60 and K4C60","12 pages, 13 figures",,"10.1103/PhysRevB.66.155122",,"cond-mat.str-el",,"  We present an NMR study of Na2C60 and K4C60, two compounds that are related
by electron-hole symmetry in the C60 triply degenerate conduction band. In both
systems, it is known that NMR spin-lattice relaxation rate (1/T1) measurements
detect a gap in the electronic structure, most likely related to
singlet-triplet excitations of the Jahn-Teller distorted (JTD) C60^{2-} or
C60^{4-}. However, the extended temperature range of the measurements presented
here (10 K to 700 K) allows to reveal deviations with respect to this general
trend, both at high and low temperatures. Above room temperature, 1/T1 deviates
from the activated law that one would expect from the presence of the gap and
saturates. In the same temperature range, a lowering of symmetry is detected in
Na2C60 by the appearance of quadrupole effects on the 23Na spectra. In K4C60,
modifications of the 13C spectra lineshapes also indicate a structural
modification. We discuss this high temperature deviation in terms of a coupling
between JTD and local symmetry. At low temperatures, 1/T$_1$T tends to a
constant value for Na2C60, both for 13C and 23Na NMR. This indicates a residual
metallic character, which emphasizes the proximity of metallic and insulting
behaviors in alkali fullerides.
","[{""version"":""v1"",""created"":""Fri, 12 Apr 2002 22:40:26 GMT""}]","2009-11-07"
"cond-mat/0204290","Natalya A. Zimbovskaya","Natalya A.Zimbovskaya, Godfrey Gumbs and Joseph L. Birman","Theory of the dc Magnetotransport in Laterally Modulated Quantum Hall
  Systems Near Filling $\nu={1/2}$","8 pages, 1 figure, text added","Int. J. of Mod. Phys. B, vol. 18, N 10 & 11 (2004) 1581-1594",,,"cond-mat.mes-hall cond-mat.str-el",,"  A quasiclassical theory for dc magnetotransport in a modulated quantum Hall
system near filling factor $\nu={1/2}$ is presented. A weak one-dimensional
electrostatic potential acts on the two-dimensional electron gas. Closed form
analytic expressions are obtained for the resistivity $\rho_\perp$
corresponding to a current at right angles to the direction of the modulation
lines as well as a smaller component $\rho_{||}$ for a current along the
direction of the modulation lines. It is shown that both resistivity components
are affected by the presence of the modulation. Numerical results are presented
for $\rho_\perp$ and $\rho_{||}$ and show reasonable agreement with the results
of recent experiments.
","[{""version"":""v1"",""created"":""Fri, 12 Apr 2002 23:25:21 GMT""},{""version"":""v2"",""created"":""Thu, 19 May 2005 20:20:04 GMT""}]","2007-05-23"
"cond-mat/0204291","Brouet","V. Brouet, H. Alloul, L. Forro","Coexistence of spin-singlets and metallic behavior in simple cubic CsC60","9 pages, 10 figures",,"10.1103/PhysRevB.66.155123",,"cond-mat.str-el",,"  We present a detailed NMR study of simple cubic CsC60, the only metallic
cubic fullerides known so far besides A3C60. 133Cs NMR signals the presence of
about 12 to 15% of ``anomalous'' C60 balls, characterized by a 15 meV gap. We
present different experimental observations supporting the idea that a
spin-singlet (i.e. a C60^{2-}) is localized on these latter balls and
stabilized by a JTD. A splitting of the 133Cs spectrum into three different
lines, with distinct electronic environments, is observed which emerges
naturally from such a situation. Quadrupole effects on 133Cs confirm an
inhomogeneous distribution of the charge between C60 molecules. Analysis of the
relative intensities of the 133Cs lines show that the spin-singlets do not form
clusters at the local scale, but are diluted within the lattice. This is
probably to avoid the occurrence of neighboring C60^{2-} and minimize
electrostatic repulsion between these balls. Through spin-lattice relaxation
measurements, we detect chemical exchange between the Cs sites above 100 K.
  From this, we deduce that the lifetime of a spin-singlet on a given ball
decreases exponentially with increasing temperature (from 15 sec at 100 K to 3
ms at 130 K). The implications of the presence of such spin-singlets for the
nature of the metallic state is discussed, in relation with a decrease of 1/T1T
for 13C at low temperatures, which would be anomalous for a simple metal.
","[{""version"":""v1"",""created"":""Fri, 12 Apr 2002 23:56:44 GMT""}]","2009-11-07"
"cond-mat/0204292","Brouet","V. Brouet, H. Alloul, S. Garaj, L. Forro","Persistence of molecular excitations in metallic fullerides and their
  role in a possible metal to insulator transition at high temperatures","10 pages, 7 figures",,"10.1103/PhysRevB.66.155124",,"cond-mat.str-el",,"  We present 13C NMR spin-lattice relaxation measurements (1/T1) in Na2CsC60
and Rb3C60 from 10 to 700K. The large temperature range of this measurement
allow to define unambiguously an increase of 1/T1T with increasing temperature,
which is anomalous in a simple metallic picture, where the Korringa law
predicts 1/T1T = cst. We attribute this increase to the existence of an
additional relaxation channel related to singlet-triplet (ST) excitations of
Jahn-Teller distorted C60^{2-} and C60^{4-}. These units are formed within the
metal on very short time scales (10^{-14} sec) that do not imply static charge
segregation. We show that the amplitude of the ST component depends directly on
the density of states, which indicates an interplay between metallic and
molecular excitations. Such an interaction is also revealed by the high
temperature behavior of Na2CsC60 and CsC60, that we then discuss. A divergence
between the behaviors of 1/T1, the NMR shift and the ESR susceptibility is
interpreted as the result of a rapid increase of the lifetime of the charge
carriers, signaling a tendency to charge localization. In our analysis, the
particular stability of C60^{2n-} is then a common feature of all known
metallic fullerides and allow to reconcile apparently contradicting properties
of these systems.
","[{""version"":""v1"",""created"":""Sat, 13 Apr 2002 00:06:15 GMT""}]","2009-11-07"
"cond-mat/0204293","Charles Stafford","C. A. Stafford","Metal Nanowires: Quantum Transport, Cohesion, and Stability","8 pages, 5 postscript figures, lectures given at Pan-American
  Advanced Studies Institute on Physics and Technology at the Nanometer Scale","Phys. Stat. Sol. (b), vol. 230, p. 481 (2002)","10.1002/1521-3951(200204)230:2<481::AID-PSSB481>3.0.CO;2-M",,"cond-mat.mes-hall cond-mat.mtrl-sci",,"  Metal nanowires exhibit a number of interesting properties: their electrical
conductance is quantized, their shot-noise is suppressed by the Pauli
principle, and they are remarkably strong and stable. We show that many of
these properties can be understood quantitatively using a nanoscale
generalization of the free-electron model. Possible technological applications
of nanowires are also discussed.
","[{""version"":""v1"",""created"":""Sat, 13 Apr 2002 05:21:13 GMT""}]","2015-06-24"
"cond-mat/0204294","Szymanska Marzena Hanna","M H Szymanska","Bose Condensation and Lasing in Optical Microstructures - Part 1","PhD thesis (Part 1), Cambridge University, October 2001",,,,"cond-mat quant-ph",,"  In the first part of this thesis I study the intermediate regime between
ordinary lasing and a BEC of exciton polaritons. I take into account the
fermionic structure of polaritons, treating the excitons as two-level systems
coupled to a single mode in a microcavity. I introduce decoherence and
dissipation processes to this system. Employing many-body Green function
techniques, similar to those used by Abrikosov and Gor'kov in their theory of
gapless superconductivity, I provide a mathematical structure that unifies
models of lasers with models of condensates. This allows me to study the
stability of the polariton condensate with respect to decoherence processes and
the crossover between the polariton condensate and the laser. I give detailed
indications of a regime in which the condensate should be observed to guide
experimental work and show how to distinguish the Bose condensate from a laser.
  The second part of this thesis is concerned with properties of excitons and
modelling of excitonic lasing in quasi-one-dimensional quantum wires. I develop
a very general numerical method of calculating the properties of wires with
different shapes and materials. Using this method I study the properties of
very wide range of T-shaped quantum wires.
","[{""version"":""v1"",""created"":""Sat, 13 Apr 2002 11:28:03 GMT""}]","2007-05-23"
"cond-mat/0204295","Hans-Christian v. Bothmer","Hans-Christian v. Bothmer, Christian Meister","Predicting critical crashes? A new restriction for the free variables","10 pages; 5 figures; AMSlatex. Author-supplied PDF file with high
  quality graphics is available at http://btm8x5.mat.uni-bayreuth.de/~bothmer/","Physica A, 320C (2003), 539-547","10.1016/S0378-4371(02)01535-2",,"cond-mat.stat-mech q-fin.ST",,"  Several authors have noticed the signature of log-periodic oscillations prior
to large stock market crashes [cond-mat/9509033, cond-mat/9510036, Vandewalle
et al 1998]. Unfortunately good fits of the corresponding equation to stock
market prices are also observed in quiet times. To refine the method several
approaches have been suggested:
  1) Logarithmic Divergence: Regard the limit where the critical exponent \beta
converges to 0.
  2) Universality: Define typical ranges for the free parameters, by observing
the best fit for historic crashes.
  We suggest a new approach. From the observation that the hazard-rate in
cond-mat/9510036 has to be a positive number, we get an inequality among the
free variables of the equation for stock-market prices.
  Checking 88 years of Dow-Jones-Data for best fits, we find that 25% of those
that satisfy our inequality, occur less than one year before a crash. We
compare this with other methods of crash prediction, i.p. the universality
method of Johansen et al., which are followed by a crash in only 9% of the
cases.
  Combining the two approaches we obtain a method whose predictions are
followed by crashes in 54% of the cases.
","[{""version"":""v1"",""created"":""Sat, 13 Apr 2002 14:02:23 GMT""}]","2009-11-07"
"cond-mat/0204296","Fa-Min Liu","Fa-Min Liu, Tian-Min Wang, Li-De Zhang, Guo-Hua Li, He-Xiang Han","Excitonic Photoluminescence properties of nanocrystalline GaSb and
  Ga0.62In0.38Sb embedded in silica films","20 pages, 7 figures Submitted to Journal of Luminescence",,"10.1016/S0022-2313(02)00346-0",,"cond-mat.mtrl-sci",,"  The GaSb and Ga0.62In0.38Sb nanocrystals were embedded in the SiO2 films by
radio-frequency magnetron co-sputtering and were grown on GaSb and Si
substrates at different temperatures. We present results on the 10K excitonic
photoluminescence (PL) properties of nanocrystalline GaSb and Ga0.62In0.38Sb as
a function of their size. The measurements show that the PL of the GaSb and
Ga0.62In0.38Sb nanocrystallites follows the quantum confinement model very
closely. By using deconvolution of PL spectra, origins of structures in
photoluminescence were identified.
","[{""version"":""v1"",""created"":""Sat, 13 Apr 2002 14:24:48 GMT""}]","2009-11-07"
"cs/0204031","Yi-Dong Shen","Yi-Dong Shen, Jia-Huai You, Li-Yan Yuan, Samuel S. P. Shen and Qiang
  Yang","A Dynamic Approach to Characterizing Termination of General Logic
  Programs","To appear in ACM TOCL","ACM Transactions on Computational Logic 4(4):417-430, 2003",,,"cs.LO cs.PL",,"  We present a new characterization of termination of general logic programs.
Most existing termination analysis approaches rely on some static information
about the structure of the source code of a logic program, such as modes/types,
norms/level mappings, models/interargument relations, and the like. We propose
a dynamic approach which employs some key dynamic features of an infinite
(generalized) SLDNF-derivation, such as repetition of selected subgoals and
recursive increase in term size. We also introduce a new formulation of
SLDNF-trees, called generalized SLDNF-trees. Generalized SLDNF-trees deal with
negative subgoals in the same way as Prolog and exist for any general logic
programs.
","[{""version"":""v1"",""created"":""Fri, 12 Apr 2002 18:01:32 GMT""}]","2007-05-23"
"gr-qc/0204046","Maria da Conceicao Bento","M.C. Bento, O. Bertolami and A.A. Sen","Supergravity Inflation on the Brane","6 pages, 1 figure, to appear in Phys. Rev. D","Phys.Rev. D67 (2003) 023504","10.1103/PhysRevD.67.023504",,"gr-qc astro-ph hep-ph",,"  We study N=1 Supergravity inflation in the context of the braneworld
scenario. Particular attention is paid to the problem of the onset of inflation
at sub-Planckian field values and the ensued inflationary observables. We find
that the so-called $\eta$-problem encountered in supergravity inspired
inflationary models can be solved in the context of the braneworld scenario,
for some range of the parameters involved. Furthermore, we obtain an upper
bound on the scale of the fifth dimension, $M_5 \lsim 10^{-3} M_P$, in case the
inflationary potential is quadratic in the inflaton field, $\phi$. If the
inflationary potential is cubic in $\phi$, consistency with observational data
requires that $M_5 \simeq 9.2 \times 10^{-4} M_P$.
","[{""version"":""v1"",""created"":""Fri, 12 Apr 2002 17:49:38 GMT""},{""version"":""v2"",""created"":""Mon, 25 Nov 2002 15:23:05 GMT""}]","2009-11-07"
"hep-ex/0204018","Carla Gobel","E791 Collaboration","Dalitz Plot Analysis of the Decay D^+ --> K^- pi^+ pi^+ and Indication
  of a Low-Mass Scalar K pi Resonance","Accepted for publication in Physical Review Letters","Phys.Rev.Lett.89:121801,2002","10.1103/PhysRevLett.89.121801",,"hep-ex hep-ph",,"  We study the Dalitz plot of the decay D^+ --> K^- pi^+ pi^+ with a sample of
15090 events from Fermilab experiment E791. Modeling the decay amplitude as the
coherent sum of known K pi resonances and a uniform nonresonant term, we do not
obtain an acceptable fit. If we allow the mass and width of the K^*_0(1430) to
float, we obtain values consistent with those from PDG but the chi^2 per degree
of freedom of the fit is still unsatisfactory. A good fit is found when we
allow for the presence of an additional scalar resonance, with mass 797 +/- 19
+/- 43 MeV/c^2 and width 410 +/- 43 +/- 87 MeV/c^2. The mass and width of the
K^*_0(1430) become 1459 +/- 7 +/- 5 MeV/c^2 and 175 +/- 12 +/- 12 MeV/c^2,
respectively. Our results provide new information on the scalar sector in
hadron spectroscopy.
","[{""version"":""v1"",""created"":""Fri, 12 Apr 2002 19:00:00 GMT""},{""version"":""v2"",""created"":""Wed, 28 Aug 2002 18:04:42 GMT""}]","2012-08-27"
"hep-lat/0204016","Wolfgang Bietenholz","W. Bietenholz","Convergence Rate and Locality of Improved Overlap Fermions","33 pages, 16 figures, a Section on approximate rotation symmetry is
  added","Nucl.Phys. B644 (2002) 223-247","10.1016/S0550-3213(02)00789-7","HU-EP-02/12","hep-lat",,"  We construct new Ginsparg-Wilson fermions for QCD by inserting an
approximately chiral Dirac operator - which involves ingredients of a perfect
action - into the overlap formula. This accelerates the convergence of the
overlap Dirac operator by a factor of 5 compared to the standard construction,
which inserts the Wilson fermion as a point of departure. Taking into account
the effort for treating the improved fermion, we are left with an total
computational overhead of about a factor 3. This remaining factor is likely to
be compensated by other virtues; here we show that the level of locality is
clearly improved, so that the exponent of the correlation decay is doubled. We
also show that approximate rotation invariance is drastically improved, but a
careful scaling test has to be postponed.
","[{""version"":""v1"",""created"":""Fri, 12 Apr 2002 17:39:17 GMT""},{""version"":""v2"",""created"":""Tue, 11 Jun 2002 11:48:50 GMT""}]","2010-04-05"
"hep-ph/0204139","George Rupp","Eef van Beveren, Frieder Kleefeld, George Rupp, and Michael D. Scadron","Remarks on the f_0(400-1200) scalar meson as the dynamically generated
  chiral partner of the pion","15 pages, plain LaTeX, 3 EPS figures","Mod.Phys.Lett.A17:1673,2002","10.1142/S0217732302007326",,"hep-ph",,"  The quark-level linear sigma model is revisited, in particular concerning the
identification of the f_0(400-1200) (or \sigma(600)) scalar meson as the chiral
partner of the pion. We demonstrate the predictive power of the linear sigma
model through the pi-pi and pi-N s-wave scattering lengths, as well as several
electromagnetic, weak, and strong decays of pseudoscalar and vector mesons. The
ease with which the data for these observables are reproduced in the linear
sigma model lends credit to the necessity to include the sigma as a fundamental
q\bar{q} degree of freedom, to be contrasted with approaches like chiral
perturbation theory or the confining NJL model of Shakin and Wang.
","[{""version"":""v1"",""created"":""Fri, 12 Apr 2002 16:01:29 GMT""}]","2008-11-26"
"hep-ph/0204142","Maxim Perelstein","Z. Chacko, C. Grojean, M. Perelstein","Fine Structure Constant Variation from a Late Phase Transition","9 pages. V2: discussion on the energy density stored in the scalar
  oscillations after the phase transition expanded. Typos corrected and Refs.
  added. Version to appear in PLB","Phys.Lett. B565 (2003) 169-175","10.1016/S0370-2693(03)00766-4",,"hep-ph astro-ph",,"  Recent experimental data indicates that the fine structure constant alpha may
be varying on cosmological time scales. We consider the possibility that such a
variation could be induced by a second order phase transition which occurs at
late times (z ~ 1 - 3) and involves a change in the vacuum expectation value
(vev) of a scalar with milli-eV mass. Such light scalars are natural in
supersymmetric theories with low SUSY breaking scale. If the vev of this scalar
contributes to masses of electrically charged fields, the low-energy value of
alpha changes during the phase transition. The observational predictions of
this scenario include isotope-dependent deviations from Newtonian gravity at
sub-millimeter distances, and (if the phase transition is a sharp event on
cosmological time scales) the presence of a well-defined step-like feature in
the alpha(z) plot. The relation between the fractional changes in alpha and the
QCD confinement scale is highly model dependent, and even in grand unified
theories the change in alpha does not need to be accompanied by a large shift
in nucleon masses.
","[{""version"":""v1"",""created"":""Fri, 12 Apr 2002 17:39:44 GMT""},{""version"":""v2"",""created"":""Thu, 26 Jun 2003 16:25:49 GMT""}]","2010-04-05"
"hep-ph/0204143","Pavol Domin","P. Domin, F. Simkovic, S. V. Semenov, Yu. V. Gaponov","Phenomenological Study of Solar-Neutrino Induced Double Beta Decay of
  Mo100","8 pages, LaTeX, 2 postscript figures, Talk presented by P. Domin on
  the workshop MEDEX'01 (Prague, June, 2001), to appear in Czech. J. Phys. 52
  (2002)","Czech.J.Phys. 52 (2002) 451","10.1023/A:1015344907452",,"hep-ph",,"  The detection of solar-neutrinos of different origin via induced beta beta
process of Mo100 is investigated. The particular counting rates and energy
distributions of emitted electrons are presented. A discussion in respect to
solar-neutrino detector consisting of 10 tones of Mo100 is included. Both the
cases of the standard solar model and neutrino oscillation scenarios are
analyzed. Moreover, new beta^- beta^+ and beta^-/EC channels of the double-beta
process are introduced and possibilities of their experimental observation are
addressed.
","[{""version"":""v1"",""created"":""Fri, 12 Apr 2002 18:41:56 GMT""}]","2009-11-07"
"hep-ph/0204144","D. V. Ahluwalia","D. V. Ahluwalia-Khalilova","Particle-Antiparticle Metamorphosis of Massive Majorana Neutrinos and
  Gauginos","Updated authorship. No other changes",,,,"hep-ph hep-th nucl-th",,"  Recent results on neutrinoless double beta decay, as reported by
Klapdor-Kleingrothaus et al., take us for the first time into the realm of
Majorana spacetime structure. However, this structure has either been treated
as an afterthought to the Dirac construct; or, when it has been attended to in
its own right, its physical and mathematical content was never fully unearthed.
In this Letter,we undertake to remedy the existing situation. We present a
detailed formalism required for the description of the non-trivial spacetime
structure underlying the ""nu-nubar"" metamorphosis - where ""nu"" generically
represents a massive Majorana neutrino, or a massive gaugino.
","[{""version"":""v1"",""created"":""Fri, 12 Apr 2002 21:04:56 GMT""},{""version"":""v2"",""created"":""Fri, 13 Jun 2003 23:56:39 GMT""}]","2007-05-23"
"hep-ph/0204145","Francois Gelis","P. Aurenche (LAPTH, Annecy), F. Gelis (LPT, Orsay), H. Zaraket
  (Winnipeg Univ.)","Enhanced thermal production of hard dileptons by $3\to 2$ processes","32 latex pages, 14 postscript figures","JHEP 0207 (2002) 063","10.1088/1126-6708/2002/07/063","LAPTH-908/02, LPT-ORSAY-02/28","hep-ph nucl-th",,"  In the framework of the Hard Thermal Loop effective theory, we calculate the
two-loop contributions to hard lepton pair production in a quark-gluon plasma.
We show that the result is free of any infrared and collinear singularity. We
also recover the known fact that perturbation theory leads to integrable
singularities at the location of the threshold for $q\bar{q}\to\gamma^*$. It
appears that the process calculated here significantly enhances the rate of low
mass hard dileptons.
","[{""version"":""v1"",""created"":""Fri, 12 Apr 2002 21:58:24 GMT""}]","2009-11-07"
"hep-ph/0204146","Francois Gelis","P. Aurenche (LAPTH, Annecy), F. Gelis (LPT, Orsay), H. Zaraket
  (Winnipeg Univ.)","A simple sum rule for the thermal gluon spectral function and
  applications","24 latex pages, 2 postscript figures","JHEP 0205:043,2002","10.1088/1126-6708/2002/05/043","LAPTH-909/02, LPT-ORSAY-02/27","hep-ph nucl-th",,"  In this paper, we derive a simple sum rule satisfied by the gluon spectral
function at finite temperature. This sum rule is useful in order to calculate
exactly some integrals that appear frequently in the photon or dilepton
production rate by a quark gluon plasma. Using this sum rule, we rederive
simply some known results and obtain some new results that would be extremely
difficult to justify otherwise. In particular, we derive an exact expression
for the collision integral that appears in the calculation of the
Landau-Pomeranchuk-Migdal effect.
","[{""version"":""v1"",""created"":""Fri, 12 Apr 2002 22:00:54 GMT""}]","2011-07-19"
