"astro-ph/0204211","Vicent J. Martinez","Martin Snethlage, Vicent J. Martinez, Dietrich Stoyan and Enn Saar","Point field models for the galaxy point pattern. Modelling the
  singularity of the two-point correlation function","Inserted a missing part of the abstract; 8 pages, 6 figures, uses
  aa.cls and natbib.sty (included); accepted for publication in Astronomy &
  Astrophysics",,"10.1051/0004-6361:20020551",,"astro-ph",,"  There is empirical evidence that the two-point correlation function of the
galaxy distribution follows, for small scales, reasonably well a power-law
expression $\xi(r)\propto r^{-\gamma}$ with $\gamma$ between 1.5 and 1.9.
Nevertheless, most of the point field models suggested in the literature do not
have this property.
  This paper presents a new class of models, which is produced by modifying
point fields commonly used in cosmology to mimic the galaxy distribution, but
where $\gamma=2$ is too large. The points are independently and randomly
shifted, leading to the desired reduction of the value of $\gamma$.
","[{""version"":""v1"",""created"":""Fri, 12 Apr 2002 16:57:19 GMT""},{""version"":""v2"",""created"":""Mon, 15 Apr 2002 13:01:44 GMT""}]","2009-11-07"
"astro-ph/0204215","William Cochran","William D. Cochran, Artie P. Hatzes and Diane B. Paulson","Searching for Planets in the Hyades. I. The Keck Radial Velocity Survey","8 pages, 3 figures; To appear in the July 2002 issue of The
  Astronomical Journal",,"10.1086/341170",,"astro-ph",,"  We describe a high-precision radial velocity search for jovian-mass
companions to main sequence stars in the Hyades star cluster. The Hyades
provides an extremely well controlled sample of stars of the same age, the same
metallicity, and a common birth and early dynamical environment. This sample
allows us to explore the dependence of the process of planet formation on only
a single independent variable: the stellar mass. In this paper we describe the
survey and summarize results for the first five years.
","[{""version"":""v1"",""created"":""Fri, 12 Apr 2002 19:32:19 GMT""}]","2009-11-07"
"astro-ph/0204216","William Cochran","Diane B. Paulson, Steven H. Saar, William D. Cochran and Artie P.
  Hatzes","Searching for Planets in the Hyades II: Some Implications of Stellar
  Magnetic Activity","15 pages, 7 figures, 3 tables; To appear in the July 2002 issue of
  The Astronomical Journal",,"10.1086/341171",,"astro-ph",,"  The Hyades constitute a homogeneous sample of stars ideal for investigating
the dependence of planet formation on the mass of the central star. Due to
their youth, Hyades members are much more chromospherically active than stars
traditionally surveyed for planets using high precision radial velocity (RV)
techniques. Therefore, we have conducted a detailed investigation of whether
magnetic activity of our Hyades target stars will interfere with our ability to
make precise RV searches for substellar companions. We measure chromospheric
activity (which we take as a proxy for magnetic activity) by computing the
equivalent of the R'HK activity index from the Ca II K line. <R'HK> is not
constant in the Hyades: we confirm that it decreases with increasing
temperature in the F stars, and also find it decreases for stars cooler than
mid-K. We examine correlations between simultaneously measured R'HK and RV
using both a classical statistical test and a Bayesian odds ratio test. We find
that there is a significant correlation between R'HK and the RV in only 5 of
the 82 stars in this sample. Thus, simple Rprime HK-RV correlations will
generally not be effective in correcting the measured RV values for the effects
of magnetic activity in the Hyades. We argue that this implies long timescale
activity variations (of order a few years; i.e., magnetic cycles or growth and
decay of plage regions) will not significantly hinder our search for planets in
the Hyades if the stars are closely monitored for chromospheric activity. The
trends in the RV scatter (sigma'_v) with <R'HK>, vsini, and P_rot for our stars
is generally consistent with those found in field stars in the Lick planet
search data, with the notable exception of a shallower dependence of sigma'_v
on <R'HK> for F stars.
","[{""version"":""v1"",""created"":""Fri, 12 Apr 2002 19:40:19 GMT""}]","2009-11-07"
"astro-ph/0204218","Ariel Zhitnitsky","Ariel R. Zhitnitsky","Dark Matter as Dense Color Superconductor","To appear in the Proceedings ""Dark Matter 2002""",,"10.1016/S0920-5632(03)02087-5",,"astro-ph hep-ph nucl-th",,"  We discuss a novel cold dark matter candidate which is formed from the
ordinary quarks during the QCD phase transition when the axion domain wall
undergoes an unchecked collapse due to the tension in the wall. If a large
number of quarks is trapped inside the bulk of a closed axion domain wall, the
collapse stops due to the internal Fermi pressure. In this case the system in
the bulk, may reach the critical density when it undergoes a phase transition
to a color superconducting phase with the ground state being the quark
condensate, similar to BCS theory. If this happens, the new state of matter
representing the diquark condensate with a large baryon number B > 10^{20}
becomes a stable soliton-like configuration. Consequently, it may serve as a
novel cold dark matter candidate.
","[{""version"":""v1"",""created"":""Fri, 12 Apr 2002 22:57:35 GMT""}]","2009-11-07"
"astro-ph/0204219","Fernando Camilo","F. Camilo (1), I. H. Stairs (2), D. R. Lorimer (3), D. C. Backer (4),
  S. M. Ransom (5, 6), B. Klein (7), R. Wielebinski (7), M. Kramer (3), M. A.
  McLaughlin (3), Z. Arzoumanian (8), P. Muller (7) ((1) Columbia, (2) NRAO
  Green Bank, (3) Jodrell Bank, (4) Berkeley, (5) McGill, (6) MIT, (7) MPIfR,
  (8) USRA/NASA-GSFC)","Discovery of radio pulsations from the X-ray pulsar J0205+6449 in
  supernova remnant 3C58 with the Green Bank Telescope","5 pages, 2 included figures, accepted for publication by ApJ Letters","Astrophys.J. 571 (2002) L41","10.1086/341178",,"astro-ph",,"  We report the discovery with the 100 m Green Bank Telescope of 65 ms radio
pulsations from the X-ray pulsar J0205+6449 at the center of supernova remnant
3C58, making this possibly the youngest radio pulsar known. From our
observations at frequencies of 820 and 1375 MHz, the free electron column
density to PSR J0205+6449 is found to be 140.7 +- 0.3 pc/cc. The barycentric
pulsar period P and period derivative determined from a phase-coherent timing
solution are consistent with the values previously measured from X-ray
observations. The averaged radio profile of PSR J0205+6449 consists of one
sharp pulse of width ~ 3 ms ~ 0.05 P. The pulsar is an exceedingly weak radio
source, with pulse-averaged flux density in the 1400 MHz band of 0.045 mJy and
a spectral index of ~ -2.1. Its radio luminosity of ~ 0.5 mJy kpc^2 at 1400 MHz
is lower than that of ~ 99% of known pulsars and is the lowest among known
young pulsars.
","[{""version"":""v1"",""created"":""Sat, 13 Apr 2002 01:28:06 GMT""}]","2009-11-07"
"astro-ph/0204220","Matthew A. Malkan","M. A. Malkan, E. K. Hicks, H. I. Teplitz, I. M. McLean, H. Sugai, J.
  Guichard","1-1.4 Micron Spectral Atlas of Stars","35 pages, 10 figures (3a-e are in gif format. For complete high
  resolution figures, go to http://www.astro.ucla.edu/~malkan/newjspec/) ;
  Accepted for published in ApJS; For associated spectra files, see
  http://www.astro.ucla.edu/~malkan/newjspec/","Astrophys.J.Suppl.142:79-94,2002","10.1086/341176",,"astro-ph",,"  We present a catalog of J-band (1.08 um to 1.35 um) stellar spectra at low
resolution (R ~ 400). The targets consist of 105 stars ranging in spectral type
from O9.5 to M7 and luminosity classes I through V. The relatively featureless
spectra of hot stars, earlier than A4, can be used to remove the atmospheric
features which dominate ground-based J-band spectroscopy. We measure equivalent
widths for three absorption lines and nine blended features which we identify
in the spectra. Using detailed comparison with higher resolution spectra, we
demonstrate that low resolution data can be used for stellar classification,
since several features depend on the effective temperature and gravity. For
example The CN index (1.096 - 1.104 um) decreases with temperature, but the
strength of a blended feature at 1.28 um (consisting of primarily P beta)
increases. The slope of a star's spectrum can also be used to estimate its
effective temperature. The luminosity class of a star correlates with the ratio
of the Mg I (1.1831 um) line to a blend of several species at 1.16 um. Using
these indicators, a star can be classified to within several subclasses.
Fifteen stars with particularly high and low metal abundances are included in
the catalog and some spectral dependence on metal abundance is also found.
","[{""version"":""v1"",""created"":""Sat, 13 Apr 2002 01:38:26 GMT""}]","2009-09-29"
"astro-ph/0204221","Tzihong Chiueh","Tzihong Chiueh, Jounghun Lee and Lihwai Lin","An Analytical Approach to the Spin-Distribution of Dark Halos","14 pages including two figures, submitted to ApJ Lett","Astrophys.J. 581 (2002) 794-798","10.1086/344240",,"astro-ph",,"  We derive the distribution of the dimensionless specific angular momentum of
dark matter halos, $P(j)$, in the framework of the standard tidal torque
theory, and explain the characteristic shape of $P(j)$ commonly observed in
N-body simulations. A scalar quantity (shear scalar), $r$, is introduced for
measuring the effective strength of the tidal torque force acting upon the halo
from the surrounding matter. It is found that the ubiquitous and broad shape of
$P(j)$ can mostly be attributed to the unique property of the shear scalar $r$,
and also that $P(j)$ is insensitve to the underlying collapse dynamics. Our
result demonstrates that although the shape of $P(j)$ is ubiquitous and close
to log-normal, the distribution is not exactly log-normal but decays
exponentially at the high angular momentum end, and drops slowly as a power-law
with an index 2 at the low angular momentum end.
","[{""version"":""v1"",""created"":""Sat, 13 Apr 2002 06:04:55 GMT""}]","2009-11-07"
"astro-ph/0204222","Akio Inoue","Akio K. Inoue (Kyoto University)","Star Formation Rate from Dust Infrared Emission","Accepted by ApJL: 6 pages (emulateapj5), 2 figures (one is an extra
  figure not appeared in ApJL)",,"10.1086/341128",,"astro-ph",,"  We examine what types of galaxies the conversion formula from dust infrared
(IR) luminosity into the star formation rate (SFR) derived by
  Kennicutt (1998) is applicable to. The ratio of the observed IR luminosity,
$L_{\rm IR}$, to the intrinsic bolometric luminosity of the newly ($\la$ 10
Myr) formed stars,
  $L_{\rm SF}$, of a galaxy can be determined by a mean dust opacity in the
interstellar medium and the activity of the current star formation. We find
that these parameters area being $0.5 \le L_{\rm IR}/L_{\rm SF}
  \le 2.0$ is very large, and many nearby normal and active star-forming
galaxies really fall in this area. It results from offsetting two effects of a
small dust opacity and a large cirrus contribution of normal galaxies relative
to starburst galaxies on the conversion of the stellar emission into the dust
IR emission. In conclusion, the SFR determined from the IR luminosity under the
assumption of $L_{\rm IR}=L_{\rm SF}$ like Kennicutt (1998) is reliable within
a factor of 2 for all galaxies except for dust rich but quiescent galaxies and
extremely dust poor galaxies.
","[{""version"":""v1"",""created"":""Sat, 13 Apr 2002 06:41:23 GMT""}]","2016-08-30"
"astro-ph/0204223","Shizuo Iwamoto","S.Iwamoto, F.Takahara","Relativistic Outflow of Electron-Positron Pair Plasma from a Wien
  Equilibrium State","17 pages, 7 figures, 1 table, accepted in ApJ","Astrophys.J. 565 (2002) 163-173","10.1086/324480",,"astro-ph",,"  We investigate a novel mechanism of bulk acceleration for relativistic jets
of pure electron-positron pair plasma.We assumed that relativistically hot
plasma is optically thick for Compton scattering and then pair plasma coupled
dynamically to photons may establish quasi-Wien equilibria. We name such an
electron-positron pair plasma the ""Wien-fireball"". Assuming there is a
Wien-fireball, it is easy to form highly relativistic jets not only because
coupled photons do not cause radiation drag effect, but also because coupled
photons prevent catastrophic annihilation of pair plasma. It is found that the
Wien-fireball provides a very effective mechanism to form high power jets. And
the radiation of the Wien-fireball in blazars should be observed as MeV peaked
emission at infinity with an order of kinetic power of jets.
","[{""version"":""v1"",""created"":""Sat, 13 Apr 2002 10:05:16 GMT""}]","2009-11-07"
"astro-ph/0204224","Akihiro Kushino","Akihiro Kushino, Yoshitaka Ishisaki, Umeyo Morita, Noriko Y. Yamasaki,
  Manabu Ishida, Takaya Ohashi, Yoshihiro Ueda","Study of the X-Ray Background Spectrum and its Large-Scale Fluctuation
  with ASCA","27 pages, 20 figures, accepted for publication in PASJ, amended
  figure8 and figure17",,"10.1093/pasj/54.3.327",,"astro-ph",,"  We studied the energy spectrum and the large-scale fluctuation of the X-ray
background with the ASCA GIS based on the ASCA MSS and LSS observations. A
total of 91 fields with Galactic latitude |b|>10 deg were selected with a sky
coverage of 50 deg^2 and 4.2 Ms of exposure. For each field, sources brighter
than \sim 2\times 10^{-13}\ergs (2-10 keV) were eliminated. Spectral fits with
a single power-law model for the individual 0.7-10 keV spectra showed a
significant excess below \sim 2 keV, which could be expressed by an additional
thermal model with kT\simeq 0.4 keV or a steep power-law model with photon
index GS\simeq 6. The 0.5-2 keV intensities of the soft thermal component
varied significantly by 1\sigma=52^{+4}_{-5}%, and showed a maximum toward the
Galactic Center. This component is considered to be entirely Galactic. As for
the hard power-law component, an average photon index of 91 fields was obtained
to be GH = 1.412\pm 0.007\pm 0.025 and the average 2-10 keV intensity was
calculated as FH = (6.38\pm 0.04\pm 0.64)\times 10^{-8} \ergss. The Galactic
component is marginally detected in the hard band. The 2-10 keV intensities
shows a 1\sigma deviation of 6.49^{+0.56}_{-0.61}%, while deviation due to the
NXB is 3.2%. The observed deviation can be explained by the Poisson noise of
source count in the f.o.v. (\sim 0.5 deg^2), even assuming a single \logn
relation on the whole sky. Based on the observed fluctuation and the absolute
intensity, an acceptable region of the \logn relation was derived, showing a
consistent feature with the recent Chandra and XMM-Newton results. Fluctuation
of the spectral index was also examined, and it implied a large amount of hard
sources and a substantial variation in the intrinsic source spectra (GS\simeq
1.1\pm 1.0).
","[{""version"":""v1"",""created"":""Sat, 13 Apr 2002 11:57:58 GMT""},{""version"":""v2"",""created"":""Thu, 18 Apr 2002 13:27:08 GMT""},{""version"":""v3"",""created"":""Sun, 12 May 2002 05:09:19 GMT""}]","2015-06-24"
"astro-ph/0204225","Sara Seager","S. Seager (IAS) and Lam Hui (Columbia)","Constraining the Rotation Rate of Transiting Extrasolar Planets by
  Oblateness Measurements","ApJ, accepted, Aug 1 2002 issue, 9 pages",,"10.1086/340994",,"astro-ph",,"  (Abridged) The solar system gas giant planets are oblate due to their rapid
rotation. A measurement of the planet's projected oblateness would constrain
the planet's rotational period. Planets that are synchronously rotating with
their orbital revolution will be rotating too slowly to be significantly
oblate; these include planets with orbital semi-major axes <~ 0.2AU (for M_P ~
M_J and M_* ~ M_sun). Jupiter-like planets in the range of orbital semi-major
axes 0.1 AU to 0.2 AU will tidally evolve to synchronous rotation on a
timescale similar to main sequence stars' lifetimes. In this case an oblateness
detection will help constrain the planet's tidal Q value.
  The projected oblateness of a transiting extrasolar giant planet is
measurable from a very high-photometric-precision transit light curve. For a
sun-sized star and a Jupiter-sized planet the normalized flux difference in the
transit ingress/egress light curve between a spherical and an oblate planet is
a few to 15 x 10^{-5} for oblateness similar to Jupiter and Saturn
respectively. The transit ingress and egress are asymmetric for an oblate
planet with an orbital inclination different from 90 degrees and a non-zero
projected obliquity. A photometric precision of 10^{-4} has been reached by HST
observations of the known transiting extrasolar planet HD209458b. In addition
several planned space missions (including MOST, MONS, Corot, and Kepler) will
study or find transiting giant planets with photometric precision <~ 10^{-5}.
In particular Kepler is expected to find ~40 transiting giant planets < 1 AU
with ~20 of those > 0.2 AU.
","[{""version"":""v1"",""created"":""Sat, 13 Apr 2002 12:22:20 GMT""}]","2009-11-07"
"astro-ph/0204226","Dima Yakovlev","D.G. Yakovlev (Ioffe Institute, St.-Petersburg), O.Y. Gnedin (Space
  Telescope Science Institute, Baltimore), A.D. Kaminker, A.Y. Potekhin (Ioffe
  Institute, St.-Petersburg)","Cooling of Superfluid Neutron Stars","14 pages, 13 figures, he_symp; to be published in Proceedings of the
  270. Heraeus Seminar on Neutron Stars, Pulsars and Supernova Remnants, Bad
  Honnef, Jan. 21-25, 2002",,,,"astro-ph",,"  Cooling of neutron stars (NSs) with the cores composed of neutrons, protons,
and electrons is analyzed. The main cooling regulators are discussed: opening
of direct Urca process in a NS central kernel; superfluidity of nucleons in NS
interiors; surface layers of light (accreted) elements; strong surface magnetic
fields. An emphasis is paid on the cooling scenario with strong $^1$S$_0$
pairing of protons and weak $^3$P$_2$ pairing of neutrons in the NS core, as
well as strong $^1$S$_0$ pairing of neutrons in the NS crust. The theory
predicts three types of isolated cooling middle-aged NSs with distinctly
different properties: low-mass, slowly cooling NSs; medium-mass, moderately
cooling NSs; massive, rapidly cooling NSs. The theory is compared with
observations of isolated NSs -- pulsars and radio quiet NSs in supernova
remnants. The constraints on physical properties of NSs which can be inferred
from such a comparison are outlined.
","[{""version"":""v1"",""created"":""Sat, 13 Apr 2002 13:53:32 GMT""}]","2007-05-23"
"cond-mat/0204280","Fabio Lucio Toninelli","Francesco Guerra (1), Fabio L. Toninelli (2) ((1) University of Rome
  'La Sapienza' and INFN, Rome, (2) Scuola Normale Superiore di Pisa and INFN,
  Pisa)","The Thermodynamic Limit in Mean Field Spin Glass Models","12 pages","Commun. Math. Phys. 230 (2002) 1, 71-79","10.1007/s00220-002-0699-y",,"cond-mat.dis-nn cond-mat.stat-mech math-ph math.MP",,"  We present a simple strategy in order to show the existence and uniqueness of
the infinite volume limit of thermodynamic quantities, for a large class of
mean field disordered models, as for example the Sherrington-Kirkpatrick model,
and the Derrida p-spin model. The main argument is based on a smooth
interpolation between a large system, made of N spin sites, and two similar but
independent subsystems, made of N_1 and N_2 sites, respectively, with
N_1+N_2=N. The quenched average of the free energy turns out to be subadditive
with respect to the size of the system. This gives immediately convergence of
the free energy per site, in the infinite volume limit. Moreover, a simple
argument, based on concentration of measure, gives the almost sure convergence,
with respect to the external noise. Similar results hold also for the ground
state energy per site.
","[{""version"":""v1"",""created"":""Fri, 12 Apr 2002 16:38:58 GMT""}]","2009-11-07"
"cond-mat/0204281","Jairo Sinova","Jairo Sinova, Alvaro N\'u\~nez, John Schliemann, and A. H. MacDonald","Electron-Phonon Interactions in Polyacene Organic Transistors","3 pages, 1 figure, paper for PASI conference, Costa Rica 2001","physica status solidi b 230, 309 (2002)","10.1002/1521-3951(200204)230:2<309::AID-PSSB309>3.0.CO;2-Q",,"cond-mat.supr-con cond-mat.mes-hall",,"  We present a simple model for the electron-phonon interactions between the
energy subbands in polyacene field-effect transistors and the vibrations of the
crystal. We introduce a generalized Su-Schrieffer-Heeger model, arguing that
the strongest electron-phonon interactions in these systems originate from the
dependence of inter-molecule hopping amplitudes on collective molecular motion.
We compute the electron-phonon spectral function $\alpha^2F(\omega)$ as a
function of two-dimensional hole density and the coupling strength constant.
Our results are in agreement with the sharp onset of superconductivity near
half-filling discovered in recent experiments by Sch\""on {\it et al.} [Batlogg]
and predict an increase of $T_c$ with pressure. We further speculate on the
implications that the observation of the quantum Hall effect in these systems
has on the effective band mass in the low carrier density regime.
","[{""version"":""v1"",""created"":""Fri, 12 Apr 2002 16:39:02 GMT""}]","2016-08-16"
"cond-mat/0204282","Martin Letz","M.Letz, W.Mannstadt, M.Brinkmann, E.Moersen","Spatial dispersion in CaF$_2$ caused by the vicinity of an excitonic
  bound state","7 pages, 3 figures, to appear in SPIE proceedings of microlithography
  2002",,"10.1117/12.474572",,"cond-mat.str-el cond-mat.mtrl-sci",,"  The microscopic mechanism beyond the optical anisotropy of an ionic crystal
which occurs for short wavelengths is investigated. The electron-hole, two
particle propagator and its analytical behaviour close to the band edge of the
one particle continuum plays a major role for the mechanism of this optical
anisotropy. Especially for an ionic crystal the two particle bound state, the
exciton, is of special importance. In this way we argue that the so called
``intrinsic birefringence'' in CaF$_2$ is neither intrinsic to the material nor
it is birefringence. Instead it is spatial dispersion caused by the vicinity of
a dispersive optical absorption given by the excitonic bound state. We propose
a model which connects the bound state dispersion with the band structure and a
model potential for a screened coulomb interaction. Based on these
considerations we predict a wavelength dependence of the dielectric function
approaching close to the bound state level $\epsilon \sim (\lambda -
\lambda_0)^{-1}$, where $\lambda_0$ is the wavelength of the excitonic bound
state level.
","[{""version"":""v1"",""created"":""Fri, 12 Apr 2002 17:57:44 GMT""}]","2015-06-24"
"cond-mat/0204283","Koujin Takeda","K. Takeda, I. Ichinose","Effects of Long-Range Correlations in Random-Mass Dirac Fermions","12 pages, 15 figures","J. Phys. Soc. Jpn. 71 (2002) 2216","10.1143/JPSJ.71.2216",,"cond-mat.dis-nn cond-mat.str-el",,"  In the previous paper, we studied the random-mass Dirac fermion in one
dimension by using the transfer-matrix methods. We furthermore employed the
imaginary vector potential methods for calculating the localization lengths.
Especially we investigated effects of the nonlocal but short-range correlations
of the random mass. In this paper, we shall study effects of the long-range
correlations of the random mass especially on the delocalization transition and
singular behaviours at the band center. We calculate localization lengths and
density of states for various nonlocally correlated random mass. We show that
there occurs a ""phase transition"" as the correlation length of the random Dirac
mass is varied. The Thouless formula, which relates the density of states and
the localization lengths, plays an important role in our investigation.
","[{""version"":""v1"",""created"":""Fri, 12 Apr 2002 18:32:52 GMT""}]","2007-05-23"
"cond-mat/0204285","Paulsamy Muruganandam","Sadhan K. Adhikari and Paulsamy Muruganandam","Effect of an impulsive force on vortices in a rotating Bose-Einstein
  condensate","RevTeX 4, 7 pages, 7 EPS figures","Phys. Lett. A. 301 (2002) 333-339","10.1016/S0375-9601(02)00980-5",,"cond-mat.soft",,"  The effects of a sudden increase and decrease of the interatomic interaction
and harmonic-oscillator trapping potential on vortices in a quasi
two-dimensional rotating Bose-Einstein condensate are investigated using the
mean-field Gross-Pitaevskii equation. Upon increasing the strength of
interaction suddenly the condensate enters a nonstationary oscillating phase
which starts to develop more vortices. The opposite happens if the strength is
reduced suddenly. Eventually, the number of vortices attains a final value at
large times. Similarly, the number of vortices increases (decreases) upon a
sudden reduction (augmentation) in the trapping potential. We also study the
decay of vortices when the rotation of the condensate is suddenly stopped. Upon
a free expansion of a rotating BEC with vortices the radius of the vortex core
increases more rapidly than the radius of the condensate. This makes the
counting and detection of multiple vortex easier after a free expansion.
","[{""version"":""v1"",""created"":""Fri, 12 Apr 2002 20:43:49 GMT""}]","2015-06-24"
