"astro-ph/0204404","Donald A. Smith","D. A. Smith (1), C. Akerlof (1), M. C. B. Ashley (2), D. Casperson
  (3), G. Gisler (3), R. Kehoe (1), S. Marshall (4), K. McGowan (3), T. McKay
  (1), M. A. Phillips (2), E. Rykoff (1), W. T. Vestrand (3), P. Wozniak (3),
  and J. Wren (3) ((1) University of Michigan, (2) University of New South
  Wales, (3) Los Alamos National Laboratory, (4) Lawrence Livermore National
  Laboratory)","The ROTSE-IIIa Telescope System","3 pages, 4 figures, submitted for publication in the proceedings of
  ``Gamma-Ray Burst and Afterglow Astronomy 2001: A Workshop Celebrating the
  First Year of the HETE Mission''","AIP Conf.Proc. 662 (2003) 514-516","10.1063/1.1579417",,"astro-ph",,"  We report on the current operating status of the ROTSE-IIIa telescope,
currently undergoing testing at Los Alamos National Laboratories in New Mexico.
It will be shipped to Siding Spring Observatory, Australia, in first quarter
2002. ROTSE-IIIa has been in automated observing mode since early October,
2001, after completing several weeks of calibration and check-out observations.
Calibrated lists of objects in ROTSE-IIIa sky patrol data are produced
routinely in an automated pipeline, and we are currently automating analysis
procedures to compile these lists, eliminate false detections, and
automatically identify transient and variable objects. The manual application
of these procedures has already led to the detection of a nova that rose over
six magnitudes in two days to a maximum detected brightness of m_R~13.9 and
then faded two magnitudes in two weeks. We also readily identify variable
stars, includings those suspected to be variables from the Sloan Digital Sky
Survey. We report on our system to allow public monitoring of the telescope
operational status in real time over the WWW.
","[{""version"":""v1"",""created"":""Wed, 24 Apr 2002 14:51:11 GMT""}]","2009-11-07"
"astro-ph/0204405","Julien Malzac","Julien Malzac, Annalisa Celotti","X-ray spectra produced by a hot plasma containing cold clouds","8 pages, 5 figures, accepted for publication in MNRAS","Mon.Not.Roy.Astron.Soc. 335 (2002) 23","10.1046/j.1365-8711.2002.05597.x",,"astro-ph",,"  We compute the hard X-ray spectra from a hot plasma pervaded by small cold
dense clouds. The main cooling mechanism of the plasma is Compton cooling by
the soft thermal emission from the clouds. We compute numerically the
equilibrium temperature of the plasma together with the escaping spectrum. The
spectrum depends mainly on the amount of cold clouds filling the hot phase. The
clouds covering factor is constrained to be low in order to produce spectra
similar to those observed in Seyfert galaxies and X-ray binaries, implying that
an external reflector is required in order to reproduce the full range of
observed reflection amplitudes. We also derive analytical estimates for the
X-ray spectral slope and reflection amplitude using an escape probability
formalism.
","[{""version"":""v1"",""created"":""Wed, 24 Apr 2002 14:59:02 GMT""}]","2009-11-07"
"astro-ph/0204406","Elena Maria Rossi","Elena Rossi & Martin J. Rees (IoA, Cambridge, UK)","Gamma-Ray Burst Afterglow emission with a decaying magnetic field","6 pages, 5 figures, MNRAS in press; extended conclusions and
  discussion","Mon.Not.Roy.Astron.Soc. 339 (2003) 881","10.1046/j.1365-8711.2003.06242.x",,"astro-ph",,"  In models for gamma ray burst afterglows, it is normally assumed that the
external shock strongly amplifies the magnetic field and that this field
maintains a steady value throughout the shocked region. We discuss the effects
of modifying this (probably simplistic) assumption by allowing for a short
decay time. The observations are incompatible with a post-shock field that
decays too rapidly. However if the field pervades only a few percent of the
total thickness of the shocked shell (and the electrons undergo only inverse
Compton losses in the remainder) the model could be compatible with data. This
would suggest a strong dependence of model parameters on the uncertainties of
shock physics, therefore calling for independent external density estimates. We
claim that afterglow emission should be instead seen as a laboratory where we
can understand relativistic shock physics. The model we propose here together
with afterglow observations in all wavebands could help to pin down the field
structure.
","[{""version"":""v1"",""created"":""Wed, 24 Apr 2002 15:03:01 GMT""},{""version"":""v2"",""created"":""Wed, 6 Nov 2002 16:52:01 GMT""}]","2009-11-07"
"astro-ph/0204407","barraud","C. Barraud, J.L. Atteia, J.F. Olive, J.P. Dezalay","The E-peak distribution of the GRBs detected by HETE FREGATE instrument","3 pages, Woods Hole Proceedings","AIP Conf.Proc. 662 (2003) 59-62","10.1063/1.1579300",,"astro-ph",,"  The FREGATE gamma ray detector of HETE-2 is sensitive to photons between 6
and 400 keV. This sensitivity range, extended towards low energies, allows us
to explore the emission of GRBs in hard X-rays. We fit the spectra of 23 GRBs
with Band's spectral function in order to derive the distribution of their peak
energies (E-peak). This distribution is then compared with the E-peak
distributions measured by BATSE and GINGA.
","[{""version"":""v1"",""created"":""Wed, 24 Apr 2002 15:23:46 GMT""}]","2016-08-30"
"astro-ph/0204408","Burkhard Wolff","B. Wolff, D. Koester, J. Liebert","Element abundances in cool white dwarfs. II. Ultraviolet observations of
  DZ white dwarfs",,"Astron.Astrophys. 385 (2002) 995","10.1051/0004-6361:20020194",,"astro-ph",,"  We present a small data base of homogeneously derived photospheric element
abundances of DZ white dwarfs and related objects. Our previous investigations
are supplemented with the analysis of ultraviolet spectra for nine white
dwarfs. Of particular interest is the detection of Lalpha absorption in van
Maanen 2 and a determination of the effective temperature of this star. The new
value is about 1000K lower than previous results due to the strong ultraviolet
absorption by metals which has to be considered consistently. The metal
abundances of our sample stars are compatible with the predictions from the
two-phase accretion model of Dupuis et al. (1992, 1993). Small deviations can
be observed for the abundance ratios in some objects. This could indicate
non-solar metal-to-metal ratios in the accreted material. Hydrogen can be
detected in virtually all of our objects. However, its average accretion rate
must be at least two orders of magnitude lower than the metal accretion rate.
","[{""version"":""v1"",""created"":""Wed, 24 Apr 2002 15:30:32 GMT""}]","2009-11-07"
"astro-ph/0204409","Philip Kaaret","P. Kaaret (1), J.J.M. in 't Zand (2,3), J. Heise (3), and J.A. Tomsick
  (4) ((1) Harvard-Smithsonian CfA, (2) Utrecht University, (3) SRON, (4) UCSD)","Discovery of Millisecond Variability in the Neutron-Star X-Ray Transient
  SAX J1750.8-2900","9 pages, to appear in the Astrophysical Journal","Astrophys.J. 575 (2002) 1018-1024","10.1086/341336",,"astro-ph",,"  We report the discovery of millisecond oscillations in the X-ray emission
from the X-ray transient SAX J1750.8-2900. Millisecond quasiperiodic
oscillations (kHz QPOs) were present in the persistent emission with
frequencies ranging from 543 Hz to 1017 Hz. Oscillations at a frequency of
600.75 Hz were present in the brightest X-ray burst observed. We derive an
upper limit on the source distance of 6.3 +/- 0.7 kpc from this X-ray burst.
","[{""version"":""v1"",""created"":""Wed, 24 Apr 2002 15:38:50 GMT""}]","2009-11-07"
"astro-ph/0204410","Maurizio Salaris","M.Salaris (1,2) and A. Weiss (2) ((1) Astrophysics Research Institute,
  Liverpool JMU, UK; (2) Max-Planck-Institut fuer Astrophysik, Garching,
  Germany)","Homogeneous age dating of 55 Galactic globular clusters. Clues to the
  Galaxy formation mechanisms","12 pages, 11 figures, A&A accepted","Astron.Astrophys.388:492-503,2002","10.1051/0004-6361:20020554",,"astro-ph",,"  We present homogeneous age determinations for a large sample of 55 Galactic
globular clusters, which constitute about 30% of the total Galactic population.
A study of their age distribution reveals that all clusters from the most metal
poor ones up to intermediate metallicities are coeval, whereas at higher [Fe/H]
an age spread exists, together with an age-metallicity relationship. At the
same time, all clusters within a certain galactocentric distance appear coeval,
whereas an age spread is present further away from the Galactic centre, without
any correlation with distance. The precise value of [Fe/H] and galactocentric
distance for the onset of the age spread and the slope of the age-metallicity
relationship are strongly affected by the as yet uncertain [Fe/H] scale. We
discuss how differences in the adopted [Fe/H] scale and cluster sample size may
explain discrepant results about the clusters age distribution reached by
different authors. Taking advantage of the large number of objects included in
our sample, we also tested the possibility that age is the global second
parameter which determines the Horizontal Branch morphology, and found
indications that age could explain the global behaviour of the second parameter
effect.
","[{""version"":""v1"",""created"":""Wed, 24 Apr 2002 15:43:09 GMT""}]","2008-11-26"
"astro-ph/0204411","Miuchi Kentaro","K.Miuchi, M.Minowa, A.Takeda, H.Sekiya, Y.Shimizu, Y.Inoue, W.Ootani,
  and Y.Ootuka","First results from dark matter search experiment with LiF bolometer at
  Kamioka Underground Laboratory","15 pages, 5 figures","Astropart.Phys.19:135-144,2003","10.1016/S0927-6505(02)00192-5",,"astro-ph",,"  Tokyo group has performed first underground dark matter search experiment in
2001 through 2002 at Kamioka Observatory(2700m.w.e). The detector is eight LiF
bolometers with total mass 168g aiming for the direct detection of WIMPs via
spin-dependent interaction. With a total exposure of 4.1 kg days, we derived
the limits in the a_p-a_n (WIMP-nucleon couplings) plane and excluded a large
part of the parameter space allowed by the UKDMC experiment.
","[{""version"":""v1"",""created"":""Wed, 24 Apr 2002 15:46:24 GMT""},{""version"":""v2"",""created"":""Mon, 17 Feb 2003 08:03:31 GMT""}]","2009-09-29"
"astro-ph/0204412","Daniel Sauer","D. Sauer (1,2), A.W.A. Pauldrach (2) ((1) Max-Planck-Inst. f.
  Astrophysik, Garching, Germany, (2) Institut f. Astronomie u. Astrophysik d.
  Universitaet Muenchen, Germany)","Model atmospheres for type Ia supernovae: Basic steps towards realistic
  synthetic spectra","4 pages, 1 figure, to appear in: Proceedings of the 11th Workshop on
  Nuclear Astrophysics, Ringberg Castle, Germany, 2002",,,"MPA/P13","astro-ph",,"  Type Ia supernovae are an important tool for studying the expansion history
of the universe. Advancing our yet incomplete understanding of the explosion
scenario requires detailed and realistic numerical models in order to interpret
and analyze the growing amount of observational data. Here we present first
results of our new NLTE model calculations for the expanding atmospheres of
type Ia supernovae that employ a detailed and consistent treatment of all
important NLTE effects as well as line blocking and blanketing. The comparison
of the synthetic spectra resulting from these models with observed data shows
that the employed methods represent an important step towards a more realistic
description of the atmospheres of supernovae Ia.
","[{""version"":""v1"",""created"":""Wed, 24 Apr 2002 15:55:31 GMT""}]","2007-05-23"
"cond-mat/0204501","Boris Shklovskii","B. I. Shklovskii","$1/f$ noise in variable range hopping conduction",,"Phys. Rev. B 67, 045201 (2003)","10.1103/PhysRevB.67.045201",,"cond-mat",,"  A mechanism of $1/f$ noise due to traps formed by impurities which have no
neighbors with close energies in their vicinity is studied. Such traps slowly
exchange electrons with the rest of conducting media. The concentration of
traps and proportional to it $1/f$ noise exponentially grow with decreasing
temperature in the variable range hopping regime. This theory provides smooth
transition to the nearest neighbor hopping case where it predicts a very weak
temperature dependence.
","[{""version"":""v1"",""created"":""Tue, 23 Apr 2002 16:38:23 GMT""},{""version"":""v2"",""created"":""Thu, 25 Apr 2002 18:09:11 GMT""},{""version"":""v3"",""created"":""Fri, 26 Apr 2002 16:59:24 GMT""},{""version"":""v4"",""created"":""Fri, 4 Oct 2002 14:29:56 GMT""}]","2009-11-07"
"cond-mat/0204502","Eduardo Ariel Menendez Proupin","Eduardo Menendez-Proupin","Comment on ""Multi-phonon Raman scattering in semiconductor nanocrystals:
  Importance of non-adiabatic transitions""","1 page, no figure. Commented paper also at cond-mat/0111282",,,,"cond-mat.mes-hall",,"  In a recent paper [E. P. Pokatilov et al, PRB 65, 075316 (2002) the Raman
selection rules in spherical nanocrystals with a degenerate valence band are
analyzed. Some precisions are given here.
","[{""version"":""v1"",""created"":""Tue, 23 Apr 2002 17:01:03 GMT""}]","2007-05-23"
"cond-mat/0204503","Jim Freericks","R. Lemanski (Inst. of Low Temperature and Structure Research, Wroclaw,
  Poland) J.K. Freericks (Georgetown University) and G. Banach (Daresbury
  Laboratory, Cheshire, England)","Stripe phases in the two-dimensional Falicov-Kimball model","(5 pages, 3 figures)","Phys. Rev. Lett. 89 196403-1--4 (2002)","10.1103/PhysRevLett.89.196403",,"cond-mat.str-el cond-mat.stat-mech",,"  The observation of charge stripe order in the doped nickelate and cuprate
materials has motivated much theoretical effort to understand the underlying
mechanism of the stripe phase. Numerical studies of the Hubbard model show two
possibilities: (i) stripe order arises from a tendency toward phase separation
and its competition with the long-range Coulomb interaction or (ii) stripe
order inherently arises as a compromise between itinerancy and magnetic
interactions. Here we determine the restricted phase diagrams of the
two-dimensional Falicov-Kimball model and see that it displays rich behavior
illustrating both possibilities in different regions of the phase diagram.
","[{""version"":""v1"",""created"":""Tue, 23 Apr 2002 17:56:56 GMT""}]","2009-11-07"
"cond-mat/0204504","Servaas Kokkelmans","S.J.J.M.F. Kokkelmans, M.J. Holland","Ramsey fringes in a Bose-Einstein condensate between atoms and molecules","5 pages, 5 figures",,"10.1103/PhysRevLett.89.180401",,"cond-mat.soft",,"  In a recent experiment, a Feshbach scattering resonance was exploited to
observe Ramsey fringes in a $^{85}$Rb Bose-Einstein condensate. The oscillation
frequency corresponded to the binding energy of the molecular state. We show
that the observations are remarkably consistent with predictions of a resonance
field theory in which the fringes arise from oscillations between atoms and
molecules.
","[{""version"":""v1"",""created"":""Tue, 23 Apr 2002 19:28:53 GMT""}]","2009-11-07"
"cond-mat/0204505","Akihisa Koga","Akihisa Koga, Akira Kawaguchi, Kouichi Okunishi and Norio Kawakami","First-Order Phase Transitions in Frustrated Spin Systems","6 pages, 6 figures, to appear in Prog. Theor. Phys. Suppl.
  Proceedings of the 16th Nishinomiya Yukawa Memorial Symposium",,"10.1143/PTPS.145.52",,"cond-mat.str-el",,"  We give a short review of our recent works on the first-order quantum phase
transitions in frustrated spin chains with orthogonal-dimer structure. When the
ratio of the competing antiferromagnetic exchange couplings is varied, a
first-order transition occurs between the dimer phase and the plaquette phase,
which is accompanied by the discontinuity in the spin excitation gap. We
further show that strong frustration triggers the phase transitions in a
magnetic field, which exhibit plateaus and jumps in the magnetization curve.
The hole-doping effect is also addressed for the orthogonal-dimer chain with
linked-tetrahedra structure. It is found that the competing antiferromagnetic
interactions result in a first-order metal-insulator transition upon hole
doping.
","[{""version"":""v1"",""created"":""Tue, 23 Apr 2002 20:00:29 GMT""}]","2009-11-07"
"cond-mat/0204506","Ginestra Bianconi","Ginestra Bianconi","Growing Cayley trees described by Fermi distribution",,,"10.1103/PhysRevE.66.036116",,"cond-mat.stat-mech",,"  We introduce a model for growing Cayley trees with thermal noise. The
evolution of these hierarchical networks reduces to the Eden model and the
Invasion Percolation model in the limit $T\to 0$, $T\to \infty$ respectively.
We show that the distribution of the bond strengths (energies) is described by
the Fermi statistics. We discuss the relation of the present results with the
scale-free networks described by Bose statistics.
","[{""version"":""v1"",""created"":""Tue, 23 Apr 2002 20:48:40 GMT""},{""version"":""v2"",""created"":""Sun, 28 Apr 2002 08:55:14 GMT""}]","2009-11-07"
"cond-mat/0204507","Piotr Habdas","Piotr Habdas and Eric R. Weeks","Video Microscopy of Colloidal Suspensions and Colloidal Crystals","11 pages, 3 figures","Current Opinion in Colloid and Interface Sci. 7, 196-203 (2002)",,,"cond-mat.soft",,"  Colloidal suspensions are simple model systems for the study of phase
transitions. Video microscopy is capable of directly imaging the structure and
dynamics of colloidal suspensions in different phases. Recent results related
to crystallization, glasses, and 2D systems complement and extend previous
theoretical and experimental studies. Moreover, new techniques allow the
details of interactions between individual colloidal particles to be carefully
measured. Understanding these details will be crucial for designing novel
colloidal phases and new materials, and for manipulating colloidal suspensions
for industrial uses.
","[{""version"":""v1"",""created"":""Tue, 23 Apr 2002 21:47:12 GMT""}]","2007-05-23"
"cond-mat/0204508","Joel E. Moore","Joel E. Moore","Mobility edge scaling at semiclassical and dissipative Hall transitions","4 pages",,"10.1103/PhysRevB.65.241309",,"cond-mat",,"  The universal anomalous diffusion scaling is obtained for the semiclassical
quantum Hall transition, which has been argued to describe samples with
dissipation or correlated impurities. The results explain a discrepancy between
existing numerics and the expected scaling $\eta = 2 x_1 = {1/2}$, which is
violated because of a cancellation in the scaling function. The crossover with
increasing observation time from semiclassical to quantum scaling is shown to
explain a recent experiment which finds different scaling laws depending on how
the localization length is extracted.
","[{""version"":""v1"",""created"":""Tue, 23 Apr 2002 22:11:05 GMT""}]","2009-11-07"
"cond-mat/0204509","Krzysztof Malarz","K. Malarz, S. Kaczanowska, K. Kulakowski","Are Forest Fires Predictable?","13 pages, 13 figures","Int. J. Mod. Phys. C13 (2002) 1017","10.1142/S0129183102003760",,"cond-mat nlin.CD",,"  Dynamic mean field theory is applied to the problem of forest fires. The
starting point is the Monte Carlo simulation in a lattice of million cells. The
statistics of the clusters is obtained by means of the Hoshen--Kopelman
algorithm. We get the map $p_n\to p_{n+1}$, where $p_n$ is the probability of
finding a tree in a cell, and $n$ is the discrete time. We demonstrate that the
time evolution of $p$ is chaotic. The arguments are provided by the calculation
of the bifurcation diagram and the Lyapunov exponent. The bifurcation diagram
reveals several windows of stability, including periodic orbits of length
three, five and seven. For smaller lattices, the results of the iteration are
in qualitative agreement with the statistics of the forest fires in Canada in
years 1970--2000.
","[{""version"":""v1"",""created"":""Tue, 23 Apr 2002 22:20:09 GMT""}]","2011-12-13"
"cond-mat/0204510","Raquel A. Ribeiro","R. A. Ribeiro, S. L. Bud`ko, C. Petrovic, P. C. Canfield","Effects of stoichiometry, purity, etching and distilling on resistance
  of MgB2 pellets and wire segments",,,"10.1016/S0921-4534(02)01840-3",,"cond-mat.supr-con",,"  We present a study of the effects of non-stoichiometry, boron purity, wire
diameter and post-synthesis treatment (etching and Mg distilling) on the
temperature dependent resistance and resistivity of sintered MgB2 pellets and
wire segments. Whereas the residual resistivity ratio (RRR) varies between RRR
\~ 4 to RRR > 20 for different boron purity, it is only moderately affected by
non-stoichiometry (from 20% Mg deficiency to 20% Mg excess) and is apparently
independent of wire diameter and presence of Mg metal traces on the wire
surface. The obtained set of data indicates that RRR values in excess of 20 and
residual resistivities as low as rho{0} ~ 0.4 mu Ohm cm are intrinsic material
properties of high purity MgB2.
","[{""version"":""v1"",""created"":""Tue, 23 Apr 2002 22:21:01 GMT""}]","2009-11-07"
"cond-mat/0204511","J. B. Neaton","J. B. Neaton, C.-L. Hsueh, and K. M. Rabe","Enhanced polarization in strained BaTiO$_3$ from first principles","MRS Proceedings, Spring 2002",,,,"cond-mat.mtrl-sci",,"  The structure, polarization, and zone-center phonons of bulk tetragonal
BaTiO$_3$ under compressive epitaxial stress are calculated using density
functional theory within the local density approximation. The polarization,
computed using the Berry-phase formalism, increases with increasing
tetragonality and is found to be enhanced by nearly 70% for the largest
compressive misfit strain considered (-2.28%). The results are expected to be
useful for the analysis of coherent epitaxial BaTiO$_3$ thin films and
heterostructures grown on perovskite substrates having a smaller lattice
constant, such as SrTiO$_3$.
","[{""version"":""v1"",""created"":""Tue, 23 Apr 2002 23:05:07 GMT""}]","2007-05-23"
"cond-mat/0204513","Carsten A. Ullrich","C. A. Ullrich and W. Kohn","Degeneracy in Density Functional Theory: Topology in v- and n-Space","4 pages, 4 figures (1 color)",,"10.1103/PhysRevLett.89.156401",,"cond-mat.mtrl-sci cond-mat.mes-hall",,"  This paper clarifies the topology of the mapping between v- and n-space in
fermionic systems. Density manifolds corresponding to degeneracies g=1 and g>1
are shown to have the same mathematical measure: every density near a
g-ensemble-v-representable (g-VR) n(r) is also g-VR (except ``boundary
densities'' of lower measure). The role of symmetry and the connection between
T=0 and T=0+ are discussed. A lattice model and the Be-series are used as
illustrations.
","[{""version"":""v1"",""created"":""Wed, 24 Apr 2002 02:09:41 GMT""}]","2009-11-07"
"cond-mat/0204514","Weihong Zheng","W. Zheng and C.J. Hamer (Univ. of NSW, Sydney, Australia)","Two-Hole and Four-Hole Bound States in a t-J Ladder at half-filling","revtex 4",,"10.1103/PhysRevB.66.085112",,"cond-mat.str-el",,"  The two-hole excitation spectrum of the t-J ladder at half-filling is studied
using linked-cluster series expansion methods. A rich spectrum of bound states
emerges, particularly at small $t/J$. Their dispersion relations and coherence
lengths are computed, along with the threshold behaviour as the bound states
merge into the continuum. A class of 4-hole bound states is also studied,
leading to the conclusion that phase separation occurs for $t/J \lesssim 0.5$,
in agreement with other studies.
","[{""version"":""v1"",""created"":""Wed, 24 Apr 2002 02:44:00 GMT""}]","2009-11-07"
"cond-mat/0204515","Tatsuya Nagao","Jun-ichi Igarashi and Tatsuya Nagao","Resonant X-Ray Scattering from CeB$_{6}$","Latex, 10 pages, 12 figures. To be published in J. Phys. Soc. Jpn.,
  Vol.71, No. 7 (2002)",,"10.1143/JPSJ.71.1771",,"cond-mat.str-el",,"  We calculate the resonant x-ray scattering (RXS) spectra near the Ce $L_{\rm
III}$ absorption edge in CeB$_6$, on the basis of a microscopic model that the
$4f$ states of Ce are atomic while the $5d$ states form an energy band with a
reasonable density of states. In the initial state, we employ an effective
Hamiltonian of Shiina {\it et al}. in the antiferro-quadrupole (AFQ) ordering
phase, while we construct the wave function consistent with the neutron
scattering experiment in the magnetic ground state. In the intermediate state,
we take full account of the intra-atomic Coulomb interaction. Without assuming
any lattice distortion, we obtain sufficient RXS intensities on the AFQ
superlattice spot. We obtain the spectral shape, the temperature and magnetic
field dependences in good agreement with the experiment, thus demonstrating the
mechanism that the intensity is brought about by the modulation of $5d$ states
through the anisotropic term of the $5d$-$4f$ Coulomb interaction. In the
magnetic ground state, a small pre-edge peak is found by the $E_2$ process. On
the magnetic superlattice spot, we get a finite but considerably small
intensity. The magnetic form factor is briefly discussed.
","[{""version"":""v1"",""created"":""Wed, 24 Apr 2002 05:15:07 GMT""}]","2009-11-07"
"cond-mat/0204516","Alexander Korotkov","Rusko Ruskov and Alexander N. Korotkov","Quantum feedback control of a solid-state qubit","Extended version of cond-mat/0107280 (5 pages, 5 figures); to be
  published in PRB (RC)","Phys. Rev. B 66, 041401(R) (2002)","10.1103/PhysRevB.66.041401",,"cond-mat.mes-hall quant-ph",,"  We have studied theoretically the basic operation of a quantum feedback loop
designed to maintain a desired phase of quantum coherent oscillations in a
single solid-state qubit. The degree of oscillations synchronization with
external harmonic signal is calculated as a function of feedback strength,
taking into account available bandwidth and coupling to environment.
  The feedback can efficiently suppress the dephasing of oscillations if the
qubit coupling to the detector is stronger than coupling to environment.
","[{""version"":""v1"",""created"":""Wed, 24 Apr 2002 05:56:25 GMT""}]","2016-08-31"
