"hep-th/0204203","Koji Hashimoto","Koji Hashimoto","Dynamical Decay of Brane-Antibrane and Dielectric Brane","46 pages, 17 eps figures, references added, typos corrected","JHEP 0207:035,2002","10.1088/1126-6708/2002/07/035","UT-Komaba 02-02","hep-th",,"  Using D-brane effective field theories, we study dynamical decay of unstable
brane systems : (i) a parallel brane-antibrane pair with separation l and (ii)
a dielectric brane. In particular we give explicitly the decay width of these
unstable systems, and describe how the decay proceeds after the tunnel effect.
The decay (i) is analysed by the use of a tachyon effective action on the
Dp-Dpbar. A pair annihilation starts by nucleation of a bubble of a tachyon
domain wall which represents a throat connecting these branes, and the
tunneling decay width is found to be proportional to exp(-l^{p+1} T_{Dp}). We
study also the decay leaving topological defects corresponding to
lower-dimensional branes, which may be relevant for recent inflationary
braneworld scenario. As for the decay (ii), first we observe that Dp-branes
generically ``curl up'' in a nontrivial RR field strength. Using this
viewpoint, we compute the decay width of the dielectric D2-branes by
constructing relevant Euclidean bounce solutions in the shape of a funnel. We
also give new solutions in doughnut shape which are involved with nucleation of
dielectric branes from nothing.
","[{""version"":""v1"",""created"":""Wed, 24 Apr 2002 11:42:27 GMT""},{""version"":""v2"",""created"":""Tue, 30 Apr 2002 08:47:15 GMT""},{""version"":""v3"",""created"":""Wed, 12 Jun 2002 05:29:06 GMT""}]","2014-11-18"
"hep-th/0204204","Debashis Ghoshal","Debajyoti Choudhury, Debashis Ghoshal, Dileep P. Jatkar and Sudhakar
  Panda","On the Cosmological Relevance of the Tachyon","13 pages, 4 postscript figures,v2. comments and references added v3.
  Incompatible use of units corrected. Changes in numerical results and
  conclusion, namely tachyon driven inflation does not give enough e-foldings","Phys.Lett. B544 (2002) 231-238","10.1016/S0370-2693(02)02512-1","MRI-P-020402","hep-th",,"  We analyse of the effective action of the tachyon field on a D-brane, of both
bosonic as well as superstring theory. We find that the non-standard kinetic
term of the tachyon field requires a correction to the Born-Infeld type
Lagrangian. The cosmological significance of the resulting dynamics is
explored. We also examine if the rolling tachyon can provide an effective
cosmological constant and contrast its behaviour with quintessence.
","[{""version"":""v1"",""created"":""Wed, 24 Apr 2002 13:32:16 GMT""},{""version"":""v2"",""created"":""Fri, 17 May 2002 10:38:19 GMT""},{""version"":""v3"",""created"":""Tue, 23 Jul 2002 07:00:32 GMT""}]","2010-04-05"
"hep-th/0204205",,"S.L.Dubovsky and V.A.Rubakov","On electric charge non-conservation in brane world","14 pages, 4.ps figures; Prepared for Proceedings of Francqui Meeting
  on Strings and Gravity: Tying the Forces Together, Brussels, Belgium, 19-21
  Oct. 2001 and Proceedings of XXXVII Rencontres de Moriond, Les Arcs, France,
  9-16 March 2002",,,,"hep-th hep-ph",,"  In some models with infinite extra dimensions, gauge fields are localized on
a brane by gravity. A generic property of these models is the existence of
arbitrarily light bulk modes of charged fields. This property may lead to
interesting low-energy effects such as electric charge non-conservation on the
brane (decay of electron to nothing). One may worry that light charged
Kaluza--Klein modes would lead to unacceptable phenomenology due to their
copious production in, e.g., electron-positron annihilation and/or their
contribution to QED observables like anomalous magnetic moments. We argue,
however, that both loop effects and production of light charged Kaluza--Klein
modes are suppressed due to screening effect of gapless spectrum of bulk
photons.
","[{""version"":""v1"",""created"":""Wed, 24 Apr 2002 14:05:03 GMT""}]","2007-05-23"
"hep-th/0204206","Axel Krause","Axel Krause","Schwarzschild Black Holes from Brane-Antibrane Pairs","26 pages, 2 figures, reference added",,,,"hep-th gr-qc",,"  We show that D=4 Schwarzschild black holes can arise from a doublet of
Euclidean D3-antiD3 pairs embedded in D=10 Lorentzian spacetime. By starting
from a D=10 type IIB supergravity description for the D3-antiD3 pairs and
wrapping one of them over an external 2-sphere, we derive all vacuum solutions
compatible with the symmetry of the problem. Analysing under what condition a
Euclidean brane configuration embedded in a Lorentzian spacetime can lead to a
time-independent spacetime, enables us to single out the embedded D=4
Schwarzschild spacetime as the unique solution generated by the D3-antiD3
pairs. In particular we argue on account of energy-conservation that
time-independent solutions arising from isolated Euclidean branes require those
branes to sit at event horizons. In combination with previous work this
self-dual brane-antibrane origin of the black hole allows for a microscopic
counting of its Bekenstein-Hawking entropy. Finally we indicate how
Hawking-radiation can be understood from the associated tachyon condensation
process.
","[{""version"":""v1"",""created"":""Wed, 24 Apr 2002 14:41:34 GMT""},{""version"":""v2"",""created"":""Tue, 7 May 2002 12:23:20 GMT""}]","2007-05-23"
"hep-th/0204207","Igor Schnakenburg","Igor Schnakenburg and Peter West","Massive IIA Supergravity as a Non-linear Realisation","13 pages","Phys.Lett. B540 (2002) 137-145","10.1016/S0370-2693(02)02124-X","KCL-MTH-02-08","hep-th",,"  A description of the bosonic sector of massive IIA supergravity as a
non-linear realisation is given. An essential feature of this construction is
that the momentum generators have non-trivial commutation relations with the
generators associated with the gauge fields.
","[{""version"":""v1"",""created"":""Wed, 24 Apr 2002 14:37:27 GMT""}]","2009-11-07"
"hep-th/0204208","Alexei Vladimirov","Alexei Vladimirov","Notes on renormalization","AMSLaTeX, 5 pages, no figures. Other notes and updates are available
  at http://thsun1.jinr.ru/~alvladim/qft.html",,,,"hep-th",,"  We outline the proofs of several principal statements in conventional
renormalization theory. This may be of some use in the light of new trends and
new techniques (Hopf algebras, etc.) recently introduced in the field.
","[{""version"":""v1"",""created"":""Wed, 24 Apr 2002 14:45:13 GMT""}]","2007-05-23"
"hep-th/0204209","Douglas J. Smith","David C. Page and Douglas J. Smith","Giant gravitons in non-supersymmetric backgrounds","14 pages. v2: Minor corrections and improved presentation of 4-form
  potential","JHEP 0207 (2002) 028","10.1088/1126-6708/2002/07/028","DCPT-02/23","hep-th",,"  We consider giant gravitons as probes of a class of ten-dimensional solutions
of type IIB supergravity which arise as lifts of solutions of U(1)^3 gauged N=2
supergravity in five-dimensions. Surprisingly it is possible to solve exactly
for minimum energy configurations of these spherical D3-brane probes in the
compact directions, even in backgrounds which preserve no supersymmetry. The
branes behave as massive charged particles in the five non-compact dimensions.
As an example we probe geometries which are believed to represent the
supergravity background of coherent states of giant gravitons. We comment on
the apparently repulsive nature of the naked singularities in these geometries.
","[{""version"":""v1"",""created"":""Wed, 24 Apr 2002 15:47:10 GMT""},{""version"":""v2"",""created"":""Fri, 14 Jun 2002 11:55:01 GMT""}]","2009-11-07"
"math-ph/0204045","Alexander Zolotaryuk","P.L. Christiansen, A.V. Zolotaryuk, V.N. Ermakov and Y.B. Gaididei","Transparency Resonances and Bound States of the $\delta^\prime$ Junction","6 figures, submitted to PRL",,,,"math-ph cond-mat math.MP quant-ph",,"  Exact positive and negative energy solutions for the eigenvalue problem of
the Schr\""{o}dinger equation in one dimension with a $\delta^\prime$
interaction are found and analyzed. An infinite series of transparency
resonance levels in the strength of this interaction is shown to exist. This
result is against the actual belief that the $\delta^\prime$ potential acts as
a totally reflecting wall. A finite number of bound states is obtained,
contrary to the previous result on the existence of only one bound state. A new
effect of a {\it negative stepwise} drop in the electron density across the
$\delta^\prime$ junction is observed. The solutions are also applied to the
propagation of the electromagnetic field in dielectric media.
","[{""version"":""v1"",""created"":""Wed, 24 Apr 2002 10:13:18 GMT""}]","2007-05-23"
"math-ph/0204046","Constantin Piron","Constantin Piron","Quantum Theory without Quantification",,"Helv.Phys.Acta 69 (1996) 694-701",,,"math-ph math.MP",,"  After having explained Samuel Clarke's conception of the new philosophy of
physical reality, we will treat the electron field in this context as a field
modifying the void. From this we will be able to derive the so-called quantum
rules just from Noether's theorem on conserved currents. Thus quantum theory
appears as a kind of nonlocal field theory, in fact a new theory.
","[{""version"":""v1"",""created"":""Wed, 24 Apr 2002 09:45:14 GMT""}]","2007-05-23"
"math/0204271","Ben Weinkove","Ben Weinkove","Higher K-energy functionals and higher Futaki invariants","14 pages, Latex; references added, Theorem 2 corrected",,,,"math.DG",,"  This note discusses the higher K-energy functionals which were defined by
Bando and Mabuchi, and integrate higher Futaki invariants. Two new formulas for
the higher K-energy functionals are given, and the second K-energy is shown to
be related to Donaldson's Lagrangian applied to metrics on the tangent bundle.
","[{""version"":""v1"",""created"":""Tue, 23 Apr 2002 16:14:22 GMT""},{""version"":""v2"",""created"":""Wed, 1 May 2002 19:42:04 GMT""}]","2007-05-23"
"math/0204275","George Joseph McNinch","George J. McNinch, Eric Sommers","Component groups of unipotent centralizers in good characteristic","13 pages; AMS LaTeX. This is the final version; it will appear in the
  Steinberg birthday volume of the Journal of Algebra. This version corrects an
  oversight pointed out by the referee; see Prop 23","Journal of Algebra 260 (2003) 323-337","10.1016/S0021-8693(02)00661-0",,"math.RT math.GR",,"  Let G be a connected, reductive group over an algebraically closed field of
good characteristic. For u in G unipotent, we describe the conjugacy classes in
the component group A(u) of the centralizer of u. Our results extend work of
the second author done for simple, adjoint G over the complex numbers.
  When G is simple and adjoint, the previous work of the second author makes
our description combinatorial and explicit; moreover, it turns out that
knowledge of the conjugacy classes suffices to determine the group structure of
A(u). Thus we obtain the result, previously known through case-checking, that
the structure of the component group A(u) is independent of good
characteristic.
","[{""version"":""v1"",""created"":""Tue, 23 Apr 2002 16:34:41 GMT""},{""version"":""v2"",""created"":""Tue, 13 Aug 2002 15:51:58 GMT""}]","2007-05-23"
"math/0204278","David E. Evans","David E Evans","Fusion rules of modular invariants","23 pages","Rev.Math.Phys. 14 (2002) 709-732","10.1142/S0129055X02001351",,"math.OA hep-th math-ph math.MP",,"  Modular invariants satisfy remarkable fusion rules. Let $Z$ be a modular
invariant associated to a braided subfactor $N\subset M$. The decomposition of
the non-normalized modular invariants $Z Z^{*}$ and $Z^{*}Z$ into sums of
normalized modular invariants is related to the decomposition of the full
induced $M-M$ system of sectors.
","[{""version"":""v1"",""created"":""Tue, 23 Apr 2002 16:58:18 GMT""}]","2009-11-07"
"math/0204279","Tom Leinster","Tom Leinster","Generalized enrichment of categories","18 pages; written 1999","Journal of Pure and Applied Algebra 168 (2002), 391-406",,,"math.CT",,"  We define the phrase `category enriched in an fc-multicategory' and explore
some examples. An fc-multicategory is a very general kind of 2-dimensional
structure, special cases of which are double categories, bicategories, monoidal
categories and ordinary multicategories. Enrichment in an fc-multicategory
extends the (more or less well-known) theories of enrichment in a monoidal
category, in a bicategory, and in a multicategory. Moreover, fc-multicategories
provide a natural setting for the bimodules construction, traditionally
performed on suitably cocomplete bicategories. Although this paper is
elementary and self-contained, we also explain why, from one point of view,
fc-multicategories are the natural structures in which to enrich categories.
","[{""version"":""v1"",""created"":""Tue, 23 Apr 2002 16:58:45 GMT""}]","2007-05-23"
"math/0204280","Grunspan","Cyril Grunspan","Quantum torsors","12 pages",,,,"math.QA math.RT",,"  This text gives some results about quantum torsors. Our starting point is an
old reformulation of torsors recalled recently by Kontsevich. We propose an
unification of the definitions of torsors in algebraic geometry and in Poisson
geometry. Any quantum torsor is equipped with two comodule-algebra structures
over Hopf algebras and these structures commute with each other. In the finite
dimensional case, these two Hopf algebras share the same finite dimension. We
show that any Galois extension of a field is a torsor and that any torsor is a
Hopf-Galois extension. We give also examples of non-commutative torsors without
character. Torsors can be composed. This leads us to define a new
group-invariant, its torsors invariant. We show how Parmentier's quantization
formalism of ""affine Poisson groups"" is part of our theory of torsors.
","[{""version"":""v1"",""created"":""Tue, 23 Apr 2002 17:01:05 GMT""}]","2007-05-23"
"math/0204281","David E. Evans","David E Evans","Critical Phenomena, modular invariants and operator algebras","27 pages",,,,"math.OA hep-th math-ph math.MP",,"  We review the framework subfactors provide for understanding modular
invariants. We discuss the structure of a generalized Longo-Rehren subfactor
and the relationship between the coupling matrices of such subfactors, modular
invariance and local extensions. We relate results of Kostant, in the context
of the McKay correspondence for finite subgroups of SU(2), to subfactors. A
direct proof of how alpha-induction produces modular invariants is presented.
","[{""version"":""v1"",""created"":""Tue, 23 Apr 2002 17:13:28 GMT""}]","2007-05-23"
"math/0204282","Bojko Bakalov","Bojko Bakalov and Victor G. Kac","Field Algebras","Dedicated to E. B. Vinberg on the occasion of his 65th birthday. 27
  pages","Int. Math. Res. Not. 2003, no. 3, 123--159","10.1155/S1073792803204232",,"math.QA",,"  A field algebra is a ``non-commutative'' generalization of a vertex algebra.
In this paper we develop foundations of the theory of field algebras.
","[{""version"":""v1"",""created"":""Tue, 23 Apr 2002 18:46:54 GMT""},{""version"":""v2"",""created"":""Tue, 7 May 2002 00:58:40 GMT""}]","2007-05-23"
"math/0204283","Mirko Primc","Mirko Primc","Generators of relations for annihilating fields","13 pages, AMS-LaTeX",,,,"math.QA",,"  For an untwisted affine Kac-Moody Lie algebra $\tilde{\mathfrak g}$, and a
given positive integer level $k$, vertex operators $x(z)=\sum x(n)z^{-n-1}$,
$x\in\mathfrak g$, generate a vertex operator algebra $V$. For the maximal root
$\theta$ and a root vector $x_\theta$ of the corresponding finite-dimensional
$\mathfrak g$, the field $x_\theta(z)^{k+1}$ generates all annihilating fields
of level $k$ standard $\tilde{\mathfrak g}$-modules. In this paper we study the
kernel of the normal order product map $r(z)\otimes Y(v,z)\mapsto :r(z)
Y(v,z):$ for $v\in V$ and $r(z)$ in the space of annihilating fields generated
by the action of $\tfrac{d}{dz}$ and $\mathfrak g$ on $x_\theta(z)^{k+1}$. We
call the elements of this kernel the relations for annihilating fields, and the
main result is that this kernel is generated, in certain sense, by the relation
$x_\theta(z)\tfrac{d}{dz}(x_\theta(z)^{k+1})=
(k+1)x_\theta(z)^{k+1}\tfrac{d}{dz}x_\theta(z)$. This study is motivated by
Lepowsky-Wilson's approach to combinatorial Rogers-Ramanujan type identities,
and many ideas used here stem from a joint work with Arne Meurman.
","[{""version"":""v1"",""created"":""Tue, 23 Apr 2002 21:11:05 GMT""}]","2007-05-23"
"math/0204284","Michael J. Nakamaye","Michael Nakamaye","Base loci of linear series are numerically determined","19 pages",,,,"math.AG",,"  Suppose D is an effective divisor on a smooth projective algebraic variety X.
For each point x of X we associate a numberical invariant called the moving
Seshadri constant of D at x which is a numerical measure of positivity of the
divisor D at x. We determine the base locus of a large multiple of D by
studying these moving Seshadri constants-- the drawback to this method is that
these moving Seshadri constants are extremely difficult to compute.
","[{""version"":""v1"",""created"":""Tue, 23 Apr 2002 21:23:06 GMT""}]","2007-05-23"
"math/0204285","Denis Auroux","Denis Auroux","Fiber sums of genus 2 Lefschetz fibrations","9 pages",,,,"math.GT math.SG",,"  Using the recent results of Siebert and Tian about the holomorphicity of
genus 2 Lefschetz fibrations with irreducible singular fibers, we show that any
genus 2 Lefschetz fibration becomes holomorphic after fiber sum with a
holomorphic fibration.
","[{""version"":""v1"",""created"":""Tue, 23 Apr 2002 21:23:34 GMT""}]","2007-05-23"
"math/0204286","Denis Auroux","Denis Auroux","A remark about Donaldson's construction of symplectic submanifolds","8 pages",,,,"math.DG math.SG",,"  We describe a simplification of Donaldson's arguments for the construction of
symplectic hypersurfaces or Lefschetz pencils that makes it possible to avoid
any reference to Yomdin's work on the complexity of real algebraic sets.
","[{""version"":""v1"",""created"":""Tue, 23 Apr 2002 21:36:46 GMT""}]","2007-05-23"
"math/0204287","Bohui Chen","Bohui Chen","A Smooth Compactification of the Moduli Space of Instantons and Its
  Application","65 pages",,,,"math.GT",,"  A smooth compactification of Donaldson moduli spaces is given. As an
application, we use this new space to study the wall-crossing formula and prove
the Kotschick-Morgan conjecture.
","[{""version"":""v1"",""created"":""Tue, 23 Apr 2002 21:56:06 GMT""}]","2007-05-23"
"math/0204288","Ryushi Goto","Ryushi Goto","Deformations of calibrations, {Calabi-Yau, HyperK\""ahler, $G_2$ and
  Spin(7) structures}","54pages",,,,"math.DG",,"  We shall develop a new deformation theory of geometric structures in terms of
closed differential forms. This theory is a generalization of Kodaira -Spencer
theory and further we obtain a criterion of unobstructed deformations. We apply
this theory to certain geometric structures: Calabi-Yau, HyperK\""ahler, $\G$
and $\Spin$ structures and show that these deformation spaces are smooth in a
systematic way.
","[{""version"":""v1"",""created"":""Wed, 24 Apr 2002 09:25:44 GMT""},{""version"":""v2"",""created"":""Thu, 25 Apr 2002 00:32:21 GMT""}]","2009-09-29"
"math/0204289","R. Liptser","N. V. Krylov, R. Liptser","On diffusion approximation with discontinuous coefficients","29 pages",,,,"math.PR math.SG",,"  Convergence of stochastic processes with jumps to diffusion processes is
investigated in the case when the limit process has discontinuous coefficients.
  An example is given in which the diffusion approximation of a queueing model
yields a diffusion process with discontinuous diffusion and drift coefficients.
","[{""version"":""v1"",""created"":""Wed, 24 Apr 2002 09:26:39 GMT""}]","2016-09-07"
"math/0204290","Oleg Viro","Oleg Viro","Quantum Relatives of Alexander Polynomial","72 pages",,,,"math.GT math.QA",,"  The multivariable Conway function is generalized to oriented framed trivalent
graphs equipped with additional structure (coloring). This is done via
refinements of Reshetikhin-Turaev functors based on irreducible representations
of quantized gl(1|1) and sl(2). The corresponding face state sum models for the
generalized Conway function are presented.
","[{""version"":""v1"",""created"":""Wed, 24 Apr 2002 10:47:52 GMT""}]","2007-05-23"
"math/0204291","Paul David Mitchener","Paul D. Mitchener","C*-categories, Groupoid Actions, Equivariant KK-theory, and the
  Baum-Connes Conjecture",,,,,"math.KT math.AT",,"  In this article we give a characterisation of the Baum-Connes assembly map
with coefficients. The technical tools needed are the K-theory of
C*-categories, and equivariant KK-theory in the world of groupoids.
","[{""version"":""v1"",""created"":""Wed, 24 Apr 2002 13:05:10 GMT""}]","2007-05-23"
"math/0204292","Jean-Camille Birget","Jean-Camille Birget","The groups of Richard Thompson and complexity",,,,,"math.GR",,"  We prove new results about the remarkable infinite simple groups introduced
by Richard Thompson in the 1960s. We define the groups as partial
transformation groups and we give a faithful representation in the Cuntz
C*-algebra. For the finitely presented simple group T_fin (also known as V) we
show that the word-length and the table size satisfy an n log n relation, just
like the symmetric groups. We show that the word problem of T_fin belongs to
the parallel complexity class AC^1 (a subclass of plynomial time). We show that
the generalized word problem of T_fin is undecidable.
  We study the distortion functions of T_fin and we show that T_fin contains
all finite direct products of finitely generated free groups as subgroups with
linear distortion. As a consequence, up to polynomial equivalence of functions,
the following three sets are the same: the set of distortions of T_fin, the set
of all Dehn functions of finitely presented groups, and the set of time
complexity functions of nondeterministic Turing machines.
","[{""version"":""v1"",""created"":""Wed, 24 Apr 2002 13:24:01 GMT""},{""version"":""v2"",""created"":""Fri, 31 Oct 2003 14:09:18 GMT""}]","2007-05-23"
"math/0204293","Michael Rapoport","J.-M. Fontaine, M. Rapoport","Existence de filtrations admissibles sur des isocristaux","10 pages, AMS-TeX",,,,"math.NT math.AG",,"  Let (D,phi) be an isocrystal over an algebraically closed field of
characteristic p. Let F^bullet be a filtration on D. If F^bullet is (weakly)
admissible, its type vector is greater or equal to the slope vector of (D,phi).
We prove that conversely, give a type mu greater or equal to the slope vector
of (D,phi), there exists an admissible filtration F^bullet on D of type vector
equal to mu. We also give a group theoretic version of this statement and
relate it to the existence of lattices M in D with mu(M)=mu.
","[{""version"":""v1"",""created"":""Wed, 24 Apr 2002 13:41:53 GMT""}]","2007-05-23"
"math/0204294","Leandro Moral","Maria J. Cantero (Universidad de Zaragoza, Spain), Maria P. Ferrer
  (Universidad de Zaragoza, Spain), Leandro Moral (Universidad de Zaragoza,
  Spain), Luis Velazquez (Universidad de Zaragoza, Spain)","A connection between orthogonal polynomials on the unit circle and
  matrix orthogonal polynomials on the real line","28 pages",,"10.1016/S0377-0427(02)00824-5",,"math.CA",,"  Szego's procedure to connect orthogonal polynomials on the unit circle and
orthogonal polynomials on [-1,1] is generalized to nonsymmetric measures. It
generates the so-called semi-orthogonal functions on the linear space of
Laurent polynomials L, and leads to a new orthogonality structure in the module
LxL. This structure can be interpreted in terms of a 2x2 matrix measure on
[-1,1], and semi-orthogonal functions provide the corresponding sequence of
orthogonal matrix polynomials. This gives a connection between orthogonal
polynomials on the unit circle and certain classes of matrix orthogonal
polynomials on [-1,1]. As an application, the strong asymptotics of these
matrix orthogonal polynomials is derived, obtaining an explicit expression for
the corresponding Szego's matrix function.
","[{""version"":""v1"",""created"":""Wed, 24 Apr 2002 13:52:00 GMT""}]","2015-06-26"
"math/0204295","Andrei Mudrov","J. Donin, A. Mudrov","Reflection Equation, Twist, and Equivariant Quantization","17 pages, AMS Latex","Isr. J. Math. V.136 (2003), 11-28",,,"math.QA",,"  We prove that the reflection equation (RE) algebra $\La_R$ associated with a
finite dimensional representation of a quasitriangular Hopf algebra $\Ha$ is
twist-equivalent to the corresponding Faddeev-Reshetikhin-Takhtajan (FRT)
algebra. We show that $\La_R$ is a module algebra over the twisted tensor
square \twist{$\Ha$}{$\Ha$} and the double $\D(\Ha)$. We define FRT- and
RE-type algebras and apply them to the problem of equivariant quantization on
Lie groups and matrix spaces.
","[{""version"":""v1"",""created"":""Wed, 24 Apr 2002 14:32:12 GMT""}]","2007-05-23"
"math/0204296","Andrei Mudrov","A. Mudrov","Characters of $\U_q\bigl(gl(n)\bigr)$-reflection equation algebra","10 pages, AMS Latex","Lett.Math.Phys., V.60 (2002) #3 283-291",,,"math.QA",,"  We list characters (one-dimensional representations) of the reflection
equation algebra associated with the fundamental vector representation of the
Drinfeld-Jimbo quantum group $\U_q\bigl(gl(n)\bigr)$.
","[{""version"":""v1"",""created"":""Wed, 24 Apr 2002 14:36:21 GMT""}]","2007-05-23"
