"cond-mat/0204517","Kestutis Staliunas","Kestutis Staliunas, Stefano Longhi, and German J. de Valcarcel","Faraday patterns in Bose-Einstein condensates","submitted to Phys.Rev.Letters",,"10.1103/PhysRevLett.89.210406",,"cond-mat.stat-mech nlin.PS",,"  Temporal periodic modulation of the interatomic s-wave scattering length in
Bose-Einstein condensates is shown to excite subharmonic patterns of atom
density through a parametric resonance. The dominating wavelength of the
spatial structures is shown to be primarily selected by the excitation
frequency but also affected by the depth of the spatial modulation via a
nonlinear resonance. These phenomena represent macroscopic quantum analogues of
the Faraday waves excited in vertically shaken liquids.
","[{""version"":""v1"",""created"":""Wed, 24 Apr 2002 08:18:23 GMT""}]","2009-11-07"
"cond-mat/0204518","Guido Tiana","G. Tiana and R. A. Broglia","Design and Folding of Dimeric Proteins",,,,,"cond-mat.soft q-bio",,"  In a similar way in which the folding of single--domain proteins provide an
important test in the study of self--organization, the folding of homodimers
constitute a basic challenge in the quest for the mechanisms which are at the
basis of biological recognition. Dimerization is studied by following the
evolution of two identical 20--letter amino acid chains within the framework of
a lattice model and using Monte Carlo simulations. It is found that when design
(evolution pressure) selects few, strongly interacting (conserved) amino acids
to control the process, a three--state folding scenario follows, where the
monomers first fold forming the halves of the eventual dimeric interface
independently of each other, and then dimerize (""lock and key"" kind of
association). On the other hand, if design distributes the control of the
folding process on a large number of (conserved) amino acids, a two--state
folding scenario ensues, where dimerization takes place at the beginning of the
proces, resulting in an ""induced type"" of association. Making use of
conservation patterns of families of analogous dimers, it is possible to
compare the model predictions with the behaviour of real proteins. It is found
that theory provides an overall account of the experimental findings.
","[{""version"":""v1"",""created"":""Wed, 24 Apr 2002 08:19:52 GMT""}]","2007-05-23"
"cond-mat/0204519","Carlin E. Yasin","C. E. Yasin, M. Y. Simmons, A. R. Hamilton, N. E. Lumpkin, and R. G.
  Clark, L. N. Pfeiffer and K. W. West","Universal behaviour in the floating up of quantum Hall extended states
  as B -> 0","5 pages, 4 figures",,,,"cond-mat.mes-hall cond-mat.str-el",,"  We investigate the relationship between the quantum Hall extended states and
the apparent B=0 `metal'-insulator transition in extremely low density, high
quality two-dimensional n-GaAs systems (\mu_{peak} ~ 2 x 10^7 cm^2/Vs). The
combination of small effective mass and high quality allow us to resolve the
continued floating up in energy of the extended states down to very low
magnetic fields, B=0.015T, despite an apparent `metal'-insulator transition at
B = 0. We present a modified global phase diagram which brings together
conflicting data in the literature from different material systems, and
reconciles the differences as to the fate of the extended states as B -> 0.
","[{""version"":""v1"",""created"":""Wed, 24 Apr 2002 09:58:08 GMT""},{""version"":""v2"",""created"":""Thu, 13 Jun 2002 05:14:01 GMT""}]","2007-05-23"
"cond-mat/0204520","Olivier Chauvet","J.M. Benoit, B. Corraze, O. Chauvet","Localization, Coulomb interactions and electrical heating in single-wall
  carbon nanotubes/polymer composites","4 pages, 5 figures, Submitted to Phys. Rev. B",,"10.1103/PhysRevB.65.241405",,"cond-mat.mes-hall",,"  Low field and high field transport properties of carbon nanotubes/polymer
composites are investigated for different tube fractions. Above the percolation
threshold f_c=0.33%, transport is due to hopping of localized charge carriers
with a localization length xi=10-30 nm. Coulomb interactions associated with a
soft gap Delta_CG=2.5 meV are present at low temperature close to f_c. We argue
that it originates from the Coulomb charging energy effect which is partly
screened by adjacent bundles. The high field conductivity is described within
an electrical heating scheme. All the results suggest that using composites
close to the percolation threshold may be a way to access intrinsic properties
of the nanotubes by experiments at a macroscopic scale.
","[{""version"":""v1"",""created"":""Wed, 24 Apr 2002 10:20:36 GMT""}]","2009-11-07"
"cond-mat/0204521","Andrew Armour","A.D. Armour and A. MacKinnon","Transport via a quantum shuttle",,"Phys. Rev. B 66 035333 (2002)","10.1103/PhysRevB.66.035333",,"cond-mat.mes-hall",,"  We investigate the effect of a quantised vibrational mode on electron
tunneling through a chain of three quantum dots. The outer dots are coupled to
voltage leads, but the position of the central dot is not rigidly fixed. Motion
of the central dot modulates the size of the tunneling barriers in opposite
ways so that electron tunneling is correlated with the position of the
oscillator. We treat the electronic part of the problem using a simple
Coulomb-blockade picture, and model the vibration of the central dot as a
quantum oscillator. We calculate the eigenspectrum of the system as a function
of the energy level shift between the outer dots. Using a density matrix
method, we include couplings to external leads and calculate the steady-state
current through the device. The current shows marked resonances which
correspond to avoided-level crossings in the eigenvalue spectrum. When the
tunneling length of the electrons is of order the zero-point position
uncertainty of the quantum oscillator, current far from the electronic
resonance is dominated by electrons hopping on and off the central dot
sequentially; the oscillator can be regarded as shuttling electrons across the
system [L.Y. Gorelik, et al., Phys. Rev. Lett. 80, 4526 (1998)]. Damping of the
oscillator can increase the current by preventing electrons from hopping
`backwards'.
","[{""version"":""v1"",""created"":""Wed, 24 Apr 2002 11:13:28 GMT""},{""version"":""v2"",""created"":""Thu, 8 Aug 2002 14:54:09 GMT""},{""version"":""v3"",""created"":""Mon, 18 Nov 2002 09:23:29 GMT""}]","2009-11-07"
"cond-mat/0204522","Kafri Yariv","M. R. Evans, Y. Kafri, E. Levine, D. Mukamel","Phase transition in a non-conserving driven diffusive system",,"J. Phys. A Vol. 35 L433 (2002)","10.1088/0305-4470/35/29/101",,"cond-mat.stat-mech",,"  An asymmetric exclusion process comprising positive particles, negative
particles and vacancies is introduced. The model is defined on a ring and the
dynamics does not conserve the number of particles. We solve the steady state
exactly and show that it can exhibit a continuous phase transition in which the
density of vacancies decreases to zero. The model has no absorbing state and
furnishes an example of a one-dimensional phase transition in a homogeneous
non-conserving system which does not belong to the absorbing state universality
classes.
","[{""version"":""v1"",""created"":""Wed, 24 Apr 2002 11:29:11 GMT""}]","2009-11-07"
"cond-mat/0204523","Reuven Cohen","N. Schwartz, R. Cohen, D. ben-Avraham, A.-L. Barabasi and S. Havlin","Percolation in Directed Scale-Free Networks","Latex, 5 pages, 2 figs","Phys. Rev. E 66, 015104 (2002)","10.1103/PhysRevE.66.015104",,"cond-mat.dis-nn",,"  Many complex networks in nature have directed links, a property that affects
the network's navigability and large-scale topology. Here we study the
percolation properties of such directed scale-free networks with correlated in-
and out-degree distributions. We derive a phase diagram that indicates the
existence of three regimes, determined by the values of the degree exponents.
In the first regime we regain the known directed percolation mean field
exponents. In contrast, the second and third regimes are characterized by
anomalous exponents, which we calculate analytically. In the third regime the
network is resilient to random dilution, i.e., the percolation threshold is
p_c->1.
","[{""version"":""v1"",""created"":""Wed, 24 Apr 2002 11:39:38 GMT""},{""version"":""v2"",""created"":""Tue, 6 Aug 2002 07:51:50 GMT""}]","2009-11-07"
"cond-mat/0204524","Takeru Suzuki","Takeru Suzuki, Hiroshi Imamura, Masahiko Hayashi and Hiromichi Ebisawa","Orbital Magnetism in Three-Dimensional Quantum Dots","5 pages, 3 figures",,"10.1143/JPSJ.71.1242",,"cond-mat.mes-hall",,"  We study orbital magnetism in a three-dimensional (3D) quantum dot with a
parabolic confining potential. We calculate the free energy of the system as a
function of the magnetic field and the temperature. By this, we show that the
temperature-field plane can be classified into three regions in terms of the
characteristic behavior of the magnetization: the Landau diamagnetism, de
Haas-van Alphen oscillation and mesoscopic fluctuation of magnetization. We
also calculate numerically the magnetization of the system and then the current
density distribution. As for the oscillation of the magnetization when the
field is varied, the 3D quantum dot shows a longer period than a 2D quantum dot
which contains the same number of electrons. A large paramagnetism appears at
low temperatures when the magnetic field is very weak.
","[{""version"":""v1"",""created"":""Wed, 24 Apr 2002 13:14:49 GMT""},{""version"":""v2"",""created"":""Wed, 24 Apr 2002 22:59:54 GMT""}]","2009-11-07"
"cond-mat/0204525","Tobias Hertel","Hendrik Ulbricht, Gunnar Moos, and Tobias Hertel","Physisorption of molecular oxygen on single-wall carbon nanotube bundles
  and graphite","7 pages, 5 figures, 1 table",,"10.1103/PhysRevB.66.075404",,"cond-mat.mtrl-sci",,"  We present a study on the kinetics of oxygen adsorption and desorption from
single-wall carbon nanotube (SWNT) and highly oriented pyrolytic graphite
(HOPG) samples. Thermal desorption spectra for SWNT samples show a broad
desorption feature peaked at 62 K which is shifted to significantly higher
temperature than the low-coverage desorption feature on HOPG. The low-coverage
O2 binding energy on SWNT bundles, 18.5 kJ/mol, is 55% higher than that for
adsorption on HOPG, 12.0 kJ/mol. In combination with molecular mechanics
calculations we show that the observed binding energies for both systems can be
attributed to van der Waals interactions, i.e. physisorption. The experiments
provide no evidence for a more strongly bound chemisorbed species or for
dissociative oxygen adsorption.
","[{""version"":""v1"",""created"":""Wed, 24 Apr 2002 13:30:21 GMT""}]","2009-11-07"
"cond-mat/0204526","Sergio E. Ulloa","Wei Zhang, Alexander O. Govorov, and Sergio E. Ulloa","Polarons with a twist","revtex4 source and one eps figure",,"10.1103/PhysRevB.66.060303",,"cond-mat.mes-hall cond-mat.soft",,"  We consider a polaron model where molecular \emph{rotations} are important.
Here, the usual hopping between neighboring sites is affected directly by the
electron-phonon interaction via a {\em twist-dependent} hopping amplitude. This
model may be of relevance for electronic transport in complex molecules and
polymers with torsional degrees of freedom, such as DNA, as well as in
molecular electronics experiments where molecular twist motion is significant.
We use a tight-binding representation and find that very different polaronic
properties are already exhibited by a two-site model -- these are due to the
nonlinearity of the restoring force of the twist excitations, and of the
electron-phonon interaction in the model. In the adiabatic regime, where
electrons move in a {\em low}-frequency field of twisting-phonons, the
effective splitting of the energy levels increases with coupling strength. The
bandwidth in a long chain shows a power-law suppression with coupling, unlike
the typical exponential dependence due to linear phonons.
","[{""version"":""v1"",""created"":""Wed, 24 Apr 2002 14:19:17 GMT""}]","2009-11-07"
"cond-mat/0204527","Andreas Wallraff","A. Wallraff, A. Lukashenko, C. Coqui, T. Duty, A. V. Ustinov","High resolution measurements of the switching current in a Josephson
  tunnel junction: Thermal activation and macroscopic quantum tunneling","10 pages, 8 figures, 1 table","Review of Scientific Instruments 74, 3740 (2003)","10.1063/1.1588752",,"cond-mat.supr-con",,"  We have developed a scheme for a high resolution measurement of the switching
current distribution of a current biased Josephson tunnel junction using a
timing technique. The measurement setup is implemented such that the digital
control and read-out electronics are optically decoupled from the analog bias
electronics attached to the sample. We have successfully used this technique to
measure the thermal activation and the macroscopic quantum tunneling of the
phase in a small Josephson tunnel junction with a high experimental resolution.
This technique may be employed to characterize current-biased Josephson tunnel
junctions for applications in quantum information processing.
","[{""version"":""v1"",""created"":""Wed, 24 Apr 2002 15:28:11 GMT""}]","2009-11-07"
"cond-mat/0204528","Oliver Morsch","O. Morsch, M. Cristiani, J.H. M\""uller, D. Ciampini, and E. Arimondo","Free expansion of a Bose-Einstein condensate in a 1D optical lattice","4 pages, 5 figures. Revised version (error bars in figure 5,
  additional references)",,"10.1103/PhysRevA.66.021601",,"cond-mat.soft",,"  We have experimentally investigated the free expansion of a Bose-Einstein
condensate in an array of two-dimensional traps created by a one-dimensional
optical lattice. If the condensate held in a magnetic trap is loaded
adiabatically into the lattice, the increase in chemical potential due to the
additional periodic potential is reflected in the expansion of the condensate
after switching off the magnetic trap. We have calculated the chemical
potential from measurements of the transverse expansion of the condensate as a
function of the lattice parameters.
","[{""version"":""v1"",""created"":""Wed, 24 Apr 2002 15:53:17 GMT""},{""version"":""v2"",""created"":""Fri, 31 May 2002 14:53:50 GMT""}]","2009-11-07"
"cs/0204049","Erik Tjong Kim Sang","Erik F. Tjong Kim Sang","Memory-Based Shallow Parsing",,"Journal of Machine Learning Research, volume 2 (March), 2002, pp.
  559-594",,"jmlr-2002-tks","cs.CL",,"  We present memory-based learning approaches to shallow parsing and apply
these to five tasks: base noun phrase identification, arbitrary base phrase
recognition, clause detection, noun phrase parsing and full parsing. We use
feature selection techniques and system combination methods for improving the
performance of the memory-based learner. Our approach is evaluated on standard
data sets and the results are compared with that of other systems. This reveals
that our approach works well for base phrase identification while its
application towards recognizing embedded structures leaves some room for
improvement.
","[{""version"":""v1"",""created"":""Wed, 24 Apr 2002 14:48:31 GMT""}]","2007-05-23"
"gr-qc/0204073","Luciano Rezzolla","L. Rezzolla and O. Zanotti","New Relativistic Effects in the Dynamics of Nonlinear Hydrodynamical
  Waves","4 pages, 5 figures","Phys.Rev.Lett. 89 (2002) 114501","10.1103/PhysRevLett.89.114501",,"gr-qc astro-ph physics.flu-dyn",,"  In Newtonian and relativistic hydrodynamics the Riemann problem consists of
calculating the evolution of a fluid which is initially characterized by two
states having different values of uniform rest-mass density, pressure and
velocity. When the fluid is allowed to relax, one of three possible
wave-patterns is produced, corresponding to the propagation in opposite
directions of two nonlinear hydrodynamical waves. New effects emerge in a
special relativistic Riemann problem when velocities tangential to the initial
discontinuity surface are present. We show that a smooth transition from one
wave-pattern to another can be produced by varying the initial tangential
velocities while otherwise maintaining the initial states unmodified. These
special relativistic effects are produced by the coupling through the
relativistic Lorentz factors and do not have a Newtonian counterpart.
","[{""version"":""v1"",""created"":""Tue, 23 Apr 2002 17:03:28 GMT""}]","2009-11-07"
"gr-qc/0204074","Ghazal Geshnizjani","Ghazal Geshnizjani and Robert Brandenberger","Back Reaction And Local Cosmological Expansion Rate","7 pages, No figures","Phys.Rev.D66:123507,2002","10.1103/PhysRevD.66.123507",,"gr-qc astro-ph hep-ph hep-th",,"  We calculate the back reaction of cosmological perturbations on a general
relativistic variable which measures the local expansion rate of the Universe.
Specifically, we consider a cosmological model in which matter is described by
a single field. We analyze back reaction both in a matter dominated Universe
and in a phase of scalar field-driven chaotic inflation. In both cases, we find
that the leading infrared terms contributing to the back reaction vanish when
the local expansion rate is measured at a fixed value of the matter field which
is used as a clock, whereas they do not appear to vanish if the expansion rate
is evaluated at a fixed value of the background time. We discuss possible
implications for more realistic models with a more complicated matter sector.
","[{""version"":""v1"",""created"":""Tue, 23 Apr 2002 21:07:43 GMT""}]","2008-11-26"
"gr-qc/0204075","He Han","He Han, Zhao Zheng","Entropy of a nonuniformly rectilinearly accelerating black hole",,,,,"gr-qc",,"  Adopting thin film brick-wall model, we calculate the entropy of a
nonuniformly rectilinearly accelerating non-stationary black hole expressed by
Kinnersley metric. Because the black hole is accelerated, the event horizon is
axisymmetric. The different points of horizon surface may have different
temperature. We calculate the temperature and the entropy density at every
point of the horizon at first, then we obtain the total entropy through
integration, which is proportional to the aera of event horizon as the same as
the stationary black holes. It is shown that the black hole entropy may be
regarded as the entropy of quantum fields just on the surface of event horizon.
","[{""version"":""v1"",""created"":""Wed, 24 Apr 2002 02:11:27 GMT""}]","2007-05-23"
"hep-ex/0204031","Leonard Apanasevich","Fermilab E706 Collaboration: L. Apanasevich, et al","Production of pizero and eta mesons at large transverse momenta in pp
  and pBe interactions at 530 and 800 GeV/c","RevTeX, 63 pages, 25 figures, to be submitted to Phys. Rev. D","Phys.Rev.D68:052001,2003","10.1103/PhysRevD.68.052001","FERMILAB-Pub-01/021-E","hep-ex",,"  We present results on the production of high transverse momentum pizero and
eta mesons in pp and pBe interactions at 530 and 800 GeV/c. The data span the
kinematic ranges: 1 < p_T < 10 GeV/c in transverse momentum and 1.5 units in
rapidity. The inclusive pizero cross sections are compared with next-to-leading
order QCD calculations and to expectations based on a phenomenological
parton-k_T model.
","[{""version"":""v1"",""created"":""Tue, 23 Apr 2002 21:04:03 GMT""}]","2009-04-17"
"hep-lat/0204021","Michael Engelhardt","Michael Engelhardt (Tuebingen)","Center vortex model for nonperturbative strong interaction physics","12 LaTeX pages, 8 ps figure files included via epsf, class
  crckbked.cls and style files called therein (Kluwer); to appear in:
  Proceedings of the NATO Advanced Research Workshop on Confinement, Topology,
  and other Non-Perturbative Aspects of QCD, Stara Lesna, Slovakia,
  21.-27.1.2002",,,,"hep-lat hep-ph hep-th",,"  A model for the infrared sector of SU(2) Yang-Mills theory, based on magnetic
vortex degrees of freedom represented by (closed) random world-surfaces, is
presented. The model quantitatively describes both the confinement properties
(including the finite-temperature transition to a deconfined phase) and the
topological susceptibility of the Yang-Mills ensemble. A (quenched) study of
the spectrum of the Dirac operator furthermore yields a behavior for the chiral
condensate which is compatible with results obtained in lattice gauge theory.
","[{""version"":""v1"",""created"":""Tue, 23 Apr 2002 16:03:21 GMT""}]","2007-05-23"
"hep-lat/0204022","Kubo","Shinji Ejiri, Shouji Fujimoto and Jisuke Kubo","Scaling Laws and Effective Dimension in Lattice SU(2) Yang-Mills Theory
  with a Compactified Extra Dimension","15 pages, TeX, 5 figures","Phys.Rev. D66 (2002) 036002","10.1103/PhysRevD.66.036002","KANAZAWA-02-07","hep-lat hep-ph",,"  Monte Carlo simulations are performed in a five-dimensional lattice SU(2)
Yang-Mills theory with a compactified extra dimension, and scaling laws are
studied. Our simulations indicate that as the compactification radius $R$
decreases, the confining phase spreads more and more to the weak coupling
regime, and the effective dimension of the theory changes gradually from five
to four. Our simulations also indicate that the limit $a_4 to 0$ with $R/a_4$
kept fixed exists both in the confining and deconfining phases if $R/a_4$ is
small enough, where $a_4$ is the lattice spacing in the four-dimensional
direction. We argue that the color degrees of freedom in QCD are confined only
for $R < R_{\rm max}$, where a rough estimate shows that $1/R_{\rm max}$ lies
in the TeV range. Comments on deconstructing extra dimensions are given.
","[{""version"":""v1"",""created"":""Wed, 24 Apr 2002 07:46:11 GMT""}]","2009-11-07"
"hep-lat/0204023","Leonardo Cosmai","Paolo Cea and Leonardo Cosmai","Abelian chromomagnetic fields and confinement","10 pages, 3 figures","JHEP 0302 (2003) 031","10.1088/1126-6708/2003/02/031","BARI-TH 436/2002","hep-lat astro-ph hep-ph",,"  We study vacuum dynamics of SU(3) lattice gauge theory at finite temperature
using the lattice Schr\""odinger functional. The SU(3) vacuum is probed by means
of an external constant Abelian chromomagnetic field. We find that by
increasing the strength of the applied external field the deconfinement
temperature decreases towards zero. This means that strong enough Abelian
chromomagnetic fields destroy confinement of color. We discuss some
consequences of this phenomenon on confinement and quark stars.
","[{""version"":""v1"",""created"":""Wed, 24 Apr 2002 14:35:23 GMT""}]","2009-11-07"
"hep-ph/0204271","Carlos Munoz","D.G. Cerdeno, E. Gabrielli, C. Munoz","Experimental Constraints on the Neutralino-Nucleon Cross Section","References added, bsgamma upper bound improved, results unchanged,
  Talk given at Corfu Summer Institute on Elementary Particle Physics, August
  31-September 20, 2001",,,"FTUAM 02/11, IFT-UAM/CSIC-02-11, HIP-2002-17/TH","hep-ph",,"  In the light of recent experimental results for the direct detection of dark
matter, we analyze in the framework of SUGRA the value of the
neutralino-nucleon cross section. We study how this value is modified when the
usual assumptions of universal soft terms and GUT scale are relaxed. In
particular we consider scenarios with non-universal scalar and gaugino masses
and scenarios with intermediate unification scale. We also study superstring
constructions with D-branes, where a combination of the above two scenarios
arises naturally. In the analysis we take into account the most recent
experimental constraints, such as the lower bound on the Higgs mass, the $b\to
s\gamma$ branching ratio, and the muon $g-2$.
","[{""version"":""v1"",""created"":""Tue, 23 Apr 2002 16:25:55 GMT""},{""version"":""v2"",""created"":""Tue, 14 May 2002 19:49:08 GMT""}]","2007-05-23"
"hep-ph/0204272","Fred Myhrer","H. Hogaasen, K. Kubodera and F. Myhrer","Quark-quark correlations and baryon electroweak observables","7 pages, 1 figure","Phys.Rev. D66 (2002) 057501","10.1103/PhysRevD.66.057501",,"hep-ph nucl-th",,"  The simple independent quark models have difficulties explaining
simultaneously the totality of the known hyperon magnetic moments and hyperon
semi-leptonic decay rates. We show that both the Goldstone boson loop
contributions and the two-quark effective exchange currents are essential in
explaining these observables.
","[{""version"":""v1"",""created"":""Tue, 23 Apr 2002 16:33:51 GMT""}]","2009-11-07"
"hep-ph/0204273","Paul H. Frampton","Paul H. Frampton, Myoung C. Oh and Tadashi Yoshikawa","Majorana Mass Zeroes from Triplet VEV without Majoron Problem","4 pages latex including one figure","Phys.Rev. D66 (2002) 033007","10.1103/PhysRevD.66.033007",,"hep-ph",,"  It is shown how to obtain recently-proposed two-zero Majorana mass textures
in models with three Higgs triplets with small VEVs and a sufficiently massive
triplet Majoron by using abelian discrete symmetries. It is briefly discussed
how in SU(5) grand unification where the triplets occur in {\bf 15}'s the
neutrino textures can be related to up- and down- quark mass textures.
","[{""version"":""v1"",""created"":""Tue, 23 Apr 2002 17:15:04 GMT""}]","2009-11-07"
