"cond-mat/0204619","Eduardo Miranda","E. Novais, E. Miranda, A. H. Castro Neto, and G. G. Cabrera","A Coulomb gas approach to the anisotropic one-dimensional Kondo lattice
  model at arbitrary filling","19 pages, 9 figures","Phys. Rev. B 66, 174409 (2002).","10.1103/PhysRevB.66.174409",,"cond-mat.str-el",,"  We establish a mapping of a general spin-fermion system in one dimension into
a classical generalized Coulomb gas. This mapping allows a renormalization
group treatment of the anisotropic Kondo chain both at and away from
half-filling. We find that the phase diagram contains regions of paramagnetism,
partial and full ferromagnetic order. We also use the method to analyze the
phases of the Ising-Kondo chain.
","[{""version"":""v1"",""created"":""Mon, 29 Apr 2002 21:49:14 GMT""}]","2007-05-23"
"cond-mat/0204620","Edval J. P. Santos","Edval J. P. Santos and Anatoly A. Barybin","Novel Results on the Large-Signal Dynamic Admittance of $p-n$-Junctions","11 pages, latex (RevTeX4), 4 postscript figures Laboratory for
  Devices and Nanostructures at the Departamento de Eletronica e Sistemas,
  Universidade Federal de Pernambuco, 50740-530, Recife, Brazil. E-mail:
  edval@ee.ufpe.br",,,,"cond-mat.mes-hall",,"  Recent theoretical results obtained by Barybin and Santos have suggested that
the dynamic admittance of the $p-n$-junction is proportional to the modified
Bessel function of the first kind which depend on an amplitude of ac signal.
This result extends the conventional theory usually encountered in known papers
and textbooks. In this letter, some experimental results are presented to
confirm our theoretical prediction. The measurements were performed with a
lock-in amplifier, using a low noise operational amplifier. Two types of the
$p-n$-diodes were employed to check our theory: 1N914B diode, typically used
for high-frequency applications, and 1N4007 diode, typically used in power
supplies. Experimental results are consistent with the theoretical ones if a
fitting parameter allowing for generation--recombination processes in the
depletion layer is taken into account.
","[{""version"":""v1"",""created"":""Mon, 29 Apr 2002 21:49:37 GMT""}]","2016-08-31"
"cond-mat/0204621","Mark Dykman","M.I. Dykman, B. Golding, J.R. Kruse, L.I. McCann, and D. Ryvkine","Universality in escape from a modulated potential well","4 pages, 3 figures",,"10.1063/1.1584917",,"cond-mat.mes-hall cond-mat.stat-mech",,"  We show that the rate of activated escape $W$ from a periodically modulated
potential displays scaling behavior versus modulation amplitude $A$. For
adiabatic modulation of an optically trapped Brownian particle, measurements
yield $\ln W\propto (A_{\rm c} - A)^{\mu}$ with $\mu = 1.5$. The theory gives
$\mu=3/2$ in the adiabatic limit and predicts a crossover to $\mu=2$ scaling as
$A$ approaches the bifurcation point where the metastable state disappears.
","[{""version"":""v1"",""created"":""Mon, 29 Apr 2002 23:07:08 GMT""}]","2009-11-07"
"cond-mat/0204622","Kazutaka Nakamura","Kazutaka Nakamura, Robert Morelos-Zaragoza, David Saad and Yoshiyuki
  Kabashima","Statistical Mechanics of Broadcast Channels Using Low Density Parity
  Check Codes","14 pages, 4 figures",,"10.1103/PhysRevE.67.036703",,"cond-mat.stat-mech cond-mat.dis-nn",,"  We investigate the use of Gallager's low-density parity-check (LDPC) codes in
a broadcast channel, one of the fundamental models in network information
theory. Combining linear codes is a standard technique in practical network
communication schemes and is known to provide better performance than simple
timesharing methods when algebraic codes are used. The statistical physics
based analysis shows that the practical performance of the suggested method,
achieved by employing the belief propagation algorithm, is superior to that of
LDPC based timesharing codes while the best performance, when received
transmissions are optimally decoded, is bounded by the timesharing limit.
","[{""version"":""v1"",""created"":""Tue, 30 Apr 2002 03:47:41 GMT""}]","2009-11-07"
"cond-mat/0204624","Hayaru Shouno","Hayaru Shouno, Koji Wada, and Masato Okada","Naive mean field approximation for image restoration","9 pages, 11 figures",,"10.1143/JPSJ.71.2406",,"cond-mat.dis-nn",,"  We attempt image restoration in the framework of the Baysian inference.
Recently, it has been shown that under a certain criterion the MAP (Maximum A
Posterior) estimate, which corresponds to the minimization of energy, can be
outperformed by the MPM (Maximizer of the Posterior Marginals) estimate, which
is equivalent to a finite-temperature decoding method. Since a lot of
computational time is needed for the MPM estimate to calculate the thermal
averages, the mean field method, which is a deterministic algorithm, is often
utilized to avoid this difficulty. We present a statistical-mechanical analysis
of naive mean field approximation in the framework of image restoration. We
compare our theoretical results with those of computer simulation, and
investigate the potential of naive mean field approximation.
","[{""version"":""v1"",""created"":""Tue, 30 Apr 2002 06:07:47 GMT""},{""version"":""v2"",""created"":""Thu, 22 Aug 2002 01:28:40 GMT""}]","2009-11-07"
"cond-mat/0204625","Takashi Yanagisawa","Takashi Yanagisawa, Soh Koike, Mitake Miyazaki and Kunihiko Yamaji","Stripe formation in high-Tc superconductors","8 pages, 9 figures","J. Phys: Condens. Matter 14 (2002) 21-31","10.1088/0953-8984/14/1/303",,"cond-mat.str-el",,"  The non-uniform ground state of the two-dimensional three-band Hubbard model
for the oxide high-Tc superconductors is investigated using a variational Monte
Carlo method. We examine the effect produced by holes doped into the
antiferromagnetic (AF) background in the underdoped region. It is shown that
the AF state with spin modulations and stripes is stabilized du to holes
travelling in the CuO plane. The structures of the modulated AF spins are
dependent upon the parameters used in the model. The effect of the boundary
conditions is reduced for larger systems. We show that there is a region where
incommensurability is proportional to the hole density. Our results give a
consistent description of stripes observed by the neutron- scattering
experiments based on the three-band model for CuO plane.
","[{""version"":""v1"",""created"":""Tue, 30 Apr 2002 06:15:17 GMT""}]","2009-11-07"
"cond-mat/0204626","Muzy","D. Sornette (CNRS, Univ. Nice and UCLA), Y. Malevergne (Univ Nice and
  Lyon I) and J.F. Muzy (CNRS, Univ. Corsica)","Volatility fingerprints of large shocks: Endogeneous versus exogeneous","Latex document, 12 pages, 2 figures","What causes crashes? Risk Volume 16 (2), 67-71 (February 2003)",,,"cond-mat.stat-mech q-fin.ST",,"  Finance is about how the continuous stream of news gets incorporated into
prices. But not all news have the same impact. Can one distinguish the effects
of the Sept. 11, 2001 attack or of the coup against Gorbachev on Aug., 19, 1991
from financial crashes such as Oct. 1987 as well as smaller volatility bursts?
Using a parsimonious autoregressive process with long-range memory defined on
the logarithm of the volatility, we predict strikingly different response
functions of the price volatility to great external shocks compared to what we
term endogeneous shocks, i.e., which result from the cooperative accumulation
of many small shocks. These predictions are remarkably well-confirmed
empirically on a hierarchy of volatility shocks. Our theory allows us to
classify two classes of events (endogeneous and exogeneous) with specific
signatures and characteristic precursors for the endogeneous class. It also
explains the origin of endogeneous shocks as the coherent accumulations of tiny
bad news, and thus unify all previous explanations of large crashes including
Oct. 1987.
","[{""version"":""v1"",""created"":""Tue, 30 Apr 2002 07:21:20 GMT""}]","2008-12-02"
"cond-mat/0204627","Keshav N. Shrivastava","Keshav N. Shrivastava","Composite Fermions Phenomenology in Quantum Hall Effect","6 pages TeX, 1 gif diagram",,,,"cond-mat.mes-hall cond-mat.stat-mech",,"  An effort is made to understand the phenomenological composite fermion model
of the quantum Hall effect. The odd denominators are composed by adding plus
minus 1 to the even numbers 2, 4, 6 and 8. Although the denominators are
phenomenologically made to agree with the experimental data, the physics of the
CF model, i.e., the even flux quanta attachment to the electron is found to be
incorrect.
","[{""version"":""v1"",""created"":""Tue, 30 Apr 2002 08:11:16 GMT""}]","2007-05-23"
"cond-mat/0204628","Matthias Fuchs","Matthias Fuchs and Michael E. Cates","Theory of nonlinear rheology and yielding of dense colloidal suspensions","4 pages, 2 figures; slightly corrected version; Phys. Rev. Lett., to
  be published (2002)",,"10.1103/PhysRevLett.89.248304",,"cond-mat.soft",,"  A first principles approach to the nonlinear flow of dense suspensions is
presented which captures shear thinning of colloidal fluids and dynamical
yielding of colloidal glasses. The advection of density fluctuations plays a
central role, suppressing the caging of particles and speeding up structural
relaxation. A mode coupling approach is developed to explore these effects.
","[{""version"":""v1"",""created"":""Tue, 30 Apr 2002 08:14:35 GMT""},{""version"":""v2"",""created"":""Wed, 28 Aug 2002 11:56:31 GMT""},{""version"":""v3"",""created"":""Wed, 4 Sep 2002 17:42:20 GMT""},{""version"":""v4"",""created"":""Tue, 22 Oct 2002 14:25:25 GMT""}]","2009-11-07"
"cond-mat/0204629","Patrik Henelius","P. Henelius, P. Fr\""obrich, P.J. Kuntz, C. Timm, P.J. Jensen","Quantum Monte Carlo simulation of thin magnetic films","9 pages, 12 figures",,"10.1103/PhysRevB.66.094407",,"cond-mat.str-el cond-mat.stat-mech",,"  The stochastic series expansion quantum Monte Carlo method is used to study
thin ferromagnetic films, described by a Heisenberg model including local
anisotropies. The magnetization curve is calculated, and the results compared
to Schwinger boson and many-body Green's function calculations. A transverse
field is introduced in order to study the reorientation effect, in which the
magnetization changes from out-of-plane to in-plane. Since the approximate
theoretical approaches above differ significantly from each other, and the
Monte Carlo method is free of systematic errors, the calculation provides an
unbiased check of the approximate treatments. By studying quantum spin models
with local anisotropies, varying spin size, and a transverse field, we also
demonstrate the general applicability of the recent cluster-loop formulation of
the stochastic series expansion quantum Monte Carlo method.
","[{""version"":""v1"",""created"":""Tue, 30 Apr 2002 08:58:59 GMT""}]","2009-11-07"
"cond-mat/0204630","Victor Gurarie","V. Gurarie and J. T. Chalker","Some generic aspects of bosonic excitations in disordered systems",,"Phys. Rev. Lett. 89, 136801 (2002)","10.1103/PhysRevLett.89.136801",,"cond-mat.dis-nn cond-mat.mes-hall",,"  We consider non-interacting bosonic excitations in disordered systems,
emphasising generic features of quadratic Hamiltonians in the absence of
Goldstone modes. We discuss relationships between such Hamiltonians and the
symmetry classes established for fermionic systems. We examine the density
\rho(\omega) of excitation frequencies \omega, showing how the universal
behavior \rho(\omega) ~ \omega^4 for small \omega can be obtained both from
general arguments and by detailed calculations for one-dimensional models.
","[{""version"":""v1"",""created"":""Tue, 30 Apr 2002 15:17:08 GMT""}]","2009-11-07"
"cond-mat/0204631","A. V. Savin","A. V. Savin, O. V. Gendelman","Heat conduction in 1D lattices with on-site potential","26 pages, 18 figures",,"10.1103/PhysRevE.67.041205",,"cond-mat.dis-nn",,"  The process of heat conduction in one-dimensional lattice with on-site
potential is studied by means of numerical simulation. Using discrete
Frenkel-Kontorova, $\phi$--4 and sinh-Gordon we demonstrate that contrary to
previously expressed opinions the sole anharmonicity of the on-site potential
is insufficient to ensure the normal heat conductivity in these systems. The
character of the heat conduction is determined by the spectrum of nonlinear
excitations peculiar for every given model and therefore depends on the
concrete potential shape and temperature of the lattice. The reason is that the
peculiarities of the nonlinear excitations and their interactions prescribe the
energy scattering mechanism in each model. For models sin-Gordon and $\phi$--4
phonons are scattered at thermalized lattice of topological solitons; for
sinh-Gordon and $\phi$--4 - models the phonons are scattered at localized
high-frequency breathers (in the case of $\phi$--4 the scattering mechanism
switches with the growth of the temperature).
","[{""version"":""v1"",""created"":""Tue, 30 Apr 2002 13:39:25 GMT""},{""version"":""v2"",""created"":""Fri, 3 May 2002 11:54:07 GMT""},{""version"":""v3"",""created"":""Mon, 28 Oct 2002 12:55:36 GMT""}]","2009-11-07"
"cond-mat/0204632","K. A. Muttalib","J. H. Barry and K. A. Muttalib","S=1 kagom\'e Ising model with triquadratic interactions, single-ion
  anisotropy and magnetic field: exact phase diagrams","14 pages plus 11 figures; to be published in Physica A",,"10.1016/S0378-4371(02)00849-X",,"cond-mat.stat-mech",,"  We consider a S=1 kagom\'e Ising model with triquadratic interactions around
each triangular face of the kagom\'e lattice, single-ion anisotropy and an
applied magnetic field. A mapping establishes an equivalence between the
magnetic canonical partition function of the model and the grand canonical
partition function of a kagom\'e lattice-gas model with localized
three-particle interactions. Since exact phase diagrams are known for
condensation in the one-parameter lattice-gas model, the mapping directly
provides the corresponding exact phase diagrams of the three-parameter S=1
Ising model. As anisotropy competes with interactions, results include the
appearance of confluent singularities effecting changes in the topology of the
phase diagrams, phase boundary curves (magnetic field vs temperature) with
purely positive or negative slopes as well as intermediate cases showing
nonmonotonicity, and coexistence curves (magnetization vs temperature) with
varying shapes and orientations, in some instances entrapping a homogeneous
phase.
","[{""version"":""v1"",""created"":""Tue, 30 Apr 2002 15:08:10 GMT""}]","2009-11-07"
"cond-mat/0204633","Viot","M. Grousson, V. Krakoviack, G. Tarjus and P. Viot","Langevin dynamics of the Coulomb frustrated ferromagnet: a mode-coupling
  analysis","13 pages, 11 figures, submitted to Phys. Rev. E",,"10.1103/PhysRevE.66.026126",,"cond-mat.dis-nn",,"  We study the Langevin dynamics of the soft-spin, continuum version of the
Coulomb frustrated Ising ferromagnet. By using the dynamical mode-coupling
approximation, supplemented by reasonable approximations for describing the
equilibrium static correlation function, and the somewhat improved dynamical
self-consistent screening approximation, we find that the system displays a
transition from an ergodic to a non-ergodic behavior. This transition is
similar to that obtained in the idealized mode-coupling theory of glassforming
liquids and in the mean-field generalized spin glasses with one-step replica
symmetry breaking. The significance of this result and the relation to the
appearance of a complex free-energy landscape are also discussed.
","[{""version"":""v1"",""created"":""Tue, 30 Apr 2002 15:15:20 GMT""}]","2009-11-07"
"cond-mat/0204634","Sven Lubeck","S. Lubeck and A. Hucht","Mean-field scaling function of the universality class of absorbing phase
  transitions with a conserved field","8 pages, 2 figures, accepted for publication in J. Phys. A","Journal of Physics A 35, 4853 (2002)","10.1088/0305-4470/35/23/304",,"cond-mat.stat-mech",,"  We consider two mean-field like models which belong to the universality class
of absorbing phase transitions with a conserved field. In both cases we derive
analytically the order parameter as function of the control parameter and of an
external field conjugated to the order parameter. This allows us to calculate
the universal scaling function of the mean-field behavior. The obtained
universal function is in perfect agreement with recently obtained numerical
data of the corresponding five and six dimensional models, showing that four is
the upper critical dimension of this particular universality class.
","[{""version"":""v1"",""created"":""Tue, 30 Apr 2002 15:57:58 GMT""}]","2015-06-24"
"gr-qc/0204087","Lars Andersson","Lars Andersson","Report on GR16, Session A3: Mathematical Studies of the Field Equations","Extended version of report appearing in proceedings of GR16",,,,"gr-qc",,"  In this report, which is an extended version of that appearing in the
Proceedings of GR16, I will give a summary of the main topics covered in
Session A.3. on mathematical relativity at GR16, Durban. The summary is mainly
based on extended abstracts submitted by the speakers. I would like to thank
all participants for their contributions and help with this summary.
","[{""version"":""v1"",""created"":""Mon, 29 Apr 2002 22:29:25 GMT""},{""version"":""v2"",""created"":""Fri, 17 May 2002 06:57:43 GMT""}]","2007-05-23"
"gr-qc/0204088","Hiromi Saida","Hiromi Saida","Hawking Radiation in the Swiss Cheese Universe","21pages. Accepted for publication in Class. Quntum Grav","Class.Quant.Grav. 19 (2002) 3179-3206","10.1088/0264-9381/19/12/306",,"gr-qc",,"  The Hawking radiation forms the essential basis of the black hole
thermodynamics. The black hole thermodynamics denotes a nice correspondence
between black hole kinematics and the laws of ordinary thermodynamics, but has
been so far considered only in an asymptotically flat case. Does such the
correspondence rely strongly on the feature of the gravity vanishing at the
infinity? In order to resolve this question, it should be considered for the
first to extend the Hawking radiation to a case with a dynamical boundary
condition like an expanding universe. Therefore the Hawking radiation in an
expanding universe is discussed in this paper. As a concrete model of a black
hole in an expanding universe, we use the swiss cheese universe which is the
spacetime including a Schwarzschild black hole in the
Friedmann-Robertson-Walker universe. Further for simplicity, our calculation is
performed in two dimension. The resultant spectrum of the Hawking radiation
measured by a comoving observer is generally different from a thermal one. We
find that the qualitative behavior of the non-thermal spectrum is of dumping
oscillation as a function of the frequency measured by the observer, and that
the intensity of the Hawking radiation is enhanced by the presence of a
cosmological expansion. It is appropriate to say that it a black hole with an
asymptotically flat boundary condition stays in a lowest energy thermal
equilibrium state, and that, once a black hole is put into an expanding
universe, it is excited to a non-equilibrium state and emits its mass energy
with stronger intensity than a thermal one.
","[{""version"":""v1"",""created"":""Tue, 30 Apr 2002 03:50:42 GMT""}]","2009-11-07"
"gr-qc/0204089","Dr. Bikash Chandra Paul","B. C. Paul (North Bengal University)","Inflation in Bianchi models and the cosmic no hair theorem in brane
  world","12 pages, no figures, submitted to Phys. Rev. D","Phys.Rev. D66 (2002) 124019","10.1103/PhysRevD.66.124019",,"gr-qc",,"  In this paper, the cosmic no hair theorem for anisotropic Bianchi models
which admit inflation with a scalar field is studied in the framework of Brane
world. It is found that all Bianchi models except Bianchi type IX, transit to
an inflationary regime with vanishing anisotropy. In the Brane world,
anisotropic universe approaches the inflationary era much faster than that in
the general theory of relativity. The form of the potential does not affect the
evolution in the inflationary epoch. However, the late time behaviour is
controlled by a constant additive factor in the potential for the inflaton
field.
","[{""version"":""v1"",""created"":""Tue, 30 Apr 2002 08:26:22 GMT""}]","2016-08-31"
"gr-qc/0204090","Curt Cutler","Curt Cutler and Kip S. Thorne","An Overview of Gravitational-Wave Sources","40 pages, 5 figures, to appear in Proceedings of GR16 (Durban, South
  Africa, 2001)",,,,"gr-qc astro-ph",,"  We review current best estimates of the strength and detectability of the
gravitational waves from a variety of sources, for both ground-based and
space-based detectors, and we describe the information carried by the waves.
","[{""version"":""v1"",""created"":""Tue, 30 Apr 2002 10:05:26 GMT""}]","2007-05-23"
"gr-qc/0204091","Naresh Dadhich","S. G. Ghosh and Naresh Dadhich","Gravitational collapse of Type II fluid in higher dimensional
  space-times","RevTex4 style, 4 pages; Accepted in Phys. Rev. D","Phys.Rev. D65 (2002) 127502","10.1103/PhysRevD.65.127502",,"gr-qc",,"  We find the general solution of the Einstein equation for spherically
symmetric collapse of Type II fluid (null strange quark fluid) in higher
dimensions. It turns out that the nakedness and curvature strength of the shell
focusing singularities carry over to higher dimensions. However, there is
shrinkage of the initial data space for a naked singularity of the Vaidya
collapse due to the presence of strange quark matter.
","[{""version"":""v1"",""created"":""Tue, 30 Apr 2002 10:58:58 GMT""}]","2016-08-31"
"hep-ex/0204037","Kirk T. McDonald","Kirk T McDonald","A Strategy for Accelerator-Based Neutrino Physics in the USA","v2 has an updated Fig. 3, thanks to Debbie Harris. Thanks also to Bob
  Shrock",,,,"hep-ex",,"  We outline a strategy for next-generation neutrino physics experiments based
on beams from accelerators in North America. This strategy is based on the
mounting evidence in favor of the large mixing angle solution to solar neutrino
problem, which implies that in addition to measurement of sin^2 2theta_13 and
of the sign of Delta m^2_23, measurement of CP violation in the neutrino sector
is a realizable goal if sin^2 2theta_13 is not too small.
  The strategy is to begin with a new detector, 20-30 kton of liquid argon,
designed to make best use of the NUMI beam currently under construction at
FNAL. Then, after new measurements have made the optimal path clearer, we
anticipate choosing among options for neutrino ""superbeam"" upgrades at BNL
and/or FNAL as well as for second new detector of 100-200 kton.
","[{""version"":""v1"",""created"":""Mon, 29 Apr 2002 20:48:12 GMT""},{""version"":""v2"",""created"":""Wed, 1 May 2002 17:22:19 GMT""}]","2007-05-23"
"hep-ex/0204038","Jan Timmermans","The DELPHI Collaboration, J. Abdallah, et al","Rapidity-Alignment and p_T Compensation of Particle Pairs in Hadronic Z0
  Decays","15 pages, 5 figures, Accepted by Phys. Lett. B","Phys.Lett.B533:243-252,2002","10.1016/S0370-2693(02)01658-1","CERN-EP-2002-023","hep-ex",,"  Observation is made of rapidity-alignment of K+K- and ppbar pairs which
results from their asymmetric orientation in rapidity, with respect to the
direction from primary quark to antiquark. The K+K- and ppbar data are
consistent with predictions from the fragmentation string model. However, the
ppbar data strongly disagree with the conventional implementation of the
cluster model. The non-perturbative process of `gluon splitting to diquarks'
has to be incorporated into the cluster model for it to agree with the data.
Local conservation of p_T between particles nearby in rapidity (i.e., p_T
compensation) is analysed with respect to the thrust direction for pi+pi-,
K+K-, and ppbar pairs. In this case, the string model provides fair agreement
with the data. The cluster model is incompatible with the data for all three
particle pairs. The model with its central premiss of isotropically-decaying
clusters predicts a p_T correlation not seen in the data.
","[{""version"":""v1"",""created"":""Tue, 30 Apr 2002 07:54:13 GMT""}]","2008-11-26"
"hep-lat/0204031","Manfried Faber","Manfried Faber, Joachim Wabnig and Andrei N. Ivanov","Solitons and spontaneous symmetry breaking in 2 and 4 dimensions","8 pages, 3 eps figures, uses crckapb.sty; Presented by Manfried Faber
  at the NATO Advanced Research Workshop ""Confinement, Topology, and other
  Non-Perturbative Aspects of QCD"", Jan. 21-27, 2002,Stara Lesna, Slovakia",,,,"hep-lat hep-th",,"  We show that mass generation in 1+1 and 3+1 dimensions may occur together
with spontaneous symmetry breaking.
","[{""version"":""v1"",""created"":""Mon, 29 Apr 2002 16:46:41 GMT""}]","2007-05-23"
"hep-lat/0204032","Enrico Meggiolaro","Adriano Di Giacomo","Color confinement and dual superconductivity: an update","Talk given at the ``Workshop on Confinement, Topology and other Non
  Perturbative Aspects of QCD'', Stara Lesna (Slovakia), 21-27 Jan 2002; 13
  pages, 7 figures",,,"IFUP-TH/2002-15","hep-lat",,"  The evidence for dual superconductivity as a mechanism for color confinement
is reviewed. New developments are presented for full QCD, i.e. in the presence
of dynamical quarks.
","[{""version"":""v1"",""created"":""Tue, 30 Apr 2002 12:46:43 GMT""}]","2007-05-23"
