"astro-ph/0204510","Suijian Xue","Sui-Jian Xue and Xiang-Ping Wu (National Astronomical Observatories,
  Chinese Academy of Sciences)","Chandra observation of Abell 1689: New determination of mass
  distribution and comparison to lensing measurements","26 pages, 7 figures, Accepted for publication in the Astrophysical
  Journal",,"10.1086/341726",,"astro-ph",,"  We present a new estimate of the projected X-ray mass of Abell 1689 observed
with Chandra, in an attempt to clarify the issue of whether or not there exists
a discrepancy between X-ray and gravitational lensing mass estimates claimed in
previous investigations based on {\it Einstein}, {\it ROSAT} and {\it ASCA}
observations. A particular attention is paid to examining if there is an offset
between X-ray centroid and central dominant cD galaxy, which may be an
indicator of the presence of local dynamical activities of intracluster gas in
the central core and therefore, explain the discrepancy between X-ray and
lensing mass estimates, if any. The unprecedentedly high spatial resolution
achieved by Chandra allows us to precisely localize the X-ray centroid of Abell
1689, which appears to coincide perfectly with the central cD galaxy. This
fact, along with the symmetry and regularity of the X-ray surface brightness
and temperature distributions, suggests that Abell 1689 is a fully-relaxed
cluster. We thus employ hydrostatic equilibrium hypothesis to determine the
projected mass profile of Abell 1689, and compare it with the results obtained
by different lensing techniques available in the literature. Our analysis
confirms the existance of the discrepancy of a factor of $\sim2$ between X-ray
and lensing mass estimates in the central region of $r\approx0.2$ Mpc, although
the two methods yield essentially consistent result on large radii. If the
perfect coincidence between the X-ray center and the cD galaxy of Abell 1689
detected by Chandra observation is not a projection effect, the central mass
discrepancy between X-ray and lensing measurements may pose a challenge to our
conventional understanding of dynamical evolution of the intracluster gas in
the central regions of clusters.
","[{""version"":""v1"",""created"":""Tue, 30 Apr 2002 09:18:26 GMT""}]","2009-11-07"
"astro-ph/0204511","Klaus Schenker","Melvyn B. Davies (1), Hans Ritter (2), Andrew King (1) ((1) University
  of Leicester, UK, (2) Max-Planck-Institut fuer Astrophysik, Germany)","Formation of the binary pulsars J1141-6545 and B2023+46","9 pages, 10 figures; MNRAS in press","Mon.Not.Roy.Astron.Soc. 335 (2002) 369","10.1046/j.1365-8711.2002.05594.x",,"astro-ph",,"  The binaries PSR J1141-6545 and PSR B2303+46 each appear to contain a white
dwarf which formed before the neutron star. We describe an evolutionary pathway
to produce these two systems. In this scenario, the primary transfers its
envelope onto the secondary which is then the more massive of the two stars,
and indeed sufficiently massive later to produce a neutron star via a
supernova. The core of the primary produces a massive white dwarf which enters
into a common envelope with the core of the secondary when the latter evolves
off the main sequence. During the common envelope phase, the white dwarf and
the core of the secondary spiral together as the envelope is ejected. The
evolutionary history of PSR J1141-6545 and PSR B2303+46 differ after this
phase. In the case of PSR J1141--6545, the secondary (now a helium star)
evolves into contact transferring its envelope onto the white dwarf. We propose
that the vast majority of this material is in fact ejected from the system. The
remains of the secondary then explode as a supernova producing a neutron star.
Generally the white dwarf and neutron star will remain bound in tight, often
eccentric, systems resembling PSR J1141-6545. These systems will spiral in and
merge on a relatively short timescale and may make a significant contribution
to the population of gamma ray burst progenitors. In PSR B2303+46, the
helium-star secondary and white dwarf never come into contact. Rather the
helium star loses its envelope via a wind, which increases the binary
separation slightly. Only a small fraction of such systems will remain bound
when the neutron star is formed (as the systems are wider). Those systems which
are broken up will produce a population of high-velocity white dwarfs and
neutron stars.
","[{""version"":""v1"",""created"":""Tue, 30 Apr 2002 09:47:25 GMT""}]","2009-11-07"
"astro-ph/0204512","David Eichler","David Eichler","Waiting for the Big One: A New Class of SGR Outbursts?","to appear in M.N.R.A.S","Mon.Not.Roy.Astron.Soc. 335 (2003) 883","10.1046/j.1365-8711.2002.05571.x",,"astro-ph",,"  It is suggested that magnetars eventually become unstable to a dynamic
overturning instability that destroys most of their dipole moment in a single
event. It is further suggested that such an instability would produce a
supergiant version of the largest soft gamma ray bursts that have thus far been
observed, and that they could be observed out to tens or even $10^2$ Mpc.
Persistent emission and afterglows from the fireball might confirm positive
identification with nearby galaxies and perhaps provide other distinguishing
features as well.
","[{""version"":""v1"",""created"":""Tue, 30 Apr 2002 11:54:06 GMT""}]","2009-11-07"
"astro-ph/0204513","Francisco Frutos-Alfaro Dr. rer. nat.","Francisco Frutos-Alfaro","A Computer Program to Visualize Gravitational Lenses","15 pages, 6 figures","Am. J. Phys. 69 (2), February 2001",,,"astro-ph","http://arxiv.org/licenses/nonexclusive-distrib/1.0/","  Gravitational lenses are presently playing an important role in astrophysics.
By means of these lenses the parameters of the deflector such as its mass,
ellipticity, etc. and Hubble's constant can be determined. Using C, Xforms,
Mesa and Imlib a computer program to visualize this lens effect has been
developed. This program has been applied to generate sequences of images of a
source object and its corresponding images. It has also been used to visually
test different models of gravitational lenses.
","[{""version"":""v1"",""created"":""Tue, 30 Apr 2002 12:03:11 GMT""},{""version"":""v2"",""created"":""Thu, 12 Jun 2014 17:11:50 GMT""}]","2014-06-13"
"astro-ph/0204514","Anastasia Pappa","A. Pappa, I. Georgantopoulos, M. Ward and A.L. Zezas","The BeppoSAX spectrum of the composite galaxy Mrk609","7 pages, accepted for publication in MNRAS","Mon.Not.Roy.Astron.Soc. 336 (2002) 714","10.1046/j.1365-8711.2002.05629.x",,"astro-ph",,"  We present Bepposax observations of the starburst/Seyfert composite galaxy
Mrk609. This enigmatic object has an optical spectrum dominated by the features
of starburst galaxies, yet its X-ray luminosity (6.3$\times10^{42}$\lunits) is
typical of an AGN. The X-ray spectrum of Mrk609 can be parameterised by a
single power-law model with a photon index $\Gamma\sim1.6\pm0.1$ and no
evidence for significant absorption above the Galactic value. Long term
variability in both the 0.1-2 keV and 2-10 keV energy bands is detected, again
suggesting that the X-ray emission is dominated by an AGN. The observed broad
Ha component is a factor of 40 below that predicted by the
  X-ray flux implying a deficit of ionizing UV photons.
","[{""version"":""v1"",""created"":""Tue, 30 Apr 2002 12:17:53 GMT""}]","2016-08-30"
"astro-ph/0204515","Harvey S. Liszt","H. Liszt","Two-phase equilibrium and molecular hydrogen formation in damped
  Lyman-alpha systems","13 pages, 7 figures; accepted 2002-04-30 by Astronomy and
  Astrophysics",,"10.1051/0004-6361:20020646",,"astro-ph",,"  Molecular hydrogen is quite underabundant in damped Lyman-alpha systems at
high redshift, when compared to the interstellar medium near the Sun. This has
been interpreted as implying that the gas in damped Lyman-alpha systems is
warm. like the nearby neutral intercloud medium, rather than cool, as in the
clouds which give rise to most H I absorption in the Milky Way. Other lines of
evidence suggest that the gas in damped Lyman-alpha systems -- in whole or part
-- is actually cool; spectroscopy of neutral and ionized carbon, discussed
here, shows that the damped Lyman-alpha systems observed at lower redshift z
$<$ 2.3 are largely cool, while those seen at z $>$ 2.8 are warm (though not
devoid of H2). To interpret the observations of carbon and hydrogen we
constructed detailed numerical models of H2 formation under the conditions of
two-phase thermal equilibrium, like those which account for conditions near the
Sun, but with varying metallicity, dust-gas ratio, $etc$. We find that the low
metallicity of damped Lyman-alpha systems is enough to suppress H2 formation by
many orders of magnitude even in cool diffuse clouds, as long as the ambient
optical/uv radiation field is not too small. For very low metallicity and under
the most diffuse conditions, H2 formation will be dominated by slow gas-phase
processes not involving grains, and a minimum molecular fraction in the range
$10^{-8}-10^{-7}$ is expected.
","[{""version"":""v1"",""created"":""Tue, 30 Apr 2002 13:18:18 GMT""}]","2009-11-07"
"astro-ph/0204516","Hector Julian Martinez","H. J. Martinez, A. Zandivarez, M. Dominguez, M. E. Merchan & D. G.
  Lambas","Galaxy groups in the 2dF redshift survey: Effects of Environment on Star
  Formation","Accepted for publication in MNRAS Pink Pages 3 figures","Mon.Not.Roy.Astron.Soc. 333 (2002) L31","10.1046/j.1365-8711.2002.05626.x",,"astro-ph",,"  We estimate the fraction of star forming galaxies in a catalogue of groups,
constructed from the 2dF galaxy redshift survey by Merch\'an & Zandivarez. We
use the $\eta$ spectral type parameter of galaxies and subdivide the sample of
galaxies in groups into four types depending on the values of the $\eta$
parameter following Madgwick et al. We obtain a strong correlation between the
relative fraction of galaxies with high star formation and the parent group
virial mass. We find that even in the environment of groups with low virial
mass $M \sim 10^{13} M_{\odot}$ the star formation of their member galaxies is
significantly suppressed. The relation between the fraction of early-type
galaxies and the group virial mass obeys a simple power law spanning over three
orders of magnitude in virial mass. Our results show quantitatively the way
that the presence of galaxies with high star formation rates is inhibited in
massive galaxy systems.
","[{""version"":""v1"",""created"":""Tue, 30 Apr 2002 14:05:44 GMT""}]","2009-11-07"
"astro-ph/0204517","Anisa Bajkova","Anisa T. Bajkova","Nonlinear image processing based on optimization of generalized
  information methods","Latex, 7 pages, corrected version of the paper published in book
  ``Advances in intelligent systems'',Ed. by F.C.Morabito, IOS Press, 1997,
  68-74",,,,"astro-ph",,"  A range of nonlinear image reconstruction procedures based on extremizing the
generalized Shannon entropy, Kullback-Leibler cross-entropy and Renyi
information measures and proposed by the author in early papers is presented.
The ``generalization'' assumes search for the solution over the space of real
bipolar or complex functions. Such an approach allows, first, to reconstruct
signals of any type and physical nature and, secondly, to decrease nonlinear
intensity image distortions caused by measurement errors. All the elaborated
procedures are contained in VLBI ``IMAGE'' program package developed in IAA
RAS.
","[{""version"":""v1"",""created"":""Tue, 30 Apr 2002 14:29:09 GMT""}]","2007-05-23"
"astro-ph/0204518","James Murray","James Murray, Dalia Chakrabarty, Graham Wynn and Louisa Kramer","Magnetically warped discs in close binaries","11 pages, 10 figures, MNRAS accepted","Mon.Not.Roy.Astron.Soc. 335 (2002) 247","10.1046/j.1365-8711.2002.05628.x",,"astro-ph",,"  We demonstrate that measurable vertical structure can be excited in the
accretion disc of a close binary system by a dipolar magnetic field centred on
the secondary star. We present the first high resolution hydrodynamic
simulations to show the initial development of a uniform warp in a tidally
truncated accretion disc. The warp precesses retrogradely with respect to the
inertial frame. The amplitude depends on the phase of the warp with respect to
the binary frame. A warped disc is the best available explanation for negative
superhumps.
","[{""version"":""v1"",""created"":""Tue, 30 Apr 2002 14:44:18 GMT""}]","2009-11-07"
"astro-ph/0204519","Ashley James","A. James, L. Dunne, S. Eales and M. G. Edmunds","SCUBA observations of galaxies with metallicity measurements: a new
  method for determining the relation between submm luminosity and dust mass","10 pages, 5 figures, accepted for publication in MNRAS","Mon.Not.Roy.Astron.Soc. 335 (2002) 753","10.1046/j.1365-8711.2002.05660.x",,"astro-ph",,"  Using a new technique we have determined a value for the constant of
proportionality between submillimetre emission and dust mass, the dust mass
absorption coefficient at 850 microns. Our method has an advantage over
previous methods in that we avoid assumptions about the properties of dust in
the interstellar medium. Our only assumption is that the fraction of metals
incorporated in the dust is a universal constant. To implement our method we
require objects that have submillimetre and far-infrared flux measurements as
well as gas mass and metallicity estimates. We present data for all the
galaxies with suitable measurements, including new submillimetre maps for five
galaxies. We find kappa(850 microns)=0.07 m^2/kg
","[{""version"":""v1"",""created"":""Tue, 30 Apr 2002 14:45:00 GMT""}]","2009-11-07"
"cond-mat/0204609","Keivan Esfarjani","Keivan Esfarjani, Amir A. Farajian, Siu Tat Chui and Yoshiyuki Kawazoe","Nonlinear charging, and transport times in doped nanotubes junctions","Letter with 3 .ps figures",,,,"cond-mat.mtrl-sci cond-mat.mes-hall",,"  The nonlinear capacitance in doped nanotube junctions is calculated self
consistently. It decreases as a function of the applied bias when the latter
becomes larger than the pseudogap of the nanotube. For this device, one can
deduce a relaxation time of about 0.1 femtosecond. Because of its negative
differential resistance (NDR), a switching time of less than a fs can also be
deduced.
","[{""version"":""v1"",""created"":""Mon, 29 Apr 2002 16:06:42 GMT""},{""version"":""v2"",""created"":""Fri, 20 Sep 2002 09:55:40 GMT""},{""version"":""v3"",""created"":""Wed, 10 Sep 2003 15:38:04 GMT""}]","2007-05-23"
"cond-mat/0204610","Melin Regis","H. Jirari, R. M\'elin, N. Stefanakis","Proximity effect in multiterminal hybrid structures","21 pages, 17 figures","Eur. Phys. J. B 31, 125 (2003)","10.1140/epjb/e2003-00016-8",,"cond-mat.mes-hall",,"  We consider the proximity effect in multiterminal ferromagnet superconductor
(FSF) hybrid structures in which two or three electrodes are connected to a
superconductor. We show that two competing effects take place in these systems:
(i) pair breaking effects due to the response to the exchange field induced in
the superconductor; (ii) a reduction of the \SOP at the interface that takes
place already in NS junctions. We focus on this second effect that dominates if
the thickness of the S layer is small enough. We consider several
single-channel electrodes connected to the same site. We calculate the
superconducting order parameter and the local density of state (LDOS). With two
ferromagnetic electrodes connected to a superconductor we find that the
superconducting order parameter in the ferromagnetic alignment is larger than
the superconducting order parameter in the antiferromagnetic alignment
($\Delta_{\rm F} >\Delta_{\rm AF}$), in agreement with [Eur. Phys. J. B {\bf
25}, 373 (2002)]. If a third spin polarized electrode is connected to a
superconductor we find that $\Delta_{\rm F}-\Delta_{\rm AF}$ can change sign as
the transparency of the third electrode increases. This can be understood from
the fact that the superconducting order parameter is reduced if pair
correlations among the ferromagnetic electrodes increase. If the two
ferromagnetic electrodes are within a finite distance we find Friedel
oscillations in the Gorkov function but we still obtain $\Delta_{\rm F} >
\Delta_{\rm AF}$.
","[{""version"":""v1"",""created"":""Mon, 29 Apr 2002 16:41:53 GMT""},{""version"":""v2"",""created"":""Wed, 20 Nov 2002 15:35:03 GMT""}]","2009-11-07"
"cond-mat/0204611","Patrik Ohberg","P. Ohberg and L. Santos","Dynamical transition from a quasi-one dimensional Bose-Einstein
  condensate to a Tonks-Girardeau gas","4 pages, 2 figures, replacement (minor misprint)",,"10.1103/PhysRevLett.89.240402",,"cond-mat.soft",,"  We analyze in detail the expansion of a 1D Bose gas after removing the axial
confinement. We show that during its one-dimensional expansion the density of
the Bose gas does not follow a self-similar solution, but on the contrary, it
asymptotically approaches a Tonks-Girardeau profile. Our analysis is based on a
nonlinear Schr\""odinger equation with variable nonlinearity whose validity is
discussed for the expansion problem, by comparing with an exact Bose-Fermi
mapping for the case of an initial Tonks-Girardeau gas. For this case, the gas
is shown to expand self-similarly, with a different similarity law compared to
the one-dimensional Thomas-Fermi condensate.
","[{""version"":""v1"",""created"":""Mon, 29 Apr 2002 17:16:48 GMT""},{""version"":""v2"",""created"":""Wed, 1 May 2002 16:25:56 GMT""},{""version"":""v3"",""created"":""Tue, 7 May 2002 13:13:34 GMT""}]","2015-06-24"
"cond-mat/0204612","Michal Kolar","Michal Kolar and Frantisek Slanina","How the Quasispecies Evolution Depends on the Topology of the Genome
  Space","23 pages, 4 figures, accepted for publication in Physica A, LaTeX -
  elsart","Physica A, 313/3-4 (2002) 549","10.1016/S0378-4371(02)00970-6",,"cond-mat.stat-mech cond-mat.dis-nn physics.bio-ph q-bio",,"  We compared the properties of the error threshold transition in quasispecies
evolution for three different topologies of the genome space. They are a)
hypercube b) rugged landscape modelled by an ultrametric space, and c) holey
landscape modelled by Bethe lattice. In all studied topologies the phase
transition exists. We calculated the critical exponents in all the cases. For
the critical exponent corresponding to appropriately defined susceptibility we
found super-universal value.
","[{""version"":""v1"",""created"":""Mon, 29 Apr 2002 17:27:12 GMT""}]","2009-11-07"
"cond-mat/0204613","Guilhem Semerjian","Guilhem Semerjian, Leticia F. Cugliandolo","Dynamics of dilute disordered models: a solvable case","7 pages, 4 figures. Clarified, final version","Europhys. Lett. 61, 247 (2003)","10.1209/epl/i2003-00226-8","LPT-ENS 02/30, LPTHE 02/27","cond-mat",,"  We study the dynamics of a dilute spherical model with two body interactions
and random exchanges. We analyze the Langevin equations and we introduce a
functional variational method to study generic dilute disordered models. A
crossover temperature replaces the dynamic transition of the fully-connected
limit. There are two asymptotic regimes, one determined by the central band of
the spectral density of the interactions and a slower one determined by
localized configurations on sites with high connectivity. We confront the
behavior of this model to the one of real glasses.
","[{""version"":""v1"",""created"":""Mon, 29 Apr 2002 17:27:37 GMT""},{""version"":""v2"",""created"":""Thu, 17 Apr 2003 12:57:12 GMT""}]","2009-11-07"
"cond-mat/0204614","Marija Drndic","M. Drndic, M. Vitasovic, N.Y. Morgan, M.A. Kastner, M.G. Bawendi","Transport properties of annealed CdSe nanocrystal solids","24 pages,4 figures, 1 table",,"10.1063/1.1523148",,"cond-mat.mes-hall",,"  Transport properties of artificial solids composed of colloidal CdSe
nanocrystals (NCs) are studied from 6 K to 250 K, before and after annealing.
Annealing results in greatly enhanced dark and photocurrent in NC solids, while
transmission electron microscopy (TEM) micrographs show that the inter-dot
separation decreases. The increased current can be attributed to the
enhancement of inter-dot tunneling caused by the decreased separation between
NCs and by chemical changes in their organic cap. In addition, the absorption
spectra of annealed solids are slightly red-shifted and broadened. These
red-shifts may result from the change of the dielectric environment around the
NCs. Our measurements also indicate that Coulomb interactions between charges
on neighboring NCs play an important role in the tunneling current.
","[{""version"":""v1"",""created"":""Mon, 29 Apr 2002 17:34:26 GMT""}]","2009-11-07"
"cond-mat/0204615","I. R. Pimentel","I. R. Pimentel, T. Temesvari, C. De Dominicis","Spin glass transition in a magnetic field: a renormalization group study","36 pages with 4 tables. To be published in Phys. Rev. B","Phys. Rev. B 65, 224420 (2002)","10.1103/PhysRevB.65.224420",,"cond-mat.dis-nn cond-mat.stat-mech",,"  We study the transition of short range Ising spin glasses in a magnetic
field, within a general replica symmetric field theory, which contains three
masses and eight cubic couplings, that is defined in terms of the fields
representing the replicon, anomalous and longitudinal modes. We discuss the
symmetry of the theory in the limit of replica number n to 0, and consider the
regular case where the longitudinal and anomalous masses remain degenerate.
  The spin glass transitions in zero and non-zero field are analyzed in a
common framework. The mean field treatment shows the usual results, that is a
transition in zero field, where all the modes become critical, and a transition
in non-zero field, at the de Almeida-Thouless (AT) line, with only the replicon
mode critical. Renormalization group methods are used to study the critical
behavior, to order epsilon = 6-d. In the general theory we find a stable
fixed-point associated to the spin glass transition in zero field. This
fixed-point becomes unstable in the presence of a small magnetic field, and we
calculate crossover exponents, which we relate to zero-field critical
exponents. In a finite magnetic field, we find no physical stable fixed-point
to describe the AT transition, in agreement with previous results of other
authors.
","[{""version"":""v1"",""created"":""Mon, 29 Apr 2002 18:50:38 GMT""}]","2016-08-31"
"cond-mat/0204616","James R. Thompson","J. R. Thompson, J. G. Ossandon, L. Krusin-Elbaum, H. J. Kim, D. K.
  Christen, K. J. Song, K. D. Sorge, and J. L. Ullmann","Current density and reversible magnetization of HgBa(2)Ca(2)Cu(3)O(x)
  superconductors containing randomly oriented columnar defects","REVTEX text plus 7 Postscript figures",,,,"cond-mat.supr-con",,"  Bulk polycrystalline HgBa(2)Ca(2)Cu(3)O(x) materials were irradiated with 0.8
GeV protons to form randomly oriented columnar defects, by induced fission of
Hg-nuclei. Proton fluences from 0 to 35 times 10^{16} cm^{-2} were used to
install defects with area densities up to a ""matching field"" of 3.4 Tesla.
Studies were conducted on the dependence of the equilibrium magnetization and
the intragrain persistent current density on temperature and applied magnetic
field, at various defect densities. The magnetization was modeled using London
theory with the addition of vortex-defect interactions.
","[{""version"":""v1"",""created"":""Mon, 29 Apr 2002 19:11:22 GMT""}]","2007-05-23"
"cond-mat/0204617","Andreas Deppeler","A. Deppeler and A. J. Millis","Dynamical mean-field theory of electron-phonon interaction in correlated
  electron materials: general results and application to doped Mott insulators","4 pages, 4 figures; referencing corrected",,,,"cond-mat.str-el",,"  The dynamical mean-field method is used to formulate a computationally
tractable theory of electron-phonon interactions in systems with arbitrary
local electron-electron interactions in the physically relevant adiabatic limit
of phonon frequency small compared to electron bandwidth or interaction scale.
As applications, the phonon contribution to the effective mass of a carrier in
a lightly doped Mott insulator is determined and the phase separation boundary
is discussed.
","[{""version"":""v1"",""created"":""Mon, 29 Apr 2002 19:12:37 GMT""},{""version"":""v2"",""created"":""Thu, 9 May 2002 02:08:01 GMT""}]","2007-05-23"
"cond-mat/0204618","Sanjib Sabhapandit","Sanjib Sabhapandit, Deepak Dhar and Prabodh Shukla","Hysteresis in the Random Field Ising Model and Bootstrap Percolation","4 pages, 4 figures","Phys. Rev. Lett. 88, 197202 (2002)","10.1103/PhysRevLett.88.197202",,"cond-mat.stat-mech",,"  We study hysteresis in the random-field Ising model with an asymmetric
distribution of quenched fields, in the limit of low disorder in two and three
dimensions. We relate the spin flip process to bootstrap percolation, and show
that the characteristic length for self-averaging $L^*$ increases as $exp(exp
(J/\Delta))$ in 2d, and as $exp(exp(exp(J/\Delta)))$ in 3d, for disorder
strength $\Delta$ much less than the exchange coupling J. For system size $1 <<
L < L^*$, the coercive field $h_{coer}$ varies as $2J - \Delta \ln \ln L$ for
the square lattice, and as $2J - \Delta \ln \ln \ln L$ on the cubic lattice.
Its limiting value is 0 for L tending to infinity, both for square and cubic
lattices. For lattices with coordination number 3, the limiting magnetization
shows no jump, and $h_{coer}$ tends to J.
","[{""version"":""v1"",""created"":""Mon, 29 Apr 2002 20:00:07 GMT""}]","2008-04-10"
