"astro-ph/0203356","Andrew E. Dolphin","Andrew E. Dolphin and Robert C. Kennicutt, Jr","HST Survey of Clusters in Nearby Galaxies. II. Statistical Analysis of
  Cluster Populations","21 pages, 3 figures accepted for publication by AJ",,"10.1086/340807",,"astro-ph",,"  We present a statistical system that can be used in the study of cluster
populations. The basis of our approach is the construction of synthetic cluster
color-magnitude-radius diagrams (CMRDs), which we compare with the observed
data using a maximum likelihood calculation. This approach permits a relatively
easy incorporation of incompleteness (a function of not only magnitude and
color, but also radius), photometry errors and biases, and a variety of other
complex effects into the calculation, instead of the more common procedure of
attempting to correct for those effects.
  We then apply this procedure to our NGC 3627 data from Paper I. We find that
we are able to successfully model the observed CMRD and constrain a number of
parameters of the cluster population. We measure a power law mass function
slope of alpha = -1.50 +/- 0.07, and a distribution of core radii centered at
r_c = 1.53 +/- 0.15 pc. Although the extinction distribution is less
constrained, we measured a value for the mean extinction consistent with that
determined in Paper I from the Cepheids.
","[{""version"":""v1"",""created"":""Wed, 20 Mar 2002 23:01:59 GMT""}]","2012-08-27"
"astro-ph/0203357","Karen S. Bjorkman","Karen S. Bjorkman, Anatoly S. Miroshnichenko, David McDavid and
  Tatiana M. Pogrosheva","A Study of Pi Aquarii During a Quasi-normal Star Phase: Refined
  Fundamental Parameters and Evidence for Binarity","26 pages (including 8 figs, 2 tables), accepted by ApJ",,"10.1086/340751",,"astro-ph",,"  We present the results of recent multicolor photometric and high-resolution
spectroscopic observations of the bright Be star Pi Aquarii. Observational data
collected from the literature were used to study the star's variations over the
last four decades. The star is identified with the IR sources F22227+0107 in
the IRAS Faint Point Source catalog and MSX5_G066.0066-44.7392 in the MSX
catalog. The variations in near-IR brightness of Pi Aqr are found to be among
the largest reported for Be stars. Since 1996, the star has shown only weak
signs of circumstellar emission, which has allowed us to refine the fundamental
stellar parameters: A_V=0.15 mag., T_eff=24000K, log g=3.9, and M_V=-2.95 mag.
A weak emission component of the H-alpha line has been detected during the
recent quasi-normal star phase. From analysis of the H-alpha line profiles, we
find anti-phased radial velocity variations of the emission component and the
photospheric absorption, with a period of 84.1 days and semi-amplitudes of
101.4 and 16.7 km/s, respectively. This result suggests that Pi Aqr may be a
binary system consisting of stars with masses of M_1 sin^{3}i = 12.4 M_sun, M_2
sin^{3}i = 2.0 M_sun. We also estimate the orbital inclination angle to be
between 50 and 75 degrees. We suggest that the photometric, spectroscopic, and
polarimetric variations observed during the second half of the 20th century may
be due to variable mass transfer between the binary components.
","[{""version"":""v1"",""created"":""Wed, 20 Mar 2002 23:44:43 GMT""}]","2009-11-07"
"astro-ph/0203358","Takahiko Matsubara","Takahiko Matsubara and Alexander S. Szalay","Cosmological Parameters from Redshift-Space Correlations","10 pages, 5 figures, to appear in Astrophys. J; figures and tables
  corrected",,"10.1086/340801",,"astro-ph",,"  We estimate how clustering in large-scale redshift surveys can constrain
various cosmological parameters. Depth and sky coverage of modern redshift
surveys are greater than ever, opening new possibilities for statistical
analysis. We have constructed a novel maximum likelihood technique applicable
to deep redshift surveys of wide sky coverage by taking into account the
effects of both curvature and linear velocity distortions. The Fisher
information matrix is evaluated numerically to show the bounds derived from a
given redshift sample. We find that intermediate-redshift galaxies, such as the
Luminous Red Galaxies (LRGs) in the Sloan Digital Sky Survey, can constrain
cosmological parameters, including the cosmological constant, unexpectedly
well. The importance of the dense as well as deep sampling in designing
redshift surveys is emphasized.
","[{""version"":""v1"",""created"":""Wed, 20 Mar 2002 23:56:33 GMT""},{""version"":""v2"",""created"":""Mon, 15 Apr 2002 06:40:50 GMT""}]","2009-11-07"
"astro-ph/0203360","Brent Groves","M. A. Dopita (1), B. A. Groves (1), R. S. Sutherland (1), L. Binette
  (2) and G. Cecil (3) ((1)Research School of Astronomy & Astrophysics, ANU,
  Australia, (2)Instituto de Astronoma, UNAM, Mexico, (3)Dept. of Physics &
  Astronomy, U. of N. Carolina, USA)","Are the Narrow Line Regions in Active Galaxies Dusty and Radiation
  Pressure Dominated?","23 pages, 8 figures, Accepted by ApJ",,"10.1086/340429",,"astro-ph",,"  The remarkable similarity between emission spectra of narrow line regions
(NLR) in Seyfert Galaxies has long presented a mystery. In photoionization
models, this similarity implies that the ionization parameter is nearly always
the same, about U ~ 0.01. Here we present dusty, radiation-pressure dominated
photoionization models that can provide natural physical insight into this
problem. In these models, dust and the radiation pressure acting on it provide
the controlling factor in moderating the density, excitation and surface
brightness of photoionized NLR structures. Additionally, photoelectric heating
by the dust is important in determining the temperature structure of the
models. These models can also explain the coexistence of the low-,
intermediate- and coronal ionization zones within a single self-consistent
physical structure. The radiation pressure acting on dust may also be capable
of driving the fast (~3000 km/s) outflows such as are seen in the HST
observations of NGC 1068.
","[{""version"":""v1"",""created"":""Thu, 21 Mar 2002 04:02:59 GMT""}]","2009-11-07"
"astro-ph/0203361","Palle Moller","P. M{\o}ller, S.J. Warren, S.M. Fall, J.U. Fynbo, P. Jakobsen","Are high-redshift DLA galxies Lyman-break galaxies?","Accepted for publication in ApJ. 12 pages including 4 figures and 2
  tables","Astrophys.J. 574 (2002) 51-58","10.1086/340934",,"astro-ph",,"  We use deep HST STIS and NICMOS images of three spectroscopically confirmed
galaxy counterparts of high-redshift damped Ly-alpha (DLA) absorbers (one of
which is a new discovery) to test the hypothesis that high-redshift DLA
galaxies are Lyman-break galaxies. If this hypothesis is correct the emission
properties of DLA galaxies must lie within the range of emission properties
measured for Lyman-break galaxies of similar absolute magnitude. This will be
true regardless of selection biases in the sample of detected DLA galaxies. We
test this prediction using several emission properties: half-light radius,
radial profile (Sersic n parameter), optical-to-near-infrared colour,
morphology, Ly alpha emission equivalent width, and Ly alpha emission velocity
structure. In all cases the measured values for the DLA galaxies lie within the
range measured for the population of Lyman-break galaxies. None of the
measurements is in conflict with the prediction. We conclude that the measured
emission properties of the three DLA galaxies studied here are consistent with
the conjecture that high-redshift DLA galaxies are Lyman-break galaxies. We
show that this result does not conflict with the observation that the few
high-redshift DLA galaxies discovered are mostly fainter than spectroscopically
confirmed L* Lyman-break galaxies.
","[{""version"":""v1"",""created"":""Thu, 21 Mar 2002 07:14:29 GMT""}]","2009-11-07"
"astro-ph/0203362","Isabel Marquez Perez","I. Marquez (Instituto de Astrofisica de Andalucia, CSIC) and P.
  Petitjean (Institut d'Astrophysique de Paris)","Adaptive Optics imaging of Quasar Hosts","Rev.Mex.A&A, in press (""Science with the GTC"", Granada Febr. 2002)",,,,"astro-ph",,"  We present the results of adaptive-optics imaging of 12 (z < 0.6) quasars in
the H and K bands using the PUEO system mounted on the Canada-France-Hawaii
telescope. The QSOs (m_V > 15.0) themselves are used as reference for the
correction. The images, obtained under poor seeing conditions, have typical
spatial resolution of FWHM ~ 0.3arcsec before deconvolution. The deconvolved
H-band image of PG 1700+514 has a spatial resolution of 0.16arcsec and reveals
a wealth of details on the companion and the host-galaxy. The comparison
between the HST and CFHT images of PG 1700+514 shows how powerful and
competitive ground-based AO can be. Close companions and obvious signs of
interactions are found in 4 out of the 12 objects. The 2D images of 3 of the
host-galaxies unambiguously reveal bars and spiral arms. The morphology of the
other host-galaxies are difficult to determine from 1D surface brightness
profiles and deeper images are needed that could be obtained with AO systems on
10m class telescopes. Analysis of mocked data shows that elliptical galaxies
are always recognized as such, whereas disk hosts can be missed for small disk
scale lengths and large QSO contributions.
","[{""version"":""v1"",""created"":""Thu, 21 Mar 2002 09:06:52 GMT""}]","2007-05-23"
"astro-ph/0203363","Rosaria Tantalo","R. Tantalo and C. Chiosi","Enhancement of alpha-Elements in Dynamical Models of Elliptical Galaxies","12 pages, 7 figures, 4 tables. To appear in Astronomy and
  Astrophisics",,"10.1051/0004-6361:20020459",,"astro-ph",,"  In this paper we present a quantitative analysis of the chemical abundances
in ""monolithic"" N-body-Tree-SPH models of elliptical galaxies to determine
whether the ratio [alpha/Fe] increases with the galaxy mass as suggested by
observational data.
","[{""version"":""v1"",""created"":""Thu, 21 Mar 2002 10:04:43 GMT""}]","2016-08-30"
"astro-ph/0203364","Attila Meszaros","Attila Meszaros (Charles University, Prague, Czech Republic)","The Rees-Sciama effect and the primordial nucleosynthesis","Astronomy and Astrophysics, accepted for publication, 4 pages",,"10.1051/0004-6361:20020371",,"astro-ph",,"  It is known that, theoretically, the Rees-Sciama effect may cause arbitrarily
large additional redshifts in the cosmic microwave background radiation due to
transparent expanding voids having sizes comparable with the size of horizon.
Therefore, again theoretically, eventual huge voids existing immediately after
the recombination may essentially change the predictions of the theory of big
bang nucleosynthesis. If this eventuality holds, then the dark matter can be
dominantly baryonic and, simultaneously, one can be in accordance with the
predictions of primordial nucleosynthesis theory. Studying this eventuality one
arrives at the result that the observed extreme isotropy of the cosmic
microwave background radiation rejects the existence of any such huge voids,
and hence this eventuality does not hold.
","[{""version"":""v1"",""created"":""Thu, 21 Mar 2002 10:07:56 GMT""}]","2009-11-07"
"astro-ph/0203365","Emilia Palladino","E. Palladino (1), S. Colafrancesco (2) & P. Marchegiani (1) ((1)
  Department of physics, University of Rome ""La Sapienza"", Italy; (2)
  Astronomica Observatory of Rome, Monteporzio, Italy)","Spatial features of non-thermal SZ effect in galaxy clusters","4 pages, 1 figure, to appear in the proceedings of the 2k1bc workshop
  """"Experimental comsology @ millimetre wavelengths"", july 9-12 2001,
  Breuil-Cervinia, Italy","AIP Conf.Proc.616:363-366,2002","10.1063/1.1475660",,"astro-ph",,"  We investigate the spatial behaviour of the total comptonization parameter
$y_{tot}$ evaluated for a galaxy cluster containing two population of
electrons: the thermal population, with energy around some KeV and whose trace
is evident in the X-ray emission of the ICM (Intra-Cluster Medium), and the
relativistic population, which give rise to the radio halo emission found in
several clusters of galaxies. We present the first results obtained from our
analysis showing that there are remarkable features in such spatial trend,
which might throw a new light in understanding the cluster internal processes.
","[{""version"":""v1"",""created"":""Thu, 21 Mar 2002 10:36:26 GMT""}]","2010-12-13"
"astro-ph/0203366","Taichi Kato","T. Kato (1), H. Yamaoka (2), R. Ishioka (1) ((1) Kyoto U., (2) Kyushu
  U.)","V2540 Oph (Nova Oph 2002): Large-Amplitude Slow Nova with Strong
  Post-Outburst Oscillations","3 pages, 2 figures, submitted to Inf. Bull. Var. Stars",,,,"astro-ph",,"  V2540 Oph (Nova Oph 2002) is a classical nova discovered by Katsumi Haseda
and Yuji Nakamura on 2002 January 24. The light curve of this nova shows strong
post-outburst oscillations as were observed in V1178 Sco and V4361 Sgr.
Accurate astrometry of the nova yeilded an upper limit of 21 mag for the nova
precursor. In combination with the observed decline rate, We propose that the
nova should have either a short orbital period or a high inclination. We
suggest that V2540 Oph may be analogous to V2214 Oph, a presumed magnetic nova
inside the period gap.
","[{""version"":""v1"",""created"":""Thu, 21 Mar 2002 10:39:20 GMT""}]","2007-05-23"
"astro-ph/0203367","Domingo Anibal Garcia Hernandez","D. A. Garcia-Hernandez, A. Manchado, P. Garcia-Lario, C.
  Dominguez-Tagle, G. Conway and F. Prada","Near-IR spectroscopy of planetary nebulae precursors","Accepted for publication in A&A",,"10.1051/0004-6361:20020411",,"astro-ph",,"  We present near-IR spectroscopy of a sample of 30 IRAS sources recently
identified as late AGB stars, post-AGB stars or early
  PNe. The spectra obtained are centered at various wavelengths covering the
molecular hydrogen v=1-0 S(1) and v=2-1 S(1) emission lines, the recombination
lines of hydrogen Br-gamma, Pf-gamma and Br-alpha, and the CO[v=2-0] first
overtone bandhead at 2.294 microns. As a result of these observations we have
increased from 4 to 13 the total number of proto-PNe detected in molecular
hydrogen. When the molecular hydrogen is fluorescence-excited the detection
rate is found to be directly correlated with the evolutionary stage of the
central star, rather than with the nebular morphology. In contrast,
shocked-excited molecular hydrogen is detected only in strongly bipolar
proto-PNe, sometimes even at an early stage in the post-AGB phase. The strong
correlation of shocked-excited molecular hydrogen emission with bipolarity
found confirms the result previously reported by Kastner et al. (1996) in
evolved PNe. However, our results show that this correlation does not exist in
the case of fluorescence-excited molecular hydrogen.
","[{""version"":""v1"",""created"":""Thu, 21 Mar 2002 11:02:15 GMT""}]","2016-08-30"
"astro-ph/0203368","Albert Bosma","E. Athanassoula","Bar-Halo Interaction and Bar Growth","10 pages, 2 figures, accepted for ApJ Letters","Astrophys.J.569:L83-L86,2002","10.1086/340784",,"astro-ph",,"  I show that strong bars can grow in galactic discs, even when the latter are
immersed in haloes whose mass within the disc radius is comparable to, or
larger than, the mass of the disc. I argue that this is due to the response of
the halo and in particular to the destabilising influence of the halo resonant
stars. Via this instability mechanism the halo can stimulate, rather than
restrain, the growth of the bar.
","[{""version"":""v1"",""created"":""Thu, 21 Mar 2002 11:03:09 GMT""}]","2010-04-21"
"astro-ph/0203369","Jens C. Niemeyer","J.C. Niemeyer, M. Reinecke, W. Hillebrandt","Models of Type Ia Supernova Explosions","Based on an invited review at the XIII Rencontres de Blois -
  Frontiers of the Universe, June 17-23,2001",,,,"astro-ph",,"  Type Ia supernovae have become an indispensable tool for studying the
expansion history of the universe, yet our understanding of the explosion
mechanism is still incomplete. We describe the variety of discussed scenarios,
sketch the most relevant physics, and report recent advances in
multidimensional simulations of Chandrasekhar mass white dwarf explosions.
","[{""version"":""v1"",""created"":""Thu, 21 Mar 2002 11:56:52 GMT""}]","2007-05-23"
"astro-ph/0203370","Man Hoi Lee","Omer Blaes, Man Hoi Lee, and Aristotle Socrates (UCSB)","The Kozai Mechanism and the Evolution of Binary Supermassive Black Holes","25 pages, including 12 figures; uses AASTeX v5.0; revised version
  accepted for publication in ApJ","Astrophys.J. 578 (2002) 775-786","10.1086/342655",,"astro-ph",,"  We consider the dynamical evolution of bound, hierarchical triples of
supermassive black holes that might be formed in the nuclei of galaxies
undergoing sequential mergers. The tidal force of the outer black hole on the
inner binary produces eccentricity oscillations through the Kozai mechanism,
and this can substantially reduce the gravitational wave merger time of the
inner binary. We numerically calculate the merger time for a wide range of
initial conditions and black hole mass ratios, including the effects of
octupole interactions in the triple as well as general relativistic periastron
precession in the inner binary. The semimajor axes and the mutual inclination
of the inner and outer binaries are the most important factors affecting the
merger time. We find that for a random distribution of inclination angles and
approximately equal mass black holes, it is possible to reduce the merger time
of a near circular inner binary by more than a factor of ten in over fifty
percent of all cases. We estimate that a typical exterior quadrupole moment
from surrounding matter in the galaxy may also be sufficient to excite
eccentricity oscillations in supermassive black hole binaries, and also
accelerate black hole mergers.
","[{""version"":""v1"",""created"":""Thu, 21 Mar 2002 12:43:38 GMT""},{""version"":""v2"",""created"":""Mon, 1 Jul 2002 21:52:01 GMT""}]","2009-11-07"
"astro-ph/0203371","Vicent J. Martinez","Adriano Campo Bagatin, Vicent J. Martinez and Silvestre Paredes","Multifractal fits to the observed main belt asteroid distribution","Tex, 14 pages, 1 table, 2 figures. Accepted for publication in Icarus",,"10.1006/icar.2002.6826",,"astro-ph",,"  Dohnanyi's (1969) theory predicts that a collisional system such as the
asteroidal population of the main belt should rapidly relax to a power-law
stationary size distribution of the kind $N(m)\propto m^{-\alpha}$, with
$\alpha$ very close to 11/6, provided all the collisional response parameters
are independent on size. The actual asteroid belt distribution at observable
sizes, instead, does not exhibit such a simple fractal size distribution.
  We investigate in this work the possibility that the corresponding cumulative
distribution may be instead fairly fitted by multifractal distributions. This
multifractal behavior, in contrast with the Dohnany fractal distribution, is
related to the release of his hypothesis of self-similarity.
","[{""version"":""v1"",""created"":""Thu, 21 Mar 2002 13:41:39 GMT""}]","2009-11-07"
"astro-ph/0203372","Martin Krause","Martin Krause","Absorbers and Globular Cluster Formation in Powerful High Redshift Radio
  Galaxies","A&A, accepted for publication. 4 pages, 2 figures",,"10.1051/0004-6361:20020135",,"astro-ph",,"  A radiative hydrodynamic simulation for a typical, powerful high redshift
radio galaxy is presented. The jet is injected at one third the speed of light
into a 10000 times denser, homogeneous medium. In the beginning of the
simulation, the bow shock consists of a spherical shell that is similar to a
spherical blast wave. This shell cools radiatively down to approximately 10,000
K, providing after 6 Mio yrs a neutral column of 3.8 x 10^21 cm^-2 around the
whole system. The shell starts to fragment and forms condensations. This
absorbing screen will cover a smaller and smaller fraction of the radio source,
and therefore the emission line region, and eventually form stars in typically
10,000 globular clusters of one million solar masses. Approximately 10^9 solar
masses are entrained into the radio cocoon. This gas, cooling and illuminated
from the radio source, could be the emission line gas observed in high
redshifted radio galaxies and radio loud quasars. The neutral column behind the
bow shock can account for the absorption found in almost all of the small
sources. The globular cluster excess of approximately 10^4 systems found in
present day brightest cluster galaxies (BCGs), which are believed to be the
vestiges of these objects, is consistent with the presented scenario.
","[{""version"":""v1"",""created"":""Thu, 21 Mar 2002 14:40:13 GMT""}]","2009-11-07"
"astro-ph/0203373","Vicent J. Martinez","M.J. Pons-Borderia, V.J. Martinez, B. Lopez-Marti, and S. Paredes","Correlations at large scale","2 pages, 3 figures, to be published in the proceedings of Statistical
  Challenges in Modern Astronomy III E. D. Feigelson & G. J. Babu (eds.),
  Springer-Verlag",,,,"astro-ph",,"  We show point processes generated in different ways and having different
structure, presenting very similar power-law two--point correlation functions
at small scales and quite different shapes at large scales.
","[{""version"":""v1"",""created"":""Thu, 21 Mar 2002 14:56:21 GMT""}]","2007-05-23"
"cond-mat/0203392","John Singleton","Tim Biggs, Anne-Katrin Klehe, John Singleton, David Bakker, Jane
  Symington, Paul Goddard, Arzhang Ardavan, William Hayes, John A. Schlueter,
  Takehiko Sasaki and Mohamedally Kurmoo","Comparison of the normal state properties of
  $\kappa$-(BEDT-TTF)$_2$Cu(NCS)$_2$ and its deuterated analogue in high
  magnetic fields and under high hydrostatic pressures","10 pages 3 figures",,"10.1088/0953-8984/14/26/102",,"cond-mat.str-el cond-mat.supr-con",,"  Details of the Fermi-surface topology of deuterated
$\kappa$-(BEDT-TTF)$_2$Cu(NCS)$_2$ ~have been measured as a function of
pressure, and compared with equivalent measurements of the undeuterated salt.
We find that the superconducting transition temperature is much more
dramatically suppressed by increasing pressure in the deuterated salt. It is
suggested that this is linked to pressure-induced changes in the Fermi-surface
topology, which occur more rapidly in the deuterated salt than in the
undeuterated salt as the pressure is raised. Our data suggest that the negative
isotope effect observed on deuteration is due to small differences in
Fermi-surface topology caused by the isotopic substitution.
","[{""version"":""v1"",""created"":""Wed, 20 Mar 2002 17:02:37 GMT""}]","2015-06-24"
"cond-mat/0203404","luis Brey","M.J.Calder\'on, G.G\'omez-Santos and L.Brey","Impurity-Semiconductor Band Hybridization Effects on the Critical
  Temperature of Diluted Magnetic Semiconductors","10 pages, 10 figures included","Phys. Rev. B 66, 075218 (2002)","10.1103/PhysRevB.66.075218",,"cond-mat.mtrl-sci cond-mat.dis-nn",,"  We have studied the critical temperature of Diluted Magnetic Semiconductors
by means of Monte Carlo simulations and Coherent-Potential-Approximation (CPA)
calculations. In our model for this syste m, the magnetic ions couple with the
carriers through an antiferromagnetic exchange interaction, $J$, and an
electrostatic interaction $W$. The effective impurity potential $J-W$ controls
the hybridization between the magnetic impurities and the hole charge on the
dopants. We find that the critical temperature depends substantially on the
hole charge on the magnetic impurities. The CPA critical temperature is always
lower than the obtained in the Monte Carlo simulations, although all trends in
the simulation results are reproduced in the CPA calculations. Finally we
predict the existence of pockets of phase segregation instability close to the
carriers band edges.
","[{""version"":""v1"",""created"":""Wed, 20 Mar 2002 16:31:28 GMT""}]","2009-11-07"
"cond-mat/0203416","M. Leone","M. Leone (1 and 2), A. Vazquez (1 and 2), A. Vespignani (2) and R.
  Zecchina (2) ((1) International School for Advanced Studies, Trieste, (2)
  International Centre for Theoretical Physics, Trieste)","Ferromagnetic ordering in graphs with arbitrary degree distribution","9 pages, 1 figure",,"10.1140/epjb/e2002-00220-0",,"cond-mat.stat-mech cond-mat.dis-nn",,"  We present a detailed study of the phase diagram of the Ising model in random
graphs with arbitrary degree distribution. By using the replica method we
compute exactly the value of the critical temperature and the associated
critical exponents as a function of the minimum and maximum degree, and the
degree distribution characterizing the graph. As expected, there is a
ferromagnetic transition provided <k> <= <k^2> < \infty. However, if the fourth
moment of the degree distribution is not finite then non-trivial scaling
exponents are obtained. These results are analyzed for the particular case of
power-law distributed random graphs.
","[{""version"":""v1"",""created"":""Wed, 20 Mar 2002 19:08:10 GMT""}]","2009-11-07"
"cond-mat/0203418","Richard Metzler","Richard Metzler, Andreas Engel","Jamming transitions and avalanches in the game of Dots-and-Boxes","7 pages, 8 figures, revtex4",,"10.1103/PhysRevE.65.066108",,"cond-mat.dis-nn",,"  We study the game of Dots-and-Boxes from a statistical point of view. The
early game can be treated as a case of Random Sequential Adsorption, with a
jamming transition that marks the beginning of the end-game. We derive set of
differential equations to make predictions about the state of the lattice at
the transition, and thus about the distribution of avalanches in the end-game.
","[{""version"":""v1"",""created"":""Wed, 20 Mar 2002 16:40:49 GMT""}]","2009-11-07"
