"cond-mat/0203419","Geza Odor","N. Menyhard and G. Odor","One-dimensional Nonequilibrium Kinetic Ising Models with local
  spin-symmetry breaking: N-component branching annihilation transition at zero
  branching rate","6 pages, 5 figures included, 2 new tables added, to appear in PRE",,"10.1103/PhysRevE.66.016127",,"cond-mat.stat-mech cond-mat.soft",,"  The effects of locally broken spin symmetry are investigated in one
dimensional nonequilibrium kinetic Ising systems via computer simulations and
cluster mean field calculations. Besides a line of directed percolation
transitions, a line of transitions belonging to N-component, two-offspring
branching annihilating random-walk class (N-BARW2) is revealed in the phase
diagram at zero branching rate. In this way a spin model for N-BARW2
transitions is proposed for the first time.
","[{""version"":""v1"",""created"":""Wed, 20 Mar 2002 16:30:06 GMT""},{""version"":""v2"",""created"":""Fri, 3 May 2002 12:51:34 GMT""}]","2009-11-07"
"cond-mat/0203420","Jonathan E. Guyer","J. E. Guyer, W. J. Boettinger, J. A. Warren, and G. B. McFadden","Model of Electrochemical ""Double Layer"" Using the Phase Field Method","14 pages, 10 figures",,,,"cond-mat.mtrl-sci",,"  We present the first application of phase field modeling to electrochemistry.
A free energy functional that includes the electrostatic effect of charged
particles leads to rich interactions between concentration, electrostatic
potential, and phase stability. The present model, explored for the equilibrium
planar interface, properly predicts the charge separation associated with the
equilibrium double layer at the electrochemical interface and its extent in the
electrolyte as a function of electrolyte concentration, as well as the form
expected of surface energy vs. potential (""electrocapillary"") curves.
","[{""version"":""v1"",""created"":""Wed, 20 Mar 2002 19:03:18 GMT""}]","2007-05-23"
"cond-mat/0203421","Hans-Werner Hammer","Eric Braaten, H.-W. Hammer (Ohio State U.)","Universality in the Three-Body Problem for 4He Atoms","23 pages, revtex4, 6 ps figures, references added, universal
  expressions updated","Phys.Rev. A67 (2003) 042706","10.1103/PhysRevA.67.042706",,"cond-mat hep-ph nucl-th",,"  The two-body scattering length a for 4He atoms is much larger than their
effective range r_s. As a consequence, low-energy few-body observables have
universal characteristics that are independent of the interaction potential.
Universality implies that, up to corrections suppressed by r_s/a, all
low-energy three-body observables are determined by a and a three-body
parameter \Lambda_*. We give simple expressions in terms of a and \Lambda_* for
the trimer binding energy equation, the atom-dimer scattering phase shifts, and
the rate for three-body recombination at threshold. We determine \Lambda_* for
several 4He potentials from the calculated binding energy of the excited state
of the trimer and use it to obtain the universality predictions for the other
low-energy observables. We also use the calculated values for one potential to
estimate the effective range corrections for the other potentials.
","[{""version"":""v1"",""created"":""Wed, 20 Mar 2002 20:38:04 GMT""},{""version"":""v2"",""created"":""Thu, 13 Mar 2003 14:20:43 GMT""}]","2009-11-07"
"cond-mat/0203422","Beatriz Noheda","B. Noheda, D.E. Cox, G. Shirane, Z.-G. Ye and J. Gao","Phase diagram of the ferroelectric-relaxor
  (1-x)PbMg(1/3)Nb(2/3)O3-xPbTiO3","REVTeX4, 11 pages, 10 figures embedded","Phys. Rev. B 66, 054104 (2002)","10.1103/PhysRevB.66.054104",,"cond-mat.mtrl-sci",,"  Synchrotron x-ray powder diffraction measurements have been performed on
unpoled ceramic samples of (1-x)PbMg(1/3)Nb(2/3)O3-xPbTiO3 (PMN-xPT) with 30%<=
x<= 39% as a function of temperature around the morphotropic phase boundary
(MPB), which is the line separating the rhombohedral and tetragonal phases in
the phase diagram. The experiments have revealed very interesting features
previously unknown in this or related systems. The sharp and well-defined
diffraction profiles observed at high and intermediate temperatures in the
cubic and tetragonal phases, respectively, are in contrast to the broad
features encountered at low temperatures. These peculiar characteristics, which
are associated with the monoclinic phase of MC-type previously reported by Kiat
et al and Singh et al., can only be interpreted as multiple coexisting
structures with MC as the major component. An analysis of the diffraction
profiles has allowed us to properly characterize the PMN-xPT phase diagram and
to determine the stability region of the monoclinic phase, which extends from
x= 31% to x= 37% at 20 K. The complex lansdcape of observed phases points to an
energy balance between the different PMN-xPT phases which is intrinsically much
more delicate than that of related systems such as PbZr(1-x)TixO3 or
(1-x)PbZn(1/3)Nb(1/3)O3-xPbTiO3. These observations are in good accord with an
optical study of x= 33% by Xu et al., who observed monoclinic domains with
several different polar directions coexisting with rhombohedral domains, in the
same single crystal.
","[{""version"":""v1"",""created"":""Wed, 20 Mar 2002 22:50:03 GMT""}]","2009-11-07"
"cond-mat/0203423","Jin-Cheng Zheng","Jin-Cheng Zheng, Hui-Qiong Wang, A. T. S. Wee, and C. H. A. Huan","Possible complete miscibility of $(BN)_x(C_2)_{1-x}$ alloys","6 pages, 3 figures","Physical Review B, 66(9), 092104 (2002)","10.1103/PhysRevB.66.092104",,"cond-mat.mtrl-sci",,"  The stabilities of $(BN)_x(C_2)_{1-x}$ alloys and related superlattices are
investigated by ab initio pseudopotential calculations. We find that the
$(BN)_1/(C_2)_1$ superlattices in (111) orientations have the lowest formation
energy among many short-range ordered $BNC_2$ structures due to the smallest
number of B-C and C-N bonds. Based on the calculated formation energies at
several compositions and for various ordered structures and assuming
thermodynamic equilibrium, the solid solution phase diagram of
$(BN)_x(C_2)_{1-x}$ alloys is constructed. We find that the complete
miscibility of $(BN)_x(C_2)_{1-x}$ alloys is possible, which is in contrast
with previous theoretical predictions but in agreement with experimental
reports.
","[{""version"":""v1"",""created"":""Thu, 21 Mar 2002 00:20:48 GMT""},{""version"":""v2"",""created"":""Tue, 5 Nov 2002 21:27:35 GMT""}]","2009-11-07"
"cond-mat/0203424","Jin-Cheng Zheng","Jin-Cheng Zheng, Hui-Qiong Wang, A.T.S. Wee, C.H.A. Huan","Structural and electronic properties of Al nanowires: an ab initio
  pseudopotential study","11 pages, 5 figures","International Journal of Nanoscience 2002, 1(2): 159-169","10.1142/S0219581X02000097",,"cond-mat.mtrl-sci",,"  The stability and electronic structure of a single monatomic Al wire has been
studied using the ab initio pseudopotential method. The Al wire undergoes two
structural rearrangements under compression, i.e., zigzag configurations at
angles of $140^o$ and $60^o$. The evolution of electronic structures of the Al
chain as a function of structural phase transition has been investigated. The
relationship between electronic structure and geometric stability is also
discussed. The 2p bands in the Al nanowire are shown to play a critical role in
its stability. The effects of density functionals (GGA and LDA) on cohesive
energy and bond length of Al nanostructures (dimmer, chains, and monolayers)
are also examined. The link between low dimensional 0D structure (dimmer) to
high dimensional 3D bulk Al is estimated. An example of optimized tip-suspended
finite atomic chain is presented to bridge the gap between hypothetical
infinite chains and experimental finite chains.
","[{""version"":""v1"",""created"":""Thu, 21 Mar 2002 01:03:22 GMT""},{""version"":""v2"",""created"":""Tue, 5 Nov 2002 20:48:04 GMT""}]","2015-06-24"
"cond-mat/0203425","Seetha Lakshmi","L. Seetha Lakshmi, V.Sridharan, D.V.Natarajan, V.Sankara Sastry and
  T.S.Radhakrishnan (MSD, IGCAR, Kalpakkam, India)","Mn Site Substitution Of La0.67Ca0.33MnO3 With Closed Shell Ions: Effect
  on Magnetic Transition Temperature","11 pages, 4 figures, To be published in Pramana-international Journal
  of Physics",,,"EFI -02-01","cond-mat.str-el",,"  Mn site is substituted with closed shell ions (Al, Ga. Ti, Zr and a certain
combination of Zr and Al) and also with Fe and Ru ions carrying the magnetic
moment (S=5/2 and 2 respectively) at a fixed concentration of 5 at. %.
Substitution did not change either the crystal symmetry or the oxygen
stiochiometry. All substituents were found to suppress both the metal-insulator
and ferromagnetic transition temperatures (TP(r) and TC respectively) to varied
extents. Two main contributions identified for the suppression are the lattice
disorder arising due to difference in the ionic radii (rMn3+-rM) between the
substituent (rM) and the Mn3+ ion (rMn3+) and in the case of the substituents
carrying a magnetic moment, the type of magnetic coupling between the
substituent and that of the neighboring Mn ion.
","[{""version"":""v1"",""created"":""Thu, 21 Mar 2002 03:01:41 GMT""}]","2007-05-23"
"cond-mat/0203426","Masashi Takigawa","K. Kodama, J. Yamazaki, M. Takigawa, H. Kageyama, K. Onizuka and Y.
  Ueda","Cu nuclear spin-spin coupling in the dimer singlet state in SrCu2(BO3)2","7pages, 6 figures, submitted to J. Phys.:condens. matter","J. Phys.:Condens. Matter 14 (2002) L319","10.1088/0953-8984/14/17/101",,"cond-mat.str-el",,"  We report results of nuclear magnetic resonance (NMR) experiments in
SrCu2(BO3)2, a quasi two-dimensional spin system with a singlet ground state.
When magnetic field is applied along the c-axis, each of the quadrupole split
Cu resonance lines splits further into four lines. The spin-echo intensity for
some of the split lines oscillates against the separation time between the
pai/2 and the pai rf-pulses. These phenomena are due to strong nuclear
spin-spin coupling mediated by the electronic spin system, which exists only
within a pair of nuclei. Thus the results provides direct evidence for the
dimer singlet gorund state in this material.
","[{""version"":""v1"",""created"":""Thu, 21 Mar 2002 03:54:19 GMT""}]","2013-03-05"
"cond-mat/0203427","Takao Furubayashi","T. Furubayashi, T. Matsumoto, S. Nagata","Ionic Ordering in Thiospinel CuIr$_{2}$S$_{4}$","10 pages, 4 figures, submitted to J. Phys. Soc. Japan",,,,"cond-mat.str-el cond-mat.mtrl-sci",,"  Crystal structure of spinel compound CuIr$_{2}$S$_{4}$ was examined by powder
X-ray diffraction for the insulating phase below the metal-insulator transition
at $T_{MI}$ = 230 K. The superstructure spots are reproduced by considering the
displacement of Ir atoms. A model for the ionic ordering of Ir$^{4+}$ and
Ir$^{3+}$ with the same number is proposed for the insulating phase on the
basis of the structural analysis. The model suggests that the structural change
at $T_{MI}$ is driven by the formation Ir$^{4+}$ dimers. In addition, we found
that the superstructure spots becomes significantly weak below 60 K, without
any significant effects on electric and magnetic properties. Possible mechanism
for the transition is discussed.
","[{""version"":""v1"",""created"":""Thu, 21 Mar 2002 07:42:36 GMT""}]","2007-05-23"
"cond-mat/0203428","Juha Merikoski","J. Merikoski (1), J. Maunuksela (1), M. Myllys (1), J. Timonen (1),
  and M. J. Alava (2) ((1) Dept of Physics, Univ of Jyvaskyla, Finland, (2) Lab
  of Physics, Helsinki Univ of Technology, Finland)","Temporal and spatial persistence of combustion fronts","4 pages, 4 figures","Phys. Rev. Lett. 90 (2) 024501 (2003)","10.1103/PhysRevLett.90.024501",,"cond-mat.stat-mech cond-mat.dis-nn",,"  The spatial and temporal persistence, or first-return distributions are
measured for slow combustion fronts in paper. The stationary temporal and
(perhaps less convincingly) spatial persistence exponents agree with the
predictions based on the front dynamics, which asymptotically belongs to the
Kardar-Parisi-Zhang (KPZ) universality class. The stationary short-range and
the transient behavior of the fronts is non-Markovian and the observed
persistence properties thus do not agree with the theory. This deviation is a
consequence of additional time and length scales, related to the crossovers to
the asymptotic coarse-grained behavior.
","[{""version"":""v1"",""created"":""Thu, 21 Mar 2002 09:08:11 GMT""},{""version"":""v2"",""created"":""Tue, 3 Dec 2002 06:34:23 GMT""}]","2009-11-07"
"cond-mat/0203429","Naoko Nakagawa","Naoko Nakagawa and Kunihiko Kaneko","A Dynamic Mechanism of Energy Conversion to a Mechanical Work","4 pages, 4 figures",,,,"cond-mat",,"  We propose a dynamic mechanism of a molecular machine for energy conversion,
by considering a simple model describing the dynamics of two components, the
head and the chain. After injection of energy to the head region, the energy is
stored at one part for some time, and is used step by step, allowing the head
to move directionally along the chain, irrespectively of the direction of the
input, under a fluctuating environment. Our system can adjust the timing with
which the head crosses the energy barrier by taking advantage of internal
dynamics and the flexibility of components. The mechanism is shown to be robust
and efficient. Some suggestions are given for molecular machines.
","[{""version"":""v1"",""created"":""Thu, 21 Mar 2002 07:26:37 GMT""}]","2007-05-23"
"cond-mat/0203430","Naoko Nakagawa","Naoko Nakagawa and Kunihiko Kaneko","Relaxation, the Boltzmann-Jeans Conjecture and Chaos","4 pages, 4 figures",,,,"cond-mat",,"  Slow (logarithmic) relaxation from a highly excited state is studied in a
Hamiltonian system with many degrees of freedom. The relaxation time is shown
to increase as the exponential of the square root of the energy of excitation,
in agreement with the Boltzmann-Jeans conjecture, while it is found to be
inversely proportional to residual Kolmogorov-Sinai entropy, introduced in this
Letter. The increase of the thermodynamic entropy through this relaxation
process is found to be proportional to this quantity.
","[{""version"":""v1"",""created"":""Thu, 21 Mar 2002 07:52:34 GMT""}]","2007-05-23"
"cond-mat/0203431","Nurit Granot","Er'el Granot","Forbidden activation levels in a non-stationary tunneling process","4pages,2 figures (Revtex)",,"10.1016/S1386-9477(01)00174-6",,"cond-mat",,"  Tunneling in the presence of an opaque barrier, part of which varies in time,
is investigated numerically and analytically in one dimension. Clearly, due to
the varying barrier a tunneling particle experiences spectral widening.
However, in the case of strong perturbations, the particles' activation to
certain energies is avoided. We show that this effect occurs only when the
perturbation decays faster than 1/t^2.
","[{""version"":""v1"",""created"":""Thu, 21 Mar 2002 07:59:07 GMT""}]","2015-06-24"
"cond-mat/0203432","Enver Nakhmedov","E.P.Nakhmedov, V.N.Prigodin and E.Sasioglu","Mesoscopic fluctuations of the Density of States and Conductivity in the
  middle of the band of Disordered Lattices","5 pages, 3 figures",,"10.1103/PhysRevB.66.075106",,"cond-mat.mes-hall cond-mat.str-el",,"  The mesoscopic fluctuations of the Density of electronic States (DoS) and of
the conductivity of two- and three- dimensional lattices with randomly
distributed substitutional impurities are studied. Correlations of the levels
lying above (or below) the Fermi surface, in addition to the correlations of
the levels lying on opposite sides of the Fermi surface, take place at half
filling due to nesting. The Bragg reflections mediate to increase static
fluctuations of the conductivity in the middle of the band which change the
distribution function of the conductivity at half- filling.
","[{""version"":""v1"",""created"":""Thu, 21 Mar 2002 08:54:09 GMT""}]","2009-11-07"
"cond-mat/0203433","Jochem Baselmans","J.J.A.Baselmans, B.J. van Wees, and T.M. Klapwijk","Direct demonstration of circulating currents in a controllable
  $\pi$-SQUID generated by a 0 to $\pi$ transition of the weak links","11 pages, 12 figures, subm. to Phys. Rev. B",,"10.1103/PhysRevB.65.224513",,"cond-mat.supr-con cond-mat.mes-hall",,"  A controllable $\pi$-SQUID is a DC SQUID with two controllable
$\pi$-junctions as weak links. A controllable $\pi$-junction consists of a
superconducting - normal metal - superconducting Josephson junction with two
additional contacts to the normal region of the junction. By applying a voltage
$V_c$ over these contacts it is possible to control the sate of the junction,
i.e. a conventional (0) state or a $\pi$-state, depending on the magnitude of
$V_c$. We demonstrate experimentally that, by putting one junction into a
$\pi$-state, a screening current is generated around the SQUID loop at integer
external flux. To be able to do this, we have fabricated controllable
$\pi$-junctions, based on Cu-Nb or Ag-Nb, in a new geometry. We show that at
1.4 K only the Nb-Ag device shows the transition to a $\pi$-state as a function
of $V_c$ consistent with theoretical predictions. In a controllable $\pi$ SQUID
based on Nb-Ag we observe, a part from a screening current at integer external
flux, a phase shift of $\pi$ of the $V_{SQUID}-B$ oscillations under suitable
current bias, depending on the magnitude of $V_c$.
","[{""version"":""v1"",""created"":""Thu, 21 Mar 2002 10:16:22 GMT""}]","2009-11-07"
"cond-mat/0203434","Balazs Dora","Bal\'azs D\'ora, Attila Virosztek, Kazumi Maki","Impurity scattering in unconventional density waves","14 pages, 9 figures","Phys. Rev. B 66 (2002) 115112","10.1103/PhysRevB.66.115112",,"cond-mat.str-el cond-mat.supr-con",,"  We have investigated the effect of nonmagnetic impurities on the
quasi-one-dimensional unconventional density wave (UDW) ground state. The
thermodynamics were found to be close to those of a d-wave superconductor in
the Born limit. Four different optical conductivity curves were found depending
on the direction of the applied electric field and on the wavevector dependence
of the gap.
","[{""version"":""v1"",""created"":""Thu, 21 Mar 2002 10:31:26 GMT""}]","2009-11-07"
"cond-mat/0203435","Vladimir Neverov","Yu.G.Arapov, G.I.Harus, O.A.Kuznetsov, V.N.Neverov, N.G.Shelushinina","Parabolic negative magnetoresistance in p-Ge/Ge1-xSix heterostructures","3 pages, 4 figures","Semiconductors 33, No 9 (September 1999) 978-980","10.1134/1.1187817",,"cond-mat.dis-nn cond-mat.mes-hall",,"  Quantum corrections to the conductivity due to the weak localization (WL) and
the disorder-modified electron-electron interaction (EEI) are investigated for
the high-mobility multilayer p-Ge/Ge1-xSix heterostructures at T = (0.1 -
20.0)K in magnetic field B up to 1.5T. Negative magnetoresistance with
logarithmic dependence on T and linear in B^2 is observed for B >= 0.1T. Such a
behavior is attributed to the interplay of the classical cyclotron motion and
the EEI effect. The Hartree part of the interaction constant is estimated
(F_/sigma = 0.44) and the WL and EEI contributions to the total quantum
correction /Delta /sigma at B = 0 are separated (/Delta /sigma_{WL} ~ 0.3/Delta
/sigma; /Delta /sigma_{EEI} ~ 0.7/Delta /sigma).
","[{""version"":""v1"",""created"":""Thu, 21 Mar 2002 10:39:56 GMT""}]","2015-06-24"
"cond-mat/0203436","Thomas Schuermann","Thomas Sch\""urmann and Peter Grassberger","Entropy estimation of symbol sequences","14 pages, 13 figures, 2 tables","CHAOS Vol. 6, No. 3 (1996) 414-427","10.1063/1.166191",,"cond-mat.stat-mech cs.CL cs.IT math.IT physics.data-an stat.ML",,"  We discuss algorithms for estimating the Shannon entropy h of finite symbol
sequences with long range correlations. In particular, we consider algorithms
which estimate h from the code lengths produced by some compression algorithm.
Our interest is in describing their convergence with sequence length, assuming
no limits for the space and time complexities of the compression algorithms. A
scaling law is proposed for extrapolation from finite sample lengths. This is
applied to sequences of dynamical systems in non-trivial chaotic regimes, a 1-D
cellular automaton, and to written English texts.
","[{""version"":""v1"",""created"":""Thu, 21 Mar 2002 11:24:56 GMT""}]","2017-04-24"
"cond-mat/0203437","Thorsten Poeschel","Michael A. Scherer, Volkhard Buchholtz, Thorsten Poeschel, and Ingo
  Rehberg","Swirling Granular Matter: From Rotation to Reptation","4 pages, 4 figures","Phys. Rev. E, Vol. 54, R4560 (1996)","10.1103/PhysRevE.54.R4560",,"cond-mat.stat-mech",,"  A novel effect in a granular material under swirling motion of the container
is presented. At low packing densities the material rotates in the same
direction as the swirling motion of the container (rotation). At higher
densities the cluster of granular material rotates in opposite direction
(reptation). The change of the direction of the motion of the cluster takes
place at a critical packing density while the diffusion coefficient changes
significantly. The measured critical density of the packing is in good
agreement with results obtained by molecular dynamics simulation.
","[{""version"":""v1"",""created"":""Thu, 21 Mar 2002 11:32:45 GMT""}]","2009-11-07"
"cond-mat/0203438","Thorsten Poeschel","Volkhard Buchholtz and Thorsten Poeschel","Avalanche statistics of sand heaps","6 pages, 4 figures","J. Stat. Phys. Vol.84, 1373 (1996)","10.1007/BF02174136",,"cond-mat.stat-mech cond-mat.mtrl-sci",,"  Large scale computer simulations are presented to investigate the avalanche
statistics of sand piles using molecular dynamics. We could show that different
methods of measurement lead to contradicting conclusions, presumably due to
avalanches not reaching the end of the experimental table.
","[{""version"":""v1"",""created"":""Thu, 21 Mar 2002 11:46:28 GMT""}]","2015-06-24"
"cond-mat/0203439","Thomas Schuermann","Holger Kantz and Thomas Sch\""urmann","Enlarged scaling ranges for the KS-entropy and the information dimension","5 pages, 6 figures","CHAOS Vol. 6, No. 2, (1996) 167-171","10.1063/1.166161",,"cond-mat.stat-mech",,"  Numerical estimates of the Kolmogorov-Sinai entropy based on a finite amount
of data decay towards zero in the relevant limits. Rewriting differences of
block entropies as averages over decay rates, and ignoring all parts of the
sample where these rates are uncomputable because of the lack of neighbours,
yields improved entropy estimates. In the same way, the scaling range for
estimates of the information dimension can be extended considerably. The
improvement is demonstrated for experimental data.
","[{""version"":""v1"",""created"":""Thu, 21 Mar 2002 12:02:25 GMT""}]","2009-11-07"
"cond-mat/0203440","Matias Aunola","M. Aunola","Superconducting single-electron transistor and the phi-modulation of
  supercurrent","1 page, a simple derivation of a nice result which is not necessarily
  new",,,,"cond-mat.supr-con",,"  An analytical expression for the supercurrent of a superconducting
single-electron transistor (SSET) is derived. The derivation is based on
analogy between the model Hamiltonian for E_J>E_C and a discrete,
one-dimensional harmonic oscillator (1DDHO). The resulting supercurrent is
nearly identical to the supercurrent obtained from a continuous harmonic
oscillator Hamiltonian.
","[{""version"":""v1"",""created"":""Thu, 21 Mar 2002 12:25:22 GMT""}]","2007-05-23"
"cond-mat/0203441","Thorsten Poeschel","Clara Saluena, Sergei E. Esipov, and Thorsten Poeschel","Hydrodynamics of dense granular systems","10 pages, 7 figures","Proceedings of the SPIE, Vol. 3045, 2 (1997)","10.1117/12.274205",,"cond-mat.mtrl-sci",,"  The properties of dense granular systems are analyzed from a hydrodynamical
point of view, based on conservation laws for the particle number density and
linear momentum. We discuss averaging problems associated with the nature of
such systems and the peculiarities of the sources of noise. We perform a
quantitative study by combining analytical methods and numerical results
obtained by ensemble-averaging of data on creep during compaction and molecular
dynamics simulations of convective flow. We show that numerical integration of
the hydrodynamic equations gives the expected evolution for the time-dependent
fields.
","[{""version"":""v1"",""created"":""Thu, 21 Mar 2002 12:37:32 GMT""}]","2015-06-24"
"cond-mat/0203442","Salvatore Miccich\`e","Fabrizio Lillo, Salvatore Micciche', Rosario N. Mantegna","Long-range correlated stationary Markovian processes","4 pages",,,,"cond-mat.stat-mech",,"  We introduce a new class of stochastic processes which are stationary,
Markovian and characterized by an infinite range of time-scales. By
transforming the Fokker-Planck equation of the process into a Schrodinger
equation with an appropriate quantum potential we determine the asymptotic
behavior of the autocorrelation function of the process in an analytical way.
We find the conditions needed to observe a stationary long-range correlated
Markovian process. In the presence of long-range correlation, for selected
values of the control parameters, the process has a 1/f-like spectral density
for low frequency values.
","[{""version"":""v1"",""created"":""Thu, 21 Mar 2002 13:39:17 GMT""}]","2007-05-23"
