"quant-ph/0203122","Carlos Viviescas","C. Viviescas and G. Hackenbroich","Field quantization for open optical cavities","16 pages, added references, corrected typos","Phys. Rev. A 67, 013805 (2003)","10.1103/PhysRevA.67.013805",,"quant-ph",,"  We study the quantum properties of the electromagnetic field in optical
cavities coupled to an arbitrary number of escape channels. We consider both
inhomogeneous dielectric resonators with a scalar dielectric constant
$\epsilon({\bf r})$ and cavities defined by mirrors of arbitrary shape. Using
the Feshbach projector technique we quantize the field in terms of a set of
resonator and bath modes. We rigorously show that the field Hamiltonian reduces
to the system--and--bath Hamiltonian of quantum optics. The field dynamics is
investigated using the input--output theory of Gardiner and Collet. In the case
of strong coupling to the external radiation field we find spectrally
overlapping resonator modes. The mode dynamics is coupled due to the damping
and noise inflicted by the external field. For wave chaotic resonators the mode
dynamics is determined by a non--Hermitean random matrix. Upon including an
amplifying medium, our dynamics of open-resonator modes may serve as a starting
point for a quantum theory of random lasing.
","[{""version"":""v1"",""created"":""Mon, 25 Mar 2002 14:44:02 GMT""},{""version"":""v2"",""created"":""Fri, 10 Jan 2003 15:51:45 GMT""}]","2009-11-07"
