"cond-mat/0203500","Eric Jeckelmann","Eric Jeckelmann (University of Marburg, Germany)","Dynamical density-matrix renormalization-group method","16 pages (REVTEX 4.0), 10 figures (in 13 EPS files)","Phys. Rev. B 66, 045114 (2002)","10.1103/PhysRevB.66.045114",,"cond-mat.str-el",,"  I present a density-matrix renormalization-group (DMRG) method for
calculating dynamical properties and excited states in low-dimensional lattice
quantum many-body systems. The method is based on an exact variational
principle for dynamical correlation functions and the excited states
contributing to them. This dynamical DMRG is an alternate formulation of the
correction vector DMRG but is both simpler and more accurate. The finite-size
scaling of spectral functions is discussed and a method for analyzing the
scaling of dense spectra is described. The key idea of the method is a
size-dependent broadening of the spectrum.The dynamical DMRG and the
finite-size scaling analysis are demonstrated on the optical conductivity of
the one-dimensional Peierls-Hubbard model. Comparisons with analytical results
show that the spectral functions of infinite systems can be reproduced almost
exactly with these techniques. The optical conductivity of the Mott-Peierls
insulator is investigated and it is shown that its spectrum is qualitatively
different from the simple spectra observed in Peierls (band) insulators and
one-dimensional Mott-Hubbard insulators.
","[{""version"":""v1"",""created"":""Mon, 25 Mar 2002 10:48:44 GMT""}]","2009-11-07"
"cond-mat/0203501","Busiello Gaetano","G. Busiello, R. V. Saburova, V. G. Sushkova","Dynamic nonlinear (cubic) susceptibility in quantum Ising spin glass","15 pages, 3 figures",,"10.1016/S0038-1098(02)00219-3",,"cond-mat.dis-nn cond-mat.stat-mech",,"  Dynamic nonlinear (cubic) susceptibility in quantum d-dimensional Ising spin
glass with short-range interactions is investigated on the basis of quantum
droplet model and quantum-mechanical nonlinear response theory. Nonlinear
response depends on the tunneling rate for a droplet which regulates the
strength of quantum fluctuations. It shows a strong dependence on the
distribution of droplet free energies and on the droplet length scale average.
Comparison with recent experiments on quantum spin glasses like disordered
dipolar quantum Ising magnet is discussed.
","[{""version"":""v1"",""created"":""Mon, 25 Mar 2002 10:43:31 GMT""}]","2009-11-07"
"cond-mat/0203502","Christian von Ferber","Christian von Ferber, Yurij Holovatch","Scaling exponents of star polymers","20 pages, in Condensed Matter Physics issue on Star Polymers","Condens. Matter Phys. 5 (2002) 117-136",,,"cond-mat.soft",,"  We review recent results of the field theoretical renormalization group
analysis on the scaling properties of star polymers. We give a brief account of
how the numerical values of the exponents governing the scaling of star
polymers were obtained as well as provide some examples of the phenomena
governed by these exponents. In particular we treat the interaction between
star polymers in a good solvent, the Brownian motion near absorbing polymers,
and diffusion-controlled reactions involving polymers.
","[{""version"":""v1"",""created"":""Mon, 25 Mar 2002 13:09:23 GMT""}]","2007-05-23"
"cond-mat/0203503","Nag","K. E. Nagaev","Cascade Boltzmann - Langevin approach to higher-order current
  correlations in diffusive metal contacts","6 pages, 2 eps figures, typo corrected, minor changes","Phys. Rev. B 66, 075334 (2002)","10.1103/PhysRevB.66.075334",,"cond-mat.mes-hall",,"  The Boltzmann - Langevin approach is extended to calculations of third and
fourth cumulants of current in diffusive-metal contacts. These cumulants result
from indirect correlations between current fluctuations, which may be
considered as ""noise of noise"". The calculated third cumulant coincides exactly
with its quantum-mechanical value. The fourth cumulant tends to its
quantum-mechanical value $-e^3I/105$ at high voltages and to a positive value
$2e^2T/3R$ at V=0 changing its sign at $eV \sim 20T$.
","[{""version"":""v1"",""created"":""Mon, 25 Mar 2002 11:15:26 GMT""},{""version"":""v2"",""created"":""Mon, 19 Aug 2002 12:19:03 GMT""}]","2009-11-07"
"cond-mat/0203504","Christian von Ferber","Christian von Ferber, Yurij Holovatch","Two-dimensional Copolymers and Multifractality: Comparing Perturbative
  Expansions, MC Simulations, and Exact Results","5 pages","Phys. Rev. E 65 (2002) 042801","10.1103/PhysRevE.65.042801",,"cond-mat.soft",,"  We analyze the scaling laws for a set of two different species of long
flexible polymer chains joined together at one of their extremities (copolymer
stars) in space dimension D=2. We use a formerly constructed field-theoretic
description and compare our perturbative results for the scaling exponents with
recent conjectures for exact conformal scaling dimensions derived by a
conformal invariance technique in the context of D=2 quantum gravity. A simple
MC simulation brings about reasonable agreement with both approaches. We
analyse the remarkable multifractal properties of the spectrum of scaling
exponents.
","[{""version"":""v1"",""created"":""Mon, 25 Mar 2002 11:18:23 GMT""}]","2009-11-07"
"cond-mat/0203505","Sornette","A. Helmstetter (Observatoire de Grenoble) and D. Sornette (CNRS and
  Univ. Nice and UCLA)","Diffusion of Earthquake Aftershock Epicenters, Omori's Law and
  Generalized Continuous-Time Random Walk Models","43 pages in revtex, 2 tables, 12 figures","Physical Review E. 6606 (6 Part 1): 1104 (2002) DOI:
  10.1103/PhysRevE.66.061104","10.1103/PhysRevE.66.061104",,"cond-mat.stat-mech",,"  The epidemic-type aftershock sequence model (ETAS) is a simple stochastic
process modeling seismicity, based on the two best-established empirical laws,
the Omori law (power law decay ~1/t^{1+\theta} of seismicity after an
earthquake) and Gutenberg-Richter law (power law distribution of earthquake
energies). In order to describe also the space distribution of seismicity, we
use in addition a power law distribution ~1/r^{1+\mu} of distances between
triggered and triggering earthquakes. We present an exact mapping between the
ETAS model and a class of CTRW (continuous time random walk) models, based on
the identification of their corresponding Master equations. This mapping allows
us to use the wealth of results previously obtained on anomalous diffusion of
CTRW. We provide a classification of the different regimes of diffusion of
seismic activity triggered by a mainshock. Specifically, we derive the relation
between the average distance between aftershocks and the mainshock as a
function of the time from the mainshock and of the joint probability
distribution of the times and locations of the aftershocks. Our predictions are
checked by careful numerical simulations. We stress the distinction between the
``bare'' Omori law describing the seismic rate activated directly by a
mainshock and the ``renormalized'' Omori law taking into account all possible
cascades from mainshocks to aftershocks of aftershock of aftershock, and so on.
In particular, we predict that seismic diffusion or sub-diffusion occurs and
should be observable only when the observed Omori exponent is less than 1,
because this signals the operation of the renormalization of the bare Omori
law, also at the origin of seismic diffusion in the ETAS model.
","[{""version"":""v1"",""created"":""Mon, 25 Mar 2002 11:35:13 GMT""},{""version"":""v2"",""created"":""Mon, 18 Aug 2003 03:16:17 GMT""}]","2009-11-07"
"cond-mat/0203506","Satoshi Yotsuhashi","Satoshi Yotsuhashi and Hideaki Maebashi","Crossover Temperature from Non-Fermi Liquid to Fermi Liquid Behavior in
  Two Types of Impurity Kondo Model","15pages, 9figures",,"10.1143/JPSJ.71.1705",,"cond-mat",,"  Numerical renormalization-group results on entropy of the anisotropic
two-channel Kondo model with the band-width cutoff ($D$) in the presence of a
magnetic field ($h$) are obtained to determine crossover temperature from the
non-Fermi liquid to Fermi liquid fixed point. It is found that the crossover
temperature ($T_{\rm x}$) is given by $T_{\rm x} \equiv {r} T_{\rm K} \sim
D(\Delta J/J_{\rm av})^2 e^{-1/J_{\rm av}}$ when $(h /T_{\rm K})^2 \ll r \ll 1
$, where $T_{\rm K}$, $J_{\rm av}$ and $\Delta J$ are the Kondo temperature,
the average and difference of the exchange coupling constants, respectively.
This result indicates that non-Fermi liquid behavior can be seen even if
$\Delta J > T_{\rm K}$. Robust similarities of the crossover behavior in the
region around the non-Fermi liquid critical point to that of the two-impurity
Kondo model are also discussed.
","[{""version"":""v1"",""created"":""Mon, 25 Mar 2002 11:39:37 GMT""}]","2009-11-07"
"cond-mat/0203507","Yu. V. Tarasov","Yu. V. Tarasov","""Unusual"" metals in two dimensions: one-particle model of the
  metal-insulator transition at T=0","7 pages, LATEX-2e","J. Phys.: Condens. Matter, v. 14 (2002), pp. L357-L363","10.1088/0953-8984/14/20/103",,"cond-mat.dis-nn cond-mat.mes-hall",,"  The conductance of disordered nano-wires at T=0 is calculated in one-particle
approximation by reducing the original multi-dimensional problem for an open
bounded system to a set of exactly one-dimensional non-Hermitian problems for
mode propagators. Regarding two-dimensional conductor as a limiting case of
three-dimensional disordered quantum waveguide, the metallic ground state is
shown to result from its multi-modeness. On thinning the waveguide (in
practice, e. g., by means of the ``pressing'' external electric field) the
electron system undergoes a continuous phase transition from metallic to
insulating state. The result predicted conform qualitatively to the observed
anomalies of the resistance of different planar electron and hole systems.
","[{""version"":""v1"",""created"":""Mon, 25 Mar 2002 11:51:49 GMT""}]","2009-11-07"
"cond-mat/0203508","Dima Shepelyansky","Bhargavi Srinivasan, Giuliano Benenti and Dima L. Shepelyansky
  (Toulouse / Como)","Transition to an Insulating Phase Induced by Attractive Interactions in
  the Disordered Three-Dimensional Hubbard Model","revtex, 4 pages, 3 figures","Phys. Rev. B 66, 172506 (2002)","10.1103/PhysRevB.66.172506",,"cond-mat",,"  We study numerically the interplay of disorder and attractive interactions
for spin-1/2 fermions in the three-dimensional Hubbard model. The results
obtained by projector quantum Monte Carlo simulations show that at moderate
disorder, increasing the attractive interaction leads to a transition from
delocalized superconducting states to the insulating phase of localized pairs.
This transition takes place well within the metallic phase of the
single-particle Anderson model.
","[{""version"":""v1"",""created"":""Mon, 25 Mar 2002 12:05:51 GMT""}]","2007-05-23"
"cond-mat/0203509","Roberto Franzosi","Roberto Franzosi (1) and Vittorio Penna (2) ((1) University and INFN
  of Pisa, (2) Politecnico and INFM of Torino)","Collective modes, chaotic behavior and self-trapping in the dynamics of
  three coupled Bose-Einstein condensates","17 pages, 20 figures, submitted to Phys. Rev. A 15 Nov 01","Physical Review E 67, 046227 (2003)","10.1103/PhysRevE.67.046227",,"cond-mat.mes-hall cond-mat.supr-con nlin.CD physics.atom-ph quant-ph",,"  The dynamics of three coupled bosonic wells (trimer) containing $N$ bosons is
investigated within a standard (mean-field) semiclassical picture based on the
coherent-state method. Various periodic solutions (configured as $\pi$-like,
dimerlike and vortex states) representing collective modes are obtained
analitically when the fixed points of trimer dynamics are identified on the
$N$=const submanifold in the phase space. Hyperbolic, maximum and minimum
points are recognized in the fixed-point set by studying the Hessian signature
of the trimer Hamiltonian.
  The system dynamics in the neighbourhood of periodic orbits (associated to
fixed points) is studied via numeric integration of trimer motion equations
thus revealing a diffused chaotic behavior (not excluding the presence of
regular orbits), macroscopic effects of population-inversion and self-trapping.
In particular, the behavior of orbits with initial conditions close to the
dimerlike periodic orbits shows how the self-trapping effect of dimerlike
integrable subregimes is destroyed by the presence of chaos.
","[{""version"":""v1"",""created"":""Mon, 25 Mar 2002 12:26:33 GMT""},{""version"":""v2"",""created"":""Wed, 15 May 2002 12:22:05 GMT""},{""version"":""v3"",""created"":""Fri, 24 May 2002 10:01:40 GMT""}]","2016-08-31"
"cond-mat/0203510","Efim I. Kats","V.A.Benderskii (Institute of Problems of Chemical Physics, Moscow
  Region, Chernogolovka, Russia; and Lab. Spectrometrie Physique, UJF,
  Grenoble, France), E.V.Vetoshkin (Institute of Problems of Chemical Physics,
  Moscow Region, Chernogolovka, Russia); E. I. Kats (Laue-Langevin Institute,
  Grenoble, France; and L. D. Landau Institute for Theoretical Physics, RAS,
  Moscow, Russia)","Semiclassical approach to states near potential barrier top","16 pages, 10 eps figures, Revtex, submitted tobPhys. Rev. A",,"10.1134/1.1520597",,"cond-mat.stat-mech",,"  Within the framework of the instanton approach we present analytical results
for the following model problems: (i) particle penetration through a parabolic
potential barrier, where the instanton solution practically coincides with the
exact (quantum) one; (ii) descriptions of highly excited states in two types of
anharmonic potentials: double-well $X^4$, and decay $X^3$. For the former case
the instanton method reproduces accurately not only single well and double-well
quantization but as well a crossover region (in the contrast with the standard
WKB approach which fails to describe the crossover behavior), and for the
latter case the instanton method allows to study resonance broadening and
collapse phenomena. We investigate also resonance tunneling, playing a relevant
role in many semiconducting devices. We show that in a broad region of energies
the instanton approach gives exact (quantum) results. Applications of the
method and of the results may concern the various systems in physics, chemistry
and biology exhibiting double level behavior and resonance tunneling.
","[{""version"":""v1"",""created"":""Mon, 25 Mar 2002 12:52:20 GMT""}]","2009-11-07"
"cond-mat/0203511","Jean-Philippe Bouchaud","J.-P. Bouchaud, M. Mezard and M. Potters","Statistical properties of stock order books: empirical results and
  models","Revised version, 10 pages, 4 .eps figures. to appear in Quantitative
  Finance","Quantitative Finance 2 251-256 (2002).","10.1088/1469-7688/2/4/301",,"cond-mat",,"  We investigate several statistical properties of the order book of three
liquid stocks of the Paris Bourse. The results are to a large degree
independent of the stock studied. The most interesting features concern (i) the
statistics of incoming limit order prices, which follows a power-law around the
current price with a diverging mean; and (ii) the humped shape of the average
order book, which can be quantitatively reproduced using a `zero intelligence'
numerical model, and qualitatively predicted using a simple approximation.
","[{""version"":""v1"",""created"":""Mon, 25 Mar 2002 12:53:09 GMT""},{""version"":""v2"",""created"":""Tue, 18 Jun 2002 16:17:45 GMT""}]","2007-05-23"
"cond-mat/0203512","R. W. Richardson","R. W. Richardson (New York University)","New Class of Solvable and Integrable Many-Body Models","16 pages, 0 figures, RevTex4",,,,"cond-mat nucl-th quant-ph",,"  Integrability conditions for systems of bosons or fermions with seniority
conserving hamiltonians are derived. The conditions are shown to be invariant
under a large class of transformations of the interaction matrix elements.
Previously published integrable models are shown to satisfy these conditions
and the existence of a new class of integrable models is demonstrated. The
number of free parameters in the interaction in these models equals the number
of single particle levels plus 3 . Equations for the energy eigenstates and
eigenvalues are derived and the eigenvalues of the complete set of two-body
integrals of the motion are given for the new class. Some two-body correlations
in these eigenstates are derived from the integrals of the motion.
","[{""version"":""v1"",""created"":""Mon, 25 Mar 2002 13:39:24 GMT""},{""version"":""v2"",""created"":""Tue, 26 Mar 2002 18:55:12 GMT""}]","2007-05-23"
"cond-mat/0203513","Eckhard Bartsch","Thomas Eckert and Eckhard Bartsch","Reentrant glass transition in a colloid-polymer mixture with depletion
  attractions","14 pages, 3 figures",,"10.1103/PhysRevLett.89.125701",,"cond-mat.soft cond-mat.dis-nn",,"  Performing light scattering experiments we show that introducing short-ranged
attraction to a colloidal suspension of nearly hard spheres by addition of free
polymer produces new glass transition phenomena. We observe a dramatic
acceleration of the density fluctuations amounting to the melting of a
colloidal glass. Increasing the strength of the attractions the system freezes
into another nonergodic state sharing some qualitative features with gel states
occurring at lower colloid packing fractions. This reentrant glass transition
is in qualitative agreement with recent theoretical predictions.
","[{""version"":""v1"",""created"":""Mon, 25 Mar 2002 15:03:33 GMT""}]","2009-11-07"
"cond-mat/0203514","Cristian Victor Ciobanu","V.B. Shenoy and L.B. Freund (Brown University)","A continuum description of the energetics and evolution of stepped
  surfaces in strained nanostructures","25 pages, 7 figs, KEYWORDS=surface diffusion, surface energy,
  morphology evolution, semiconductor material, stability and bifurcation",,"10.1016/S0022-5096(02)00015-7",,"cond-mat",,"  As a departure from existing continuum approaches for describing the
stability and evolution of surfaces of crystalline materials, this article
provides a description of surface evolution based on the physics of the main
feature imposed by the discrete nature of the material, namely,
crystallographic surface steps. It is shown that the formation energy of
surface steps depends on the sign of extensional strain of the crystal surface,
and this behavior plays a crucial role in surface evolution. The nature of this
dependence implies that there is no energetic barrier to nucleation of islands
on the growth surface during deposition, and that island faces tend toward
natural orientations which have no counterpart in unstrained materials. This
behavior is expressed in terms of a small number of parameters that can be
estimated through atomistic analysis of stepped surfaces. The continuum
framework developed is then applied to study the time evolution of surface
shape of an epitaxial film being deposited onto a substrate. The kinetic
equation for mass transport is enforced in a weak form by means of a
variational formulation [...].
","[{""version"":""v1"",""created"":""Mon, 25 Mar 2002 15:27:15 GMT""},{""version"":""v2"",""created"":""Mon, 25 Mar 2002 22:01:54 GMT""}]","2009-11-07"
"cond-mat/0203515","Zorica Konstantinovic","Z. Konstantinovic, G. Le Bras, A. Forget, D. Colson, F. Jean, G.
  Collin, M. Ocio, C. Ayache","Thermopower in the strongly overdoped region of single-layer
  Bi2Sr2CuO6+d superconductor","4 pages, 4 figures","Phys. Rev. B 66 (2002) 20503","10.1103/PhysRevB.66.020503",,"cond-mat.supr-con cond-mat.str-el",,"  The evolution of the thermoelectric power S(T) with doping, p, of
single-layer Bi2Sr2CuO6+d ceramics in the strongly overdoped region is studied
in detail. Analysis in term of drag and diffusion contributions indicates a
departure of the diffusion from the T-linear metallic behavior. This effect is
increased in the strongly overdoped range (p~0.2-0.28) and should reflect the
proximity of some topological change.
","[{""version"":""v1"",""created"":""Mon, 25 Mar 2002 15:38:25 GMT""}]","2009-11-07"
"gr-qc/0203081","Chris Clarkson","J. Ibanez, C.A. Clarkson and A.A. Coley","On Scaling Solutions with a Dissipative Fluid","8 pages and 5 figures; to appear in Class. Quantum Grav","Class.Quant.Grav. 19 (2002) 3067-3076","10.1088/0264-9381/19/11/320",,"gr-qc astro-ph",,"  We study the asymptotic behaviour of scaling solutions with a dissipative
fluid and we show that, contrary to recent claims, the existence of stable
accelerating attractor solution which solves the `energy' coincidence problem
depends crucially on the chosen equations of state for the thermodynamical
variables. We discuss two types of equations of state, one which contradicts
this claim, and one which supports it.
","[{""version"":""v1"",""created"":""Mon, 25 Mar 2002 14:58:37 GMT""}]","2009-11-07"
"gr-qc/0203083","Panayiotis Stavrinos","P.C. Stavrinos, F.I. Diakogiannis","A Geometric Anisotropic Model of Space-Time Based on Finsler Metric","Latex, 18 pages",,,,"gr-qc",,"  In this work we study an anisotropic model of general relativity based on the
framework of Finsler geometry. The observed anisotropy of the microwave
background radiation is incorporated in the Finslerian structure of space-time.
We also examine the electromagnetic (e.m.) field equations in our space. As a
result a modified wave equation of e.m. waves yields.
","[{""version"":""v1"",""created"":""Sun, 24 Mar 2002 21:47:49 GMT""}]","2007-05-23"
"gr-qc/0203084","Irina Radinschi","I. Radinschi (Department of Physics, ``Gh. Asachi'' Technical
  University, Iasi, Romania)","M{\o}ller Energy-Momentum Complex for an Axially Symmetric Scalar Field","LaTex",,,,"gr-qc",,"  We calculate the energy-distribution for an axially symmetric scalar field in
the M{\o}ller prescription. The total energy is given by the parameter m of the
space-time.
","[{""version"":""v1"",""created"":""Mon, 25 Mar 2002 09:56:26 GMT""}]","2007-05-23"
"hep-lat/0203025","Hideo Matsufuru","Junpei Harada, Hideo Matsufuru, Tetsuya Onogi and Ayumu Sugita","Heavy quark action on the anisotropic lattice","11 pages, REVTeX4, 11 eps figures","Phys.Rev. D66 (2002) 014509","10.1103/PhysRevD.66.014509","HUPD-0120, YITP-02-19, RCNP-Th02004","hep-lat",,"  We investigate the $O(a)$ improved quark action on anisotropic lattice as a
potential framework for the heavy quark, which may enable precision computation
of hadronic matrix elements of heavy-light mesons. The relativity relations of
heavy-light mesons as well as of heavy quarkonium are examined on a quenched
lattice with spatial lattice cutoff $a_\sigma^{-1} \simeq$ 1.6 GeV and the
anisotropy $\xi=4$. We find that the bare anisotropy parameter tuned for the
massless quark describes both the heavy-heavy and heavy-light mesons within 2%
accuracy for the quark mass $a_\sigma m_Q < 0.8$, which covers the charm quark
mass. This bare anisotropy parameter also successfully describes the
heavy-light mesons in the quark mass region $a_\sigma m_Q \leq 1.2$ within the
same accuracy. Beyond this region, the discretization effects seem to grow
gradually. The anisotropic lattice is expected to extend by a factor $\xi$ the
quark mass region in which the parameters in the action tuned for the massless
limit are applicable for heavy-light systems with well controlled systematic
errors.
","[{""version"":""v1"",""created"":""Sun, 24 Mar 2002 16:42:08 GMT""}]","2009-11-07"
"hep-ph/0203228","Marek Nowakowski","Marek Nowakowski, (Universidad de Guanajuato, Mexico)","Quantum Instability for Mixed States","11 pages","Mod.Phys.Lett. A17 (2002) 2039-2048","10.1142/S0217732302008642",,"hep-ph",,"  The analysis of the time evolution of unstable states which are linear
superposition of other, observable, states can, in principle, be carried out in
two distinct, non-equivalent ways. One of the methods, usually employed for the
neutral kaon system, combines the mixing and instability into one single step
which then results into unconventional properties of the mass-eigenstates. An
alternative method is to remain within the framework of a Lagrangian formalism
and to perform the mixing prior to the instability analysis. Staying close to
the $K^0-\bar{K^0}$ system, we compare both methods pointing out some of their
shortcomings and advantages.
","[{""version"":""v1"",""created"":""Sun, 24 Mar 2002 19:04:50 GMT""}]","2009-11-07"
"hep-ph/0203229","Howard E. Haber","Marcela Carena, David W. Gerdes, Howard E. Haber, Andre S. Turcot and
  Peter M. Zerwas","Executive Summary of the Snowmass 2001 Working Group (P1) ``Electroweak
  Symmetry Breaking''","24 pages, 10 figures, to appear in the Proceedings of the APS/DPF/DPB
  Summer Study on the Future of Particle Physics (Snowmass 2001), newest
  version includes corrected references","eConfC010630:P1001,2001",,"FERMILAB-Conf-02/053-T","hep-ph hep-ex",,"  In this summary report of the 2001 Snowmass Electroweak Symmetry Breaking
Working Group, the main candidates for theories of electroweak symmetry
breaking are surveyed, and the criteria for distinguishing among the different
approaches are discussed. The potential for observing electroweak symmetry
breaking phenomena at the upgraded Tevatron and the LHC is described. We
emphasize the importance of a high-luminosity $e^+e^-$ linear collider for
precision measurements to clarify the underlying electroweak symmetry breaking
dynamics. Finally, we note the possible roles of the $\mu^+\mu^-$ collider and
VLHC for further elucidating the physics of electroweak symmetry breaking.
","[{""version"":""v1"",""created"":""Mon, 25 Mar 2002 01:28:16 GMT""},{""version"":""v2"",""created"":""Mon, 15 Apr 2002 21:42:00 GMT""},{""version"":""v3"",""created"":""Wed, 24 Apr 2002 21:47:54 GMT""}]","2008-11-26"
