"hep-ph/0203230","Sorina Lazanu","Ionel Lazanu and Sorina Lazanu","Radiation defects in silicon due to hadrons and leptons, their annealing
  and influence on detector performance","13 pag, 7 figures accepted for publication in Physica Scripta","Phys.Scripta 66 (2002) 125-132","10.1238/Physica.Regular.066a00125",,"hep-ph hep-ex",,"  A phenomenological model was developed to explain quantitatively, without
free parameters, the production of primary defects in silicon after particle
irradiation, the kinetics of their evolution toward equilibrium and their
influence on detector parameters. The type of the projectile particle and its
energy is considered in the evaluation of the concentration of primary defects.
Vacancy-interstitial annihilation, interstitial migration to sinks, vacancy -
impurity complexes (VP, VO, V2O), and divacancy (V2) formation are taken into
account in different irradiation conditions, for different concentrations of
impurities in the semiconductor material, for 20 and 0 degrees C. The model can
be extended to include other vacancy and interstitial complexes. The density of
the reverse current in the detector after irradiation is estimated. Comparison
with experimental measurements is performed. A special application considered
in the paper is the modelled case of the behaviour of silicon detectors
operating in the pion field estimated for the LHC accelerator, under continuum
generation and annealing.
","[{""version"":""v1"",""created"":""Mon, 25 Mar 2002 08:06:51 GMT""}]","2009-11-07"
"hep-ph/0203231","Armin Boehrer","Armin B\""ohrer, Maria Krawczyk","Summary of Photon 2001","29 pages, Summary of the Photon 2001 conference held in Ascona,
  submitted to proceedings",,"10.1142/9789812777157_0072",,"hep-ph",,"  This article summarizes the experimental and theoretical results presented
and discussed at the International Conference on the Structure and Interactions
of the Photon, PHOTON 2001, in Ascona.
","[{""version"":""v1"",""created"":""Mon, 25 Mar 2002 13:11:20 GMT""}]","2017-08-23"
"hep-ph/0203232","Tommaso Spadaro","The KLOE Collaboration","Measurement of the branching fraction for the decay KS --> pi e nu","9 pages, 5 Encapsulated Postscript figures. Submitted to Phys. Lett.
  B","Phys.Lett.B535:37-42,2002","10.1016/S0370-2693(02)01733-1","LNF-02/001","hep-ph hep-ex",,"  We present a measurement of the branching ratio BR(KS --> pi e nu) performed
using the KLOE detector. KS mesons are produced in the reaction e+ e- --> phi
--> KS KL at the DAFNE collider. In a sample of about 5 million KS-tagged
events we find 624 +- 30 semileptonic KS decays. Normalizing to the KS --> pi+
pi- count in the same data sample, we obtain BR(KS --> pi e nu) = (6.91 +-
0.37) 10^-4, in agreement with the Standard Model expectation.
","[{""version"":""v1"",""created"":""Mon, 25 Mar 2002 13:48:54 GMT""}]","2012-08-27"
"hep-ph/0203233","Stefan Antusch","Stefan Antusch, Joern Kersten, Manfred Lindner, Michael Ratz","Neutrino Mass Matrix Running for Non-Degenerate See-Saw Scales","12 pages, 9 figures","Phys.Lett. B538 (2002) 87-95","10.1016/S0370-2693(02)01960-3","TUM-HEP-459/02","hep-ph",,"  We consider the running of the neutrino mass matrix in the Standard Model and
the Minimal Supersymmetric Standard Model, extended by heavy singlet Majorana
neutrinos. Unlike previous studies, we do not assume that all of the heavy mass
eigenvalues are degenerate. This leads to various effective theories when the
heavy degrees of freedom are integrated out successively. We calculate the
Renormalization Group Equations that govern the evolution of the neutrino mass
matrix in these effective theories. We show that an appropriate treatment of
the singlet mass scales can yield a substantially different result compared to
integrating out the singlets at a common intermediate scale.
","[{""version"":""v1"",""created"":""Mon, 25 Mar 2002 15:37:59 GMT""}]","2015-06-25"
"hep-th/0203221","Per Kraus","Per Kraus and E. T. Tomboulis","Photons and Gravitons as Goldstone Bosons, and the Cosmological Constant","21 pages, harvmac","Phys.Rev. D66 (2002) 045015","10.1103/PhysRevD.66.045015","UCLA-02-TEP-3","hep-th",,"  We reexamine a scenario in which photons and gravitons arise as Goldstone
bosons associated with the spontaneous breaking of Lorentz invariance. We study
the emergence of Lorentz invariant low energy physics in an effective field
theory framework, with non-Lorentz invariant effects arising from radiative
corrections and higher order interactions. Spontaneous breaking of the Lorentz
group also leads to additional exotic but weakly coupled Goldstone bosons,
whose dispersion relations we compute. The usual cosmological constant problem
is absent in this context: being a Goldstone boson, the graviton can never
develop a potential, and the existence of a flat spacetime solution to the
field equations is guaranteed.
","[{""version"":""v1"",""created"":""Mon, 25 Mar 2002 00:54:17 GMT""}]","2009-11-07"
"hep-th/0203222","Ion Vasile Vancea","M. C. B. Abdalla, A. L. Gadelha, I. V. Vancea (IFT-Unesp)","On the SU(1,1) Thermal Group of Bosonic Strings and D-Branes","misprints corrected","Phys.Rev. D66 (2002) 065005","10.1103/PhysRevD.66.065005","IFT-P.019/2002","hep-th",,"  All possible Bogoliubov operators that generate the thermal transformations
in the Thermo Field Dynamics (TFD) form a SU(1,1) group. We discuss this
contruction in the bosonic string theory. In particular, the transformation of
the Fock space and string operators generated by the most general SU(1,1)
unitary Bogoliubov transformation and the entropy of the corresponding thermal
string are computed. Also, we construct the thermal $D$-brane solution
generated by the SU(1,1) transformation in a constant Kalb-Ramond field and
compute its entropy.
","[{""version"":""v1"",""created"":""Mon, 25 Mar 2002 13:33:05 GMT""},{""version"":""v2"",""created"":""Fri, 14 Jun 2002 14:12:03 GMT""},{""version"":""v3"",""created"":""Sun, 16 Jun 2002 16:14:00 GMT""}]","2009-11-07"
"hep-th/0203224","Harvinder K. Jassal","H. K. Jassal (IUCAA, India)","On brane cosmological solutions","8 pages, Latex2e",,,,"hep-th",,"  This paper presents some cosmological consequences of the five dimensional,
two brane Randall-Sundrum brane scenario. The radius of the compact extra
dimension is taken to be time dependent. It is shown that the cosmology
consistent with the two brane Randall-Sundrum model is a power law expansion of
the universe, with scale factor growing as $t^{1/2}$. The two branes tend to
move towards each other with time. Some comments are made on the contribution
of surface terms in deriving the four dimensional effective action.
","[{""version"":""v1"",""created"":""Mon, 25 Mar 2002 05:31:49 GMT""}]","2007-05-23"
"hep-th/0203227","Aref'eva Irina","I.Ya.Aref'eva, A.A.Giryavets and A.S.Koshelev","NS Ghost Slivers","27 pages, LATEX","Phys.Lett. B536 (2002) 138-146","10.1016/S0370-2693(02)01759-8",,"hep-th",,"  Neveu-Schwarz ghost slivers in pictures zero and minus one are constructed.
In particular, using algebraic methods $\beta$, $\gamma$ ghost sliver in the -1
picture is obtained. The algebraic method consists in solving a projector
equation in an algebra, where the multiplication is defined by a pure 3-string
vertex without any insertions at the string midpoint. We show that this
projector is a sliver in a twisted version of $\beta$, $\gamma$ conformal
theory. We also show that the product of the twisted $b$, $c$ and $\beta$,
$\gamma$ ghost slivers solves an equation that appears after a special
rescaling of super VSFT.
","[{""version"":""v1"",""created"":""Sun, 24 Mar 2002 18:07:48 GMT""}]","2009-11-07"
"hep-th/0203228","Guillermo Raul Zemba","Henry D. Herce, Guillermo R. Zemba","A new class of Matrix Models arising from the W-infinity Algebra","8 pages, 1 figure","Phys.Lett. B537 (2002) 141-146","10.1016/S0370-2693(02)01879-8",,"hep-th cond-mat.mes-hall math-ph math.MP",,"  We present a new class of hermitian one-matrix models originated in the
W-infinity algebra: more precisely, the polynomials defining the W-infinity
generators in their fermionic bilinear form are shown to expand the orthogonal
basis of a class of random hermitian matrix models. The corresponding
potentials are given, and the thermodynamic limit interpreted in terms of a
simple plasma picture. The new matrix models can be successfully applied to the
full bosonization of interesting one-dimensional systems, including all the
perturbative orders in the inverse size of the system. As a simple application,
we present the all-order bosonization of the free fermionic field on the
one-dimensional lattice.
","[{""version"":""v1"",""created"":""Mon, 25 Mar 2002 13:16:01 GMT""}]","2009-11-07"
"math-ph/0203049","Nicholas S. Witte","P.J. Forrester and N.S. Witte","{\bf $\tau$-Function Evaluation of Gap Probabilities in Orthogonal and
  Symplectic Matrix Ensembles}","AMS-Latex",,"10.1088/0951-7715/15/3/325",,"math-ph math.MP",,"  It has recently been emphasized that all known exact evaluations of gap
probabilities for classical unitary matrix ensembles are in fact
$\tau$-functions for certain Painlev\'e systems. We show that all exact
evaluations of gap probabilities for classical orthogonal matrix ensembles,
either known or derivable from the existing literature, are likewise
$\tau$-functions for certain Painlev\'e systems. In the case of symplectic
matrix ensembles all exact evaluations, either known or derivable from the
existing literature, are identified as the mean of two $\tau$-functions, both
of which correspond to Hamiltonians satisfying the same differential equation,
differing only in the boundary condition. Furthermore the product of these two
$\tau$-functions gives the gap probability in the corresponding unitary
symmetry case, while one of those $\tau$-functions is the gap probability in
the corresponding orthogonal symmetry case.
","[{""version"":""v1"",""created"":""Mon, 25 Mar 2002 00:41:10 GMT""}]","2009-11-07"
"math-ph/0203050","Shchepetilov","Alexey V. Shchepetilov (Moscow State University)","Two body problem on two point homogeneous spaces, invariant differential
  operators and the mass center concept","26 pages, LaTeX, no figures, text improved","Journal of Geometry and Physics, V.48 (2003), N.2/3, pp.245-274.","10.1016/S0393-0440(03)00043-3","CHT-02-03","math-ph math.DG math.MP",,"  We consider the two body problem with central interaction on two point
homogeneous spaces from point of view of the invariant differential operators
theory. The representation of the two particle Hamiltonian in terms of the
radial differential operator and invariant operators on the symmetry group is
found. The connection of different mass center definitions for these spaces to
the obtained expression for Hamiltonian operator is studied.
","[{""version"":""v1"",""created"":""Mon, 25 Mar 2002 09:04:59 GMT""},{""version"":""v2"",""created"":""Mon, 17 Jun 2002 09:35:01 GMT""}]","2009-11-07"
"math-ph/0203051","A. D. Alhaidari","A. D. Alhaidari","Deformation of the J-matrix method of scattering","8 pages, 5 figures","Found. Phys. Lett. 16, 579 (2003)","10.1023/B:FOPL.0000012784.06039.6f",,"math-ph math.MP",,"  We construct nonrelativistic J-matrix theory of scattering for a system whose
reference Hamiltonian is enhanced by one-parameter linear deformation to
account for nontrivial physical effects that could be modeled by a singular
ground state coupling.
","[{""version"":""v1"",""created"":""Mon, 25 Mar 2002 12:10:56 GMT""}]","2009-11-07"
"math/0203250","Boris A. Springborn","Alexander I. Bobenko and Boris A. Springborn","Variational principles for circle patterns and Koebe's theorem","33 pages, 12 figures, Appendix. Revised version. Appendix on cellular
  surfaces removed, references added and removed, typos corrected, a few minor
  changes","Trans. Amer. Math. Soc. 356 (2004), 659-689.",,,"math.GT math.CV math.MG",,"  We prove existence and uniqueness results for patterns of circles with
prescribed intersection angles in constant curvature surfaces. Our method is
based on two new functionals--one for the Euclidean and one for the hyperbolic
case. We show how Colin de Verdi`ere's, Br""agger's and Rivin's functionals can
be derived from ours.
","[{""version"":""v1"",""created"":""Mon, 25 Mar 2002 15:25:46 GMT""},{""version"":""v2"",""created"":""Mon, 3 Jun 2002 12:36:27 GMT""}]","2007-05-23"
"math/0203253","Diarmuid John Crowley","Diarmuid J. Crowley","The classification of highly connected manifolds in dimensions 7 and 15","PhD Thesis, Indiana University 2001, 117 pages",,,,"math.GT math.AT",,"  Let P be a closed smooth (4j-2)-connected 8j-manifold. We complete Wilkens'
classification of the manifolds P for j = 1,2 and give an alternative proof to
Wall's classification of the manifolds for j > 2. The Hopf-invariant-one
dimensions (j=1,2) are characteristed by the fact that the quadratic linking
functions which classify may be inhomogeneous. Hence we also extend the
classification of (homogeneous) quadratic linking forms on finite abelian
groups (due to Nikulin) to the inhomogeneous case.
","[{""version"":""v1"",""created"":""Sun, 24 Mar 2002 17:51:28 GMT""}]","2007-05-23"
"math/0203254","Duong Phong","D.H. Phong (Columbia University), Jacob Sturm (Rutgers University)","Stability, energy functionals, and K\""ahler-Einstein metrics","PlainTEX file, 28 pages",,,,"math.DG",,"  An explicit seminorm $||f||_{#}$ on the vector space of Chow vectors of
projective varieties is introduced, and shown to be a generalized Mabuchi
energy functional for Chow varieties. The singularities of the Chow varieties
give rise to currents supported on their singular loci, while the regular parts
are shown to reproduce the Mabuchi energy functional of the corresponding
projective variety. Thus the boundedness from below of the Mabuchi functional,
and hence the existence of K\""ahler-Einstein metrics, is related to the
behavior of the current $[Y_s]$ and the seminorm $||f||_{#}$ along the orbits
of $SL(N+1,{\bf C})$.
","[{""version"":""v1"",""created"":""Sun, 24 Mar 2002 18:55:04 GMT""}]","2007-05-23"
"math/0203255","Ostrik Viktor","Viktor Ostrik","Fusion categories of rank 2","6 pages, main text by V.Ostrik with an appendix by P.Etingof",,,,"math.QA math.CT",,"  We classify semisimple rigid monoidal categories with two isomorphism classes
of simple objects over the field of complex numbers. In the appendix written by
P.Etingof it is proved that the number of semisimple Hopf algebras with a given
finite number of irreducible representations is finite.
","[{""version"":""v1"",""created"":""Sun, 24 Mar 2002 20:39:02 GMT""}]","2007-05-23"
"math/0203256","Thomas Kerler","Thomas Kerler","p-Modular TQFT's, Milnor torsion and the Casson-Lescop invariant","Published by Geometry and Topology Monographs at
  http://www.maths.warwick.ac.uk/gt/GTMon4/paper9.abs.html","Geom.Topol.Monographs 4 (2002) 119-141",,,"math.GT math.QA math.RT",,"  We derive formulae which lend themselves to TQFT interpretations of the
Milnor torsion, the Lescop invariant, the Casson invariant, and the
Casson-Morita cocyle of a 3-manifold, and, furthermore, relate them to the
Reshetikhin-Turaev theory.
","[{""version"":""v1"",""created"":""Sun, 24 Mar 2002 23:37:32 GMT""},{""version"":""v2"",""created"":""Mon, 15 Apr 2002 01:27:24 GMT""},{""version"":""v3"",""created"":""Mon, 4 Nov 2002 17:32:21 GMT""}]","2007-05-23"
"math/0203257","Manuel Pedreira Perez","Luis Fuentes Garcia, Manuel Pedreira Perez","Projective normality of special scrolls","Latex2.09; 9 pages",,,,"math.AG",,"  We study the projective normality of a linearly normal special scroll R of
degree d and speciality i over a smooth curve of genus g. If d>=4g-2i+1, we
prove that the projective normality of the scroll is equivalent to the
projective normality of its directrix curve of minimum degree.
","[{""version"":""v1"",""created"":""Mon, 25 Mar 2002 11:18:02 GMT""}]","2007-05-23"
"math/0203258","Geometry and Topology Journal","Francois Dahmani","Combination of convergence groups","Published in Geometry and Topology at
  http://www.maths.warwick.ac.uk/gt/GTVol7/paper27.abs.html","Geom. Topol. 7 (2003) 933-963","10.2140/gt.2003.7.933",,"math.GR",,"  We state and prove a combination theorem for relatively hyperbolic groups
seen as geometrically finite convergence groups. For that, we explain how to
contruct a boundary for a group that is an acylindrical amalgamation of
relatively hyperbolic groups over a fully quasi-convex subgroup. We apply our
result to Sela's theory on limit groups and prove their relative hyperbolicity.
We also get a proof of the Howson property for limit groups.
","[{""version"":""v1"",""created"":""Mon, 25 Mar 2002 12:29:50 GMT""},{""version"":""v2"",""created"":""Wed, 17 Apr 2002 14:19:47 GMT""},{""version"":""v3"",""created"":""Fri, 12 Dec 2003 15:45:46 GMT""}]","2014-11-11"
"math/0203259","Guillaume Pagot","Guillaume Pagot","$F_p$-espaces vectoriels de formes diff\'erentielles logarithmiques sur
  la droite projective","36 pages, to appear in journal of Number Theory",,,,"math.NT math.AG",,"  Let k be an algebraically closed field of characteristic p >0. Let $m \in
\N$, (m,p)=1. We study $\fp$-vector spaces of logarithmic differential forms on
the projective line such that each non zero form has a unique zero at $\infty$
of given order m-1. We discuss the existence of such vectors spaces according
to the value of m. We give applications to the lifting to characteristic 0 of
$(\Z /p\Z)^n$ actions as k-automorphisms of $k[[t]]$.
","[{""version"":""v1"",""created"":""Mon, 25 Mar 2002 13:59:26 GMT""}]","2007-05-23"
"math/0203260","J. M. Landsberg","J.M. Landsberg, L. Manivel","Representation theory and projective geometry","37 pages with pictures",,,,"math.AG math.DG math.RT",,"  We give an elementary introduction to our papers relating the geometry of
rational homogeneous varieties to representation theory. We also describe
related work and recent progress.
","[{""version"":""v1"",""created"":""Mon, 25 Mar 2002 14:56:52 GMT""},{""version"":""v2"",""created"":""Tue, 2 Jul 2002 16:19:37 GMT""}]","2007-05-23"
"nlin/0203050","Junichi Yamamoto","Jun-ichi Yamamoto","M\""obius Symmetry of Discrete Time Soliton Equations","21 pages, 4 figure, epsfig.sty",,"10.1143/JPSJ.72.253",,"nlin.SI",,"  We have proposed, in our previous papers, a method to characterize integrable
discrete soliton equations. In this paper we generalize the method further and
obtain a $q$-difference Toda equation, from which we can derive various
$q$-difference soliton equations by reductions.
","[{""version"":""v1"",""created"":""Mon, 25 Mar 2002 08:42:30 GMT""}]","2009-11-07"
"nucl-ex/0203017","Durand","A. Van Lauwe, D. Durand et al (INDRA Collaboration)","Multifragmentation in central collisions at intermediate energies: a
  fast process?","Proceedings of the LX International Winter Meeting on Nuclear
  Physics, Bormio, Italy (2002)",,,,"nucl-ex",,"  The kinematical characteristics of fragments and light particles observed in
central highly fragmented nuclear collisions at intermediate energies are
compared with the results of a model assuming that the initial momentum
distribution of the nucleons inside the two partners of the reaction has no
time to relax before the disassembly of the system. The rather good agreement
between the results of the model and the experimental data suggests that
multifragmentation is a fast process with a strong memory of the entrance
channel.
","[{""version"":""v1"",""created"":""Mon, 25 Mar 2002 13:46:31 GMT""}]","2007-05-23"
"nucl-th/0203068","Johann Haidenbauer","M. Betz, E.A. Veit, J. Haidenbauer","Role of Delta exchange for proton-antiproton annihilation into two-pion
  and three-pion channels","27 pages, 9 figures, accepted for publication in Eur. Phys. J. A","Eur.Phys.J. A14 (2002) 113-124",,,"nucl-th",,"  Proton-antiproton annihilation into two pions and three pions is studied in a
baryon-exchange model. Annihilation diagrams involving nucleon as well as
Delta-resonance exchanges are included consistently in the two- and three-pion
channels. Effects from the initial-state interaction are fully taken into
account. A comparison of the influence of the Delta exchange on the considered
annihilation channels is made and reveals that its importance for three-pion
annihilation is strongly reduced as compared to two-pion annihilation. It is
found that annihilation into three uncorrelated pions can yield up to 10 % of
the total experimentally observed three-pion annihilation cross section.
","[{""version"":""v1"",""created"":""Mon, 25 Mar 2002 10:30:39 GMT""}]","2007-05-23"
"physics/0203072","Beisbart Claus","Claus Beisbart, Robert Dahlke, Klaus Mecke, and Herbert Wagner","Vector- and tensor-valued descriptors for spatial patterns","24 pages, to appear in K.Mecke and D.Stoyan, Morphology of Condensed
  Matter - Physics and Geometry of Spatially Complex Systems. Proceedings of
  the Second Wuppertal conference on Spatial Statistics and Statistical
  Physics, Lecture Notes in Physics, Springer",,,,"physics.data-an astro-ph cond-mat.stat-mech math.GM",,"  Higher-rank Minkowski valuations are efficient means for describing the
geometry and connectivity of spatial patterns. We show how to extend the
framework of the scalar Minkowski valuations to vector- and tensor-valued
measures. The properties of these extensions are described in detail. We show
the versatility of these measures by using simple toy models as well as real
data. Our applications cover the morphology of galaxy clusters, the structure
of spiral galaxies, and the geometry of molecules. Furthermore, we consider a
physical ansatz closely related to higher-rank Minkowski valuations, the
Rosenfeld functional known from density functional theory.
","[{""version"":""v1"",""created"":""Mon, 25 Mar 2002 13:32:18 GMT""}]","2007-05-23"
"physics/0203073","Davide Marenduzzo","J. R. Banavar, A. Flammini, D. Marenduzzo, A. Maritan, A. Trovato","Geometry of compact tubes and protein structures","15 pages, 3 eps figures",,,,"physics.bio-ph cond-mat.soft cond-mat.stat-mech q-bio",,"  Proteins form a very important class of polymers. In spite of major advances
in the understanding of polymer science, the protein problem has remained
largely unsolved. Here, we show that a polymer chain viewed as a tube not only
captures the well-known characteristics of polymers and their phases but also
provides a natural explanation for many of the key features of protein
behavior. There are two natural length scales associated with a tube subject to
compaction -- the thickness of the tube and the range of the attractive
interactions. For short tubes, when these length scales become comparable, one
obtains marginally compact structures, which are relatively few in number
compared to those in the generic compact phase of polymers. The motifs
associated with the structures in this new phase include helices, hairpins and
sheets. We suggest that Nature has selected this phase for the structures of
proteins because of its many advantages including the few candidate strucures,
the ability to squeeze the water out from the hydrophobic core and the
flexibility and versatility associated with being marginally compact. Our
results provide a framework for understanding the common features of all
proteins.
","[{""version"":""v1"",""created"":""Mon, 25 Mar 2002 14:09:07 GMT""}]","2007-05-23"
"quant-ph/0203121","Eleonora Alfinito","P. Tempesta, E. Alfinito, R.A. Leo and G. Soliani","Quantum models related to fouled Hamiltonians of the harmonic oscillator","24 pages, no figures, accepted for publication on JMP","J.Math.Phys. 43 (2002) 3538-3553","10.1063/1.1479300",,"quant-ph hep-th",,"  We study a pair of canonoid (fouled) Hamiltonians of the harmonic oscillator
which provide, at the classical level, the same equation of motion as the
conventional Hamiltonian. These Hamiltonians, say $K_{1}$ and $K_{2}$, result
to be explicitly time-dependent and can be expressed as a formal rotation of
two cubic polynomial functions, $H_{1}$ and $H_{2}$, of the canonical variables
(q,p).
  We investigate the role of these fouled Hamiltonians at the quantum level.
Adopting a canonical quantization procedure, we construct some quantum models
and analyze the related eigenvalue equations. One of these models is described
by a Hamiltonian admitting infinite self-adjoint extensions, each of them has a
discrete spectrum on the real line. A self-adjoint extension is fixed by
choosing the spectral parameter $\epsilon$ of the associated eigenvalue
equation equal to zero. The spectral problem is discussed in the context of
three different representations. For $\epsilon =0$, the eigenvalue equation is
exactly solved in all these representations, in which square-integrable
solutions are explicity found. A set of constants of motion corresponding to
these quantum models is also obtained. Furthermore, the algebraic structure
underlying the quantum models is explored. This turns out to be a nonlinear
(quadratic) algebra, which could be applied for the determination of
approximate solutions to the eigenvalue equations.
","[{""version"":""v1"",""created"":""Mon, 25 Mar 2002 08:30:24 GMT""}]","2015-06-26"
