"astro-ph/0203424","Hideki Asada","Hideki Asada","Perturbative approach to the astrometric microlensing due to an
  extrasolar planet","11 pages (LaTeX); accepted for publication in Astrophys. J","Astrophys.J. 573 (2002) 825-828","10.1086/340838",,"astro-ph",,"  We have developed a perturbative approach to microlensing due to an
extrasolar planetary lens. In particular, we have found analytic formulae for
triple images. We have used the formulae to investigate the astrometric
microlensing due to the extrasolar planetary lens, in expectation of dramatic
improvements in the precision of the future astrometric measurements. For a
weak lensing case, we have shown how the maximum angular size and the typical
time scale of the anomalous shift of the lightcentroid are dependent on the
mass ratio and angular separation between the star and the planet.
","[{""version"":""v1"",""created"":""Mon, 25 Mar 2002 03:12:26 GMT""}]","2009-11-07"
"astro-ph/0203425","Ken Ohsuga","Ken Ohsuga, Shin Mineshige, Masao Mori, Masayuki Umemura","Does the Slim-Disk Model Correctly Consider Photon-Trapping Effects?","10 pages, 7 figures, accepted for publication in ApJ",,"10.1086/340798",,"astro-ph",,"  We investigate the photon-trapping effects in the super-critical black hole
accretion flows by solving radiation transfer as well as the energy equations
of radiation and gas. It is found that the slim-disk model generally
overestimates the luminosity of the disk at around the Eddington luminosity
(L_E) and is not accurate in describing the effective temperature profile,
since it neglects time delay between energy generation at deeper inside the
disk and energy release at the surface. Especially, the photon-trapping effects
are appreciable even below L ~ L_E, while they appear above ~ 3L_E according to
the slim disk. Through the photon-trapping effects, the luminosity is reduced
and the effective temperature profile becomes flatter than r^{-3/4} as in the
standard disk. In the case that the viscous heating is effective only around
the equatorial plane, the luminosity is kept around the Eddington luminosity
even at very large mass accretion rate, Mdot>>L_E/c^2. The effective
temperature profile is almost flat, and the maximum temperature decreases in
accordance with rise in the mass accretion rate. Thus, the most luminous radius
shifts to the outer region when Mdot/(L_E/c^2) >> 10^2. In the case that the
energy is dissipated equally at any heights, the resultant luminosity is
somewhat larger than in the former case, but the energy-conversion efficiency
still decreases with increase of the mass accretion rate, as well. The most
luminous radius stays around the inner edge of the disk in the latter case.
Hence, the effective temperature profile is sensitive to the vertical
distribution of energy production rates, so is the spectral shape. Future
observations of high L/L_E objects will be able to test our model.
","[{""version"":""v1"",""created"":""Mon, 25 Mar 2002 07:41:36 GMT""}]","2009-11-07"
"astro-ph/0203426","Jozef Sima","Miroslav Sukenik and Jozef Sima","Neutron stars properties viewed by the ENU model","5 pages, LaTeX, submitted to Spacetime & Substance",,,"SS-02-01","astro-ph",,"  Up-to-now known characteristics of radio pulsars, such as mass limits,
magnetic field intensity, rotational period, and maximum radiation are mainly
of empirical nature. Applying the Expansive Nondecelerative Universe model
(ENU) into the issue allows to offer a deeper theoretical explanation of the
known parameters and to estimate their limits. Using the ENU approach the
following values related to synchrotron radiation emitting radio pulsars were
estimated: the lower and upper limits of magnetic field intensity are B(min) =
8.6 x 10^6 T, and B(max) = 9.4 x 10^8 T, respectively, the maximum rotation
period reaches 3.9 s, the maximum radiation output of a pulsar is P(max) = 5.6
x 10^29 W (all the values relate to radio pulsars with 1.4 solar masses and
radius 1.0 x 10^4 m and are mass and radius dependent). These values are in
accordance with the experimental observations.
","[{""version"":""v1"",""created"":""Mon, 25 Mar 2002 08:40:09 GMT""}]","2007-05-23"
"astro-ph/0203427","Luca Lamagna","L. Lamagna, M. De Petris, F. Melchiorri, E. Battistelli, M. De Grazia,
  G. Luzzi, A. Orlando, G. Savini","MAD-4-MITO, a Multi Array of Detectors for ground-based mm/submm SZ
  observations","5 pages, 3 figures, to be published in th eProceedings of the 2K1BC
  Workshop, July 9-13, 2001 - Breuil-Cervinia","AIP Conf.Proc.616:92-96,2002","10.1063/1.1475609",,"astro-ph",,"  The last few years have seen a large development of mm technology and
ultra-sensitive detectors devoted to microwave astronomy and astrophysics. The
possibility to deal with large numbers of these detectors assembled into
multi--pixel imaging systems has greatly improved the performance of microwave
observations, even from ground--based stations, especially combining the power
of multi--band detectors with their new imaging capabilities. Hereafter, we
will present the development of a multi--pixel solution devoted to
Sunyaev--Zel'dovich observations from ground--based telescopes, that is going
to be operated from the Millimetre and Infrared Testagrigia Observatory.
","[{""version"":""v1"",""created"":""Mon, 25 Mar 2002 08:47:41 GMT""}]","2010-12-13"
"astro-ph/0203428","Gabriele Breuer","B. Vollmer (1), W.J. Duschl (2) ((1) MPI fuer Radioastronomie, Bonn,
  Germany, (2) ITA, Univ. Heidelberg, Germany)","The dynamics of the Circumnuclear Disk and its environment in the
  Galactic centre","14 pages with 22 figures. Accepted for publication in A&A",,"10.1051/0004-6361:20020422",,"astro-ph",,"  We address the question of the dynamics in the inner 50 pc of the Galactic
Centre. In a first step we investigate the cloud-cloud collision rate in the
Circumnuclear Disk (CND) with the help of a three dimensional N-body code using
gas particles that can have inelastic collisions. The CND might be a longer
lived structure than previously assumed. The whole disk-like structure of the
CND can thus survive for several million years. A realistic simulation of the
CND shows the observed disk height structure. In a second step the environment
of the CND is taken into account. Retrograde and prograde encounters of a cloud
of several 10^4 M_solar falling onto an already existing nuclear disk using
different energy loss rates per collision are simulated. The influence of the
energy loss rate per collision on the evolution of the mass accretion and cloud
collision rates is strongest for a prograde encounter. A composite data cube of
two different snapshots of a prograde encounter together with the CND shows
striking similarity with the observed Sgr A cloud complex. The current
appearance of the Galactic Centre environment can thus be explained by at least
two dynamically distinct features together with the CND. The current mass
accretion rate within the CND ranges between 10^-3 and 10^-4 M_solar yr^-1. It
can rise up to several 10^-2 M_solar yr^-1 during massive accretion events.
","[{""version"":""v1"",""created"":""Mon, 25 Mar 2002 09:50:07 GMT""}]","2009-11-07"
"astro-ph/0203429","Mordehai Milgrom","Mordehai Milgrom (Weizmann Institute)","MOND mass-to-light ratios for galaxy groups","7 pages, Astrophys. J. Lett., in press","Astrophys.J.577:L75,2002","10.1086/344253",,"astro-ph",,"  I estimate MOND M/L values for nine galaxy groups that were recently studied
by Tully et al.. Instead of the large M/L values that they find with Newtonian
dynamics (up to 1200 solar units) the MOND estimates cluster around 1 solar
unit. Tully et al. find a systematic and significant difference between the M/L
values of groups that do not contain luminous galaxies and those that do:
Dwarfs-only groups have larger M/L values (by a factor of about 5). The MOND
M/L values do not show this trend; the Newtonian disparity is traced back to
the dwarfs-only groups having systematically smaller intrinsic accelerations
(similar sizes, but rather smaller velocity dispersions).
","[{""version"":""v1"",""created"":""Mon, 25 Mar 2002 11:02:00 GMT""},{""version"":""v2"",""created"":""Tue, 27 Aug 2002 14:01:02 GMT""}]","2011-03-28"
"astro-ph/0203430","Elina Sihvola","Massimo Giovannini, Elina Keihanen, and Hannu Kurki-Suonio","Big Bang nucleosynthesis, matter-antimatter regions, extra relativistic
  species, and relic gravitational waves","10 pages, PRD version","Phys.Rev. D66 (2002) 043504","10.1103/PhysRevD.66.043504",,"astro-ph gr-qc hep-ph",,"  Provided that matter-antimatter domains are present at the onset of big bang
nucleosynthesis (BBN), the number of allowed additional relativistic species
increases, compared to the standard scenario when matter-antimatter domains are
absent. The extra relativistic species may take the form of massless fermions
or even massless bosons, like relic gravitons. The number of additional degrees
of freedom compatible with BBN depends, in this framework, upon the typical
scale of the domains and the antimatter fraction. Since the presence of
matter-antimatter domains allows a reduction of the neutron to proton ratio
prior to the formation of 4He, large amounts of radiation-like energy density
are allowed. Our results are compared with other constraints on the number of
supplementary relativistic degrees of freedom and with different nonstandard
BBN scenarios where the reduction of the neutron to proton ratio occurs via a
different physical mechanism. The implications of our considerations for the
upper limits on stochastic gravitational waves backgrounds of cosmological
origin are outlined.
","[{""version"":""v1"",""created"":""Mon, 25 Mar 2002 14:17:38 GMT""},{""version"":""v2"",""created"":""Thu, 13 Jun 2002 15:14:07 GMT""},{""version"":""v3"",""created"":""Fri, 14 Jun 2002 12:13:30 GMT""}]","2009-11-07"
"astro-ph/0203431","Jan-Uwe Ness","J.-U. Ness, J.H.M.M. Schmitt, V. Burwitz, R. Mewe, P. Predehl","Chandra LETGS Observation of the Active Binary Algol","16 pages, Latex2e, 23 figures",,"10.1051/0004-6361:20020445",,"astro-ph",,"  A high-resolution spectrum obtained with the low-energy transmission grating
onboard the Chandra observatory is presented and analyzed. Our analysis
indicates very hot plasma with temperatures up to T=15-20MK from the continuum
and from ratios of hydrogen-like and helium-like ions of Si, Mg, and Ne. In
addition lower temperature material is present since OVII and NVI are detected.
Two methods for density diagnostics are applied. The He-like triplets from NVII
to SiXIII are used and densities around 10^11 cm^-3 are found for the low
temperature ions. Taking the UV radiation field from the B star companion into
account, we find that the low-Z ions can be affected by the radiation field
quite strongly, such that densities of 3 10^10 cm^-3 are also possible, but
only assuming that the emitting plasma is immersed in the radiation field. For
the high temperature He-like ions only low density limits are found. Using
ratios of FeXXI lines produced at similar temperatures are sensitive to lower
densities but again yield only low density limits. We thus conclude that the
hot plasma has densities below 10^12 cm^-3. Assuming a constant pressure corona
we show that the characteristic loop sizes must be small compared to the
stellar radius and that filling factors below 0.1 are unlikely.
","[{""version"":""v1"",""created"":""Mon, 25 Mar 2002 14:29:35 GMT""}]","2009-11-07"
"astro-ph/0203432","Titarchuk Lev","Lev Titarchuk (GMU/NRL), and Nickolai Shaposhnikov (GMU)","Three Type I X-ray bursts from Cyg X-2: Application of Analytical Models
  for Neutron Star Mass and Radius Determination","9 pages, 2 figures. To be published in the Astrophysical Journal
  Letters",,"10.1086/340834",,"astro-ph",,"  We study the spectral and temporal properties of three Type I X-ray bursts
observed from Cyg X-2 with the Rossi X-ray Timing Explorer. Despite the short
time durations (~ 5 sec) these bursts show radial expansion of order of several
neutron star (NS) radii. We apply the analytical models of spectral formation
during the expansion and contraction stages to derive physical conditions for
the matter in the burning zone close to the surface of the NS as well as the NS
mass-radius relation. Our results, combined with statistical errors, show that
the central object is a compact star with mass ~1.4 solar masses and radius ~9
km. Our results favor the softer equation of state for neutron star matter.
","[{""version"":""v1"",""created"":""Mon, 25 Mar 2002 15:30:28 GMT""}]","2009-11-07"
"astro-ph/0203433","Marek Sarna","Ene Ergma (Physics Department, Tartu University) and Marek J. Sarna
  (N. Copernicus Astronomical Center)","Eclipsing binary millisecond pulsar PSR J1740-5340 -- evolutionary
  considerations and observational test","5 pages, 3 figures, uses aa.cls and graphicx, abstract, submitted to
  A&A at March 20","Astron.Astrophys. 399 (2003) 237-242","10.1051/0004-6361:20021689",,"astro-ph",,"  We perform evolutionary calculations for a binary system with initial
parameters: $M_{sg,i}$= 1$M\odot$ and $M_{ns,i}$= 1.4 $M\odot$ and
$P_{orb,i}(RLOF)$= 1.27 d to produce observed binary parameters for the PSR
J1740--5340. Our calculations support model proposed by D'Amico et al. (2001)
in which this binary may be progenitor of a millisecond pulsar + helium white
dwarf system. We propose observational test to verify this hypothesis. If the
optical companion lack of carbon lines in its spectrum shows but the oxygen and
nitrogen lines are present then our model correctly describes the evolutionary
stage of PSR J1740--5340.
","[{""version"":""v1"",""created"":""Mon, 25 Mar 2002 15:23:33 GMT""}]","2009-11-07"
"astro-ph/0203434","Juergen Kerp","Juergen Kerp (1), Fabian Walter (2), Elias Brinks (3)((1)
  Radioastronomisches Institut Universitaet Bonn, (2) Astronomy Department
  Caltech, (3) Departamento de Astronomia Guanajuato)","ROSAT X-ray observations of the dwarf galaxy Holmberg II","14 pages, 6 figures, accepted for publication by Astrophysical
  Journal",,"10.1086/340060",,"astro-ph",,"  We present a study of the irregular dwarf galaxy Holmberg II based on ROSAT
PSPC observations (total exposure time: 22 ksec). Holmberg II is a nearby (3.2
Mpc), well-studied dwarf irregular galaxy. It is famous for its interstellar
medium which is dominated by expanding structures such as HI holes and shells.
We search for X-ray emission from point sources as well as for diffuse
emission, down to the detection limit of the ROSAT data. Using X-ray hardness
ratio diagrams we differentiate between thermal plasma and power-law X-ray
spectra which helps to determine the nature of the individual sources.
Correlating the X-ray data with complementary observations ranging from the
far-ultraviolet to the radio regime we increase the probability of correctly
identifying sources belonging to Holmberg II. We did not detect soft X-ray
emission originating from hot gas within supergiant HI shells above our
luminosity sensitivity limit of (L_limit(0.1 - 2.1 keV) ~ 10^{37}erg/s). This
finding can probably be attributed to blow-out in the case of the largest holes
and insufficient sensitivity (due to strong photoelectric absorption) in case
of the smaller HI holes. However we find faint X-ray sources well beyond the
stellar body but within the HI distribution of Holmberg II, which suggests the
presence of X-ray binaries. This indicates that star formation has taken place
across the entire gaseous disk of Holmberg II in the past, some of which may
have created the structures seen in the ISM at large galactocentric radii.
","[{""version"":""v1"",""created"":""Mon, 25 Mar 2002 15:48:46 GMT""}]","2009-11-07"
"cond-mat/0203484","Andrij Rovenchak","A. A. Rovenchak","Effective Mass of Atom and Excitation Spectrum in Liquid Helium-4 at T=0
  K","5 pages, 1 figure","Fizika Nizkikh Temperatur 29, No. 2, 145-148 (2003); Low Temp.
  Phys. 29, 105-107 (2003)","10.1063/1.1542407",,"cond-mat.stat-mech",,"  A self-consistent approach is applied for the calculations within the
two-time temperature Green functions formalism in the random phase
approximation. The effective mass of He4 atom is computed as $m^*=1.58 m$. The
excitation spectrum is found to be in a satisfactory agreement with the
experiment. The sound velocity is calculated as 230 m/s. The temperature of the
Bose-condensation with the effective mass taken into consideration is estimated
as 1.99 K.
","[{""version"":""v1"",""created"":""Mon, 25 Mar 2002 08:51:24 GMT""}]","2009-11-07"
"cond-mat/0203493","Matthias Mayr","Matthias Mayr, Gonzalo Alvarez, and Elbio Dagotto","Global versus Local Ferromagnetism in a Model for Diluted Magnetic
  Semiconductors Studied with Monte Carlo Techniques","4 pages, 4 figures",,"10.1103/PhysRevB.65.241202",,"cond-mat.dis-nn",,"  A model recently introduced for diluted magnetic semiconductors by Berciu and
Bhatt (PRL 87, 107203 (2001)) is studied with a Monte Carlo technique, and the
results are compared to Hartree-Fock calculations. For doping rates close to
the experimentally observed metal-insulator transition, a picture dominated by
ferromagnetic droplets formed below a T* scale emerges. The moments of these
droplets align as the temperature is lowered below a critical value Tc<T*. Our
Monte Carlo investigations provide critical temperatures considerably smaller
than Hartree-Fock predictions. Disorder does not seem to enhance ferromagnetism
substantially. The inhomogeneous droplet state should be strongly susceptible
to changes in doping and external fields.
","[{""version"":""v1"",""created"":""Sun, 24 Mar 2002 16:35:23 GMT""},{""version"":""v2"",""created"":""Sun, 28 Apr 2002 16:59:17 GMT""}]","2009-11-07"
"cond-mat/0203494","Daniel Wojcik","Daniel K. Wojcik, J. R. Dorfman","Quantum Multibaker Maps: Extreme Quantum Regime","17 pages, referee's and editor's comments addressed","Phys. Rev. E 66, 036110 (2002)","10.1103/PhysRevE.66.036110",,"cond-mat.stat-mech nlin.CD quant-ph",,"  We introduce a family of models for quantum mechanical, one-dimensional
random walks, called quantum multibaker maps (QMB). These are Weyl
quantizations of the classical multibaker models previously considered by
Gaspard, Tasaki and others. Depending on the properties of the phases
parametrizing the quantization, we consider only two classes of the QMB maps:
uniform and random. Uniform QMB maps are characterized by phases which are the
same in every unit cell of the multibaker chain. Random QMB maps have phases
that vary randomly from unit cell to unit cell. The eigenstates in the former
case are extended while in the latter they are localized. In the uniform case
and for large $\hbar$, analytic solutions can be obtained for the time
dependent quantum states for periodic chains and for open chains with absorbing
boundary conditions. Steady state solutions and the properties of the
relaxation to a steady state for a uniform QMB chain in contact with
``particle'' reservoirs can also be described analytically. The analytical
results are consistent with, and confirmed by, results obtained from numerical
methods. We report here results for the deep quantum regime (large $\hbar$) of
the uniform QMB, as well as some results for the random QMB. We leave the
moderate and small $\hbar$ results as well as further consideration of the
other versions of the QMB for further publications.
","[{""version"":""v1"",""created"":""Sun, 24 Mar 2002 16:35:50 GMT""},{""version"":""v2"",""created"":""Thu, 27 Jun 2002 13:21:12 GMT""}]","2009-11-07"
"cond-mat/0203495","Jin-Cheng Zheng","Jin-Cheng Zheng, Hui-Qiong Wang, A. T. S. Wee and C. H. A. Huan","Trends in bonding configuration at SiC/III-V semiconductor interfaces","6 pages, 3 figures","Applied Physics Letters, Vol. 79, No.11, 1643-1645, (2001)","10.1063/1.1402162",,"cond-mat.mtrl-sci",,"  The structural and electronic properties of interfaces between beta-SiC and
III-V semiconductors are studied by first-principles calculations. Favorable
bonding configurations are found to form between Si-V and C-III (model A) for
BN, AlN, AlP, AlAs, GaN, GaP, GaAs, InN, InP, InAs and InSb, and Si-III and C-V
(model B) for BP, BAs, BSb, AlSb and GaSb. The relationship between formation
energy difference and lattice constant difference as well as charge
distribution for these two models is found. The origin of bonding
configurations can be explained in terms of the ionicity of III-V
semiconductors, electrostatic effect, charge distribution and band-structure
component.
","[{""version"":""v1"",""created"":""Sun, 24 Mar 2002 22:30:39 GMT""},{""version"":""v2"",""created"":""Tue, 26 Mar 2002 13:44:25 GMT""}]","2009-11-07"
"cond-mat/0203496","Mark Newman","R. M. Ziff and M. E. J. Newman","Convergence of threshold estimates for two-dimensional percolation","11 pages, 4 figures","Phys. Rev. E 66, 016129 (2002)","10.1103/PhysRevE.66.016129",,"cond-mat.stat-mech",,"  Using a recently introduced algorithm for simulating percolation in
microcanonical (fixed-occupancy) samples, we study the convergence with
increasing system size of a number of estimates for the percolation threshold
for an open system with a square boundary, specifically for site percolation on
a square lattice. We show that the convergence of the so-called
""average-probability"" estimate is described by a non-trivial
correction-to-scaling exponent as predicted previously, and measure the value
of this exponent to be 0.90(2). For the ""median"" and ""cell-to-cell"" estimates
of the percolation threshold we verify that convergence does not depend on this
exponent, having instead a slightly faster convergence with a trivial analytic
leading exponent.
","[{""version"":""v1"",""created"":""Sun, 24 Mar 2002 23:05:27 GMT""}]","2009-11-07"
"cond-mat/0203497","Hyuntak Kim","Hyun-Tak Kim","Analyzing Intrinsic Superconducting Gap by Means of Measurement of
  Bi-2212 Superconductors","4 pages, 2 figures","J. Phys. Soc. Jpn. Vol. 71 No.9 (2002) 2106","10.1143/JPSJ.71.2106",,"cond-mat.str-el cond-mat.supr-con",,"  For the mechanism of high-Tc superconductivity in inhomogeneous Bi-2212
superconductors, we demonstrate the intrinsic superconducting gap,GAP_i, and
pairing symmetry by using a developed GAP=GAP_i/rho, where GAP is the observed
energy gap and 0<rho<=1 is band filling. When rho=1, GAP=GAP_i<=10 meV,
measured at a node, is intrinsic. When 0<rho<1, GAP implies an averaging of
GAP_i over the measurement region, which is the effect of measurement. From
analysis's of conductance data, b=2GAP_i/k_BT_c is less than 4 when rho=1 and
the density of state indicates s-wave symmetry. The superconducting gap
anisotropy is attributed to the inhomogeneity of the metal phase and the
insulating d-wave phase in the measurement region.
","[{""version"":""v1"",""created"":""Sun, 24 Mar 2002 23:40:23 GMT""},{""version"":""v2"",""created"":""Tue, 26 Mar 2002 23:45:13 GMT""},{""version"":""v3"",""created"":""Wed, 28 Aug 2002 04:30:13 GMT""},{""version"":""v4"",""created"":""Thu, 19 Sep 2002 07:00:44 GMT""}]","2009-11-07"
"cond-mat/0203498",,"S. Park, K. Moon (Yonsei University), C. Ahn (Ewha Womans University),
  J. Yeo (Konkuk University), C. Rim (Chonbuk National University), B.H. Lee
  (Sogang University)","Reentrant Melting of Soliton Lattice Phase in Bilayer Quantum Hall
  System","11 pages, 2 figures",,"10.1103/PhysRevB.66.153318","R01-1999-00018","cond-mat.mes-hall",,"  At large parallel magnetic field $B_\parallel$, the ground state of bilayer
quantum Hall system forms uniform soliton lattice phase. The soliton lattice
will melt due to the proliferation of unbound dislocations at certain finite
temperature leading to the Kosterlitz-Thouless (KT) melting. We calculate the
KT phase boundary by numerically solving the newly developed set of Bethe
ansatz equations, which fully take into account the thermal fluctuations of
soliton walls. We predict that within certain ranges of $B_\parallel$, the
soliton lattice will melt at $T_{\rm KT}$. Interestingly enough, as temperature
decreases, it melts at certain temperature lower than $T_{\rm KT}$ exhibiting
the reentrant behaviour of the soliton liquid phase.
","[{""version"":""v1"",""created"":""Mon, 25 Mar 2002 07:56:07 GMT""},{""version"":""v2"",""created"":""Tue, 26 Mar 2002 04:21:55 GMT""}]","2009-11-07"
"cond-mat/0203499","Andres Santos","Andres Santos","Comments on nonlinear viscosity and Grad's moment method","4 pages, 1 figure; missing lines in figure corrected; accepted for
  publication in Phys. Rev. E","Phys. Rev. E 67, 053201-1-4 (2003)","10.1103/PhysRevE.67.053201",,"cond-mat.stat-mech physics.flu-dyn",,"  It is shown that the steady unidirectional flow with vanishing heat flux
considered by B. C. Eu [Phys. Rev. E 65, 031202 (2002)], and earlier by Uribe
and Garcia--Colin [Phys. Rev. E 60, 4052 (1999)], is inconsistent with the
exact conservation laws of mass, momentum, and energy. The inconsistency does
not lie in the assumed symmetry properties of the flow but in the stationarity
assumption. The unsteady problem is considered and its solution from the
Boltzmann equation for Maxwell molecules is given.
","[{""version"":""v1"",""created"":""Mon, 25 Mar 2002 10:03:08 GMT""},{""version"":""v2"",""created"":""Fri, 28 Feb 2003 09:43:23 GMT""},{""version"":""v3"",""created"":""Wed, 9 Apr 2003 08:33:36 GMT""}]","2007-05-23"
