"cond-mat/0211100","Veer Awana","M. Matvejeff, V.P.S. Awana, L.-Y. Jang, R.S. Liu, H. Yamauchi and M.
  Karppinen","Oxygen non-stoichiometry in Ru-1212 and Ru-1222 magnetosuperconductors","11 pages text, 4 pages Figs. To ISS 2002 YOKOHAMA for PHYSICA C",,"10.1016/S0921-4534(03)01067-0",,"cond-mat.supr-con cond-mat.str-el",,"  Here we report the results of thermogravimetric (TG) analysis on the oxygen
non-stoichiometry of RuSr2GdCu2O8 (Ru-1212) and
RuSr2(Gd0.75Ce0.25)2Cu2O10(Ru-1222) samples. With TG annealings carried out in
O2 and Ar atmospheres it was found that the oxygen content in Ru-1212 remains
less affected upon various annealings, while for Ru-1222 wider-range
oxygen-content tuning is possible. When heated in H2/Ar atmosphere the both
phases release oxygen upon breaking down to mixtures of metals (Ru and Cu) and
binary oxides (CeO2, Gd2O3, and SrO) in two distinct steps around 300 and 450
oC. This reductive decomposition reaction carried out in a thermobalance was
utilized in precise oxygen content determination for these phases. It was found
that the 100-atm O2-annealed Ru-1212 sample was nearly stoichiometric, while
the similarly treated Ru-1222 sample was clearly oxygen deficient. X-ray
absorption near-edge (XANES) spectroscopy was applied to estimate the valence
of Ru in the samples. In spite of the fact that the Ru-1212 phase was shown to
possess less oxygen-deficient RuO2 layer, the valence of Ru as probed with
XANES was found to be lower in Ru-1212 than that in Ru-1222.
","[{""version"":""v1"",""created"":""Wed, 6 Nov 2002 07:11:17 GMT""}]","2009-11-07"
"cond-mat/0211101","Vincent Bretin","V. Bretin, P. Rosenbusch, F. Chevy, G.V. Shlyapnikov, and J. Dalibard","Quadrupole Oscillation of a Single-Vortex Condensate: Evidence for
  Kelvin Modes","4 pages, 3 figures",,"10.1103/PhysRevLett.90.100403",,"cond-mat.soft cond-mat.supr-con",,"  We study the two transverse quadrupole modes of a cigar-shaped Bose-Einstein
condensate with a single centered vortex. We show that the counter-rotating
mode is more strongly damped than in the absence of a vortex, whereas the
co-rotating mode is not affected appreciably by the vortex. We interpret this
result as a decay of the counter-rotating quadrupole mode into two excitations
of the vortex line, the so-called Kelvin modes. This is supported by direct
observation of the wiggling vortex line.
","[{""version"":""v1"",""created"":""Wed, 6 Nov 2002 08:24:54 GMT""}]","2009-11-07"
"cond-mat/0211102","Patrizia Vignolo","Patrizia Vignolo and Anna Minguzzi (SNS-Italy)","Shell structure in the density profiles for noninteracting fermions in
  anisotropic harmonic confinement","4 pages, 4 figures","Phys. Rev. A 67 (2003) 053601","10.1103/PhysRevA.67.053601",,"cond-mat.stat-mech",,"  We develop a Green's function method to evaluate the exact equilibrium
particle-density profiles of noninteracting Fermi gases in external harmonic
confinement in any spatial dimension and for arbitrary trap anisotropy. While
in a spherically symmetric configuration the shell effects are negligible in
the case of large number of particles, we find that for very anisotropic traps
the quantum effects due to single-level occupancy and the deviations from the
Thomas-Fermi approximation are visible also for mesoscopic clouds.
","[{""version"":""v1"",""created"":""Wed, 6 Nov 2002 08:41:21 GMT""}]","2009-11-07"
"cond-mat/0211103","Alessandro Speranza","Alessandro Speranza and Peter Sollich","Isotropic-nematic phase equilibria in the Onsager theory of hard rods
  with length polydispersity","20 pages, 13 figures","Physical Review E, 67, 2003, pp. 061702","10.1103/PhysRevE.67.061702",,"cond-mat.soft cond-mat.stat-mech",,"  We analyse the effect of a continuous spread of particle lengths on the phase
behavior of rodlike particles, using the Onsager theory of hard rods. Our aim
is to establish whether ``unusual'' effects such as isotropic-nematic-nematic
(I-N-N) phase separation can occur even for length distributions with a single
peak. We focus on the onset of I-N coexistence. For a log-normal distribution
we find that a finite upper cutoff on rod lengths is required to make this
problem well-posed. The cloud curve, which tracks the density at the onset of
I-N coexistence as a function of the width of the length distribution, exhibits
a kink; this demonstrates that the phase diagram must contain a three-phase
I-N-N region.
  Theoretical analysis shows that in the limit of large cutoff the cloud point
density actually converges to zero, so that phase separation results at any
nonzero density; this conclusion applies to all length distributions with
fatter-than-exponentail tails. Finally we consider the case of a Schulz
distribution, with its exponential tail. Surprisingly, even here the long rods
(and hence the cutoff) can dominate the phase behaviour, and a kink in the
cloud curve and I-N-N coexistence again result. Theory establishes that there
is a nonzero threshold for the width of the length distribution above which
these long rod effects occur, and shows that the cloud and shadow curves
approach nonzero limits for large cutoff, both in good agreement with the
numerical results.
","[{""version"":""v1"",""created"":""Wed, 6 Nov 2002 09:03:39 GMT""}]","2010-12-14"
"cond-mat/0211104","Slava Yukalov","V. I. Yukalov, E. P. Yukalova, and V. S. Bagnato","Spectrum of Coherent Modes for Trapped Bose Gas","1 file, 11 pages, Latex, no figures","Laser Phys. 12 (2002) 1325-1331",,,"cond-mat",,"  The spectrum of coherent modes for dilute atomic Bose gas, confined in a
cylindrical trap, is calculated by applying optimized perturbation theory and
the technique of self-similar root approximants. The latter technique makes it
possible to derive accurate analytical formulas. The obtained expressions are
valid for arbitrary energy levels of all excited nonlinear coherent modes and
for different traps, spherical, sigar-shape, and disk-shape.
","[{""version"":""v1"",""created"":""Wed, 6 Nov 2002 09:09:25 GMT""}]","2007-05-23"
"cond-mat/0211105","Tarik CELiK","H. Arkin (Hacettepe Uni.), T. Celik (Hacettepe Uni.)","Structure of the Energy Landscape of Short Peptides","17 pages, 4 figures","Int. J. of Mod. Phys. C 14(1), xxx (2003)","10.1142/S0129183103004267",,"cond-mat.stat-mech q-bio",,"  We have simulated, as a showcase, the pentapeptide Met-enkephalin
(Tyr-Gly-Gly-Phe-Met) to visualize the energy landscape and investigate the
conformational coverage by the multicanonical method. We have obtained a
three-dimensional topographic picture of the whole energy landscape by plotting
the histogram with respect to energy(temperature) and the order parameter,
which gives the degree of resemblance of any created conformation with the
global energy minimum (GEM).
","[{""version"":""v1"",""created"":""Wed, 6 Nov 2002 09:48:05 GMT""}]","2009-11-07"
"cond-mat/0211106","Berthier","Ludovic Berthier, Virgile Viasnoff, Olivia White, Vladimir Orlyanchik,
  Florent Krzakala","Hiking through glassy phases: physics beyond aging","Lecture notes, Les Houches, July 2002","in ""Slow relaxations and nonequilibrium dynamics in condensed
  matter""; Eds: J.-L. Barrat, J. Dalibard, M. Feigelman, J. Kurchan (Springer,
  Berlin, 2003)",,,"cond-mat.stat-mech cond-mat.dis-nn cond-mat.soft",,"  Experiments performed on a wide range of glassy materials display many
interesting phenomena, such as aging behavior. In recent years, a large body of
experiments probed this nonequilibrium glassy dynamics through elaborate
protocols, in which external parameters are shifted, or cycled in the course of
the experiment. We review here these protocols, as well as experimental and
numerical results. Then, we critically discuss various theoretical approaches
put forward in this context. Emphasis is put more on the generality of the
phenomena than on a specific system. Experiments are also suggested.
","[{""version"":""v1"",""created"":""Wed, 6 Nov 2002 10:10:24 GMT""},{""version"":""v2"",""created"":""Thu, 14 Nov 2002 13:32:34 GMT""}]","2007-05-23"
"cond-mat/0211107","G. Baskaran","G. Baskaran (Institute of Mathematical Sciences, Madras)","Mott Insulator to high \tc Superconductor via Pressure: Resonating
  Valence Bond theory and prediction of new Systems","4 pages of LaTex file, 3 figures in eps files","Physical Review Letters, 90, 197007 (2003)","10.1103/PhysRevLett.90.197007","IMSc\2002\11","cond-mat.str-el cond-mat.mtrl-sci cond-mat.supr-con",,"  Mott insulator superconductor transition, via pressure and no external
doping, is studied in orbitally non degenerate spin-\half systems. It is
presented as another RVB route to high \tc superconductivity. We propose a
`strong coupling' hypothesis which helps to view first order Mott transition as
a self doping process that also preserves superexchange on metal side . We
present a generalized t-J model where a conserved $N_0$ doubly occupied ($e^-$)
sites and $N_0$ empty sites ($e^+$) hop in the background of $N - 2 N_0$ singly
singly occupied (neutral) sites in a lattice of N sites. An equivalence to the
regular t-J model is made and some old and new systems are predicted to be
candidates for pressure induced high \tc superconductivity.
","[{""version"":""v1"",""created"":""Wed, 6 Nov 2002 13:28:39 GMT""}]","2009-11-07"
"cond-mat/0211108",,"R. Vilela Mendes, Tanya Ara\'ujo and Francisco Lou\c{c}\~a","Reconstructing an economic space from a market metric","20 pages Latex, 9 figures","Physica A 323 (2003) 635","10.1016/S0378-4371(03)00014-1",,"cond-mat.stat-mech q-fin.ST",,"  Using a metric related to the returns correlation, a method is proposed to
reconstruct an economic space from the market data. A reduced subspace,
associated to the systematic structure of the market, is identified and its
dimension related to the number of terms in factor models. Example were worked
out involving sets of companies from the DJIA and S&P500 indexes. Having a
metric defined in the space of companies, network topology coefficients may be
used to extract further information from the data. A notion of ""continuous
clustering"" is defined and empirically related to the occurrence of market
shocks.
","[{""version"":""v1"",""created"":""Wed, 6 Nov 2002 14:27:44 GMT""}]","2016-08-16"
"cond-mat/0211109","Guido Tiana","G. Tiana, D. Provasi and R. A. Broglia","Role of bulk and of interface contacts in the behaviour of model dimeric
  proteins",,,"10.1103/PhysRevE.67.051909",,"cond-mat q-bio",,"  Some dimeric proteins first fold and then dimerize (three--state dimers)
while others first dimerize and then fold (two--state dimers). Within the
framework of a minimal lattice model, we can distinguish between sequences
obeying to one or to the other mechanism on the basis of the partition of the
ground state energy between bulk than for interface contacts. The topology of
contacts is very different for the bulk than for the interface: while the bulk
displays a rich network of interactions, the dimer interface is built up a set
of essentially independent contacts. Consequently, the two sets of interactions
play very different roles both in the the folding and in the evolutionary
history of the protein. Three--state dimers, where a large fraction of the
energy is concentrated in few contacts buried in the bulk, and where the
relative contact energy of interface contacts is considerably smaller than that
associated with bulk contacts, fold according to a hierarchycal pathway
controlled by local elementary structures, as also happens in the folding of
single--domain monomeric proteins. On the other hand, two--state dimers display
a relative contact energy of interface contacts which is larger than the
corresponding quantity associated with the bulk. In this case, the assembly of
the interface stabilizes the system and lead the two chains to fold. The
specific properties of three--state dimers acquired through evolution are
expected to be more robust than those of two--state dimers, a fact which has
consequences on proteins connected with viral diseases.
","[{""version"":""v1"",""created"":""Wed, 6 Nov 2002 14:32:22 GMT""}]","2009-11-07"
"cond-mat/0211110","Tom Kibble","T.W.B. Kibble","Symmetry breaking and defects","Lectures at NATO ASI ""Patterns of symmetry breaking"", Cracow, Sept.
  2002, 35 pp",,,"Imperial/02-3/5","cond-mat astro-ph hep-ph",,"  Symmetry-breaking phase transitions are ubiquitous in condensed matter
systems and in quantum field theories. There is also good reason to believe
that they feature in the very early history of the Universe. At many such
transitions topological defects of one kind or another are formed. Because of
their inherent stability, they can have important effects on the subsequent
behaviour of the system. In the first of these lectures I shall review a number
of examples of spontaneous symmetry breaking, many of which will be discussed
in more detail by other lecturers, and discuss their general features. The
second lecture will be mainly devoted to the conditions under which topological
defects can appear and their classification in terms of homotopy groups of the
underlying vacuum manifold. In my final lecture, I will discuss the `cosmology
in the laboratory' experiments which have been done to try to test some of the
ideas thrown up by discussions of defect formation in the early Universe by
looking at analogous processes in condensed-matter systems.
","[{""version"":""v1"",""created"":""Wed, 6 Nov 2002 14:54:43 GMT""}]","2007-05-23"
"cond-mat/0211111","Dirk Brockmann","D. Brockmann and T. Geisel","Levy Flights in Inhomogeneous Media","4 pages, 4 figures","Phys. Rev. Lett, 90:170601, 2003","10.1103/PhysRevLett.90.170601",,"cond-mat.stat-mech cond-mat.dis-nn",,"  We investigate the impact of external periodic potentials on superdiffusive
random walks known as Levy flights and show that even strongly superdiffusive
transport is substantially affected by the external field. Unlike ordinary
random walks, Levy flights are surprisingly sensitive to the shape of the
potential while their asymptotic behavior ceases to depend on the Levy index
$\mu $. Our analysis is based on a novel generalization of the Fokker-Planck
equation suitable for systems in thermal equilibrium. Thus, the results
presented are applicable to the large class of situations in which
superdiffusion is caused by topological complexity, such as diffusion on folded
polymers and scale-free networks.
","[{""version"":""v1"",""created"":""Wed, 6 Nov 2002 15:11:30 GMT""},{""version"":""v2"",""created"":""Tue, 12 Nov 2002 20:51:21 GMT""},{""version"":""v3"",""created"":""Wed, 13 Nov 2002 20:38:47 GMT""},{""version"":""v4"",""created"":""Mon, 24 Feb 2003 20:31:14 GMT""}]","2009-11-07"
"cs/0211005","Sanshzar Kettebekov","Sanshzar Kettebekov, Mohammed Yeasin, Rajeev Sharma","Prosody Based Co-analysis for Continuous Recognition of Coverbal
  Gestures","Alternative see:
  http://vision.cse.psu.edu/kettebek/academ/publications.htm","S. Kettebekov, M. Yeasin, and R. Sharma, ""Prosody Based
  Co-analysis for Continuous Recognition of Coverbal Gestures,"" presented at
  International Conference on Multimodal Interfaces (ICMI'02), Pittsburgh, USA,
  2002",,,"cs.CV cs.HC",,"  Although speech and gesture recognition has been studied extensively, all the
successful attempts of combining them in the unified framework were
semantically motivated, e.g., keyword-gesture cooccurrence. Such formulations
inherited the complexity of natural language processing. This paper presents a
Bayesian formulation that uses a phenomenon of gesture and speech articulation
for improving accuracy of automatic recognition of continuous coverbal
gestures. The prosodic features from the speech signal were coanalyzed with the
visual signal to learn the prior probability of co-occurrence of the prominent
spoken segments with the particular kinematical phases of gestures. It was
found that the above co-analysis helps in detecting and disambiguating visually
small gestures, which subsequently improves the rate of continuous gesture
recognition. The efficacy of the proposed approach was demonstrated on a large
database collected from the weather channel broadcast. This formulation opens
new avenues for bottom-up frameworks of multimodal integration.
","[{""version"":""v1"",""created"":""Tue, 5 Nov 2002 19:27:32 GMT""}]","2007-05-23"
"gr-qc/0211017","Miguel S\'anchez","A. M. Candela (1), J.L. Flores (2), Miguel Sanchez (2) ((1) Univ.
  Bari, (2) Univ. Granada)","On General Plane Fronted Waves. Geodesics","Final version with minor errata corrected. 19 pages, Latex. To appear
  in Gen. Relat. Gravit. (2003)","Gen.Rel.Grav. 35 (2003) 631-649","10.1023/A:1022962017685",,"gr-qc math.DG",,"  A general class of Lorentzian metrics, $M_0 x R^2$, $ds^2 = <.,.> + 2 du dv +
H(x,u) du^2$, with $(M_0, <.,.>$ any Riemannian manifold, is introduced in
order to generalize classical exact plane fronted waves. Here, we start a
systematic study of their main geodesic properties: geodesic completeness,
geodesic connectedness and multiplicity, causal character of connecting
geodesics. These results are independent of the possibility of a full
integration of geodesic equations. Variational and geometrical techniques are
applied systematically.
  In particular, we prove that the asymptotic behavior of $H(x,u)$ with $x$ at
infinity determines many properties of geodesics. Essentially, a subquadratic
growth of $H$ ensures geodesic completeness and connectedness, while the
critical situation appears when $H(x,u)$ behaves in some direction as $|x|^2$,
as in the classical model of exact gravitational waves
","[{""version"":""v1"",""created"":""Tue, 5 Nov 2002 17:00:01 GMT""},{""version"":""v2"",""created"":""Wed, 5 Mar 2003 10:24:14 GMT""}]","2015-06-25"
"gr-qc/0211018","Martin Snajdr","Martin Snajdr, Valeri Frolov","Capture and Critical Scattering of a Long Cosmic String by a Rotating
  Black Hole","version accepted for publication in Classical and Quantum Gravity, 18
  pages, 12 figures, animations can be found at
  http://www.phys.ualberta.ca/~frolov/CSBH","Class.Quant.Grav. 20 (2003) 1303-1320","10.1088/0264-9381/20/7/305",,"gr-qc",,"  The capture of a straight, infinitely long cosmic string by a rotating black
hole with rotation parameter $a$ is considered. We assume that a string is
moving with velocity $v$ and that initially the string is parallel to the axis
of rotation of the black hole and has the impact parameter $b$. The string can
be either scattered or captured by the black hole. We demonstrate that there
exists a critical value of the impact parameter $b_c(v,a)$ which separates
these two regimes. Using numerical simulations we obtain the critical impact
parameter curve for different values of the rotation parameter $a$. We show
that for the prograde motion of the string this curve lies below the curve for
the retrograde motion. Moreover, for ultrarelativistic strings moving in the
prograde direction and nearly extremal black holes the critical impact
parameter curve is found to be a multiply valued function of $v$. We obtain
real time profiles of the scattered strings in the regime close to the
critical. We also study critical scattering and capture of strings by the
rotating black hole in the relativistic and ultrarelativistic regime and
especially such relativistic effects as coil formation and wrapping effect.
","[{""version"":""v1"",""created"":""Wed, 6 Nov 2002 07:37:02 GMT""},{""version"":""v2"",""created"":""Sat, 9 Nov 2002 00:20:57 GMT""},{""version"":""v3"",""created"":""Thu, 6 Feb 2003 07:06:11 GMT""}]","2017-08-23"
"gr-qc/0211019","Sushant G. Ghosh","S. G. Ghosh (Science College, Nagpur) and Naresh Dadhich (IUCAA, Pune)","Gravitational collapse of null strange quark fluid and cosmic censorship","8 pages, RevTeX 4, no figures, Accepted in GRG","Gen.Rel.Grav. 35 (2003) 359-370","10.1023/A:1022361631003",,"gr-qc",,"  We study gravitational collapse of the general spherically symmetric null
strange quark fluid having the equation of state, $p = (\rho - 4B)/n$, where
$B$ is the bag constant. An interesting feature that emerges is that the
initial data set giving rise to naked singularity in the Vaidya collapse of
null fluid gets covered due to the presence of strange quark matter component.
Its implication to the Cosmic Censorship Conjecture is discussed.
","[{""version"":""v1"",""created"":""Wed, 6 Nov 2002 10:55:01 GMT""}]","2015-06-25"
"gr-qc/0211020","Peter Dunsby","Naureen Goheer and Peter K. S. Dunsby","Exponential Potentials on the Brane","14 Pages RevTeX","Phys.Rev. D67 (2003) 103513","10.1103/PhysRevD.67.103513",,"gr-qc",,"  In this paper we study the cosmological dynamics of Randall-Sundrum
braneworld type scenarios in which the five-dimensional Weyl tensor has a
non-vanishing projection onto the three-brane where matter fields are confined.
Using dynamical systems techniques, we study how the state space of
Friedmann-Lemaitre-Robertson-Walker (FLRW) and Bianchi type I scalar field
models with an exponential potential is affected by the bulk Weyl tensor,
focusing on the differences that appear with respect to standard general
relativity and also Randall-Sundrum cosmological scenarios without the Weyl
tensor contribution.
","[{""version"":""v1"",""created"":""Wed, 6 Nov 2002 12:21:08 GMT""}]","2009-11-07"
"hep-ex/0211013","Alan W. P. Poon","A.W.P. Poon","Solar Neutrino Observations at the Sudbury Neutrino Observatory","invited talk at the SLAC Summer Institute Topical Conference
  (SSI02-TTh01), 2002, 43 pages, 19 figures, 10 tables","ECONF C020805:TTH01,2002",,,"hep-ex nucl-ex",,"  The Sudbury Neutrino Observatory (SNO) is a 1000-tonne heavy water Cherenkov
detector. Its usage of \dto as target allows the simultaneous measurements of
the $\nu_e$ flux from $^8$B decay in the Sun and the total flux of all active
neutrino species through the charged-current and the neutral-current
interactions on the deuterons. Assuming the standard $^{8}$B shape, the $\nu_e$
component of the $^{8}$B solar neutrino flux is measured to be $\phi_e =
1.76^{+0.05}_{-0.05}{(stat.)}^{+0.09}_{-0.09} {(syst.)} x 10^6 {\rm cm}^{-2}
{\rm s}^{-1}$ for a kinetic energy threshold of 5 MeV. The non-\nue component
is found to be $\phinumutau = 3.41^{+0.45}_{-0.45}{(stat.)}^{+0.48}_{-0.45}
{(syst.)} x 10^6 {\rm cm}^{-2} {\rm s}^{-1}$. This $5.3\sigma$ difference
provides strong evidence for $\nu_{e}$ flavor transformation in the solar
neutrino sector. The total active neutrino flux is measured with the
neutral-current reaction at a neutrino energy threshold of 2.2 MeV. This flux
is determined to be $\phi_{NC} = 5.09^{+0.44}_{-0.43}{(stat.)}^{+0.46}_{-0.43}
{(syst.)} x 10^6 {\rm cm}^{-2} {\rm s}^{-1}$, and is consistent with solar
model predictions. Assuming an undistorted $^8$B spectrum, the night minus day
rate is 14.0$\pm$6.3(stat.)$^{+1.5}_{-1.4}$(sys.)\% of the average rate in the
charged-current channel. If the total active neutrino flux is constrained to
have no asymmetry, the night-day asymmetry in the $\nu_e$ flux is found to be
7.0$\pm$4.9(stat.)$^{+1.3}_{1.2}$(sys.)\%. A global analysis of all the
available solar neutrino data in terms of matter-enhanced oscillations of two
active flavors strongly favors the Large Mixing Angle (LMA) solution.
","[{""version"":""v1"",""created"":""Wed, 6 Nov 2002 00:47:35 GMT""}]","2009-02-20"
"hep-ex/0211014","Contalbrigo Marco","Marco Contalbrigo (1) (for the HERMES Collaboration) ((1) INFN -
  Ferrara University)","A First Measurement of the Tensor-Polarized Structure Function b1d","LaTex, 5 pages, 3 figures, talk given at SPIN 2002 Conference","AIP Conf.Proc.675:284-288,2003","10.1063/1.1607144",,"hep-ex",,"  The Hermes experiment studies the spin structure of the nucleon using the
27.6 GeV longitudinally polarized positron beam of HERA and an internal target
of pure gases. In addition to the well-known spin structure function g_1,
measured precisely with longitudinally polarized proton and deuteron targets,
the use of a tensor-polarized deuteron target provides access to the tensor
polarized structure function b1d. The latter, measured with an unpolarized
beam, quantifies the dependence of the parton momentum distribution on the
nucleon spin. Hermes had a 1-month dedicated run with a tensor polarized
deuterium target during the 2000 data taking period. Here preliminary results
on the tensor-polarized structure function b1d are presented for the kinematic
range 0.002<x<0.85 and 0.1<Q^2<20 GeV^2.
","[{""version"":""v1"",""created"":""Wed, 6 Nov 2002 12:33:53 GMT""}]","2019-08-15"
"hep-ex/0211015","Cremonesi Oliviero","A. Alessandrello, C. Arnaboldi, C. Brofferio, S. Capelli, O.
  Cremonesi, E. Fiorini, A. Nucciotti, M. Pavan, G. Pessina, S. Pirro, E.
  Previtali, M. Sisti, M. Vanzini and L. Zanotti, A. Giuliani, M. Pedretti, C.
  Bucci, C. Pobes (MiBeta)","New Limits on Naturally Occurring Electron Capture of 123Te","4 pages, 3 figures, submitted to Physical Review C","Phys.Rev. C67 (2003) 014323","10.1103/PhysRevC.67.014323",,"hep-ex",,"  Electron capture of 123Te from the K shell has been investigated in a new
underground search with an array of 340 g TeO_2 thermal detectors. We find that
some previous indication of this decay could be attributed to E.C. of 121Te
resulting from neutron activation of natural Tellurium. There is therefore so
far no evidence for E.C. of 123Te from the K shell with a 90 % c.l. lower limit
t_{1/2}^K > 5.E19 years on the half lifetime. Taking into account the predicted
K E.C. branching ratio, the corresponding lower limit on the 123Te EC half
lifetime is t_{1/2} > 9.2E16 y, which can be theoretically interpreted only on
the basis of a strong suppression of the nuclear matrix elements. A
complementary analysis based on the expected fraction of E.C. accompanied by
internal bremsstrahlung is discussed.
","[{""version"":""v1"",""created"":""Wed, 6 Nov 2002 15:50:55 GMT""}]","2009-11-07"
