"cond-mat/0211540","Mikhail Korshunov","M. A. Korshunov","Influence of the Random Arrangement of Molecules on Energy of Vacancies
  Migration","4 pages, 4 figures",,,,"cond-mat.dis-nn",,"  Calculation of energy of migration for number of molecular crystals
consisting of centrosymmetrical and non-centrosymmetrical molecules was carried
out by using a method of atom-atom potentials. It is shown, that the potential
barrier is symmetrical for crystals consisting of centrosymmetrical molecules,
but not symmetrical for the mixed crystals and crystals consisting of
non-centrosymmetrical molecules. Thus it is possible to influence quantity of
migration energy, growing the mixed crystals with a particular arrangement of
components.
","[{""version"":""v1"",""created"":""Mon, 25 Nov 2002 03:26:30 GMT""}]","2007-05-23"
"cond-mat/0211542","Klaus Molmer","Klaus Molmer","Jaynes-Cummings dynamics with a matter wave oscillator","4 pages, 2 figures",,"10.1103/PhysRevLett.90.110403",,"cond-mat.soft quant-ph",,"  We propose to subject two Bose-Einstein condensates to a periodic potential,
so that one condensate undergoes the Mott insulator transition to a state with
precisely one atom per lattice site. We show that photoassociation of
heteronuclear molecules within each lattice site is described by the quantum
optical Jaynes-Cummings Hamiltonian. In analogy with studies of this
Hamiltonian with cavity fields and trapped ions, we are thus able to engineer
quantum optical states of atomic matter wave fields and we are able to
reconstruct these states by quantum state tomography.
","[{""version"":""v1"",""created"":""Mon, 25 Nov 2002 09:49:35 GMT""}]","2009-11-07"
"cond-mat/0211543","Angles d'Auriac","J-Ch. Angles d'Auriac and F. Igloi","Phase transition in the 2d random Potts model in the large-q limit","4 pages 3 figures",,,,"cond-mat.stat-mech cond-mat.dis-nn",,"  Phase transition in the two-dimensional $q$-state Potts model with random
ferromagnetic couplings in the large-q limit is conjectured to be described by
the isotropic version of the infinite randomness fixed point of the random
transverse-field Ising spin chain. This is supported by extensive numerical
studies with a combinatorial optimization algorithm giving estimates for the
critical exponents in accordance with the conjectured values:
$\beta=(3-\sqrt{5})/4$, $\beta_s=1/2$ and $\nu=1$. The specific heat has a
logarithmic singularity, but at the transition point there are very strong
sample-to-sample fluctuations. Discretized randomness results in
discontinuities in the internal energy.
","[{""version"":""v1"",""created"":""Mon, 25 Nov 2002 10:22:37 GMT""}]","2007-05-23"
"cond-mat/0211544","Peter Samuely","P. Samuely, P. Szabo, J. Kacmarcik, T. Klein, A. G. M. Jansen","Point-contact spectroscopy of MgB2","14 pages incl. 8 eps figures","Physica C 385 (2003), 244","10.1016/S0921-4534(02)02344-4",,"cond-mat.supr-con",,"  Point-contact spectroscopy measurements on magnesium diboride reveal the
existence of two superconducting energy gaps closing at the same transition
temperature in line with the multiband model of superconductivity. The sizes of
the two gaps ($\Delta_{\pi}$ = 2.8 meV and $\Delta_{\sigma}$ = 6.5-7 meV) are
respectively smaller and larger than the expected weak coupling value of the
one-gap superconductor. The smaller gap is rapidly filled by a small magnetic
field of about 1-2 Tesla much lower than the real upper critical field
$H_{c2}$. The larger gap is closed at the anisotropic $H_{c2}$. Above the gap
energies reproducible non-linearities are observed at the characteristic phonon
energies of MgB$_2$.
","[{""version"":""v1"",""created"":""Mon, 25 Nov 2002 11:21:37 GMT""}]","2009-11-07"
"cond-mat/0211545","Stefano Giovanazzi","Stefano Giovanazzi, Axel Gorlitz, Tilman Pfau","Ballistic expansion of a dipolar condensate","7 pages, 3 figures",,,,"cond-mat",,"  We have studied the free expansion of a Bose condensate in which both the
usual s-wave contact interaction and the dipole-dipole interaction contribute
considerably to the total interaction energy. We calculate corrections due to
dipolar forces to the expansion of such a condensate after release from a trap.
In the Thomas-Fermi limit, we find that the modifications are to lowest order
independent from the total number of atoms.
","[{""version"":""v1"",""created"":""Mon, 25 Nov 2002 14:51:27 GMT""}]","2007-05-23"
"cond-mat/0211546","Guido Caldarelli","Giovanni Bonanno (1,2), Guido Caldarelli (1), Fabrizio Lillo (3)and
  Rosario N. Mantegna (2,3) ((1) INFM UdR Roma1, (2) Dip. Fisica UNiversita' di
  Palermo, (3) INFM UdR Palermo)","Topology of correlation based minimal spanning trees in real and model
  markets","4 pages revtex, 4 figs, first 2 in color",,"10.1103/PhysRevE.68.046130",,"cond-mat.stat-mech",,"  We present here a topological characterization of the minimal spanning tree
that can be obtained by considering the price return correlations of stocks
traded in a financial market. We compare the minimal spanning tree obtained
from a large group of stocks traded at the New York Stock Exchange during a
12-year trading period with the one obtained from surrogated data simulated by
using simple market models. We find that the empirical tree has features of a
complex network that cannot be reproduced, even as a first approximation, by a
random market model and by the one-factor model.
","[{""version"":""v1"",""created"":""Mon, 25 Nov 2002 11:47:38 GMT""}]","2009-11-07"
"cond-mat/0211547","Milorad Milosevic","M. V. Milosevic and F. M. Peeters","Superconducting Wigner Vortex Molecule near a Magnetic Disk","4 pages, 4 figures. Submitted to Phys. Rev. Lett","Phys. Rev. B 68, 024509 (2003)","10.1103/PhysRevB.68.024509",,"cond-mat.supr-con",,"  Within the non-linear Ginzburg-Landau (GL) theory, we investigate the vortex
structure in a superconducting thin film with a ferromagnetic disk on top of
it. Antivortices are stabilized in shells around a central core of vortices (or
a giant-vortex) with size-magnetization controlled ``magic numbers''. An
equilibrium vortex phase diagram is constructed. The transition between the
different vortex phases occurs through the creation of a vortex-antivortex pair
under the magnetic disk edge.
","[{""version"":""v1"",""created"":""Mon, 25 Nov 2002 11:56:46 GMT""}]","2009-11-07"
"cond-mat/0211548","Christophe Texier","Christophe Texier and Markus Buttiker","Local Friedel sum rule on graphs","25 pages, LaTeX, 8 figures","Phys. Rev. B67 (2003) 245410.","10.1103/PhysRevB.67.245410",,"cond-mat.mes-hall",,"  We consider graphs made of one-dimensional wires connected at vertices and on
which may live a scalar potential. We are interested in a scattering situation
where the graph is connected to infinite leads. We investigate relations
between the scattering matrix and the continuous part of the local density of
states, the injectivities, emissivities and partial local density of states.
Those latter quantities can be obtained by attaching an extra lead at the point
of interest and by investigating the transport in the limit of zero
transmission into the additional lead. In addition to the continuous part
related to the scattering states, the spectrum of graphs may present a discrete
part related to states that remain uncoupled to the external leads. The theory
is illustrated with the help of a few simple examples.
","[{""version"":""v1"",""created"":""Mon, 25 Nov 2002 11:57:08 GMT""}]","2009-11-07"
"cond-mat/0211549","Andrey L. Pankratov","Andrey L. Pankratov","Optimal Pump Frequency for Ac Hysteretic Squid","4 pages, 6 figures",,"10.1103/PhysRevB.68.024503",,"cond-mat.supr-con",,"  This paper presents the analytical and numerical analysis of fluctuational
dynamics of ac hysteretic SQUID. It has been demonstrated, that the most
important parameter for the improvement of the hysteretic SQUID sensitivity is
the ratio between the pump and the characteristic frequencies but not their
absolute values. The resonant behavior of signal-to-noise ratio as function of
the pump frequency has been observed and the narrow area for the optimal pump
frequency range is indicated.
","[{""version"":""v1"",""created"":""Mon, 25 Nov 2002 12:37:34 GMT""}]","2009-11-07"
"cond-mat/0211550","Pasqualina Caputo","J. Oppenlaender, P. Caputo, Ch. Haeussler, T. Traeuble, J. Tomes, A.
  Friesch, N. Schopohl","Effects of magnetic field on two-dimensional Superconducting Quantum
  Interference Filters","3 pages, 4 figures, submitted to APL","Appl. Phys.Lett., vol.83, 969 (2003)","10.1063/1.1597753",,"cond-mat.supr-con",,"  We present an experimental study of two-dimensional superconducting quantum
interference filters (2D-SQIFs) in the presence of a magnetic field B. The
dependences of the dc voltage on the applied magnetic field are characterized
by a unique delta-like dip at B=0, which depends on the distribution of the
areas of the individual loops, and on the bias current. The voltage span of the
dip scales proportional to the number of rows simultaneously operating at the
same working point. In addition, the voltage response of the 2D-SQIF is
sensitive to a field gradient generated by a control line and superimposed to
the homogeneous field coil. This feature opens the possibility to use 2D
superconducting quantum interference filters as highly sensitive detectors of
spatial gradients of magnetic field.
","[{""version"":""v1"",""created"":""Mon, 25 Nov 2002 13:17:35 GMT""}]","2007-05-23"
"cond-mat/0211551","Roman Martonak","R. Martonak, A. Laio and M. Parrinello ((1) Swiss Center for
  Scientific Computing, Manno, Switzerland, (2) ETH Zurich, Physical Chemistry,
  Zurich, Switzerland)","Predicting crystal structures: the Parrinello-Rahman method revisited","5 pages, 2 Postscript figures, submitted",,"10.1103/PhysRevLett.90.075503",,"cond-mat.mtrl-sci cond-mat.stat-mech",,"  By suitably adapting a recent approach [A. Laio and M. Parrinello, PNAS, 99,
12562 (2002)] we develop a powerful molecular dynamics method for the study of
pressure-induced structural transformations. We use the edges of the simulation
cell as collective variables. In the space of these variables we define a
metadynamics that drives the system away from the local minimum towards a new
crystal structure. In contrast to the Parrinello-Rahman method our approach
shows no hysteresis and crystal structure transformations can occur at the
equilibrium pressure. We illustrate the power of the method by studying the
pressure-induced diamond to simple hexagonal phase transition in a model of
silicon.
","[{""version"":""v1"",""created"":""Mon, 25 Nov 2002 14:11:46 GMT""}]","2009-11-07"
"cond-mat/0211552","Hiroaki Onodera","Hiroaki Onodera, Takami Tohyama and Sadamichi Maekawa","Resonant two-magnon Raman scattering in two-dimensional and ladder-type
  Mott insulators","REVTeX4, 3 pages, 3 figures, Proceedings for ISS2002 (Yokohama,
  November 2002). To be published in Physica C",,"10.1016/S0921-4534(03)01098-0",,"cond-mat.str-el",,"  We investigate the resonant two-magnon Raman scattering in the
two-dimensional (2D) and ladder-type Mott insulators by using a half-filled
Hubbard model in the strong coupling limit. By performing numerical
diagonalization calculations for small clusters, we find that the model can
reproduce the experimental features in the 2D that the Raman intensity is
enhanced when the incoming photon energy is not near the absorption edge but
well above it. In the ladder-type Mott insulators, the Raman intensity is found
to resonate with absorption spectrum in contrast to the 2D system. The
difference between 2D and the ladder systems is explained by taking into
account the fact that the ground state in 2D is a spin-ordered state while that
in ladder is a spin-gapped one.
","[{""version"":""v1"",""created"":""Mon, 25 Nov 2002 15:05:54 GMT""}]","2009-11-07"
"cond-mat/0211553","Ingo Josopait","I. Josopait, L. Dobrek, L. Santos, A. Sanpera, M. Lewenstein","Atom optics with rotating Bose-Einstein condensates","7 pages, 7 figures, to be published in EPJ D","The European Physical Journal D - Atomic, Molecular and Optical
  Physics, Volume 22, Issue 3, Mar 2003, Pages 385 - 391","10.1140/epjd/e2003-00044-6",,"cond-mat.soft",,"  The atom optics of Bose-Einstein condensates containing a vortex of
circulation one is discussed. We first analyze in detail the reflection of such
a condensate falling on an atomic mirror. In a second part, we consider a
rotating condensate in the case of attractive interactions. We show that for
sufficiently large nonlinearity the rotational symmetry of the rotating
condensate is broken.
","[{""version"":""v1"",""created"":""Mon, 25 Nov 2002 15:33:44 GMT""}]","2007-05-23"
"cs/0211032","Yaneff","A. G. Yaneff","Solution Bounds for a Hypothetical Polynomial Time Aproximation
  Algorithm for the TSP","2 pages",,,,"cs.CC",,"  Bounds for the optimal tour length for a hypothetical TSP algorithm are
derived.
","[{""version"":""v1"",""created"":""Mon, 25 Nov 2002 08:24:37 GMT""},{""version"":""v2"",""created"":""Sat, 25 Jan 2003 14:40:16 GMT""}]","2007-05-23"
"cs/0211033","Miroslaw Truszczynski","Deborah East and Miroslaw Truszczynski","Propositional satisfiability in declarative programming","34 pages, 4 tables; extended version of papers that appeared in
  Proceedings of AAAI-2000 and Proceedings of KI-2001",,,,"cs.LO cs.AI",,"  Answer-set programming (ASP) paradigm is a way of using logic to solve search
problems. Given a search problem, to solve it one designs a theory in the logic
so that models of this theory represent problem solutions. To compute a
solution to a problem one needs to compute a model of the corresponding theory.
Several answer-set programming formalisms have been developed on the basis of
logic programming with the semantics of stable models. In this paper we show
that also the logic of predicate calculus gives rise to effective
implementations of the ASP paradigm, similar in spirit to logic programming
with stable model semantics and with a similar scope of applicability.
Specifically, we propose two logics based on predicate calculus as formalisms
for encoding search problems. We show that the expressive power of these logics
is given by the class NP-search. We demonstrate how to use them in programming
and develop computational tools for model finding. In the case of one of the
logics our techniques reduce the problem to that of propositional
satisfiability and allow one to use off-the-shelf satisfiability solvers. The
language of the other logic has more complex syntax and provides explicit means
to model some high-level constraints. For theories in this logic, we designed
our own solver that takes advantage of the expanded syntax. We present
experimental results demonstrating computational effectiveness of the overall
approach.
","[{""version"":""v1"",""created"":""Mon, 25 Nov 2002 13:15:58 GMT""}]","2007-05-23"
"cs/0211035","Jean-Marie Chauvet","Jean-Marie Chauvet","Monadic Style Control Constructs for Inference Systems","25 pages",,,"DD-2002-1","cs.AI cs.PL",,"  Recent advances in programming languages study and design have established a
standard way of grounding computational systems representation in category
theory. These formal results led to a better understanding of issues of control
and side-effects in functional and imperative languages. Another benefit is a
better way of modelling computational effects in logical frameworks. With this
analogy in mind, we embark on an investigation of inference systems based on
considering inference behaviour as a form of computation. We delineate a
categorical formalisation of control constructs in inference systems. This
representation emphasises the parallel between the modular articulation of the
categorical building blocks (triples) used to account for the inference
architecture and the modular composition of cognitive processes.
","[{""version"":""v1"",""created"":""Mon, 25 Nov 2002 14:19:26 GMT""}]","2007-05-23"
"gr-qc/0211078","Chiao","Raymond Y. Chiao","Conceptual tensions between quantum mechanics and general relativity:
  Are there experimental consequences?","26 pages, 4 figures, Revised Wheeler Volume Chapter of January 22,
  2002",,,,"gr-qc",,"  One of the conceptual tensions between quantum mechanics (QM) and general
relativity (GR) arises from the clash between the spatial nonseparability} of
entangled states in QM, and the complete spatial separability of all physical
systems in GR, i.e., between the nonlocality implied by the superposition
principle, and the locality implied by the equivalence principle. Possible
experimental consequences of this conceptual tension will be discussed for
macroscopically entangled, coherent quantum fluids, such as superconductors,
superfluids, atomic Bose-Einstein condensates, and quantum Hall fluids,
interacting with tidal and gravitational radiation fields. A minimal-coupling
rule, which arises from the electron spin coupled to curved spacetime, leads to
an interaction between electromagnetic (EM) and gravitational (GR) radiation
fields mediated by a quantum Hall fluid. This suggests the possibility of a
quantum transducer action, in which EM waves are convertible to GR waves, and
vice versa.
","[{""version"":""v1"",""created"":""Mon, 25 Nov 2002 03:48:07 GMT""},{""version"":""v2"",""created"":""Mon, 30 Dec 2002 16:19:24 GMT""},{""version"":""v3"",""created"":""Mon, 6 Jan 2003 18:48:48 GMT""},{""version"":""v4"",""created"":""Wed, 22 Jan 2003 17:58:12 GMT""}]","2007-05-23"
"gr-qc/0211080","Carlos F. Sopuerta","Carlos F. Sopuerta, Marco Bruni (1) and Leonardo Gualtieri (2) ((1)
  ICG, Portsmouth U. (2) Universit\`a di Roma ''La Sapienza'' and Sezione INFN
  ROMA)","Non-linear relativistic perturbation theory with two parameters","5 pages, LaTeX2e. Contribution to the Spanish Relativity Meeting (ERE
  2002), Mao, Menorca, Spain, 22-24.September.2002",,,,"gr-qc",,"  An underlying fundamental assumption in relativistic perturbation theory is
the existence of a parametric family of spacetimes that can be Taylor expanded
around a background. Since the choice of the latter is crucial, sometimes it is
convenient to have a perturbative formalism based on two (or more) parameters.
A good example is the study of rotating stars, where generic perturbations are
constructed on top of an axisymmetric configuration built by using the slow
rotation approximation. Here, we discuss the gauge dependence of non-linear
perturbations depending on two parameters and how to derive explicit higher
order gauge transformation rules.
","[{""version"":""v1"",""created"":""Mon, 25 Nov 2002 10:59:50 GMT""}]","2007-05-23"
"gr-qc/0211081","Alejandra Melfo","Alejandra Melfo, Nelson Pantoja and Aureliano Skirzewski","Thick domain wall spacetimes with and without reflection symmetry","8 pages, no figures","Phys.Rev. D67 (2003) 105003","10.1103/PhysRevD.67.105003",,"gr-qc",,"  We show that the spacetimes of domain wall solutions to the coupled
Einstein-scalar field equations with a given scalar field potential fall into
two classes, depending on whether or not reflection symmetry on the wall is
imposed. Solutions with reflection symmetry are dynamic, while the asymmetric
ones are static. Asymmetric walls are asymptotically flat on one side and
reduce to the Taub spacetime on the other. Examples of asymmetric thick walls
in D-dimensional spacetimes are given, and results on the thin-wall limit of
the dynamic, symmetric walls are extended to the asymmetric case. The
particular case of symmetric, static spacetimes is considered and a new family
of solutions, including previously known BPS walls, is presented.
","[{""version"":""v1"",""created"":""Mon, 25 Nov 2002 13:09:27 GMT""}]","2009-11-07"
"gr-qc/0211082","Roy Maartens","George Ellis, Roy Maartens","The Emergent Universe: inflationary cosmology with no singularity","minor changes; version to appear in Class Q Grav","Class.Quant.Grav.21:223-232,2004","10.1088/0264-9381/21/1/015",,"gr-qc astro-ph",,"  Observations indicate that the universe is effectively flat, but they do not
rule out a closed universe. The role of positive curvature is negligible at
late times, but can be crucial in the early universe. In particular, positive
curvature allows for cosmologies that originate as Einstein static universes,
and then inflate and later reheat to a hot big bang era. These cosmologies have
no singularity, no ""beginning of time"", and no horizon problem. If the initial
radius is chosen to be above the Planck scale, then they also have no quantum
gravity era, and are described by classical general relativity throughout their
history.
","[{""version"":""v1"",""created"":""Mon, 25 Nov 2002 14:53:59 GMT""},{""version"":""v2"",""created"":""Thu, 12 Jun 2003 12:12:08 GMT""},{""version"":""v3"",""created"":""Mon, 11 Aug 2003 14:17:19 GMT""},{""version"":""v4"",""created"":""Sat, 25 Oct 2003 10:15:41 GMT""}]","2010-04-06"
"hep-ex/0211058","Eilam Gross","Eilam Gross and Amit Klier","Higgs Statistics for Pedestrians","22 pages including 14 figures, typo corrected, compact plots replace
  ""heavy"" ones",,,,"hep-ex",,"  We review the results of the Standard Model Higgs boson search at LEP. An
emphasis is put on revealing the details behind the statistical procedure
developed by the LEP Higgs working group. The procedure is explained using a
toy model which allows the reader to estimate the significance of the
experimental observation which led at the time to a scientific debate on
whether LEP has observed a 115 GeV Higgs boson.
","[{""version"":""v1"",""created"":""Mon, 25 Nov 2002 08:20:14 GMT""},{""version"":""v2"",""created"":""Tue, 26 Nov 2002 08:46:23 GMT""},{""version"":""v3"",""created"":""Sun, 8 Dec 2002 11:03:41 GMT""}]","2007-05-23"
"hep-ex/0211060","Laurent Duflot","Laurent Duflot and Marumi Kado","Probing extra spacetime dimensions at the Tevatron","Proceedings of the SUSY 2002 conference, Hamburg, Germany. 8 pages
  corrected reference and a typo",,,,"hep-ex",,"  Theories with extra spacetime dimensions aiming at resolving the hierarchy
problem have recently been developed. These scenarios have provided exciting
new grounds for experimental probes. A review of the searches conducted at the
Tevatron in this framework during its first running phase and the prospects for
its second running phase are reviewed.
","[{""version"":""v1"",""created"":""Mon, 25 Nov 2002 11:53:53 GMT""},{""version"":""v2"",""created"":""Thu, 28 Nov 2002 11:59:11 GMT""}]","2007-05-23"
"hep-lat/0211039","Takumi Doi","Takumi Doi (1), Noriyoshi Ishii (2), Makoto Oka (1) and Hideo Suganuma
  (1) ((1) Tokyo Inst. Tech, (2) Wako, RIKEN)","The Quark-Gluon Mixed Condensate g<\bar{q} sigma G q> in SU(3)c Quenched
  Lattice QCD","9 pages, REVTeX4, 3 figures","Phys.Rev. D67 (2003) 054504","10.1103/PhysRevD.67.054504",,"hep-lat hep-ph nucl-th",,"  Using the SU(3)c lattice QCD with the Kogut-Susskind fermion at the quenched
level, we study the quark-gluon mixed condensate g<\bar{q} sigma G q>, which is
another chiral order parameter. For each current quark mass of m_q=21, 36, 52
MeV, we generate 100 gauge configurations in the 16^4 lattice with \beta = 6.0,
and perform the measurement of the mixed condensate at 16 points in each gauge
configuration. Using the 1600 data for each m_q, we find the ratio between the
mixed condensate and the quark condensate, m_0^2 = g<\bar{q} sigma G q>/
<\bar{q}q> \simeq 2.5 GeV^2 at the lattice scale in the chiral limit. The large
value of the mixed condensate suggests its importance in the operator product
expansion in QCD.
","[{""version"":""v1"",""created"":""Sun, 24 Nov 2002 16:47:20 GMT""},{""version"":""v2"",""created"":""Fri, 24 Jan 2003 08:09:56 GMT""}]","2009-11-07"
"hep-ph/0211371","Per Osland","Ilya F. Ginzburg (Novosibirsk), Maria Krawczyk (CERN, Warsaw), Per
  Osland (Bergen)","Two-Higgs-Doublet Models with CP violation","5 pages, LaTeX, including figures. Presented at SUSY02, DESY, June
  2002 and LCWS02, Jeju, Korea, August 2002. To appear in the proceedings.
  Version 2: minor changes, additional references",,,"CERN-TH/2002-330, IFT 40/2002","hep-ph",,"  We consider the Two-Higgs-Doublet Model and determine the range of parameters
for which CP violation and Flavor Changing Neutral Current effects are
naturally small. It corresponds to small values of the mass parameter m_{12}^2,
describing soft (\phi_1,\phi_2) mixing in the potential. We discuss how, in
this approach, some Higgs bosons can be heavy, with mass of the order of 1 TeV.
  The possibility that at the Tevatron, LHC and an e^+e^- Linear Collider, only
one Higgs boson will be found, with properties indistinguishable from those in
the Standard Model (SM), we define as the SM-like scenario. While this scenario
can be obtained with large \mu^2 \sim \Re m_{12}^2 parameter, in which case
there is decoupling, we here discuss the opposite case of small \mu^2, without
decoupling.
","[{""version"":""v1"",""created"":""Sun, 24 Nov 2002 18:22:15 GMT""},{""version"":""v2"",""created"":""Tue, 3 Dec 2002 20:20:02 GMT""}]","2007-05-23"
