"astro-ph/0211522","Carolina Odman","Alessandro Melchiorri, Laura Mersini, Carolina J. Odman, Mark Trodden","The State of the Dark Energy Equation of State","7 pages, 4 figures, added a reference","Phys.Rev.D68:043509,2003","10.1103/PhysRevD.68.043509",,"astro-ph gr-qc hep-ph hep-th",,"  By combining data from seven cosmic microwave background experiments
(including the latest WMAP results) with large scale structure data, the Hubble
parameter measurement from the Hubble Space Telescope and luminosity
measurements of Type Ia supernovae we demonstrate the bounds on the dark energy
equation of state $w_Q$ to be $-1.38< w_Q <-0.82$ at the 95% confidence level.
Although our limit on $w_Q$ is improved with respect to previous analyses,
cosmological data does not rule out the possibility that the equation of state
parameter $w_Q$ of the dark energy $Q$ is less than -1. We present a tracking
model that ensures $w_Q \le -1$ at recent times and discuss the observational
consequences.
","[{""version"":""v1"",""created"":""Sun, 24 Nov 2002 16:57:08 GMT""},{""version"":""v2"",""created"":""Tue, 15 Apr 2003 17:06:36 GMT""},{""version"":""v3"",""created"":""Wed, 16 Apr 2003 18:56:05 GMT""}]","2008-11-26"
"astro-ph/0211526","Neal J. Evans II","N. J. Evans II","Studying Infall",,,,,"astro-ph",,"  The study of protostellar collapse or infall has proven unusually difficult
and controversial. Some historical context will be provided, against which
recent advances can be measured. We now have a substantial number of objects
with signatures that can be interpreted in terms of collapse, but a number of
issues remain. One issue is the effect of chemical variations, especially
depletion in the dense, cold interiors of cores that are likely to form low
mass stars. Strategies for dealing with this issue depend on using dust
emission to constrain the density and temperature distribution, leaving
molecular line observations to constrain dynamics and abundance distributions.
Recent progress in this area will be described and we will consider the next
challenges to be overcome. Interferometeric observations, especially with
future instruments, will provide a powerful tool. In combination with chemical
studies coupled with dynamical models, the observations made possible by
interferometers should finally put this subject on a firm foundation.
","[{""version"":""v1"",""created"":""Sun, 24 Nov 2002 19:58:06 GMT""}]","2007-05-23"
"astro-ph/0211527","Jonathan E. Grindlay","Jonathan Grindlay, Ping Zhao, JaeSub Hong, Johnathan Jenkins, Dong-Woo
  Kim, Eric Schlegel, Jeremy Drake, Vinay Kashyap, Peter Edmonds, Haldan Cohn,
  Phyllis Lugger and Adrienne Cool","Chandra Multi-wavelength Plane (ChaMPlane) Survey: Design and Initial
  Results","4 pages, 7 figures (in 8 files), Astronomishe Nachrichten, in press
  (Feb 2003). Proceedings of ""X-ray Surveys, in the Light of New
  Observatories"", 4-6 September, Santander, Spain. Higher resolution figures
  available at:
  http://hea-www.harvard.edu/ChaMPlane/papers/champlane-santander.pdf",,"10.1002/asna.200310015",,"astro-ph",,"  The Chandra Multiwavength Plane (ChaMPlane) Survey of the galactic plane
incorporates serendipitous sources from selected Chandra pointings in or near
the galactic plane (b < 12deg; >20 ksec; lack of bright diffuse or point
sources) to measure or constrain the luminosity function of low-luminosity
accretion sources in the Galaxy. The primary goal is to detect and identify
accreting white dwarfs (cataclysmic variables, with space density still
uncertain by a factor of >10-100), neutron stars and black holes (quiescent low
mass X-ray binaries) to constrain their space densities and thus origin and
evolution. Secondary objectives are to identify Be stars in high mass X-ray
binaries and constrain their space densities, and to survey the H-R diagram for
stellar coronal sources. A parallel optical imaging under the NOAO Long Term
Survey program provides deep optical images using the Mosaic imager on the CTIO
and KPNO 4-m telescopes. The 36arcmin X 36arcmin optical images (Halpha, R, V
and I) cover ~5X the area of each enclosed Chandra ACIS FOV, providing an
extended survey of emission line objects for comparison with Chandra.
Spectroscopic followup of optical counterparts is then conducted, thus far with
WIYN and Magellan. The X-ray preliminary results from both the Chandra and
optical surveys will be presented, including logN-logS vs. galactic position
(l,b) and optical idenifications.
","[{""version"":""v1"",""created"":""Mon, 25 Nov 2002 03:25:55 GMT""}]","2015-06-24"
"astro-ph/0211528","Jonathan E. Grindlay","Ping Zhao (1), Jonathan Grindlay (1), Peter Edmonds (1), Jaesub Hong
  (1), Johnathan Jenkins (1), Eric Schlegel (1), Haldan Cohn (2) and Phyllis
  Lugger (2)((1) Harvard-Smithsonian Center for Astrophysics, (2) Indiana
  University)","Initial Optical Results for the ChaMPlane Survey","1 page, 2 figures (in 3 files). Astronomische Nachrichten, in press
  (Feb 2003). Proceedings of ""X-ray Surveys, in the Light of New
  Observatories"", 4-6 September, Santander, Spain",,"10.1002/asna.200310075",,"astro-ph",,"  We provide a brief description of the optical survey being conducted under
the NOAO Long Term Surveys program in support of the Chandra Multiwavelength
Plane (ChaMPlane) Survey (see paper by Grindlay et al. in this Volume). A
representative photometry result is shown, along with spectroscopic followup.
","[{""version"":""v1"",""created"":""Mon, 25 Nov 2002 03:31:30 GMT""}]","2015-06-24"
"astro-ph/0211529","Jonathan E. Grindlay","Johnathan A Jenkins (Harvard), Tomohiko Narita (Holy Cross), Jonathan
  E. Grindlay (Harvard), Peter F. Bloser (GSFC), Carl Stahle (GSFC), Brad
  Parker (GSFC), and Scott Barthelmy (GSFC)","Background Measurements from Balloon-Borne CZT Detectors","9 pages, 7 figures (in 8 files). Presented at SPIE, Aug. 2002. To
  appear in Proc. SPIE, volume 4851. Errors in references and typos in text
  fixed",,"10.1117/12.461537",,"astro-ph",,"  We report detector characteristics and background measurements from two
prototype imaging CZT detectors flown on a scientific balloon payload in May
2001. The detectors are both platinum-contact 10mm x 10mm x 5mm CZT crystals,
each with a 4 $\times$ 4 array of pixels tiling the anode. One is made from
IMARAD horizontal Bridgman CZT, the other from eV Products high-pressure
Bridgman material. Both detectors were mounted side-by-side in a flip-chip
configuration and read out by a 32-channel IDE VA/TA ASIC preamp/shaper. We
enclosed the detectors in the same 40deg field-of-view collimator (comprisinga
graded passive shield and plastic scintillator) used in our previously-reported
September 2000 flight. I-V curves for the detectors are diode-like, and we find
that the platinum contacts adhere significantly better to the CZT surfaces than
gold to previous detectors. The detectors and instrumentation performed well in
a 20-hour balloon flight on 23/24 May 2001. Although we discovered a
significant instrumental background component in flight, it was possible to
measure and subtract this component from the spectra. The resulting IMARAD
detector background spectrum (from 30 keV to ~450 keV) reaches ~5 x 10^{-3}$
counts/cm^2 -sec-keV at 100 keV and has a power-law index of ~2 at high
energies. The eV Products detector has a similar spectrum, although there is
more uncertainty in the energy scale because of calibration complications.
","[{""version"":""v1"",""created"":""Mon, 25 Nov 2002 03:41:44 GMT""},{""version"":""v2"",""created"":""Tue, 3 Dec 2002 21:38:45 GMT""}]","2009-11-07"
"astro-ph/0211530","Ryoji Enomoto","C. Itoh, R. Enomoto, S. Yanagita, T. Yoshida, and CANGAROO-II
  collaboration","Detection of diffuse TeV gamma-ray emission from the nearby starburst
  galaxy NGC 253","4 pages, double colomn, 3 figures, aa.cls","Astron.Astrophys. 396 (2002) L1-L4","10.1051/0004-6361:20021565",,"astro-ph",,"  We report the TeV gamma-ray observations of the nearby normal spiral galaxy
NGC 253. At a distance of $\sim$2.5 Mpc, NGC 253 is one of the nearest
starburst galaxies. This relative closeness, coupled with the high star
formation rate in the galaxy, make it a good candidate TeV gamma-ray source.
Observations were carried out in 2000 and 2001 with the CANGAROO-II 10 m
imaging atmospheric Cerenkov telescope. TeV gamma-ray emission is detected at
the $\sim 11\sigma$ level with a flux of $(7.8 \pm 2.5)\times 10^{-12} {\rm
cm}^{-2} {\rm sec}^{-1}$ at energies $>$0.5 TeV. The data indicate that the
emission region is broader than the point spread function of our telescope.
","[{""version"":""v1"",""created"":""Mon, 25 Nov 2002 09:10:16 GMT""}]","2009-11-07"
"astro-ph/0211531","Grandi Paola","Paola Grandi, Matteo Guainazzi, Laura Maraschi, Raffaella Morganti,
  Roberto Fusco-Femiano, Mariateresa Fiocchi, Lucia Ballo and Fabrizio
  Tavecchio","Detection of X-ray Emission from the Eastern Radio Lobe of PICTOR A","8 pages, 5 figures; accepted for publication in ApJ","Astrophys.J. 586 (2003) 123-127","10.1086/367604",,"astro-ph",,"  The XMM-Newton satellite has revealed extended X-ray emission from the
eastern radio lobe of the Fanaroff-Riley II Radio Galaxy Pictor A. The X-ray
spectrum, accumulated on a region covering about half the entire radio lobe, is
well described by both a thermal model and a power law. The X-ray emission
could be thermal and produced by circum-galactic gas shocked by the expanding
radio lobe or, alternatively, by Inverse Compton (IC) of cosmic microwave
background photons by relativistic electrons in the lobe. The latter
possibility seems to be supported by the good agreement between the
lobe-average synchrotron radio index and the X-ray energy slope. However, if
this is the case, the magnetic field, as deduced from the comparison of the IC
X-ray and radio fluxes, is more than a factor 2 below the equipartition value
estimated in the same X-ray region.
","[{""version"":""v1"",""created"":""Mon, 25 Nov 2002 10:08:11 GMT""}]","2009-11-07"
"astro-ph/0211532","Massimo Persic","M.Persic (INAF/Oss. Astr. Trieste), Y.Rephaeli (Tel Aviv U., UCSD)","Starburst Galaxies and the X-Ray Background","10 pages, 5 figures; accepted for publication in A&A","Astron.Astrophys. 399 (2003) 9-18","10.1051/0004-6361:20021738",,"astro-ph",,"  Integrated X-ray spectra of an evolving population of starburst galaxies
(SBGs) are determined based on the observed spectra of local SBGs. In addition
to emission from hot gas and binary systems, our model SBG spectrum includes a
nonthermal component from Compton scattering of relativistic electrons by the
intense ambient far-IR and the (steeply evolving) CMB radiation fields. We use
these integrated spectra to calculate the levels of contribution of SBGs to the
cosmic X-ray background assuming that their density evolves as (1+z)^q up to a
maximal redshift of 5. We find that at energies <10 keV this contribution is at
a level of few percent for q up to 3, and in the range of 5%-15% for q ~ 4.5.
The Compton component is predicted to be the main SBG emission at high
energies, and its relative contribution gets progressively higher for
increasing redshift.
","[{""version"":""v1"",""created"":""Mon, 25 Nov 2002 10:49:59 GMT""}]","2009-11-07"
"astro-ph/0211533","Xavier Barcons","X. Barcons (IFCA/Csic-Uc), F.J. Carrera (IFCA/Csic-Uc), M.T. Ceballos
  (IFCA/Csic-Uc), S. Mateos (IFCA/Csic-Uc), M.J. Page (MSSL), I. Perez-Fournon
  (IAC), M.G. Watson (Leicester), and the XMM-Newton Survey Science Centre","The XMM-Newton Survey Science Centre Medium Sensitivity Survey","Proceedings of the ""X-ray surveys, in the light of the new
  observatories"" workshop, Astronomische Nachrichten, in the press (4 pages, 5
  eps figures, uses an.cls)",,"10.1002/asna.200310012",,"astro-ph",,"  We present preliminary results on the XMM-Newton Survey Science Centre medium
sensitivity survey (XMS), with 0.5-4.5 keV flux limit 2 10^{-14} erg/cm2/s. At
present, 19 fields have been examined with a total of 239 X-ray sources.
Identifications for about 2/3 of these reveal that type 1 AGN dominate, but
type 2 AGN, absorption-line galaxies and clusters as well as stars are also
present. We also discuss on a few X-ray selected Broad-Absorption-Line QSOs
found in this survey.
","[{""version"":""v1"",""created"":""Mon, 25 Nov 2002 12:21:45 GMT""}]","2015-06-24"
"astro-ph/0211534","Paolo Walter Cattaneo","Paolo Walter Cattaneo","Critical review of the results of the Homestake solar neutrino
  experiment","7 pages Latex, Submitted to A&A",,,,"astro-ph",,"  The radiochemical experiment in the Homestake mine was designed to measure
the solar neutrino flux through the detection of $^{37}Ar$ produced in the
reaction $\nu_e + ^{37}Cl \longrightarrow e^-+^{37}Ar$. The comparison between
this measurement and the theoretical predictions from solar models evidences a
substantial disagreement. I reanalyzed the data evidencing a bias with high
statistical significance and suggesting a new interpretation of the data.
","[{""version"":""v1"",""created"":""Mon, 25 Nov 2002 13:34:13 GMT""}]","2009-07-06"
"astro-ph/0211535","Igor G. Irastorza","I. G. Irastorza, A. Morales, C. E. Aalseth, F. T. Avignone III, R. L.
  Brodzinski, J. M. Carmona, S. Cebrian, E. Garcia, I. V. Kirpichnikov, A. A.
  Klimenko, G. Luzon, H. S. Miley, J. Morales, A. Ortiz de Solorzano, S. B.
  Osetrov, V. S. Pogosov, J. Puimedon, J. H. Reeves, M. L. Sarsa, A. A.
  Smolnikov, A. G. Tamanyan, A. A. Vasenko, S. I. Vasiliev, J. A. Villar","Status of IGEX dark matter search at Canfranc Underground Laboratory","6 pages, 3 figures, talk given at 4th International Workshop on the
  Identification of Dark Matter, York, September 2002",,"10.1142/9789812791313_0043",,"astro-ph hep-ex",,"  One IGEX 76Ge double-beta decay detector is currently operating in the
Canfranc Underground Laboratory in a search for dark matter WIMPs, through the
Ge nuclear recoil produced by the WIMP elastic scattering. In this talk we
report on the on-going efforts to understand and eventually reject the
background at low energy. These efforts have led to the improvement of the
neutron shielding and to partial reduction of the background, but still the
remaining events are not totally identified. A tritium contamination or
muon-induced neutrons are considered as possible sources, simulations and
experimental test being still under progress. According to the success of this
study we comment the prospects of the experiment as well as those of its future
extension, the GEDEON dark matter experiment.
","[{""version"":""v1"",""created"":""Mon, 25 Nov 2002 14:07:57 GMT""}]","2017-08-23"
"astro-ph/0211536","Vadim Burwitz","V. Burwitz, F. Haberl, R. Neuhaeuser, P. Predehl, J. Truemper, and
  V.E. Zavlin (Max-Planck-Institut fuer extraterrestrische Physik (MPE
  Garching))","The thermal radiation of the isolated neutron star RX J1856.5-3754
  observed with Chandra and XMM-Newton","6 pages, (including 3 figures) accepted for publication in Astronomy
  and Astrophysics (A&A)","Astron.Astrophys. 399 (2003) 1109-1114","10.1051/0004-6361:20021747",,"astro-ph",,"  We present results of the analysis of data collected in 57-ks XMM-Newton and
505-ks Chandra observations of the nearby ~= 120 pc isolated neutron star RX
J1856.5-3754. We confirm most of the statements made by Burwitz et al. (2001)
who discussed the original 55-ks Chandra data. Detailed spectral analysis of
the combined X-ray and optical data rules out the currently available
nonmagnetic light and heavy element neutron star atmosphere (LTE) models with
hydrogen, helium, iron and solar compositions. We find that strongly magnetized
atmosphere models also are unable to represent the data. The X-ray and optical
data show no spectral features and are best fitted with a two-component
blackbody model with kT_{bb,X}^{\infty} ~= 63.5 eV and R_{bb,X}^{\infty} ~=
4.4(d/120 pc) km for the hot X-ray emitting region, and kT_{bb,opt}^{\infty}<33
eV and R_{bb,opt}^{\infty}>17(d/120 pc) km for the rest of the neutron star
surface responsible for the optical flux. The large number of counts collected
with XMM-Newton allows us to reduce the upper limit on periodic variation in
the X-ray range down to 1.3% (at a 2\sigma confidence level) in the 10^{-3}-50
Hz frequency range. In an attempt to explain this small variability, we discuss
an one-component model with kT_{bb}^{\infty} ~= 63 eV and R_{bb}^{\infty} ~=
12.3(d/120 pc) km. This model requires a low radiative efficiency in the X-ray
domain, which may be expected if the neutron star has a condensed matter
surface.
","[{""version"":""v1"",""created"":""Mon, 25 Nov 2002 15:02:29 GMT""}]","2009-11-07"
"astro-ph/0211537","Heiko Hafok","H. Hafok and J. Stutzki","12CO(J=2->1) and CO(J=3->2) observations of Virgo Cluster spiral
  galaxies with the KOSMA telescope: global properties","accepted for publication in A&A, 9 pages, 8 figures","Astron.Astrophys. 398 (2003) 959-966","10.1051/0004-6361:20021692",,"astro-ph",,"  We present 12CO(J=2->1) and CO(J=3->2) observations of quiescent Virgo
Cluster spiral galaxies with the KOSMA 3m submm telescope. The beam sizes of
80"" at 345 GHz and 120"" at 230 GHz are well suited for the investigation of
global properties of Virgo Cluster galaxies. The observed sample was selected
based on previous 12CO(J=1->0) detections by Stark et al. (1986), performed
with the AT&T Bell Laboratory 7m telescope (beam size 100""). We were able to
detect 18 spiral galaxies in 12CO(2->1) and 16 in 12CO(3->2). Beam matched
observations of the lowest three 12CO transitions allow us to compare our
results with previous high spatial resolution studies of (moderate) starburst
galaxies and galactic core regions. We discuss the global excitation conditions
of the ISM in these quiescent spiral galaxies. The resulting CO (3--2)/(1--0)
integrated line ratios vary over a relatively narrow range of values from 0.35
to 0.14 (on a K km/s-scale) with increasing CO (2--1)/(1--0) ratio (from 0.5 to
1.1). The line ratios between the three lowest rotational transitions of CO
cannot be fitted by any radiative transfer model with a single source
component. A two-component model, assuming a warm, dense nuclear and a cold,
less dense disc component allows us to fit the observed line ratios for most of
the galaxies individually by selecting suitable parameters. The two-component
model, however, fails to explain the observed correlation of the line ratios.
This is due to a variation of the relative filling factor of the warm gas
alone, assuming a typical set of parameters for the two components common for
all galaxies.
","[{""version"":""v1"",""created"":""Mon, 25 Nov 2002 15:41:47 GMT""}]","2009-11-07"
"astro-ph/0211538","Natalya Orlova","N. V. Orlova, V. I. Korchagin, N. Kikuchi, S. M. Miyama and A. V.
  Moiseev","Application of the global modal approach to the spiral galaxies","4 pages, 1 figure, to appear in the proceedings of ""The Evoution of
  Galaxies. III. From simple approaches to self-consistent models"" (Kiel, July
  2002), G. Hensler et al. (eds.)","Astrophys.Space Sci. 284 (2003) 739-742","10.1023/A:1024040331638",,"astro-ph",,"  We have tested the applicability of the global modal approach in the density
wave theory of spiral structure for a sample of spiral galaxies with measured
axisymmetric background properties. We report here the results of the
simulations for four galaxies: NGC 488, NGC 628, NGC 1566, and NGC 3938. Using
the observed radial distributions for the stellar velocity dispersions and the
rotation velocities we have constructed the equilibrium models for the galactic
disks in each galaxy and implemented two kinds of stability analyses - the
linear global analysis and 2D-nonlinear simulations. In general, the global
modal approach is able to reproduce the observed properties of the spiral arms
in the galactic disks. The growth of spirals in the galactic disks can be
physically understood in terms of amplification by over-reflection at the
corotation resonance. Our results support the global modal approach as a
theoretical explanation of spiral structure in galaxies.
","[{""version"":""v1"",""created"":""Mon, 25 Nov 2002 15:32:11 GMT""}]","2009-11-07"
"astro-ph/0211539","Zsolt Bagoly","Z. Bagoly, I. Csabai, A. M\'esz\'aros, P. M\'esz\'aros, I. Horv\'ath,
  L. G. Bal\'azs and R. Vavrek","Gamma photometric redshifts for long gamma-ray bursts","accepted in A&A, 7 pages incl. 7 figures","Astron.Astrophys. 398 (2003) 919-926","10.1051/0004-6361:20021724",,"astro-ph",,"  It is known that the soft tail of the gamma-ray bursts' spectra show excesses
from the exact power-law dependence. In this article we show that this
departure can be detected in the peak flux ratios of different BATSE DISCSC
energy channels. This effect allows to estimate the redshift of the bright long
gamma-ray bursts in the BATSE Catalog. A verification of these redshifts is
obtained for the 8 GRB which have both BATSE DISCSC data and measured optical
spectroscopic redshifts. There is good correlation between the measured and
esti redshifts, and the average error is $\Delta z \approx 0.33$. The method is
similar to the photometric redshift estimation of galaxies in the optical
range, hence it can be called as ""gamma photometric redshift estimation"". The
estimated redshifts for the long bright gamma-ray bursts are up to $z \simeq
4$. For the the faint long bursts - which should be up to $z \simeq 20$ - the
redshifts cannot be determined unambiguously with this method.
","[{""version"":""v1"",""created"":""Mon, 25 Nov 2002 15:35:41 GMT""}]","2009-11-07"
"cond-mat/0211518","Serguei Dorogovtsev","S.N. Dorogovtsev, A.N. Samukhin","Mesoscopics and fluctuations in networks","3 pages, 1 figure","Phys. Rev. E 67, 037103 (2003)","10.1103/PhysRevE.67.037103",,"cond-mat.stat-mech",,"  We describe fluctuations in finite-size networks with a complex distribution
of connections, $P(k)$. We show that the spectrum of fluctuations of the number
of vertices with a given degree is Poissonian. These mesoscopic fluctuations
are strong in the large-degree region, where $P(k) \lesssim 1/N$ ($N$ is the
total number of vertices in a network), and are important in networks with
fat-tailed degree distributions.
","[{""version"":""v1"",""created"":""Sun, 24 Nov 2002 17:15:04 GMT""}]","2009-11-07"
"cond-mat/0211524","R. Mahendiran","R. Mahendiran, Y. Briead, M. Hervieu, B. Raveau, and P. Schiffer","Giant frequency dependence of dynamic freezing in nanocrystalline
  ferromagnetic LaCo0.5Mn0.5O3","16 pages with 4 figures",,"10.1103/PhysRevB.68.104402",,"cond-mat.mtrl-sci",,"  This paper is withdrawn now and soon will be replaced by a complete study on
LaCo0.5-MgxMn0.5O3.
","[{""version"":""v1"",""created"":""Mon, 25 Nov 2002 15:59:11 GMT""},{""version"":""v2"",""created"":""Sat, 7 Dec 2002 13:23:49 GMT""}]","2009-11-07"
"cond-mat/0211538","Indranil Paul","Indranil Paul and Gabriel Kotliar","Thermal Transport for Many Body Tight-Binding Models","Revtex, 9 pages including 1 figure","Phys. Rev. B 67, 115131 (2003)","10.1103/PhysRevB.67.115131",,"cond-mat.str-el",,"  We clarify some aspects of the calculation of the thermal transport
coefficients. For a tight-binding Hamiltonian we discuss the approximate nature
of the charge current and the thermal current obtained by Peierls substitution
which is also identical to the equation of motion technique. We address the
issue of choosing an appropriate basis for making the Peierls construction for
transport calculations. We propose a criteria for finding an optimum Wannier
basis where the difference between the exact current and the approximate one is
minimum. Using the equations of motion we derive the thermal current for a
generalized Hubbard model with density interaction. We identify a part which is
the contribution from the long range interactions to the heat current. For the
Hubbard model we derive expressions for the transport coefficients in the limit
of infinite dimensions.
","[{""version"":""v1"",""created"":""Sun, 24 Nov 2002 20:30:08 GMT""}]","2009-11-07"
"cond-mat/0211539","Wissam Al-Saidi","W. A. Al-Saidi and D. Stroud","Phase phonon spectrum and melting in a quantum rotor model with diagonal
  disorder","8 pages, 5 figures. To be published in Phys. Rev. B. Minor changes",,"10.1103/PhysRevB.67.024511",,"cond-mat.supr-con",,"  We study the zero-temperature ($T = 0$) quantum rotor model with on-site
disorder in the charging energy. Such a model may serve as an idealized
Hamiltonian for an array of Josephson-coupled small superconducting grains, or
superfluid $^4$He in a disordered environment. In the approximation of
small-amplitude phase fluctuations, the Hamiltonian maps onto a system of
coupled harmonic oscillators with on-site disorder. We study the effects of
disorder in this harmonic regime, using the coherent potential approximation
(CPA), obtaining the density of states and the lifetimes of the spin-wave-like
excitations for several choices of the parameters which characterize the
disorder. Finally, we estimate the parameters characterizing the $T = 0$
quantum melting of the phase order, using a suitable Lindemann criterion.
","[{""version"":""v1"",""created"":""Sun, 24 Nov 2002 21:04:45 GMT""},{""version"":""v2"",""created"":""Thu, 26 Dec 2002 19:44:12 GMT""}]","2009-11-07"
