"hep-th/0211239","Marcelo A. N. Botta Cantcheff","M. Botta Cantcheff (CBPF-GFT)","On the Group Structure of the Kalb-Ramond Gauge Symmetry","7 pages",,,,"hep-th math-ph math.MP",,"  The transformation properties of a Kalb-Ramond field are those of a gauge
field; however, it is not clear which is the group structure these
transformations are associated with. The purpose of this letter is to establish
a basic framework in order to clarify the group structure underneath the 2-form
gauge potential.
","[{""version"":""v1"",""created"":""Mon, 25 Nov 2002 13:34:40 GMT""}]","2007-05-23"
"hep-th/0211240","Jon Urrestilla","M. Pickles, J. Urrestilla","Nielsen-Olesen strings in Supersymmetric models","7 pages, 2 figues, uses revtex4; minor typos corrected; references
  added","JHEP 0301:052,2003","10.1088/1126-6708/2003/01/052",,"hep-th astro-ph hep-ph",,"  We investigate the behaviour of a model with two oppositely charged scalar
fields. In the Bogomol'nyi limit this may be seen as the scalar sector of N=1
supersymmetric QED, and it has been shown that cosmic strings form. We examine
numerically the model out of the Bogomol'nyi limit, and show that this remains
the case. We then add supersymmetry-breaking mass terms to the supersymmetric
model, and show that strings still survive.
  Finally we consider the extension to N=2 supersymmetry with
supersymmetry-breaking mass terms, and show that this leads to the formation of
stable cosmic strings, unlike in the unbroken case.
","[{""version"":""v1"",""created"":""Mon, 25 Nov 2002 14:48:35 GMT""},{""version"":""v2"",""created"":""Fri, 31 Jan 2003 12:01:02 GMT""}]","2014-11-18"
"hep-th/0211242","Michael Duetsch","Michael Duetsch, Klaus Fredenhagen","The Master Ward Identity and Generalized Schwinger-Dyson Equation in
  Classical Field Theory","56 pages. to appear in Commun. Math. Phys","Commun.Math.Phys. 243 (2003) 275-314","10.1007/s00220-003-0968-4","DESY 02-211, ESI: 1246","hep-th",,"  In the framework of perturbative quantum field theory a new, universal
renormalization condition (called Master Ward Identity) was recently proposed
by one of us (M.D.) in a joint paper with F.-M. Boas. The main aim of the
present paper is to get a better understanding of the Master Ward Identity by
analyzing its meaning in classical field theory. It turns out that it is the
most general identity for classical local fields which follows from the field
equations. It is equivalent to a generalization of the Schwinger-Dyson Equation
and is closely related to the Quantum Action Principle of Lowenstein and Lam.
  As a byproduct we give a self-contained treatment of Peierls' manifestly
covariant definition of the Poisson bracket.
","[{""version"":""v1"",""created"":""Mon, 25 Nov 2002 15:25:04 GMT""},{""version"":""v2"",""created"":""Fri, 27 Jun 2003 12:58:33 GMT""}]","2009-11-07"
"math-ph/0211061","Manuel Jaime Prata","M. J. Prata","Solid angle subtended by a cylindrical detector at a point source in
  terms of elliptic integrals","10 pages, 3 figures, LaTex. Typos corrected. References added.
  Accepted in Rad. Phys. Chem","Radiat. Phys. Chem. (2003) 67, 599-603.","10.1016/S0969-806X(03)00144-0",,"math-ph math.MP physics.ins-det",,"  The solid angle subtended by a right circular cylinder at a point source
located at an arbitrary position generally consists of a sum of two terms: that
defined by the cylindrical surface ($\Omega_{cyl}$) and the other by either of
the end circles ($\Omega_{circ}$). We derive an expression for $\Omega_{cyl}$
in terms of elliptic integrals of the first and third kinds and give similar
expressions for $\Omega_{circ}$ using integrals of the first and second kinds.
These latter can be used alternatively to an expression also in terms of
elliptic integrals, due to Philip A. Macklin and included as a footnote in
Masket (Rev. Sci. Instr., 28 (3), 191-197, 1957). The solid angle subtended by
the whole cylinder when the source is located at an arbitrary location can then
be calculated using elliptic integrals.
","[{""version"":""v1"",""created"":""Sun, 24 Nov 2002 19:01:11 GMT""},{""version"":""v2"",""created"":""Sun, 2 Feb 2003 20:26:34 GMT""}]","2009-11-07"
"math-ph/0211062","Pablo A. Ferrari","M. Cassandro, P.A. Ferrari, I. Merola, E. Presutti","Geometry of contours and Peierls estimates in d=1 Ising models","28 pages, 3 figures","J. Math. Phys. 46 (2005), no. 5, 053305, 22 pp.","10.1063/1.1897644",,"math-ph math.MP math.PR",,"  Following Fr\""ohlich and Spencer, we study one dimensional Ising spin systems
with ferromagnetic, long range interactions which decay as $|x-y|^{-2+\alpha}$,
$0\leq \alpha\leq 1/2$. We introduce a geometric description of the spin
configurations in terms of triangles which play the role of contours and for
which we establish Peierls bounds. This in particular yields a direct proof of
the well known result by Dyson about phase transitions at low temperatures.
","[{""version"":""v1"",""created"":""Mon, 25 Nov 2002 12:46:24 GMT""},{""version"":""v2"",""created"":""Thu, 28 Nov 2002 07:08:53 GMT""}]","2011-11-09"
"math/0211376","Michael T. Anderson","Michael T. Anderson, Atsushi Katsuda, Yaroslav Kurylev, Matti Lassas
  and Michael E. Taylor","Boundary regularity for the Ricci equation, geometric convergence, and
  Gel'fand's inverse boundary problem","TeX reformatting of v1, now 62pp. (Thanks Adrian.)",,,,"math.SP math.AP math.DG",,"  This paper explores and ties together three themes. The first is to establish
regularity of a metric tensor, on a manifold with boundary, on which there are
given Ricci curvature bounds, on the manifold and its boundary, and a Lipschitz
bound on the mean curvature of the boundary. The second is to establish
geometric convergence of a (sub)sequence of manifolds with boundary with such
geometrical bounds and also an upper bound on the diameter and a lower bound on
injectivity and boundary injectivity radius, making use of the first part. The
third theme involves the uniqueness and conditional stability of an inverse
problem proposed by Gel'fand making essential use of the results of the first
two parts.
","[{""version"":""v1"",""created"":""Sun, 24 Nov 2002 19:24:36 GMT""},{""version"":""v2"",""created"":""Mon, 2 Dec 2002 20:58:20 GMT""}]","2007-05-23"
"math/0211377","Inna Scherbak","I. Scherbak","A theorem of Heine-Stieltjes, the Wronski map, and Bethe vectors in the
  sl_p Gaudin model","Revised version; 24 pages",,,,"math.AG math.RT",,"  Heine and Stieltjes in their studies of linear second-order differential
equations with polynomial coefficients having a polynomial solution of a
preassigned degree, discovered that the roots of such a solution are the
coordinates of a critical point of a certain remarkable symmetric function,
[He], [St]. Their result can be reformulated in terms of the Schubert calculus
as follows: the critical points label the elements of the intersection of
certain Schubert varieties in the Grassmannian of two-dimensional subspaces of
the space of complex polynomials, [S1].
  In a hundred years after the works of Heine and Stieltjes, it was established
that the same critical points determine the Bethe vectors in the sl_2 Gaudin
model, [G]. Recently it was proved that the Bethe vectors of the sl_2 Gaudin
model form a basis of the subspace of singular vectors of a given weight in the
tensor product of irreducible sl_2-representations, [SV].
  In the present work we generalize the result of Heine and Stieltjes to linear
differential equations of order p>2. The function, which determines elements in
the intersection of corresponding Schubert varieties in the Grassmannian of
p-dimensional subspaces, turns out to be the very function which appears in the
sl_p Gaudin model.
  In the case when the space of states of the Gaudin model is the tensor
product of symmetric powers of the standard sl_p-representation, we prove that
the Bethe vectors form a basis of the subspace of singular vectors of a given
weight.
","[{""version"":""v1"",""created"":""Sun, 24 Nov 2002 20:03:22 GMT""},{""version"":""v2"",""created"":""Sat, 30 Aug 2003 08:35:22 GMT""}]","2007-05-23"
"math/0211378","Tetsushi Ito","Tetsushi Ito","Stringy Hodge numbers and p-adic Hodge theory","23 pages, AMS LaTeX, minor modifications, references added, to appear
  in Compositio Mathematica",,,,"math.NT math.AG",,"  The aim of this paper is to give an application of p-adic Hodge theory to
stringy Hodge numbers introduced by V. Batyrev for a mathematical formulation
of mirror symmetry. Since the stringy Hodge numbers of an algebraic variety are
defined by choosing a resolution of singularities, the well-definedness is not
clear from the definition. We give a proof of the well-definedness based on
arithmetic results such as p-adic integration and p-adic Hodge theory. Note
that another proof of the well-definedness was already obtained by V. Batyrev
himself by motivic integration. This is a generalization of the author's
earlier work in math.NT/0209269, where he treats only the smooth case.
","[{""version"":""v1"",""created"":""Sun, 24 Nov 2002 20:58:33 GMT""},{""version"":""v2"",""created"":""Wed, 27 Nov 2002 22:57:23 GMT""},{""version"":""v3"",""created"":""Thu, 31 Jul 2003 17:25:22 GMT""}]","2007-05-23"
"math/0211379","Marc Culler","Steven Boyer, Marc Culler, Peter B. Shalen, Xingru Zhang","Characteristic subsurfaces and Dehn filling","69 pages, 1 figure, plain TeX",,,,"math.GT",,"  Let M be a compact, orientable, irreducible, atoroidal 3-manifold with
boundary an incompressible torus. Techniques based on the characteristic
submanifold theory are used to bound the intersection number of two slopes
\alpha and \beta on the boundary of M. The method applies when \beta is the
boundary slope of an essential surface F that is not a semi-fiber (i.e. F is
not a fiber and does not split M into two twisted I-bundles), and the Dehn
filling M(\alpha) contains a suitable singular surface. One of the main results
is that if F is planar and if the fundamental group of M(\alpha) does not
contain a non-abelian free subgroup then the intersection number of \alpha and
\beta is at most 5.
","[{""version"":""v1"",""created"":""Mon, 25 Nov 2002 04:54:23 GMT""}]","2007-05-23"
"math/0211380","David Callan","David Callan","A recursive bijective approach to counting permutations containing
  3-letter patterns","28 pages",,,,"math.CO",,"  We present a method, illustrated by several examples, to find explicit counts
of permutations containing a given multiset of three letter patterns. The
method is recursive, depending on bijections to reduce to the case of a smaller
multiset, and involves a consideration of separate cases according to how the
patterns overlap. Specifically, we use the method (i) to provide combinatorial
proofs of Bona's formula {2n-3}choose{n-3} for the number of n-permutations
containing one 132 pattern and Noonan's formula 3/n {2n}choose{n+3} for one 123
pattern, (ii) to express the number of n-permutations containing exactly k 123
patterns in terms of ballot numbers for k<=4, and (iii) to express the number
of 123-avoiding n-permutations containing exactly k 132 patterns as a linear
combination of powers of 2, also for k<=4. The results strengthen the
conjecture that the counts are algebraic for all k.
","[{""version"":""v1"",""created"":""Mon, 25 Nov 2002 05:37:34 GMT""}]","2007-05-23"
"math/0211381","Claudio Meneghini","Claudio Meneghini","Renormalizing iterated elementary mappings and correspondences of C^2",,"Matematicki Vesnik, Vol. 56, No. 3-4, pp. 85-90 (2004)",,,"math.CV",,"  After proving a multi-dimensional extension of Zalcman's renormalization
lemma and considering maximality problems about dimensions, we find
renormalizing polynomial families for iterated elementary mappings, extending
this result to some kinds of correspondences (by means of 'algebraic'
renormalizing families) and to the family of the iterated mappings of an
automorphism of $\CI^2$ admitting a repulsive fixed point (by means of a family
of polunomial automorphisms composed with a Fatou-Bieberbach one). All families
will allow maximal-dimension renormalizations.
","[{""version"":""v1"",""created"":""Mon, 25 Nov 2002 08:43:49 GMT""},{""version"":""v2"",""created"":""Thu, 20 May 2004 11:00:29 GMT""}]","2008-06-16"
"math/0211382","Ladislav Sladecek","Ladislav Sladecek","Exact Feedback Linearization of Stochastic Control Systems","AMS-LaTeX, 43 pages, 6 postscript figures",,,,"math.OC",,"  This paper studies exact linearization methods for stochastic SISO affine
controlled dynamical systems. The systems are defined as vectorfield triplets
in Euclidean space. The goal is to find, for a given nonlinear stochastic
system, a combination of invertible transformations which transform the system
into a controllable linear form. Of course, for most nonlinear systems such
transformation does not exist.
  We are focused on linearization by state coordinate transformation combined
with feedback. The difference between Ito and Stratonovich systems is
emphasized. Moreover, we define three types of linearity of stochastic systems
-- g-linearity, sigma-linearity, and g sigma-linearity.
  Six variants of the stochastic exact linearization problem are studied. The
most useful problem -- the Ito-g sigma linearization is solved using the
correcting term, which proved to be a very useful tool for Ito systems. The
results are illustrated on a numerical example solved with help of symbolic
algebra.
","[{""version"":""v1"",""created"":""Mon, 25 Nov 2002 13:00:19 GMT""},{""version"":""v2"",""created"":""Mon, 25 Nov 2002 21:18:49 GMT""}]","2007-05-23"
"math/0211383","M. R. Grasselli","M. R. Grasselli and T. R. Hurd","A Monte Carlo method for exponential hedging of contingent claims","38 pages, 5 figures",,,,"math.PR math.OC q-fin.CP q-fin.PR",,"  Utility based methods provide a very general theoretically consistent
approach to pricing and hedging of securities in incomplete financial markets.
Solving problems in the utility based framework typically involves dynamic
programming, which in practise can be difficult to implement. This article
presents a Monte Carlo approach to optimal portfolio problems for which the
dynamic programming is based on the exponential utility function U(x)=-exp(-x).
The algorithm, inspired by the Longstaff-Schwartz approach to pricing American
options by Monte Carlo simulation, involves learning the optimal portfolio
selection strategy on simulated Monte Carlo data. It shares with the LS
framework intuitivity, simplicity and flexibility.
","[{""version"":""v1"",""created"":""Mon, 25 Nov 2002 14:22:35 GMT""}]","2008-12-10"
"math/0211384","Adam Parusinski","Adam Parusinski","Topology of Injective Endomorphisms of Real Algebraic Sets","16 pages, AMS-Latex",,,,"math.AG",,"  Using only basic topological properties of real algebraic sets and regular
morphisms we show that any injective regular self-mapping of a real algebraic
set is surjective. Then we show that injective morphisms between germs of real
algebraic sets define a partial order on the equivalence classes of these germs
divided by continuous semi-algebraic homeomorphisms. We use this observation to
deduce that any injective regular self-mapping of a real algebraic set is a
homeomorphism. We show also a similar local property. All our results can be
extended to arc-symmetric semi-algebraic sets and injective continuous
arc-symmetric morphisms, and some results to Euler semi-algebraic sets and
injective continuous semi-algebraic morphisms.
","[{""version"":""v1"",""created"":""Mon, 25 Nov 2002 15:34:26 GMT""}]","2007-05-23"
"math/0211385","Jakob Kellner","Jakob Kellner","Preserving Non-Null with Suslin+ forcing","14 pages","Arch. Math. Logic 45 (2006), no. 6, 649 -- 664","10.1007/s00153-006-0008-0",,"math.LO",,"  We introduce the notion of effective Axiom A and use it to show that some
popular tree forcings are Suslin+. We introduce transitive nep and present a
simplified version of Shelah's ""preserving a little implies preserving much"":
If I is a Suslin ccc ideal (e.g. Lebesgue-null or meager) and P is a transitive
nep forcing (e.g. P is Suslin+) and P doesn't make any I-positive Borel set
small, then P doesn't make any I-positive set small.
","[{""version"":""v1"",""created"":""Mon, 25 Nov 2002 15:04:38 GMT""},{""version"":""v2"",""created"":""Mon, 9 Dec 2002 10:57:53 GMT""},{""version"":""v3"",""created"":""Wed, 9 Feb 2005 17:21:31 GMT""}]","2009-09-29"
"math/0211386","Gavrilov","Lubomir Gavrilov, Iliya D. Iliev","Complete hyperelliptic integrals of the first kind and their
  non-oscillation",,"Trans. Amer. Math. Soc. vol. 356 (2004) 1185-1207",,,"math.DS",,"  Let $P(x)$ be a real polynomial of degree $2g+1$, $H=y^2+P(x)$ and
$\delta(h)$ be an oval contained in the level set $\{H=h\}$. We study complete
Abelian integrals of the form $$I(h)=\int_{\delta(h)} \frac{(\alpha_0+\alpha_1
x+... + \alpha_{g-1}x^{g-1})dx}{y}, h\in \Sigma,$$ where $\alpha_i$ are real
and $\Sigma\subset \R$ is a maximal open interval on which a continuous family
of ovals $\{\delta(h)\}$ exists. We show that the $g$-dimensional real vector
space of these integrals is not Chebyshev in general: for any $g>1$, there are
hyperelliptic Hamiltonians $H$ and continuous families of ovals
$\delta(h)\subset\{H=h\}$, $h\in\Sigma$, such that the Abelian integral $I(h)$
can have at least $[\frac32g]-1$ zeros in $\Sigma$. Our main result is Theorem
\ref{main} in which we show that when $g=2$, exceptional families of ovals
$\{\delta(h)\}$ exist, such that the corresponding vector space is still
Chebyshev.
","[{""version"":""v1"",""created"":""Mon, 25 Nov 2002 15:15:28 GMT""}]","2008-05-31"
"math/0211387","Olivier Raimond","Yves Le Jan and Olivier Raimond","Sticky flows on the circle","10 pages",,,,"math.PR",,"  The purpose of this note is to give an example of stochastic flows of
kernels, which naturally interpolates between the Arratia coalescing flow
associated with systems of coalescing independent Brownian particles on the
circle and the deterministic diffusion flow (actually, the results are given in
the slightly more general framework of symmetric Levy processes for which
points are not polar). The construction is performed using Dirichlet form
theory and the extension of De Finetti's theorem given in the previous work by
the authors. The sticky flows of kernels are associated with systems of sticky
independent Levy particles on the circle, for some fixed parameter of
stickyness. Some elementary asymptotic properties of the flow are also given.
","[{""version"":""v1"",""created"":""Mon, 25 Nov 2002 15:39:45 GMT""}]","2007-05-23"
"math/0211388","Nan-Kuo Ho","Nan-Kuo Ho, Chiu-Chu Melissa Liu","On the Connectedness of Moduli Spaces of Flat Connections over Compact
  Surfaces","24 pages","Canad.J. Math. 56 (2004), no. 6, 1228-1236",,,"math.SG",,"  We study the connectedness of the moduli space of gauge equivalence classes
of flat G-connections on a compact orientable surface or a compact
nonorientable surface for a class of compact connected Lie groups. This class
includes all the compact, connected, simply connected Lie groups, and some
non-semisimple classical groups including U(n) and Spin^C(n).
","[{""version"":""v1"",""created"":""Mon, 25 Nov 2002 15:57:50 GMT""},{""version"":""v2"",""created"":""Tue, 18 May 2004 06:49:27 GMT""}]","2007-05-23"
"nlin/0211043","Adam Doliwa","Adam Doliwa, Mariusz Bialecki, Pawel Klimczewski","The Hirota equation over finite fields. Algebro-geometric approach and
  multisoliton solutions","18 pages","J. Phys. A: Math. Gen. 36 (2003) 4827-4839","10.1088/0305-4470/36/17/309",,"nlin.SI math-ph math.MP nlin.CG",,"  We consider the Hirota equation (the discrete analog of the generalized Toda
system) over a finite field. We present the general algebro-geometric method of
construction of solutions of the equation. As an example we construct analogs
of the multisoliton solutions for which the wave functions and the
$\tau$-function can be found using rational functions. Within the class of
multisoliton solutions we isolate generalized breather-type solutions which
have no direct counterparts in the complex field case.
","[{""version"":""v1"",""created"":""Mon, 25 Nov 2002 12:36:54 GMT""}]","2009-11-07"
"nlin/0211044","Skokos Charalampos","C.Polymilis, G. Servizi, Ch. Skokos, G. Turchetti & M. N. Vrahatis","Locating periodic orbits by Topological Degree theory","9 pages, 8 figures, to appear in ""Proceedings of International
  Conference on Libration Point Orbits and Applications"" Aiguablava, Spain,
  June 2002",,,,"nlin.CD",,"  We consider methods based on the topological degree theory to compute
periodic orbits of area preserving maps. Numerical approximations of the
Kronecker integral and the application of Stenger's method allows us to compute
the value of the topological degree in a bounded region of the phase space. If
the topological degree of an appropriate set of equations has a non--zero
value, we know that there exists at least one periodic orbit of a given period
in the given region. We discuss in detail the problems that these methods face,
due to the existence of periodic orbits near the domain's boundary and due to
the discontinuity curves that appear in maps defined on the torus. We use the
characteristic bisection method for actually locating periodic orbits. We apply
this method successfully, both to the standard map, which is a map defined on
the torus, and to the beam--beam map which is a continuous map on the plane.
Specifically we find a large number of periodic orbits of periods up to 40,
which give us a clear picture of the dynamics of both maps.
","[{""version"":""v1"",""created"":""Mon, 25 Nov 2002 15:27:14 GMT""}]","2007-05-23"
"nucl-ex/0211026","Robert M. Willson","R. Willson (for the STAR Collaboration)","Measurement of Source Chaoticity for Particle Emission in Au+Au
  Collisions at $\sqrt{s_{NN}}$ = 130 GeV using 3-Particle HBT Correlations","4 pages, 4 figures. Plenary talk presented at Quark Matter 2002,
  Nantes, France, July 18-24, 2002","Nucl.Phys.A715:619-622,2003","10.1016/S0375-9474(02)01546-4",,"nucl-ex",,"  Data from the first physics run at the Relativistic Heavy-Ion Collider at
Brookhaven National Laboratory from the STAR experiment have been analyzed
using three-pion correlations to study whether pions are emitted independently
at freezeout. We have made a high-statistics measurement of the three-pion
correlation function and calculated the normalized three-particle correlator to
obtain a quantitative measurement of the degree of chaoticity in the freeze-out
environment.
","[{""version"":""v1"",""created"":""Mon, 25 Nov 2002 02:32:46 GMT""}]","2019-08-14"
"nucl-ex/0211027","Dan Bardayan","D.W. Bardayan, J.C. Batchelder, J.C. Blackmon, C.R. Brune, A.E.
  Champagne, J.A. Cizewski, T. Davinson, U. Greife, A.N. James, M. Johnson,
  R.L. Kozub, J.F. Liang, R.J. Livesay, Z. Ma, C.D. Nesaraja, D.C. Radford, D.
  Shapira, M.S. Smith, J. S. Thomas, P.J. Woods, E. Zganjar, and the Unirib
  Collaboration","The Single-Particle Structure of Neutron-Rich Nuclei of Astrophysical
  Interest at the Ornl Hribf","Proceedings of the Third International Conference on Fission and
  Properties of Neutron-Rich Nuclei",,"10.1142/9789812705211_0053",,"nucl-ex",,"  The rapid nuetron-capture process (r process) produces roughly half of the
elements heavier than iron. The path and abundances produced are uncertain,
however, because of the lack of nuclear strucure information on important
neutron-rich nuclei. We are studying nuclei on or near the r-process path via
single-nucleon transfer reactions on neutron-rich radioactive beams at ORNL's
Holifield Radioactive Ion Beam Facility (HRIBF). Owing to the difficulties in
studying these reactions in inverse kinematics, a variety of experimental
approaches are being developed. We present the experimental methods and initial
results.
","[{""version"":""v1"",""created"":""Mon, 25 Nov 2002 14:17:13 GMT""}]","2017-08-23"
"nucl-ex/0211028","James C. Dunlop","STAR-RICH Collaboration: A. Braem, D. Cozza, M. Davenport, G. De
  Cataldo, L. Dell Olio, D. DiBari, A. DiMauro, J. C. Dunlop, E. Finch, D.
  Fraissard, A. Franco, J. Gans, B. Ghidini, J. W. Harris, M. Horsley, G. J.
  Kunde, B. Lasiuk, Y. Lesenechal, R. D. Majka, P. Martinengo, A. Morsch, E.
  Nappi, G. Paic, F. Piuz, F. Posa, J. Raynaud, S. Salur, J. Sandweiss, J. C.
  Santiard, J. Satinover, E. Schyns, N. Smirnov, J. Van Beelen, T. D. Williams,
  Z. Xu","Identification of High $\rm p_{\perp}$ Particles with the STAR-RICH
  Detector","6 pages, 6 figures",,,,"nucl-ex",,"  The STAR-RICH detector extends the particle identification capapbilities of
the STAR experiment for charged hadrons at mid-rapidity. This detector
represents the first use of a proximity-focusing CsI-based RICH detector in a
collider experiment. It provides identification of pions and kaons up to 3
GeV/c and protons up to 5 GeV/c. The characteristics and performance of the
device in the inaugural RHIC run are described.
","[{""version"":""v1"",""created"":""Mon, 25 Nov 2002 14:35:01 GMT""}]","2012-08-27"
