"hep-ph/0211372","Matthew Martin","Matthew R. Martin (Carnegie Mellon University)","Radion Induced Baryogenesis","10 pages, 7 figures, minor revisions to conform with PRD version","Phys.Rev. D67 (2003) 083503","10.1103/PhysRevD.67.083503","CMU-HEP-02-15","hep-ph astro-ph",,"  Recent work in two brane Randall-Sundrum models has shown that the radion can
drive parametric amplification of particles on the TeV brane leading to a stage
of cosmology similar to preheating. We consider radion induced preheating as a
mechanism for electroweak scale baryogenesis and estimate the baryon to entropy
ratio for some regions of parameter space. We also predict an upper bound for
the radion mass which makes this baryogenesis mechanism testable. Finally, we
verify some assumptions with numerical calculations of the 1+1 dimensional
Abelian Higgs model.
","[{""version"":""v1"",""created"":""Mon, 25 Nov 2002 15:54:07 GMT""},{""version"":""v2"",""created"":""Sun, 13 Apr 2003 23:08:29 GMT""}]","2009-11-07"
"hep-ph/0211373","Laura Reina","S. Dawson (BNL), L.H. Orr (Rochester U.), L. Reina (FSU), D. Wackeroth
  (SUNY, Buffalo)","NLO QCD Predictions for associated t-tbar-h production in Hadronic
  Collisions","LaTeX, 5 pages, 6 figures, talk given by L.R. at RADCOR2002/Loops and
  Legs, Kloster Banz, Germany, Sep. 2002, to appear in the Proceedings","Nucl.Phys.Proc.Suppl. 116 (2003) 207","10.1016/S0920-5632(03)80171-8","BNL-HET-02/27, FSU-HEP-2002-1123, UB-HET-02-10","hep-ph",,"  We present the next-to-leading-order (NLO) QCD corrections to the inclusive
total cross section for the production of a Higgs boson in association with a
top anti-top quark pair within the Standard Model at the Tevatron and the LHC.
","[{""version"":""v1"",""created"":""Sun, 24 Nov 2002 21:36:11 GMT""}]","2009-11-07"
"hep-ph/0211374",,"Thomas G. Rizzo","Transverse Polarization Signatures of Extra Dimensions at Linear
  Colliders","22 pages, 6 figs. LaTex","JHEP 0302 (2003) 008","10.1088/1126-6708/2003/02/008","SLAC-PUB-9564","hep-ph",,"  If significant longitudinal polarization of both the electrons and positrons
becomes feasible at a future linear collider(LC), it may be possible to use
spin rotators to produce transversely polarized beams. Using the transverse
polarization of both beams, new azimuthal spin asymmetries can be formed which
will be sensitive probes for new physics beyond the Standard Model. Here we
demonstrate that these asymmetries are particularly sensitive to the exchange
of Kaluza-Klein towers of gravitons, or other spin-2 fields, that are predicted
to exist in higher dimensional theories which address the hierarchy problem.
These new asymmetries are shown to be able to extend the search reach for such
new physics by more than a factor of two, provide an additional tool for
isolating the signatures for spin-2 exchange up to mass scales in excess of
$10\sqrt s$, and can be used to help differentiate among the proposed solutions
to the hierarchy problem below the production threshold for new particles.
","[{""version"":""v1"",""created"":""Sun, 24 Nov 2002 22:30:07 GMT""}]","2009-11-07"
"hep-ph/0211375","Yasaman Farzan","Yasaman Farzan","Bounds on the Coupling of the Majoron to Light Neutrinos from Supernova
  Cooling","34 pages, Version to appear in Phys. Rev. D","Phys.Rev. D67 (2003) 073015","10.1103/PhysRevD.67.073015","SISSA/69/2002/EP, SLAC-PUB-9543","hep-ph astro-ph",,"  We explore the role of Majoron ($J$) emission in the supernova cooling
process, as a source of upper bound on neutrino-Majoron coupling.
  We show that the strongest upper bound on the coupling to $\nu_e$ comes from
the $\nu_e\nu_e \to J $ process in the core of a supernova. We also find bounds
on diagonal couplings of the Majoron to $\nu_{\mu(\tau)}\nu_{\mu(\tau)}$ and on
off-diagonal $\nu_e \nu_{\mu (\tau)}$ couplings in various regions of the
parameter space. We discuss the evaluation of the cross-section for
four-particle interactions ($\nu \nu \to JJ$ and $\nu J \to \nu J$). We show
that these are typically dominated by three-particle sub-processes and do not
give new independent constraints.
","[{""version"":""v1"",""created"":""Sun, 24 Nov 2002 22:52:37 GMT""},{""version"":""v2"",""created"":""Wed, 4 Dec 2002 19:34:17 GMT""},{""version"":""v3"",""created"":""Tue, 18 Mar 2003 00:13:05 GMT""}]","2016-09-06"
"hep-ph/0211376","A. Thomas","S.D. Bass (Innsbruck), R.J. Crewther (Adelaide, Durham), F.M. Steffens
  (Mackenzie University) and A.W. Thomas (Adelaide)","Matching functions for heavy particles","Revised version to be published in Physical Review D; added section
  with application to decoupling of heavy particles in non-asymptotically free
  theories","Phys.Rev.D68:096005,2003","10.1103/PhysRevD.68.096005","ADP-02-100/T538","hep-ph",,"  We introduce matching functions as a means of summing heavy-quark logarithms
to any order. Our analysis is based on Witten's approach, where heavy quarks
are decoupled one at a time in a mass-independent renormalization scheme. The
outcome is a generalization of the matching conditions of Bernreuther and
Wetzel: we show how to derive closed formulas for summed logarithms to any
order, and present explicit expressions for leading order and next-to-leading
order contributions. The decoupling of heavy quarks in theories lacking
asymptotic freedom is also considered.
","[{""version"":""v1"",""created"":""Sun, 24 Nov 2002 23:04:34 GMT""},{""version"":""v2"",""created"":""Fri, 19 Sep 2003 08:45:51 GMT""}]","2010-03-26"
"hep-ph/0211378","Anjan Joshipura","Anjan S. Joshipura, Saurabh D. Rindani and N. Nimai Singh","Predictive Framework with a Pair of Degenerate Neutrinos at a high scale","15 pages, including a postscript figure","Nucl.Phys.B660:362-372,2003","10.1016/S0550-3213(03)00236-0",,"hep-ph",,"  Radiative generation of the solar scale $\Delta_{\odot}$ is discussed in the
presence of leptonic CP violation. We assume that both the solar scale and
$U_{e3}$ are zero at a high scale and the weak radiative corrections generate
them. It is shown that all leptonic mass matrices satisfying these requirements
lead to a unique prediction $\Delta_{\odot} \cos 2\theta_{\odot}\approx 4
\delta_\tau \sin^2 \theta_A |m_{ee}|^2$ for the solar scale in terms of the
radiative correction parameter $\delta_\tau$, the physical solar (atmospheric)
mixing angles $\theta_{odot} (\theta_A)$ and the Majorana neutrino mass
$m_{ee}$ probed in neutrinoless double beta decay. This relation is independent
of the mixing matrix and CP-violating phases at the high scale. The presence of
CP-violating phases leads to dilution in the solar mixing angle defined at the
high scale. Because of this, bi-maximal mixing pattern at the high energy leads
to large but non-maximal solar mixing in the low-energy theory. An illustrative
model with this feature is discussed.
","[{""version"":""v1"",""created"":""Mon, 25 Nov 2002 09:10:55 GMT""}]","2014-11-17"
"hep-ph/0211379","Karl Schilcher","N. F. Nasrallah (Lebanese University), K. Schilcher (Universitaet
  Mainz)","Charged pion pair production by two photons from a chiral sum rule","4pages, 1 figure",,,"MZ-TH/02-28","hep-ph",,"  The cross-section for a charged pion pair production by two photons is
evaluated by using the low energy expression previously obtained from current
algebra and PCAC which involves an integral over a vector and axial-vector
spectral functions. Data on the latter obtained from tau-decay as measured by
the ALEPH collaboration is then inserted in the integral which is appropriately
modified in order to eliminate contributions near the cut in the duality
contour integral. The experimental behavior of the cross-section for
gamma-gamma into pi (+)-pi(-) is well reproduced at low energies.
","[{""version"":""v1"",""created"":""Mon, 25 Nov 2002 12:26:16 GMT""}]","2007-05-23"
"hep-ph/0211380","Robert Harlander","Robert Harlander, William Kilgore","Scalar and Pseudo-Scalar Higgs Production at Hadron Colliders","5+2 pages, 4 figures (9 ps-files). Talk given at RADCOR/Loops and
  Legs 2002, September 8-13, 2002, Kloster Banz, Germany",,"10.1016/S0920-5632(03)80163-9","BNL-HET-02/23, CERN-TH/2002-326","hep-ph",,"  The evaluation of the NNLO QCD corrections to the production of a scalar and
a pseudo-scalar Higgs boson is described.
","[{""version"":""v1"",""created"":""Mon, 25 Nov 2002 11:12:10 GMT""}]","2009-11-07"
"hep-ph/0211381","Gerhard Buchalla","Gerhard Buchalla (LMU Munich)","Radiative Corrections to Radiative B Decays: Exclusive B -> V gamma at
  NLO","Talk presented at 6th International Symposium on Radiative
  Corrections (RADCOR) and 6th Workshop on Elementary Particle Theory (Loops
  and Legs), 8-13 September 2002, Kloster Banz, Germany; 5 pages, 7 figures","Nucl.Phys.Proc.Suppl.116:264-268,2003","10.1016/S0920-5632(03)80181-0","LMU 02/15","hep-ph",,"  We discuss a model-independent framework for the analysis of the radiative
B-meson decays B -> K* gamma and B -> rho gamma based on the heavy-quark limit
of QCD. We present a factorization formula for the treatment of B -> V gamma
matrix elements involving charm (or up-quark) loops, which contribute at
leading power in Lambda_QCD/m_B to the decay amplitude. Annihilation topologies
are power suppressed, but still calculable in some cases. The framework of QCD
factorization is necessary to compute exclusive b -> s(d) gamma decays
systematically beyond the leading logarithmic approximation. Results to
next-to-leading order in QCD and to leading order in the heavy-quark limit are
given and phenomenological implications are discussed.
","[{""version"":""v1"",""created"":""Mon, 25 Nov 2002 12:15:04 GMT""}]","2009-10-09"
"hep-ph/0211382","Kiselev","V.V.Kiselev, O.P.Yushchenko","Possibility of Measuring the CP-Violation gamma-parameter in Decays of
  Xi_bc Baryons","15 pages, LaTeX file, 8 eps-figures, title changed, typos corrected",,"10.1016/j.physletb.2003.06.012",,"hep-ph",,"  The model-independent method based on the triangle ideology is implemented to
extract the CKM-matrix angle gamma in the decays of doubly heavy baryons
containing the charmed and beauty quarks. We analyze a color structure of
diagrams and conditions for reconstructing two reference-triangles by tagging
the flavor and CP eigenstates of neutral D mesons in the fixed exclusive
channels. The characteristic branching ratios are evaluated in the framework of
a potential model setting a parametric dependence on the hadronic matrix
elements for the decay rates.
","[{""version"":""v1"",""created"":""Mon, 25 Nov 2002 14:44:36 GMT""},{""version"":""v2"",""created"":""Mon, 17 Mar 2003 12:02:00 GMT""},{""version"":""v3"",""created"":""Mon, 28 Apr 2003 12:30:32 GMT""},{""version"":""v4"",""created"":""Mon, 26 May 2003 11:17:48 GMT""}]","2009-11-07"
"hep-ph/0211383","Pietro Faccioli","P. Faccioli (E.C.T., Trento)","A Systematic Study of the Chirality-Mixing Interactions in QCD","Substantial revision. Analysis extended, figures and references added",,,,"hep-ph hep-lat",,"  We present a study of the QCD interactions which do not conserve the
chirality of quarks. These non-perturbative forces are responsible for the
violation of the U_A(1) charge conservation and for the breaking of chiral
symmetry. From a systematic analysis we argue that the leading dynamical
sources chirality flips are the interactions mediated by topological vacuum
field fluctuations. We study in detail the contribution of instantons and
derive a simple model-independent semi-classical prediction. This result can be
used to check on the lattice if instantons are the dynamical mechanism
responsible both for chiral symmetry breaking and for the anomalous violation
of the U_A(1) charge conservation.
","[{""version"":""v1"",""created"":""Mon, 25 Nov 2002 13:46:12 GMT""},{""version"":""v2"",""created"":""Tue, 14 Jan 2003 10:41:22 GMT""}]","2007-05-23"
"hep-ph/0211384","Sven Heinemeyer","T. Hahn, S. Heinemeyer, G. Weiglein","Very Heavy MSSM Higgs-Boson Production at the Linear Collider","6 pages, 7 figures, invited talk at the RADCOR 2002 - Loops & Legs
  2002, Kloster Banz, Germany, Sept. 2002","Nucl.Phys.Proc.Suppl. 116 (2003) 336-340","10.1016/S0920-5632(03)80195-0","DCPT/02/124, IPPP/02/62, LMU 13/02, MPI-PhT/2002-72","hep-ph",,"  In the Minimal Supersymmetric Standard Model (MSSM) we present the
corrections to the heavy neutral CP-even Higgs-boson production in the
WW-fusion and Higgs-strahlung channel, e+e- -> \bar nu nu H, taking into
account all O(\alpha) corrections arising from loops of fermions and sfermions.
While the H boson shows decoupling behavior at the tree-level, we find
non-negligible loop corrections that can enhance the cross section
considerably. At a center-of-mass energy of \sqrt{s} = 1000 GeV, masses of up
to M_H <= 750 GeV are accessible at the LC in favorable regions of the MSSM
parameter space.
","[{""version"":""v1"",""created"":""Mon, 25 Nov 2002 13:41:19 GMT""}]","2009-11-07"
"hep-ph/0211385","Stefan Antusch","Stefan Antusch, Joern Kersten, Manfred Lindner, Michael Ratz","Dynamical Electroweak Symmetry Breaking by a Neutrino Condensate","18 pages, 8 figures; minor clarifications; version to appear in Nucl.
  Phys. B","Nucl.Phys. B658 (2003) 203-216","10.1016/S0550-3213(03)00188-3","TUM-HEP-491/02, DESY 02-208","hep-ph",,"  We show that the electroweak symmetry can be broken in a natural and
phenomenologically acceptable way by a neutrino condensate. Therefore, we
assume as particle content only the chiral fermions and gauge bosons of the
Standard Model and in addition right-handed neutrinos. A fundamental Higgs
field is absent. We assume instead that new interactions exist that can
effectively be described as four-fermion interactions and that can become
critical in the neutrino sector. We discuss in detail the coupled
Dirac-Majorana gap equations which lead to a neutrino condensate, electroweak
symmetry breaking and via the dynamical see-saw mechanism to small neutrino
masses. We show that the effective Lagrangian is that of the Standard Model
with massive neutrinos and with a composite Higgs particle. The mass
predictions are consistent with data.
","[{""version"":""v1"",""created"":""Mon, 25 Nov 2002 13:48:11 GMT""},{""version"":""v2"",""created"":""Tue, 22 Apr 2003 11:14:07 GMT""}]","2010-04-05"
"hep-ph/0211386","Asmita Mukherjee","A. Mukherjee and M. Vanderhaeghen","Helicity-dependent Twist-two and Twist-three Generalized Parton
  Distributions in Light-front QCD","References and appendix added, minor points clarified, accepted for
  publication in PRD","Phys.Rev. D67 (2003) 085020","10.1103/PhysRevD.67.085020","DO-TH 02/18, MKPH-T-02-21","hep-ph",,"  We investigate the helicity dependent twist-two and twist-three generalized
parton distributions in light-front Hamiltonian QCD for a massive dressed quark
target. Working in the kinematical region $\xi< x <1$, we obtain the splitting
functions for the evolutions of twist-two quark and gluon distributions in a
straightforward way. For the twist-three distribution, we find that all
contributions are proportional to the quark mass and thus the twist-three
distribution is directly related to the chiral symmetry breaking dynamics in
light-front QCD. We also show that the off-forward Wandzura-Wilczek relation is
violated in perturbative QCD for a massive dressed quark.We calculate the quark
mass correction to the WW relation in the off-forward case and show that it is
related to $h_1(x)$ in the forward limit. We extract the 'genuine twist three'
part of the matrix element in the forward case and verify the Burkhardt
Cottingham and Efremov-Leader-Teryaev sum rules.
","[{""version"":""v1"",""created"":""Mon, 25 Nov 2002 15:02:02 GMT""},{""version"":""v2"",""created"":""Fri, 13 Dec 2002 16:12:57 GMT""},{""version"":""v3"",""created"":""Mon, 3 Mar 2003 13:35:57 GMT""}]","2009-11-07"
"hep-ph/0211387","Shabelski","Yu. M. Shabelski","Ratios of Antibaryon/Baryon Yields in Heavy Ion Collisions","5 pages, 1 figure",,,,"hep-ph",,"  We discuss the model predictions for antibaryon/baryon production ratios in
high energy heavy ion collisions. The role of string junction mechanism of
baryon number transfer seems to be very important here and we consider some
quantitative results.
","[{""version"":""v1"",""created"":""Mon, 25 Nov 2002 14:12:57 GMT""}]","2007-05-23"
"hep-ph/0211388","Bodenm\""uller","W.A. Bardeen, H. Fritzch, M. Gell-Mann","Light-Cone Algebra, \pi^0 Decay and e^+ e^- Annihilation","11 pages. The paper was originally issued as a CERN preprint in 1972
  and published in a book edited by R. Gatto. The reference reads ""Light Cone
  Current Algebra, pi^0 Decay and e^+ e^- Annihilation"", (by W. A. Bardeen, H.
  Fritzsch and M. Gell-Mann, in ""Scale and Conformal Symmetry in Hadron
  Physics"", R. Gatto, ed., John Wiley and Sons (1973, pg. 139. After receiving
  many requests for reprints of this article describing som ideas which led to
  QCD, we decided to place the article in the e-Print archive",,,"LMU 2002","hep-ph",,"  The indication from deep inelastic electron scattering experiments at SLAC
that Bjorken scaling may really hold has motivated an extension of the
hypotheses of current algebra to what may be called light-cone current algebra.
","[{""version"":""v1"",""created"":""Mon, 25 Nov 2002 14:56:12 GMT""}]","2007-05-23"
"hep-th/0211221","Nemanja Kaloper","Andreas Albrecht, Nemanja Kaloper, Yong-Seon Song","Holographic Limitations of the Effective Field Theory of Inflation","4 pages, 1 .eps figure, revtex v2: conclusions unchanged, discussions
  clarified",,,,"hep-th astro-ph gr-qc hep-ph",,"  Holographic considerations may provide a glimpse of quantum gravity beyond
what is currently accessible by other means. Here we apply holography to
inflationary cosmology. We argue that the appropriate holographic bound on the
total entropy in the inflationary perturbations is given by the {\it
difference} of the area of the apparent horizon in the slow-roll approximation
and its exact value near the end of inflation. This implies that the effective
field theory of the inflaton weakly coupled to gravity requires modifications
below the Planck scale. For a conventional model of inflation this scale is of
order of the GUT scale, $\Lambda_{UV} \la 10^{16} GeV$, but could be
considerably lower. Signatures of such new physics could show up in the CMB.
","[{""version"":""v1"",""created"":""Sun, 24 Nov 2002 21:21:16 GMT""},{""version"":""v2"",""created"":""Fri, 17 Jan 2003 00:07:54 GMT""}]","2007-05-23"
"hep-th/0211222","Neil Constable","Neil R. Constable, Johanna Erdmenger, Zachary Guralnik and Ingo Kirsch","Intersecting D3-branes and Holography","46 pages, 5 figures, Latex, minor corrections to section 4.2, version
  published in Phys. Rev. D","Phys.Rev. D68 (2003) 106007","10.1103/PhysRevD.68.106007",,"hep-th",,"  We study a defect conformal field theory describing D3-branes intersecting
over two space-time dimensions. This theory admits an exact Lagrangian
description which includes both two- and four-dimensional degrees of freedom,
has (4,4) supersymmetry and is invariant under global conformal
transformations. Both two- and four-dimensional contributions to the action are
conveniently obtained in a two-dimensional (2,2) superspace. In a suitable
limit, the theory has a dual description in terms of a probe D3-brane wrapping
an AdS_3 x S^1 slice of AdS_5 x S^5. We consider the AdS/CFT dictionary for
this set-up. In particular we find classical probe fluctuations corresponding
to the holomorphic curve wy=c\alpha^{\prime}. These fluctuations are dual to
defect fields containing massless two-dimensional scalars which parameterize
the classical Higgs branch, but do not correspond to states in the Hilbert
space of the CFT. We also identify probe fluctuations which are dual to BPS
superconformal primary operators and to their descendants. A
non-renormalization theorem is conjectured for the correlators of these
operators, and verified to order g^2.
","[{""version"":""v1"",""created"":""Mon, 25 Nov 2002 14:43:05 GMT""},{""version"":""v2"",""created"":""Thu, 22 Jan 2004 15:18:20 GMT""}]","2009-11-07"
"hep-th/0211228","Jurg Kappeli","Bernard de Wit and J\""urg K\""appeli","On a gauge invariant description of soliton dynamics","8 pages, contribution to the proceedings of the 35th Ahrenshoop
  Symposium, 2002","Fortsch.Phys. 51 (2003) 690-696","10.1002/prop.200310084","SPIN-02/38, ITP-UU-02/60","hep-th",,"  We present important elements of a gauge and diffeomorphism invariant
formulation of the moduli space approximation to soliton dynamics. We argue
that explicit velocity-dependent modifications are determined entirely from
gauge and diffeomorphism invariance. We illustrate the formalism for the case
of a Yang-Mills theory on a curved spacetime background.
","[{""version"":""v1"",""created"":""Sun, 24 Nov 2002 18:05:55 GMT""}]","2016-09-06"
"hep-th/0211234","Bo Feng","Bo Feng and Yang-Hui He","Seiberg Duality in Matrix Models II","11 pages, comments added","Phys.Lett. B562 (2003) 339-346","10.1016/S0370-2693(03)00597-5","UPR-1022-T","hep-th",,"  In this paper we continue the investigation, within the context of the
Dijkgraaf-Vafa Programme, of Seiberg duality in matrix models as initiated in
hep-th/0211202, by allowing degenerate mass deformations. In this case, there
are some massless fields which remain and the theory has a moduli space. With
this illustrative example, we propose a general methodology for performing the
relevant matrix model integrations and addressing the corresponding field
theories which have non-trivial IR behaviour, and which may or may not have
tree-level superpotentials.
","[{""version"":""v1"",""created"":""Sun, 24 Nov 2002 18:25:52 GMT""},{""version"":""v2"",""created"":""Wed, 16 Apr 2003 22:16:41 GMT""}]","2009-11-07"
"hep-th/0211235","Yao-Zhong Zhang","Xiang-Mao Ding, Mark D. Gould, Courtney J. Mewton, Yao-Zhong Zhang","On osp(2|2) conformal field theories","LaTex file 20 pages; Title changed and modifications made","J.Phys.A36:7649-7665,2003","10.1088/0305-4470/36/27/316",,"hep-th cond-mat",,"  We study the conformal field theories corresponding to current superalgebras
$osp(2|2)^{(1)}_k$ and $osp(2|2)^{(2)}_k$. We construct the free field
realizations, screen currents and primary fields of these current superalgebras
at general level $k$. All the results for $osp(2|2)^{(2)}_k$ are new, and the
results for the primary fields of $osp(2|2)^{(1)}_k$ also seem to be new. Our
results are expected to be useful in the supersymmetric approach to Gaussian
disordered systems such as random bond Ising model and Dirac model.
","[{""version"":""v1"",""created"":""Mon, 25 Nov 2002 04:06:13 GMT""},{""version"":""v2"",""created"":""Fri, 21 Mar 2003 05:47:46 GMT""}]","2008-11-26"
"hep-th/0211236","Andrei Marshakov","Vladimir A. Kazakov, Andrei Marshakov","Complex Curve of the Two Matrix Model and its Tau-function","36 pages, 10 figures, TeX; final version appeared in special issue of
  J.Phys. A on Random Matrix Theory","J.Phys.A36:3107-3136,2003","10.1088/0305-4470/36/12/315","LPTENS-02/60, IHES/P/02/83, FIAN/TD-15/02, ITEP/TH-56/02","hep-th nlin.SI",,"  We study the hermitean and normal two matrix models in planar approximation
for an arbitrary number of eigenvalue supports. Its planar graph interpretation
is given. The study reveals a general structure of the underlying analytic
complex curve, different from the hyperelliptic curve of the one matrix model.
The matrix model quantities are expressed through the periods of meromorphic
generating differential on this curve and the partition function of the
multiple support solution, as a function of filling numbers and coefficients of
the matrix potential, is shown to be the quasiclassical tau-function. The
relation to softly broken N=1 supersymmetric Yang-Mills theories is discussed.
A general class of solvable multimatrix models with tree-like interactions is
considered.
","[{""version"":""v1"",""created"":""Mon, 25 Nov 2002 03:05:58 GMT""},{""version"":""v2"",""created"":""Thu, 28 Nov 2002 16:59:12 GMT""},{""version"":""v3"",""created"":""Tue, 10 Dec 2002 21:24:10 GMT""},{""version"":""v4"",""created"":""Mon, 31 Mar 2003 13:53:38 GMT""}]","2008-11-26"
"hep-th/0211237","Shao-Xia Chen","Shao-Xia Chen and Zhao-Yu Yang","Noncommutativity as a Possible Origin of the Ultrahigh Energy Cosmic Ray
  and the TeV-photon Paradoxes","9 pages, 1 figure","Mod.Phys.Lett. A18 (2003) 2913","10.1142/S0217732303012398","BIHEP-TH-2002-53","hep-th",,"  In this paper, we present a general modified dispersion relation derived from
q-deformed noncommutative theory and apply it to the ultrahigh energy cosmic
ray and the TeV-photon paradoxes--threshold anomalies. Our purpose is not only
trying to solve these puzzles by noncommutative theory but also to support
noncommutative theory through the coincidence of the region in the parameter
space for resolving the threshold anomalies with the one from the q-deformed
noncommutative theory.
","[{""version"":""v1"",""created"":""Mon, 25 Nov 2002 10:00:41 GMT""},{""version"":""v2"",""created"":""Tue, 26 Nov 2002 11:54:19 GMT""},{""version"":""v3"",""created"":""Wed, 28 May 2003 11:37:21 GMT""}]","2009-11-07"
"hep-th/0211238","Itzhak Bars","Itzhak Bars","MSFT : Moyal Star Formulation of String Field Theory","22 pages, LaTeX. v3 minor corrections",,,,"hep-th",,"  The Moyal star formulation of string field theory is reviewed. The various
versions of the star product are compared and related to one another in a
regulated theory that resolves associativity anomalies. A summary of
computations and challenges is given.
","[{""version"":""v1"",""created"":""Mon, 25 Nov 2002 12:01:06 GMT""},{""version"":""v2"",""created"":""Tue, 14 Jan 2003 03:33:15 GMT""},{""version"":""v3"",""created"":""Sat, 22 May 2004 18:45:14 GMT""}]","2007-05-23"
