"astro-ph/0209177","Valentina Luridiana","V. Luridiana (IAA, Granada, Spain)","The primordial Helium abundance","8 pages, 1 figure. Moriond Latex style. To be published in the
  proceedings of the XXXVIIth Moriond Astrophysics Meeting ""The Cosmological
  Model"", Les Arcs, France, March 16-23, 2002","Proceedings of the XXXVIIth Rencontres de Moriond: 'The
  cosmological model', eds. Y. Giraud-H\'eraud, C. Magneville, J. Tran Thanh
  Van, The Gioi Publishers (Vietnam), p. 159 (2003)",,,"astro-ph",,"  The primordial abundance of 4He, Y_P, is one of the hottest themes in
present-day astronomy, mostly due to its cosmological relevance. The
disagreement between different determinations has been currently reduced to the
1-2 percent level, but these differences are still large enough to have deep
implications for Big-Bang nucleosynthesis. It is therefore crucial to estimate
precisely the uncertainties involved in the measurement of Y_P. Here, I review
the methods used in the determination of Y_P and the related uncertainties. I
also discuss some recent results, and emphasize the assumptions underlying the
differences among them.
","[{""version"":""v1"",""created"":""Tue, 10 Sep 2002 09:07:31 GMT""}]","2007-05-23"
"astro-ph/0209178","Jerome Bouvier","J. Bouvier, E. Moraux, J.R. Stauffer, D. Barrado y Navascues, J.-C.
  Cuillandre","The lower mass function of young open clusters","8 pages, 4 figures","IAU Symp.211 ""Brown Dwarfs"", E.L. Martin ed., 2002",,,"astro-ph",,"  We report new estimates for the lower mass function of 5 young open clusters
spanning an age range from 80 to 150 Myr. In all studied clusters, the mass
function across the stellar/substellar boundary (~0.072 Mo) and up to 0.4 Mo is
consistent with a power-law with an exponent alpha of -0.5 +/- 0.1, i.e., dN/dM
~ M**(-0.5).
","[{""version"":""v1"",""created"":""Tue, 10 Sep 2002 09:40:07 GMT""}]","2007-05-23"
"astro-ph/0209179","Suzanne Aigrain","S. Aigrain (IoA, Cambridge, UK), F. Favata (ESA/ESTEC, Noordwijk, The
  Netherlands)","A modified version of the Gregory-Loredo method for Bayesian periodic
  signal detection","12 pages, 11 figures, uses bibtex and the macros aa.cls and aa.bst.
  Accepted for publication in Astronomy and Astrophysics","Astron.Astrophys. 395 (2002) 625-636","10.1051/0004-6361:20021290",,"astro-ph",,"  The detection of planetary transits in stellar photometric light-curves is
poised to become the main method for finding substantial numbers of terrestrial
planets. The French-European mission COROT (foreseen for launch in 2005) will
perform the first search on a limited number of stars, and larger missions
Eddington (from ESA) and Kepler (from NASA) are planned for launch in 2007.
Transit signals from terrestrial planets are small (Delta_F/F approx 10^{-4}),
short (Delta_t approx 10 hours) dips, which repeat with periodicity of a few
months, in time series lasting up to a few years. The reliable and automated
detection of such signals in large numbers of light curves affected by
different sources of noise is a statistical and computational challenge. We
present a novel algorithm based on a Bayesian approach. The algorithm is based
on the Gregory-Loredo method originally developed for the detection of pulsars
in X-ray data. In the present paper the algorithm is presented, and its
performance on simulated data sets dominated by photon noise is explored. In an
upcoming paper the influence of additional noise sources (such as stellar
activity) will be discussed.
","[{""version"":""v1"",""created"":""Tue, 10 Sep 2002 10:23:17 GMT""}]","2009-11-07"
"astro-ph/0209180","Giorgio Savini","E.S. Battistelli, M. De Petris, L. Lamagna, R. Maoli, F. Melchiorri,
  E. Palladino, G. Savini, P.D. Mauskopf, A. Orlando","Far infrared polarimeter with very low instrumental polarization","9 pages, 5 figures, to appear in SPIE conference proceedings
  ""Astronomical telescopes and instrumentation""",,"10.1117/12.458224",,"astro-ph",,"  After a short analysis of the main problems involved in the construction of a
Far Infrared polarimeter with very low instrumental noise, we describe the
instrument that will be employed at MITO telescope to search for calibration
sources and investigate polarization near the CMB anisotropy peaks in the next
campaign (Winter 2002-03).
","[{""version"":""v1"",""created"":""Tue, 10 Sep 2002 11:06:57 GMT""}]","2009-11-07"
"astro-ph/0209181","Mauro Sereno","M. Sereno, E. Piedipalumbo, M.V. Sazhin","Effects of quintessence on observations of Type Ia SuperNovae in the
  clumpy Universe","11 pages, 6 figures","Mon.Not.Roy.Astron.Soc. 335 (2002) 1061","10.1046/j.1365-8711.2002.05687.x",,"astro-ph",,"  We discuss the amplification dispersion in the observed luminosity of
standard candles, like supernovae (SNe) of type Ia, induced by gravitational
lensing in a Universe with dark energy (quintessence). We derive the main
features of the magnification probability distribution function (pdf) of SNe in
the framework of on average Friedmann-Lemaitre-Robertson-Walker (FLRW) models
for both lensing by large-scale structures and compact objects. The
magnification pdf is strongly dependent on the equation of state, $w_Q$, of the
quintessence. The dispersion increases with the redshift of the source and is
maximum for dark energy with very large negative pressure; the effects of
gravitational lensing on the magnification pdf, i.e. the mode biased towards
de-amplified values and the long tail towards large magnifications, are reduced
for both microscopic DM and quintessence with an intermediate $w_Q$. Different
equations of state of the dark energy can deeply change the dispersion in
amplification for the projected observed samples of SNe Ia by future space-born
missions. The ""noise"" in the Hubble diagram due to gravitational lensing
strongly affects the determination of the cosmological parameters from SNe
data. The errors on the pressureless matter density parameter, $\Omega_M$, and
on $w_Q$ are maximum for quintessence with not very negative pressure. The
effect of the gravitational lensing is of the same order of the other
systematics affecting observations of SNe Ia. Due to the lensing by large-scale
structures, in a flat Universe with $\Omega_M =0.4$, at $z=1$ a cosmological
constant ($w_Q=-1$) can be interpreted as dark energy with $w_Q <-0.84$ (at
2-$\sigma$ confidence limit).
","[{""version"":""v1"",""created"":""Tue, 10 Sep 2002 12:32:21 GMT""}]","2009-11-07"
"astro-ph/0209182","Andy Biggs","A. D. Biggs (1,2), O. Wucknitz (3,1), R. W. Porcas (4), I. W. A.
  Browne (1), N. J. Jackson (1), S. Mao (1) and P. N. Wilkinson (1) ((1)
  Jodrell Bank, (2) JIVE, (3) University of Hamburg, (4) MPIfR)","Global 8.4-GHz VLBI observations of JVAS B0218+357","10 pages, 5 figures, accepted for publication in MNRAS","Mon.Not.Roy.Astron.Soc. 338 (2003) 599","10.1046/j.1365-8711.2003.06050.x",,"astro-ph",,"  In this paper we present new observations of the gravitational lens system
JVAS B0218+357 made with a global VLBI network at a frequency of 8.4 GHz. Our
maps have an rms noise of 30 microJy/beam and with these we have been able to
image much of the extended structure of the radio jet in both the A and B
images at high resolution (~1 mas). The main use of these maps will be to
enable us to further constrain the lens model for the purposes of H0
determination. We are able to identify several sub-components common to both
images with the expected parity reversal, including one which we identify as a
counter-jet. We have not been successful in detecting either the core of the
lensing galaxy or a third image. Using a model of the lensing galaxy we have
back-projected both of the images to the source plane and find that they agree
well. However, there are small, but significant, differences which we suggest
may arise from multi-path scattering in the ISM of the lensing galaxy. We also
find an exponent of the radial mass distribution of approximately 1.04, in
agreement with lens modelling of published 15-GHz VLBI data. Polarisation maps
of each image are presented which show that the distributions of polarisation
across images A and B are different. We suggest that this results from Faraday
rotation and associated depolarisation in the lensing galaxy.
","[{""version"":""v1"",""created"":""Tue, 10 Sep 2002 15:08:07 GMT""}]","2007-05-23"
"astro-ph/0209183","Volker Springel","Lars Hernquist (Harvard-CfA), Volker Springel (MPA)","An analytical model for the history of cosmic star formation","17 pages, 13 figures, submitted to MNRAS","Mon.Not.Roy.Astron.Soc.341:1253,2003","10.1046/j.1365-8711.2003.06499.x",,"astro-ph",,"  We use simple analytic reasoning to identify physical processes that drive
the evolution of the cosmic star formation density in cold dark matter
universes. Based on our analysis, we formulate a model to characterise the
redshift dependence of the star formation history and compare it to results
obtained from a set of hydrodynamic simulations which include star formation
and feedback. At early times, densities are sufficiently high and cooling times
sufficiently short that abundant quantities of star-forming gas are present in
all dark matter halos that can cool by atomic processes. Consequently, the star
formation density generically rises exponentially as z decreases, independent
of the details of the physical model for star formation, but dependent on the
normalisation and shape of the cosmological power spectrum. This part of the
evolution is dominated by gravitationally driven growth of the halo mass
function. At low redshifts, densities decline as the universe expands to the
point that cooling is inhibited, limiting the amount of star-forming gas
available. We find that in this regime the star formation rate scales
approximately in proportion to the cooling rate within halos. We derive
analytic expressions for the full star formation history and show that they
match our simulation results to better than ~10%. Using various approximations,
we reduce the expressions to a simple analytic fitting function that can be
used to compute global cosmological quantities that are directly related to the
star formation history. As examples, we consider the integrated stellar
density, the supernova and gamma-ray burst rates observable on Earth, the metal
enrichment history of the Universe, and the density of compact objects.
(abridged)
","[{""version"":""v1"",""created"":""Tue, 10 Sep 2002 12:50:17 GMT""}]","2009-07-09"
"astro-ph/0209184","Dafydd Wyn Evans","D. W. Evans, M. J. Irwin, L. Helmer","The Carlsberg Meridian Telescope CCD Drift Scan Survey","13 pages 11 Figures (PS) Accepted for publication in A&A. The
  catalogue can be found at http://www.ast.cam.ac.uk/~dwe/SRF/cmc12/","Astron.Astrophys. 395 (2002) 347-356","10.1051/0004-6361:20021285",,"astro-ph",,"  This paper contains the general data reduction methods used in processing the
data from the Carlsberg Meridian Telescope CCD Drift Scan Survey. An efficient
method to calibrate the fluctuations in the positions of the images caused by
atmospheric turbulence is described. The external accuracy achieved is 36 mas
in right ascension and declination. A description of the recently released
catalogue is given.
","[{""version"":""v1"",""created"":""Tue, 10 Sep 2002 14:06:36 GMT""}]","2009-11-07"
"astro-ph/0209185","Jordi Jose","Jordi Jose (Dept. Fisica i Enginyeria Nuclear, Universitat Politecnica
  de Catalunya, and Institut d'Estudis Espacials de Catalunya, Barcelona,
  Spain)","Nuclear Ashes: Reviewing Thirty Years of Nucleosynthesis in Classical
  Novae","10 pages. To appear in ""Classical Nova Explosions"", M. Hernanz and J.
  Jose (eds.), AIP","AIP Conf.Proc. 637 (2003) 104-113","10.1063/1.1518186",,"astro-ph",,"  One of the observational evidences in support of the ""thermonuclear runaway
model"" for the classical nova outburst relies on the accompanying
nucleosynthesis. In this paper, we stress the relevant role played by
nucleosynthesis in our understanding of the nova phenomenon by constraining
models through a comparison with both the atomic abundance determinations from
the ejecta and the isotopic ratios measured in presolar grains of a likely nova
origin. Furthermore, the endpoint of nova nucleosynthesis provides hints for
the understanding of the mixing process responsible for the enhanced
metallicities found in the ejecta, and reveals also information on the
properties of the underlying white dwarf (mass, luminosity...).
  We discuss first the interplay between nova outbursts and the Galactic
chemical abundances: Classical nova outbursts are expected to be the major
source of 13C, 15N and 17O in the Galaxy, and to contribute to the abundances
of other species with A < 40, such as 7Li or 26Al. We describe the main nuclear
path during the course of the explosion, with special emphasis on the synthesis
of radioactive species, of particular interest for the gamma-ray output
predicted from novae (7Li, 18F, 22Na, 26Al). An overview of the recent
discovery of presolar nova candidate grains, as well as a discussion of the
role played by nuclear uncertainties associated with key reactions of the
NeNa-MgAl and Si-Ca regions, are also given.
","[{""version"":""v1"",""created"":""Tue, 10 Sep 2002 14:16:06 GMT""}]","2009-11-07"
"astro-ph/0209186","Juri Poutanen","Juri Poutanen (University of Oulu), Andrzej A. Zdziarski (N.
  Copernicus Astronomical Center)","Radiative Processes in Microquasars","6 pages; figures in color; Proceedings of the 4th Microquasar
  Workshop, eds. Ph. Durouchoux, Y. Fuchs and J. Rodriguez, published by the
  Center for Space Physics: Kolkata",,,,"astro-ph",,"  Recent advances in the X-ray and soft gamma-ray observations of accreting
black holes and microquasars, in particular, are reviewed. The radiative
processes responsible for the emission are discussed briefly. The hybrid
thermal/nonthermal Comptonization model is shown to describe well the observed
broad-band spectra. We also comments on alternative phenomenological and
physical models that are used to describe the X/gamma-ray spectra of accreting
black holes. Among those are the ""standard"" model (i.e. disk-blackbody plus a
power-law), pexrav, bulk motion Comptonization, and synchrotron emission from
the jet.
","[{""version"":""v1"",""created"":""Tue, 10 Sep 2002 14:48:44 GMT""},{""version"":""v2"",""created"":""Wed, 11 Sep 2002 11:28:13 GMT""}]","2007-05-23"
"astro-ph/0209187","Ronald Mennickent","R.E. Mennickent, G. Pietrzynski, W. Gieren","Light Curve Analysis of Be Star Candidates in the Small Magellanic Cloud","3 pages, 7 figures, to be published in ASP Conference Series,
  Interplay between periodic, cyclic and stochastic variability in selected
  areas of the H-R diagram, C. Sterken (ed.)",,,,"astro-ph",,"  The recent discovery, based on a search of public OGLE data, of Be star
candidates in the Small Magellanic Cloud showing spectacular photometric
variations (Mennickent et al. 2002), has motivated further analysis of their
light curves. Here we report the results of a statistical study of the light
curves of Type-1, Type-2 and Type-3 stars. Type-3 stars show a bimodal period
distribution, with a main, broad peak, between 20 and 130 days, and a narrower,
secondary peak, between 140 and 210 days. We also find that, among Type-3
stars, the maximum amplitude of oscillation correlates with the system
luminosity, in the sense that only low luminosity systems show large amplitude
oscillations. In general, the amplitude of these oscillations tends to increase
with the photometric period. A parametric study shows no correlation between
the amplitude, duration and asymmetry of Type-1 outbursts, and amplitude of
Type-2 jumps, with the available stellar photometric parameters.
","[{""version"":""v1"",""created"":""Tue, 10 Sep 2002 14:50:05 GMT""},{""version"":""v2"",""created"":""Fri, 13 Sep 2002 16:56:07 GMT""}]","2007-05-23"
"astro-ph/0209188","Stephen Kane","Stephen R. Kane, Keith Horne, Rachel A. Street, Don L. Pollacco, David
  James, Yiannis Tsapras, Andrew Collier Cameron","Recent Results from the Wide Angle Search for Planets (WASP) Prototype","4 pages, 6 figures, To appear in the ASP Conference Series:
  ""Scientific Frontiers in Research on Extrasolar Planets"", eds. D. Deming and
  S. Seager",,,,"astro-ph",,"  WASP0 is a prototype for what is intended to become a collection of WASPs
whose primary aim is to detect transiting extra-solar planets across the face
of their parent star. The WASP0 instrument is a wide-field (9-degree) 6.3cm
aperture F/2.8 Apogee 10 CCD camera (2Kx2K chip, 16-arcsec pixels). The camera
is mounted piggy-back on a commercial 10-inch Meade telescope. We present some
recent results from the WASP camera, including observations from La Palma of
the known transiting planet around HD 209458 and preliminary analysis of other
stars located in the same field. We also outline further problems which
restrict the ability to achieve photon limited precision with a wide-field
commercial CCD.
","[{""version"":""v1"",""created"":""Tue, 10 Sep 2002 15:02:25 GMT""}]","2007-05-23"
"cond-mat/0209191","Todor M. Mishonov","T. M. Mishonov, J. O. Indekeu, and E. S. Penev","Superconductivity of overdoped cuprates: the modern face of the
  ancestral two-electron exchange","34 pages, 3 figures, 152 references (updated; more than 250
  publications cited), LaTeX2e; Appendix added. This is the final cond-mat
  version (v4) that takes into account many comments by readers after the paper
  has been published","J. Phys.: Condens. Matter 15, 4429-4456 (2003)","10.1088/0953-8984/15/25/312",,"cond-mat.supr-con cond-mat.str-el",,"  The single-site two-electron exchange amplitude J_sd between the Cu 4s and Cu
3d_{x^2-y^2} states is found to be the pairing mechanism of high-T_c overdoped
cuprates. The noninteracting part of the Hamiltonian spans the copper Cu 4s, Cu
3d_{x^2-y^2} and oxygen O 2p_x and O 2p_y states. Within the standard BCS
treatment an explicit expression for the momentum dependence of the gap Delta_p
is derived and shown to fit the angle-resolved photoemission spectroscopy
(ARPES) data. The basic thermodynamic and electrodynamic properties of the
model (specific heat C(T), London penetration depth lambda(T)) are analytically
derived. These are directly applicable to cuprates without complicating
structural accessories (chains, double CuO_2 planes, etc.). We advocate that
the pairing mechanism of overdoped and underdoped cuprates is the same, as T_c
displays smooth doping dependence. Thus, a long-standing puzzle in physics is
possibly solved.
","[{""version"":""v1"",""created"":""Mon, 9 Sep 2002 16:54:15 GMT""},{""version"":""v2"",""created"":""Tue, 6 May 2003 18:38:37 GMT""},{""version"":""v3"",""created"":""Tue, 6 May 2003 20:30:17 GMT""},{""version"":""v4"",""created"":""Sun, 16 Apr 2006 02:30:26 GMT""}]","2007-05-23"
"cond-mat/0209208","David Vanderbilt","Lixin He, J.B. Neaton, David Vanderbilt, and Morrel H. Cohen
  (Department of Physics and Astronomy, Rutgers University)","Lattice dielectric response of CdCu{3}Ti{4}O{12} and of
  CaCu{3}Ti{4}O{12} from first principles","5 pages; uses REVTEX macros. Also available at
  http://www.physics.rutgers.edu/~dhv/preprints/lh_cdct/index.html",,"10.1103/PhysRevB.67.012103",,"cond-mat.mtrl-sci",,"  Structural, vibrational, and lattice dielectric properties of
CdCu{3}Ti{4}O{12} are studied using density-functional theory within the local
spin-density approximation, and the results are compared with those computed
previously for CaCu{3}Ti{4}O{12}. Replacing Ca with Cd is found to leave many
calculated quantities largely unaltered, although significant differences do
emerge in zone-center optical phonon frequencies and mode effective charges.
The computed phonon frequencies of CdCu{3}Ti{4}O{12} are found to be in
excellent agreement with experiment, and the computed lattice contribution to
the intrinsic static dielectric constant (~60) also agrees exceptionally well
with a recent optical absorption experiment. These results provide further
support for a picture in which the lattice dielectric response is essentially
conventional, suggesting an extrinsic origin for the anomalous low-frequency
dielectric response recently observed in both materials.
","[{""version"":""v1"",""created"":""Mon, 9 Sep 2002 19:23:03 GMT""}]","2009-11-07"
"cond-mat/0209217","Anatoly Smirnov","Anatoly Yu. Smirnov","Decoherence and Relaxation of a Quantum Bit in the Presence of Rabi
  Oscillations","14 pages; misprints corrected","Phys.Rev. B 67, 155104 (2003)","10.1103/PhysRevB.67.155104",,"cond-mat",,"  Dissipative dynamics of a quantum bit driven by a strong resonant field and
interacting with a heat bath is investigated. We derive generalized Bloch
equations and find modifications of the qubit's damping rates caused by Rabi
oscillations. Nonequilibrium decoherence of a phase qubit inductively coupled
to a LC-circuit is considered as an illustration of the general results. It is
argued that recent experimental results give a clear evidence of effective
suppression of decoherence in a strongly driven flux qubit.
","[{""version"":""v1"",""created"":""Mon, 9 Sep 2002 17:00:46 GMT""},{""version"":""v2"",""created"":""Tue, 11 Feb 2003 19:15:46 GMT""},{""version"":""v3"",""created"":""Mon, 3 Mar 2003 18:00:34 GMT""},{""version"":""v4"",""created"":""Mon, 2 Jun 2003 18:13:33 GMT""}]","2009-11-07"
"cond-mat/0209218","Andrei Pimenov","A. Pimenov, A. V. Pronin, A. Loidl, A. Tsukada, and M. Naito","On the peak in the far-infrared conductivity of strongly anisotropic
  cuprates","4 pages, 4 figures included","Phys. Rev. B 66, 212508 (2002)","10.1103/PhysRevB.66.212508",,"cond-mat.supr-con",,"  We investigate the far-infrared and submillimeter-wave conductivity of
electron-doped La_(2-x)Ce_xCuO_4 tilted 1 degree off from the ab-plane. The
effective conductivity measured for this tilt angle reveals an intensive peak
at finite frequency (\nu ~ 50 cm{-1}) due to a mixing of the in-plane and
out-of-plane responses. The peak disappears for the pure in-plane response and
transforms to the Drude-like contribution. Comparative analysis of the mixed
and the in-plane contributions allows to extract the c-axis conductivity which
shows a Josephson plasma resonance at 11.7 cm{-1} in the superconducting state.
","[{""version"":""v1"",""created"":""Mon, 9 Sep 2002 17:01:37 GMT""}]","2009-11-07"
"cond-mat/0209219","Roberto A. Kraenkel","F. Kh. Abdullaev, J.G. Caputo, R.A. Kraenkel and B.A. Malomed","Controlling collapse in Bose-Einstein condensates by temporal modulation
  of the scattering length","7 figures",,"10.1103/PhysRevA.67.013605",,"cond-mat",,"  We consider, by means of the variational approximation (VA) and direct
numerical simulations of the Gross-Pitaevskii (GP) equation, the dynamics of 2D
and 3D condensates with a scattering length containing constant and
harmonically varying parts, which can be achieved with an ac magnetic field
tuned to the Feshbach resonance. For a rapid time modulation, we develop an
approach based on the direct averaging of the GP equation,without using the VA.
In the 2D case, both VA and direct simulations, as well as the averaging
method, reveal the existence of stable self-confined condensates without an
external trap, in agreement with qualitatively similar results recently
reported for spatial solitons in nonlinear optics. In the 3D case, the VA again
predicts the existence of a stable self-confined condensate without a trap. In
this case, direct simulations demonstrate that the stability is limited in
time, eventually switching into collapse, even though the constant part of the
scattering length is positive (but not too large). Thus a spatially uniform ac
magnetic field, resonantly tuned to control the scattering length, may play the
role of an effective trap confining the condensate, and sometimes causing its
collapse.
","[{""version"":""v1"",""created"":""Mon, 9 Sep 2002 17:58:50 GMT""}]","2009-11-07"
"cond-mat/0209220","M. Mercedes Calbi","M. Mercedes Calbi, Silvina M. Gatica, Mary J. Bojan, and Milton W.
  Cole","Ground state and thermal properties of a lattice gas on a cylindrical
  surface","6 pages, 12 figures",,,,"cond-mat.soft cond-mat.stat-mech",,"  Adsorbed gases within, or outside of, carbon nanotubes may be analyzed with
an approximate model of adsorption on lattice sites situated on a cylindrical
surface. Using this model, the ground state energies of alternative lattice
structures are calculated, assuming Lennard-Jones pair interactions between the
particles. The resulting energy and equilibrium structure are nonanalytic
functions of radius (R) because of commensuration effects associated with the
cylindrical geometry.
  Specifically, as R varies, structural transitions occur between
configurations differing in the ""ring number"", defined as the number of atoms
located at a common value of the longitudinal coordinate (z). The thermodynamic
behavior of this system is evaluated at finite temperatures, using a
Hamiltonian with nearest-neighbor interactions. The resulting specific heat
bears a qualitative resemblance to that of the one-dimensional Ising model.
","[{""version"":""v1"",""created"":""Mon, 9 Sep 2002 20:21:01 GMT""},{""version"":""v2"",""created"":""Wed, 25 Sep 2002 15:32:34 GMT""}]","2016-08-31"
