"hep-th/0209060","Markus A. Luty","W. D. Linch III, Markus A. Luty, J. Phillips","Five dimensional supergravity in N = 1 superspace","22 pages, LaTeX2e, no figures","Phys.Rev.D68:025008,2003","10.1103/PhysRevD.68.025008","UMD-PP-03-008","hep-th hep-ph",,"  We give a formulation of linearized minimal 5-dimensional supergravity in N =
1 superspace. Infinitesimal local 5D diffeomorphisms, local 5D Lorentz
transformations, and local 5D supersymmetry are all realized as off-shell
superfield transformations. Compactification on an S^1 / Z_2 orbifold and
couplings to brane-localized supermultiplets are very simple in this formalism.
We use this to show that 5-dimensional supergravity can naturally generate mu
and B mu terms of the correct size in gaugino- or radion-mediated supersymmetry
breaking. We also include a self-contained review of linearized minimal 4D
supergravity in superspace.
","[{""version"":""v1"",""created"":""Mon, 9 Sep 2002 19:49:12 GMT""}]","2008-11-26"
"hep-th/0209072","Gordon Chalmers","Gordon Chalmers","Quantum Gravity with the Standard Model","16 pages, LaTeX, v2: typos corrected",,,"UCLA-02-TEP-24","hep-th gr-qc hep-ph",,"  A unified theory of four-dimensional gravity together with the standard model
is presented, with supersymmetry breaking of M-theory at a TeV. Masses of the
the known particles are derived. The cosmological constant is quantum generated
to the observed value. Quantum corrections to the classical compactification
are analyzed, and the scenario is stable.
","[{""version"":""v1"",""created"":""Mon, 9 Sep 2002 17:40:40 GMT""},{""version"":""v2"",""created"":""Wed, 11 Sep 2002 21:33:40 GMT""},{""version"":""v3"",""created"":""Sun, 22 Sep 2002 17:55:41 GMT""}]","2007-05-23"
"hep-th/0209073","S. D. Joglekar","Satish D. Joglekar (I.I.T. Kanpur, India)","Additional considerations in the definition and renormalization of
  non-covariant gauges","13 pages, Latex2e file; v2:Some conclusions from an analysis of
  (17)-(18) added; minor additional changes; This version to appear in MPLA","Mod.Phys.Lett. A18 (2003) 843-852","10.1142/S0217732303009915","IITK/PHY/2002/46","hep-th",,"  In this work, we pursue further consequences of a general formalism for
non-covariant gauges developed in an earlier work (hep-th/0205042). We carry
out further analysis of the additional restrictions on renormalizations noted
in that work. We use the example of the axial gauge A_3=0. We find that if
multiplicative renormalization together with ghost-decoupling is to hold, the
``prescription-term'' (that defines a prescription) cannot be chosen
arbitrarily but has to satisfy certain non-trivial conditions (over and above
those implied by the validity of power counting) arising from the WT identities
associated with the residual gauge invariance. We also give a restricted class
of solutions to these conditions.
","[{""version"":""v1"",""created"":""Mon, 9 Sep 2002 17:57:36 GMT""},{""version"":""v2"",""created"":""Tue, 25 Feb 2003 10:11:10 GMT""}]","2009-11-07"
"hep-th/0209074","Pierre Mathieu","P. Desrosiers, L. Lapointe and P. Mathieu","Jack polynomials in superspace","28 pages. Corrected version of lemme 3 and other minor corrections
  and 2 new references; version to appear in Commun. Math. Phys","Commun.Math.Phys. 242 (2003) 331-360","10.1007/s00220-003-0933-2",,"hep-th math.CO math.QA nlin.SI",,"  This work initiates the study of {\it orthogonal} symmetric polynomials in
superspace. Here we present two approaches leading to a family of orthogonal
polynomials in superspace that generalize the Jack polynomials. The first
approach relies on previous work by the authors in which eigenfunctions of the
supersymmetric extension of the trigonometric Calogero-Moser-Sutherland
Hamiltonian were constructed. Orthogonal eigenfunctions are now obtained by
diagonalizing the first nontrivial element of a bosonic tower of commuting
conserved charges not containing this Hamiltonian. Quite remarkably, the
expansion coefficients of these orthogonal eigenfunctions in the supermonomial
basis are stable with respect to the number of variables. The second and more
direct approach amounts to symmetrize products of non-symmetric Jack
polynomials with monomials in the fermionic variables. This time, the
orthogonality is inherited from the orthogonality of the non-symmetric Jack
polynomials, and the value of the norm is given explicitly.
","[{""version"":""v1"",""created"":""Mon, 9 Sep 2002 18:24:26 GMT""},{""version"":""v2"",""created"":""Mon, 28 Oct 2002 15:56:35 GMT""},{""version"":""v3"",""created"":""Tue, 9 Sep 2003 15:55:53 GMT""}]","2009-11-07"
"hep-th/0209075","Gordon Chalmers","Gordon Chalmers","Scalar Field Theory in the Derivative Expansion","8 pages, 1 figure",,,"UCLA-02-TEP-22","hep-th hep-ph",,"  The quantum correlations of scalar fields are examined as a power series in
derivatives. Recursive algebraic equations are derived and determine the
amplitudes; all loop integrations are performed. This recursion contains the
same information as the usual loop expansion. The approach is pragmatic and
generalizable to most quantum field theories.
","[{""version"":""v1"",""created"":""Mon, 9 Sep 2002 19:15:36 GMT""},{""version"":""v2"",""created"":""Mon, 9 Sep 2002 20:34:50 GMT""}]","2007-05-23"
"hep-th/0209076","Steven Willison","Elias Gravanis, Steven Willison","Israel conditions for the Gauss-Bonnet theory and the Friedmann equation
  on the brane universe","8 pages, published version","Phys.Lett.B562:118-126,2003","10.1016/S0370-2693(03)00555-0",,"hep-th gr-qc",,"  Assuming an Einstein-Gauss-Bonnet theory of gravitation in a ($D \geq
5$)-dimensional spacetime with boundary, we consider the problem of the
boundary dynamics given the matter Lagrangian on it. The resulting equation is
applied in particular on the derivation of the Friedmann eq. of a 3-brane,
understood as the non-orientable boundary of a 5d spacetime. We briefly discuss
the contradictory conclusions of the literature.
","[{""version"":""v1"",""created"":""Mon, 9 Sep 2002 19:47:58 GMT""},{""version"":""v2"",""created"":""Fri, 27 Sep 2002 14:36:44 GMT""},{""version"":""v3"",""created"":""Tue, 5 Aug 2003 14:19:23 GMT""}]","2010-04-06"
"hep-th/0209077","Keshav Dasgupta","Katrin Becker, Keshav Dasgupta","Heterotic Strings with Torsion","37 pages, No figures, Harvmac; v4: Some notations fixed and typos
  corrected, final version to appear in JHEP","JHEP 0211 (2002) 006","10.1088/1126-6708/2002/11/006","SU-ITP-02/34","hep-th",,"  In this paper we describe the heterotic dual of the type IIB theory
compactified to four dimensions on a toroidal orientifold in the presence of
fluxes. The type IIB background is most easily described in terms of an
M-theory compactification on a four-fold. The heterotic dual is obtained by
performing a series of U-dualities. We argue that these dualities preserve
supersymmetry and that the supergravity description is valid after performing
them. The heterotic string is compactified on a manifold that is no longer
Kahler and has torsion. These manifolds have to satisfy a number of
constraints, for example, existence of an holomorphic three-form, size limits,
torsional equations etc. We give an explicit form of the background and study
the constraints associated to them.
","[{""version"":""v1"",""created"":""Mon, 9 Sep 2002 20:15:03 GMT""},{""version"":""v2"",""created"":""Tue, 24 Sep 2002 00:27:02 GMT""},{""version"":""v3"",""created"":""Tue, 5 Nov 2002 04:46:20 GMT""},{""version"":""v4"",""created"":""Wed, 4 Dec 2002 02:03:20 GMT""}]","2009-11-07"
"hep-th/0209078","Mikhail Zubkov","M.A.Zubkov","Dirac monopoles embedded into SU(N) gauge theory with $\theta$ - term","5 pages, Revtex4","JETP Lett. 76 (2002) 591-595; Pisma Zh.Eksp.Teor.Fiz. 76 (2002)
  691-695","10.1134/1.1541041",,"hep-th",,"  We consider Dirac monopoles embedded into SU(N) gauge theory with theta-term
for $\theta = 4\pi M $ (where $M$ is half-integer for $N = 2$ and is integer
for $N>2$). Due to the theta - term those monopoles obtain the SU(N) charge and
become the dyons. They belong to different irreducible representations of SU(N)
(but not to all of them). The admitted representations are enumerated. Their
minimal rank increases with increasing of $N$. The main result of the paper is
the representation of the partition function of SU(N) model with theta-term
(that contains singular gauge fields correspondent to the mentioned monopoles)
as the vacuum average of the product of Wilson loops (considered along the
monopole worldlines). This vacuum average should be calculated within the
correspondent model without theta-term.
","[{""version"":""v1"",""created"":""Mon, 9 Sep 2002 22:54:14 GMT""},{""version"":""v2"",""created"":""Sat, 14 Sep 2002 16:41:04 GMT""},{""version"":""v3"",""created"":""Fri, 25 Oct 2002 13:23:12 GMT""},{""version"":""v4"",""created"":""Wed, 27 Nov 2002 22:17:36 GMT""},{""version"":""v5"",""created"":""Fri, 29 Nov 2002 11:21:16 GMT""}]","2009-11-07"
"hep-th/0209079","Lee Smolin","Lee Smolin","Quantum gravity with a positive cosmological constant","Latex 59 pages",,,,"hep-th",,"  A quantum theory of gravity is described in the case of a positive
cosmological constant in 3+1 dimensions. Both old and new results are
described, which support the case that loop quantum gravity provides a
satisfactory quantum theory of gravity. These include the existence of a ground
state, discoverd by Kodama, which both is an exact solution to the constraints
of quantum gravity and has a semiclassical limit which is deSitter spacetime.
The long wavelength excitations of this state are studied and are shown to
reproduce both gravitons and, when matter is included, quantum field theory on
deSitter spacetime. Furthermore, one may derive directly from the
Wheeler-deWitt equation, Planck scale, computable corrections to the
energy-momentum relations for matter fields. This may lead in the next few
years to experimental tests of the theory.
  To study the excitations of the Kodama state exactly requires the use of the
spin network representation, which is quantum deformed due to the cosmological
constant. The theory may be developed within a single horizon, and the boundary
states described exactly in terms of a boundary Chern-Simons theory. The
Bekenstein bound is recovered and the N bound of Banks is given a background
independent explanation.
  The paper is written as an introduction to loop quantum gravity, requiring no
prior knowledge of the subject. The deep relationship between quantum gravity
and topological field theory is stressed throughout.
","[{""version"":""v1"",""created"":""Mon, 9 Sep 2002 23:18:44 GMT""}]","2007-05-23"
"hep-th/0209081","Noriko Nakayama","Noriko Nakayama, Katsuyuki Sugiyama and Kentaroh Yoshida (Kyoto Univ.)","Ground State of Supermembrane on PP-wave","27 pages, LaTeX, typos corrected","Phys.Rev. D68 (2003) 026001","10.1103/PhysRevD.68.026001","KUCP-0217","hep-th",,"  We consider the ground state of supermembrane on the maximally supersymmetric
pp-wave background by using the quantum-mechanical procedure of de
Wit-Hoppe-Nicolai. In the pp-wave case the ground state has non-trivial
structure even in the zero-mode Hamiltonian, which is identical with that of
superparticles on the pp-wave and resembles supersymmetric harmonic
oscillators. The supergravity multiplet in the flat case is splitting with a
certain energy difference. We explicitly construct the unique supersymmetric
ground-state wave function of the zero-mode Hamiltonian, which is obviously
normalizable. Moreover, we discuss the nonzero-mode Hamiltonian and construct
an example for the ground-state wave function with a truncation of the
variables. This special solution seems non-normalizable but its L^2-norm can be
represented by an asymptotic series.
","[{""version"":""v1"",""created"":""Tue, 10 Sep 2002 10:34:39 GMT""},{""version"":""v2"",""created"":""Wed, 18 Sep 2002 10:58:35 GMT""}]","2009-11-07"
"hep-th/0209082","Shogo Aoyama","Shogo Aoyama and Takahiro Masuda","Fuzzy Algebrae of the General Kaehler Coset Space G/H\otimesU(1)^k","8 pages, LaTex, no figure","Mod.Phys.Lett. A18 (2003) 553-560","10.1142/S0217732303009666","KEK-TH-841","hep-th",,"  We study the fuzzy structure of the general Kaehler coset space
G/S\otimes{U(1)}^k deformed by the Fedosov formalism. It is shown that the
Killing potentials satisfy the fuzzy algebrae working in the Darboux
coordinates.
","[{""version"":""v1"",""created"":""Tue, 10 Sep 2002 10:57:11 GMT""}]","2009-11-07"
"hep-th/0209083",,"H.Culetu (Ovidius University)","On the gravitational energy of the Hawking wormhole","9 pages, chapter 4 removed, to appear in Int. Jour. Mod. Phys. A","Int.J.Mod.Phys. A18 (2003) 4251-4256","10.1142/S0217751X03016124",,"hep-th",,"  The surface energy for a conformally flat spacetime which represents the
Hawking wormhole in spherical (static) Rindler coordinates is computed using
the Hawking - Hunter formalism for non asymptotically - flat spacetimes.
  The physical gravitational Hamiltonian is proportional to the Rindler
acceleration g of the hyperbolic observer and is finite on the event horizon
ksi = b (b-the Planck length, ksi - the Minkowski interval). The corresponding
temperature of the system of particles associated to the massless scalar field
Psi, coupled conformally to Einstein's equations, is given by the Davies -
Unruh temperature up to a constant factor of order unity.
","[{""version"":""v1"",""created"":""Tue, 10 Sep 2002 11:25:16 GMT""},{""version"":""v2"",""created"":""Mon, 23 Sep 2002 14:24:53 GMT""},{""version"":""v3"",""created"":""Fri, 4 Jul 2003 11:21:55 GMT""}]","2016-09-06"
"hep-th/0209084","Benedicte Ponsot","Benedicte Ponsot and Sebastian Silva","Are there really any AdS_2 branes in the euclidean (or not) AdS_3?","7 pages; v2: more explanations","Phys.Lett. B551 (2003) 173-177","10.1016/S0370-2693(02)03006-X",,"hep-th",,"  We do not find any AdS_2 branes, neither in the H_3^+ WZNW model nor the
SL(2,R) WZNW model. We then reexamine the case of the branes that possess a
su(2) symmetry: we speculate that they would have to live on the boundary of
AdS_3. This cannot be realized in an euclidean spacetime, but in the SL(2,R)
WZNW model by analytical continuation.
","[{""version"":""v1"",""created"":""Tue, 10 Sep 2002 12:13:07 GMT""},{""version"":""v2"",""created"":""Tue, 22 Oct 2002 07:51:15 GMT""}]","2009-11-07"
"hep-th/0209085","Leonid Chekhov","L.Chekhov and A.Mironov","Matrix models vs. Seiberg-Witten/Whitham theories","8 pages in LaTeX, 1 LaTeX figure, reference added","Phys.Lett. B552 (2003) 293-302","10.1016/S0370-2693(02)03163-5","FIAN/TD-21/02, ITEP/TH-40/02","hep-th",,"  We discuss the relation between matrix models and the Seiberg--Witten type
(SW) theories, recently proposed by Dijkgraaf and Vafa. In particular, we prove
that the partition function of the Hermitean one-matrix model in the planar
(large $N$) limit coincides with the prepotential of the corresponding SW
theory. This partition function is the logarithm of a Whitham $\tau$-function.
The corresponding Whitham hierarchy is explicitly constructed. The double-point
problem is solved.
","[{""version"":""v1"",""created"":""Tue, 10 Sep 2002 13:10:09 GMT""},{""version"":""v2"",""created"":""Mon, 7 Oct 2002 09:37:15 GMT""}]","2010-04-05"
"hep-th/0209086","Gordon Chalmers","Gordon Chalmers","Gauge Theories in the Derivative Expansion","9 pages, v2: typo corrected",,,"UCLA-02-TEP-27","hep-th hep-ph",,"  Gauge theories with and without matter are formulated in the derivative
expansion. Amplitudues are derived as a power series in the energy scales;
there are simplifications as compared with the usual loop expansion. The
incorporation and summation of Wilson loops is natural in this approach and
allows for a derivation of the confining potential as well as the masses of the
gauge invariant observables.
","[{""version"":""v1"",""created"":""Tue, 10 Sep 2002 14:34:23 GMT""},{""version"":""v2"",""created"":""Fri, 20 Sep 2002 18:30:29 GMT""}]","2007-05-23"
"hep-th/0209087","Eynard Bertrand","P. Bleher, B. Eynard","Double Scaling Limit in Random Matrix Models and a Nonlinear Hierarchy
  of Differential Equations","17 pages, latex, J. Phys. A special issue on random matrices","J.Phys.A36:3085-3106,2003","10.1088/0305-4470/36/12/314","SPHT T02/111, CRM-2861","hep-th cond-mat math-ph math.MP",,"  We derive the double scaling limit of eigenvalue correlations in the random
matrix model at critical points and we relate the limiting correlation
functions to a nonlinear hierarchy of ordinary differential equations.
","[{""version"":""v1"",""created"":""Tue, 10 Sep 2002 15:40:32 GMT""}]","2008-11-26"
"math-ph/0209017","Jan De Gier","Paul A. Pearce, Vladimir Rittenberg, Jan de Gier and Bernard Nienhuis","Temperley-Lieb Stochastic Processes","9 pages LaTeX, 11 Postscript figures, minor changes","J.Phys. A35 (2002) L661-L668","10.1088/0305-4470/35/45/105",,"math-ph cond-mat.stat-mech math.CO math.DS math.MP",,"  We discuss one-dimensional stochastic processes defined through the
Temperley-Lieb algebra related to the Q=1 Potts model. For various boundary
conditions, we formulate a conjecture relating the probability distribution
which describes the stationary state, to the enumeration of a symmetry class of
alternating sign matrices, objects that have received much attention in
combinatorics.
","[{""version"":""v1"",""created"":""Tue, 10 Sep 2002 02:01:52 GMT""},{""version"":""v2"",""created"":""Tue, 5 Nov 2002 22:59:00 GMT""}]","2009-11-07"
"math-ph/0209018","Ali Mostafazadeh","Ali Mostafazadeh","Pseudo-Hermiticity and Generalized PT- and CPT-Symmetries","25 pages, slightly revised version, accepted for publication in J.
  Math. Phys","J.Math.Phys. 44 (2003) 974-989","10.1063/1.1539304",,"math-ph hep-th math.MP quant-ph",,"  We study certain linear and antilinear symmetry generators and involution
operators associated with pseudo-Hermitian Hamiltonians and show that the
theory of pseudo-Hermitian operators provides a simple explanation for the
recent results of Bender, Brody and Jones (quant-ph/0208076) on the
CPT-symmetry of a class of PT-symmetric non-Hermitian Hamiltonians. We present
a natural extension of these results to the class of diagonalizable
pseudo-Hermitian Hamiltonians H with a discrete spectrum. In particular, we
introduce generalized parity (${\cal P}$), time-reversal (${\cal T}$), and
charge-conjugation (${\cal C}$) operators and establish the ${\cal PT}$- and
${\cal CPT}$-invariance of H.
","[{""version"":""v1"",""created"":""Tue, 10 Sep 2002 12:40:27 GMT""},{""version"":""v2"",""created"":""Fri, 22 Nov 2002 10:05:37 GMT""},{""version"":""v3"",""created"":""Thu, 28 Nov 2002 08:43:32 GMT""}]","2009-11-07"
"math/0209093","Michael Mueger","Michael Mueger","Galois extensions of braided tensor categories and braided crossed
  G-categories","Some comments and references added. Final version, to appear in J.
  Alg. latex2e, ca. 25 p., requires diagrams.tex","J. Alg. 277 (2004) 256-281",,,"math.CT",,"  We show that the author's notion of Galois extensions of braided tensor
categories [22], see also [3], gives rise to braided crossed G-categories,
recently introduced for the purposes of 3-manifold topology [31]. The Galois
extensions C \rtimes S are studied in detail, and we determine for which g in G
non-trivial objects of grade g exist in C \rtimes S.
","[{""version"":""v1"",""created"":""Mon, 9 Sep 2002 17:12:16 GMT""},{""version"":""v2"",""created"":""Mon, 23 Feb 2004 13:00:46 GMT""}]","2007-05-23"
"math/0209095","Adrian Vasiu","Adrian Vasiu (U. of Arizona, USA)","A purity theorem for abelian schemes","11 pages","Michigan Math. J. 52 (2004), no.1, pp. 71--81","10.1307/mmj/1080837735",,"math.NT",,"  We prove a purity theorem for abelian schemes in arbitrary unramified mixed
characteristic (0,p). The case p=2 is completely new and the case p>2 fixes
several errors in the literature.
","[{""version"":""v1"",""created"":""Mon, 9 Sep 2002 18:19:37 GMT""},{""version"":""v2"",""created"":""Thu, 8 Apr 2004 19:16:15 GMT""}]","2007-05-23"
"math/0209096","Gregorio Malajovich","Jean-Pierre Dedieu, Pierre Priouret and Gregorio Malajovich","Newton Method on Riemannian Manifolds: Covariant Alpha-Theory",,"IMA Journal of Numerical Analysis 2003 23(3):395-419;","10.1093/imanum/23.3.395",,"math.NA",,"  In this paper we study quantitative aspects of Newton method for finding
zeros of mappings f: M_n -> R^n and vector fields X: M_x -> TM_n
","[{""version"":""v1"",""created"":""Mon, 9 Sep 2002 19:25:19 GMT""},{""version"":""v2"",""created"":""Wed, 15 Jan 2003 17:54:18 GMT""}]","2007-10-25"
"math/0209097","Nicolau C. Saldanha","Nicolau C. Saldanha and Carlos Tomei","Functions from $R^2$ to $R^2$: a study in nonlinearity","24 pages, 15 figures Completely rewritten to make it more elementary",,,,"math.NA",,"  We study the geometry of functions from the plane to the plane. For a large
special class we are able to count preimages and compute them. Both numerical
and theoretical aspects are discussed. Some of the tools used are Whitney's
classification of critical points, rotation numbers, covering maps and
continuation methods.
","[{""version"":""v1"",""created"":""Mon, 9 Sep 2002 21:00:23 GMT""},{""version"":""v2"",""created"":""Wed, 17 Sep 2003 12:40:34 GMT""}]","2009-09-29"
"math/0209098","Jacob Sturm","D.H. Phong (Columbia University), Jacob Sturm (Rutgers
  University/Newark)","Scalar curvature, moment maps and the Deligne Pairing",,,,,"math.DG math.AG",,"  In this paper, we the improve the bound for the moment map derivative proved
by Donaldson in his recent proof of the Hilbert-Mumford stability of complex
manifolds with constant scalar curvature. The proof depends on the
identification of Donaldson's symplectic form with the curvature of a certain
Deligne pairing.
","[{""version"":""v1"",""created"":""Mon, 9 Sep 2002 22:58:28 GMT""},{""version"":""v2"",""created"":""Tue, 10 Sep 2002 20:54:52 GMT""},{""version"":""v3"",""created"":""Wed, 31 Dec 2003 20:15:30 GMT""}]","2007-05-23"
"math/0209099","Nigel Hitchin","Nigel Hitchin","Generalized Calabi-Yau manifolds","37 pages, LateX","Quart.J.Math.Oxford Ser.54:281-308,2003","10.1093/qjmath/54.3.281",,"math.DG math.AG",,"  A geometrical structure on even-dimensional manifolds is defined which
generalizes the notion of a Calabi-Yau manifold and also a symplectic manifold.
Such structures are of either odd or even type and can be transformed by the
action of both diffeomorphisms and closed 2-forms. In the special case of six
dimensions we characterize them as critical points of a natural variational
problem on closed forms, and prove that a local moduli space is provided by an
open set in either the odd or even cohomology.
","[{""version"":""v1"",""created"":""Tue, 10 Sep 2002 08:59:07 GMT""}]","2011-05-05"
"math/0209100","Alexandre Borovik","Richard F. Booth, Alexandre V. Borovik and Neil White","Lagrangian Pairs and Lagrangian Orthogonal Matroids","Requires amssymb.sty; 12 pages, 2 LaTeX figures",,,,"math.CO",,"  Represented Coxeter matroids of types $C_n$ and $D_n$, that is, symplectic
and orthogonal matroids arising from totally isotropic subspaces of symplectic
or (even-dimensional) orthogonal spaces, may also be represented in buildings
of type $C_n$ and $D_n$, respectively. Indeed, the particular buildings
involved are those arising from the flags or oriflammes, respectively, of
totally isotropic subspaces. There are also buildings of type $B_n$ arising
from flags of totally isotropic subspaces in odd-dimensional orthogonal space.
Coxeter matroids of type $B_n$ are the same as those of type $C_n$ (since they
depend only upon the reflection group, not the root system). However, buildings
of type $B_n$ are distinct from those of the other types. The matroids
representable in odd dimensional orthogonal space (and therefore in the
building of type $B_n$) turn out to be a special case of symplectic (flag)
matroids, those whose top component, or Lagrangian matroid, is a union of two
Lagrangian orthogonal matroids. These two matroids are called a Lagrangian
pair, and they are the combinatorial manifestation of the ``fork'' at the top
of an oriflamme (or of the fork at the end of the Coxeter diagram of $D_n$).
  Here we give a number of equivalent characterizations of Lagrangian pairs,
and prove some rather strong properties of them.
","[{""version"":""v1"",""created"":""Mon, 9 Sep 2002 23:00:55 GMT""}]","2007-05-23"
"math/0209101","Masahiko Miyamoto","Masahiko Miyamoto (University of Tsukuba)","Modular invariance of vertex operator algebras satisfying
  C_2-cofiniteness","34 pages. We get rid of the condition of being of``CFT type''. Latex",,,,"math.QA",,"  We show that C_2-cofiniteness is enough to prove a modular invariance
property of vertex operator algebras without assuming the semisimplicity of Zhu
algebra. For example, if a VOA V=\oplus_{m=0}^{\infty}V_m is C_2-cofinite, then
the space spanned by generalized characters of V-modules is invariant under the
action of SL_2(\Z). In this case, the central charge and conformal weights are
all rational numbers. Namely, a VOA satisfying C_2-cofiniteness is a rational
conformal field theory in a sense. We also show that C_2-cofiniteness is
equivalent to the condition that every weak module is an \N-graded weak module
which is a direct sum of generalized eigenspaces of L(0).
","[{""version"":""v1"",""created"":""Tue, 10 Sep 2002 01:47:26 GMT""},{""version"":""v2"",""created"":""Wed, 2 Oct 2002 03:43:24 GMT""}]","2007-05-23"
"math/0209102","Daniel Goldston","Daniel A. Goldston, Cem Yalcin Yildirim","Higher correlations of divisor sums related to primes III:
  k-correlations","32 pages",,,"AIM 2002-11","math.NT",,"  We obtain the general k-correlations for a short divisor sum related to
primes.
","[{""version"":""v1"",""created"":""Tue, 10 Sep 2002 01:54:18 GMT""}]","2016-09-07"
