"cond-mat/0209221","Clare Yu","Clare C. Yu and Herve M. Carruzzo","Influence of the Potential Energy Landscape on the Equilibration and
  Specific Heat of Glass Forming Liquids","4 pages, Latex, 3 encapsulated postscript figures",,,,"cond-mat.dis-nn cond-mat.stat-mech",,"  We show that a glass transition, signaled by a peak in the specific heat vs.
temperature, can occur because a glassy system that shows no signs of aging
progresses so slowly through the energy landscape that the time needed to
obtain an accurate estimate of the thermodynamic averages exceeds the
observation time. We find that below the glass transition temperature of a
three dimensional binary mixture of soft spheres, the specific heat increases
with measurement time spans orders of magnitude longer than previously
recognized equilibration times.
","[{""version"":""v1"",""created"":""Mon, 9 Sep 2002 21:36:22 GMT""}]","2007-05-23"
"cond-mat/0209223","Shuichi Wakimoto","S. Wakimoto, R. J. Birgeneau, Y. Fujimaki, N. Ichikawa, T. Kasuga, Y.
  J. Kim, K. M. Kojima, S.-H. Lee, H. Niko, J. M. Tranquada, S. Uchida, M. v.
  Zimmermann","Effect of a magnetic field on the spin- and charge-density wave order in
  La1.45Nd0.4Sr0.15CuO4","7 pages, 5 figures",,"10.1103/PhysRevB.67.184419",,"cond-mat.supr-con",,"  The spin-density wave (SDW) and charge-density wave (CDW) order in
superconducting La1.45Nd0.4Sr0.15CuO4 were studied under an applied magnetic
field using neutron and X-ray diffraction techniques. In zero field,
incommensurate (IC) SDW order appears below ~ 40 K, which is characterized by
neutron diffraction peaks at (1/2 +/- 0.134, 1/2 +/- 0.134, 0). The intensity
of these IC peaks increases rapidly below T_Nd ~ 8 K due to an ordering of the
Nd^3+ spins. The application of a 1 T magnetic field parallel to the c-axis
markedly diminishes the intensity below T_Nd, while only a slight decrease in
intensity is observed at higher temperatures for fields up to 7 T. Our
interpretation is that the c-axis field suppresses the parasitic Nd^3+ spin
order at the incommensurate wave vector without disturbing the stripe order of
Cu^2+ spins. Consistent with this picture, the CDW order, which appears below
60 K, shows no change for magnetic fields up to 4 T. These results stand in
contrast to the significant field-induced enhancement of the SDW order observed
in superconducting La2-xSrxCuO4 with x ~ 0.12 and stage-4 La2CuO4+y. The
differences can be understood in terms of the relative volume fraction
exhibiting stripe order in zero field, and the collective results are
consistent with the idea that suppression of superconductivity by vortices
nucleates local patches of stripe order.
","[{""version"":""v1"",""created"":""Mon, 9 Sep 2002 22:23:19 GMT""},{""version"":""v2"",""created"":""Wed, 11 Sep 2002 13:53:26 GMT""},{""version"":""v3"",""created"":""Thu, 19 Sep 2002 14:03:03 GMT""},{""version"":""v4"",""created"":""Fri, 24 Jan 2003 15:57:10 GMT""}]","2009-11-07"
"cond-mat/0209224","Kohji Nakamura","K. Nakamura and A. J. Freeman","Canted ferromagnetism in RuSr$_2$GdCu$_2$O$_8$","4pages, 3 figures",,"10.1103/PhysRevB.66.140405",,"cond-mat.supr-con cond-mat.mtrl-sci",,"  First principles calculations using the full-potential linearized augmented
plane wave (FLAPW) method including intra-atomic noncollinear magnetism have
been performed to determine the magnetic structures of
RuSr$_{2}$GdCu$_{2}$O$_{8}$. The magnetism clearly arises from the RuO$_{6}$
octahedra where the moments on neighboring Ru sites order antiferromagnetically
but cant perpendicular to the AFM axis - and so induce a weak ferromagnetism.
The projected Ru moments along the AFM and FM axes result in magnetic moments
of 1.16 and 0.99 $\mu_{B}$ respectively. The results are consistent with the
possible coexistence of canted ferromagnetism and superconductivity in the
RuSr$_{2}$GdCu$_{2}$O$_{8}$ - inferred from experiments.
","[{""version"":""v1"",""created"":""Tue, 10 Sep 2002 00:02:46 GMT""}]","2009-11-07"
"cond-mat/0209225","Chul-Ho Lee","C. H. Lee, K. Yamada, H. Hiraka, C. R. Venkateswara Rao and Y. Endoh","Spin Pseudo Gap in La2-xSrxCuO4 Studied by Neutron Scattering","revtex, 7 pages, 8 eps figures, PRB (2003) in press","Phys. Rev. B 67 (2003) 134521","10.1103/PhysRevB.67.134521",,"cond-mat.supr-con cond-mat.str-el",,"  Spin excitations of La2-xSrxCuO have been studied using inelastic neutron
scattering techniques in the energy range of 2 meV =< w =< 12 meV and the
temperature range of 8 K =< T =< 150 K. We observed a signature of a spin
pseudo gap in the excitation spectrum above Tc for the slightly overdoped
sample with x = 0.18. On heating, the spin pseudo gap gradually collapses
between T = 80 K and 150 K. For the x = 0.15 and 0.20, although the visibility
of gap-like structure at T ~ Tc is lower compared to the x = 0.18 sample, the
broad bump of kai""(w) appears at w ~ 5 meV,close to the spin-gap energy at base
temperature, suggests the existence of the spin pseudo gap in the normal state.
","[{""version"":""v1"",""created"":""Tue, 10 Sep 2002 02:53:15 GMT""},{""version"":""v2"",""created"":""Thu, 13 Mar 2003 05:16:54 GMT""}]","2009-11-07"
"cond-mat/0209226","Won Nam Kang","W.N. Kang, Eun-Mi Choi, Hyeong-Jin Kim, Hyun-Jung Kim, and Sung-Ik Lee","Growth of superconducting MgB2 thin films via postannealing techniques","7 pages, 4 figures included",,"10.1016/S0921-4534(02)02310-9",,"cond-mat.supr-con cond-mat.mtrl-sci",,"  We report the effect of annealing on the superconductivity of MgB2 thin films
as functions of the postannealing temperature in the range from 700 C to 950 C
and of the postannealing time in the range from 30 min to 120 min. On annealing
at 900 C for 30 min, we obtained the best-quality MgB2 films with a transition
temperature of 39 K and a critical current density of ~ 10^7 A/cm^2. Using the
scanning electron microscopy, we also investigated the film growth mechanism.
The samples annealed at higher temperatures showed the larger grain sizes,
well-aligned crystal structures with preferential orientations along the
c-axis, and smooth surface morphologies. However, a longer annealing time
prevented the alignment of grains and reduced the superconductivity, indicating
a strong interfacial reaction between the substrate and the MgB2 film.
","[{""version"":""v1"",""created"":""Tue, 10 Sep 2002 05:25:29 GMT""}]","2009-11-07"
"cond-mat/0209227","Nobuki Maeda","N. Maeda, T. Aoyama, Y. Ishizuka, and K. Ishikawa","Neutral Collective Excitations in Striped Hall States","2 pages, 2 figures, LT23 Hiroshima","PhysicaE18:122,2003","10.1016/S1386-9477(02)01042-1","EPHOU-02-004","cond-mat.mes-hall hep-th",,"  In the striped Hall state, a magnetic translation in one direction is
spontaneously broken to the discrete translation. The spectrum of the neutral
collective excitation is obtained in the single mode approximation at
half-filled third and fourth Landau levels. The spectrum is anisotropic and has
a multiple line node structure. In one direction, the spectrum resembles the
liquid Helium spectrum with the phonon and roton minimum.
","[{""version"":""v1"",""created"":""Tue, 10 Sep 2002 05:22:48 GMT""}]","2015-06-24"
"cond-mat/0209228","Agha Afsar Ali","Agha Afsar Ali","Cooperative behavior in a spatial model of ""commons""","12 pages 9 figures",,,,"cond-mat.stat-mech cond-mat.dis-nn",,"  We study a lattice model of ``commons'', where a resource is shared locally
among the agents of various cooperative tendency. The payoff function of an
agent is proportional to the fraction of his operation rate and the net output
of the resource. After each time step a site is occupied by the neighbor of
maximum profit or by its owner himself. In steady state the model is dominated
by ``altruist'' agents with a small minority of selfish agents, forming a
complex pattern. The dynamics selects cooperative levels in a way that the
model becomes critical. We study the critical behavior of the model in case of
moderate mutation rate and find the power spectrum of fluctuation of activity
shows a $1/f^\alpha$ behavior with $\alpha \sim 1.30$. In case of very slow
mutation rate the steady state has slow fluctuations which helps the evolution
of higher cooperative tendency.
","[{""version"":""v1"",""created"":""Tue, 10 Sep 2002 06:06:08 GMT""}]","2007-05-23"
"cond-mat/0209229","Mikio Eto","Akiko Ueda, Ikuo Baba, Keita Suzuki and Mikio Eto","Numerical Studies of Fano Resonance in Quantum dots Embedded in AB Rings","2 pages, 4 figures, to appear in J. Phys. Soc. Jpn., proceedings of
  International Conference on Quantum Transport and Quantum Coherence
  (Localisation 2002, Tokyo)","J. Phys. Soc. Jpn. 72, Supplement A, 157 (2003).","10.1143/JPSJS.72SA.157",,"cond-mat.mes-hall",,"  The Fano resonance in quantum dots embedded in Aharonov-Bohm rings is
examined theoretically, using two models of non-interacting electrons. The
first model yields an analytical expression for the conductance G. G is written
in an extended Fano form with a complex parameter. The shape of the resonance
can be asymmetric or symmetric, depending on the magnetic flux enclosed in the
ring. The ""phase"" of the resonance is changed continuously with increasing the
flux in two-terminal situations. These are in accordance with recent
experimental results. In the second model, we consider the dephasing effect on
the Fano resonance by numerical calculations.
","[{""version"":""v1"",""created"":""Tue, 10 Sep 2002 07:05:29 GMT""}]","2015-06-24"
"cond-mat/0209230","Unjong   Yu","Unjong Yu, Yookyung Jo, B. I. Min","Magnetic phase diagram of doped CMR manganites","2 pages, 1 figure; Transport and Thermal Properties of Advanced
  Materials(Aug. 2002; Hiroshima, Japan)",,"10.1016/S0921-4526(02)01823-9",,"cond-mat.str-el",,"  The magnetic phase diagram of the colossal magnetoresistance (CMR) manganites
is determined based on the Hamiltonian incorporating the double-exchange (DE)
interaction between degenerate Mn $e_g$ orbitals and the antiferromagnetic (AF)
superexchange interaction between Mn $t_{2g}$ spins. We have employed the
rigorous quantum mechanical formalism and obtained the finite temperature phase
diagram which describes well the commonly observed features in CMR manganites.
We have also shown that the CE-type AF structure cannot be stabilized at
$x$=0.5 in this model.
","[{""version"":""v1"",""created"":""Tue, 10 Sep 2002 07:56:42 GMT""}]","2009-11-07"
"cond-mat/0209231","I. Junier","I. Junier, J. Kurchan","Tailoring symmetry groups using external alternate fields","4 pages, 2 figures finite dimension and selection mechanism clarified","Europhys. Lett., 63 (5), 674-680 (2003)","10.1209/epl/i2003-00583-2",,"cond-mat.stat-mech cond-mat.soft",,"  Macroscopic systems with continuous symmetries subjected to oscillatory
fields have phases and transitions that are qualitatively different from their
equilibrium ones. Depending on the amplitude and frequency of the fields
applied, Heisenberg ferromagnets can become XY or Ising-like -or, conversely,
anisotropies can be compensated -thus changing the nature of the ordered phase
and the topology of defects. The phenomena can be viewed as a dynamic form of
""order by disorder"".
","[{""version"":""v1"",""created"":""Tue, 10 Sep 2002 13:28:48 GMT""},{""version"":""v2"",""created"":""Wed, 11 Sep 2002 14:46:46 GMT""},{""version"":""v3"",""created"":""Fri, 3 Jan 2003 15:35:00 GMT""}]","2009-11-07"
"cond-mat/0209232","Knorr Karsten","L. Ehm, K. Knorr, W. Depmeier","The high-pressure behaviour of 3R-NbS2","3 pages, 2 figures, 1 table submitted to Z. Krist., pages in print","Z. Kristallogr. 217 (2002) 522-524",,,"cond-mat.mtrl-sci",,"  The high pressure behaviour of 3R-NbS2 has been investigated by
angle-dispersive X-ray powder diffraction using diamond anvil cells up to 14
GPa. The compression behaviour of the structure is highly anisotropic. The
compressibility perpendicular to the layers is 2.5 times higher than within the
layers. A fit of a 3rd-order Birch-Murnaghan equation of state gave a volume at
zero pressure V0=174(1)\AA^3 and a bulk modulus b0=57(1) GPa, with a pressure
derivative b'=8.6(5).
","[{""version"":""v1"",""created"":""Tue, 10 Sep 2002 08:51:21 GMT""}]","2007-05-23"
"cond-mat/0209233","N. Fedorov","P.I. Arseev, N.K. Fedorov, S.O. Loiko","Scattering of electrons by impurities within the framework of two band
  model of order parameter anisotropy","13 pages, 2 figures",,,,"cond-mat.supr-con cond-mat.str-el",,"  The impurity concentration dependence of superconducting transition
temperature $T_c$ is studied within the framework of two band model of order
parameter anisotropy. Both intraband and interband electron scattering by
nonmagnetic and magnetic impurities are taken into account. It is demonstrated
that at various values of model parameters both types of impurity concentration
dependence of $T_c$ are possible: weak dependence typical of the model with
s-wave order parameter and strong suppression of $T_c$ by impurities with
critical impurity concentration at which $T_c=0$. It is found that in some
cases there is a possibility of a rise of critical temperature with increasing
impurity concentration. The obtained results are consistent with existing
experimental data for the high-temperature superconductors.
","[{""version"":""v1"",""created"":""Tue, 10 Sep 2002 09:05:09 GMT""}]","2007-05-23"
"cond-mat/0209234","Einat Klein","Michal Rosen-Zvi, Einat Klein, Ido Kanter, Wolfgang Kinzel","Mutual learning in a tree parity machine and its application to
  cryptography",,,"10.1103/PhysRevE.66.066135",,"cond-mat.dis-nn",,"  Mutual learning of a pair of tree parity machines with continuous and
discrete weight vectors is studied analytically. The analysis is based on a
mapping procedure that maps the mutual learning in tree parity machines onto
mutual learning in noisy perceptrons. The stationary solution of the mutual
learning in the case of continuous tree parity machines depends on the learning
rate where a phase transition from partial to full synchronization is observed.
In the discrete case the learning process is based on a finite increment and a
full synchronized state is achieved in a finite number of steps. The
synchronization of discrete parity machines is introduced in order to construct
an ephemeral key-exchange protocol. The dynamic learning of a third tree parity
machine (an attacker) that tries to imitate one of the two machines while the
two still update their weight vectors is also analyzed. In particular, the
synchronization times of the naive attacker and the flipping attacker recently
introduced in [1] are analyzed. All analytical results are found to be in good
agreement with simulation results.
","[{""version"":""v1"",""created"":""Tue, 10 Sep 2002 09:19:56 GMT""}]","2009-11-07"
"cond-mat/0209235","Samsel-Czekala","H. Sormann, G. Kontrym-Sznajd, R.N. West","On the reliability of various enhancement theories for a description of
  electron-positron densities in metals",,"Mat. Sci. Forum 363-365, 609-611 (2001)",,,"cond-mat.mtrl-sci",,"  Four theoretical approaches to calculate momentum densities of
electron-positron annihilation pairs (MDAP) in crystalline solids are
confronted with 3D densities reconstructed from two-dimensional angular
correlation (2D-ACAR) data for copper, chromium, and yttrium. It is shown that
the Bloch-modified ladder theory, in contrast to other approaches, is able to
describe - at least qualitatively - the MDAP profiles for all metals
investigated.
","[{""version"":""v1"",""created"":""Tue, 10 Sep 2002 10:53:18 GMT""}]","2007-05-23"
"cond-mat/0209236","Hiroshi Noguchi","Hiroshi Noguchi","Polyhedral vesicles","4 pages, 5 figures","Phys. Rev. E 67, 041901 (2003).","10.1103/PhysRevE.67.041901",,"cond-mat.soft cond-mat.stat-mech",,"  Polyhedral vesicles with a large bending modulus of the membrane such as the
gel phase lipid membrane were studied using a Brownian dynamics simulation. The
vesicles exhibit various polyhedral morphologies such as tetrahedron and cube
shapes. We clarified two types of line defects on the edges of the polyhedrons:
cracks of both monolayers at the spontaneous curvature of monolayer $C_{\text
{0}}<0$, and a crack of the inner monolayer at $C_{\text {0}}\ge0$. Around the
latter defect, the inner monolayer curves positively. Our results suggested
that the polyhedral morphology is controlled by $C_{\text {0}}$.
","[{""version"":""v1"",""created"":""Tue, 10 Sep 2002 12:03:12 GMT""}]","2009-11-07"
"cond-mat/0209237","Debanand Sa","Debanand Sa","Hidden Quantum Critical Point in a Ferromagnetic Superconductor","4 pages, Phys. Rev. B (Rapid) accepted","Phys. Rev B, 66, 140505(R) (2002)","10.1103/PhysRevB.66.140505",,"cond-mat.supr-con cond-mat.str-el",,"  We consider a coexistence phase of both Ferromagnetism and superconductivity
and solve the self-consistent mean-field equations at zero temperature. The
superconducting gap is shown to vanish at the Stoner point whereas the
magnetization doesn't. This indicates that the para-Ferro quantum critical
point becomes a hidden critical point. The effective mass in such a phase gets
enhanced whereas the spin wave stiffness is reduced as compared to the pure FM
phase. The spin wave stiffness remains finite even at the para-Ferro quantum
critical point.
","[{""version"":""v1"",""created"":""Tue, 10 Sep 2002 13:53:53 GMT""}]","2009-11-07"
"cond-mat/0209238","Melin Regis","N. Stefanakis, R. M\'elin","Transport properties of ferromagnet/d-wave superconductor/ferromagnet
  double junctions","16 pages, 4 figures, revised version","J. Phys. : Condens. Matter 15, 4239 (2003)","10.1088/0953-8984/15/24/317",,"cond-mat.supr-con",,"  We investigate transport properties of a trilayer made of a d-wave
superconductor connected to two ferromagnetic electrodes. Using Keldysh
formalism we show that crossed Andreev reflection and elastic cotunneling exist
also with d-wave superconductors. Their properties are controlled by the
existence of zero energy states due to the anisotropy of the d-wave pair
potential.
","[{""version"":""v1"",""created"":""Tue, 10 Sep 2002 14:44:03 GMT""},{""version"":""v2"",""created"":""Thu, 28 Nov 2002 16:21:01 GMT""},{""version"":""v3"",""created"":""Wed, 7 May 2003 14:49:36 GMT""}]","2009-11-07"
"cond-mat/0209239","Milva Celli","M. Celli, U. Bafile, G. J. Cuello, F. Formisano, E. Guarini, R. Magli,
  M. Neumann, and M. Zoppi","Microscopic structure of liquid hydrogen: a neutron diffraction
  experiment","4 pages, 2 figures",,,,"cond-mat.soft",,"  We have measured the center-of-mass structure factor S(k) of liquid
para-hydrogen by neutron diffraction, using the D4C diffractometer at the
Institute Laue Langevin, Grenoble, France. The present determination is at
variance with previous results obtained from inelastic neutron scattering data,
but agrees with path integral Monte Carlo simulations.
","[{""version"":""v1"",""created"":""Tue, 10 Sep 2002 14:52:35 GMT""}]","2007-05-23"
"cond-mat/0209240","M. S. Sercheli","M.S. Sercheli, C. Rettori, A.R. Zanatta","Magnetic Properties of a-Si films doped with rare-earth elements","15 pages, 7 figures",,"10.1103/PhysRevB.68.174418",,"cond-mat.mtrl-sci cond-mat.dis-nn",,"  Amorphous silicon films doped with Y, La, Gd, Er, and Lu rare-earth elements
(a-Si:RE) have been prepared by co-sputtering and studied by means of electron
spin resonance (ESR), dc-magnetization, ion beam analysis, optical
transmission, and Raman spectroscopy. For comparison the magnetic properties of
laser-crystallized and hydrogenated a-Si:RE films were also studied. It was
found that the rare-earth species are incorporated in the a-Si:RE films in the
RE3+ form and that the RE-doping depletes the neutral dangling bonds (D0)
density. The reduction of D0 density is significantly larger for the magnetic
REs (Gd3+ and Er3+) than for the non-magnetic ones (Y3+, La3+, Lu3+). These
results are interpreted in terms of a strong exchange-like interaction, J RE-DB
SRE SDB, between the spin of the magnetic REs and that of the D0. All our
Gd-doped Si films showed basically the same broad ESR Gd3+ resonance (DHpp ~
850 Oe) at g ~ 2.01, suggesting the formation of a rather stable RE-Si complex
in these films.
","[{""version"":""v1"",""created"":""Tue, 10 Sep 2002 15:02:50 GMT""}]","2009-11-07"
"cond-mat/0209241","M. S. Sercheli","M.S. Sercheli, C. Rettori, A.R. Zanatta","Neutral-dangling bond depletion in a-SiN films caused by magnetic
  rare-earth elements","7 page, 2 figures",,"10.1016/S0038-1098(03)00654-9",,"cond-mat.mtrl-sci cond-mat.dis-nn",,"  Amorphous silicon-nitrogen thin films doped with rare-earth elements
(a-SiN:RE; RE = Y, La, Pr, Nd, Sm, Gd, Tb, Dy, Ho, Er, Yb, and Lu) have been
prepared by co-sputtering and studied by means of electron spin resonance
(ESR). It was found that the neutral dangling-bond density [D0] of a-SiN films
decreases with the presence of magnetic REs and the drop of [D0] approximately
scales with the spin and/or the de Gennes factor of each rare-earth element.
These results suggest that a strong exchange-like interaction,
H=J(RE-D0)S(RE).S(D0), between the spin of the magnetic REs and D0 may be
responsible for this behaviour, similarly to the decrease of Tc in RE-doped
superconductors.
","[{""version"":""v1"",""created"":""Tue, 10 Sep 2002 15:19:23 GMT""}]","2009-11-07"
"cond-mat/0209242","Hildegard Meyer-Ortmanns","Hildegard Meyer-Ortmanns","Immigration, integration and ghetto formation","10 pages, LaTeX2e, 16 postscript figures, to be published in
  Int.J.Mod.Phys.C14,no.3,2003",,"10.1142/S0129183103004504",,"cond-mat",,"  We study ghetto formation in a population with natives and immigrants in the
framework of the two-dimensional Ising-model with Kawasaki-exchange dynamics.
It is the phase structure of the Ising model, the integration speed and the
immigration rate which determine whether ghetto formation between natives and
immigrants can be avoided or not. Our simulations are performed in and out-of
equilibrium.
","[{""version"":""v1"",""created"":""Tue, 10 Sep 2002 15:20:09 GMT""}]","2009-11-07"
"cond-mat/0209243","Jens Oluf Andersen","Jens O. Andersen","Effective Field Theory for Goldstone Bosons in Nonrelativistic
  Superfluids","4 pages, 1 figure, revtex",,,,"cond-mat hep-ph",,"  We consider nonrelativistic superfluids where the global U(1)-symmetry is
spontaneously broken. At sufficiently long wavelengths, the relevant degree of
freedom is the massless Goldstone mode and we construct an effective low energy
theory for the Goldstone boson. The damping rate of collective excitations at
low energy is calculated. In the case of a weakly interacting Bose gas, we
recover the results by Beliaev, and by Hohenberg and Martin.
","[{""version"":""v1"",""created"":""Tue, 10 Sep 2002 15:44:40 GMT""}]","2007-05-23"
"gr-qc/0209030","Valdir B. Bezerra","Geusa de A. Marques (UFPb) and V. B. Bezerra (UFPb)","Hydrogen atom in the gravitational fields of topological defects","17 pages, LATEX file","Phys.Rev. D66 (2002) 105011","10.1103/PhysRevD.66.105011",,"gr-qc",,"  We consider a hydrogen atom in the background spacetimes generated by an
infinitely thin cosmic string and by a point-like global monopole. In both
cases, we find the solutions of the corresponding Dirac equations and we
determine the energy levels of the atom. We investigate how the geometric and
topological features of these spacetimes leads to shifts in the energy levels
as compared with the flat Minkowski spacetime.
","[{""version"":""v1"",""created"":""Mon, 9 Sep 2002 17:54:06 GMT""}]","2009-11-07"
"gr-qc/0209031","Gerald Kaiser","Gerald Kaiser","Electromagnetic Wavelets as Hertzian Pulsed Beams in Complex Spacetime","16 pages, 2 figures, ""Topics in Mathematical Physics, General
  Relativity and Cosmology"" conference (in honor of Jerzy Plebanski)
  <http://cabana.fis.cinvestav.mx/~merced/>",,,,"gr-qc math-ph math.CV math.MP",,"  Electromagnetic wavelets are a family of 3x3 matrix fields W_z(x')
parameterized by complex spacetime points z=x+iy with y timelike. They are
translates of a \sl basic \rm wavelet W(z) holomorphic in the future-oriented
union T of the forward and backward tubes. Applied to a complex polarization
vector p (representing electric and magnetic dipole moments), W(z) gives an
anti-selfdual solution W(z)p of Maxwell's equations derived from a selfdual
Hertz potential Z(z)=-iS(z)p, where S is the \sl Synge function \rm acting as a
Whittaker-like scalar Hertz potential. Resolutions of unity exist giving
representations of sourceless electromagnetic fields as superpositions of
wavelets. With the choice of a branch cut, S(z) splits into a difference of
retarded and advanced \sl pulsed beams \rm whose limits as y\to 0 give the
propagators of the wave equation. This yields a similar splitting of the
wavelets and leads to their complete physical interpretation as EM pulsed beams
absorbed and emitted by a \sl disk source \rm D(y) representing the branch cut.
The choice of y determines the beam's orientation, collimation and duration,
giving beams as sharp and pulses as short as desired. The sources are computed
as spacetime distributions of electric and magnetic dipoles supported on D(y).
The wavelet representation of sourceless electromagnetic fields now splits into
representations with advanced and retarded sources. These representations are
the electromagnetic counterpart of relativistic coherent-state representations
previously derived for massive Klein-Gordon and Dirac particles.
","[{""version"":""v1"",""created"":""Mon, 9 Sep 2002 18:26:38 GMT""},{""version"":""v2"",""created"":""Thu, 12 Sep 2002 19:57:33 GMT""}]","2007-05-23"
