"math-ph/0209045","Joel Feldman","Joel Feldman, Horst Knoerrer and Eugene Trubowitz","Convergence of Perturbation Expansions in Fermionic Models. Part 1:
  Nonperturbative Bounds","58 pages, 2 figures",,,,"math-ph math.MP",,"  An estimate on the operator norm of an abstract fermionic renormalization
group map is derived. This abstract estimate is applied in another paper to
construct the thermodynamic Green's functions of a two dimensional, weakly
coupled fermion gas with an asymmetric Fermi curve. The estimate derived here
is strong enough to control everything but the sum of all quartic contributions
to the Green's functions.
","[{""version"":""v1"",""created"":""Sat, 21 Sep 2002 21:11:53 GMT""}]","2007-05-23"
"math-ph/0209046","Joel Feldman","Joel Feldman, Horst Knoerrer and Eugene Trubowitz","Convergence of Perturbation Expansions in Fermionic Models. Part 2:
  Overlapping Loops","86 pages, 23 figures",,,,"math-ph math.MP",,"  We improve on the abstract estimate obtained in Part 1 by assuming that there
are constraints imposed by `overlapping momentum loops'. These constraints are
active in a two dimensional, weakly coupled fermion gas with a strictly convex
Fermi curve. The improved estimate is used in another paper to control
everything but the sum of all ladder contributions to the thermodynamic Green's
functions.
","[{""version"":""v1"",""created"":""Sat, 21 Sep 2002 21:16:10 GMT""}]","2007-05-23"
"math-ph/0209047","Joel Feldman","Joel Feldman, Horst Knoerrer and Eugene Trubowitz","A Two Dimensional Fermi Liquid. Part 1: Overview","55 pages, 30 figures",,,,"math-ph math.MP",,"  In a series of ten papers, of which this is the first, we prove that the
temperature zero renormalized perturbation expansions of a class of interacting
many-fermion models in two space dimensions have nonzero radius of convergence.
The models have ""asymmetric"" Fermi surfaces and short range interactions. One
consequence of the convergence of the perturbation expansions is the existence
of a discontinuity in the particle number density at the Fermi surface. Here,
we present a self contained formulation of our main results and give an
overview of the methods used to prove them.
","[{""version"":""v1"",""created"":""Sat, 21 Sep 2002 21:23:34 GMT""}]","2007-05-23"
"math-ph/0209048","Joel Feldman","Joel Feldman, Horst Knoerrer and Eugene Trubowitz","A Two Dimensional Fermi Liquid. Part 2: Convergence","76 pages, 8 figures",,,,"math-ph math.MP",,"  Using results established in other papers in our series, we prove the
existence of the infinite volume, temperature zero, thermodynamic Green's
functions of a two dimensional, weakly coupled fermion gas with an asymmetric
Fermi curve and short range interactions. This is done by showing that our
sequence of renormalization group maps converges.
","[{""version"":""v1"",""created"":""Sat, 21 Sep 2002 21:28:32 GMT""}]","2007-05-23"
"math-ph/0209049","Joel Feldman","Joel Feldman, Horst Knoerrer and Eugene Trubowitz","A Two Dimensional Fermi Liquid. Part 3: The Fermi Surface","73 pages, 3 figures",,,,"math-ph math.MP",,"  We show that the particle number density derived from the thermodynamic
Green's function at temperature zero constructed in the second part of this
series has a jump across the Fermi curve, a basic property of a Fermi liquid.
We further show that the two particle thermodynamic Green's function at
temperature zero has the regularity behavior expected in a Fermi liquid.
","[{""version"":""v1"",""created"":""Sat, 21 Sep 2002 21:32:29 GMT""}]","2007-05-23"
"math/0209283","Laurent Berger","Laurent Berger","Bloch and Kato's exponential map: three explicit formulas","22 pages, in english","Documenta Mathematica 2003, Kazuya Kato's fiftieth birthday. Extra
  Vol., 99--129.",,,"math.NT math.AG",,"  The purpose of this article is to give formulas for Bloch-Kato's exponential
map and its dual for an absolutely crystalline p-adic representation V, in
terms of the (phi,Gamma)-module associated to that representation. As a
corollary of these computations, we can give a very simple (and slightly
improved) description of Perrin-Riou's exponential map (which interpolates
Bloch-Kato's exponentials for V(k)). This new description directly implies
Perrin-Riou's reciprocity formula.
","[{""version"":""v1"",""created"":""Sat, 21 Sep 2002 18:40:13 GMT""}]","2010-02-22"
"math/0209284","Marie A. Vitulli","Marie A. Vitulli","Some normal monomial ideals",,,,,"math.AC math.AG",,"  In this paper we investigate the question of normality for special monomial
ideals in a polynomial ring over a field. We first include some expository
sections that give the basics on the integral closure of a ideal, the Rees
algebra on an ideal, and some fundamental results on the integral closure of a
monomial ideal.
","[{""version"":""v1"",""created"":""Sat, 21 Sep 2002 23:52:19 GMT""}]","2007-05-23"
"math/0209285","Marie A. Vitulli","Les Reid, Leslie G. Roberts, and Marie A. Vitulli","Some Results On Normal Homogeneous Ideals","19 pages",,,,"math.AC math.AG",,"  In this article we investigate when a homogeneous ideal in a graded ring is
normal, that is, when all positive powers of the ideal are integrally closed.
We are particularly interested in homogeneous ideals in an N-graded ring
generated by all homogeneous elements of degree at least m and monomial ideals
in a polynomial ring over a field. For ideals of the first trype we generalize
a recent result of S. Faridi. We prove that a monomial ideal in a polynomial
ring in n indeterminates over a field is normal if and only if the first n-1
positive powers of the ideal are integrally closed. We then specialize to the
case of ideals obtained by taking integral closures of m-primary ideals
generated by powers of the variables. We obtain classes of normal monomial
ideals and arithmetic critera for deciding when the monomial ideal is not
normal.
","[{""version"":""v1"",""created"":""Sun, 22 Sep 2002 01:10:38 GMT""}]","2007-05-23"
"math/0209286","Charles Frohman","Charles Frohman, William H. Meeks III","The Topological Classification of Minimal Surfaces in R^3",,,,,"math.DG math.GT",,"  We give a complete topological classification of minimal surfaces in
Euclidian three-space.
","[{""version"":""v1"",""created"":""Sun, 22 Sep 2002 02:13:19 GMT""}]","2007-05-23"
"math/0209287","Atsushi Moriwaki","Atsushi Moriwaki","The number of algebraic cycles with bounded degree",,,,,"math.AG math.NT",,"  Let X be a projective scheme over a finite field. In this paper, we consider
the asymptotic behavior of the number of effective cycles on X with bounded
degree as it goes to the infinity. By this estimate, we can define a certain
kind of zeta functions associated with groups of cycles. We also consider an
analogue in Arakelov geometry.
","[{""version"":""v1"",""created"":""Sun, 22 Sep 2002 06:49:53 GMT""}]","2007-05-23"
"math/0209288","Jarek Kedra","Tadeusz Januszkiewicz, Jarek Kedra","Characteristic classes of smooth fibrations","23 pages, 3 figures",,,,"math.SG math.AT math.GT",,"  We construct characteristic classes of smooth (Hamiltonian) fibrations as as
fiber integrals of products of Pontriagin (or Chern) classes of vertical vector
bundles over the total space of the universal fibration. We give explicit
formulae of these fiber integrals for toric manifolds and get estimates of the
dimension of the cohomology groups of classifying spaces.
","[{""version"":""v1"",""created"":""Sun, 22 Sep 2002 15:18:47 GMT""}]","2007-05-23"
"nlin/0209043","M. C. Nucci","M. C. Nucci","Lorenz integrable system moves \`a la Poinsot","14 pages, 6 figures","J. Math. Phys. 44 (2003) pp. 4107-4118","10.1063/1.1599955",,"nlin.SI math-ph math.DS math.MP nlin.CD",,"  A transformation is derived which takes Lorenz integrable system into the
well-known Euler equations of a free-torque rigid body with a fixed point, i.e.
the famous motion \`a la Poinsot. The proof is based on Lie group analysis
applied to two third order ordinary differential equations admitting the same
two-dimensional Lie symmetry algebra. Lie's classification of two-dimensional
symmetry algebra in the plane is used. If the same transformation is applied to
Lorenz system with any value of parameters, then one obtains Euler equations of
a rigid body with a fixed point subjected to a torsion depending on time and
angular velocity. The numerical solution of this system yields a
three-dimensional picture which looks like a ""tornado"" whose cross-section has
a butterfly-shape. Thus, Lorenz's {\em butterfly} has been transformed into a
{\em tornado}.
","[{""version"":""v1"",""created"":""Sun, 22 Sep 2002 02:14:53 GMT""},{""version"":""v2"",""created"":""Sun, 31 Aug 2003 21:15:28 GMT""}]","2009-11-07"
"nlin/0209044","Leonardo Trujillo","J. A. Gonzalez, L. Trujillo and A. Escalante","Intrinsic chaos and external noise in population dynamics","13 pages, Elsevier style","Physica A 324 (2003) 723-732","10.1016/S0378-4371(03)00075-X",,"nlin.CD q-bio.PE",,"  We address the problem of the relative importance of the intrinsic chaos and
the external noise in determining the complexity of population dynamics. We use
a recently proposed method for studying the complexity of nonlinear random
dynamical systems. The new measure of complexity is defined in terms of the
average number of bits per time-unit necessary to specify the sequence
generated by the system. This measure coincides with the rate of divergence of
nearby trajectories under two different realizations of the noise. In
particular, we show that the complexity of a nonlinear time-series model
constructed from sheep populations comes completely from the environmental
variations. However, in other situations, intrinsic chaos can be the crucial
factor. This method can be applied to many other systems in biology and
physics.
","[{""version"":""v1"",""created"":""Sun, 22 Sep 2002 11:06:38 GMT""},{""version"":""v2"",""created"":""Wed, 21 May 2003 18:38:51 GMT""}]","2009-11-07"
"nlin/0209045","Kenichi Maruno","Ken-ichi Maruno, Adrian Ankiewicz, Nail Akhmediev","Exact soliton solutions of the one-dimensional complex Swift-Hohenberg
  equation","32 pages, no figures, elsart.cls","Physica D 176 (2003) 44-66","10.1016/S0167-2789(02)00708-X",,"nlin.PS cond-mat.stat-mech math-ph math.MP nlin.SI physics.optics",,"  Using Painlev\'e analysis, the Hirota multi-linear method and a direct ansatz
technique, we study analytic solutions of the (1+1)-dimensional complex cubic
and quintic Swift-Hohenberg equations. We consider both standard and
generalized versions of these equations. We have found that a number of exact
solutions exist to each of these equations, provided that the coefficients are
constrained by certain relations. The set of solutions include particular types
of solitary wave solutions, hole (dark soliton) solutions and periodic
solutions in terms of elliptic Jacobi functions and the Weierstrass $\wp$
function. Although these solutions represent only a small subset of the large
variety of possible solutions admitted by the complex cubic and quintic
Swift-Hohenberg equations, those presented here are the first examples of exact
analytic solutions found thus far.
","[{""version"":""v1"",""created"":""Sun, 22 Sep 2002 13:55:37 GMT""},{""version"":""v2"",""created"":""Wed, 2 Oct 2002 05:00:08 GMT""},{""version"":""v3"",""created"":""Wed, 5 Mar 2003 05:41:05 GMT""}]","2009-11-07"
"nucl-th/0209067","Thomas Hemmert","Thomas R. Hemmert","Selected Topics in Near Threshold Pion Photoproduction and Compton
  Scattering off Nucleons","13 pages, Latex, 3 ps-figures",,,"TUM-T39-02-17","nucl-th",,"  Some open topics in the field of low energy photon-nucleon interactions are
discussed--which in my opinion are of interest both for obtaining new
information on nucleon structure as well as for precision tests of our
theoretical understanding of chiral dynamics. In particular, I discuss p-wave
multipoles in charged pion photoproduction off protons as well as the role of
spin-dependent effects in (unpolarized) Compton scattering off nucleons. There
the concept of dynamical spin polarizabilities is found to be essential for the
understanding of differential Compton cross sections above 120 MeV cms photon
energy.
","[{""version"":""v1"",""created"":""Sat, 21 Sep 2002 17:42:22 GMT""}]","2007-05-23"
"nucl-th/0209068","David Blaschke","H. Grigorian, D. Blaschke, G. Poghosyan","Mapping Deconfinement with a Compact Star Phase Diagram","4 pages, 2 figures, Contribution to Proceedings of Quark Matter 2002,
  Nantes, July 18 - 24, 2002","Nucl.Phys. A715 (2003) 831-834","10.1016/S0375-9474(02)01513-0","MPG-VT-UR 233/02","nucl-th",,"  We have found correlations between properties of the equation of state for
stellar matter with a phase transition at supernuclear densities and two
characteristic features of a ""phase diagram"" for rotating compact stars in the
angular velocity - baryon number plane: 1) the critical dividing line between
mono- and two-phase star configurations and 2) the maximum mass line. The
second line corresponds to the minimum mass function for black hole candidates
whereas the first one is observable by a population statistics, e.g. for
Z-sources in low-mass X-ray binaries. The observation of a population gap in
the mass distribution for the latter is suggested as an astrophysical
verification of the existence of a first order phase transition in QCD at high
densities such as the deconfinement.
","[{""version"":""v1"",""created"":""Sun, 22 Sep 2002 00:17:26 GMT""}]","2009-11-07"
"physics/0209081","Chris Adami","C. Adami (JPL, Caltech)","Ab Initio Modeling of Ecosystems with Artificial Life","13 pages, 2 figures","Natural Resource Modeling 15 (2002) 133-145",,,"physics.bio-ph q-bio.PE",,"  Artificial Life provides the opportunity to study the emergence and evolution
of simple ecosystems in real time. We give an overview of the advantages and
limitations of such an approach, as well as its relation to individual-based
modeling techniques. The Digital Life system Avida is introduced and prospects
for experiments with ab initio evolution (evolution ""from scratch""),
maintenance, as well as stability of ecosystems are discussed.
","[{""version"":""v1"",""created"":""Sun, 22 Sep 2002 00:30:08 GMT""}]","2007-05-23"
"quant-ph/0209116","Robert B. Griffiths","Robert B. Griffiths","Probabilities and Quantum Reality: Are There Correlata?","Latex 31 pages, 3 figures in text using PSTricks",,"10.1023/A:1026092212820",,"quant-ph",,"  Any attempt to introduce probabilities into quantum mechanics faces
difficulties due to the mathematical structure of Hilbert space, as reflected
in Birkhoff and von Neumann's proposal for a quantum logic. The (consistent or
decoherent) histories solution is provided by its single framework rule, an
approach that includes conventional (Copenhagen) quantum theory as a special
case. Mermin's Ithaca interpretation addresses the same problem by defining
probabilities which make no reference to a sample space or event algebra
(``correlations without correlata''). But this leads to severe conceptual
difficulties, which almost inevitably couple quantum theory to unresolved
problems of human consciousness. Using histories allows a sharper quantum
description than is possible with a density matrix, suggesting that the latter
provides an ensemble rather than an irreducible single-system description as
claimed by Mermin. The histories approach satisfies the first five of Mermin's
desiderata for a good interpretation of quantum mechanics, including Einstein
locality, but the Ithaca interpretation seems to have difficulty with the first
(independence of observers) and the third (describing individual systems).
","[{""version"":""v1"",""created"":""Sat, 21 Sep 2002 20:15:49 GMT""}]","2022-10-12"
