"astro-ph/0209447","Fabrizio Lucarelli","F. Lucarelli (1), A. Konopelko (2), F. Aharonian (2), W. Hofmann (2),
  A. Kohnle (2), H. Lampeitl (2) and V. Fonseca (1) ((1) Facultad de Ciencias
  Fisicas, Universidad Complutense, Madrid, Spain, (2) Max-Planck-Institut fur
  Kernphysik, Heidelberg, Germany)","Observations of the Crab Nebula with the HEGRA system of IACTs in
  convergent mode using a topological trigger","18 pages, 9 figures, accepted for publication in ""Astroparticle
  Physics""","Astropart.Phys. 19 (2003) 339-350","10.1016/S0927-6505(02)00218-9",,"astro-ph",,"  Routine observations of the Crab Nebula for a total of about 250 hrs,
performed with the HEGRA stereoscopic system of 5 imaging atmospheric Cerenkov
telescopes in the standard operational mode, have proven the energy threshold
of the system to be 500 GeV for small zenith angles (< 20 deg). A topological
trigger applied along with the convergent observational mode allows to reduce
noticeably the energy threshold of the system down to 350 GeV. Here we present
the relevant Monte Carlo simulations as well as the analysis results of 15 hrs
Crab Nebula data taken in such an observational mode. From the Crab Nebula
data, the final energy threshold was found to be 350 GeV. The estimated gamma
ray flux from the Crab Nebula above 350 GeV is (8.1 +- 0.1(stat) +- 0.2(syst))
10^(-11) ph cm^(-2) s^(-1), which is consistent with recent measurements
reported by the STACEE, CELESTE, CAT, and Whipple groups.
","[{""version"":""v1"",""created"":""Sat, 21 Sep 2002 16:24:31 GMT""}]","2009-11-07"
"astro-ph/0209448","Vygandas Laugalys","V. Straizys, K. Cernis, A. Kazlauskas and V. Laugalys","Photometric investigation of the MBM 12 molecular cloud area in Aries.
  II. Cloud distance","17 pages, 1 figure to be published in Baltic Astronomy journal","Baltic Astron. 11 (2002) 231-247",,,"astro-ph",,"  Photoelectric magnitudes and color indices in the Vilnius seven-color system
for 152 stars are used to investigate the interstellar extinction in the area
of the Aries molecular cloud MBM 12, coinciding with the L1454 and L1457 dust
clouds. Spectral types, absolute magnitudes, color excesses, interstellar
extinctions and distances of the stars are determined. The plot of interstellar
extinction Av versus distance shows that the dust cloud is situated at a
distance of 325 pc, at 180 pc from the Galactic plane, and its true diameter is
about 11 pc. The interstellar extinction law in the area is found to be normal,
typical for the diffuse dust. Ten peculiar or unresolved binary stars and some
heavily reddened stars are detected.
","[{""version"":""v1"",""created"":""Sat, 21 Sep 2002 16:45:29 GMT""}]","2007-05-23"
"astro-ph/0209449","Vygandas Laugalys","V. Laugalys and V. Straizys","CCD photometry and classification of stars in the North America and
  Pelican nebulae region. I. Moletai photometry","14 pages, 6 figures to be published in Baltic Astronomy journal","Baltic Astron. 11 (2002) 205-218",,,"astro-ph",,"  Magnitudes and color indices in the Vilnius seven-color system are measured
for 690 stars down to ~13.2 mag in the area of the North America and Pelican
nebulae. Spectral types, absolute magnitudes, color excesses, interstellar
extinctions and distances of the stars are determined. The plots of
interstellar extinction Av versus distance for the North America Nebula and for
the dark cloud L935 show that both areas are covered by the same absorbing
cloud, situated at a distance of 600 pc. The maximal extinction in the area of
the nebula is ~3 mag, while in the dark cloud L935 it is much greater.
","[{""version"":""v1"",""created"":""Sat, 21 Sep 2002 17:06:51 GMT""}]","2007-05-23"
"astro-ph/0209450","Andrew Blain","Andrew W. Blain (Caltech), V. E. Barnard (Cavendish Astrophysics),
  Scott C. Chapman (Caltech)","Submillimetre and far-infrared spectral energy distributions of
  galaxies: the luminosity-temperature relation and consequences for
  photometric redshifts","14 pages, 14 figures, in press at MNRAS. Replaced with final updated
  proof version","Mon.Not.Roy.Astron.Soc. 338 (2003) 733-744","10.1046/j.1365-8711.2003.06086.x",,"astro-ph",,"  The spectral energy distributions (SEDs) of dusty high-redshift galaxies are
poorly sampled in frequency and spatially unresolved. Their form is crucially
important for estimating the large luminosities of these galaxies accurately,
for providing circumstantial evidence concerning their power sources, and for
estimating their redshifts in the absence of spectroscopic information. We
discuss the suite of parameters necessary to describe their SEDs adequately
without introducing unnecessary complexity. We compare directly four popular
descriptions, explain the key degeneracies between the parameters in each when
confronted with data, and highlight the differences in their best-fitting
values. Using one representative SED model, we show that fitting to even a
large number of radio, submillimetre and far-infrared (far-IR) continuum
colours provides almost no power to discriminate between the redshift and dust
temperature of an observed galaxy, unless an accurate relationship with a tight
scatter exists between luminosity and temperature for the whole galaxy
population. We review our knowledge of this luminosity-dust temperature
relation derived from three galaxy samples, to better understand the size of
these uncertainties. Contrary to recent claims, we stress that far-IR-based
photometric redshifts are unlikely to be sufficiently accurate to impose useful
constraints on models of galaxy evolution: finding spectroscopic redshifts for
distant dusty galaxies will remain essential.
","[{""version"":""v1"",""created"":""Sat, 21 Sep 2002 21:35:37 GMT""},{""version"":""v2"",""created"":""Thu, 14 Nov 2002 20:40:55 GMT""}]","2009-11-07"
"astro-ph/0209451","Craig J. Hogan","Craig J. Hogan","Information from the Beginning","8 pages, LateX, lecture delivered at ""The Early Universe and the
  Cosmic Microwave Background: Theory and Observations,"" Palermo, September
  2002",,,,"astro-ph gr-qc hep-th",,"  Requiring black hole evaporation to be quantum-mechanically coherent imposes
a universal, finite ``holographic bound'', conjectured to be due to fundamental
discreteness of quantized gravity, on the amount of information carried by any
physical system. This bound is applied to the information budget in the
standard slow-roll model of cosmic inflation. A simple estimate suggests that
when quantum gravity is included, fluctuations during inflation have a discrete
spectrum with a limited information content, only about 10^5 bits per mode,
fixed by the inverse scalar perturbation amplitude. This scarcity of
information may allow direct observation of quantum-gravity eigenmodes in the
anisotropy of cosmic background radiation.
","[{""version"":""v1"",""created"":""Sun, 22 Sep 2002 04:45:55 GMT""}]","2007-05-23"
"astro-ph/0209452","Nozomu Kawakatu","Nozomu Kawakatu, Masayuki Umemura, Masao Mori","Proto-Quasars:Physical States and Observable Properties","7pages,7figures,accepted for publication in ApJ","Astrophys.J. 583 (2003) 85-91","10.1086/345085",,"astro-ph",,"  Based on the radiation hydrodynamical model for the black hole(BH)
growth,incorporated with the chemical evolution of the early-type host galaxy,
we construct the coevolution model of a QSO BH and the host galaxy. As a
result, it is found that after a galactic wind epoch,the luminosity is shifted
from the host-dominant phase to the AGN-dominant phase (QSO phase) in the
timescale of a few $10^{8}$ years.The former phase corresponds to the early
stage of growing BH, and can be regarded as a ``proto-QSO'' phase. It has
observable characteristic properties (detail inthis paper).By comparing these
predictions with recent observations, radio galaxies are a possible candidate
for proto-QSOs.Also, it is anticipated that the proto-QSO phase is preceded by
an optically thick phase, which may correspond to ULIRGs.In this phase, $M_{\rm
BH}/M_{\rm bulge}$ is predicted to be much less than $10^{-3}$ and grow with
metallicity.Moreover, as precursors of ULIRGs, optically-thin star-forming
galaxies are predicted. These may be in the assembly phase of Lyman break
galaxies (LBGs) or Ly$\alpha$ emitters.
","[{""version"":""v1"",""created"":""Sun, 22 Sep 2002 09:58:19 GMT""}]","2009-11-07"
"astro-ph/0209453","H. Shojaie","H. Shojaie, M. Farhoudi","Black holes in the varying speed of light theory","5 pages","Can.J.Phys.85:1409-1415,2007","10.1139/P07-131",,"astro-ph gr-qc",,"  We consider the effect of the \emph{Varying Speed of Light} theory on
non-rotating black holes. We show that in any varying-$c$ theory, the
Schwarzschild solution is neither static nor stationary. For a no-charged black
hole, the singularity in the Schwarzschild horizon cannot be removed by
coordinate transformation. Hence, no matter can enter the horizon, and the
interior part of the black hole is separated from the rest of the Universe. If
$\dot{c}<0$, then the size of the Schwarzschild radius increases with time. The
higher value of the speed of light in the very early Universe may have caused a
large reduction in the probability of the creation of the primordial black
holes and their population.The same analogy is also considered for the charged
black holes.
","[{""version"":""v1"",""created"":""Sun, 22 Sep 2002 11:05:03 GMT""},{""version"":""v2"",""created"":""Tue, 27 Jul 2004 16:54:56 GMT""},{""version"":""v3"",""created"":""Wed, 19 Dec 2007 06:05:52 GMT""}]","2008-11-26"
"astro-ph/0209454","Dieter Horns","D. Horns (1), and the HEGRA collaboration ((1) Max-Planck-Institute f.
  Kernphysik, Heidelberg)","Multi-wavelength observations of the TeV Blazars Mkn~421, 1ES1959+650,
  and H1426+428 with the HEGRA Cherenkov telescopes and the RXTE X-ray
  satellite","6 pages, 4 figures, will appear in the Proceedings for ""High Energy
  Blazar astronomy"", Turku, Finland 2002",,,,"astro-ph",,"  Recent results obtained with the HEGRA system of imaging Cherenkov telescopes
on the TeV emission of the Blazars Mkn~421 ($z=0.030$), 1ES1959+650
($z=0.047$), and H1426+428 ($z=0.129$) are reported. For Mkn~421, a close
connection of the average flux level and spectral shape has been observed
during the periods of increased activity in the years 2000 and 2001.
Simultaneously taken data with the RXTE X-ray satellite reveal a complex light
curve at X-ray and TeV energies. After a deep exposure of 94 hrs, the object
1ES1959+650 was detected at the significance level of 5.4$\sigma$ with a soft
energy spectrum following a power-law with a photon-index of $3.3 \pm 0.7$.
During recent observations in May 2002, the source has shown increased activity
with indications for a flattening of the energy spectrum.
  The high energy peaked Blazar H1426+428 has recently been identified as a
source of TeV photons. Since the source is fairly distant (z=0.129), absorption
of TeV photons due to pair-production on the optical and near infrared
extragalactic light becomes important and should leave a signature in the
observed TeV energy spectrum. Notably, the TeV energy spectrum determined with
the HEGRA system of Cherenkov telescopes agrees with the expectation of a
strongly absorbed source spectrum.
","[{""version"":""v1"",""created"":""Sun, 22 Sep 2002 13:25:11 GMT""}]","2007-05-23"
"cond-mat/0209507","Leonya Levitov","L.S. Levitov, E.I. Rashba","Dynamical spin-electric coupling in a quantum dot","4 pages, 2 figures","Phys. Rev. B 67, 115324 (2003)","10.1103/PhysRevB.67.115324",,"cond-mat.mes-hall",,"  Due to the spin-orbital coupling in a semiconductor quantum dot, a freely
precessing electron spin produces a time-dependent charge density. This creates
a sizeable electric field outside the dot, leading to promising applications in
spintronics. The spin-electric coupling can be employed for non-invasive single
spin detection by electrical methods. We also consider a spin relaxation
mechanism due to long-range coupling to electrons in gates and elsewhere in the
system, and find a contribution comparable to, and in some cases dominant over
previously discussed mechanisms.
","[{""version"":""v1"",""created"":""Sat, 21 Sep 2002 18:35:03 GMT""}]","2008-04-12"
"cond-mat/0209509","Adam Micolich","Adam P. Micolich","Fractal Magneto-conductance Fluctuations in Mesoscopic Semiconductor
  Billiards","Ph.D. Thesis - Completed May 2000. 241 pages as 3.43MB PDF file.
  Higher quality version available at
  http://www.phys.unsw.edu.au/~mico/downloads/downloads.html . Questions,
  comments, etc to mico@phys.unsw.edu.au",,,,"cond-mat.mes-hall nlin.CD",,"  Negatively biased surface-gates allow electrostatic depletion of selected
regions of a 2DEG, forming confined regions of specific geometry called
billiards, in which ballistic transport occurs. At millikelvin temperatures,
the electron phase coherence length is sufficient that quantum interference
effects produce reproducible magneto-conductance fluctuations (MCF) that act as
a 'magneto-fingerprint' of the scattering dynamics in the billiard. It has been
predicted that billiard MCF are fractal. Fractal MCF in mesoscopic
semiconductor billiards are investigated experimentally. The MCF of a Sinai
billiard displayed exact self-similarity (ESS). A correlation function analysis
is used to quantify the presence of ESS. A model for the Sinai billiard MCF
based on a Weierstrass function is presented. Using a bridging interconnect, a
continuous transition between the Sinai and an empty square geometry is
achieved. The removal of the circle induces a transition from ESS to
statistical self-similarity (SSS), suggesting that ESS is due to the presence
of an obstacle at the center of the billiard. The physical dependencies of SSS
are investigated and show variation in the fractal dimension, rather than the
fractal scaling range. SSS obeys a unified picture where the fractal dimension
depends only on the ratio between the average spacing and broadening of
billiard energy levels, irrespective of other billiard parameters. The
semiclassical origin of SSS is demonstrated and the suppression of SSS is
observed in both the quantum and classical limits. The influence of soft-wall
potential profile on fractal MCF is investigated using double-2DEG billiards.
Detailed reviews of semiconductor billiard fabrication, low-temperature
electrical measurements and fractal analysis are also presented.
","[{""version"":""v1"",""created"":""Sun, 22 Sep 2002 15:46:46 GMT""}]","2007-05-23"
"cs/0209024","Andrzej Karbowski","Andrzej Karbowski","Errors in Low and Lapsley's article ""Optimization Flow Control, I: Basic
  Algorithm and Convergence""","The mathematical errors in one of the most cited network publication
  are presented","Karbowski, A., Comments on ""Optimization Flow Control, I: Basic
  Algorithm and Convergence"", IEEE/ACM Trans. on Networking, vol. 11(2), pp.
  338-339, 2003",,,"cs.NI cs.DC","http://arxiv.org/licenses/nonexclusive-distrib/1.0/","  In the note two errors in Low and Lapsley's article ""Optimization Flow
Control, I: Basic Algorithm and Convergence"", ""IEEE/ACM Transactions on
Networking"", 7(6), pp. 861-874, 1999, are shown. Because of these errors the
proofs of both theorems presented in the article are incomplete and some
assessments are wrong.
","[{""version"":""v1"",""created"":""Sat, 21 Sep 2002 22:53:21 GMT""},{""version"":""v2"",""created"":""Sat, 8 Oct 2016 15:56:24 GMT""}]","2016-10-11"
"cs/0209025","Andrzej Karbowski","Andrzej Karbowski","Correction to Low and Lapsley's article ""Optimization Flow Control, I:
  Basic Algorithm and Convergence""","The corrections to errors in one of the most important articles on
  network management are presented","IEEE/ACM Trans. on Networking, vol. 11(2), pp. 338-339, 2003",,,"cs.NI cs.DC","http://arxiv.org/licenses/nonexclusive-distrib/1.0/","  In the note an error in Low and Lapsley's article (""Optimization Flow
Control, I: Basic Algorithm and Convergence"", IEEE/ACM Transactions on
Networking, 7(6), pp. 861-874, 1999) is pointed out. Because of this error the
proof of the Theorem 2 presented in the article is incomplete and some
assessments are wrong. In the second part of the note the author proposes a
correction to this proof.
","[{""version"":""v1"",""created"":""Sat, 21 Sep 2002 23:19:13 GMT""},{""version"":""v2"",""created"":""Sat, 8 Oct 2016 12:49:32 GMT""}]","2016-10-11"
"gr-qc/0209078","Leonid V. Verozub","L. Verozub and A. Kochetov","Testing of Metric-Field Equations of Gravitation by Binary Pulsar","8 pages, 1 figure, latex","Grav.Cosmol. 6 (2000) 246",,,"gr-qc astro-ph",,"  Testing of the gravitation equations, proposed by one of the authors earlier,
by a binary pulsar is considered. It has been shown that the formulas for the
gravitation radiation of the system resulting from the equations do not
contradict the available observations data.
","[{""version"":""v1"",""created"":""Sun, 22 Sep 2002 12:42:21 GMT""}]","2007-05-23"
"hep-ex/0209058","Makoto C. Fujiwara","M.C. Fujiwara (Univ. of Tokyo) and M. Marchesotti (CERN)","A novel current mode operating beam counter based on not preamplified
  HPDs","17 pages, 13 figures","Nucl.Instrum.Meth.A484:162-173,2002","10.1016/S0168-9002(01)02033-2",,"hep-ex nucl-ex",,"  A novel system to monitor the intensity and the stability of a bunched beam
of $\simeq 1.2\times 10^{7}$ antiprotons ($\bar{p}$s) with a length of $\simeq$
250 ns (FWHM) and to measure its trapping efficiency in a Penning trap is
described. This system operates parasitically detecting the pions from the
annihilation of part of the beam in a degrader. Six plastic scintillators have
been coupled from one side to six proximity focused HPDs without preamplifiers
and operating in current mode. This device works in the stray field of the
ATHENA magnet with no loss of efficiency; the gain can be varied from zero to a
few thousands with a precision better than 0.1% and the dynamic range is larger
than 8 orders of magnitude. Linearity and stability have been measured up to
charge responses of 100 nC, corresponding to the beam completely dumped. The
beam counter has been calibrated in two different and independent ways giving
consistent results.
","[{""version"":""v1"",""created"":""Sat, 21 Sep 2002 16:22:59 GMT""}]","2009-12-30"
"hep-lat/0209146","Maria Paola Lombardo","M. D'Elia, M.-P. Lombardo","Finite density QCD via imaginary chemical potential","27 pages, 10 figures, comments and references added","Phys.Rev. D67 (2003) 014505","10.1103/PhysRevD.67.014505","GEF-TH-2002-12","hep-lat hep-ph",,"  We study QCD at nonzero temperature and baryon density in the framework of
the analytic continuation from imaginary chemical potential. We carry out
simulations of QCD with four flavor of staggered fermions, and reconstruct the
phase diagram in the temperature-imaginary \mu plane. We consider ans\""atze for
the analytic continuation of the critical line and other observables motivated
both by theoretical considerations and mean field calculations in four fermion
models and random matrix theory. We determine the critical line, and the
analytic continuation of the chiral condensate, up to \mu_B approx. 500 MeV.
The results are in qualitative agreement with the predictions of model field
theories, and consistent with a first order chiral transition. The correlation
between the chiral transition and the deconfinement transition observed at
\mu=0 persists at nonzero density.
","[{""version"":""v1"",""created"":""Sat, 21 Sep 2002 17:42:13 GMT""},{""version"":""v2"",""created"":""Tue, 1 Oct 2002 15:26:56 GMT""}]","2009-11-07"
"hep-lat/0209147","Thomas Hemmert","Thomas R. Hemmert (1) and Wolfram Weise (1,2) ((1) TU Muenchen, (2)
  ECT Trento)","Nucleon Magnetic Moments, their Quark Mass Dependence and Lattice QCD
  Extrapolations","4 pages, Latex, 3 ps figures, uses world-scientific style, talk given
  at Baryons 2002",,,"TUM-T39-02-16","hep-lat",,"  We calculate the quark mass dependence of both isovector and isoscalar
anomalous magnetic moments of the nucleon in a chiral effective field theory
with explicit pion, nucleon and Delta(1232) degrees of freedom to
leading-one-loop order. In the isovector sector we fit 3 unknown couplings of
the effective Lagrangian to available lattice data and obtain a surprisingly
well-behaved extrapolation function connecting the chiral limit, experimental
data and the lattice simulations. We also discuss the polynomial quark mass
dependence in the isoscalar sector and finally compare with the Pade formula of
the Adelaide group.
","[{""version"":""v1"",""created"":""Sat, 21 Sep 2002 19:46:30 GMT""}]","2007-05-23"
"hep-ph/0209249","Prashanth Jaikumar","Prashanth Jaikumar, Ismail Zahed","Scalar-isoscalar excitation in dense quark matter","RevTeX, 11 pages, 4 figs","Phys.Rev. C67 (2003) 045202","10.1103/PhysRevC.67.045202",,"hep-ph",,"  We study the spectrum of scalar-isoscalar excitations in the color-flavor
locked phase of dense quark matter. The sigma meson in this phase appears as a
four-quark state (of diquark and anti-diquark) with a well-defined mass and
extremely small width, as a consequence of it's small coupling to two pions.
The quark particle/hole degrees of freedom also contribute significantly to the
correlator just above the threshold 2\Delta where \Delta is the superconducting
gap.
","[{""version"":""v1"",""created"":""Sun, 22 Sep 2002 04:18:23 GMT""}]","2009-11-07"
"hep-th/0209180","F. Loran","F. Loran","Abelianization of First Class Constraints","To appear in PLB","Phys.Lett. B547 (2002) 63-68","10.1016/S0370-2693(02)02734-X",,"hep-th",,"  We show that a given set of first class constraints becomes abelian if one
maps each constraint to the surface of other constraints. There is no
assumption that first class constraints satisfy a closed algebra. The explicit
form of the projection map is obtained at least for irreducible first class
constraints. Using this map we give a method to obtain gauge fixing conditions
such that the set of abelian first class constraints and gauge fixing
conditions satisfy the symplectic algebra.
","[{""version"":""v1"",""created"":""Sun, 22 Sep 2002 07:40:59 GMT""}]","2009-11-07"
"math-ph/0209040","Joel Feldman","Joel Feldman, Horst Knoerrer and Eugene Trubowitz","Single Scale Analysis of Many Fermion Systems. Part 1: Insulators","42 pages",,"10.1142/S0129055X03001801",,"math-ph math.MP",,"  We construct, using fermionic functional integrals, thermodynamic Green's
functions for a weakly coupled fermion gas whose Fermi energy lies in a gap.
Estimates on the Green's functions are obtained that are characteristic of the
size of the gap. This prepares the way for the analysis of single scale
renormalization group maps for a system of fermions at temperature zero without
a gap.
","[{""version"":""v1"",""created"":""Sat, 21 Sep 2002 20:26:53 GMT""}]","2009-11-07"
"math-ph/0209041","Joel Feldman","Joel Feldman, Horst Knoerrer and Eugene Trubowitz","Single Scale Analysis of Many Fermion Systems. Part 2: The First Scale","45 pages",,"10.1142/S0129055X03001795",,"math-ph math.MP",,"  The first renormalization group map arising from the momentum space
decomposition of a weakly coupled system of fermions at temperature zero
differs from all subsequent maps. Namely, the component of momentum dual to
temperature may be arbitrarily large - there is no ultraviolet cutoff. The
methods of Part 1 are supplemented to control this special case.
","[{""version"":""v1"",""created"":""Sat, 21 Sep 2002 20:43:31 GMT""}]","2009-11-07"
"math-ph/0209042","Joel Feldman","Joel Feldman, Horst Knoerrer and Eugene Trubowitz","Single Scale Analysis of Many Fermion Systems. Part 3: Sectorized Norms","82 pages, 6 figures",,,,"math-ph math.MP",,"  The generic renormalization group map associated to a weakly coupled system
of fermions at temperature zero is treated by supplementing the methods of Part
1. The interplay between position and momentum space is captured by `sectors'.
It is shown that the difference between the complete four legged vertex and its
`ladder' part is irrelevant for the sequence of renormalization group maps.
","[{""version"":""v1"",""created"":""Sat, 21 Sep 2002 20:52:09 GMT""}]","2007-05-23"
"math-ph/0209043","Joel Feldman","Joel Feldman, Horst Knoerrer and Eugene Trubowitz","Single Scale Analysis of Many Fermion Systems. Part 4: Sector Counting","52 pages, 2 figures",,"10.1142/S0129055X03001783",,"math-ph math.MP",,"  For a two dimensional, weakly coupled system of fermions at temperature zero,
one principal ingredient used to control the composition of the associated
renormalization group maps is the careful counting of the number of quartets of
sectors that are consistent with conservation of momentum. A similar counting
argument is made to show that particle-particle ladders are irrelevant in the
case of an asymmetric Fermi curve.
","[{""version"":""v1"",""created"":""Sat, 21 Sep 2002 21:01:12 GMT""}]","2015-06-26"
"math-ph/0209044","Joel Feldman","Joel Feldman, Horst Knoerrer and Eugene Trubowitz","Particle-Hole Ladders","131 pages, 26 figures",,,,"math-ph math.MP",,"  A self contained analysis demonstrates that the sum of all particle-hole
ladder contributions for a two dimensional, weakly coupled fermion gas with a
strictly convex Fermi curve at temperature zero is bounded. This is used in our
construction of two dimensional Fermi liquids.
","[{""version"":""v1"",""created"":""Sat, 21 Sep 2002 21:06:50 GMT""}]","2007-05-23"
