"cond-mat/0205155","Marco Baiesi","M. Baiesi, E. Orlandini, A.L. Stella","Topological and geometrical entanglement in a model of circular DNA
  undergoing denaturation","7 pages, 11 figures, revtex","Eur. Phys. J. B 28, 467-473 (2002)","10.1140/epjb/e2002-00249-y","DFPR 02/CM/09","cond-mat.stat-mech q-bio",,"  The linking number (topological entanglement) and the writhe (geometrical
entanglement) of a model of circular double stranded DNA undergoing a thermal
denaturation transition are investigated by Monte Carlo simulations. By
allowing the linking number to fluctuate freely in equilibrium we see that the
linking probability undergoes an abrupt variation (first-order) at the
denaturation transition, and stays close to 1 in the whole native phase. The
average linking number is almost zero in the denatured phase and grows as the
square root of the chain length, N, in the native phase. The writhe of the two
strands grows as the square root of N in both phases.
","[{""version"":""v1"",""created"":""Wed, 8 May 2002 14:39:07 GMT""}]","2007-05-23"
"cond-mat/0205156","Th. M. Nieuwenhuizen","A.E. Allahverdyan and Th.M. Nieuwenhuizen","On testing the violation of the Clausius inequality in nanoscale
  electric circuits","5 pages revtex 4. No figures",,"10.1103/PhysRevB.66.115309","ITFA-2002-16","cond-mat.mes-hall cond-mat.dis-nn cond-mat.stat-mech",,"  The Clausius inequality, one of the classical formulations of the second law,
was recently found to be violated in the quantum regime. Here this result is
formulated in the context of a mesoscopic or nanoscale linear RLC circuit
interacting with a thermal bath. Previous experiments in this and related
fields are analyzed and possibilities of experimental detection of the
violation are pointed out. It is discussed that recent experiments reached the
range of temperatures, where the effect should be visible, and that a part of
the proposal was already confirmed.
","[{""version"":""v1"",""created"":""Wed, 8 May 2002 14:47:27 GMT""}]","2009-11-07"
"cond-mat/0205157","Tamar Djobava","J. G. Chigvinadze, A. A. Iashvili, T. V. Machaidze","On amplitude oscillation of vibrations of strongly anisotropic
  high-temperature superconductors of BiPbSrCaCuO system","8 pages, 7 figures",,"10.1016/S0375-9601(02)00805-8",,"cond-mat",,"  Effect of oscillations of the vibration amplitude of cylindrical sample
suspended by a thin elastic thread and vibrating in a transverse magnetic field
and containing 2D quasi-two-dimensional vortices (pancakes), was observed in
the strongly anisotropic high-$T_{c}$ superconductor of
$Bi_{1.7}Pb_{0.3}Sr_{2}Ca_{2}Cu_{3}O_{y}$ system.
","[{""version"":""v1"",""created"":""Wed, 8 May 2002 15:30:54 GMT""}]","2009-11-07"
"cond-mat/0205159","Stephen Hill","A. E. Kovalev, S. Hill, J. S. Qualls","Determination of the Fermi Velocity by Angle-dependent Periodic Orbit
  Resonance Measurements in the Organic Conductor alpha-(BEDT-TTF)2KHg(SCN)4","28 pages, including 6 figures. Submitted to PRB",,"10.1103/PhysRevB.66.134513",,"cond-mat.str-el",,"  We report detailed angle-dependent studies of the microwave (f=50 to 90 GHz)
interlayer magneto-electrodynamics of a single crystal sample of the organic
charge-density-wave (CDW) conductor alpha-(BEDT-TTF)2KHg(SCN)4. Recently
developed instrumentation enables both magnetic field (B) sweeps for a fixed
sample orientation and, for the first time, angle sweeps at fixed f/B. We
observe series' of resonant absorptions which we attribute to periodic orbit
resonances (POR) - a phenomenon closely related to cyclotron resonance. The
angle dependence of the POR indicate that they are associated with the low
temperature quasi-one-dimensional (Q1D) Fermi surface (FS) of the title
compound; indeed, all of the resonance peaks collapse beautifully onto a single
set of f/B versus angle curves, generated using a semiclassical
magneto-transport theory for a single Q1D FS. We show that Q1D POR measurements
provide one of the most direct methods for determining the Fermi velocity,
without any detailed assumptions concerning the bandstructure; our analysis
yields an average value of v_F=6.5x10^4 m/s. Quantitative analysis of the POR
harmonic content indicates that the Q1D FS is strongly corrugated. This is
consistent with the assumption that the low-temperature FS derives from a
reconstruction of the high temperature quasi-two-dimensional FS, caused by the
CDW instability. Detailed analysis of the angle dependence of the POR yields
parameters associated with the CDW superstructure which are consistent with
published results. Finally, we address the issue as to whether or not the
interlayer electrodynamics are coherent in the title compound.
","[{""version"":""v1"",""created"":""Wed, 8 May 2002 15:43:56 GMT""}]","2009-11-07"
"cond-mat/0205160","Igor I. Smolyaninov","I.I. Smolyaninov, A.V. Zayats, C.C. Davis","Light controlled photon tunneling","11 pages, 3 figures","Appl.Phys.Letters 81, 3314-3316 (2002)","10.1063/1.1518778",,"cond-mat.str-el",,"  Recent measurements of photon tunneling through individual subwavelength
pinholes in a gold film covered with a layer of polydiacetylene (Phys. Rev.
Letters 88, 187402 (2002)) provided strong indication of ""photon blockade""
effect similar to Coulomb blockade phenomenon observed in single-electron
tunneling experiments. Here we report first observation of photon tunneling
been blocked (gated) by light at a different wavelength. This observation
suggests possibility of building new class of photon tunneling gating devices
for all-optical signal processing.
","[{""version"":""v1"",""created"":""Wed, 8 May 2002 15:47:29 GMT""}]","2009-11-07"
"cs/0205006","Marco Baroni","Marco Baroni, Johannes Matiasek and Harald Trost","Unsupervised discovery of morphologically related words based on
  orthographic and semantic similarity","10 pages, to appear in the Proceedings of the Morphology/Phonology
  Learning Workshop of ACL-02",,,,"cs.CL",,"  We present an algorithm that takes an unannotated corpus as its input, and
returns a ranked list of probable morphologically related pairs as its output.
The algorithm tries to discover morphologically related pairs by looking for
pairs that are both orthographically and semantically similar, where
orthographic similarity is measured in terms of minimum edit distance, and
semantic similarity is measured in terms of mutual information. The procedure
does not rely on a morpheme concatenation model, nor on distributional
properties of word substrings (such as affix frequency). Experiments with
German and English input give encouraging results, both in terms of precision
(proportion of good pairs found at various cutoff points of the ranked list),
and in terms of a qualitative analysis of the types of morphological patterns
discovered by the algorithm.
","[{""version"":""v1"",""created"":""Wed, 8 May 2002 14:39:19 GMT""}]","2007-05-23"
"gr-qc/0205027","Osvaldo M. Moreschi","Osvaldo Moreschi, Alejandro Perez and Luis Lehner","Energy and angular momentum radiated for non head-on binary black hole
  collisions","9 pages, 2 figures","Phys.Rev. D66 (2002) 104017","10.1103/PhysRevD.66.104017",,"gr-qc",,"  We investigate the possible total radiated energy produced by a binary black
hole system containing non-vanishing total angular momentum. For the scenearios
considered we find that the total radiated energy does not exceed 1%.
Additionally we explore the gravitational radiation field and the variation of
angular momentum in the process.
","[{""version"":""v1"",""created"":""Tue, 7 May 2002 18:06:16 GMT""},{""version"":""v2"",""created"":""Tue, 17 Sep 2002 18:14:20 GMT""}]","2009-11-07"
"gr-qc/0205028","Jose Francisco da Rocha Neto","J. F. da Rocha-Neto and K. H. Castello-Branco","Gravitational Energy of Kerr and Kerr Anti-de Sitter Space-times in the
  Teleparallel Geometry","11 pages, 1 figure, to appear in JHEP11(2003)002","JHEP0311:002,2003","10.1088/1126-6708/2003/11/002",,"gr-qc hep-th",,"  In the context of the Hamiltonian formulation of the teleparallel equivalent
of general relativity we compute the gravitational energy of Kerr and Kerr
Anti-de Sitter (Kerr-AdS) space-times. The present calculation is carried out
by means of an expression for the energy of the gravitational field that
naturally arises from the integral form of the constraint equations of the
formalism. In each case, the energy is exactly computed for finite and
arbitrary spacelike two-spheres, without any restriction on the metric
parameters. In particular, we evaluate the energy at the outer event horizon of
the black holes.
","[{""version"":""v1"",""created"":""Tue, 7 May 2002 22:46:02 GMT""},{""version"":""v2"",""created"":""Tue, 4 Jun 2002 21:57:45 GMT""},{""version"":""v3"",""created"":""Mon, 17 Nov 2003 15:59:58 GMT""}]","2009-11-07"
"gr-qc/0205029","Homer G. Ellis","Homer G. Ellis","Space-Time--Time","29 pages, AMSTeX. This is the original (long) version that
  gr-qc/0107023 is based on",,,,"gr-qc",,"  Space-time--time is a natural hybrid of Kaluza's five-dimensional geometry
and Weyl's conformal space-time geometry. Translations along the secondary time
dimension produce the electromagnetic gauge transformations of Kaluza--Klein
theory and the metric gauge transformations of Weyl theory, related as Weyl
postulated. Geometrically, this phenomenon resides in an exponential-expansion
producing ``conformality constraint'', which replaces Kaluza's ``cylinder
condition''. The curvature tensors exhibit a wealth of ``interactions'' among
geometrical entities with physical interpretations. Unique to the conformally
constrained geometry is a sectionally isotropic, ultralocally determined
``residual curvature'', useful in construction of an action density for field
equations. A space-time--time geodesic describes a test particle whose rest
mass m and electric charge q evolve according to definite laws. The particls's
motion is governed by four apparent forces: the Einstein gravitational force,
the Lorentz electromagnetic force, a force proportional to the electromagnetic
potential, and a force proportional to a gradient d(ln phi), where the scalar
field phi is essentially the space-time--time residual radius of curvature. The
particle appears suddenly at an event E1 with q = -phi(E1) and vanishes at an
event E2 with q = phi(E2). At E1 and E2 the phi-force infinitely dominates the
others, causing E1 and E2 to tend to occur near where phi has an extreme value;
application to the modeling of orbital transitions of atomic electrons suggests
itself. The equivalence of a test particle's inertial mass and its passive
gravitational mass follows from the gravitational force's proportionality to m.
No connection is apparent between m and active gravitational mass or between q
and active electric charge, nor does the theory seem to require any.
","[{""version"":""v1"",""created"":""Wed, 8 May 2002 01:51:07 GMT""}]","2007-05-23"
"gr-qc/0205030","Zhang Chengmin","J. G. Pereira, and C. M. Zhang","ADDENDUM on the mass neutrino oscillation in a gravitational field","2 pages","Gen.Rel.Grav. 33 (2001) 2801-2802",,,"gr-qc astro-ph hep-ph",,"  In the article {\it Gen. Rel. Grav.} {\bf 32}, 1633 (2000), by J. G. Pereira
and C. M. Zhang, the special relativity energy-momentum tensor was used to
discuss the neutrino phase-splitting in a weak gravitational field. However, it
would be more appropriate to use the general relativity energy-momentum tensor.
When we do that, as we are going to see, some results change, but the basic
conclusion remains the same.
","[{""version"":""v1"",""created"":""Wed, 8 May 2002 05:26:34 GMT""}]","2007-05-23"
"gr-qc/0205031","Kouji Nakamura","Kouji Nakamura","Does a Nambu-Goto wall emit gravitational waves? -- Cylindrical
  Nambu-Goto wall as an example of gravitating non-spherical walls --","Accepted for publication in Physical Review D. Minor changes are
  made, and some typos are corrected","Phys.Rev. D66 (2002) 084005","10.1103/PhysRevD.66.084005","NAOJ-Th-Ap 2002, No.15","gr-qc hep-th",,"  Gravitational field of a cylindrical Nambu-Goto wall in the vacuum spacetime
is considered in order to clarify the interaction between Nambu-Goto membranes
and gravitational waves. If one neglects the emission of gravitational waves by
the wall motion, the spacetime becomes singular. It is also shown that the
emission of gravitational waves does occur by the motion of the cylindrical
wall if the initial data is singularity free. The energy loss rate due to
radiation of gravitational waves agrees with that estimated from the test wall
motion and the quadrupole formula for the gravitational wave emission. This is
quite different from the oscillatory behavior of gravitating Nambu-Goto
membranes: the presence of gravity induces the wall to lose its dynamical
degree of freedom.
","[{""version"":""v1"",""created"":""Wed, 8 May 2002 07:37:49 GMT""},{""version"":""v2"",""created"":""Mon, 13 May 2002 14:18:16 GMT""},{""version"":""v3"",""created"":""Fri, 26 Jul 2002 17:26:06 GMT""}]","2009-11-07"
"gr-qc/0205032","Giovanni Montani","Giovanni Montani","Canonical Quantization of Gravity without ""Frozen Formalism""","LateX file, 25 pages, to appear on Nucl.Phys.B","Nucl.Phys. B634 (2002) 370-392","10.1016/S0550-3213(02)00301-2",,"gr-qc",,"  We write down a quantum gravity equation which generalizes the Wheeler-DeWitt
one in view of including a time dependence in the wave functional. The obtained
equation provides a consistent canonical quantization of the 3-geometries
resulting from a ``gauge-fixing'' (3 + 1)-slicing of the space-time.
  Our leading idea relies on a criticism to the possibility that, in a quantum
space-time, the notion of a (3 + 1)-slicing formalism (underlying the
Wheeler-DeWitt approach) has yet a precise physical meaning. As solution to
this problem we propose of adding to the gravity-matter action the so-called
{\em kinematical action} (indeed in its reduced form, as implemented in the
quantum regime), and then we impose the new quantum constraints.
  As consequence of this revised approach, the quantization procedure of the
3-geometries takes place in a fixed reference frame and the wave functional
acquires a time evolution along a one-parameter family of spatial hypersurfaces
filling the space-time. We show how the states of the new quantum dynamics can
be arranged into an Hilbert space, whose associated inner product induces a
conserved probability notion for the 3-geometries.
  Finally, since the constraints we quantize violate the classical symmetries
(i. e. the vanishing nature of the super-Hamiltonian), then a key result is to
find a (non-physical) restriction on the initial wave functional phase,
ensuring that general relativity outcomes when taking the appropriate classical
limit. However we propose a physical interpretation of the kinematical
variables which, based on the analogy with the so-called {\em Gaussian
reference fluid}, makes allowance even for such classical symmetry violation.
","[{""version"":""v1"",""created"":""Wed, 8 May 2002 13:50:38 GMT""}]","2009-11-07"
"hep-ex/0205013","Sally Seidel","Sally Seidel","Jet Physics at the Tevatron","Proceedings of the XXXVII Rencontres de Moriond: QCD and High Energy
  Hadronic Interactions",,,,"hep-ex",,"  Recent analyses by the CDF and D0 Collaborations of jet data produced in
proton-antiproton collisions at the Fermilab Tevatron Collider are presented.
These include new studies of the inclusive jet production cross section, a
measurement of the strong coupling constant, the first measurement of subjet
multiplicity of quark and gluon jets, examination of ratios of multijet cross
sections and their implications for choice of renormalization scale, and a
study of charged jet evolution and energy flow in the underlying event. The
results are compared to theoretical predictions.
","[{""version"":""v1"",""created"":""Tue, 7 May 2002 20:09:39 GMT""}]","2007-05-23"
"hep-lat/0205009","Nazario Tantalo","L. Giusti, S. Petrarca, B. Taglienti and N. Tantalo","Remarks on the Gauge Dependence of the RI/MOM Renormalization Procedure","11 pages, 3 figures","Phys.Lett. B541 (2002) 350-355","10.1016/S0370-2693(02)02243-8",,"hep-lat",,"  The RI/MOM non-perturbative renormalization scheme is studied on the lattice
in SU(3) quenched QCD with Wilson fermions. The gauge dependence of some
fermion bilinear renormalization constants is discussed by comparing data which
have been gauge-fixed in two different realizations of the Landau gauge and in
a generic covariant gauge. The very good agreement between the various sets of
results and the theory indicates that the numerical uncertainty induced by the
lattice gauge-fixing procedure is moderate and below the statistical errors.
","[{""version"":""v1"",""created"":""Tue, 7 May 2002 16:16:51 GMT""}]","2009-11-07"
"hep-lat/0205010","Kieran Holland","P. Hasenfratz, S. Hauswirth, K. Holland, T. Jorg and F. Niedermayer","Testing the fixed-point QCD action and the construction of chiral
  currents","50 pages, 19 figures; misprints corrected, discussion on covariant
  densities extended, new appendix added","Nucl.Phys.B643:280-320,2002","10.1016/S0550-3213(02)00742-3","BUTP/02/5, UCSD/PTH 02-04","hep-lat",,"  We present the first set of quenched QCD measurements using the recently
parametrized fixed-point Dirac operator D^FP. We also give a general and
practical construction of covariant densities and conserved currents for chiral
lattice actions. The measurements include (a) hadron spectroscopy, (b)
corrections of small chiral deviations, (c) the renormalized quark condensate
from finite-size scaling and, independently, spectroscopy, (d) the topological
susceptibility, (e) small eigenvalue distributions and random matrix theory,
and (f) local chirality of near-zero modes and instanton-dominance.
","[{""version"":""v1"",""created"":""Tue, 7 May 2002 16:55:37 GMT""},{""version"":""v2"",""created"":""Tue, 9 Jul 2002 18:50:54 GMT""}]","2011-07-19"
"hep-lat/0205011","Artan Borici","Artan Borici","Lattice QCD with Suppressed High Momentum Modes of the Dirac Operator","15 pages, 2 figures. Version 2: computational methods removed, one
  figure replaced","Phys.Rev.D67:114501,2003","10.1103/PhysRevD.67.114501",,"hep-lat",,"  I define lattice fermions in five Euclidean dimensions and the corresponding
effective theory in four dimensions. The main properties of these theories
include the suppression of high momentum modes of the lattice Dirac operator
and their ability to continuously interpolate between quenched and dynamical
fermions. In particular, the standard formulation of lattice QCD can be viewed
as a limiting case of the theory.
","[{""version"":""v1"",""created"":""Tue, 7 May 2002 17:50:25 GMT""},{""version"":""v2"",""created"":""Mon, 26 Aug 2002 09:55:44 GMT""}]","2008-11-26"
"hep-lat/0205012","Ivan Horvath","I. Horvath, S.J. Dong, T. Draper, F.X. Lee, H.B. Thacker, J.B. Zhang","Low-Lying Dirac Eigenmodes, Topological Charge Fluctuations and the
  Instanton Liquid Model","Presented by I. Horvath at the NATO Advanced Research Workshop
  ""Confinement, Topology, and other Non-Perturbative Aspects of QCD"", January
  21-27, 2002, Stara Lesna, Slovakia. 12 pages, 6 figures, uses crckapb.sty",,,,"hep-lat",,"  The local structure of low-lying eigenmodes of the overlap Dirac operator is
studied. It is found that these modes cannot be described as linear
combinations of 't Hooft ""would-be"" zeromodes associated with instanton
excitations that underly the Instanton Liquid Model. This implies that the
instanton liquid scenario for spontaneous chiral symmetry breaking in QCD is
not accurate. More generally, our data suggests that the vacuum fluctuations of
topological charge are not effectively dominated by localized lumps of unit
charge with which the topological ""would-be"" zeromodes could be associated.
","[{""version"":""v1"",""created"":""Tue, 7 May 2002 19:11:36 GMT""}]","2007-05-23"
"hep-ph/0205058","Stephen Wong","U. Heinz and S.M.H. Wong","Elliptic Flow from a Transversally Thermalized Fireball","revtex4, 15 pages + 10 embedded EPS figures","Phys.Rev.C66:014907,2002","10.1103/PhysRevC.66.014907",,"hep-ph hep-ex hep-th nucl-ex nucl-th",,"  The agreement of elliptic flow data at RHIC at central rapidity with the
hydrodynamic model has led to the conclusion of very rapid thermalization. This
conclusion is based on the intuitive argument that hydrodynamics, which assumes
instantaneous local thermalization, produces the largest possible elliptic flow
values and that the data seem to saturate this limit. We here investigate the
question whether incompletely thermalized viscous systems may actually produce
more elliptic flow than ideal hydrodynamics. Motivated by the extremely fast
primordial longitudinal expansion of the reaction zone, we investigate a toy
model which exhibits thermalization only in the transverse directions but
undergoes collisionless free-streaming expansion in the longitudinal direction.
For collisions at RHIC energies, elliptic flow results from the model are
compared with those from hydrodynamics. With the final particle yield and
$\kt$-distribution fixed, the transversally thermalized model is shown not to
be able to produce the measured amount of elliptic flow. This investigation
provides further support for very rapid local kinetic equilibration at RHIC. It
also yields interesting novel results for the elliptic flow of massless
particles such as direct photons.
","[{""version"":""v1"",""created"":""Tue, 7 May 2002 17:15:27 GMT""}]","2009-10-09"
"hep-ph/0205064","Elizabeth H. Simmons","R.S. Chivukula and E.H. Simmons","Electroweak Limits on Non-Universal Z' Bosons","17 pages, 5 figures; added references; updated figures","Phys.Rev.D66:015006,2002","10.1103/PhysRevD.66.015006","BUHEP-02-16, HUPT-02/A002","hep-ph hep-ex",,"  Many types of physics beyond the standard model include an extended
electroweak gauge group. If these extensions are associated with flavor
symmetry breaking, the gauge interactions will not be flavor-universal. In this
note we update the bounds placed by electroweak data on the existence of flavor
non-universal extensions to the standard model in the context of topcolor
assisted technicolor (TC2), noncommuting extended technicolor (NCETC), and the
ununified standard model (UUM). In the first two cases the extended gauge
interactions couple to the third generation fermions differently than to the
light fermions, while in the ununified standard model the gauge interactions
couple differently to quarks and leptons. The extra SU(2) triplet of gauge
bosons in NCETC and UUM models must be heavier than about 3 TeV, while the
extra Z boson in TC2 models must be heavier than about 1 TeV.
","[{""version"":""v1"",""created"":""Tue, 7 May 2002 16:09:35 GMT""},{""version"":""v2"",""created"":""Wed, 22 May 2002 20:30:59 GMT""},{""version"":""v3"",""created"":""Wed, 5 Jun 2002 13:58:42 GMT""}]","2008-11-26"
"hep-ph/0205065","Dan Pirjol","Michael Gronau and Dan Pirjol","Photon polarization in radiative B decays","22 pages, 3 figures, version to appear in Phys. Rev. D","Phys.Rev. D66 (2002) 054008","10.1103/PhysRevD.66.054008","TECHNION-PH-2002-18, UCSD/PTH 02-10","hep-ph hep-ex",,"  We study decay distributions in B -> K pi pi gamma, combining contributions
from several overlapping resonances in a K pi pi mass range near 1400 MeV,
(1^+) K_1(1400), (2^+) K^*_2(1430) and (1^-) K^*(1410). A method is proposed
for using these distributions to determine a photon polarization parameter in
the effective radiative weak Hamiltonian. This parameter is measured through an
up-down asymmetry of the photon direction relative to the K pi pi decay plane.
We calculate a dominant up-down asymmetry of 0.33 +- 0.05 from the K1(1400)
resonance, which can be measured with about 10^8 B B-bar pairs, thus providing
a new test for the Standard Model and a probe for some of its extensions.
","[{""version"":""v1"",""created"":""Tue, 7 May 2002 18:10:19 GMT""},{""version"":""v2"",""created"":""Thu, 8 Aug 2002 16:52:56 GMT""}]","2009-11-07"
"hep-ph/0205066","Nobuchika Okada","Takeshi Fukuyama and Nobuchika Okada","Neutrino oscillation data versus minimal supersymmetric SO(10) model","18 pages, 3 figures. Some numerical errors in the version published
  in JHEP have been corrected: the mass eigenvalue M_{R_i}, and <m_nu>_ee and
  epsilon in Table 3","JHEP 0211:011,2002","10.1088/1126-6708/2002/11/011","UMD-PP-02-048","hep-ph",,"  We reconsider the minimal supersymmetric SO(10) model, where only one {\bf
10} and one $\bar{\bf 126}$ Higgs multiplets have Yukawa couplings with matter
multiplets. The model is generalized to include CP-violating phases, and
examined how well its predictions can meet the current neutrino oscillation
data. Using the electroweak scale data about six quark masses, three angles and
one CP-phase in the Cabibbo-Kobayashi-Maskawa matrix and three charged-lepton
masses and given $\tan \beta$ (the ratio of vacuum expectation values of a pair
of Higgs doublets), we obtain the Pontecorvo-Maki-Nakagawa-Sakata matrix and
the ratio, $\Delta m_\odot^2/\Delta m_\oplus^2 $, as functions of only one free
parameter in the model. In our analysis, one-loop renormalization group
equations for the gauge couplings, the Yukawa couplings and the effective
dimension-five operator are used to connect the data between the electroweak
scale and the grand unification scale. Fixing the free parameter appropriately,
we find, for example, $\sin^2 2 \theta_{12} \sim 0.72$, $\sin^2 2 \theta_{23}
\sim 0.90$, $\sin^2 2 \theta_{13} \sim 0.16$ and $\Delta m_\odot^2/\Delta
m_\oplus^2 \sim 0.19$ with $\tan \beta = 45$, which are in agreement with the
current neutrino oscillation data.
","[{""version"":""v1"",""created"":""Tue, 7 May 2002 20:31:23 GMT""},{""version"":""v2"",""created"":""Fri, 18 Apr 2003 02:19:09 GMT""}]","2010-04-06"
