"astro-ph/0205121","Marina Orio","M. Orio, A.N. Parmar, J. Greiner, H. Ogelman, S. Starrfield, E.
  Trussoni","The X-ray emission from Nova V382 Velorum: II. The super-soft component
  observed with BeppoSAX","To appear in MNRAS","Mon.Not.Roy.Astron.Soc. 333 (2002) L11","10.1046/j.1365-8711.2002.05577.x",,"astro-ph",,"  Nova Velorum 1999 (V382 Vel) was observed by BeppoSAX 6 months after optical
maximum and was detected as a bright X-ray supersoft source, with a count rate
3.454+-0.002 cts/s in the LECS. It was the softest and most luminous supersoft
source observed with this instrument. The flux in the 0.1-0.7 keV range was not
constant during the observation. It dropped by a factor of 2 in less than 1.5
hour and then was faint for at least 15 minutes, without significant spectral
changes.
  The observed spectrum is not well fit with atmospheric models of a hot,
hydrogen burning white dwarf. This is due mainly to a supersoft excess in the
range 0.1-0.2 keV, but the fit can be significantly improved at higher energy
if at least one emission feature is superimposed. We suggest that a
``pseudocontinuum'' was detected, consisting of emission lines in the supersoft
X-ray range superimposed on the thermal continuum of a white dwarf atmosphere.
As a result, an accurate determination of the effective temperature and gravity
of the white dwarf at this post-outburst stage is not possible.
","[{""version"":""v1"",""created"":""Wed, 8 May 2002 15:00:31 GMT""}]","2009-11-07"
"cond-mat/0205124","Xi-Wen Guan","Xi-Wen Guan, Angela Foerster, Jon Links and Huan-Qiang Zhou","Integrability and exact solution for coupled BCS systems associated with
  the $su(4)$ Lie algebra","15 pages","Nucl. Phys. B 642 (2002) 501-514","10.1016/S0550-3213(02)00776-9",,"cond-mat.str-el cond-mat.stat-mech",,"  We introduce an integrable model for two coupled BCS systems through a
solution of the Yang-Baxter equation associated with the Lie algebra $su(4)$.
By employing the algebraic Bethe ansatz, we determine the exact solution for
the energy spectrum. An asymptotic analysis is conducted to determine the
leading terms in the ground state energy, the gap and some one point
correlation functions at zero temperature.
","[{""version"":""v1"",""created"":""Tue, 7 May 2002 17:44:40 GMT""}]","2015-06-24"
"cond-mat/0205127","Boris Spivak","B.Spivak","Phase separation in the two-dimensional electron liquid in MOSFETs","11 pages, 3 figures",,"10.1103/PhysRevB.67.125205",,"cond-mat.mes-hall cond-mat.str-el",,"  We show that the existence of an intermediate phase between the Fermi liquid
and the Wigner crystal phases is a generic property of the two-dimensional pure
electron liqd in MOSFET's at zero temperature. The physical reason for the
existence of these phases is a partial separation of the uniform phases.
  We discuss properties of these phases and a possible explanation of
experimental results on transport properties of low density electron gas in Si
MOSFET's. We also argue that in certain range of parameters the partial phase
separation corresponds to a supersolid phas e discussed in [AndreevLifshitz].
","[{""version"":""v1"",""created"":""Tue, 7 May 2002 19:18:30 GMT""},{""version"":""v2"",""created"":""Thu, 16 May 2002 01:16:40 GMT""},{""version"":""v3"",""created"":""Mon, 20 Jan 2003 23:04:24 GMT""}]","2009-11-07"
"cond-mat/0205135","Jiri Bok","J. Bok and V. Capek","Langevin approach to the Porto system","7 figures",,"10.1063/1.1523826",,"cond-mat.stat-mech",,"  M. Porto (Phys. Rev. E 63 (2001) 030102) suggested a system consisting of
Coulomb interacting particles, forming a linear track and a rotor, and working
as a molecular motor. Newton equations with damping for the rotor coordinate on
the track x, with a prescribed time-dependence of the rotor angle theta,
indicated unidirectional motion of the rotor. Here, for the same system, the
treatment was generalized to nonzero temperatures by including stochastic
forces and treating both x and theta via two coupled Langevin equations.
Numerical results are reported for stochastic homogeneous distributions of
impact events and Gaussian distributions of stochastic forces acting on both
the variables. For specific values of parameters involved, the unidirectional
motion of the rotor along the track is confirmed, but with a mechanism that is
not necessarily the same as that one by Porto. In an additional weak
homogeneous potential field U(x)=const.x acting against the motion, the
unidirectional motion persists. Then the rotor accumulates potential energy at
the cost of thermal stochastic forces from the bath.
","[{""version"":""v1"",""created"":""Tue, 7 May 2002 16:25:55 GMT""}]","2009-11-07"
"cond-mat/0205136","Ramon Xulvi-Brunet","R. Xulvi-Brunet and I.M. Sokolov","Evolving networks with disadvantaged long-range connections","REVTeX, 6 pages, 5 figures","Phys. Rev. E 66, 026118 (2002)","10.1103/PhysRevE.66.026118",,"cond-mat.stat-mech",,"  We consider a growing network, whose growth algorithm is based on the
preferential attachment typical for scale-free constructions, but where the
long-range bonds are disadvantaged. Thus, the probability to get connected to a
site at distance $d$ is proportional to $d^{-\alpha}$, where $\alpha $ is a
tunable parameter of the model. We show that the properties of the networks
grown with $\alpha <1$ are close to those of the genuine scale-free
construction, while for $\alpha >1$ the structure of the network is vastly
different. Thus, in this regime, the node degree distribution is no more a
power law, and it is well-represented by a stretched exponential. On the other
hand, the small-world property of the growing networks is preserved at all
values of $\alpha $.
","[{""version"":""v1"",""created"":""Tue, 7 May 2002 17:37:10 GMT""}]","2009-11-07"
"cond-mat/0205137","Munetaka Sasaki","M. Sasaki, V. Dupuis, J.-P. Bouchaud, E. Vincent","Deviations from Perfect Memory in Spin Glass Temperature Cycling
  Experiments","12 pages, 12 figures, 2 tables, the tables are modified, the text is
  slightly changed","Eur. Phys. J. B 29, 469 (2002)","10.1140/epjb/e2002-00327-2",,"cond-mat.dis-nn cond-mat.stat-mech",,"  We study the deviations from perfect memory in negative temperature cycle
spin glass experiments. It is known that the a.c. susceptibility after the
temperature is raised back to its initial value is superimposed to the
reference isothermal curve for large enough temperature jumps DT (perfect
memory). For smaller DT, the deviation from this perfect memory has a striking
non monotonous behavior: the memory anomaly is negative for small DT's, becomes
positive for intermediate DT's, before vanishing for still larger DT's. We show
that this interesting behavior can be reproduced by simple Random Energy trap
models. We discuss an alternative interpretation in terms of droplets and
temperature chaos.
","[{""version"":""v1"",""created"":""Tue, 7 May 2002 20:20:18 GMT""},{""version"":""v2"",""created"":""Fri, 17 May 2002 10:51:31 GMT""}]","2009-11-07"
"cond-mat/0205138","Corwin H. Booth","E. D. Bauer, C. H. Booth, G. H. Kwei, R. Chau, M. B. Maple","Effects of lattice disorder in the UCu_(5-x)Pd_(x) system","14 pages, 12 EPS figures, Phys. Rev. B, in press",,"10.1103/PhysRevB.65.245114",,"cond-mat.str-el",,"  The UCu(5-x)Pd(x) system exhibits non-Fermi liquid (NFL) in the thermodynamic
and transport properties at low temperatures for Pd concentrations 0.9 <~ x <~
1.5. The local structure around the U, Cu, and Pd atoms has been measured for 0
<= x <= 1.5 using the X-ray Absorption Fine Structure (XAFS) technique in order
to quantify the effects of lattice disorder on the NFL properties. A model
which allows a percentage of the Pd atoms to occupy nominal Cu (16e) sites, s,
was used to fit the Pd and Cu K edge and U L(III) edge data. Pd/Cu site
interchange was found to occur in all samples (x != 0), reaching a minimum
value of s ~0.17 at x = 0.7 and increasing monotonically to s ~ 0.4 at x=1.5.
These data also determine the static disorder the nearest neighbor U--Cu pairs.
The results indicate that the measured U--Cu static disorder is not sufficient
to explain the NFL behavior of the magnetic susceptibility within the
single-ion Kondo disorder model and casts doubt on the applicability of this
model to UCu(5-x)Pd(x).
","[{""version"":""v1"",""created"":""Tue, 7 May 2002 22:15:54 GMT""}]","2009-11-07"
"cond-mat/0205139","Uwe R. Fischer","Uwe R. Fischer and Matt Visser","On the space-time curvature experienced by quasiparticle excitations in
  the Painleve-Gullstrand effective geometry","9 RevTex4 pages, 1 figure, minor modifications, to appear in Annals
  of Physics (N.Y.)","Annals Phys. 304 (2003) 22-39","10.1016/S0003-4916(03)00011-3",,"cond-mat gr-qc",,"  We consider quasiparticle propagation in constant-speed-of-sound (iso-tachic)
and almost incompressible (iso-pycnal) hydrodynamic flows, using the technical
machinery of general relativity to investigate the ``effective space-time
geometry'' that is probed by the quasiparticles. This effective geometry,
described for the quasiparticles of condensed matter systems by the
Painleve-Gullstrand metric, generally exhibits curvature (in the sense of
Riemann), and many features of quasiparticle propagation can be re-phrased in
terms of null geodesics, Killing vectors, and Jacobi fields. As particular
examples of hydrodynamic flow we consider shear flow, a constant-circulation
vortex, flow past an impenetrable cylinder, and rigid rotation.
","[{""version"":""v1"",""created"":""Wed, 8 May 2002 00:09:30 GMT""},{""version"":""v2"",""created"":""Mon, 3 Feb 2003 13:14:03 GMT""}]","2007-05-23"
"cond-mat/0205140","Tim Byrnes","T.M.R. Byrnes, R.J. Bursill, H.-P. Eckle, C.J. Hamer, and A. W.
  Sandvik","Persistent Currents in the Heisenberg chain with a weak link","14 pages, 7 figures, 2 tables, no changes to paper, author list
  changed on archive","Phys. Rev. B 66, 195313 (2002)","10.1103/PhysRevB.66.195313",,"cond-mat.str-el",,"  The Heisenberg chain with a weak link is studied, as a simple example of a
quantum ring with a constriction or defect. The Heisenberg chain is equivalent
to a spinless electron gas under a Jordan-Wigner transformation. Using density
matrix renormalization group and quantum Monte Carlo methods we calculate the
spin/charge stiffness of the model, which determines the strength of the
`persistent currents'. The stiffness is found to scale to zero in the weak link
case, in agreement with renormalization group arguments of Eggert and Affleck,
and Kane and Fisher.
","[{""version"":""v1"",""created"":""Wed, 8 May 2002 00:59:08 GMT""},{""version"":""v2"",""created"":""Tue, 14 May 2002 00:27:49 GMT""}]","2009-11-07"
"cond-mat/0205141","I. Chiorescu","B. Barbara, I. Chiorescu, W. Wernsdorfer, H. Boegge, A. Mueller","The V15 molecule, a multi-spin two-level system: adiabatic LZS
  transition with or without dissipation and Kramers theorem","to be published in the supplement of the Progress of Theoretical
  Physics, proceedings of the 16th Nishinomiya-Yukawa Memorial Symposium held
  in the city of Nishinomiya, Japan, Nov. 13-14, 2001","Progress Theor. Phys. Suppl., vol. 145, 357 (2002)","10.1143/PTPS.145.357",,"cond-mat.mes-hall cond-mat.str-el",,"  The so-called V15 molecule is formed of 15 spins 1/2 antiferromagnetically
coupled. The resultant spin is equal to 1/2. Contrary to what is expected at
first sight, this half-integer spin is gapped. We show that this is a
consequence of the multi-spin character of the molecule. Time reversal symmetry
(Kramers theorem) is preserved due to the existence of a groundstate degeneracy
larger than 2. Magnetization experiments have been performed at different
temperatures, sweeping-field rates and couplings with the cryostat. Their
interpretation in terms of the Landau-Zener-Stuckelberg model gives evidence
for adiabatic LZS spin reversal with and without dissipation.
","[{""version"":""v1"",""created"":""Wed, 8 May 2002 06:54:13 GMT""}]","2009-11-07"
"cond-mat/0205142","Michael Karbach","Michael Karbach, Daniel Biegel and Gerhard Muller","Quasiparticles governing the zero-temperature dynamics of the 1D
  spin-1/2 Heisenberg antiferromagnet in a magnetic field","13 pages, 12 figures",,"10.1103/PhysRevB.66.054405",,"cond-mat.str-el",,"  The T=0 dynamical properties of the one-dimensional (1D) $s=1/2$
  Heisenberg antiferromagnet in a uniform magnetic field are studied via Bethe
ansatz for cyclic chains of $N$ sites. The ground state at magnetization
$0<M_z<N/2$, which can be interpreted as a state with $2M_z$ spinons or as a
state of $M_z$ magnons, is reconfigured here as the vacuum for a different
species of quasiparticles, the {\em psinons} and {\em antipsinons}. We
investigate three kinds of quantum fluctuations, namely the spin fluctuations
parallel and perpendicular to the direction of the applied magnetic field and
the dimer fluctuations. The dynamically dominant excitation spectra are found
to be sets of collective excitations composed of two quasiparticles excited
from the psinon vacuum in different configurations. The Bethe ansatz provides a
framework for (i) the characterization of the new quasiparticles in relation to
the more familiar spinons and magnons, (ii) the calculation of spectral
boundaries and densities of states for each continuum, (iii) the calculation of
transition rates between the ground state and the dynamically dominant
collective excitations, (iv) the prediction of lineshapes for dynamic structure
factors relevant for experiments performed on a variety of quasi-1D
antiferromagnetic compounds, including KCuF$_3$,
  Cu(C$_4$H$_4$N$_2)(NO_3)_2$, and CuGeO$_3$.
","[{""version"":""v1"",""created"":""Wed, 8 May 2002 07:21:37 GMT""}]","2009-11-07"
"cond-mat/0205143","Kenji M. Kojima","K.M. Kojima and S. Uchida and Y. Fudamoto and S. Tajima","New Josephson Plasma Modes in Underdoped YBa2Cu3O6.6 Induced by Parallel
  Magnetic Field","4 pages, 3 figures",,"10.1103/PhysRevLett.89.247001",,"cond-mat.supr-con cond-mat.str-el",,"  The c-axis reflectivity spectrum of underdoped YBa2Cu3O6.6 (YBCO) is measured
below Tc=59K in parallel magnetic fields H//CuO2 up to 7T. Upon application of
a parallel field, a new peak appears at finite frequency in the optical
conductivity at the expense of suppression of c-axis condensate weight. We
conclude that the dramatic change originates from different Josephson coupling
strengths between bilayers with and without Josephson vortices. We find that
the 400cm^-1 broad conductivity peak in YBCO gains the spectral weight under
parallel magnetic field; this indicates that the condensate weight at \omega =0
is distributed to the intra-bilayer mode as well as to the new optical
Josephson mode.
","[{""version"":""v1"",""created"":""Wed, 8 May 2002 07:23:04 GMT""}]","2009-11-07"
"cond-mat/0205145","Fuhner","C. Fuhner, U. F. Keyser, R. J. Haug, D. Reuter, A. D. Wieck","Flux-quantum-modulated Kondo conductance in a multielectron quantum dot","4 pages, 5 figures","Phys. Rev. B 66, 161305(R) (2002)","10.1103/PhysRevB.66.161305",,"cond-mat.mes-hall cond-mat.str-el",,"  We investigate a lateral semiconductor quantum dot with a large number of
electrons in the limit of strong coupling to the leads. A Kondo effect is
observed and can be tuned in a perpendicular magnetic field. This Kondo effect
does not exhibit Zeeman splitting. It shows a modulation with the periodicity
of one flux quantum per dot area at low temperatures. The modulation leads to a
novel, strikingly regular stripe pattern for a wide range in magnetic field and
number of electrons.
","[{""version"":""v1"",""created"":""Wed, 8 May 2002 08:35:37 GMT""},{""version"":""v2"",""created"":""Fri, 1 Nov 2002 14:20:13 GMT""}]","2009-11-07"
"cond-mat/0205146","Achille Giacometti","Domenico Gazzillo, and Achille Giacometti (Universita' di Venezia)","On the compressibility equation of state for multicomponent adhesive
  hard sphere fluids","13 pages, no figures, accepted for publication Molec. Physics (2002)",,"10.1080/00268970210153808",,"cond-mat.stat-mech cond-mat.soft",,"  The compressibility equation of state for a multicomponent fluid of particles
interacting via an infinitely narrow and deep potential, is considered within
the mean spherical approximation (MSA). It is shown that for a class of models
leading to a particular form of the Baxter functions $q_{ij}(r)$ containing
density-independent stickiness coefficient, the compressibility EOS does not
exist, unlike the one-component case. The reason for this is that a direct
integration of the compressibility at fixed composition, cannot be carried out
due to the lack of a reciprocity relation on the second order partial
derivatives of the pressure with respect to two different densities. This is,
in turn, related to the inadequacy of the MSA. A way out to this drawback is
presented in a particular example, leading to a consistent compressibility
pressure, and a possible generalization of this result is discussed.
","[{""version"":""v1"",""created"":""Wed, 8 May 2002 09:37:46 GMT""}]","2009-11-07"
"cond-mat/0205147","A. Ovchinnikov","Igor N. Karnaukhov and Alexander A. Ovchinnikov","Strongly Interacting Luttinger Liquid and Superconductivity in an
  Exactly Solvable Model","4 pages, 2 figures, RevTex",,"10.1103/PhysRevB.66.104518",,"cond-mat.str-el",,"  A new family of exactly solvable one dimensional models with a hard-core
repulsive potential is solved by the Bethe Ansatz for an arbitrary hard-core
radius. The exact ground state phase diagrams in a plane 'electron density -
on-site interaction' have been studied for several values of a hard-core
radius. It is shown that superconducting phase and strongly interacting
Luttinger liquid state are coexisted at a high electron density and unusually
high value of repulsive on-site Coulomb interaction.
","[{""version"":""v1"",""created"":""Wed, 8 May 2002 10:15:39 GMT""}]","2009-11-07"
"cond-mat/0205148","Dimitri N. Argyriou","D. N. Argyriou, J.W. Lynn, R. Osborn, B. Campbell, J. F. Mitchell, U.
  Ruett, H. N. Bordallo, A. Wildes, C. D. Ling","Glass Transition in the Polaron Dynamics of CMR Manganites","4 pages, 4 figures. Physical Review Letters (in Press)",,"10.1103/PhysRevLett.89.036401",,"cond-mat.str-el cond-mat.mtrl-sci",,"  Neutron scattering measurements on a bilayer manganite near optimal doping
show that the short-range polarons correlations are completely dynamic at high
T, but then freeze upon cooling to a temperature T* 310 K. This glass
transition suggests that the paramagnetic/insulating state arises from an
inherent orbital frustration that inhibits the formation of a long range
orbital- and charge-ordered state. Upon further cooling into the
ferromagnetic-metallic state (Tc=114 K), where the polarons melt, the diffuse
scattering quickly develops into a propagating, transverse optic phonon.
","[{""version"":""v1"",""created"":""Wed, 8 May 2002 11:59:01 GMT""}]","2009-11-07"
"cond-mat/0205149","Krzysztof Byczuk","Krzysztof Byczuk, Ralf Bulla, Ralph Claessen, and Dieter Vollhardt","Phenomenological Modeling of Photoemission Spectra in Strongly
  Correlated Electron Systems","13 pages, 4 figures, IJMPB style (included)","International Journal of Modern Physics B, Vol. 16, No. 25 (2002)
  3759-3770","10.1142/S0217979202013031","EKM-TP3/10-02","cond-mat.str-el",,"  A phenomenological approach is presented that allows one to model, and
thereby interpret, photoemission spectra of strongly correlated electron
systems. A simple analytical formula for the self-energy is proposed. This
self-energy describes both coherent and incoherent parts of the spectrum
(quasiparticle and Hubbard peaks, respectively). Free parameters in the
expression are determined by fitting the density of states to experimental
photoemission data. An explicit fitting is presented for the
La$_{1-x}$Sr$_x$TiO$_3$ system with $0.08 \le x \le 0.38$. In general, our
phenomenological approach provides information on the effective mass, the
Hubbard interaction, and the spectral weight distribution in different parts of
the spectrum. Limitations of this approach are also discussed.
","[{""version"":""v1"",""created"":""Wed, 8 May 2002 12:16:22 GMT""}]","2009-11-07"
"cond-mat/0205150","Holger Fehske","Alexander Weisse and Holger Fehske","Interplay of charge, spin, orbital and lattice correlations in colossal
  magnetoresistance manganites","8 pages, 12 figures; more detailed version","Eur. Phys. J. B 30, 487 (2002)","10.1140/epjb/e2002-00405-5",,"cond-mat.str-el",,"  We derive a realistic microscopic model for doped colossal magnetoresistance
manganites, which includes the dynamics of charge, spin, orbital and lattice
degrees of freedom on a quantum mechanical level. The model respects the SU(2)
spin symmetry and the full multiplet structure of the manganese ions within the
cubic lattice. Concentrating on the hole doped domain ($0\le x\le 0.5$) we
study the influence of the electron-lattice interaction on spin and orbital
correlations by means of exact diagonalisation techniques. We find that the
lattice can cause a considerable suppression of the coupling between spin and
orbital degrees of freedom and show how changes in the magnetic correlations
are reflected in dynamic phonon correlations. In addition, our calculation
gives detailed insights into orbital correlations and demonstrates the
possibility of complex orbital states.
","[{""version"":""v1"",""created"":""Wed, 8 May 2002 12:49:39 GMT""},{""version"":""v2"",""created"":""Wed, 4 Sep 2002 15:07:57 GMT""}]","2007-05-23"
"cond-mat/0205151","Luis Molinuevo Balicas","G. Cao, L. Balicas, Y. Xin, E. Dagotto, J.E. Crow, C. S. Nelson, and
  J. P. Hill","Complex Quantum Phenomena in a Bilayered Calcium Ruthenate","4 pages 3 figures",,,,"cond-mat.str-el cond-mat.mtrl-sci",,"  Ca$_3$Ru$_2$O$_7$ undergoes an antiferromagnetic transition at
$T_{\text{N}}=56 $K, followed by a Mott-like (MI) transition at
$T_{\text{MI}}=48$ K. This nonmetallic ground state, with a charge gap of 0.1
eV, is suppressed by a highly anisotropic metamagnetic transition that leads to
a fully spin-polarized metallic state. We report the observation of
Shubnikov-de Haas oscillations in the \textit{gapped} state, colossal
magnetoresistance in the inter-plane resistivity with a large anisotropy
different from that observed in the magnetization, and non-Fermi liquid
behavior in the metallic state at high magnetic fields.
","[{""version"":""v1"",""created"":""Wed, 8 May 2002 13:29:03 GMT""}]","2007-05-23"
"cond-mat/0205152","S. Schwieger","S. Schwieger and W. Nolting","Long range superexchange - an exchange interaction through empty bands","6 pages, 3 figures, to be published in Phys. Rev. B","Phys. Rev. B 65, 205210 (2002)","10.1103/PhysRevB.65.205210",,"cond-mat.str-el",,"  We derive a generalization of the RKKY interaction to semiconductors using
perturbation theory on a non-degenerated two-impurity Anderson model. In metals
the interaction is mediated by excitations of free carriers over the
Fermi-energy. In semiconductors, where no carriers are present, the only
possible excitations are those of the localized impurity electrons (or holes)
themselves. Thus a possible interaction is closely related to superexchange. We
find an oscillating anti-ferromagnetic spin-spin coupling due to impurity
electron (hole) excitations. By treating the coupling through empty bands
(superexchange) along the same route as carrier mediated interactions (RKKY) it
is easy to compare these two kinds of spin-spin coupling. The interaction
derived here is of special interest for diluted magnetic semiconductors.
","[{""version"":""v1"",""created"":""Wed, 8 May 2002 13:33:19 GMT""}]","2016-08-31"
"cond-mat/0205153","Weidong Si","W. Si, E. M. Cruz, P. D. Johnson, P. W. Barnes, P. Woodward and A. P.
  Ramirez","Epitaxial Thin Films of the Giant-Dielectric-Constant Material
  CaCu_3Ti_4O_{12} Grown by Pulsed-laser Deposition","11 pages, 4 figures",,"10.1063/1.1506951",,"cond-mat.mtrl-sci",,"  Pulsed-laser deposition has been used to grow epitaxial thin films of the
giant-dielectric-constant material CaCu_3Ti_4O_{12} on LaAlO_3 and SrTiO_3
substrates with or without various conducting buffer layers. The latter include
YBa_2Cu_3O_7, La_{1.85}Sr_{0.15}CuO_{4+\delta} and LaNiO_3. Above 100K - 150K
the thin films have a temperature independent dielectric constant as do single
crystals. The value of the dielectric constant is of the order of 1500 over a
wide temperature region, potentially making it a good candidate for many
applications. The frequency dependence of its dielectric properties below 100K
- 150K indicates an activated relaxation process.
","[{""version"":""v1"",""created"":""Wed, 8 May 2002 13:46:49 GMT""}]","2009-11-07"
"cond-mat/0205154","Alexander Golubov","A. A. Golubov, A. Brinkman, O. V. Dolgov, J. Kortus, O. Jepsen","Multiband model for penetration depth in MgB2","submitted to Phys. Rev. B","Phys. Rev. B 66, 054524 (2002)","10.1103/PhysRevB.66.054524",,"cond-mat.supr-con",,"  The results of first principles calculations of the electronic structure and
the electron-phonon interaction in MgB2 are used to study theoretically the
temperature dependence and anisotropy of the magnetic field penetration depth.
The effects of impurity scattering are essential for a proper description of
the experimental results. We compare our results with experimental data and we
argue that the two-band model describes the data rather well.
","[{""version"":""v1"",""created"":""Wed, 8 May 2002 14:25:54 GMT""}]","2009-11-07"
