"astro-ph/0205101","Ruth Durrer","Ruth Durrer","Frontiers of the Universe: What do we know, what do we understand?","Contribution for the Proceedings of the 'Rencontres de Blois', June
  2001, Summary talk",,,,"astro-ph",,"  In this talk I summarize the topics addressed during the conference. We have
discussed the most relevant cosmological observations of the last say 10 years
and their implications for our understanding of the Universe. My finding
throughout this meeting has been that it is amazing how our knowledge of
cosmological parameters has improved during the last years. It comes as a
surprise to many, that the simplest inflationary model of adiabatic
perturbations agrees well with present data. But it is frustrating that we have
not made any progress in identifying the dark matter, in contrary, we have
supplemented it by what we call the 'dark energy', a gravitationally and
esthetically repulsive component which is even more mysterious than the dark
matter. We have no understanding about the origin of these two most abundant
energy components of the present Universe.
","[{""version"":""v1"",""created"":""Tue, 7 May 2002 16:09:56 GMT""}]","2007-05-23"
"astro-ph/0205102","Gavin Ramsay","Gavin Ramsay, Mark Cropper (MSSL/UCL)","First X-ray observations of the polar CE Gru","Accepted for publication in MNRAS, 6 pages","Mon.Not.Roy.Astron.Soc. 335 (2002) 918","10.1046/j.1365-8711.2002.05666.x",,"astro-ph",,"  We report the detection of the polar CE Gru in X-rays for the first time. We
find evidence for a dip seen in the hard X-ray light curve which we attribute
to the accretion stream obscuring the accretion region in the lower hemisphere
of the white dwarf. The X-ray spectrum can be fitted using only a shock model:
there is no distinct soft X-ray component. We suggest that this is because the
reprocessed component is cool enough so that it is shifted into the UV. We
determine a mass for the white dwarf of ~1.0Msun.
","[{""version"":""v1"",""created"":""Tue, 7 May 2002 17:29:34 GMT""}]","2009-11-07"
"astro-ph/0205103","Fabian Heitsch","Fabian Heitsch (1), Ellen G. Zweibel (1) ((1) JILA, University of
  Colorado, Boulder)","Fast Reconnection in a Two-Stage Process","21 pages, 13 figures, submitted to ApJ","Astrophys.J. 583 (2003) 229-244","10.1086/345082",,"astro-ph",,"  Magnetic reconnection plays an essential role in the generation and evolution
of astrophysical magnetic fields. The best tested and most robust reconnection
theory is that of Parker and Sweet. According to this theory, the reconnection
rate scales with magnetic diffusivity lambda as lambda^0.5. In the interstellar
medium, the Parker-Sweet reconnection rate is far too slow to be of interest.
Thus, a mechanism for fast reconnection seems to be required. We have studied
the magnetic merging of two oppositely directed flux systems in weakly ionized,
but highly conducting, compressible gas. In such systems, ambipolar diffusion
steepens the magnetic profile, leading to a thin current sheet. If the ion
pressure is small enough, and the recombination of ions is fast enough, the
resulting rate of magnetic merging is fast, and independent of lambda. Slow
recombination or sufficiently large ion pressure leads to slower merging which
scales with lambda as lambda^0.5. We derive a criterion for distinguishing
these two regimes, and discuss applications to the weakly ionized ISM and to
protoplanetary accretion disks.
","[{""version"":""v1"",""created"":""Tue, 7 May 2002 19:41:03 GMT""}]","2009-11-07"
"astro-ph/0205104","Makiko Nagasawa","M. Nagasawa (UCO/Lick), D. N. C. Lin (UCO/Lick), S. Ida (Tokyo
  Institute of Technology)","Eccentricity Evolution of Extrasolar Multiple Planetary Systems due to
  the Depletion of Nascent Protostellar Disks","50 pages including 11 figures, submitted to ApJ","Astrophys.J. 586 (2003) 1374-1393","10.1086/367884",,"astro-ph",,"  Most extrasolar planets are observed to have eccentricities much larger than
those in the solar system. Some of these planets have sibling planets, with
comparable masses, orbiting around the same host stars. In these multiple
planetary systems, eccentricity is modulated by the planets' mutual secular
interaction as a consequence of angular momentum exchange between them. For
mature planets, the eigenfrequencies of this modulation are determined by their
mass and semi-major axis ratios. But, prior to the disk depletion, self gravity
of the planets' nascent disks dominates the precession eigenfrequencies. We
examine here the initial evolution of young planets' eccentricity due to the
apsidal libration or circulation induced by both the secular interaction
between them and the self gravity of their nascent disks. We show that as the
latter effect declines adiabatically with disk depletion, the modulation
amplitude of the planets' relative phase of periapse is approximately invariant
despite the time-asymmetrical exchange of angular momentum between planets.
However, as the young planets' orbits pass through a state of secular
resonance, their mean eccentricities undergo systematic quantitative changes.
For applications, we analyze the eccentricity evolution of planets around
Upsilon Andromedae and HD168443 during the epoch of protostellar disk
depletion. We find that the disk depletion can change the planets' eccentricity
ratio. However, the relatively large amplitude of the planets' eccentricity
cannot be excited if all the planets had small initial eccentricities.
","[{""version"":""v1"",""created"":""Tue, 7 May 2002 20:18:49 GMT""},{""version"":""v2"",""created"":""Wed, 20 Nov 2002 19:20:29 GMT""}]","2009-11-07"
"astro-ph/0205105","Bruce Elmegreen","Debra Meloy Elmegreen (1), Bruce G. Elmegreen (2), Jay A. Frogel
  (3,4), Paul B. Eskridge (5), Richard W. Pogge (3), Andrew Gallagher (1), and
  Joel Iams (1,6) ((1) Vassar College, (2) IBM T.J. Watson Research Center, (3)
  Ohio State University, (4) NASA Headquarters, (5) Minnesota State University,
  (6) Williams College)","Arm Structure in Anemic Spiral Galaxies","15 pages, 3 figures, accepted by AJ",,"10.1086/341613",,"astro-ph",,"  Anemic galaxies have less prominent star formation than normal galaxies of
the same Hubble type. Previous studies showed they are deficient in total
atomic hydrogen but not in molecular hydrogen. Here we compare the combined
surface densities of HI and H2 at mid-disk radii with the Kennicutt threshold
for star formation. The anemic galaxies are below threshold, which explains
their lack of prominent star formation, but they are not much different than
other early type galaxies, which also tend to be below threshold. The spiral
wave amplitudes of anemic and normal galaxies were also compared, using images
in B and J passbands from the OSU Bright Spiral Galaxy Survey. Anemic galaxies
have normal spiral wave properties too, with the same amplitudes and radial
dependencies as other galaxies of the same arm class. Because of the lack of
gas, spiral waves in early type galaxies and anemics do not have a continuous
supply of stars with low velocity dispersions to maintain a marginally stable
disk. As a result, they are either short-lived, evolving toward lenticulars and
S0 types in only a few rotations at mid-disk, or they are driven by the
asymmetries associated with gas removal in the cluster environment.
","[{""version"":""v1"",""created"":""Tue, 7 May 2002 20:31:37 GMT""}]","2009-11-07"
"astro-ph/0205106","Julia Arias","J.I. Arias (1), N.I. Morrell (1), R.H. Barba (1), G.L. Bosch (1), M.
  Grosso (2), and M. Corcoran (3). ((1) Observatorio Astronomico La Plata, La
  Plata, Argentina, (2) Complejo Astronomico El Leoncito, San Juan, Argentina,
  (3) Laboratory for High Energy Astrophysics, Goddard Space Flight Center,
  Greenbelt, MD, USA.)","The massive double-lined O-type binary HD 165052","9 pages, 5 tables, 9 figures. Accepted by Monthly Notices","Mon.Not.Roy.Astron.Soc.333:202,2002","10.1046/j.1365-8711.2002.05404.x",,"astro-ph",,"  We present a new optical spectroscopic study of the O-type binary HD 165052
based on high- and intermediate-resolution CCD observations. We re-investigated
the spectral classification of the binary components, obtaining spectral types
of O6.5 V and O7.5 V for the primary and secondary, respectively, finding that
both stars display weak C {\sc iii} $\lambda5696$ emission in their spectra. We
also determined a radial-velocity orbit for HD 165052 with a period of 2.95510
$\pm$ 0.00001 d, and semiamplitudes of 94.8 and 104.7 $\pm$ 0.5 km s$^{-1}$,
resulting in a mass ratio $Q = 0.9$. From a comparison with previous
radial-velocity determinations, we found evidence of apsidal motion in the
system. Several signatures of wind-wind collision, such as phase-locked
variability of the X-ray flux and the Struve-Sahade effect, are also
considered. It was also found that the reddening in the region should be
normal, in contrast with previous determinations.
","[{""version"":""v1"",""created"":""Tue, 7 May 2002 21:09:58 GMT""}]","2008-11-26"
"astro-ph/0205107","Titarchuk Lev","Roberto Turolla (University of Padova, Italy), Silvia Zane (MSSL,
  University College London, UK) and Lev Titarchuk (GMU/NRL/GSFC, USA)","Power-law Tails from Dynamical Comptonization in Converging Flows","to be published in the Astrophysical Journal, 16 pages and 9 figures","Astrophys.J. 576 (2002) 349-356","10.1086/341631",,"astro-ph",,"  The effects of bulk motion comptonization on the spectral formation in a
converging flow onto a black hole are investigated. The problem is tackled by
means of both a fully relativistic, angle-dependent transfer code and a
semi-analytical, diffusion-approximation method. We find that a power-law
high-energy tail is a ubiquitous feature in converging flows and that the two
approaches produce consistent results at large enough accretion rates, when
photon diffusion holds. Our semi-analytical approach is based on an expansion
in eigenfunctions of the diffusion equation. Contrary to previous
investigations based on the same method we find that, although the power-law
tail at really large energies is always dominated by the flatter spectral mode,
the slope of the hard X-ray portion of the spectrum is dictated by the second
mode and it approaches Gamma=3 at large accretion rate, irrespective of the
model parameters. The photon index in the tail is found to be largely
independent on the spatial distribution of soft seed photons when the accretion
rate is either quite low (< 5 in Eddington units) or sufficiently high (> 10).
On the other hand, the spatial distribution of source photons controls the
photon index at intermediate accretion rates, when Gamma switches from the
first to the second mode. Our analysis confirms that a hard tail with photon
index Gamma <3 is produced by the up-scattering of primary photons onto
infalling electrons if the central object is a black hole.
","[{""version"":""v1"",""created"":""Tue, 7 May 2002 21:26:07 GMT""}]","2009-11-07"
"astro-ph/0205108","Enrico Ramirez-Ruiz","Enrico Ramirez-Ruiz (1), Annalisa Celotti (1,2), Martin J. Rees (1)
  ((1) IoA Cambridge; (2) SISSA)","Events in the life of a cocoon surrounding a light, collapsar jet","16 pages, 5 figures, slightly revised version, accepted for
  publication in MNRAS","Mon.Not.Roy.Astron.Soc. 337 (2002) 1349","10.1046/j.1365-8711.2002.05995.x",,"astro-ph",,"  According to the collapsar model, gamma-ray bursts are thought to be produced
in shocks that occur after the relativistic jet has broken free from the
stellar envelope. If the mass density of the collimated outflow is less than
that of the stellar envelope, the jet will then be surrounded by a cocoon of
relativistic plasma. This material would itself be able to escape along the
direction of least resistance, which is likely to be the rotation axis of the
stellar progenitor, and accelerate in approximately the same way as an
impulsive fireball. We discuss how the properties of the stellar envelope have
a decisive effect on the appearance of a cocoon propagating through it. The
relativistic material that accumulated in the cocoon would have enough kinetic
energy to substantially alter the structure of the relativistic outflow, if not
in fact provide much of the observed explosive power. Shock waves within this
plasma can produce gamma-ray and X-ray transients, in addition to the standard
afterglow emission that would arise from the deceleration shock of the cocoon
fireball.
","[{""version"":""v1"",""created"":""Tue, 7 May 2002 21:47:47 GMT""},{""version"":""v2"",""created"":""Fri, 16 Aug 2002 23:29:42 GMT""}]","2009-11-07"
"astro-ph/0205109","Albrecht Karle","AMANDA Collaboration: J. Ahrens, et al","Observation of High Energy Atmospheric Neutrinos with the Antarctic Muon
  and Neutrino Detector Array","21 pages, 25 figures","Phys.Rev.D66:012005,2002","10.1103/PhysRevD.66.012005",,"astro-ph hep-ex",,"  The Antarctic Muon and Neutrino Detector Array (AMANDA) began collecting data
with ten strings in 1997. Results from the first year of operation are
presented. Neutrinos coming through the Earth from the Northern Hemisphere are
identified by secondary muons moving upward through the array. Cosmic rays in
the atmosphere generate a background of downward moving muons, which are about
10^6 times more abundant than the upward moving muons. Over 130 days of
exposure, we observed a total of about 300 neutrino events. In the same period,
a background of 1.05*10^9 cosmic ray muon events was recorded. The observed
neutrino flux is consistent with atmospheric neutrino predictions. Monte Carlo
simulations indicate that 90% of these events lie in the energy range 66 GeV to
3.4 TeV. The observation of atmospheric neutrinos consistent with expectations
establishes AMANDA-B10 as a working neutrino telescope.
","[{""version"":""v1"",""created"":""Tue, 7 May 2002 23:05:36 GMT""}]","2008-11-26"
"astro-ph/0205110","Dieter Hartmann","D. H. Hartmann (Clemson), K. Kretschmer (MPE), R. Diehl (MPE)","Disturbance Ecology from nearby Supernovae","7 pages, 1 Fig, to appear in Proc. 11th Workshop on Nuclear
  Astrophysics, Ringberg Castle, 2/11-16, 2002; available online at
  http://www.mpa-garching.mpg.de/english/greenreports.html",,,,"astro-ph",,"  Monte Carlo simulations of Galactic Supernovae are carried out to study the
rate of nearby events, which may have a direct effect on Earth's ecology though
ionizing radiation and cosmic ray bombardment. A nearby supernova may have left
a radioactive imprint (60Fe) in recent galactic history.
","[{""version"":""v1"",""created"":""Wed, 8 May 2002 03:39:00 GMT""}]","2007-05-23"
"astro-ph/0205111","D. J. Saikia","F. Mantovani, D.J. Saikia, M. Bondi, W. Junor, C.J. Salter, R. Ricci","B1524-136: A CSS quasar with two-sided radio jets","5 pages, 3 figures, to appear in A&A Letters",,"10.1051/0004-6361:20020697",,"astro-ph",,"  We present MERLIN, global VLBI and VLBA observations of the high-luminosity,
compact steep-spectrum quasar B1524$-$136 at cm wavelengths. These observations
reveal well-defined radio jets on both sides of the active nucleus, a situation
which is almost unique amongst high-luminosity radio quasars. However, the
radio jets on opposite sides are very dissimilar, and the overall radio
structure appears highly distorted. We discuss possible implications of these
observations.
","[{""version"":""v1"",""created"":""Wed, 8 May 2002 08:14:16 GMT""}]","2009-11-07"
"astro-ph/0205112","Anisa Bajkova","A.T.Bajkova","Maximum entropy method for reconstruction of the CMB images","Talk at the COSMION-5 Conference (Moscow--St.Petersburg, 21-30 May
  2001)5 pages, 2 figures, Latex with gc.sty",,,,"astro-ph",,"  We propose a new approach for the accurate reconstruction of cosmic microwave
background distributions from observations containing in addition to the
primary fluctuations the radiation from unresolved extragalactic point sources
and pixel noise. The approach uses some effective realizations of the
well-known maximum entropy method and principally takes into account {\it a
priori} information about finiteness and spherical symmetry of the power
spectrum of the CMB satisfying the Gaussian statistics.
","[{""version"":""v1"",""created"":""Wed, 8 May 2002 08:22:56 GMT""},{""version"":""v2"",""created"":""Tue, 21 May 2002 12:22:46 GMT""}]","2007-05-23"
"astro-ph/0205113","Moshe Carmeli","Moshe Carmeli","Five-Dimrnsional Cosmological Theory of Unified Space, Time and Velocity","6 pages in LaTex, presented at Dark Matter 2002",,"10.1016/S0920-5632(03)02118-2",,"astro-ph",,"  A five-dimensional cosmological theory of gravitation that unifies space,
time and velocity is presented
","[{""version"":""v1"",""created"":""Wed, 8 May 2002 10:42:47 GMT""}]","2009-11-07"
"astro-ph/0205114","Gulab Chand Dewangan","G. C. Dewangan (TIFR, India), Th. Boller (MPE, Germany), K. P. Singh
  (TIFR, India), K. M. Leighly (University of Oklahoma, USA)","A 10-day ASCA Observation of the Narrow-line Seyfert~1 galaxy IRAS
  13224-3809","29 pages, 16 figures, To apear in A&A",,"10.1051/0004-6361:20020689",,"astro-ph",,"  (Abridged) We present an analysis of a 10-day continuous ASCA observation of
the narrow-line Seyfert 1 galaxy IRAS 13224-3809. The soft (0.7-1.3 keV) and
hard (1.3-10 keV) X-ray band light curves binned to 5000s reveal trough-to-peak
variations by a factor >25 and 20, respectively. The light curves in the soft
and hard bands are strongly correlated without any significant delay. However,
this correlation is not entirely due to changes in the power-law flux alone but
also due to changes in the soft X-ray hump emission above the power law. The
presence of a soft X-ray hump below 2 keV, previously detected in ROSAT and
ASCA data, is confirmed. Time resolved spectroscopy using daily sampling
reveals changes in the power-law slope, with Gamma in the range 1.74-2.47,
however, day-to-day variations in Gamma are not significant. The Soft hump
emission is found to dominate the observed variability on a timescale of a
week, but on shorter timescales (20000s) the power-law component appears to
dominate the observed variability. Flux resolved spectroscopy reveals that at
high flux levels the power law becomes steeper and the soft hump more
pronounced. The steepening of the photon index with the fluxes in the soft and
hard bands can be understood in the framework of disk/corona models in which
accretion disk is heated by viscous dissipation as well as by reprocessing of
hard X-rays following an X-ray flare resulting from coronal dissipation through
magnetic reconnection events.
","[{""version"":""v1"",""created"":""Wed, 8 May 2002 11:23:28 GMT""}]","2009-11-07"
"astro-ph/0205116","Subir Sarkar","Subir Sarkar (Oxford)","Measuring the baryon content of the universe: BBN vs CMB","14 pages, 5 figures (LaTeX); Invited talk at the XIII Recontres de
  Blois ""Frontiers of the Universe"", 17-23 June 2001","in ""Frontiers of the Universe"", eds L Celnekier and J Tran Thanh
  Van (The Gioi Publishers, 2004) pp.53-63",,,"astro-ph hep-ph",,"  The relic abundance of baryons - the only form of stable matter whose
existence we are certain of - is a crucial parameter for many cosmological
processes, as well as material evidence that there is new physics beyond the
Standard Model. We discuss recent determinations of the cosmological baryon
density from analysis of the abundances of light elements synthesised at the
end of ``the first three minutes'', and from the observed temperature
anisotropies imprinted on small angular-scales in the cosmic microwave
background when the universe was about 100,000 yr old.
","[{""version"":""v1"",""created"":""Wed, 8 May 2002 15:13:01 GMT""}]","2007-05-23"
"astro-ph/0205117","Jochen Schulz","J. Schulz and U. Fritze - v. Alvensleben and C.S. Moeller and K. J.
  Fricke (Universit\""atssternwarte, G\""ottingen, Germany)","Spectral & Photometric Evolution of Simple Stellar Populations at
  Various Metallicities","12 pages, using AA LaTeX vers. 4.01, accepted for A&A",,"10.1051/0004-6361:20020657",,"astro-ph",,"  A new set of evolutionary synthesis spectra are presented for {\bf S}imple
{\bf S}tellar {\bf P}opulations ({\bf SSP}s) covering ranges in metallicity
from $ 0.02 \leq Z/Z_{\odot} \leq 2.5$ and ages from $4\cdot 10^6$ yr $\leq t
\leq 16$ Gyr. They are based on the most recent isochrones from the Padova
group that extend earlier models by the inclusion of the thermal pulsing AGB
phase for stars in the mass range $2 M_{\odot} \leq m \leq 7 M_{\odot}$ in
accordance with the fuel consumption theorem. We show that with respect to
earlier models, inclusion of the TP-AGB phase leads to significant changes in
the $(V-I)$ and $(V-K)$ colors of SSPs. Using model atmosphere spectra from
Lejeune et al, we calculate the spectral evolution of single burst populations
of various metallicities. Isochrone spectra are convolved with filter response
functions to describe the time evolution of luminosities and colors in various
filter systems. The models and their results are not only intended for use in
the interpretation of star clusters but also for combination with any kind of
dynamical galaxy formation and/or evolution model that contains a star
formation criterion. We also present the time evolution of ejection rates for
gas and metals for two different {\bf I}nitial {\bf M}ass {\bf F}unctions ({\bf
IMF}s) as well as cosmological and evolutionary corrections for all the filters
as a function of redshift and two different cosmologies. Extensive data files
are provided in the electronic version, at CDS, and at our above www-address.
","[{""version"":""v1"",""created"":""Wed, 8 May 2002 14:13:42 GMT""}]","2009-11-07"
"astro-ph/0205118","Cormac Reynolds","C. Reynolds (1), Z. Paragi (1), M. Garrett (1) ((1) JIVE)","Pipeline Processing of VLBI Data","4 pages, 8 figures. To be presented at the URSI General Assembly,
  2002",,,,"astro-ph",,"  As part of an on-going effort to simplify the data analysis path for VLBI
experiments, a pipeline procedure has been developed at JIVE to carry out much
of the data reduction required for EVN experiments in an automated fashion.
This pipeline procedure runs entirely within AIPS, the standard data reduction
package used in astronomical VLBI, and is used to provide preliminary
calibration of EVN experiments correlated at the EVN MkIV data processor. As
well as simplifying the analysis for EVN users, the pipeline reduces the delay
in providing information on the data quality to participating telescopes, hence
improving the overall performance of the array. A description of this pipeline
is presented here.
","[{""version"":""v1"",""created"":""Wed, 8 May 2002 15:12:30 GMT""}]","2016-08-30"
"astro-ph/0205119","Luc Binette","Luc Binette, Mario Rodriguez-Martinez, Isidro Ballinas","The Intergalactic Medium and the Energy Distribution of Quasars","revised, 8 pages, 2 figures, to appear in Pasp Conf. Series",,,,"astro-ph",,"  The ionizing spectral energy distribution of quasars is known to exhibit a
steepening of the distribution short-ward of 1050\AA. It has been assumed that
this change of power-law index from -1 to -2 is intrinsic to the quasars. We
study an alternative interpretation, in which a tenuous absorption screen is
responsible for the change of index. A successful spectral fit is obtained
using a total hydrogen density distribution decreasing with redshift as $\sim
(1+z)^{\xi}$ with $\xi$ of the order -3.5 if we suppose that the ionization
state of the intervening gas is controlled by the line-of-sight quasar. This
interpretation is not compatible, however, with the relative weakness of the
observed quasar intensities with respect to that of the local background
metagalactic radiation. Therefore, our interpretation in its present form
cannot be sustained.
","[{""version"":""v1"",""created"":""Wed, 8 May 2002 14:34:01 GMT""},{""version"":""v2"",""created"":""Wed, 15 May 2002 15:45:29 GMT""}]","2007-05-23"
"astro-ph/0205120","Marina Orio","P. Nedialkov, M. Orio, K. Birkle, C. Conselice, M. Della Valle, J.
  Greiner, E. Magnier, N.A. Tikhonov","First optical identification of a suprsoft X-ray source in M31","To appear in Astronomy and Astrophysics",,"10.1051/0004-6361:20020575",,"astro-ph",,"  We propose the first association of an optical counterpart with a luminous
supersoft X-ray source in M31, RX J0044.0+4118, observed with ROSAT in July
1991. The PSPC position is at 1.6"" angular distance from a candidate nova in
outburst in September of 1990. This is interesting because the incidence of
classical novae among supersoft X-ray sources is an open question. The proposed
optical counterpart was measured at R~17.7 in September of 1990, and it had
faded to R>19.2 when it was observed again after 70 days.
  The light curve was too sparsely monitored for definite conclusions on the
speed class of the nova. No other variable objects with V<23.5 were found in
the ROSAT spatial error box. We evaluate that the probability that a classical
or recurrent nova was in outburst in the ROSAT error box in the few years
preceding the observation is very small, so the proposed identification is
meaningful. We also show evidence that the associated supersoft X-ray source
turned off in the third year after the outburst.
","[{""version"":""v1"",""created"":""Wed, 8 May 2002 14:48:42 GMT""}]","2016-08-30"
