"astro-ph/0205502","Alan Whiting","Alan B. Whiting (CTIO), G. K. T. Hau (ESO), Mike Irwin (Cambridge)","The Southern Dwarf Hunt: Local Group Dwarf Candidates in the Southern
  Sky","33 pages, 84 images (low-resolution here), accepted for publication
  in ApJ Supplemnt, July 2002","Astrophys.J.Suppl. 141 (2002) 123-146","10.1086/340037",,"astro-ph",,"  We present observations of 82 Local Group dwarf galaxy candidates, of which
62 were chosen visually from ESO-SRC survey plates of the southern sky (32 of
which were not previously catalogued) and the rest suggested by various sources
in the literature. Two are the Local Group galaxies Antlia and Cetus; nine are
more distant galaxies, though still within a few megaparsecs; 45 are background
galaxies; seven are planetary (or other emission) nebulae; 15 are reflection or
other Galactic nebulae; two are galaxy clusters; one is a Galactic star cluster
and one is a misidentified star. We conclude that there is no large population
of faint Local Group dwarf galaxies of any familiar type awaiting discovery. We
point out the danger of relying on a single type of data to reach conclusions
about an object.
","[{""version"":""v1"",""created"":""Wed, 29 May 2002 13:23:02 GMT""}]","2009-11-07"
"astro-ph/0205503","Cecile Gry","Cecile Gry, Francois Boulanger, Cyrine Nehme, Guillaume Pineau Des
  Forets, Emilie Habart, Edith Falgarone","H2 formation and excitation in the diffuse interstellar medium","7 pages, 4 figures, to be published in Astronomy & Astrophysics",,"10.1051/0004-6361:20020691",,"astro-ph",,"  We use far-UV absorption spectra obtained with FUSE towards three late B
stars to study the formation and excitation of H2 in the diffuse ISM. The data
interpretation relies on a model of the chemical and thermal balance in
photon-illuminated gas. The data constrain well the nR product between gas
density and H2 formation rate on dust grains: nR = 1 to 2.2 e-15 s-1. For each
line of sight the mean effective H2 density n, assumed uniform, is obtained by
the best fit of the model to the observed N(J=1)/N(J=0) ratio, since the
radiation field is known. Combining n with the nR values, we find similar H2
formation rates for the three stars of about R = 4 e-17 cm3/s.
  Because the target stars do not interact with the absorbing matter we can
show that the H2 excitation in the J>2 levels cannot be accounted for by the UV
pumping of the cold H2 but implies collisional excitation in regions where the
gas is much warmer. The existence of warm H2 is corroborated by the fact that
the star with the largest column density of CH+ has the largest amount of warm
H2.
","[{""version"":""v1"",""created"":""Wed, 29 May 2002 15:31:55 GMT""}]","2009-11-07"
"astro-ph/0205504","C. J. A. P. Martins","C. J. A. P. Martins (CAUP (Porto), DAMTP (Cambridge), IAP (Paris))","Cosmology with Varying Constants","14 pages, no figures. Essay to appear in Phil. Trans. Roy. Soc. Lond.
  A Triennial Series (Christmas 2002 Issue)","Phil.Trans.Roy.Soc.Lond. A360 (2002) 2681-2696","10.1098/rsta.2002.1087","DAMTP-2002-61","astro-ph gr-qc hep-ph hep-th",,"  The idea of possible time or space variations of the `fundamental' constants
of nature, although not new, is only now beginning to be actively considered by
large numbers of researchers in the particle physics, cosmology and
astrophysics communities. This revival is mostly due to the claims of possible
detection of such variations, in various different contexts and by several
groups. Here, I present the current theoretical motivations and expectations
for such variations, review the current observational status, and discuss the
impact of a possible confirmation of these results in our views of cosmology
and physics as a whole.
","[{""version"":""v1"",""created"":""Wed, 29 May 2002 13:41:48 GMT""}]","2009-11-07"
"astro-ph/0205505","Kazuhiro Yamamoto","Kazuhiro Yamamoto ((1)MPA Garching, (2)Hiroshima Univ.)","Cosmological Constraint from the 2dF QSO Spatial Power Spectrum","16 pages, 6 figures, MNRAS, in press","Mon.Not.Roy.Astron.Soc. 334 (2002) 958","10.1046/j.1365-8711.2002.05575.x",,"astro-ph",,"  In this paper we obtain constraints on the cosmological density parameters,
\Omega_m and \Omega_b, by comparing the preliminary measurement of the QSO
power spectrum from the two degree field QSO redshift survey with results from
an analytic technique of power spectrum estimation, described in this paper. We
demonstrate the validity of the analytic approach by comparing the results with
the power spectrum of an N-body simulation. We find a better fit to the shape
of the QSO power spectrum for low density models with \Omega_m= 0.1-0.4. We
show that a finite baryon fraction \Omega_b/\Omega_m=0.2, consistent with
observations of the CMB anisotropies and nucleosynthesis, fits the
observational result of the 2QZ survey better, though the constraint is not
very tight. By using the Fisher matrix technique, we investigate just how a
survey would be required before a significant constraint on the density
parameters can be made. We demonstrate that the constraint could be
significantly improved if the survey was four times larger.
","[{""version"":""v1"",""created"":""Wed, 29 May 2002 15:19:53 GMT""}]","2009-11-07"
"astro-ph/0205506","Bernstein","G. M. Bernstein and P. Norberg","Shape Alignments of Satellite Galaxies","4 pages, 2 figures, accepted for Aug 2002 Astronomical Journal",,"10.1086/341383",,"astro-ph",,"  We test a sample of satellites of isolated primary galaxies, extracted from
the 2dF Galaxy Redshift Survey (2dFGRS), for any tendency to be aligned along
(or against) the primary-to-satellite radius vector. If tidal effects induce
such an alignment, it would contaminate recent measurements of galaxy halo
masses which use the coherent alignment induced on background galaxies by
gravitational lensing. The mean tangential ellipticity of 1819 satellites
within 500 kpc projected radius is <e_+> = +0.004+-0.008, so no tidal alignment
is detected. This implies at 95% confidence that satellite alignment is less
than a 20% contamination of the alignment signal attributed to galaxy-galaxy
lensing by Smith et al. (2001) and McKay et al. (2001).
","[{""version"":""v1"",""created"":""Wed, 29 May 2002 15:42:44 GMT""}]","2009-11-07"
"cond-mat/0205599","Robert Pelcovits","Pavel A. Kossyrev, Jun Qi, Nikolai V. Priezjev, Robert A. Pelcovits,
  and Gregory P. Crawford","Virtual surfaces, director domains and the Freedericksz transition in
  polymer stabilized nematic liquid crystals","14 pages, pdf","Appl. Phys. Lett. 81, 2986 (2002)","10.1063/1.1515136",,"cond-mat.soft",,"  The critical field of the Freedericksz transition and switching dynamics are
investigated for polymer stabilized nematic liquid crystals as a function of
polymer concentration. A simple phenomenological model is proposed to describe
the observed critical field and dynamic response time behaviors as a function
of concentration. In this model the polymer fibrils form director domains,
which are bounded by virtual surfaces with a finite anchoring energy. The
Freedericksz transition occurs independently within each of these domains.
","[{""version"":""v1"",""created"":""Tue, 28 May 2002 17:31:26 GMT""}]","2009-11-07"
"cond-mat/0205600","Geert Brocks","G. Brocks, J.H. Snoeijer, P. J. Kelly, H. J. W. Zandvliet, and Bene
  Poelsema","The difference between Si and Ge(001) surfaces in the initial stages of
  growth","4 pages, 3 figures",,,,"cond-mat.mtrl-sci",,"  The initial stages of growth of Ge and Si on the Ge(001) surface are studied
and compared to growth on the Si(001) surface. Metastable rows of diluted
ad-dimers exist on both surfaces as intermediate stages of epitaxial growth.
Unexpectedly, for Ge(001) these rows are found exclusively in the <310>
directions, whereas on Si(001) the preferred direction is <110>. This
qualitative difference between Si and Ge surfaces reflects the subtle
difference in the chemistry of these two elements, which has direct
consequences for epitaxial growth on these surfaces.
","[{""version"":""v1"",""created"":""Tue, 28 May 2002 19:42:46 GMT""}]","2007-05-23"
"cond-mat/0205601","Vito Latora","Paolo Crucitti, Vito Latora, Massimo Marchiori and Andrea Rapisarda","Efficiency of Scale-Free Networks: Error and Attack Tolerance","23 pages, 10 figures","Physica A 320 (2003) 642","10.1016/S0378-4371(02)01545-5",,"cond-mat",,"  The concept of network efficiency, recently proposed to characterize the
properties of small-world networks, is here used to study the effects of errors
and attacks on scale-free networks. Two different kinds of scale-free networks,
i.e. networks with power law P(k), are considered: 1) scale-free networks with
no local clustering produced by the Barabasi-Albert model and 2) scale-free
networks with high clustering properties as in the model by Klemm and Eguiluz,
and their properties are compared to the properties of random graphs
(exponential graphs). By using as mathematical measures the global and the
local efficiency we investigate the effects of errors and attacks both on the
global and the local properties of the network. We show that the global
efficiency is a better measure than the characteristic path length to describe
the response of complex networks to external factors. We find that, at variance
with random graphs, scale-free networks display, both on a global and on a
local scale, a high degree of error tolerance and an extreme vulnerability to
attacks. In fact, the global and the local efficiency are unaffected by the
failure of some randomly chosen nodes, though they are extremely sensititive to
the removal of the few nodes which play a crucial role in maintaining the
network's connectivity.
","[{""version"":""v1"",""created"":""Tue, 28 May 2002 19:42:25 GMT""}]","2009-11-07"
"cond-mat/0205602","A. J. Blattner","A. J. Blattner and B. W. Wessels","Ferromagnetism in (In,Mn)As Diluted Magnetic Semiconductor Thin Films
  Grown by Metalorganic Vapor Phase Epitaxy","5 pages, 5 figures, accepted for publication in JVSTB",,"10.1116/1.1491991",,"cond-mat.mtrl-sci",,"  In1-xMnxAs diluted magnetic semiconductor (DMS) thin films have been grown
using metalorganic vapor phase epitaxy (MOVPE).
Tricarbonyl(methylcyclopentadienyl)manganese was used as the Mn source.
Nominally single-phase, epitaxial films were achieved with Mn content as high
as x=0.14 using growth temperatures Tg>475 C. For lower growth temperatures and
higher Mn concentrations, nanometer scale MnAs precipitates were detected
within the In1-xMnxAs matrix. Magnetic properties of the films were
investigated using a superconducting quantum interference device (SQUID)
magnetometer. Room-temperature ferromagnetic order was observed in a sample
with x=0.1. Magnetization measurements indicated a Curie temperature of 333 K
and a room-temperature saturation magnetization of 49 emu/cm^3. The remnant
magnetization and the coercive field were small, with values of 10 emu/cm^3 and
400 Oe, respectively. A mechanism for this high-temperature ferromagnetism is
discussed in light of the recent theory based on the formation of small
clusters of a few magnetic atoms.
","[{""version"":""v1"",""created"":""Tue, 28 May 2002 23:42:15 GMT""}]","2009-11-07"
"cond-mat/0205603","Neepa T. Maitra","Neepa T. Maitra, Ivo Souza, and Kieron Burke","Current-Density Functional Theory of the Response of Solids","5 pages, accepted in PRB",,"10.1103/PhysRevB.68.045109",,"cond-mat.mtrl-sci",,"  The response of an extended periodic system to a homogeneous field (of
wave-vector $q=0$) cannot be obtained from a $q=0$ time-dependent density
functional theory (TDDFT) calculation, because the
  Runge-Gross theorem does not apply. Time-dependent {\em current}-density
functional theory is needed and demonstrates that one key ingredient missing
from TDDFT is the macroscopic current. In the low-frequency limit, in certain
cases, density polarization functional theory is recovered and a formally exact
expression for the polarization functional is given.
","[{""version"":""v1"",""created"":""Tue, 28 May 2002 20:23:43 GMT""},{""version"":""v2"",""created"":""Thu, 8 May 2003 14:48:06 GMT""}]","2016-08-31"
"cond-mat/0205604","Caio H. Lewenkopf","E. R. P. Alves and C. H. Lewenkopf","Conductance fluctuations and weak localization in chaotic quantum dots","4 pages, 4 figures, to appear in Phys. Rev. Lett",,"10.1103/PhysRevLett.88.256805",,"cond-mat.mes-hall",,"  We study the conductance statistical features of ballistic electrons flowing
through a chaotic quantum dot. We show how the temperature affects the
universal conductance fluctuations by analyzing the influence of dephasing and
thermal smearing. This leads us to two main findings. First, we show that the
energy correlations in the transmission, which were overlooked so far, are
important for calculating the variance and higher moments of the conductance.
Second, we show that there is an ambiguity in the method of determination of
the dephasing rate from the size of the of the weak localization. We find that
the dephasing times obtained at low temperatures from quantum dots are
underestimated.
","[{""version"":""v1"",""created"":""Tue, 28 May 2002 21:20:09 GMT""}]","2009-11-07"
"cond-mat/0205605","Kunal K. Das","Kunal K. Das, M.D. Girardeau and E.M. Wright","Interference of a thermal Tonks gas on a ring","4 pages, 3 figures","Phys. Rev. Lett. 89, 170404 (2002)","10.1103/PhysRevLett.89.170404",,"cond-mat.soft",,"  A nonzero temperature generalization of the Fermi-Bose mapping theorem is
used to study the exact quantum statistical dynamics of a one-dimensional gas
of impenetrable bosons on a ring. We investigate the interference produced when
an initially trapped gas localized on one side of the ring is released, split
via an optical-dipole grating, and recombined on the other side of the ring.
Nonzero temperature is shown not to be a limitation to obtaining high
visibility fringes.
","[{""version"":""v1"",""created"":""Tue, 28 May 2002 22:08:35 GMT""}]","2009-11-07"
"cond-mat/0205606","Andrei Mishchenko","A. S. Mishchenko (1,2), N. Nagaosa (1,3), N. V. Prokof'ev (4), A.
  Sakamoto (3), and B. V. Svistunov (2) ((1) Correlated electron research
  center, (2) RRC ""Kurchatov Institute, (3) The University of Tokyo, (4)
  University of Massachusets)","Self-Trapping of Polarons in the Rashba-Pekar Model","5 pages, 5 figures, Accepted to Phys. Rev. B Rapid Communications",,"10.1103/PhysRevB.66.020301",,"cond-mat.str-el",,"  We performed quantum Monte Carlo study of the exciton-polaron model which
features the self-trapping phenomenon when the coupling strength and/or
particle momentum is varied. For the first time accurate data for energy,
effective mass, the structure of the polaronic cloud, dispersion law, and
spectral function are available throughout the crossover region. We observed
that self-trapping can not be reduced to hybridization of two states with
different lattice deformation, and that at least three states are involved in
the crossover from light- to heavy-mass regimes.
","[{""version"":""v1"",""created"":""Wed, 29 May 2002 02:05:58 GMT""}]","2009-11-07"
"cond-mat/0205607","Tao Xiang","T. Xiang, Y.H. Su, C. Panagopoulos, Z.B. Su and L. Yu","Microscopic Hamiltonian for Zn or Ni substituted high temperature
  cuprate superconductors","5 pages, a discussion on the c-axis hopping and its implication on
  the STM spectrum is added","Physical Review B 66, 174504 (2002)","10.1103/PhysRevB.66.174504",,"cond-mat.supr-con cond-mat.str-el",,"  We have derived the effective low energy Hamiltonian for Zn or Ni substituted
high-T_c cuprates from microscopic three-band models consisting of the most
relevant Cu or impurity 3d and O 2p orbitals. We find that both scattering
potential and hopping integral induced by impurities have a finite range but
decay very fast with distance from the impurity. The Zn scattering potential is
very strong and attractive for electrons. The Ni scattering potential is much
weaker than the Zn case, resulting from the hybridization between Ni ions and O
holes. This profound difference is due to neither the electric charge nor
d-level location, but rather because of the interplay between the valence state
of the impurity and the strong correlation background. It gives a natural
account for the unusual effect of Ni and Zn on the reduction of superconducting
transition temperature. The interlayer hopping of electrons is highly
anisotropic and nonlocal, determined by the in-plane electronic structure. This
leads to a quantum interference of states from different sites and affects
strongly the scanning tunneling spectrum perpendicular to CuO_2 planes.
","[{""version"":""v1"",""created"":""Wed, 29 May 2002 02:20:23 GMT""},{""version"":""v2"",""created"":""Wed, 31 Jul 2002 02:51:46 GMT""}]","2009-11-07"
"cond-mat/0205608","Hyunsuk Hong","H. Hong, Beom Jun Kim, and M.Y. Choi","Stochastic resonance in the driven Ising model on small-world networks","to be published in Phys. Rev. E","Phys. Rev. E 66, 011107 (2002)","10.1103/PhysRevE.66.011107",,"cond-mat.dis-nn",,"  We investigate the stochastic resonance phenomena in the field-driven Ising
model on small-world networks. The response of the magnetization to an
oscillating magnetic field is examined by means of Monte Carlo dynamic
simulations, with the rewiring probability varied. At any finite value of the
rewiring probability, the system is found to undergo a dynamic phase transition
at a finite temperature, giving rise to double resonance peaks. While the peak
in the ferromagnetic phase grows with the rewiring probability, that in the
paramagnetic phase tends to reduce, indicating opposite effects of the
long-range interactions on the resonance in the two phases.
","[{""version"":""v1"",""created"":""Wed, 29 May 2002 05:48:46 GMT""}]","2009-11-07"
"cond-mat/0205609","Michael O. Katanaev","M.O. Katanaev (Steklov Mathematical Institute, Moscow)","Wedge Dislocation in the Geometric Theory of Defects","14 pages, 2 ps figures, minor changes, added references","Theor.Math.Phys. 135 (2003) 733-744; Teor.Mat.Fiz. 135 (2003)
  338-352",,,"cond-mat.mtrl-sci gr-qc hep-th",,"  We consider a wedge dislocation in the framework of elasticity theory and the
geometric theory of defects. We show that the geometric theory reproduces
quantitatively all the results of elasticity theory in the linear
approximation. The coincidence is achieved by introducing a postulate that the
vielbein satisfying the Einstein equations must also satisfy the gauge
condition, which in the linear approximation leads to the elasticity equations
for the displacement vector field. The gauge condition depends on the Poisson
ratio, which can be experimentally measured. This indicates the existence of a
privileged reference frame, which denies the relativity principle.
","[{""version"":""v1"",""created"":""Wed, 29 May 2002 06:45:30 GMT""},{""version"":""v2"",""created"":""Sat, 19 Apr 2003 08:09:25 GMT""}]","2007-05-23"
"cond-mat/0205610","Ching Cheng","C. Cheng","Uniaxial Phase Transition in Si : Ab initio Calculations",,,"10.1103/PhysRevB.67.134109",,"cond-mat.mtrl-sci cond-mat.stat-mech",,"  Based on a previously proposed thermodynamic analysis, we study the relative
stabilities of five Si phases under uniaxial compression using ab initio
methods. The five phases are diamond, beta-tin, sh, sc, and hcp structures. The
possible phase-transition patterns were investigated by considering the phase
transitions between any two chosen phases of the five phases. By analyzing the
different conributions to the relative pahse stability, we identified the most
important factors in reducing the phase-transition pressures at uniaxial
compression. We also show that it is possible to have phase transitions occur
only when the phases are under uniaxial compression, in spite of no phase
transition when under hydrostatic commpression. Taking all five phases into
consideration, the phase diagram at uniaxial compression was constructed for
pressures under 20 GPa. The stable phases were found to be diamond, beta-tin
and sh structures, i.e. the same as those when under hydrostatic condition.
According to the phase diagram, direct phase transition from the diamond to the
sh phase is possible if the applied uniaxial pressures, on increasing, satisfy
the condition of Px>Pz. Simiilarly, the sh-to-beta-tin transition on
increeasing pressures is also possible if the applied uniaxial pressures are
varied from the condition of Px>Pz, on which the phase of sh is stable, to that
of Px<Pz, on which the beta-tin is stable.
","[{""version"":""v1"",""created"":""Wed, 29 May 2002 07:13:34 GMT""}]","2009-11-07"
"cond-mat/0205611","Magdalena Milata","M. Milata, K. Wojcik, and K. Zieleniec (Institute of Physics,
  University of Silesia)","Influence of nonstoichiometry and iron doping on optical absorption in
  KNbO3 single crystal","10 pages with 3 figures and 2 table, submitted to Journal Physics D:
  Applied Physics",,,,"cond-mat",,"  Single crystals of KNbO3 and KNbO3 : Fe have been grown using the flux method
at various technological conditions. The investigations of optical absorption
of these crystals were carried out. Marked influence of technological
conditions and doping with iron on optical absorption has been found. Observed
changes of the absorption spectra are associated with lattice defects arising
due to nonstoichiometry and/or doping.
","[{""version"":""v1"",""created"":""Wed, 29 May 2002 09:12:49 GMT""}]","2007-05-23"
"cond-mat/0205612","David A. Kessler","David A. Kessler and Yitzhak Rabin","Stretching Instability of Helical Spring","5 pages, 4 figures",,"10.1103/PhysRevLett.90.024301",,"cond-mat.soft",,"  We show that when a gradually increasing tensile force is applied to the ends
of a helical spring with sufficiently large ratios of radius to pitch and twist
to bending rigidity, the end-to-end distance undergoes a sequence of
discontinuous stretching transitions. Subsequent decrease of the force leads to
step-like contraction and hysteresis is observed. For finite helices, the
number of these transitions increases with the number of helical turns but only
one stretching and one contraction instability survive in the limit of an
infinite helix. We calculate the critical line that separates the region of
parameters in which the deformation is continuous from that in which stretching
instabilities occur, and propose experimental tests of our predictions.
","[{""version"":""v1"",""created"":""Wed, 29 May 2002 10:16:59 GMT""}]","2009-11-07"
"cond-mat/0205613","Alejandro Rozenfeld","Alejandro F. Rozenfeld, Reuven Cohen, Daniel ben-Avraham, and Shlomo
  Havlin","Scale-free Networks on Lattices","Latex, 4 pages, 5 figures","Phys. Rev. Lett. 89, 218701 (2002)","10.1103/PhysRevLett.89.218701",,"cond-mat.dis-nn",,"  We suggest a method for embedding scale-free networks, with degree
distribution P(k) k^-lambda, in regular Euclidean lattices. The embedding is
driven by a natural constraint of minimization of the total length of the links
in the system. We find that all networks with lambda>2 can be successfully
embedded up to an (Euclidean) distance xi which can be made as large as desired
upon the changing of an external parameter. Clusters of successive chemical
shells are found to be compact (the fractal dimension is d_f=d), while the
dimension of the shortest path between any two sites is smaller than one:
d_min=(lambda-2)/(lambda-1-1/d), contrary to all other known examples of
fractals and disordered lattices.
","[{""version"":""v1"",""created"":""Wed, 29 May 2002 10:19:10 GMT""}]","2009-11-07"
"cond-mat/0205614","Katarzyna Sznajd-Weron","Katarzyna Sznajd-Weron","On controlling simple dynamics by a disagreement function",,,"10.1103/PhysRevE.66.046131",,"cond-mat.stat-mech",,"  We introduce a formula for the disagreement function which is used to control
a recently proposed dynamics of the Ising spin system. This leads to four
different phases of the Ising spin chain in a zero temperature. One of these
phases is doubly degenerated (anti- and ferromagnetic states are equally
probable). On the borders between the phases two types of transitions are
observed: infinite degeneration and instability lines. The relaxation of the
system depends strongly on the phase.
","[{""version"":""v1"",""created"":""Wed, 29 May 2002 10:24:32 GMT""}]","2009-11-07"
"cond-mat/0205615","Tullio Scopigno","T. Scopigno, E. Pontecorvo, R. Di Leonardo, M. Krisch, G. Monaco, G.
  Ruocco, B. Ruzicka, F. Sette","Experimental evidence for high frequency transverse-like excitations in
  glasses","13 pages, 5 PostScript figures",,,,"cond-mat.dis-nn",,"  The dynamic structure factor of glassy and liquid glycerol has been measured
by inelastic X-ray scattering in the exchanged momentum ($Q$) region
$Q$=2$\div$23 nm$^{-1}$ and in the temperature range 80$\div$570 K. Beside the
propagating longitudinal excitations modes, at low temperature the spectra show
a second non $Q$-dispersing peak at $\hbar \Omega_T$$\approx$8.5 meV. We assign
this peak to the transverse dynamics that, in topologically disordered systems,
acquires a longitudinal symmetry component. This assignment is substantiated by
the observation that, in the liquid, this peak vanishes when the structural
relaxation time $\tau_\alpha$ approaches $\Omega_T^{-1}$, a behavior consistent
with the condition $\tau_\alpha \Omega_T^{-1}$$>>$1 required for the existence
of a transverse-like dynamics in the liquid state.
","[{""version"":""v1"",""created"":""Wed, 29 May 2002 11:06:31 GMT""}]","2007-05-23"
