"cond-mat/0205616","E. Penev","T. M. Mishonov, J. P. Wallington, E. S. Penev, and J. O. Indekeu","Reduced pairing hamiltonian for interatomic two-electron exchange in
  layered cuprates","6 pages, LaTeX2e, submitted to Int. J. Mod. Phys. B",,"10.1142/S0217984902004160",,"cond-mat.supr-con cond-mat.mtrl-sci",,"  A detailed Linear Combination of Atomic Orbitals (LCAO) tight-binding model
is developed for the layered High-Temperature Superconductor cuprates. The band
structure of these materials is described using a sigma-band Hamiltonian
employing Cu4s, Cu3d_x^2-y^2, O2p_x and O2p_y atomic orbitals. The Fermi level
and the shape of the resulting Fermi surface are fitted to recent Angle
Resolved Photon Emission Spectroscopy (ARPES) data to realistically determine
the dispersion in the conduction band. Electron-electron interactions and,
ultimately, Cooper pairing is obtained by introducing a Heitler-London,
two-electron exchange between adjacent orbitals within the CuO_2 plane.
Finally, using the LCAO wavefunctions determined by the band structure fit, the
Bardeen-Cooper-Schrieffer type kernel is derived for interatomic exchange.
","[{""version"":""v1"",""created"":""Wed, 29 May 2002 11:47:53 GMT""}]","2009-11-07"
"cond-mat/0205617","Alex Amato","A. Amato, B. Roessli, P. Fischer, N. Bernhoeft, A. Stunault, C.
  Baines, A. D\""onni, H. Sugawara","Magnetic fluctuations and superconductivity in YbPd$_2$Sn","Author list updated, acknowledgements added",,"10.1016/S0921-4526(02)01631-9",,"cond-mat.str-el cond-mat.supr-con",,"  We report muon spin relaxation and inelastic neutron measurements on the
Heusler system YbPd$_2$Sn. Localised anisotropic and quasi-elastic Yb magnetic
fluctuations are observed below $T = 150$K. Both $\mu$SR and neutron data
indicate a slowing-down of the spin-fluctuations, upon lowering the
temperature, similar to that observed in Kondo lattices. The temperature
dependence of the quasi-elastic neutron signal is compatible with a
crystal-electric field scheme having a $\Gamma_7^{\rm CEF}$ ground state. The
muon depolarization rate exhibits an additional contribution upon decreasing
the temperature below $T_{\rm c}$ suggesting a close interplay between magnetic
fluctuations and the superconducting state.
","[{""version"":""v1"",""created"":""Wed, 29 May 2002 11:55:33 GMT""},{""version"":""v2"",""created"":""Mon, 10 Jun 2002 09:38:00 GMT""}]","2009-11-07"
"cond-mat/0205618","Radjai","F. Radjai, S. Roux","Turbulent-like fluctuations in quasistatic flow of granular media",,,"10.1103/PhysRevLett.89.064302",,"cond-mat.soft cond-mat.mtrl-sci",,"  We analyze particle velocity fluctuations in a simulated granular system
subjected to homogeneous quasistatic shearing. We show that these fluctuations
share the following scaling characteristics of fluid turbulence in spite of
their different physical origins: 1) Scale-dependent probability distribution
with non-Guassian broadening at small time scales; 2) Power-law spectrum,
reflecting long-range correlations and the self-affine nature of the
fluctuations; 3) Superdiffusion with respect to the mean background flow.
","[{""version"":""v1"",""created"":""Wed, 29 May 2002 12:07:12 GMT""}]","2009-11-07"
"cond-mat/0205619","Andrea Puglisi","R. Pagnani, U. Marini Bettolo Marconi and A. Puglisi","Driven low density granular mixtures","19 pages, 12 figures, submitted for publication","Phys. Rev. E 66, 051304 (2002)","10.1103/PhysRevE.66.051304",,"cond-mat.stat-mech cond-mat.mtrl-sci cond-mat.soft",,"  We study the steady state properties of a 2D granular mixture in the presence
of energy driving by employing simple analytical estimates and Direct
Simulation Monte Carlo. We adopt two different driving mechanisms: a) a
homogeneous heat bath with friction and b) a vibrating boundary (thermal or
harmonic) in the presence of gravity. The main findings are: the appearance of
two different granular temperatures, one for each species; the existence of
overpopulated tails in the velocity distribution functions and of non trivial
spatial correlations indicating the spontaneous formation of cluster
aggregates. In the case of a fluid subject to gravity and to a vibrating
boundary, both densities and temperatures display non uniform profiles along
the direction normal to the wall, in particular the temperature profiles are
different for the two species while the temperature ratio is almost constant
with the height. Finally, we obtained the velocity distributions at different
heights and verified the non gaussianity of the resulting distributions.
","[{""version"":""v1"",""created"":""Wed, 29 May 2002 13:20:31 GMT""}]","2009-11-07"
"cond-mat/0205620","Enzo Granato","O. Trushin, E. Granato, S.C. Ying, P. Salo and T. Ala-Nissila","Minimum energy paths for dislocation nucleation in strained epitaxial
  layers","4 pages + 3 figs, to appear in Phys. Rev. B, Rap. Comm","Phys. Rev. B 65, 241408 (2002)","10.1103/PhysRevB.65.241408",,"cond-mat.mtrl-sci cond-mat.stat-mech",,"  We study numerically the minimum energy path and energy barriers for
dislocation nucleation in a two-dimensional atomistic model of strained
epitaxial layers on a substrate with lattice misfit. Stress relaxation
processes from coherent to incoherent states for different transition paths are
determined using saddle point search based on a combination of repulsive
potential minimization and the Nudged Elastic Band method. The minimum energy
barrier leading to a final state with a single misfit dislocation nucleation is
determined. A strong tensile-compressive asymmetry is observed. This asymmetry
can be understood in terms of the qualitatively different transition paths for
the tensile and compressive strains.
","[{""version"":""v1"",""created"":""Wed, 29 May 2002 14:43:04 GMT""}]","2009-11-07"
"cond-mat/0205622","Lars Egil Helseth","Lars Egil Helseth","Interaction between superconductive films and magnetic nanostructures","16 pages, 5 figures, submitted to Phys. Rev. B",,"10.1103/PhysRevB.67.139903",,"cond-mat.supr-con cond-mat.mes-hall",,"  The interplay between magnetic and superconductive films is studied. The
generalized London equation for this system is solved, and the magnetic fields,
the energy and the interaction forces are computed. In particular, we focus on
how to manipulate vortices using magnetic nanostructures.
","[{""version"":""v1"",""created"":""Wed, 29 May 2002 15:29:13 GMT""}]","2009-11-07"
"cond-mat/0205623","Aubrey T. Hanbicki","Aubrey T. Hanbicki, P. J. Rous, and E. W. Plummer","The Static and Dynamic Lattice Changes Induced by Hydrogen Adsorption on
  NiAl(110)","36 pages, including 12 figures, 2 tables and 58 references","A.T. Hanbicki, P.J. Rous, and E.W. Plummer, Phys. Rev. B 67,
  205405 (2003)","10.1103/PhysRevB.67.205405",,"cond-mat.mtrl-sci",,"  Static and dynamic changes induced by adsorption of atomic hydrogen on the
NiAl(110) lattice at 130 K have been examined as a function of adsorbate
coverage. Adsorbed hydrogen exists in three distinct phases. At low coverages
the hydrogen is itinerant because of quantum tunneling between sites and
exhibits no observable vibrational modes. Between 0.4 ML and 0.6 ML, substrate
mediated interactions produce an ordered superstructure with c(2x2) symmetry,
and at higher coverages, hydrogen exists as a disordered lattice gas. This
picture of how hydrogen interacts with NiAl(110) is developed from our data and
compared to current theoretical predictions.
","[{""version"":""v1"",""created"":""Wed, 29 May 2002 15:30:04 GMT""}]","2009-11-07"
"cs/0205073","Vincent Conitzer","Vincent Conitzer, Tuomas Sandholm","Vote Elicitation: Complexity and Strategy-Proofness",,"Proceedings of the 18th National Conference on Artificial
  Intelligence (AAAI-02), Edmonton, Canada, 2002",,,"cs.GT cs.CC cs.MA",,"  Preference elicitation is a central problem in AI, and has received
significant attention in single-agent settings. It is also a key problem in
multiagent systems, but has received little attention here so far. In this
setting, the agents may have different preferences that often must be
aggregated using voting. This leads to interesting issues because what, if any,
information should be elicited from an agent depends on what other agents have
revealed about their preferences so far.
  In this paper we study effective elicitation, and its impediments, for the
most common voting protocols. It turns out that in the Single Transferable Vote
protocol, even knowing when to terminate elicitation is mathcal NP-complete,
while this is easy for all the other protocols under study. Even for these
protocols, determining how to elicit effectively is NP-complete, even with
perfect suspicions about how the agents will vote. The exception is the
Plurality protocol where such effective elicitation is easy.
  We also show that elicitation introduces additional opportunities for
strategic manipulation by the voters. We demonstrate how to curtail the space
of elicitation schemes so that no such additional strategic issues arise.
","[{""version"":""v1"",""created"":""Wed, 29 May 2002 00:10:26 GMT""}]","2007-05-23"
"cs/0205074","Vincent Conitzer","Vincent Conitzer, Tuomas Sandholm","Complexity Results about Nash Equilibria",,"In Proceedings of the 18th International Joint Conference on
  Artificial Intelligence (IJCAI-03), Acapulco, Mexico, 2003",,"CMU-CS-02-135","cs.GT cs.CC cs.MA",,"  Noncooperative game theory provides a normative framework for analyzing
strategic interactions. However, for the toolbox to be operational, the
solutions it defines will have to be computed. In this paper, we provide a
single reduction that 1) demonstrates NP-hardness of determining whether Nash
equilibria with certain natural properties exist, and 2) demonstrates the
#P-hardness of counting Nash equilibria (or connected sets of Nash equilibria).
We also show that 3) determining whether a pure-strategy Bayes-Nash equilibrium
exists is NP-hard, and that 4) determining whether a pure-strategy Nash
equilibrium exists in a stochastic (Markov) game is PSPACE-hard even if the
game is invisible (this remains NP-hard if the game is finite). All of our
hardness results hold even if there are only two players and the game is
symmetric.
  Keywords: Nash equilibrium; game theory; computational complexity;
noncooperative game theory; normal form game; stochastic game; Markov game;
Bayes-Nash equilibrium; multiagent systems.
","[{""version"":""v1"",""created"":""Tue, 28 May 2002 23:32:37 GMT""}]","2007-05-23"
"cs/0205075","Vincent Conitzer","Vincent Conitzer, Tuomas Sandholm","Complexity of Mechanism Design",,"Proceedings of the 18th Annual Conference on Uncertainty in
  Artificial Intelligence (UAI-02), Edmonton, Canada, 2002",,,"cs.GT cs.CC cs.MA",,"  The aggregation of conflicting preferences is a central problem in multiagent
systems. The key difficulty is that the agents may report their preferences
insincerely. Mechanism design is the art of designing the rules of the game so
that the agents are motivated to report their preferences truthfully and a
(socially) desirable outcome is chosen. We propose an approach where a
mechanism is automatically created for the preference aggregation setting at
hand. This has several advantages, but the downside is that the mechanism
design optimization problem needs to be solved anew each time. Focusing on
settings where side payments are not possible, we show that the mechanism
design problem is NP-complete for deterministic mechanisms. This holds both for
dominant-strategy implementation and for Bayes-Nash implementation. We then
show that if we allow randomized mechanisms, the mechanism design problem
becomes tractable. In other words, the coordinator can tackle the computational
complexity introduced by its uncertainty about the agents' preferences by
making the agents face additional uncertainty. This comes at no loss, and in
some cases at a gain, in the (social) objective.
","[{""version"":""v1"",""created"":""Tue, 28 May 2002 23:43:12 GMT""}]","2007-05-23"
"gr-qc/0205118","Edward Anderson","Edward Anderson","Strong-coupled Relativity without Relativity","To appear in Gen. Rel. Grav. 2 typos corrected and one reference
  updated","Gen.Rel.Grav. 36 (2004) 255-276","10.1023/B:GERG.0000010474.63835.2c",,"gr-qc",,"  GR can be interpreted as a theory of evolving 3-geometries. A recent such
formulation, the 3-space approach of Barbour, Foster and \'{O} Murchadha, also
permits the construction of a limited number of other theories of evolving
3-geometries, including conformal gravity and strong gravity. In this paper, we
use the 3-space approach to construct a 1-parameter family of theories which
generalize strong gravity. The usual strong gravity is the strong-coupled limit
of GR, which is appropriate near singularities and is one of very few regimes
of GR which is amenable to quantization. Our new strong gravity theories are
similar limits of scalar-tensor theories such as Brans--Dicke theory, and are
likewise appropriate near singularities. They represent an extension of the
regime amenable to quantization, which furthermore spans two qualitatively
different types of inner product.
  We find that strong gravity theories permit coupling only to ultralocal
matter fields and that they prevent gauge theory. Thus in the classical
picture, gauge theory breaks down (rather than undergoing unification) as one
approaches the GR initial singularity.
","[{""version"":""v1"",""created"":""Tue, 28 May 2002 17:25:37 GMT""},{""version"":""v2"",""created"":""Fri, 4 Oct 2002 14:35:50 GMT""},{""version"":""v3"",""created"":""Mon, 7 Apr 2003 16:31:07 GMT""},{""version"":""v4"",""created"":""Mon, 3 Nov 2003 21:30:37 GMT""}]","2009-11-07"
"gr-qc/0205119","Ruediger Vaas","Ruediger Vaas","Is there a Darwinian Evolution of the Cosmos? - Some Comments on Lee
  Smolin's Theory of the Origin of Universes by Means of Natural Selection","20 pages; extended version of a contribution to the MicroCosmos -
  MacroCosmos conference in Aachen, Germany, September 2-5 1998; finished in
  late 1998 and published in the conference proceedings
  (http://www.vijlen.com/vip-projects/confs/mima/Vaas/VAAS.html)",,,,"gr-qc",,"  For Lee Smolin, our universe is only one in a much larger cosmos (the
Multiverse) - a member of a growing community of universes, each one being born
in a bounce following the formation of a black hole. In the course of this, the
values of the free parameters of the physical laws are reprocessed and slightly
changed. This leads to an evolutionary picture of the Multiverse, where
universes with more black holes have more descendants. Smolin concludes, that
due to this kind of Cosmological Natural Selection our own universe is the way
it is. The hospitality for life of our universe is seen as an offshot of this
self-organized process. - This paper outlines Smolin's hypothesis, its
strength, weakness and limits, its relationship to the anthropic principle and
evolutionary biology, and comments on the hypothesis from different points of
view: physics, biology, philosophy of science, philosophy of nature, and
metaphysics. Some of the main points are: (1) There is no necessary connection
between black holes and life. In principle, life and Cosmological Natural
Selection could be independent of each other. Smolin might explain the
so-called fine-tuning of physical constants, but life remains an epiphenomenon.
(2) The Darwinian analogy is an inadequate model transfer. The fitness of
Smolin's universes is not constrained by its environment, but by only one
internal factor: the numbers of black holes. Furthermore, although Smolin's
universes have different reproduction rates, they are not competing against
each other. (3) Smolin's central claim cannot be falsified.
","[{""version"":""v1"",""created"":""Tue, 28 May 2002 21:17:21 GMT""}]","2007-05-23"
"gr-qc/0205120","L. C. Garcia de Andrade","L.C. Garcia de Andrade","Nongeodesic motion of spinless particles in the teleparallel
  gravitational wave background","Latex file",,,,"gr-qc",,"  The motion of spinless particles in Riemann-Cartan (RC) $U_{4}$ and
teleparallel spacetimes is revisited on the light of gravitational waves
hitting on the spinless test particles. It is shown that in the case Cartan
contortion is totally skew-symmetric the spinless particles follow geodesics
but if this symmetry is dropped they are able to follow nongeodesic worldlines
in torsionic background. The case of totally skew contortion and spinning
particles may appear either in $T_{4}$ or $U_{4}$ spacetimes. We consider
$T_{4}$ nongeodesic motion of spinless test particles in the field of
gravitational waves (GW). It is shown that the general contortion obeys a
tensor wave constraint and the analysis of a ring of spinless test particles as
in General Relativity (GR) hit by the GW leads to damping contortion effects on
the nongeodesic motion is undertaken. It is also shown that the contortion and
gravitational waves possess a difference of phase of $\frac{\pi}{2}$ and a
contortion at the surface of the Earth of $10^{-24} s^{-1}$ computed by Nitsch
in the realm of teleparallelism is used to obtain a deviation of the lenght of
the separation of test spinless particles compatible with the GR result. To
obtain this result data from GW LISA detector is used.
","[{""version"":""v1"",""created"":""Wed, 29 May 2002 00:19:59 GMT""}]","2007-05-23"
"hep-ex/0205091","Alex Tapper","ZEUS Collaboration","Measurement of high-Q2 charged current cross sections in e-p deep
  inelastic scattering at HERA","33 pages, 5 figures (eps). Published in Physics Letters B. Corrected
  missing \sqrt symbol and one missing reference","Phys.Lett.B539:197-217,2002; Erratum-ibid.B552:308,2003","10.1016/S0370-2693(02)02093-2","DESY-02-064","hep-ex",,"  Cross sections for e-p charged current deep inelastic scattering have been
measured at a centre-of-mass energy of 318 GeV with an integrated luminosity of
16.4 pb-1 using the ZEUS detector at HERA. Differential cross-sections
d\sigma/dQ2, d\sigma/dx and d\sigma/dy are presented for Q2>200 GeV2. In
addition, d2\sigma/dxdQ2 was measured in the kinematic range 280 GeV2 < Q2 <
30000 GeV2 and 0.015 < x < 0.42. The predictions of the Standard Model agree
well with the measured cross sections. The mass of the W boson, determined from
a fit to d\sigma/dQ2, is MW=80.3 \pm 2.1 (stat.) \pm 1.2 (syst.) \pm 1.0 (PDF)
GeV.
","[{""version"":""v1"",""created"":""Tue, 28 May 2002 16:36:18 GMT""},{""version"":""v2"",""created"":""Thu, 13 Jun 2002 14:15:20 GMT""},{""version"":""v3"",""created"":""Tue, 8 Oct 2002 16:09:05 GMT""}]","2012-08-27"
"hep-ex/0205092","Marco Rescigno","M. Rescigno","The Start of RUN II at CDF","Proceedings of XXXVIIth Rencontres de Moriond on Electroweak
  Interactions and Unified Theories, March 9th 16th, 2002. 6 pages 4 figures",,,,"hep-ex",,"  After a hiatus of almost 6 years and an extensive upgrade, Tevatron, the
world largest proton--antiproton collider, has resumed the operation for the so
called RUN II. In this paper we give a brief overview of the many new features
of the Tevatron complex and of the upgraded CDF experiment, and show the
presently achieved detector performances as well as highlights of the RUN II
physics program in the beauty and electroweak sector.
","[{""version"":""v1"",""created"":""Tue, 28 May 2002 17:47:16 GMT""}]","2016-08-31"
"hep-ex/0205093","Tomas Kafka","J. Chung, et al","Search for Neutron-Antineutron Oscillations Using Multiprong Events in
  Soudan 2","21 pages, 7 figures","Phys.Rev.D66:032004,2002","10.1103/PhysRevD.66.032004","PDK-788, TUHEP-02-01","hep-ex",,"  We have searched for neutron-antineutron oscillations using the 5.56 fiducial
kiloton-year exposure of the Soudan 2 iron tracking calorimeter. We require
candidate n-nbar occurrences to have .GE. 4 prongs (tracks and showers) and to
have kinematics compatible with nbar-N annihilation within a nucleus. We
observe five candidate events, with an estimated background from atmospheric
neutrino and cosmic ray induced events of 4.5 \pm 1.2 events. Previous
experiments with smaller exposures observed no candidates, with estimated
background rates similar to this experiment. We set a lifetime lower limit for
oscillation time in iron: T_A(Fe) > 7.2x10^{31} years. The corresponding lower
limit for oscillation of free neutrons is \tau_{n-nbar} > 1.3x10^8 seconds.
","[{""version"":""v1"",""created"":""Tue, 28 May 2002 21:25:33 GMT""}]","2008-11-26"
"hep-ex/0205094","Stephen D. Robins","S.D. Robins (for the ZEUS Collaboration)","D*+/- Production in e-p and e+p Deep Inelastic Scattering at HERA","5 pages, 3 figures, presented at the DIS02 conference in Krakow,
  Poland and submitted to Acta Physica Polonica","Acta Phys.Polon. B33 (2002) 3183-3188",,,"hep-ex",,"  Inclusive production of D*+/- (2010) mesons in deep inelastic scattering has
been measured using e+p and e-p data obtained with the ZEUS detector at HERA
using integrated luminosities of 16.7 and 65.2 pb-1, respectively. The decay
channel D*+/- -> D0 pi+ with D0 -> K- pi+ and corresponding antiparticle decays
were used to identify D*+/- mesons. The D*+/- cross sections in e-p and e+p
interactions agree with NLO QCD predictions, although the D*+/- cross section
in e-p is slightly higher than that in e+p.
","[{""version"":""v1"",""created"":""Wed, 29 May 2002 12:26:30 GMT""}]","2019-08-14"
"hep-ex/0205095","Aleph Secretariat","F. Cerutti","Search for the Standard Model Higgs boson at LEP","12 pages, 4 figures, La Thuile 2002 proceedings",,,"CERN-ALEPH-PUB-2002-003","hep-ex",,"  The combined results of the search for the Standard Model Higgs boson from
the four LEP experiments are given. These results are based on the full data
sample collected by ALEPH, DELPHI, L3 and OPAL at centre-of-mass energies up to
209GeV, corresponding to a total integrated luminosity of about 2.5fb-1. A
slight excess of events over the background expectation is found at the 2sigma
level, originating mainly from the ALEPH 4-jet channel. This excess is
compatible with what expected for the production of a SM Higgs boson with a
mass of 115.6GeV/c2. A combined 95% confidence level lower limit of 114.1GeV/c2
on the mass of the Standard Model Higgs boson is derived.
","[{""version"":""v1"",""created"":""Wed, 29 May 2002 12:46:24 GMT""}]","2007-05-23"
"hep-ph/0205313","Jacek Syska","J. Syska","Boson ground state fields in electroweak theory with non-zero charge
  densities","56 pages, 11 figures (*.gif); Others 8 figures are available:
  jacek@jas.us.edu.pl with the subject: Boson figures",,,,"hep-ph",,"  The ""non-linear"" self-consistent theory of classical fields in the
electroweak model is proposed. Homogeneous boson ground state solutions in the
GSW model at the presence of a non-zero extended fermionic charge densities are
reviewed and fully reinterpreted to make the theory with non-zero charge
densities fruitful. Consequences of charge density fluctuations are proposed.
","[{""version"":""v1"",""created"":""Tue, 28 May 2002 18:04:28 GMT""}]","2007-05-23"
"hep-ph/0205314","Hsin-Chia Cheng","Hsin-Chia Cheng, Konstantin T. Matchev, Martin Schmaltz","Bosonic Supersymmetry? Getting Fooled at the LHC","6 pages, 4 figures, RevTeX4","Phys.Rev.D66:056006,2002","10.1103/PhysRevD.66.056006","EFI-02-80, UFIFT-HEP-02-7, CERN-TH/2002-108, BUHEP-02-21","hep-ph hep-ex",,"  We define a minimal model with Universal Extra Dimensions, and begin to study
its phenomenology. The collider signals of the first KK level are surprisingly
similar to those of a supersymmetric model with a nearly degenerate
superpartner spectrum. The lightest KK particle (LKP) is neutral and stable
because of KK-parity. KK excitations cascade decay to the LKP yielding missing
energy signatures with relatively soft jets and leptons. Level 2 KK modes may
also be probed via their KK number violating decays to Standard Model
particles. In either case we provide initial estimates for the discovery
potential of the Tevatron and the LHC.
","[{""version"":""v1"",""created"":""Tue, 28 May 2002 19:35:37 GMT""}]","2008-11-26"
"hep-ph/0205315","Anatoly Radyushkin","A. Mukherjee, I.V. Musatov, H. C. Pauli and A. V. Radyushkin","Power-Law Wave Functions and Generalized Parton Distributions for Pion","27 pages, Latex; Revised and Extended Version, to be published in
  Phys. Rev. D","Phys.Rev.D67:073014,2003","10.1103/PhysRevD.67.073014","JLAB-THY-02-22","hep-ph",,"  We propose a model for generalized parton distributions of the pion based on
the power-law ansatz for the effective light-cone wave function.
","[{""version"":""v1"",""created"":""Tue, 28 May 2002 20:50:34 GMT""},{""version"":""v2"",""created"":""Mon, 30 Sep 2002 20:50:15 GMT""},{""version"":""v3"",""created"":""Mon, 3 Feb 2003 18:06:01 GMT""}]","2014-11-17"
"hep-ph/0205316","Zoltan Ligeti","Zoltan Ligeti","D0-D0bar Mixing","9 pages; Talk given at the XXXVIIth Rencontres de Moriond,
  Electroweak Interactions and Unified Theories, Les Arcs, March 9-16 2002; and
  at the 9th International Symposium on Heavy Flavor Physics, Pasadena,
  California, September 10-13 2001","AIP Conf.Proc. 618 (2002) 298-309","10.1063/1.1478849","LBNL-50404","hep-ph",,"  The main challenge in the Standard Model calculation of the mass and width
difference in $D^0 - \bar D^0$ mixing is to estimate the size of SU(3)
breaking. We prove that mixing occurs in the Standard Model only at second
order in SU(3) violation. We calculate SU(3) breaking due to phase space
effects, and find that it can naturally give rise to a width difference
$\Delta\Gamma / 2\Gamma \sim 1%$, potentially reducing the sensitivity of D
mixing to new physics.
","[{""version"":""v1"",""created"":""Wed, 29 May 2002 02:22:06 GMT""}]","2009-11-07"
