"astro-ph/0206007","Vladan Celebonovic","V.Celebonovic (Inst.of Physics, Belgrade, Yugoslavia)","The plasma-solid equilibrium an in Debye plasma","4 pages,PDF,no figures.Sumbitted for the SPIG2002 conference",,,,"astro-ph",,"  Using the Salpeter criterion and known results from solid state physics,the
Debye temperature of a solid in equilibrium with a Debye-Huckel plasma was
calculated.This result could have interesting applications in studies of
various kinds of interstellar clouds.
","[{""version"":""v1"",""created"":""Sat, 1 Jun 2002 21:11:33 GMT""}]","2007-05-23"
"astro-ph/0206008","Kenji Bekki","K. Bekki, Duncan A. Forbes, M. A. Beasley, W. J. Couch","Globular cluster formation from gravitational tidal effects of merging
  and interacting galaxies","19 pages 20 figures (Fig.1,7 14,17 are jpg format), 2002, accepted by
  MNRAS","Mon.Not.Roy.Astron.Soc. 335 (2002) 1176","10.1046/j.1365-8711.2002.05708.x",,"astro-ph",,"  We investigate the spatial, kinematic and chemical properties of globular
cluster systems formed in merging and interacting galaxies using N-body/SPH
simulations. Although we can not resolve individual clusters in our simulation,
we assume that they form in collapsing molecular clouds when the local external
gas pressure exceeds 10$^5$ $k_B$ (where $k_B$ is the Boltzmann constant).
Several simulations are carried out for a range of initial conditions and
galaxy mass ratios. The input model spirals are given a halo globular cluster
system similar to those observed for the Milky Way and M31. Gravitational tidal
effects during galaxy merging and interaction leads to a dramatic increase in
gas pressure, which exceeds our threshold and hence triggers new globular
cluster formation. We investigate the properties of the globular cluster system
in the remnant galaxy, such as number density, specific frequency, kinematic
properties and metallicity distribution. Different orbital conditions and mass
ratios give rise to a range in globular cluster properties, particularly for
the interaction models. Our key results are the following: The newly formed
metal-rich clusters are concentrated at the centre of the merger remnant
elliptical, whereas the metal-poor ones are distributed to the outer parts due
to strong angular momentum transfer. (abridged version)
","[{""version"":""v1"",""created"":""Sun, 2 Jun 2002 07:47:48 GMT""}]","2009-11-07"
"astro-ph/0206009","Vladan Celebonovic","V. Celebonovic (Inst.of Physics, Belgrade, Yugoslavia) and W.Dappen
  (USC, Los Angeles, USA)","The plasma-solid transition:some implications in astrophysics","plain LaTeX,9 pages,no figures",,,,"astro-ph",,"  Using a criterion proposed by Salpeter,and standard solid state physics,we
have determined the Debye temperature of a solid in equilibrium with the
electron gas surrounding it.The results obtained can have implications in
studies of the interstellar medium.
","[{""version"":""v1"",""created"":""Sun, 2 Jun 2002 12:59:19 GMT""}]","2007-05-23"
"astro-ph/0206010","Woodard","N. C. Tsamis (Univ. of Crete) and R. P. Woodard (Univ. of Florida)","Plane waves in a general Robertson-Walker background","11 pages, revtex4, no figures, version 3 is vastly expanded (from 57
  eqns to 166) to give an explicit expression for the transfer matrix, and to
  expand it in the ultraviolet and the infrared. We use the infrared limit to
  give an improved result for the gravitational wave contribution to CMB
  anisotropies","Class.Quant.Grav. 20 (2003) 5205-5223","10.1088/0264-9381/20/23/015","UFIFT-HEP-02-04","astro-ph gr-qc hep-ph",,"  We present an exact solution for the plane wave mode functions of a massless,
minimally coupled scalar propagating in an arbitrary homogeneous, isotropic and
spatially flat geometry. Our solution encompasses all previous solvable special
cases such as de Sitter and power law expansion. Moreover, it can generate the
mode functions for gravitons. We discuss some of the many applications that are
now possible.
","[{""version"":""v1"",""created"":""Sun, 2 Jun 2002 13:33:19 GMT""},{""version"":""v2"",""created"":""Mon, 17 Jun 2002 11:22:02 GMT""},{""version"":""v3"",""created"":""Sat, 28 Jun 2003 13:37:46 GMT""}]","2009-11-07"
"cond-mat/0206013","Anton Starikov","A.A. Starikov, I.I.Yakimenko, K.-F. Berggren, A.C. Graham, K.J.
  Thomas, M. Pepper, M.Y. Simmons","Effects of accidental microconstriction on the quantized conductance in
  long wires","4 pages, 2 figures, paper for NANO2002 symposium, will appear in SPIE
  proceedings","Proc. SPIE, Vol. 5023, 267 (2002)","10.1117/12.513897",,"cond-mat.mes-hall",,"  We have investigated the conductance of long quantum wires formed in
GaAs/AlGaAs heterostructures. Using realistic fluctuation potentials from donor
layers we have simulated numerically the conductance of four different kinds of
wires. While ideal wires show perfect quantization, potential fluctuations from
random donors may give rise to strong conductance oscillations and degradation
of the quantization plateaux. Statistically there is always the possibility of
having large fluctuations in a sample that may effectively act as a
microconstriction. We therefore introduce microconstrictions in the wires by
occasional clustering of donors. These microconstrictions are found to restore
the quantized plateaux. A similar effect is found for accidental lithographic
inaccuracies.
","[{""version"":""v1"",""created"":""Sat, 1 Jun 2002 18:57:56 GMT""}]","2010-10-11"
"cond-mat/0206016","Alexander Korotkov","Alexander N. Korotkov","Analysis of integrated single-electron memory operation","6 pages","J. Appl. Phys. 92, 7291 (2002)","10.1063/1.1521788",,"cond-mat.mes-hall",,"  Various aspects of single-electron memory are discussed. In particular, we
analyze the single-electron charging by Fowler-Nordheim tunneling, propose the
idea of background charge compensation, and discuss the defect-tolerant
architecture based on nanofuses.
","[{""version"":""v1"",""created"":""Sun, 2 Jun 2002 01:58:08 GMT""}]","2009-11-07"
"cond-mat/0206017","Jian-Sheng Wang","Jian-Sheng Wang","Binary tree summation Monte Carlo simulation for Potts models","9 pages, 2 figures, for StatPhys-Taiwan 2002 conference","Physica A vol 321, 351 (2003).","10.1016/S0378-4371(02)01794-6",,"cond-mat.stat-mech",,"  In this talk, we briefly comment on Sweeny and Gliozzi methods, cluster Monte
Carlo method, and recent transition matrix Monte Carlo for Potts models. We
mostly concentrate on a new algorithm known as ""binary tree summation"". Some of
the most interesting features of this method will be highlighted - such as
simulating fractional number of Potts states, as well as offering the partition
function and thermodynamic quantities as functions of temperature in a single
run.
","[{""version"":""v1"",""created"":""Sun, 2 Jun 2002 06:20:59 GMT""}]","2009-11-07"
"cond-mat/0206018","Eugene Kogan","Eugene Kogan, Mark Auslender, and Eran Dgani","Ground state of a double-exchange system containing impurities: bounds
  of ferromagnetism","5 pages, 8 eps figures, latex; minor typos corrected",,"10.1103/PhysRevB.67.132410",,"cond-mat.str-el cond-mat.stat-mech",,"  We study the boundary between ferromagnetic and non-ferromagnetic ground
state of a double-exchange system with quenched disorder for arbitrary relation
between Hund exchange coupling and electron band width. The boundary is found
both from the solution of the Dynamical Mean Field Approximation equations and
from the comparison of the energies of the saturated ferromagnetic and
paramagnetic states. Both methods give very similar results. To explain the
disappearance of ferromagnetism in part of the parameter space we derive from
the double-exchange Hamiltonian with classical localized spins in the limit of
large but finite Hund exchange coupling the $t-J$ model (with classical
localized spins).
","[{""version"":""v1"",""created"":""Sun, 2 Jun 2002 07:27:19 GMT""},{""version"":""v2"",""created"":""Tue, 4 Jun 2002 17:46:31 GMT""}]","2013-05-29"
"cond-mat/0206019","Holger Fehske","Franz X.Bronold and Holger Fehske","Statistical dynamical mean-field description of strongly correlated
  disordered electron-phonon systems","5 pages, 3 figures, contribution to the Strongly Correlated Electron
  Systems Conference, Krakow 2002","Phys. Rev. B 66, 073102 (2002)","10.1103/PhysRevB.66.073102",,"cond-mat.str-el cond-mat.dis-nn",,"  Combining the self-consistent theory of localization and the dynamical
mean-field theory, we present a theoretical approach capable of describing both
self-trapping of charge carriers during the process of polaron formation and
disorder-induced Anderson localization. By constructing random samples for the
local density of states (LDOS) we analyze the distribution function for this
quantity and demonstrate that the typical rather than the mean LDOS is a
natural measure to distinguish between itinerant and localized states.
Significant polaron effects on the mobility edge are found.
","[{""version"":""v1"",""created"":""Sun, 2 Jun 2002 09:43:22 GMT""}]","2009-11-07"
"cond-mat/0206020","M. Patra","M. Patra","Decay Rate Distributions of Disordered Slabs and Application to Random
  Lasers","11 pages, 11 figures","Phys. Rev. E 67, 016603 (2003)","10.1103/PhysRevE.67.016603",,"cond-mat.mes-hall cond-mat.dis-nn",,"  We compute the distribution of the decay rates (also referred to as residues)
of the eigenstates of a disordered slab from a numerical model. From the
results of the numerical simulations, we are able to find simple analytical
formulae that describe those results well. This is possible for samples both in
the diffusive and in the localised regime. As example of a possible
application, we investigate the lasing threshold of random lasers.
","[{""version"":""v1"",""created"":""Sun, 2 Jun 2002 15:54:14 GMT""}]","2009-11-07"
"cs/0206002","Jeff Erickson","Jeff Erickson, Damrong Guoy, John M. Sullivan, and Alper \""Ung\""or","Building Space-Time Meshes over Arbitrary Spatial Domains","12 pages, 14 figures; see also
  http://www.cs.uiuc.edu/~jeffe/pubs/slowpitch.html",,,,"cs.CG",,"  We present an algorithm to construct meshes suitable for space-time
discontinuous Galerkin finite-element methods. Our method generalizes and
improves the `Tent Pitcher' algorithm of \""Ung\""or and Sheffer. Given an
arbitrary simplicially meshed domain M of any dimension and a time interval
[0,T], our algorithm builds a simplicial mesh of the space-time domain Mx[0,T],
in constant time per element. Our algorithm avoids the limitations of previous
methods by carefully adapting the durations of space-time elements to the local
quality and feature size of the underlying space mesh.
","[{""version"":""v1"",""created"":""Sat, 1 Jun 2002 23:20:51 GMT""}]","2007-05-23"
"gr-qc/0206002","S. Karino","Masaru Shibata, Shigeyuki Karino, Yoshiharu Eriguchi (Univ. of Tokyo)","Dynamical instability of differentially rotating stars","5 pages, 7 figures, accepted for publication in MNRAS","Mon.Not.Roy.Astron.Soc.334:L27,2002","10.1046/j.1365-8711.2002.05724.x",,"gr-qc astro-ph",,"  We study the dynamical instability against bar-mode deformation of
differentially rotating stars. We performed numerical simulation and linear
perturbation analysis adopting polytropic equations of state with the
polytropic index $n=1$. It is found that rotating stars of a high degree of
differential rotation are dynamically unstable even for the ratio of the
kinetic energy to the gravitational potential energy of $O(0.01)$.
Gravitational waves from the final nonaxisymmetric quasistationary states are
calculated in the quadrupole formula. For rotating stars of mass $1.4M_{\odot}$
and radius several 10 km, gravitational waves have frequency several 100 Hz and
effective amplitude $\sim 5 \times 10^{-22}$ at a distance of $\sim 100$ Mpc.
","[{""version"":""v1"",""created"":""Sun, 2 Jun 2002 08:48:10 GMT""},{""version"":""v2"",""created"":""Thu, 6 Jun 2002 12:12:30 GMT""}]","2010-11-19"
"hep-ex/0206003","V. Uzhinskii","V.V.Uzhinskii, V.Sh.Navotny, G.A.Ososkov, A.Polanski, M.M.Chernyavski","Wavelet analysis of angular distributions of secondary particles in high
  energy nucleus-nucleus interactions. Irregularity of particle pseudorapidity
  distributions","11 pages, 7 figures",,,,"hep-ex",,"  Experimental data on sulphur and oxygen nuclei interactions with
photoemulsion nuclei at the energies of 200 and 60 GeV/nucleon are analyzed
with the help of a continuous wavelet transform. Irregularities in
pseudorapidity distributions of narrow groups of the secondary shower particles
in the mentioned interactions are observed at application of the second order
derivative of Gaussian as a wavelet. The irregularities can be interpreted as
an existence of the preference emission angles of groups of particles. Such an
effect is expected at emission of Cherenkov gluons in nucleus-nucleus
collisions. Some of the positions of the observed peculiarities on the
pseudorapidity axis coincide with those found by I.M.Dremin et al. (I.M.Dremin
et al. Phys. Lett., 2001, v. B499, p. 97).)
","[{""version"":""v1"",""created"":""Sat, 1 Jun 2002 19:28:19 GMT""}]","2007-05-23"
"hep-ph/0206004","Fu-Sin Ling","Fu-Sin Ling and Pierre Ramond","Family Hierarchy and Large Neutrino Mixings",,"Phys.Lett. B543 (2002) 29-37","10.1016/S0370-2693(02)02388-2",,"hep-ph",,"  The recent neutrino data seem to favor two large and one small mixing angles
and a hierarchy of their squared mass differences. We discuss these within the
context of hierarchical neutrino masses. We show that this scheme suggests a
specific neutrino mass matrix with mild fine-tuning. We then present a
Froggatt-Nielsen model that reproduces this matrix.
","[{""version"":""v1"",""created"":""Sat, 1 Jun 2002 20:47:23 GMT""},{""version"":""v2"",""created"":""Fri, 14 Jun 2002 21:27:21 GMT""},{""version"":""v3"",""created"":""Mon, 31 Mar 2003 02:19:43 GMT""}]","2009-11-07"
"hep-ph/0206006","Jonathan L. Rosner","Cheng-Wei Chiang, Zumin Luo, and Jonathan L. Rosner","$B \to D_s \pi$ and the tree amplitude in $B \to \pi^+ \pi^-$","7 pages, LaTeX, 1 figure, to be submitted to Phys. Rev. D (Brief
  Reports)","Phys.Rev. D66 (2002) 057503","10.1103/PhysRevD.66.057503","ANL-HEP-PR-02-037","hep-ph",,"  The recently-observed decay $B^0 \to D_s^+ \pi^-$ is expected to proceed
mainly by means of a tree amplitude in the factorization limit: $B^0 \to \pi^-
{(W^+)}^*$, ${(W^+)}^* \to D_s^+$. Under this assumption, we predict the
corresponding contribution of the tree amplitude to $B^0 \to \pi^+ \pi^-$. We
indicate the needed improvements in data that will allow a useful estimate of
this amplitude with errors comparable to those accompanying other methods.
Since the factorization hypothesis for this process goes beyond that proved in
most approaches, we also discuss independent tests of this hypothesis.
","[{""version"":""v1"",""created"":""Sun, 2 Jun 2002 14:23:29 GMT""}]","2009-11-07"
"hep-th/0206006","Joseph C. Varilly","Jose M. Gracia-Bondia","Noncommutative geometry and fundamental interactions: the first ten
  years","Latex, 20 pages, minor changes, a few references added","Annalen Phys.11:479-495,2002","10.1002/1521-3889(200208)11:7<479::AID-ANDP479>3.0.CO;2-0",,"hep-th",,"  This is the full text of a survey talk for nonspecialists, delivered at the
66th Annual Meeting of the German Physical Society in Leipzig, March 2002. We
have not taken pains to suppress the colloquial style. References are given
only insofar as they help to underline the points made; this is not a
full-blooded survey. The connection between noncommutative field theory and
string theory is mentioned, but deemphasized. Contributions to noncommutative
geometry made in Germany are emphasized.
","[{""version"":""v1"",""created"":""Sun, 2 Jun 2002 05:54:44 GMT""},{""version"":""v2"",""created"":""Thu, 9 Jan 2003 04:26:16 GMT""}]","2017-09-27"
"hep-th/0206007","Joseph C. Varilly","Joseph C. Varilly","The interface of noncommutative geometry and physics","Latex, 15 pages, talk given at the 6th Conference on Clifford
  Algebras and Applications, Cookeville, TN, May 2002",,,,"hep-th",,"  The progress of noncommutative geometry has been crucially influenced, from
the beginning, by quantum physics: we review this development in recent years.
The Standard Model, with its central role for the Dirac operator, led to
several formulations culminating in the concept of a real spectral triple.
String theory then came into contact with NCG, leading to an emphasis on
Moyal-like algebras and formulations of quantum field theory on noncommutative
spaces. Hopf algebras have yielded an unexpected link between the
noncommutative geometry of foliations and perturbative quantum field theory.
The quest for a suitable foundation of quantum gravity continues to promote
fruitful ideas, among them the spectral action principle and the search for a
better understanding of ""noncommutative spaces"".
","[{""version"":""v1"",""created"":""Sun, 2 Jun 2002 06:04:57 GMT""}]","2007-05-23"
"hep-th/0206008","Bozhidar Zakhariev Iliev","Bozhidar Z. Iliev (Institute for Nuclear Research and Nuclear Energy,
  Bulgarian Academy of Sciences, Sofia, Bulgaria)","On momentum operator in quantum field theory","13 LaTeX pages. The packages AMS-LaTeX and amsfonts are required. For
  related papers, visit the ""publication"" pages at
  http://theo.inrne.bas.bg/~bozho/","In: Frontiers in quantum physics research, Editors F. Columbus and
  V. Krasnoholovets, Nova Science Pub., Inc., New York, 2004, pp.143-156",,,"hep-th math-ph math.MP quant-ph",,"  The interrelations between the two definitions of momentum operator, via the
canonical energy-momentum tensorial operator and as translation operator (on
the operator space), are studied in quantum field theory. These definitions
give rise to similar but, generally, different momentum operators, each of them
having its own place in the theory. Some speculations on the relations between
quantum field theory and quantum mechanics are presented.
","[{""version"":""v1"",""created"":""Sun, 2 Jun 2002 08:30:56 GMT""}]","2007-05-23"
"hep-th/0206009","Neda Sadooghi","Neda Sadooghi and Masoud Soroush","Noncommutative Dipole QED","1+30 pages, LaTeX, axodraw.sty, 7 figures","Int.J.Mod.Phys. A18 (2003) 97-126","10.1142/S0217751X03012242","IPM/P-2002/013","hep-th",,"  The noncommutative dipole QED is studied in detail for the matter fields in
the adjoint representation. The axial anomaly of this theory is calculated in
two and four dimensions using various regularization methods. The
Ward-Takahashi identity is proved by making use of a non-perturbative path
integral method. The one-loop $\beta$-function of the theory is calculated
explicitly. It turns out that the value of the $\beta$-function depends on the
direction of the dipole length $\vec{L}$, which defines the noncommutativity.
Finally using a semi-classical approximation a non-perturbative definition of
the form factors is presented and the anomalous magnetic moment of this theory
at one-loop order is computed.
","[{""version"":""v1"",""created"":""Sun, 2 Jun 2002 14:19:42 GMT""}]","2009-11-07"
"hep-th/0206011","Yi Liao","Yi Liao and Klaus Sibold (ITP, Leipzig)","Time-ordered Perturbation Theory on Noncommutative Spacetime II:
  Unitarity","19 pages, 3 figures using axodraw; version 2: typos fixed and very
  minor rewording, to appear in Eur Phys J C","Eur.Phys.J.C25:479-486,2002","10.1007/s10052-002-1018-7","LU-ITP 2002/010","hep-th hep-ph",,"  We examine the unitarity issue in the recently proposed time-ordered
perturbation theory on noncommutative (NC) spacetime. We show that unitarity is
preserved as long as the interaction Lagrangian is explicitly Hermitian. We
explain why it makes sense to distinguish the Hermiticity of the Lagrangian
from that of the action in perturbative NC field theory and how this
requirement fits in the framework.
","[{""version"":""v1"",""created"":""Sun, 2 Jun 2002 15:55:08 GMT""},{""version"":""v2"",""created"":""Wed, 3 Jul 2002 15:32:45 GMT""}]","2008-11-26"
"math-ph/0206001","Anirban Pathak","Anirban Pathak","Generalised quantum anharmonic oscillator using an operator ordering
  approach","9 pages, latex 2e, no figure Journal Reference: J. Phys. A 33 (2000)
  5607-5613",,,,"math-ph math.MP math.QA",,"  We construct a generalised expression for the normal ordering of
(a+a^{\dagger})^{m} for integral values of m and use the result to study the
quantum anharmonic oscillator problem in the Heisenberg approach. In
particular, we derive generalised expressions for energy eigen values and
frequency shifts for the Hamiltonian
H=\frac{x^{2}}{2}+\frac{\dot{x}^{2}}{2}+\frac{\lambda}{m}x^{m}. We also derive
a closed form first order multi scale perturbation theoretic operator solution
of this Hamiltonian with a view to generalise some recent results of Bender and
Bettencourt .
","[{""version"":""v1"",""created"":""Sun, 2 Jun 2002 08:27:22 GMT""}]","2007-05-23"
"math/0206004","Vyacheslav V. Shokurov","V.V. Shokurov","Letters of a Bi-Rationalist IV: Geometry of log flips","LaTex, 20p. To appear in the Proceedings of the Conference in memory
  of Paolo Francia, Genova, September 2001",,,,"math.AG",,"  For a birational log Fano contraction, it is conjectured an inequality
between the dimension of its exceptional locus and the minimal log discrepancy
over the locus. The conjecture follows from the existence of the flip for the
contraction and another conjecture about the maximum of minimal log discripancy
in given dimension; in particular, it holds in small dimensions (up to 4), and
some special cases. It is illustrated by some examples.
","[{""version"":""v1"",""created"":""Sun, 2 Jun 2002 13:53:37 GMT""}]","2016-09-07"
"physics/0206002","Karl Bane","Karl L.F. Bane","A Simplified Model of Intrabeam Scattering","4 pages, 2 figures, presented at epac'02",,,"slac-pub-9226","physics.acc-ph",,"  Beginning with the general Bjorken-Mtingwa solution, we derive a simplified
model of intrabeam scattering (IBS), one valid for high energy beams in normal
storage rings; our result is similar, though more accurate than a model due to
Raubenheimer. In addition, we show that a modified version of Piwinski's IBS
formulation (where eta squared over beta has been replaced by the dispersion
invariant) at high energies asymptotically approaches the same result.
","[{""version"":""v1"",""created"":""Sat, 1 Jun 2002 16:33:35 GMT""}]","2007-05-23"
"physics/0206003","Karl Bane","K.L.F. Bane (1), H. Hayano (2), K. Kubo (2), T. Naito (2), T. Okugi
  (2), J. Urakawa (2) ((1) SLAC, (2) KEK)","Intrabeam scattering analysis of measurements at KEK's ATF damping ring","17 pages, 6 figures, .bbl file","Phys.Rev.ST Accel.Beams 5 (2002) 084403","10.1103/PhysRevSTAB.5.084403","SLAC-PUB-9227, KEK-Preprint 2002-26","physics.acc-ph",,"  We derive a simple relation for estimating the relative emittance growth in x
and y due to intrabeam scattering (IBS) in electron storage rings. We show that
IBS calculations for the ATF damping ring, when using the formalism of
Bjorken-Mtingwa, a modified formalism of Piwinski (where eta squared divided by
beta has been replaced by the dispersion invariant), or a simple high-energy
approximate formula all give results that agree well. Comparing theory,
including the effect of potential well bunch lengthening, with a complete set
of ATF steady-state beam size vs. current measurements we find reasonably good
agreement for energy spread and horizontal emittance. The measured vertical
emittance, however, is larger than theory in both offset (zero current
emittance) and slope (emittance change with current). The slope error indicates
measurement error and/or additional current-dependent physics at the ATF; the
offset error, that the assumed Coulomb log is correct to within a factor of
1.75.
","[{""version"":""v1"",""created"":""Sat, 1 Jun 2002 18:30:11 GMT""}]","2009-11-07"
"quant-ph/0206004","Anirban Pathak","Anirban Pathak","Aharanov Anandan Phase for the Quasi Exactly Solvable Bose Systems","6 pages LATEX, No figure","Proc. of Nat. Conf. on Laser and Its Application (2001) 159",,,"quant-ph",,"  An extended notion of quasi-exactly solvable potential model is used here to
treat quasi exactly solvable (QES) Bose systems. We report an analytic
expression for the Ahoronov Anandan non-adiabatic geometric phase for the QES
Bose system in general. The generalized expression is then used to study some
particular cases of physical interest and we observe that the geometric phase
can be tuned.
","[{""version"":""v1"",""created"":""Sun, 2 Jun 2002 07:53:28 GMT""}]","2007-05-23"
"quant-ph/0206005","Manu Mathur","Manu Mathur and H. S. Mani","SU(N) Coherent States","25 pages, LaTex, no figures","J.Math.Phys. 43 (2002) 5351","10.1063/1.1513651",,"quant-ph hep-th math-ph math.MP",,"  We generalize Schwinger boson representation of SU(2) algebra to SU(N) and
define coherent states of SU(N) using $2(2^{N-1}-1)$ bosonic harmonic
oscillator creation and annihilation operators. We give an explicit
construction of all (N-1) Casimirs of SU(N) in terms of these creation and
annihilation operators. The SU(N) coherent states belonging to any irreducible
representations of SU(N) are labelled by the eigenvalues of the Casimir
operators and are characterized by (N-1) complex orthonormal vectors describing
the SU(N) manifold. The coherent states provide a resolution of identity,
satisfy the continuity property, and possess a variety of group theoretic
properties.
","[{""version"":""v1"",""created"":""Sun, 2 Jun 2002 13:49:17 GMT""}]","2015-06-26"
