"quant-ph/0206006","Subhash Kak","Subhash Kak","Uncertainty In Quantum Computation","6 pages",,,,"quant-ph",,"  We examine the effect of previous history on starting a computation on a
quantum computer. Specifically, we assume that the quantum register has some
unknown state on it, and it is required that this state be cleared and replaced
by a specific superposition state without any phase uncertainty, as needed by
quantum algorithms. We show that, in general, this task is computationally
impossible.
","[{""version"":""v1"",""created"":""Sun, 2 Jun 2002 15:55:38 GMT""}]","2007-05-23"
