"physics/0206050","Michael Zeitlin","Antonina N. Fedorova, Michael G. Zeitlin","Fast Calculation Methods in Collective Dynamical Models of Beam/Plasma
  Physics","4 pages, 2 figures, JAC2001.cls, presented at European Particle
  Accelerator Conference (EPAC02), Paris, June 3-7, 2002; changed from A4 to US
  format for correct printing",,,,"physics.acc-ph physics.comp-ph physics.plasm-ph",,"  We consider an application of modification of our variational-wavelet
approach to some nonlinear collective model of beam/plasma physics:
Vlasov/Boltzmann-like reduction from general BBGKY hierachy related to modeling
of propagation of intense charged particle beams in high-intensity accelerators
and transport systems. We use fast convergent multiscale variational-wavelet
representations for solutions which allow to consider polynomial and rational
type of nonlinearities. The solutions are represented via the multiscale
decomposition in nonlinear high-localized eigenmodes (waveletons). In contrast
with different approaches we do not use perturbation technique or linearization
procedures.
","[{""version"":""v1"",""created"":""Sun, 16 Jun 2002 09:12:34 GMT""},{""version"":""v2"",""created"":""Sat, 22 Jun 2002 13:10:50 GMT""}]","2007-05-23"
"physics/0206051","Michael Zeitlin","Antonina N. Fedorova, Michael G. Zeitlin","Multiscale Decomposition for Vlasov-Poisson Equations","4 pages, 3 figures, JAC2001.cls, presented at European Particle
  Accelerator Conference (EPAC02), Paris, June 3-7, 2002; changed from A4 to US
  format for correct printing",,,,"physics.acc-ph physics.comp-ph physics.plasm-ph",,"  We consider the applications of a numerical-analytical approach based on
multiscale variational wavelet technique to the systems with collective type
behaviour described by some forms of Vlasov-Poisson/Maxwell equations. We
calculate the exact fast convergent representations for solutions in
high-localized wavelet-like bases functions, which correspond to underlying
hidden (coherent) nonlinear eigenmodes. This helps to control
stability/unstability scenario of evolution in parameter space on pure
algebraical level.
","[{""version"":""v1"",""created"":""Sun, 16 Jun 2002 09:35:21 GMT""},{""version"":""v2"",""created"":""Sat, 22 Jun 2002 13:23:33 GMT""}]","2007-05-23"
"physics/0206052","Michael Zeitlin","Antonina N. Fedorova, Michael G. Zeitlin","RMS/Rate Dynamics via Localized Modes","4 pages, 2 figures, JAC2001.cls, presented at European Particle
  Accelerator Conference (EPAC02), Paris, June 3-7, 2002; changed from A4 to US
  format for correct printing",,,,"physics.acc-ph physics.comp-ph physics.plasm-ph",,"  We consider some reduction from nonlinear Vlasov-Maxwell equation to rms/rate
equations for second moments related quantities. Our analysis is based on
variational wavelet approach to rational (in dynamical variables)
approximation. It allows to control contribution from each scale of underlying
multiscales and represent solutions via multiscale exact nonlinear eigenmodes
(waveletons) expansions. Our approach provides the possibility to work with
well-localized bases in phase space and best convergence properties of the
corresponding expansions without perturbations or/and linearization procedures.
","[{""version"":""v1"",""created"":""Sun, 16 Jun 2002 09:52:59 GMT""},{""version"":""v2"",""created"":""Sat, 22 Jun 2002 13:37:34 GMT""}]","2007-05-23"
"physics/0206053","Michael Zeitlin","Antonina N. Fedorova, Michael G. Zeitlin","Nonlinear Localized Coherent Spectrum of Beam-Beam Interactions","4 pages, 2 figures, JAC2001.cls, presented at European Particle
  Accelerator Conference (EPAC02), Paris, June 3-7, 2002; changed from A4 to US
  format for correct printing",,,,"physics.acc-ph physics.comp-ph physics.plasm-ph",,"  We consider modeling for strong-strong beam-beam interactions beyond
preceding linearized/perturbative methods such as soft gaussian approximation
or FMM (HFMM) etc. In our approach discrete coherent modes, discovered before,
and possible incoherent oscillations appear as a result of
multiresolution/multiscale fast convergent decomposition in the bases of
high-localized exact nonlinear modes represented by wavelets or wavelet packets
functions. The constructed solutions represent the full multiscale spectrum in
all internal hidden scales from slow to fast oscillating eigenmodes. Underlying
variational method provides algebraical control of the spectrum.
","[{""version"":""v1"",""created"":""Sun, 16 Jun 2002 10:11:54 GMT""},{""version"":""v2"",""created"":""Sat, 22 Jun 2002 13:45:46 GMT""}]","2007-05-23"
"physics/0206054","Michael Zeitlin","Antonina N. Fedorova, Michael G. Zeitlin","Nonlinear Motion in Electromagnetic Fields via Multiscale Expansions","3 pages, presented at GAMM Meeting, February, 2001, ETH, Zurich;
  changed margins for printing","PAMM, Volume 1, Issue 1, pp. 432-433, Wiley-VCH, 2002",,,"physics.acc-ph physics.comp-ph physics.plasm-ph",,"  The consideration of dynamics of relativistic beams/particles is based on
variational approach to rational (in dynamical variables) approximation for
equations of motions. It allows to control contribution from each scale of
underlying multiscales and represent solutions via exact nonlinear eigenmodes
expansions. Our approach is based on methods provided possibility to work with
well-localized bases in phase space and good convergence properties of the
corresponding expansions.
","[{""version"":""v1"",""created"":""Sun, 16 Jun 2002 10:34:15 GMT""},{""version"":""v2"",""created"":""Sat, 22 Jun 2002 14:18:11 GMT""}]","2007-05-23"
"quant-ph/0206101","P. K. Aravind","J.F.Schneiderman, M.E.Stanley and P.K.Aravind","A pseudo-simulation of Shor's quantum factoring algorithm","20 pages, 4 tables, 2 figures",,,,"quant-ph",,"  This paper presents a computer program, written in Maple, that allows a user
to simulate certain aspects of Shor's quantum factoring algorithm on a desktop
or laptop computer. The program does not simulate the unitary operations
carried out by a quantum computer but does faithfully mimic its output at the
crucial ""readout"" step of the order-finding process. The program reqires only
two inputs from the user - the number to be factored (which can be up to 10
digits long) and the number of qubits to be used in the factoring (for which a
helpful hint is given). The program then returns a detailed history of all its
attempts at factoring the number, beginning with its various unsuccessful
attempts and ending with the final successful attempt that leads to the correct
factors. The structure of the simulation is described, a typical output
produced by it is shown, and the factors limiting its performance are
discussed. The purpose of this simulation is to provide the user with some
""hands-on"" experience of how quantum factoring works on integers somewhat
larger than can be handled by today's quantum computers.
","[{""version"":""v1"",""created"":""Sun, 16 Jun 2002 15:09:42 GMT""}]","2007-05-23"
