"quant-ph/0207002","Kazuyuki Fujii","Kazuyuki Fujii (Yokohama City Univ.)","Exchange Gate on the Qudit Space and Fock Space","Latex File, 12 pages. I could solve the problems in Sec. 3 in the
  preceding manuscript, so many corrections including the title were made","J. Opt. B: Quantum Semiclass. Opt. 5(2003) S613-S618","10.1088/1464-4266/5/6/011",,"quant-ph cond-mat math-ph math.MP",,"  We construct the exchange gate with small elementary gates on the space of
qudits, which consist of three controlled shift gates and three ""reverse""
gates. This is a natural extension of the qubit case.
  We also consider a similar subject on the Fock space, but in this case we
meet with some different situation. However we can construct the exchange gate
by making use of generalized coherent operator based on the Lie algebra su(2)
which is a well--known method in Quantum Optics. We moreover make a brief
comment on ""imperfect clone"".
","[{""version"":""v1"",""created"":""Sat, 29 Jun 2002 01:17:56 GMT""},{""version"":""v2"",""created"":""Thu, 11 Jul 2002 00:20:06 GMT""},{""version"":""v3"",""created"":""Thu, 8 Aug 2002 06:02:25 GMT""}]","2009-11-07"
