"hep-ph/0207004","Kirill Melnikov","Charalampos Anastasiou and Kirill Melnikov","Higgs boson production at hadron colliders in NNLO QCD","27 pages, revtex","Nucl.Phys. B646 (2002) 220-256","10.1016/S0550-3213(02)00837-4","SLAC-PUB-9273","hep-ph",,"  We compute the total cross-section for direct Higgs boson production in
hadron collisions at NNLO in perturbative QCD. A new technique which allows us
to perform an algorithmic evaluation of inclusive phase-space integrals is
introduced, based on the Cutkosky rules, integration by parts and the
differential equation method for computing master integrals. Finally, we
discuss the numerical impact of the O(alpha_s^2) QCD corrections to the Higgs
boson production cross-section at the LHC and the Tevatron.
","[{""version"":""v1"",""created"":""Sat, 29 Jun 2002 02:51:20 GMT""},{""version"":""v2"",""created"":""Fri, 6 Sep 2002 00:40:20 GMT""},{""version"":""v3"",""created"":""Fri, 11 Oct 2002 19:28:37 GMT""}]","2009-11-07"
"hep-ph/0207005","Yukinari Sumino","S. Recksiegel and Y. Sumino","Improved Perturbative QCD Approach to the Bottomonium Spectrum","26 pages, 16 figures. Minor changes, to be published in PRD","Phys.Rev. D67 (2003) 014004","10.1103/PhysRevD.67.014004","TU-659, KEK-TH-827","hep-ph",,"  Recently it has been shown that the gross structure of the bottomonium
spectrum is reproduced reasonably well within the non-relativistic boundstate
theory based on perturbative QCD. In that calculation, however, the fine
splittings and the S-P level splittings are predicted to be considerably
narrower than the corresponding experimental values. We investigate the
bottomonium spectrum within a specific framework based on perturbative QCD,
which incorporates all the corrections up to O(alpha_S^5 m_b) and O(alpha_S^4
m_b), respectively, in the computations of the fine splittings and the S-P
splittings. We find that the agreement with the experimental data for the fine
splittings improves drastically due to an enhancement of the wave functions
close to the origin as compared to the Coulomb wave functions. The agreement of
the S-P splittings with the experimental data also becomes better. We find that
natural scales of the fine splittings and the S-P splittings are larger than
those of the boundstates themselves. On the other hand, the predictions of the
level spacings between consecutive principal quantum numbers depend rather
strongly on the scale mu of the operator \propto C_A/(m_b r^2). The agreement
of the whole spectrum with the experimental data is much better than the
previous predictions when mu \simeq 3-4 GeV for alpha_S(M_Z)=0.1181. There
seems to be a phenomenological preference for some suppression mechanism for
the above operator.
","[{""version"":""v1"",""created"":""Sat, 29 Jun 2002 07:36:22 GMT""},{""version"":""v2"",""created"":""Fri, 22 Nov 2002 10:45:21 GMT""}]","2009-11-07"
"hep-th/0206251","Silvio Paolo Sorella","V.E.R. Lemes, M.S. Sarandy, S.P. Sorella","Ghost Condensates and Dynamical Breaking of SL(2,R) in Yang-Mills in the
  Maximal Abelian Gauge","16 pages, LaTeX2e, final version to appear in J. Phys. A","J.Phys.A36:7211-7220,2003","10.1088/0305-4470/36/25/320",,"hep-th",,"  Ghost condensates of dimension two in SU(N) Yang-Mills theory quantized in
the Maximal Abelian Gauge are discussed. These condensates turn out to be
related to the dynamical breaking of the SL(2,R) symmetry present in this gauge
","[{""version"":""v1"",""created"":""Fri, 28 Jun 2002 18:54:48 GMT""},{""version"":""v2"",""created"":""Wed, 4 Sep 2002 17:32:09 GMT""},{""version"":""v3"",""created"":""Mon, 11 Nov 2002 16:51:48 GMT""},{""version"":""v4"",""created"":""Fri, 9 May 2003 13:03:37 GMT""}]","2008-11-26"
"hep-th/0206254","Marek Olechowski","A. Jakobek, K.A. Meissner and M. Olechowski","New brane solutions in higher order gravity","22 pages, Latex, 3 figures; discussion of effective gravitational
  constant and of one type of solutions extended; references added","Nucl.Phys. B645 (2002) 217-236","10.1016/S0550-3213(02)00831-3",,"hep-th",,"  We consider the higher order gravity with dilaton and with the leading string
theory corrections taken into account. The domain wall type solutions are
investigated for arbitrary number of space-time dimensions. The explicit
formulae for the fixed points and asymptotic behavior of generic solutions are
given. We analyze and classify solutions with finite effective gravitational
constant. There is a class of such solutions which have no singularities. We
discuss in detail the relation between fine tuning and self tuning and clarify
in which sense our solutions are fine-tuning free. The stability of such
solutions is also discussed.
","[{""version"":""v1"",""created"":""Fri, 28 Jun 2002 19:18:09 GMT""},{""version"":""v2"",""created"":""Fri, 6 Sep 2002 12:42:43 GMT""}]","2009-11-07"
"hep-th/0206255","Robbert Dijkgraaf","Robbert Dijkgraaf and Cumrun Vafa","Matrix Models, Topological Strings, and Supersymmetric Gauge Theories","22 pages, minor corrections","Nucl.Phys. B644 (2002) 3-20","10.1016/S0550-3213(02)00766-6",,"hep-th",,"  We show that B-model topological strings on local Calabi-Yau threefolds are
large N duals of matrix models, which in the planar limit naturally give rise
to special geometry. These matrix models directly compute F-terms in an
associated N=1 supersymmetric gauge theory, obtained by deforming N=2 theories
by a superpotential term that can be directly identified with the potential of
the matrix model. Moreover by tuning some of the parameters of the geometry in
a double scaling limit we recover (p,q) conformal minimal models coupled to 2d
gravity, thereby relating non-critical string theories to type II superstrings
on Calabi-Yau backgrounds.
","[{""version"":""v1"",""created"":""Fri, 28 Jun 2002 17:14:19 GMT""},{""version"":""v2"",""created"":""Sun, 11 Aug 2002 14:02:21 GMT""}]","2010-04-05"
"hep-th/0207003","James T. Liu","M.J. Duff, James T. Liu and H. Sati","Complementarity of the Maldacena and Karch-Randall Pictures","20 pages, Revtex 3, Discussion on the absence of a scalar ghost
  clarified; Additional details on the computation given","Phys.Rev. D69 (2004) 085012","10.1103/PhysRevD.69.085012","MCTP-02-39","hep-th",,"  We perform a one-loop test of the holographic interpretation of the
Karch-Randall model, whereby a massive graviton appears on an AdS_4 brane in an
AdS_5 bulk. Within the AdS/CFT framework, we examine the quantum corrections to
the graviton propagator on the brane, and demonstrate that they induce a
graviton mass in exact agreement with the Karch-Randall result. Interestingly
enough, at one loop order, the spin 0, spin 1/2 and spin 1 loops contribute to
the dynamically generated (mass)^2 in the same 1: 3: 12 ratio as enters the
Weyl anomaly and the 1/r^3 corrections to the Newtonian gravitational
potential.
","[{""version"":""v1"",""created"":""Fri, 28 Jun 2002 22:13:53 GMT""},{""version"":""v2"",""created"":""Fri, 26 Jul 2002 18:11:01 GMT""},{""version"":""v3"",""created"":""Wed, 2 Jun 2004 13:56:16 GMT""}]","2009-11-07"
"hep-th/0207004","Kazutoshi Ohta","Kazutoshi Ohta, Takashi Yokono","Gravitational Approach to Tachyon Matter","14 pages, LaTeX, reference added and typos corrected","Phys.Rev. D66 (2002) 125009","10.1103/PhysRevD.66.125009","KUNS-1793, MIT-CTP-3288","hep-th",,"  We found a gravity solution of p+1 dimensional extended object with
SO(p)xSO(9-p) symmetry which has zero pressure and zero dilaton charge. We
expect that this object is a residual tachyon dust after tachyon condensation
of brane and anti-brane system discussed by Sen, recently. We also discuss the
Hawking temperature and some properties of this object.
","[{""version"":""v1"",""created"":""Sat, 29 Jun 2002 00:20:37 GMT""},{""version"":""v2"",""created"":""Fri, 12 Jul 2002 22:44:32 GMT""}]","2009-11-07"
"hep-th/0207005","Yun-Song Piao","Yun-Song Piao, Xinmin Zhang and Yuan-Zhong Zhang","Gravity In A Model Of Multi Branes Alternated Between Minkowski And AdS
  Spacetime In The Fifth Dimension","8 pages, 6 figues","Phys.Lett. B541 (2002) 390-395","10.1016/S0370-2693(02)02235-9",,"hep-th",,"  We construct in this paper a multi-brne model with Minkowski and AdS
spacetime alternated in the fifth dimension and study the gravity on the brane
of our universe. We will show that in this model there are both the
graviton-like resonant states which generates the ""quasi-localized gravity"" and
the resonant states of the massive KK mode. This model gives rise to gravity
which deviates from the Newton gravitational potential at small and large scale
which, however can be shown to be consistent with the observations in the
absence of fine-tuning of the model parameters.
","[{""version"":""v1"",""created"":""Sat, 29 Jun 2002 07:49:58 GMT""}]","2009-11-07"
"math/0206311","Fernando Torres","Massimo Giulietti, G\'abor Korchm\'aros and Fernando Torres","Quotient curves of the Deligne-Lusztig curve of Suzuki type","Latex 2e, 36 pages",,,,"math.AG",,"  Inspired by a recent paper of Garcia, Stichtenoth and Xing [2000, Compositio
Math. 120, 137--170], we investigate the quotient curves of the Deligne-Lusztig
curve associated to the Suzuki group.
","[{""version"":""v1"",""created"":""Fri, 28 Jun 2002 18:47:07 GMT""}]","2007-05-23"
"math/0207001","George Joseph McNinch","George J. McNinch","Adjoint Jordan Blocks","19 pages. AMSLaTeX",,,,"math.RT",,"  Let G be a quasisimple algebraic group over an algebraically closed field of
characteristic p>0. We suppose that p is very good for G; since p is good,
there is a bijection between the nilpotent orbits in the Lie algebra and the
unipotent classes in G. If the nilpotent X in Lie(G) and the unipotent u in G
correspond under this bijection, and if u has order p, we show that the
partitions of ad(X) and Ad(u) are the same. When G is classical or of type G_2,
we prove this result with no assumption on the order of u.
  In the cases where u has order p, the result is achieved through an
application of results of Seitz concerning good A_1 subgroups of G. For
classical groups, the techniques are more elementary, and they lead also to a
new proof of the following result of Fossum: the structure constants of the
representation ring of a 1-dimensional formal group law F are independent of F.
","[{""version"":""v1"",""created"":""Fri, 28 Jun 2002 21:29:16 GMT""}]","2007-05-23"
"math/0207002","Gianni Dal Maso","Gianni Dal Maso and Rodica Toader","A model for the quasi-static growth of brittle fractures based on local
  minimization","20 pages",,,"SISSA 51/2002/M","math.AP",,"  We study a variant of the variational model for the quasi-static growth of
brittle fractures proposed by Francfort and Marigo. The main feature of our
model is that, in the discrete-time formulation, in each step we do not
consider absolute minimizers of the energy, but, in a sense, we look for local
minimizers which are sufficiently close to the approximate solution obtained in
the previous step. This is done by introducing in the variational problem an
additional term which penalizes the $L^2$-distance between the approximate
solutions at two consecutive times. We study the continuous-time version of
this model, obtained by passing to the limit as the time step tends to zero,
and show that it satisfies (for almost every time) some minimality conditions
which are slightly different from those considered in Francfort and Marigo and
in our previous paper, but are still enough to prove (under suitable regularity
assumptions on the crack path) that the classical Griffith's criterion holds at
the crack tips. We prove also that, if no initial crack is present and if the
data of the problem are sufficiently smooth, no crack will develop in this
model, provided the penalization term is large enough.
","[{""version"":""v1"",""created"":""Sat, 29 Jun 2002 09:00:37 GMT""}]","2007-05-23"
"nlin/0207001","Artyom Yurov","Artyom Yurov","Discrete symmetry's chains and links between integrable equations","20 pages","Journal of Mathematical Physics, Vol.44, N3, pp. 1183-1201 (2003)","10.1063/1.1523641",,"nlin.SI",,"  The discrete symmetry's dressing chains of the nonlinear Schrodinger equation
(NLS) and Davey-Stewartson equations (DS) are consider. The modified NLS (mNLS)
equation and the modified DS (mDS) equations are obtained. The explicitly
reversible Backlund auto-transformations for the mNLS and mDS equations are
constructed. We demonstrate discrete symmetry's conjugate chains of the KP and
DS models. The two-dimensional generalization of the P4 equation are obtained.
","[{""version"":""v1"",""created"":""Sat, 29 Jun 2002 15:10:49 GMT""}]","2015-06-26"
"nucl-th/0206073","J. Raufeisen","D.E. Kharzeev, J. Raufeisen","High energy nuclear interactions and QCD: an introduction","43 pp., 19 figures, based on lectures given by D. Kharzeev at the
  School on ""New States of Matter in Hadronic Interactions"" of the Pan American
  Advanced Study Institute (PASI 2002) in Campos do Jordao, Sao Paulo, Brazil,
  on January 7-18, 2002",,"10.1063/1.1513676","BNL-NT-02/15, LA-UR-02-3956","nucl-th hep-ph",,"  The goal of these lectures, oriented towards the students just entering the
field, is to provide an elementary introduction to QCD and the physics of
nuclear interactions at high energies. We first introduce the general structure
of QCD and discuss its main properties. Then we proceed to Glauber multiple
scattering theory which lays the foundation for the theoretical treatment of
nuclear interactions at high energies. We introduce the concept of Gribov's
inelastic shadowing, crucial for the understanding of quantum formation
effects. We outline the problems facing Glauber approach at high energies, and
discuss how asymptotic freedom of QCD helps to resolve them, introducing the
concepts of parton saturation and color glass condensate.
","[{""version"":""v1"",""created"":""Fri, 28 Jun 2002 18:51:55 GMT""}]","2009-11-07"
"nucl-th/0207001","Claudio Ciofi degli Atti","C. Ciofi degli Atti, B. Z. Kopeliovich","Final state interaction in semi-inclusive DIS off nuclei","27 pages, 10 eps-figures","Eur.Phys.J. A17 (2003) 133-144","10.1140/epja/i2002-10140-7",,"nucl-th hep-ph",,"  The final state interaction in DIS of leptons off a nucleus A, due to the
propagation of the struck nucleon debris and its hadronization in the nuclear
environment is considered. The effective cross section of such a partonic
system with the nucleons of the medium and its time dependence are estimated on
the basis of a model which takes into account the production of hadrons due to
the breaking of the color string and to gluon radiation. It is shown that the
details of the propagation of the partonic system in the nuclear environment
can be thoroughly investigated by the semi-inclusive process A(e,e'(A-1))X, in
which the scattered lepton is detected in coincidence with the nucleus (A-1) in
low energy and momentum states. The rescattering of the struck nucleon debris
with the medium damps and distorts the momentum distributions of (A-1) in a way
which is very sensitive to the details of effective cross section of the
debris.
  The total cross section of the process on ^4He, ^16O, and ^40Ca, related to
the probability that after a target nucleon experiences a DIS process, the
recoiling (A-1) nucleus remains intact, is evaluated, and the distorted
momentum distribution of the recoiling (A-1) system is obtained. It is shown
that both quantities are very sensitive to the details of the early stage of
hadronization of the nucleon debris in the nuclear medium.
","[{""version"":""v1"",""created"":""Sat, 29 Jun 2002 15:07:42 GMT""}]","2016-09-08"
"nucl-th/0207002","Takuya Mizoguchi","M. Biyajima, M. Ide, T. Mizoguchi and N. Suzuki","Scaling Behavior of $(N_{ch})^{-1}dN_{ch}/d\eta$ at $\sqrt{s_{NN}} =
  130$ GeV by the PHOBOS Collaboration and Its Implication --A Possible
  Explanation Employing the Ornstein-Uhlenbeck Process--","15 pages, 9 figures, PTPTeX","Prog.Theor.Phys. 108 (2002) 559-569; Addendum-ibid. 109 (2003)
  151-152","10.1143/PTP.108.559",,"nucl-th",,"  Recently, interesting data concerning $dN_{ch}/d\eta$ in Au-Au collisions
[$\eta=-\ln \tan (\theta/2)$] with centrality cuts have been reported from the
PHOBOS Collaboration. In most treatment these data are divided by the number of
participants (nucleons) in collisions. Instead of this method, we use the total
multiplicity $N_{ch} = \int (dN_{ch}/d\eta)d\eta$ and find that there is
scaling phenomenon among $(N_{ch})^{-1}dN_{ch}/d\eta = dn/d\eta$ with different
centrality cuts at $\sqrt{s_{NN}} = 130$ GeV. To explain this scaling behavior
of $dn/d\eta$, we employ a stochastic approach using the Ornstein-Uhlenbeck
process with two sources. A Langevin equation is adopted for this explanation.
Moreover, comparisons of $dn/d\eta$ at $\sqrt{s_{NN}} = 130$ GeV with that at
$\sqrt{s_{NN}} = 200$ GeV are made, and no significant difference is found. A
possible method fot the detection of the quark-gluon plasma (QGP) through
$dN_{ch}/d\eta$ is presented.
","[{""version"":""v1"",""created"":""Sat, 29 Jun 2002 15:41:37 GMT""},{""version"":""v2"",""created"":""Mon, 22 Jul 2002 08:22:58 GMT""},{""version"":""v3"",""created"":""Fri, 20 Dec 2002 18:43:14 GMT""}]","2009-11-07"
"physics/0207001","Randall D. Peters","Randall D. Peters","The Pendulum in the 21st Century--Relic or Trendsetter","11 pages, 8 figures",,,,"physics.class-ph",,"  When identifying instruments that have had great influence on the history of
physics, none comes to mind more quickly than the pendulum. Though 'birthed' by
Galileo in the 16th century, and in some respects nearly 'dead' by the middle
of the 20th century; the pendulum experienced 'rebirth' by becoming an
archetype of chaos. With the resulting acclaim for its surprising behavior at
large amplitudes, one might expect that there would already be widespread
interest in another of its significant nonlinearities. Such is not the case,
however, and the complex motions of small amplitude physical pendula are barely
known. The present paper shows that a simply-constructed metallic rod pendulum
is capable of demonstrating rich physics in a largely unstudied area.
","[{""version"":""v1"",""created"":""Fri, 28 Jun 2002 20:34:23 GMT""}]","2007-05-23"
"physics/0207002","Doerte Blume","D. Blume, B. D. Esry, C. H. Greene, N. N. Klausen, and G. J. Hanna","Formation of atomic tritium clusters and condensates","5 pages, 3 figures",,"10.1103/PhysRevLett.89.163402",,"physics.atom-ph",,"  We present an extensive study of the static and dynamic properties of systems
of spin-polarized tritium atoms. In particular, we calculate the two-body
|F,m_F>=|0,0> s-wave scattering length and show that it can be manipulated via
a Feshbach resonance at a field strength of about 870G. Such a resonance might
be exploited to make and control a Bose-Einstein condensate of tritium in the
|0,0> state. It is further shown that the quartet tritium trimer is the only
bound hydrogen isotope and that its single vibrational bound state is a
Borromean state. The ground state properties of larger spin-polarized tritium
clusters are also presented and compared with those of helium clusters.
","[{""version"":""v1"",""created"":""Fri, 28 Jun 2002 22:48:46 GMT""}]","2009-11-07"
"physics/0207003","Harald G. L. Schwefel","H. E. Tureci, H. G. L. Schwefel, E. E. Narimanov and A. Douglas Stone","A Gaussian-optical Approach to Stable Periodic Orbit Resonances of
  Partially Chaotic Dielectric Micro-cavities","20 pages, 8 figures, 2 tables, revtex4, submitted to Optics Express","Opt. Express 10, 752-776 (2002)","10.1364/OE.10.000752",,"physics.optics nlin.CD",,"  The quasi-bound modes localized on stable periodic ray orbits of dielectric
micro-cavities are constructed in the short-wavelength limit using the
parabolic equation method. These modes are shown to coexist with irregularly
spaced ""chaotic"" modes for the generic case. The wavevector quantization rule
for the quasi-bound modes is derived and given a simple physical interpretation
in terms of Fresnel reflection; quasi-bound modes are explictly constructed and
compared to numerical results. The effect of discrete symmetries of the
resonator is analyzed and shown to give rise to quasi-degenerate multiplets;
the average splitting of these multiplets is calculated by methods from quantum
chaos theory.
","[{""version"":""v1"",""created"":""Sat, 29 Jun 2002 00:08:23 GMT""}]","2015-06-26"
"quant-ph/0206193","Robert R. Tucci","Robert R. Tucci","All Moments of the Uniform Ensemble of Quantum Density Matrices","17 pages (files: 1 .tex, 3 .sty)",,,,"quant-ph",,"  Given a uniform ensemble of quantum density matrices $\rho$, it is useful to
calculate the mean value over this ensemble of a product of entries of $\rho$.
We show how to calculate such moments in this paper. The answer involves well
known results from Group Representation Theory and Random Matrix Theory. This
quantum problem has a well known classical counterpart: given a uniform
ensemble of probability distributions $P=(P_1, P_2, ..., P_N)$ where the $P_j$
are non-negative reals that sum to one, calculate the mean value over this
probability simplex of products of $P$ components. The answer to the classical
problem follows from an integral formula due to Dirichlet.
","[{""version"":""v1"",""created"":""Fri, 28 Jun 2002 16:54:41 GMT""}]","2007-05-23"
"quant-ph/0206199","Gavin Brennen","Gavin K. Brennen","Distant entanglement with nearest neighbor interactions",,,,,"quant-ph",,"  Preparing many body entangled states efficiently using available interactions
is a challenging task. One solution may be to couple a system collectively with
a probe that leaves residual entanglement in the system. We investigate the
entanglement produced between two possibly distant qubits 1 and 2 that interact
locally with a third qubit 3 under unitary evolution generated by pairwise
Hamiltonians. For the case where the Hamiltonians commute, relevant to certain
quantum nondemolition measurements, the entanglement between qubits 1 and 2 is
calculated explicitly for several classes of initial states and compared with
the case of noncommuting interaction Hamiltonians. This analysis can be helpful
to identify preferable physical system interactions for entangled state
synthesis.
","[{""version"":""v1"",""created"":""Fri, 28 Jun 2002 16:46:19 GMT""}]","2007-05-23"
"quant-ph/0206200","Matthias Jakob","Matthias Jakob and Janos Bergou","Quantitative conditional quantum erasure in two-atom resonance
  fluorescence","Revtex4, 12pages, 4 eps figures, replaced with published version,
  changes in Sec. 3, to appear in Physical Review A","Phys. Rev. A 66, 062107 (2002)","10.1103/PhysRevA.66.062107",,"quant-ph",,"  We present a conditional quantum eraser which erases the a priori knowledge
or the predictability of the path a photon takes in a Young-type double-slit
experiment with two fluorescent four-level atoms. This erasure violates a
recently derived erasure relation which must be satisfied for a conventional,
unconditional quantum eraser that aims to find an optimal sorting of the system
into subensembles with particularly large fringe visibilities. The conditional
quantum eraser employs an interaction-free, partial which-way measurement which
not only sorts the system into optimal subsystems with large visibility but
also selects the appropriate subsystem with the maximum possible visibility. We
explain how the erasure relation can be violated under these circumstances.
","[{""version"":""v1"",""created"":""Fri, 28 Jun 2002 19:28:18 GMT""},{""version"":""v2"",""created"":""Wed, 20 Nov 2002 20:54:57 GMT""}]","2009-11-07"
"quant-ph/0207001","Igor L. Markov","Vivek V. Shende, Aditya K. Prasad, Igor L. Markov, and John P. Hayes","Reversible Logic Circuit Synthesis","30 pages, 14 figs+tables. To appear in IEEE Transactions on
  Computer-Aided Design of Electronic Circuits. Contains results presented at
  the Intl. Conf. on Computer-Aided Design, 2002 and new material on
  decompositions of reversible circuits where gates of the same type are next
  to each other","V. V. Shende, A. K. Prasad, I. L. Markov and J. P. Hayes,
  ``Synthesis of Reversible Logic Circuits'', IEEE Trans. on CAD, vol 22(6),
  June 2003, pp. 710-722.",,,"quant-ph",,"  Reversible or information-lossless circuits have applications in digital
signal processing, communication, computer graphics and cryptography. They are
also a fundamental requirement in the emerging field of quantum computation. We
investigate the synthesis of reversible circuits that employ a minimum number
of gates and contain no redundant input-output line-pairs (temporary storage
channels). We prove constructively that every even permutation can be
implemented without temporary storage using NOT, CNOT and TOFFOLI gates. We
describe an algorithm for the synthesis of optimal circuits and study the
reversible functions on three wires, reporting distributions of circuit sizes.
We study circuit decompositions of reversible circuits where gates of the same
type are next to each other. Finally, in an application important to quantum
computing, we synthesize oracle circuits for Grover's search algorithm, and
show a significant improvement over a previously proposed synthesis algorithm.
","[{""version"":""v1"",""created"":""Fri, 28 Jun 2002 23:38:19 GMT""},{""version"":""v2"",""created"":""Tue, 2 Jul 2002 05:09:58 GMT""},{""version"":""v3"",""created"":""Tue, 24 Sep 2002 22:41:52 GMT""},{""version"":""v4"",""created"":""Thu, 27 Feb 2003 22:12:37 GMT""}]","2007-05-23"
