"cond-mat/0207004","Joshua M. Pomeroy","J.M. Pomeroy, J. Jacobsen, C.C. Hill, B.H. Cooper, and J.P. Sethna","KMC-MD Investigations of Hyperthermal Copper Deposition on Cu(111)","9 pages, 2 tables, 7 figures",,,,"cond-mat.mtrl-sci",,"  Detailed KMC-MD (kinetic Monte Carlo-molecular dynamics) simulations of
hyperthermal energy (10-100 eV) copper homoepitaxy have revealed a re-entrant
layer-by-layer growth mode at low temperatures (50K) and reasonable fluxes (1
ML/s). This growth mode is the result of atoms with hyperthermal kinetic
energies becoming inserted into islands when the impact site is near a step
edge. The yield for atomic insertion as calculated with molecular dynamics near
(111) step edges reaches a maxima near 18 eV. KMC-MD simulations of growing
films and a minima in the RMS roughness as a function of energy near 25 eV. We
find that the RMS roughness saturates just beyond 0.5 ML of coverage in films
grown with energies greater than 25 eV due to the onset of adatom-vacancy
formation near 20 eV. Adatom-vacancy pairs increase the island nuclei density
and the step edge density which increases the number of sites available to
insert atoms. Smoothest growth in this regime is achieved by maximizing island
and step edge densities, which consequently reverses the traditional roles of
temperature and flux: low temperatures and high fluxes produce the smoothest
surfaces in these films. Dramatic increases in island densities are found to
persist at room temperature,where island densities increase an order of
magnitude from 20 to 150 eV.
","[{""version"":""v1"",""created"":""Fri, 28 Jun 2002 21:46:33 GMT""}]","2007-05-23"
"cond-mat/0207005","Matthew Hastings","M. B. Hastings, I. Martin, and D. Mozyrsky","Quantum Dynamics in Non-equilibrium Strongly Correlated Environments","4 pages, 1 figure","Phys. Rev. B 68, 035101 (2003).","10.1103/PhysRevB.68.035101",,"cond-mat.str-el",,"  We consider a quantum point contact between two Luttinger liquids coupled to
a mechanical system (oscillator). For non-vanishing bias, we find an effective
oscillator temperature that depends on the Luttinger parameter. A generalized
fluctuation-dissipation relation connects the decoherence and dissipation of
the oscillator to the current-voltage characteristics of the device. Via a
spectral representation, this result is generalized to arbitrary leads in a
weak tunneling regime.
","[{""version"":""v1"",""created"":""Sat, 29 Jun 2002 01:29:52 GMT""}]","2009-11-07"
"cond-mat/0207006","Jian-Yang Zhu","Jian-Yang Zhu and Z. R. Yang","Glauber Critical Dynamics: Exact Solution of the Kinetic Gaussian Model","9 pages","Phys. Rev. E 59,1551 (1999)","10.1103/PhysRevE.59.1551",,"cond-mat.dis-nn",,"  In this paper, we have exactly solved Glauber critical dynamics of the
Gaussian model on three dimensions. Of course, it is much easy to apply to low
dimensional case. The key steps are that we generalize the spin change
mechanism from Glauber's single-spin flipping to single-spin transition and
give a normalized version of the transition probability . We have also
investigated the dynamical critical exponent and found surprisingly that the
dynamical critical exponent is highly universal which refer to that for one-
two- and three-dimensions they have same value independent of spatial
dimensionality in contrast to static (equilibrium) critical exponents.
","[{""version"":""v1"",""created"":""Sat, 29 Jun 2002 03:10:21 GMT""}]","2009-11-07"
"cond-mat/0207007","Jian-Yang Zhu","Jian-Yang Zhu and Z. R. Yang","Solvable Kinetic Gaussian Model in External Field","11 pages","Phys. Rev. E 61, 210 (2000)","10.1103/PhysRevE.61.210",,"cond-mat.dis-nn",,"  In this paper, the single-spin transition dynamics is used to investigate the
kinetic Gaussian model in a periodic external field. We first derive the
fundamental dynamic equations, and then treat an isotropic d-dimensional
hypercubic lattice Gaussian spin system with Fourier's transformation method.
We obtain exactly the local magnetization and the equal-time pair correlation
function. The critical characteristics of the dynamical, the complex
susceptibility, and the dynamical response are discussed. The results show that
the time evolution of the dynamical quantities and the dynamical responses of
the system strongly depend on the frequency and the wave vector of the external
field.
","[{""version"":""v1"",""created"":""Sat, 29 Jun 2002 03:20:51 GMT""}]","2009-11-07"
"cond-mat/0207008","Jian-Yang Zhu","Jian-Yang Zhu and Z. R. Yang","Dynamical Decimation Renormalization-Group Technique: Kinetic Gaussian
  Model on Non-Branching, Braching and Multi-branching Koch Curve","21 pages","Phys. Rev. E 61, 6219 (2000)","10.1103/PhysRevE.61.6219",,"cond-mat.dis-nn",,"  A generalizing formulation of dynamical real-space renormalization that suits
for arbitrary spin systems is suggested. The new version replaces the
single-spin flipping Glauber dynamics with the single-spin transition dynamics.
As an application, in this paper we mainly investigate the critical slowing
down of the Gaussian spin model on three fractal lattices, including
nonbranching, branching and multibranching Koch Curve. The dynamical critical
exponent $z$ is calculated for these lattices using an exact decimation
renormalization transformation in the assumption of the magnetic-like
perturbation, and a universal result $z=1/\nu $ is found.
","[{""version"":""v1"",""created"":""Sat, 29 Jun 2002 03:28:34 GMT""}]","2009-11-07"
"cond-mat/0207009",,"Nizam A. Taylanov (Institute of Applied Physics, National University
  of Uzbekistan)","On the stability of the critical state in composite superconductors with
  an inhomogeneous temperature profile","10 pages, LaTex file",,,,"cond-mat.supr-con",,"  The problem of the thermal and magnetic destruction of the critical state in
composite superconductors is investigated. The initial distributions of
temperature and electromagnetic field are assumed to be essentially
inhomogeneous. The limit of the thermomagnetic instability in quasi-stationary
approximation is determined. The obtained integral criterion, unlike the
analogous criterion for a homogeneous temperature profile, is shown to take
into account the influence of any part of the superconductor on the threshold
for critical-state instability.
","[{""version"":""v1"",""created"":""Sat, 29 Jun 2002 08:04:48 GMT""}]","2007-05-23"
"cond-mat/0207010","I. S. Beloborodov","I.S. Beloborodov, A.V. Andreev, and A.I. Larkin","Two-loop approximation in the Coulomb blockade problem","10 pages, 3 figures","Phys. Rev. B 68, 024204 (2003)","10.1103/PhysRevB.68.024204",,"cond-mat.mes-hall",,"  We study Coulomb blockade (CB) oscillations in the thermodynamics of a
metallic grain which is connected to a lead by a tunneling contact with a large
conductance $g_0$ in a wide temperature range, $E_Cg_0^4 e^{-g_0/2}<T<E_C$,
where $E_C$ is the charging energy. Using the instanton analysis and the
renormalization group we obtain the temperature dependence of the amplitude of
CB oscillations which differs from the previously obtained results. Assuming
that at $T < E_Cg_0^4 e^{-g_0/2}$ the oscillation amplitude weakly depends on
temperature we estimate the magnitude of CB oscillations in the ground state
energy as $E_Cg_0^4 e^{-g_0/2}$.
","[{""version"":""v1"",""created"":""Sat, 29 Jun 2002 13:19:10 GMT""},{""version"":""v2"",""created"":""Fri, 15 Nov 2002 19:39:35 GMT""}]","2009-11-07"
"gr-qc/0207001","J. Ponce de Leon","J. Ponce de Leon","Variation of G, $\Lambda_{(4)}$ and Vacuum Energy From Brane-World
  Models","In version 2 an error noticed by the author is fixed, and the
  corresponding changes are made. Version 3 is identical to v2, except for a
  couple of typos corrected. V3 will appear in Mod. Phys. Lett. A","Mod.Phys.Lett. A17 (2002) 2425-2441","10.1142/S0217732302009143",,"gr-qc",,"  In brane-world theory in five dimensions, the bulk metric is usually written
in gaussian coordinates, where $g_{4\mu} = 0$ and $g_{44} = - 1$. However, the
choice $g_{44} = - 1$ is an external condition, not a requirement of the field
equations. In this paper we study the consequences of having $g_{44} = \epsilon
\Phi^2$, where $\epsilon = \pm 1$ and $\Phi$ is a scalar function varying with
time, $\dot{\Phi} \neq 0$. This varying field entails the possibility of
variable fundamental physical ""constants"". These variations are different from
those predicted in scalar-tensor and multidimensional theories. We solve the
five-dimensional equations for a {\em fixed} brane and use the brane-world
paradigm to determine the fundamental parameters in the theory, which are the
vacuum energy $\sigma$, the gravitational coupling $G$ and the cosmological
term $\Lambda_{(4)}$. We present specific models where these physical
quantities are variable functions of time. Different scenarios are possible but
we discuss with some detail a model for which $\dot{G}/G \sim H$ and
$\Lambda_{(4)} \sim H^2$, which seems to be favored by observations. Our
results are not in contradiction to previous ones in the literature. In
particular, to those where the brane is described as a domain wall moving in a
static $Sch-AdS$ bulk. Indeed these latter models in RS scenarios describe the
same spacetime as other solutions (with fixed brane) in gaussian coordinates
with $\dot{\Phi} = 0 $. We conclude that the introduction of a time-varying
$\Phi$ in brane-world theory yields a number of models that show variation in
the fundamental physical ""constants"" and exhibit reasonable physical
properties.
","[{""version"":""v1"",""created"":""Sat, 29 Jun 2002 07:25:51 GMT""},{""version"":""v2"",""created"":""Sun, 17 Nov 2002 22:57:05 GMT""},{""version"":""v3"",""created"":""Wed, 27 Nov 2002 22:20:27 GMT""}]","2015-06-25"
"gr-qc/0207002","Choquet-Bruhat","Yvonne Choquet-Bruhat and James W. York","Bianchi - Euler system for relativistice fluids and Bel - Robinson type
  energy","10 pages",,,,"gr-qc",,"  We write a first order symmetric hyperbolic system coupling the Riemann with
the dynamical acceleration of a relativistic fluid. W determine the associated,
coupled, Bel - Robinson energy, and the integral equality that it satisfies.
","[{""version"":""v1"",""created"":""Sat, 29 Jun 2002 13:46:32 GMT""}]","2007-05-23"
"hep-ex/0206074","Giovanni Abbiendi","G. Abbiendi, R.G. Kellogg, D. Strom","Performance of the OPAL Si-W luminometer at LEP I-II","9 pages, 7 figures, 10th International Conference on Calorimetry in
  High Energy Physics. http://3w.hep.caltech.edu/calor02/",,"10.1142/9789812704894_0032",,"hep-ex",,"  A pair of compact Silicon-Tungsten calorimeters was operated in the OPAL
experiment at LEP to measure the integrated luminosity from detection of Bhabha
electrons scattered at angles between 25 and 58 mrad from the beam line. In the
eight years from 1993 to 2000 the detector worked first at the Z mass peak and
then at center of mass energies up to 209 GeV. The fine radial and longitudinal
segmentation (2.5mm x 1X0) allowed the radial position of electron and photon
showers to be measured with a resolution of 130-170 microns and a residual
radial bias as small as 7 microns. Reducing the bias in the definition of the
inner acceptance radius was the key element in obtaining an experimental
systematic error on the integrated luminosity of only 3.4 10^-4. The
performance of the detector at both LEP-I and LEP-II is reviewed. Energy
resolution, sensitivity to overlapping electromagnetic showers and sensitivity
to minimum ionizing particles are discussed.
","[{""version"":""v1"",""created"":""Fri, 28 Jun 2002 17:24:41 GMT""}]","2017-08-23"
"hep-ex/0206075","Ignacio Bediaga","Ignacio Bediaga","Light Scalar Mesons in Charm Decays","5 pages, 7 figures, to appear in proceeding of Flavor Physics & CP
  Violation (FCPC), May 16-18,2002, University of Pennsylvania",,,,"hep-ex",,"  We present recent results on scalar light mesons based on Dalitz plot
analyses of charm decays from Fermilab experiment E791. Low mass scalar mesons
are found to have large contributions to the decays studied, D^+\to
K^-\pi^+\pi^+ and D^+, D_s^+\to\pi^-\pi^+\pi^+. These results demonstrate the
importance of charm decays as a new environment for the study of light meson
physics.
","[{""version"":""v1"",""created"":""Fri, 28 Jun 2002 19:40:38 GMT""}]","2007-05-23"
"hep-ex/0207001","Giorgio Gratta","J.Detwiler, G.Gratta, N.Tolich, Y.Uchida","Nuclear Propelled Vessels and Neutrino Oscillation Experiments","4 pages, 2 figures","Phys.Rev.Lett. 89 (2002) 191802","10.1103/PhysRevLett.89.191802",,"hep-ex",,"  We study the effect of naval nuclear reactors on the study of neutrino
oscillations. We find that the presence of naval reactors at unknown locations
and times may limit the accuracy of future very long baseline reactor-based
neutrino oscillation experiments. At the same time we argue that a nuclear
powered surface ship such as a large Russian ice-breaker may provide an ideal
source for precision experiments. While the relatively low reactor power would
in this case require a larger detector, the source could be conveniently
located at essentially any distance from a detector built at an underground
location near a shore in a region of the world far away from other nuclear
installations. The variable baseline would allow for a precise measurement of
backgrounds and greatly reduced systematics from reactor flux and detector
efficiency. In addition, once the oscillation measurement is completed, the
detector could perform geological neutrino and astrophysical measurements with
minimal reactor background.
","[{""version"":""v1"",""created"":""Sat, 29 Jun 2002 06:16:02 GMT""}]","2009-11-07"
"hep-ph/0206292","Ernest Ma","K. S. Babu (Oklahoma State U), Ernest Ma (UC Riverside), J. W. F.
  Valle (IFIC Valencia)","Underlying A_4 Symmetry for the Neutrino Mass Matrix and the Quark
  Mixing Matrix","12 pages including 2 figures","Phys.Lett.B552:207-213,2003","10.1016/S0370-2693(02)03153-2","UCRHEP-T341, OSU-HEP-02-07, IFIC/02-26 (June 2002)","hep-ph",,"  The discrete non-Abelian symmetry $A_4$, valid at some high-energy scale,
naturally leads to degenerate neutrino masses, without spoiling the hierarchy
of charged-lepton masses. Realistic neutrino mass splittings and mixing angles
(one of which is necessarily maximal and the other large) are then induced
radiatively in the context of softly broken supersymmetry. The quark mixing
matrix is also calculable in a similar way. The mixing parameter $U_{e3}$ is
predicted to be imaginary, leading to maximal CP violation in neutrino
oscillations. Neutrinoless double beta decay and $\tau \to \mu \gamma$ should
be in the experimentally accessible range.
","[{""version"":""v1"",""created"":""Fri, 28 Jun 2002 16:23:37 GMT""}]","2009-09-17"
"hep-ph/0206293","Michelangelo Mangano","M.L. Mangano, M. Moretti, F. Piccinini, R. Pittau and A.D. Polosa","ALPGEN, a generator for hard multiparton processes in hadronic
  collisions","1+38 pages, uses JHEP.cls. Documents code version 1.2: extended list
  of processes, updated documentation and bibliography","JHEP 0307 (2003) 001","10.1088/1126-6708/2003/07/001","CERN-TH/2002-129","hep-ph",,"  This paper presents a new event generator, ALPGEN, dedicated to the study of
multiparton hard processes in hadronic collisions. The code performs, at the
leading order in QCD and EW interactions, the calculation of the exact matrix
elements for a large set of parton-level processes of interest in the study of
the Tevatron and LHC data. The current version of the code describes the
following final states: (W -> ffbar') QQbar+ N jets (Q being a heavy quark, and
f=l,q), with N<=4; (Z/gamma* -> f fbar)+QQbar+Njets (f=l,nu), with N<=4; (W ->
ffbar') + charm + N jets (f=l,q), N<= 5; (W -> f fbar') + N jets (f=l,q) and
(Z/gamma* -> f fbar)+ N jets (f=l,nu), with N<=6; nW+mZ+lH+N jets, with
n+m+l+N<=8 and N<=3 including all 2-fermion decay modes of W and Z bosons, with
spin correlations; Q Qbar+N jets (N<=6) with t -> b f fbar' decays and relative
spin correlations included if Q=t; Q Qbar Q' Qbar'+N jets, with Q and Q' heavy
quarks (possibly equal) and N<=4; H Q Qbar+N jets (N<=4) with t -> b f fbar'
decays and relative spin correlations included if Q=t; N jets, with N<=6.
Parton-level events are generated, providing full information on their colour
and flavour structure, enabling the evolution of the partons into fully
hadronised final states.
","[{""version"":""v1"",""created"":""Fri, 28 Jun 2002 17:40:08 GMT""},{""version"":""v2"",""created"":""Mon, 26 May 2003 15:13:24 GMT""}]","2009-11-07"
"hep-ph/0206295","Christian Weiss","C. Weiss (Regensburg University)","Proton-antiproton annihilation into two photons at large s","6 pages, 3 figures, uses ws-procs9x6.cls. Talk presented at the
  Workshop on Exclusive Processes at High Momentum Transfer, Jefferson Lab,
  Newport News, VA, May 15-18, 2002",,"10.1142/9789812776211_0032",,"hep-ph",,"  Exclusive proton-antiproton annihilation into two photons can be viewed as
the Compton process in the crossed channel. At large s (~10 GeV^2) and |t|,|u|
s this process can be described by a generalized partonic picture, analogous to
the 'soft mechanism' in wide-angle real Compton scattering. The two photons are
emitted in the annihilation of a single fast quark and antiquark ('handbag
graph'). The transition of the p-pbar system to a q-qbar pair through soft
interactions is described by double distributions, which can be related to the
timelike proton elastic form factors as well as, by crossing symmetry, to the
usual quark--antiquark distributions in the nucleon. We estimate that this
reaction should be observable with reasonable statistics at the proposed
1.5..15 GeV high-luminosity antiproton storage ring (HESR) at GSI.
","[{""version"":""v1"",""created"":""Fri, 28 Jun 2002 16:14:01 GMT""}]","2017-08-23"
"hep-ph/0206306","Dieter Mueller","A.V. Belitsky, D. M\""uller","Nucleon hologram with exclusive leptoproduction","9 pages LaTeX, 7 figures, sign in Eq. (16) corrected, Invited talk at
  the European Workshop ""QCD structure of the nucleon"", Ferrara, Italy, April
  3-6, 2002","Nucl.Phys. A711 (2002) 118-126","10.1016/S0375-9474(02)01202-2",,"hep-ph",,"  Hard exclusive leptoproductions of real photons, lepton pairs and mesons are
the most promising tools to unravel the three-dimensional picture of the
nucleon, which cannot be deduced from conventional inclusive processes like
deeply inelastic scattering.
","[{""version"":""v1"",""created"":""Fri, 28 Jun 2002 17:00:39 GMT""},{""version"":""v2"",""created"":""Fri, 12 Jul 2002 14:05:07 GMT""}]","2009-11-07"
"hep-ph/0206309","Alessandro Bacchetta","A. Bacchetta, R. Kundu, A. Metz, P.J. Mulders","Estimate of the Collins function in a chiral invariant approach","5 pages, 4 figures, to appear in Proceedings of 10th International
  Workshop on Deep Inelastic Scattering (DIS 2002), Cracow, Poland, 30 Apr-4
  May 2002","Acta Phys.Polon. B33 (2002) 3761-3766",,,"hep-ph",,"  We estimate the Collins function at a low energy scale by calculating the
fragmentation of a quark into a pion at the one-loop level in the chiral
invariant model of Manohar and Georgi. We give a useful parametrization of our
results and we briefly discuss different spin and/or azimuthal asymmetries
containing the Collins function and measurable in semi-inclusive DIS and e+ e-
annihilation
","[{""version"":""v1"",""created"":""Fri, 28 Jun 2002 16:12:26 GMT""}]","2007-05-23"
"hep-ph/0206310","Christopher Kolda","K.S. Babu (Oklahoma State U.) and Christopher Kolda (Notre Dame U.)","Higgs-Mediated tau -> 3 mu in the Supersymmetric Seesaw Model","9 pages LaTeX, 2 figures. Added a discussion of mu -> 3e and its
  ramifications for probing neutrino mass matrix. Also added references, fixed
  typos, and made one notational change","Phys.Rev.Lett.89:241802,2002","10.1103/PhysRevLett.89.241802","OSU-HEP-02-09","hep-ph",,"  Recent observations of neutrino oscillations imply non-zero neutrino masses
and flavor violation in the lepton sector, most economically explained by the
seesaw mechanism. Within the context of supersymmetry, lepton flavor violation
(LFV) among the neutrinos can be communicated by renormalization group flow to
the sleptons and from there to the charged leptons. We show that LFV can appear
in the couplings of the neutral Higgs bosons, an effect that is strongly
enhanced at large tan(beta). In particular, we calculate the branching fraction
for tau -> 3 mu and mu -> 3 e mediated by Higgs and find that they can be as
large as 10^{-7} and 5x10^{-14} respectively. These modes, along with B^0 -> mu
mu, can provide important evidence for supersymmetry before direct discovery of
supersymmetric partners occurs. Along with tau -> mu gamma and mu -> e gamma,
they can also provide key insights into the form of the neutrino Yukawa mass
matrix.
","[{""version"":""v1"",""created"":""Fri, 28 Jun 2002 17:00:25 GMT""},{""version"":""v2"",""created"":""Wed, 10 Jul 2002 20:44:32 GMT""}]","2009-07-09"
"hep-ph/0206311","Rohini M. Godbole","F. Boudjema, G. B\'elanger and R.M. Godbole","Invisible Decays of the Supersymmetric Higgs and Dark Matter","17 pages, 11 figures, Talk presented at Appi2002, Accelerator and
  Particle Physics Institute, Appi, Iwate, Japan, February 13--16 2002",,,"CERN-TH/20002-141, LAPTH-Conf-919","hep-ph",,"  We discuss effects of the light sparticles on decays of the lightest Higgs in
a supersymmetric model with nonuniversal gaugino masses at the high scale,
focusing on the `invisible' decays into neutralinos. These can impact
significanlty the discovery possibilities of the lightest Higgs at the LHC. We
show that due to these decays, there exist regions of the $M_2-\mu$ space where
the B.R. $(h \to \gamma \gamma)$ becomes dangerously low even after imposing
the LEP constraints on the sparticle masses, implying a possible preclusion of
its discovery in the $\gamma \gamma$ channel. We find that there exist regions
in the parameter space with acceptable relic density and where the ratio ${B.R.
(h \to \gamma \gamma)_{SUSY} \over B.R. (h \to \gamma \gamma)_{SM}}$ falls
below 0.6, implying loss of signal in the $\gamma \gamma$ channel. These
regions correspond to $\tilde \chi_1^+, \tilde \chi_2^0$ masses which should be
accessible already at the Tevatron. Further we find that considerations of
relic density put lower limit on the U(1) gaugino mass parameter $M_1$
independently of $\mu, \tan \beta$ and $m_0$.
","[{""version"":""v1"",""created"":""Fri, 28 Jun 2002 17:11:22 GMT""}]","2007-05-23"
"hep-ph/0206312","Gil Paz","Gil Paz","SU(3) - Flavor Symmetry in $B \to VP$ Decays","30 pages",,,,"hep-ph",,"  In the framework of SU(3) symmetry, we present a general analysis of $B$
meson decays into two lighter uncharmed mesons (both pairs of pseudoscalar
mesons and pairs of vector and pseudoscalar mesons). From the analysis we find
constraints on $\gamma$ and discuss their validity. The most useful new
constraint is obtained by considering the decay modes $B^{0} \to K\pi$ and
$B^{+} \to \pi^{0}\pi^{+}$. In decays into pairs of vector and pseudeuscalar
mesons, no constraints can be obtained using SU(3) symmetry alone and further
assumptions are needed. Based on these assumptions, we obtain new (weaker)
constraints using $B^{0} \to \rho K/B^{0} \to K^{*}\pi$ and $B^{+} \to
\rho\pi$. We show that no other constraints can be obtained. We also suggest a
method to measure $\gamma$ using $B^{0}_{s} \to \rho\pi$ and $B^{0} \to
K^{*\pm}K^{\mp}$.
","[{""version"":""v1"",""created"":""Fri, 28 Jun 2002 19:13:27 GMT""}]","2007-05-23"
"hep-ph/0207001","Yun-Song Piao","Yun-Song Piao, Rong-Gen Cai and Xinmin Zhang","The Effect of 4D Effective Cosmological Constant On The Stability of
  Randall-Sundrum Scenario","6 pages, 2 figures, to be published in Mod. Phys. Lett. A","Mod.Phys.Lett. A17 (2002) 1291-1296","10.1142/S021773230200748X",,"hep-ph",,"  We study the Randall-Sundrum model with a small 4D effective cosmological
constant on the brane, and drive a corrected radion potential following the
Goldberger-Wise mechanism. We then discuss the effect of the 4D effective
cosmological constant on the stability of the brane-system, and find that to
quintessence determined by updated observation, the proper distance between the
two branes required to solve the hierarchy problem can exist. However, during
inflation, whether we can get an reasonable hierarchy scale is still uncertain.
","[{""version"":""v1"",""created"":""Sat, 29 Jun 2002 08:24:38 GMT""}]","2009-11-07"
"hep-ph/0207002","Matthias Neubert","Matthias Neubert (Cornell)","Subleading Shape Functions and the Determination of |V_{ub}|","8 pages, 1 figure. Final version to appear in Physics Letters B. By a
  smarter choice of weight function, m_b and lambda_1 have been eliminated from
  the final results. A paragraph has been added mentioning the potentially
  sizeable uncertainty due to duality violations and spectator-dependent
  effects. The discussion of the results obtained in refs. [7,8] has been made
  more accurate","Phys.Lett. B543 (2002) 269-275","10.1016/S0370-2693(02)02462-0","CLNS-02/1791","hep-ph",,"  It is argued that the dominant subleading shape-function contributions to the
endpoint region of the charged-lepton energy spectrum in B -> X_u l nu decays
can be related in a model-independent way to an integral over the B -> X_s
gamma photon spectrum. The square root of the fraction of B -> X_u l nu events
with charged-lepton energy above E_0=2.2 GeV can be calculated with a residual
theoretical uncertainty from subleading shape-function effects that it safely
below the 10% level. These effects have therefore a minor impact on the
determination of |V_{ub}|.
","[{""version"":""v1"",""created"":""Fri, 28 Jun 2002 21:36:23 GMT""},{""version"":""v2"",""created"":""Tue, 20 Aug 2002 17:19:35 GMT""}]","2010-04-05"
