"cond-mat/0201388","Sandro Sorella","Sandro Sorella","Effective hamiltonian approach for strongly correlated lattice models","19 pages, 7 colour figures, lecture notes for the Euro Winter
  School-Kerkrade-NL",,,,"cond-mat.str-el cond-mat.supr-con",,"  We review a recent approach for the simulation of many-body interacting
systems based on an efficient generalization of the Lanczos method for Quantum
Monte Carlo simulations. This technique allows to perform systematic
corrections to a given variational wavefunction, that allow to estimate exact
energies and correlation functions, whenever the starting variational
wavefunction is a qualitatively correct description of the ground state. The
stability of the variational wavefunction against possible phases, not
described at the variational level can be tested by using the ''effective
Hamiltonian'' approach. In fact Monte Carlo methods, such as the ''fixed node
approximation'' and the ''generalized Lanczos technique'' (Phys. Rev. B
64,024512, 2001) allow to obtain exact ground state properties of an effective
Hamiltonian, chosen to be as close as possible to the exact Hamiltonian, thus
yielding the most reasonable estimates of correlation functions. We also
describe a simplified one-parameter scheme that improve substantially the
efficiency of the generalized Lanczos method. This is tested on the t-J model,
with a special effort to obtain accurate pairing correlations, and provide a
possible non-phonon mechanism for High temperature superconductivity.
","[{""version"":""v1"",""created"":""Tue, 22 Jan 2002 11:20:44 GMT""}]","2007-05-23"
"cond-mat/0201389","Jun Goryo","J. Goryo and M. Kohmoto (ISSP, Univ. Tokyo)","Berry phase and quantized Hall effect in three-dimension","corrected some typos. Accepted for publication in J. Phys. Soc. Jpn","J. Phys. Soc. Jpn. Vol.71, 1403 (2002)","10.1143/JPSJ.71.1403",,"cond-mat.mes-hall",,"  We consider Bloch electrons in the electromagnetic field and argue the
relation between the Berry phase and the quantized Hall conductivity in
three-dimension. The Berry phase we consider here is induced by the adiabatic
change of the time-dependent vector potential. The relation has been shown in
two-dimensional systems, and we generalize the relation in three-dimensional
systems.
","[{""version"":""v1"",""created"":""Tue, 22 Jan 2002 11:28:51 GMT""},{""version"":""v2"",""created"":""Tue, 5 Mar 2002 05:04:45 GMT""}]","2009-11-07"
"cond-mat/0201390","Cosima Schuster","C. Schuster and U. Eckern","Quantum spin chains with various defects","15 pages, 8 figures, replaced by final version, Journal-ref. added","Ann. Phys. (Leipzig) 11, 901-915 (2002)","10.1002/1521-3889(200212)11:12<901::AID-ANDP901>3.0.CO;2-I",,"cond-mat.str-el",,"  Using the density matrix renormalization group (DMRG) method, we study the
quantum coherence in one-dimensional disordered Fermi systems. We consider in
detail spinless fermions on a ring, and compare the influence of several kinds
of impurities in a gapless and a dimerized, gapped system. In the
translation-invariant system a so-called site-impurity, which can be realized
by a local potential or a change of one link, increases for repulsive
interaction and decreases for attractive interaction. The weakening of two
neighboring bonds, which is a realization of a so-called bond-impurity, on the
other hand, is healed for repulsive interaction, but enhanced for intermediate
attractive interactions. This leads to strong suppression of the quantum
coherence measured by the phase sensitivity, but not to localization. Adding a
local distortion to a dimerized system we find that even the presence of a
single site-impurity increases the metallic region found in the dimerized
model. For a strong dimerization and a high barrier, an additional sharp
maximum, even seen for systems with about 100 sites, occurs in the phase
sensitivity. A bond-impurity in the dimerized system also opens a small
metallic window in the otherwise isolating regime.
","[{""version"":""v1"",""created"":""Tue, 22 Jan 2002 12:29:20 GMT""},{""version"":""v2"",""created"":""Mon, 25 Nov 2002 10:23:46 GMT""}]","2017-09-27"
"cond-mat/0201391","Fabrizio Dolcini","Fabrizio Dolcini and Arianna Montorsi","Finite-temperature properties of the Hubbard chain with bond-charge
  interaction","5 pages, 3 eps figures",,"10.1103/PhysRevB.66.075112",,"cond-mat.str-el cond-mat.stat-mech",,"  We investigate the one-dimensional Hubbard model with an additional
bond-charge interaction, recently considered in the description of compounds
that exhibit strong 1D features above the temperature of ordered phases. The
partition function of the model is exactly calculated for a value of the
bond-charge coupling; the behavior of the specific heat and spin susceptibility
as a function of temperature is derived at arbitrary filling, and particularly
discussed across the occurring metal-insulator transition. The results show
that the bond-charge terms weaken the spin excitations of the system.
","[{""version"":""v1"",""created"":""Tue, 22 Jan 2002 13:39:25 GMT""},{""version"":""v2"",""created"":""Fri, 5 Apr 2002 17:42:01 GMT""}]","2009-11-07"
"cond-mat/0201392","Keiji Saito","Keiji Saito and Seiji Miyashita","Enhancement of the Thermal Conductivity in gapped Quantum Spin Chains","4 pages, 2 figures",,"10.1143/JPSJ.71.2485",,"cond-mat.mtrl-sci",,"  We study mechanism of magnetic energy transport, motivated by recent
measurements of the thermal conductivity in low dimensional quantum magnets. We
point out a possible mechanism of enhancement of the thermal conductivity in
gapped magnetic system, where the magnetic energy transport plays a crucial
role. This mechanism gives an interpretation for the recent experiment of
CuGeO_3, where the thermal conductivity depends on the crystal direction.
","[{""version"":""v1"",""created"":""Tue, 22 Jan 2002 14:40:44 GMT""},{""version"":""v2"",""created"":""Fri, 30 Aug 2002 00:11:39 GMT""}]","2009-11-07"
"cond-mat/0201393","Ismael Lima Menezes Sobrinho","I. L. Menezes-Sobrinho","Fracture toughness in fibrous materials","4 pages, 4 figures.eps, Revtex","Phy. Rev. E 65,011502 (2001)","10.1103/PhysRevE.65.011502",,"cond-mat.stat-mech",,"  In the present paper, a fiber bundle model in (1+1)-dimensions that simulates
the rupture process of a fibrous material pulled by an uniaxial force F is
analyzed. In this model the load of a broken fiber is shifted in equal portions
onto the nearest unbroken fibers. The force-displacement diagram is obtained
for several traction velocities v and temperatures t. Also, it is shown how the
fracture toughness $K_c$ changes with the traction velocity v and with the
temperature t. In this paper it is shown that the rupture process is strongly
dependent on temperature t and on velocity v.
","[{""version"":""v1"",""created"":""Tue, 22 Jan 2002 15:23:15 GMT""}]","2016-08-31"
"gr-qc/0201069","Stanislav Alexeyev","S. Alexeyev (1,2), A. Barrau (1), G. Boudoul (1), O. Khovanskaya (2),
  M. Sazhin (2), ((1) Institut des Sciences Nucleaires, Grenoble, France, (2)
  Sternberg Astronomical Institute, Moscow, Russia)","Black Hole Relics in String Gravity: Last Stages of Hawking Evaporation","15 pages, accepted to Class. Quant. Grav","Class.Quant.Grav.19:4431-4444,2002","10.1088/0264-9381/19/16/314",,"gr-qc astro-ph",,"  One of the most intriguing problem of modern physics is the question of the
endpoint of black hole evaporation. Based on Einstein-dilaton-Gauss-Bonnet four
dimensional string gravity model we show that black holes do not disappear and
that the end of the evaporation process leaves some relic. The possibility of
experimental detection of the remnant black holes is investigated. If they
really exist, such objects could be a considerable part of the non baryonic
dark matter in our Universe.
","[{""version"":""v1"",""created"":""Mon, 21 Jan 2002 17:50:54 GMT""},{""version"":""v2"",""created"":""Thu, 24 Jan 2002 18:45:11 GMT""},{""version"":""v3"",""created"":""Wed, 27 Mar 2002 20:15:01 GMT""},{""version"":""v4"",""created"":""Thu, 28 Mar 2002 11:22:51 GMT""},{""version"":""v5"",""created"":""Wed, 26 Jun 2002 04:34:45 GMT""}]","2008-11-26"
"gr-qc/0201070","Jonathan Halliwell","J.J.Halliwell and J.Thorwart","Life in an Energy Eigenstate: Decoherent Histories Analysis of a Model
  Timeless Universe","57 pages, plain Tex, 1 figure","Phys.Rev. D65 (2002) 104009","10.1103/PhysRevD.65.104009","IC/TP/1-02/13","gr-qc",,"  Inspired by quantum cosmology, in which the wave function of the universe is
annihilated by the total Hamiltonian, we consider the internal dynamics of a
simple particle system in an energy eigenstate. Such a system does not possess
a uniquely defined time parameter and all physical questions about it must be
posed without reference to time. We consider in particular the question, what
is the probability that the system's trajectory passes through a set of regions
of configuration space without reference to time? We first consider the
classical case, where the answer has a variety of forms in terms of a phase
space probability distribution function. We then consider the quantum case, and
we analyze this question using the decoherent histories approach to quantum
theory, adapted to questions which do not involve time. When the histories are
decoherent, the probabilities approximately coincide with the classical case,
with the phase space probability distribution replaced by the Wigner function
of the quantum state. For some initial states, decoherence requires an
environment, and we compute the required influence functional and examine some
of its properties. Special attention is given to the inner product used in the
construction (the induced or Rieffel inner product), the construction of class
operators describing the histories, and the extent to which reparametrization
invariance is respected. Our results indicate that simple systems without an
explicit time parameter may be quantized using the decoherent histories
approach, and the expected classical limit extracted. The results support, for
simple models, the usual heuristic proposals for the probability distribution
function associated with a semiclassical wave function satisfying the
Wheeler-DeWitt equation.
","[{""version"":""v1"",""created"":""Mon, 21 Jan 2002 18:02:12 GMT""}]","2009-11-07"
"gr-qc/0201071","L. C. Garcia de Andrade","L.C. Garcia de Andrade (Departamento de Fisica Teorica-IF-UERJ)","Gravitational Stability of inflaton and torsion in
  Einstein-Cartan-Klein-Gordon cosmology with kinky potentials","Latex file",,,,"gr-qc",,"  Gravitational stability of torsion and inflaton field in a four-dimensional
spacetime de Sitter solution in scalar-tensor cosmology where Cartan torsion
propagates is investigated in detail. Inflaton and torsion evolution equations
are derived by making use of a Lagrangean method. Stable and unstable modes for
torsion and inflatons are found to be dependent of the background torsion and
inflaton fields. Present astrophysical observations favour a stable mode for
torsion since this would explain why no relic torsion imprint has been found on
the Cosmic Background Radiation in the universe.
","[{""version"":""v1"",""created"":""Mon, 21 Jan 2002 23:51:44 GMT""}]","2007-05-23"
"gr-qc/0201072","Pio J. Arias","Rolando Gaitan (Theoretical Physics Group of Physics Departament of
  Carabobo's University, Valencia, Venezuela)","On Consistence of Material Coupling in a GL(3,R) Gauge Formulation of
  Gravity","9 pages, LaTeX, title, and abstract changed. To appear in
  Mod.Phys.Lett.A, Vol. 18, No. 25 (2003) pp. 1753-1761",,,,"gr-qc",,"  A covariant scheme for material coupling with $GL(N,R)$ gauge formulation of
gravity is studied. We revisit a known idea of a Yang-Mills type construction,
where quadratical power of cosmological constant have to be considered in
consistence with vacuum Einstein's gravity. Then, matter coupling with gravity
is introduced and some constraints on fields and background appear. Finally,
exploring the N=3 case we elucidate that introduction of auxiliary fields
decreases the number of these constraints.
","[{""version"":""v1"",""created"":""Tue, 22 Jan 2002 06:14:15 GMT""},{""version"":""v2"",""created"":""Sun, 17 Mar 2002 14:08:28 GMT""},{""version"":""v3"",""created"":""Thu, 7 Aug 2003 20:52:39 GMT""}]","2007-05-23"
"gr-qc/0201073","Pio J. Arias","Victor Varela (Universidad Central de Venezuela)","Construction of Sources for Majumdar-Papapetrou Spacetimes","15 pages, LaTeX","Gen.Rel.Grav. 35 (2003) 1815-1831","10.1023/A:1026014114308",,"gr-qc",,"  We study Majumdar-Papapetrou solutions for the 3+1 Einstein-Maxwell
equations, with charged dust acting as the external source for the fields. The
spherically symmetric solution of G\""{u}rses is considered in detail. We
introduce new parameters that simplify the construction of class $C^1$,
singularity-free geometries. The arising sources are bounded or unbounded, and
the redshift of light signals allows an observer at spatial infinity to
distinguish these cases. We find out an interesting affinity between the
conformastatic metric and some homothetic, matter and Ricci collineations. The
associated non-Noetherian symmetries provide us with distinctive solutions that
can be used to construct non-singular sources for Majumdar-Papapetrou
spacetimes.}
","[{""version"":""v1"",""created"":""Tue, 22 Jan 2002 06:25:27 GMT""}]","2015-06-25"
"gr-qc/0201074","Gennadi Sardanashvily","G.Sardanashvily","On the geometric foundation of classical gauge gravitation theory","47 pages",,,,"gr-qc",,"  A number of recent works in E-print arXiv have addressed the foundation of
gauge gravitation theory again. As is well known, differential geometry of
fibre bundles provides the adequate mathematical formulation of classical field
theory, including gauge theory on principal bundles. Gauge gravitation theory
is formulated on the natural bundles over a world manifold whose structure
group is reducible to the Lorentz group. It is the metric-affine gravitation
theory where a metric (tetrad) gravitational field is a Higgs field.
","[{""version"":""v1"",""created"":""Tue, 22 Jan 2002 07:24:33 GMT""}]","2007-05-23"
"hep-ex/0201034","Spencer Klein","G. Baur, C. A. Bertulani, M. Chiu, I. F. Ginzburg, K. Hencken, S. R.
  Klein, J. Nystrand, K. Piotrzkowski, C. G. Roldao, D. Silvermyr, J. H.
  Thomas, S. N. White and P. Yepes","Hot Topics in Ultra-Peripheral Collisions","7 pages, with 3 figures. This developed from a discussion at the
  workshop on ""Electromagnetic Probes of Fundamental Physics,"" Oct. 16-21,
  Erice, Italy",,"10.1142/9789812704214_0025",,"hep-ex",,"  Ultra-peripheral collisions of relativistic heavy ions involve long-ranged
electromagnetic interactions at impact parameters too large for hadronic
interactions to occur. The nuclear charges are large; with the coherent
enhancement, the cross sections are also large. Many types of photonuclear and
purely electromagnetic interactions are possible. We present here an
introduction to ultra-peripheral collisions, and present four of the most
compelling physics topics. This note developed from a discussion at a workshop
on ``Electromagnetic Probes of Fundamental Physics,'' in Erice, Italy, Oct.
16-21, 2001.
","[{""version"":""v1"",""created"":""Mon, 21 Jan 2002 23:10:35 GMT""}]","2017-08-23"
"hep-lat/0201018","Dzhunushaliev Vladimir","V. Dzhunushaliev and D. Singleton","Monopoles in Lattice QCD with Abelian Projection as Quantum Monopoles","8 pages, 3 figures","Hadronic J.26:539-552,2003",,,"hep-lat hep-ph hep-th",,"  Within the context of the Abelian Projection of QCD monopole-like quantum
excitations of gauge fields are studied. We start with certain classical
solutions, of the SU(2) Yang-Mills field equations, which are not monopole-like
and whose energy density diverges as $r \to \infty$. These divergent classical
solutions are then quantized using a modified version of Heisenberg's
quantization technique for strongly interacting, nonlinear fields. The modified
Heisenberg quantization technique leads to a system of equations with mixed
quantum and classical degrees of freedom. By applying a Feynman path
integration over the quantum degrees of freedom the quantum-averaged solution
gives a nondivergent, monopole-like configuration after Abelian Projection.
","[{""version"":""v1"",""created"":""Tue, 22 Jan 2002 02:59:54 GMT""}]","2014-11-17"
"hep-ph/0201189","Thomas Schaefer","Thomas Schaefer (Duke U, SUNY Stony Brook and Riken-BNL)","Instanton Effects in QCD at High Baryon Density","27 pages, 8 figures, minor revisions","Phys.Rev. D65 (2002) 094033","10.1103/PhysRevD.65.094033",,"hep-ph hep-lat",,"  We study instanton effects in QCD at very high baryon density. In this regime
instantons are suppressed by a large power of $(\Lambda_{QCD}/\mu)$, where
$\Lambda_{QCD}$ is the QCD scale parameter and $\mu$ is the baryon chemical
potential. Instantons are nevertheless important because they contribute to
several physical observables that vanish to all orders in perturbative QCD. We
study, in particular, the chiral condensate and its contribution $m_{GB}^2\sim
m<\bar{\psi}\psi>$ to the masses of Goldstone bosons in the CFL phase of QCD
with $N_f=3$ flavors. We find that at densities $\rho\sim (5-10) \rho_0$, where
$\rho_0$ is the density of nuclear matter, the result is dominated by large
instantons and subject to considerable uncertainties. We suggest that these
uncertainties can be addressed using lattice calculations of the instanton
density and the pseudoscalar diquark mass in QCD with two colors. We study the
topological susceptibility and Witten-Veneziano type mass relations in both
$N_c=2$ and $N_c=3$ QCD.
","[{""version"":""v1"",""created"":""Mon, 21 Jan 2002 19:16:45 GMT""},{""version"":""v2"",""created"":""Sat, 9 Feb 2002 19:54:40 GMT""}]","2009-11-07"
"hep-ph/0201190","Richard Woloshyn","R. Lewis, W. Wilcox, R.M. Woloshyn","Strange-quark Current in the Nucleon from Lattice QCD","12 pages, 9 figures, Presented at EMI 2001",,"10.1142/9789812777218_0055","BU-HEPP-06-01, TRI-PP-02-01","hep-ph",,"  The contribution of the strange-quark current to the electromagnetic form
factors of the nucleon is studied using lattice QCD. The strange current matrix
elements from our lattice calculation are analyzed in two different ways, the
differential method used in an earlier work by Wilcox and a cumulative method
which sums over all current insertion times. The preliminary results of our
simulation indicate the importance of high statistics, and that consistent
results between the varying analysis methods can be achieved. Although this
simulation does not yet yield a number that can be compared to experiment,
several criteria useful in assessing the robustness of a signal extracted from
a noisy background are presented.
","[{""version"":""v1"",""created"":""Mon, 21 Jan 2002 19:13:00 GMT""}]","2017-08-23"
"hep-ph/0201191","Geng","C.Q. Geng, J.N. Ng, and T.H. Wu","CP Violation in the Decay $\eta\to\pi^+\pi^-\gamma$","new references added,accepted for publication in Mod.Phys.Lett","Mod.Phys.Lett. A17 (2002) 1489-1498","10.1142/S0217732302007697",,"hep-ph",,"  We study the CP violating effects in the decay of $\eta\to\pi^+\pi^-\gamma$.
We show that to have CP violation in the decay, one has to consider both linear
and circular photon polarizations. In the standard model, the polarizations are
vanishingly small. However, model-independently, i.e. using only experimental
constraint imposed by the limit on $Br(\eta\to\pi^+\pi^-)$ it can be up to
$O(10%)$. We also explore various possible operators and we find that the
tensor type operator, possibly arising from a nonzero CP violating electric
dipole moment of the strange quark, can induce a sizable linear photon
polarization.
","[{""version"":""v1"",""created"":""Mon, 21 Jan 2002 19:43:09 GMT""},{""version"":""v2"",""created"":""Tue, 12 Mar 2002 19:34:00 GMT""},{""version"":""v3"",""created"":""Mon, 17 Jun 2002 18:13:48 GMT""}]","2009-11-07"
"hep-ph/0201192","Richard Field","R. D. Field","The Underlying Event in Hard Scattering Processes","RevTex4, 18 pages, 29 figures, contribution to Snowmass 2001","eConfC010630:P501,2001",,"UFIFT-HEP-01-19","hep-ph",,"  We study the behavior of the ""underlying event"" in hard scattering
proton-antiproton collisions at 1.8 TeV and compare with the QCD Monte-Carlo
models. The ""underlying event"" is everything except the two outgoing hard
scattered ""jets"" and receives contributions from the ""beam-beam remnants"" plus
initial and final-state radiation. The data indicate that neither ISAJET or
HERWIG produce enough charged particles (with PT > 0.5 GeV/c) from the
""beam-beam remnant"" component and that ISAJET produces too many charged
particles from initial-state radiation. PYTHIA which uses multiple parton
scattering to enhance the ""underlying event"" does the best job describing the
data.
","[{""version"":""v1"",""created"":""Mon, 21 Jan 2002 22:19:35 GMT""}]","2008-11-26"
"hep-ph/0201193","Jean-Pierre Hurni","Andre Gsponer and Jean-Pierre Hurni","Non-linear field theory for lepton and quark masses","8 pages, 1 table, 1 figure. PACS: 12.15.Ff, 11.10","Hadronic J. 19 (1996) 367-373",,"Independent Scientific Research Institute report number ISRI-96-01","hep-ph",,"  Barut's formula for the mass of leptons is successfully extended to quarks. A
very simple non-linear scalar field model explains both the N^4 power law
dependence of the mass, and the existence of a cut-off which limits the number
of leptons to three and the number of quarks to five, suggesting that the mass
of the sixth quark is of different origin.
","[{""version"":""v1"",""created"":""Mon, 21 Jan 2002 22:22:07 GMT""}]","2007-05-23"
"hep-ph/0201194","Bhaskar Dutta","R. Arnowitt, B. Dutta and Y. Santoso","Dark Matter in SUSY Models","13 pages, latex, 10 figures, invited talk at NANP-01, Dubna, Russia,
  June 19--23, 2001","Phys.Atom.Nucl.65:2218-2224,2002; Yad.Fiz.65:2281-2286,2002","10.1134/1.1530303",,"hep-ph astro-ph hep-ex",,"  Direct detection experiments for neutralino dark matter in the Milky Way are
examined within the framework of SUGRA models with R-parity invariance and
grand unification at the GUT scale, M_G. Models of this type apply to a large
number of phenomena, and all existing bounds on the SUSY parameter space due to
current experimental constraints are included. For models with universal soft
breaking at M_G (mSUGRA), the Higgs mass and b\to s\gamma constraints imply
that the gaugino mass, m_{1/2}, obeys m_{1/2} >(300-400)GeV putting most of the
parameter space in the co-annihilation domain where there is a relatively
narrow band in the m_0 - m_{1/2} plane. For $\mu > 0$ we find that the
neutralino -proton cross section >~ 10^{-10} pb for m_{1/2} < 1 TeV, making
almost all of this parameter space accessible to future planned detectors. For
\mu < 0, however, there will be large regions of parameter space with cross
sections < 10^{-12} pb, and hence unaccessible experimentally. If, however, the
muon magnetic moment anomaly is confirmed, then \mu >0 and m_{1/2}<~ 800 GeV.
Models with non-universal soft breaking in the third generation and Higgs
sector can allow for new effects arising from additional early universe
annihilation through the Z-channel pole. Here cross sections that will be
accessible in the near future to the next generation of detectors can arise,
and can even rise to the large values implied by the DAMA data. Thus dark
matter detectors have the possibility of studying the the post-GUT physics that
control the patterns of soft breaking.
","[{""version"":""v1"",""created"":""Mon, 21 Jan 2002 22:31:18 GMT""}]","2008-11-26"
"hep-ph/0201195","Wu-Ki Tung","J. Pumplin, D.R. Stump, J. Huston, H.L. Lai, P. Nadolsky, and W.K.
  Tung","New Generation of Parton Distributions with Uncertainties from Global
  QCD Analysis","44 pages, 25 figures; misprints in tables in Appendix A corrected","JHEP 0207:012,2002","10.1088/1126-6708/2002/07/012","MSU-HEP-011101","hep-ph hep-ex",,"  A new generation of parton distribution functions with increased precision
and quantitative estimates of uncertainties is presented. This work
significantly extends previous CTEQ and other global analyses on two fronts:
(i) a full treatment of available experimental correlated systematic errors for
both new and old data sets; (ii) a systematic and pragmatic treatment of
uncertainties of the parton distributions and their physical predictions, using
a recently developed eigenvector-basis approach to the Hessian method. The new
gluon distribution is considerably harder than that of previous standard fits.
A number of physics issues, particularly relating to the behavior of the gluon
distribution, are addressed in more quantitative terms than before. Extensive
results on the uncertainties of parton distributions at various scales, and on
parton luminosity functions at the Tevatron RunII and the LHC, are presented.
The latter provide the means to quickly estimate the uncertainties of a wide
range of physical processes at these high-energy hadron colliders, based on
current knowledge of the parton distributions. In particular, the uncertainties
on the production cross sections of the $W,Z$ at the Tevatron and the LHC are
estimated to be $\pm 4%$ and $\pm 5%$ respectively, and that of a light Higgs
at the LHC to be $\pm 5%$.
","[{""version"":""v1"",""created"":""Tue, 22 Jan 2002 03:45:22 GMT""},{""version"":""v2"",""created"":""Sun, 27 Jan 2002 19:52:53 GMT""},{""version"":""v3"",""created"":""Sun, 3 Feb 2002 02:24:39 GMT""}]","2011-07-18"
