"cond-mat/0201407","Arata Tanaka","Arata Tanaka","Electronic Structure and Phase Transition in V2O3: Importance of 3d
  Spin-Orbit Interaction and Lattice Distortion","18 pages, 16 figures","J. Phys. Soc. Jpn. 71 (2002) 1091","10.1143/JPSJ.71.1091",,"cond-mat.str-el",,"  The 3d electronic structure and phase transition in pure and Cr doped V2O3
are theoretically investigated in relation to the 3d spin-orbit interaction and
lattice distortion. A model consisting of the nearest-neighbor V ion pair with
full degeneracy of the 3d orbitals is studied within the many-body point of
view. It is shown that each V ion with S=1 spin state has a large orbital
magnetic moment $\sim 0.7 \mu_{\rm B}$ and no orbital ordering occurs in the
antiferromagnetic insulating (AFI) phase. The anomalous resonant Bragg
reflection found in the AFI phase is attributed to the magnetic ordering. In
the AFI and paramagnetic insulating (PI) phases, Jahn-Teller like lattice
instability leads to tilting of the V ion pairs from the corundum c-axis and
this causes large difference in the orbital occupation between the paramagnetic
metal and the insulating phases, which is consistent with linear dichroic V 2p
XAS measurements.
  To understand the AFI to PI transition, a model spin Hamiltonian is also
proposed. The transition is found to be simultaneous order-disorder transition
of the magnetic moments and tilting directions of the V ion pairs. Softening of
elastic constant C44 and abrupt change in short range spin correlations
observed at the transition are also explained.
","[{""version"":""v1"",""created"":""Wed, 23 Jan 2002 11:26:48 GMT""},{""version"":""v2"",""created"":""Mon, 15 Apr 2002 04:00:33 GMT""}]","2016-08-31"
"cond-mat/0201408","Theo Nieuwenhuizen","A.E. Allahverdyan and Th.M. Nieuwenhuizen","Bath generated work extraction and inversion-free gain in two-level
  systems","4 pages revtex",,"10.1088/0305-4470/36/4/301",,"cond-mat.stat-mech",,"  The spin-boson model, often used in NMR and ESR physics, quantum optics and
spintronics, is considered in a solvable limit to model a spin one-half
particle interacting with a bosonic thermal bath. By applying external pulses
to a non-equilibrium initial state of the spin, work can be extracted from the
thermalized bath. It occurs on the timescale $\T_2$ inherent to transversal
(`quantum') fluctuations. The work (partly) arises from heat given off by the
surrounding bath, while the spin entropy remains constant during a pulse. This
presents a violation of the Clausius inequality and the Thomson formulation of
the second law (cycles cost work) for the two-level system.
  Starting from a fully disordered state, coherence can be induced by employing
the bath. Due to this, a gain from a positive-temperature (inversion-free)
two-level system is shown to be possible.
","[{""version"":""v1"",""created"":""Wed, 23 Jan 2002 11:08:15 GMT""}]","2009-11-07"
"cond-mat/0201409","Olivier Klein","V. Charbois, V. V. Naletov, J. Ben Youssef, and O. Klein","Mechanical detection of FMR spectrum in a normally magnetized YIG disk","Accepted in J. Appl. Phys",,,,"cond-mat.mtrl-sci",,"  The ferromagnetic resonance spectrum of a normally magnetized YIG disk, with
thickness of 4.75$\mu$m and radius of 80$\mu$m, is measured at room temperature
both by magnetic resonance force microscopy and by standard detection of the
microwave susceptibility. The comparison indicates that MRFM represents one of
the most potent means of obtaining the \emph{complete} FMR spectra of
micron-size samples. In the weak coupling regime, the measured data can be
quantitatively understood within the framework of the Damon and Eshbach model.
","[{""version"":""v1"",""created"":""Wed, 23 Jan 2002 11:14:21 GMT""}]","2007-05-23"
"cond-mat/0201410","A. Ovchinnikov","A.A.Ovchinnikov","Magnetophoresis of neutral particles in AC electric field","5 pages, Revtex",,,,"cond-mat.stat-mech cond-mat.mtrl-sci",,"  It has been shown that under joint action of DC magnetic and AC electric
fields neutral particles (atoms,molecules,nano-size particles etc.) nearby
interface move with permanent velocity along the surface. The driving force
depends on non-linear dynamical properties of polarization of the particles and
a coupling between the polarisation and the position of the particles on a
surface.
","[{""version"":""v1"",""created"":""Wed, 23 Jan 2002 12:14:10 GMT""}]","2007-05-23"
"cond-mat/0201411","Carsten Timm","C. Timm, F. Sch\""afer, and F. von Oppen","Correlated defects, metal-insulator transition, and magnetic order in
  ferromagnetic semiconductors","4 pages RevTeX4, 5 figures included","Phys. Rev. Lett. 89, 137201 (2002)","10.1103/PhysRevLett.89.137201",,"cond-mat.mtrl-sci cond-mat.dis-nn",,"  The effect of disorder on transport and magnetization in ferromagnetic III-V
semiconductors, in particular (Ga,Mn)As, is studied theoretically. We show that
Coulomb-induced correlations of the defect positions are crucial for the
transport and magnetic properties of these highly compensated materials. We
employ Monte Carlo simulations to obtain the correlated defect distributions.
Exact diagonalization gives reasonable results for the spectrum of valence-band
holes and the metal-insulator transition only for correlated disorder. Finally,
we show that the mean-field magnetization also depends crucially on defect
correlations.
","[{""version"":""v1"",""created"":""Wed, 23 Jan 2002 12:24:25 GMT""},{""version"":""v2"",""created"":""Fri, 6 Sep 2002 07:44:40 GMT""}]","2009-11-07"
"cond-mat/0201412","Andrey","M. I. Katsnelson (1), A. F. Maksyutov (2) and A. V. Trefilov (2) ((1)
  Institute of Metal Physics, (2) Russian Research Center Kurchatov Institute)","Peculiarities of anharmonic effects in the lattice thermodynamics of fcc
  metals","8 pages, 5 Postscript figures, LaTeX",,"10.1016/S0375-9601(02)00126-3",,"cond-mat.mtrl-sci",,"  Explicit expressions for anharmonic contributions to the thermodynamic
properties with allowance for higher-order phonon-phonon interactions for
closed-packed crystals are given, and the calculations for some fcc metals near
the melting (Ir, Rh) and martensite phase transition (Ca, Sr) points are
carried out. A detailed comparison of anharmonic and electron contributions to
the heat capacity of these metals is carried out. The computational results for
high-temperature heat capacity agree well with the available experimental data.
","[{""version"":""v1"",""created"":""Wed, 23 Jan 2002 14:30:29 GMT""},{""version"":""v2"",""created"":""Tue, 19 Mar 2002 09:54:32 GMT""}]","2009-11-07"
"cond-mat/0201413","Gorshunov","B. Gorshunov, P. Haas, T. R\~o\~om, M. Dressel, T. Vuletic, B. Hamzic,
  S. Tomic, J. Akimitsu, T. Nagata","Charge-density wave formation in Sr_{14}Cu_{24}O_{41}","One name added to author list 4 pages, 2 figures, email:
  gorshunov@pi1.physik.uni-stuttgart.de",,"10.1103/PhysRevB.66.060508",,"cond-mat.str-el",,"  The electrodynamic response of the spin-ladder compound
Sr$_{14-x}$Ca$_x$Cu$_{24}$O$_{41}$ ($x=0, 3, 9$) has been studied from
radiofrequencies up to the infrared. At temperatures below 250 K a pronounced
absorption peak appears around 12 cm$^{-1}$ in Sr$_{14}$Cu$_{24}$O$_{41}$ for
the radiation polarized along the chains/ladders (${\bf E}\parallel {\bf c}$).
In addition a strongly temperature dependent dielectric relaxation is observed
in the kHz - MHz range. We explain this behavior by a charge density wave which
develops in the ladders sub-system and produces a mode pinned at 12 cm$^{-1}$.
With increasing Ca doping the mode shifts up in frequency and eventually
disappears for $x=9$ because the dimensionality of the system crosses over from
one to two dimensions, giving way to the superconducting ground state under
pressure.
","[{""version"":""v1"",""created"":""Wed, 23 Jan 2002 14:45:16 GMT""},{""version"":""v2"",""created"":""Mon, 28 Jan 2002 13:39:55 GMT""}]","2009-11-07"
"cond-mat/0201414","Gaetano Senatore","S. De Palo F. Rapisarda Gaetano Senatore","Excitonic condensation in a symmetric electron-hole bilayer","4 pages, 3 figures, 2 tables","Phys. Rev. Lett. 88, 206401 (2002)","10.1103/PhysRevLett.88.206401",,"cond-mat.str-el cond-mat.mes-hall",,"  Using Diffusion Monte Carlo simulations we have investigated the ground state
of a symmetric electron-hole bilayer and determined its phase diagram at T=0.
We find clear evidence of an excitonic condensate, whose stability however is
affected by in-layer electronic correlation. This stabilizes the electron-hole
plasma at large values of the density or inter-layer distance, and the Wigner
crystal at low density and large distance. We have also estimated pair
correlation functions and low order density matrices, to give a microscopic
characterization of correlations, as well as to try and estimate the condensate
fraction.
","[{""version"":""v1"",""created"":""Wed, 23 Jan 2002 15:12:35 GMT""}]","2009-11-07"
"cond-mat/0201415","Michael R. Norman","M. R. Norman, C. Pepin","Quasiparticle Formation and Optical Sum Rule Violation in Cuprate
  Superconductors","5 pages, revtex, 4 encapsulated postscript figures","Phys. Rev. B 66, 100506(R) (2002)","10.1103/PhysRevB.66.100506",,"cond-mat.supr-con",,"  Using a simple model for the frequency dependent scattering rate, we evaluate
the in-plane optical integral for cuprate superconductors in the normal and
superconducting states. In the overdoped region, this integral is conserved. In
the optimal and underdoped region, though, the optical integrals differ,
implying a lowering of the in-plane kinetic energy in the superconducting
state. This sum rule violation, due to the difference of the non Fermi liquid
normal state and the superconducting Fermi liquid state, has a magnitude
comparable to recent experimental results.
","[{""version"":""v1"",""created"":""Wed, 23 Jan 2002 15:46:44 GMT""}]","2009-11-07"
"cond-mat/0201416","Stefano Fabris","S. Fabris, S. Nufer and C. Elsaesser","The prismatic Sigma 3 (10-10) twin bounday in alpha-Al2O3 investigated
  by density functional theory and transmission electron microscopy",,,"10.1103/PhysRevB.66.155415",,"cond-mat.mtrl-sci",,"  The microscopic structure of a prismatic $\Sigma 3$ $(10\bar{1}0)$ twin
boundary in \aal2o3 is characterized theoretically by ab-initio
local-density-functional theory, and experimentally by spatial-resolution
electron energy-loss spectroscopy in a scanning transmission electron
microscope (STEM), measuring energy-loss near-edge structures (ELNES) of the
oxygen $K$-ionization edge. Theoretically, two distinct microscopic variants
for this twin interface with low interface energies are derived and analysed.
Experimentally, it is demonstrated that the spatial and energetical resolutions
of present high-performance STEM instruments are insufficient to discriminate
the subtle differences of the two proposed interface variants. It is predicted
that for the currently developed next generation of analytical electron
microscopes the prismatic twin interface will provide a promising benchmark
case to demonstrate the achievement of ELNES with spatial resolution of
individual atom columns.
","[{""version"":""v1"",""created"":""Wed, 23 Jan 2002 15:54:58 GMT""}]","2009-11-07"
"cs/0201019","Mireille Boutin","Pierre-Louis Bazin (Brown University) Mireille Boutin (Brown
  University)","Structure from Motion: Theoretical Foundations of a Novel Approach Using
  Custom Built Invariants","15 pages",,,,"cs.CV math.DG",,"  We rephrase the problem of 3D reconstruction from images in terms of
intersections of projections of orbits of custom built Lie groups actions. We
then use an algorithmic method based on moving frames ""a la Fels-Olver"" to
obtain a fundamental set of invariants of these groups actions. The invariants
are used to define a set of equations to be solved by the points of the 3D
object, providing a new technique for recovering 3D structure from motion.
","[{""version"":""v1"",""created"":""Tue, 22 Jan 2002 21:00:35 GMT""}]","2007-05-23"
"cs/0201020","Churn-Jung Liau","Churn-Jung Liau","A Modal Logic Framework for Multi-agent Belief Fusion","LaTex, 29 pages",,,,"cs.AI cs.LO",,"  This paper is aimed at providing a uniform framework for reasoning about
beliefs of multiple agents and their fusion. In the first part of the paper, we
develop logics for reasoning about cautiously merged beliefs of agents with
different degrees of reliability. The logics are obtained by combining the
multi-agent epistemic logic and multi-sources reasoning systems. Every ordering
for the reliability of the agents is represented by a modal operator, so we can
reason with the merged results under different situations. The fusion is
cautious in the sense that if an agent's belief is in conflict with those of
higher priorities, then his belief is completely discarded from the merged
result. We consider two strategies for the cautious merging of beliefs. In the
first one, if inconsistency occurs at some level, then all beliefs at the lower
levels are discarded simultaneously, so it is called level cutting strategy.
For the second one, only the level at which the inconsistency occurs is
skipped, so it is called level skipping strategy. The formal semantics and
axiomatic systems for these two strategies are presented. In the second part,
we extend the logics both syntactically and semantically to cover some more
sophisticated belief fusion and revision operators. While most existing
approaches treat belief fusion operators as meta-level constructs, these
operators are directly incorporated into our object logic language. Thus it is
possible to reason not only with the merged results but also about the fusion
process in our logics. The relationship of our extended logics with the
conditional logics of belief revision is also discussed.
","[{""version"":""v1"",""created"":""Wed, 23 Jan 2002 02:43:01 GMT""}]","2007-05-23"
"cs/0201021","Dov Samet","Philippe Jehiel, Dov Samet","Learning to Play Games in Extensive Form by Valuation",,,,,"cs.LG cs.GT",,"  A valuation for a player in a game in extensive form is an assignment of
numeric values to the players moves. The valuation reflects the desirability
moves. We assume a myopic player, who chooses a move with the highest
valuation. Valuations can also be revised, and hopefully improved, after each
play of the game. Here, a very simple valuation revision is considered, in
which the moves made in a play are assigned the payoff obtained in the play. We
show that by adopting such a learning process a player who has a winning
strategy in a win-lose game can almost surely guarantee a win in a repeated
game. When a player has more than two payoffs, a more elaborate learning
procedure is required. We consider one that associates with each move the
average payoff in the rounds in which this move was made. When all players
adopt this learning procedure, with some perturbations, then, with probability
1, strategies that are close to subgame perfect equilibrium are played after
some time. A single player who adopts this procedure can guarantee only her
individually rational payoff.
","[{""version"":""v1"",""created"":""Wed, 23 Jan 2002 11:58:17 GMT""}]","2007-05-23"
"gr-qc/0201075","Olga Sergeevna Khovanskaya","O.Khovanskaya (Sternberg Astronomical Institute, Moscow, Russia)","Dilatonic Black Holes Time Stability","LaTeX, 4 pages, uses gc-99.sty, submitted to Grav. & Cosmol","Grav.Cosmol. 8 (2002) 197-200",,,"gr-qc",,"  The stability under small time perturbations of the dilatonic black hole
solution near the determinant curvature singularity is proved. This fact gives
the additional arguments that the investigated topological configuration can
realise in nature. In the frames of this model primordial black hole remnants
are examined as time stable objects, which can form an significant part of a
dark matter in the Universe.
","[{""version"":""v1"",""created"":""Wed, 23 Jan 2002 09:29:36 GMT""}]","2007-05-23"
"gr-qc/0201076","Jose Geraldo Pereira","M. Calcada and J. G. Pereira","Angular Momentum and Energy-Momentum Densities as Gauge Currents","RevTeX4, 7 pages, no figures. Presentation changes; version to appear
  in Phys. Rev. D","Phys.Rev. D66 (2002) 044001","10.1103/PhysRevD.66.044001",,"gr-qc hep-th",,"  If we replace the general spacetime group of diffeomorphisms by
transformations taking place in the tangent space, general relativity can be
interpreted as a gauge theory, and in particular as a gauge theory for the
Lorentz group. In this context, it is shown that the angular momentum and the
energy-momentum tensors of a general matter field can be obtained from the
invariance of the corresponding action integral under transformations taking
place, not in spacetime, but in the tangent space, in which case they can be
considered as gauge currents.
","[{""version"":""v1"",""created"":""Wed, 23 Jan 2002 12:43:26 GMT""},{""version"":""v2"",""created"":""Tue, 5 Feb 2002 17:08:44 GMT""},{""version"":""v3"",""created"":""Thu, 11 Jul 2002 16:10:16 GMT""}]","2009-11-07"
"hep-ex/0201035","Aleph Secretariat","D. Fayolle","Anomalous couplings at LEP2","7 pages, 6 figures, 10th Lomonosov Conference on Elementary Particle
  Physics, Moscow, August 2001",,"10.1142/9789812704948_0030",,"hep-ex",,"  In its second phase, LEP has allowed to study four fermion processes never
observed before. Results are presented on the charged triple gauge boson
couplings (TGC) from the W-pair, Single W and Single gamma production. The
anomalous quartic gauge couplings (QGC) are constrained using production of
WWgamma, nunubargammagamma and Zgammagamma final states. Finally, limits on the
neutral anomalous gauge couplings (NGC) using the Zgamma and ZZ production
processes are also reported. All results are consistent with the Standard Model
expectations.
","[{""version"":""v1"",""created"":""Wed, 23 Jan 2002 08:17:47 GMT""}]","2017-08-23"
"hep-ex/0201036","Uta Stosslein","Uta Stosslein","Polarized Structure Functions and Spin Physics","Invited talk at the XX. Int. Sym. on Lepton and Photon Interactions
  at High Energies, Rome, Italy, July 2001, 19 pages, 16 Postscript figures,
  Latex2e, ws-p10x7.cls","Int.J.Mod.Phys.A17:3220-3238,2002","10.1142/S0217751X02012703",,"hep-ex",,"  Recent progress in the field of spin physics of high energy particle
interactions is reviewed with particular emphasis on the spin structure
functions as measured in polarized deep inelastic lepton-nucleon scattering
(DIS). New measurements are presented to obtain more direct information on the
composition of the nucleon angular momentum, with results from semi-inclusive
DIS accessing flavour-separated parton distribution functions (PDF) and with
first data from hard exclusive reactions which may be interpreted in terms of
recently developed generalizations of parton distribution functions (GPD).
Finally, experimental prospects are outlined which will lead to a further
development of the virtues of QCD phenomenology of the spin structure of the
nucleon.
","[{""version"":""v1"",""created"":""Wed, 23 Jan 2002 08:40:14 GMT""}]","2011-07-19"
"hep-ph/0201204","Juergen Berges","J. Berges","Nonequilibrium Quantum Fields and the Classical Field Theory Limit","5 pages, to appear in the Proceedings of ""Statistical QCD"",
  Bielefeld, August 26-30, 2001","Nucl.Phys. A702 (2002) 351-355","10.1016/S0375-9474(02)00723-6","HD-THEP-02-03","hep-ph",,"  We calculate the far-from-equilibrium dynamics and thermalization both for
the quantum and the classical O(N)--model. The early and late-time behavior can
be described from the 2PI--loop expansion for weak couplings or the
nonperturbative 2PI--1/N expansion of the effective action beyond leading
order. A comparison with exact simulations in 1+1 dimensions in the classical
limit shows that the 2PI--1/N expansion at next-to-leading order gives
quantitatively precise results already for moderate values of N. We derive a
criterion for the validity of the classical approximation and verify it by
comparing far-from-equilibrium quantum and classical dynamics. At late times
one observes the expected deviations due to the difference between classical
and quantum thermal equilibrium.
","[{""version"":""v1"",""created"":""Tue, 22 Jan 2002 16:13:43 GMT""}]","2009-11-07"
"hep-ph/0201205","Sterman","George Sterman (Stony Brook)","Some Recent Developments in Perturbative Quantum Chromodynamics","10 pages, 9 eps figures, based on a talk at Light-Cone Physics,
  Particles and Strings, Trento, September 2001","Nucl.Phys.Proc.Suppl.108:49-58,2002","10.1016/S0920-5632(02)01304-X","YITP-SB-02-02","hep-ph",,"  This talk reviews some recent trends in perturbative quantum chromodynamics,
with emphasis on higher orders in perturbation theory, resummation and power
corrections.
","[{""version"":""v1"",""created"":""Tue, 22 Jan 2002 16:16:18 GMT""}]","2014-11-17"
"hep-ph/0201206","William Kilgore","Robert V. Harlander, William B. Kilgore","Next-to-Next-to-Leading Order Higgs Production at Hadron Colliders","5 pages, 4 figures, minor changes","Phys.Rev.Lett. 88 (2002) 201801","10.1103/PhysRevLett.88.201801","BNL-HET-02/3, CERN-TH/2002-006","hep-ph",,"  The Higgs boson production cross section at pp and p\bar{p} colliders is
calculated in QCD at next-to-next-to-leading order (NNLO). We find that the
perturbative expansion of the production cross section is well behaved and that
scale dependence is reduced relative to the NLO result. These findings give us
confidence in the reliability of the prediction. We also report an error in the
NNLO correction to Drell-Yan production.
","[{""version"":""v1"",""created"":""Tue, 22 Jan 2002 19:02:52 GMT""},{""version"":""v2"",""created"":""Thu, 9 May 2002 01:59:29 GMT""}]","2009-11-07"
"hep-ph/0201207","Ilja Dorsner","Ilja Dorsner and S.M. Barr (Bartol Research Institute)","Flavon exchange effects in models with abelian flavor symmetry","19 pages, 5 Postscript figures, LATEX","Phys.Rev.D65:095004,2002","10.1103/PhysRevD.65.095004","BA-02-03","hep-ph",,"  In models with abelian flavor symmetry the small mixing angles and mass
ratios of quarks and leptons are typically given by powers of small parameters
characterizing the spontaneous breaking of flavor symmetry by ""flavon"" fields.
If the scale of the breaking of flavor symmetry is near the weak scale, flavon
exchange can lead to interesting flavor-violating and CP violating effects.
These are studied. It is found that d_e, mu -> e + gamma, and mu-e conversion
on nuclei can be near present limits. For significant range of parameters mu-e
conversion can be the most sensitive way to look for such effects.
","[{""version"":""v1"",""created"":""Tue, 22 Jan 2002 19:52:00 GMT""}]","2011-05-12"
"hep-ph/0201208","Maurice Goldhaber","Maurice Goldhaber","A Closer Look at the Elementary Fermions","8 pages","Proc.Nat.Acad.Sci. 99 (2002) 33","10.1073/pnas.221582298",,"hep-ph",,"  Although there have been many experimental and theoretical efforts to measure
and interpret small deviations from the standard model of particle physics, the
gap that the model leaves in understanding why there are only three generations
of elementary fermions, with hierarchical masses, has not received the
attention it deserves. I present here an attempt to fill this gap. Although our
findings are mostly only qualitative, they nevertheless may be of heuristic
value. Rules concerning the elementary fermions, some previously known and some
new, lead to a number of conclusions and questions that seem worth pursuing.
Some clarify the standard model, and others suggest possible modifications, the
implications of which are discussed.
","[{""version"":""v1"",""created"":""Tue, 22 Jan 2002 19:57:25 GMT""},{""version"":""v2"",""created"":""Wed, 23 Jan 2002 15:59:56 GMT""},{""version"":""v3"",""created"":""Tue, 29 Jan 2002 17:22:14 GMT""},{""version"":""v4"",""created"":""Tue, 12 Feb 2002 19:09:12 GMT""}]","2009-11-07"
"hep-ph/0201209","Anne M. Green","Anne M Green and Anupam Mazumdar","Dynamics of a large extra dimension inspired hybrid inflation model","9 pages, 2 figures version to appear in Phys. Rev. D, additional
  references and minor changes to discussion","Phys.Rev. D65 (2002) 105022","10.1103/PhysRevD.65.105022",,"hep-ph astro-ph hep-th",,"  In low scale quantum gravity scenarios the fundamental scale of nature can be
as low as TeV, in order to address the naturalness of the electroweak scale. A
number of difficulties arise in constructing specific models; stabilisation of
the radius of the extra dimensions, avoidance of overproduction of Kaluza Klein
modes, achieving successful baryogenesis and production of a close to
scale-invariant spectrum of density perturbations with the correct amplitude.
We examine in detail the dynamics, including radion stabilisation, of a hybrid
inflation model that has been proposed in order to address these difficulties,
where the inflaton is a gauge singlet residing in the bulk. We find that for a
low fundamental scale the phase transition, which in standard four dimensional
hybrid models usually ends inflation, is slow and there is second phase of
inflation lasting for a large number of e-foldings. The density perturbations
on cosmologically interesting scales exit the Hubble radius during this second
phase of inflation, and we find that their amplitude is far smaller than is
required. We find that the duration of the second phase of inflation can be
short, so that cosmologically interesting scales exit the Hubble radius prior
to the phase transition, and the density perturbations have the correct
amplitude, only if the fundamental scale takes an intermediate value. Finally
we comment briefly on the implications of an intermediate fundamental scale for
the production of primordial black holes and baryogenesis.
","[{""version"":""v1"",""created"":""Tue, 22 Jan 2002 20:11:29 GMT""},{""version"":""v2"",""created"":""Tue, 26 Mar 2002 12:54:36 GMT""}]","2009-11-07"
