"hep-ph/0201210","Yu-Ping Kuang","Yu-Ping Kuang","S-D Mixing and Searching for the psi(1P1) State at the Beijing
  Electron-Positron Coolider","9-page RevTex file. Version for publication in Phys. Rev. D","Phys.Rev. D65 (2002) 094024","10.1103/PhysRevD.65.094024","TUHEP-TH-01129","hep-ph",,"  The psi(1P1) state can be produced at the Beijing Electron-Positron Collider
(BEPC) in the process psi'-->psi(1P1)+pi(0). We calculate the rate of this
process taking account of the S-D mixing effect in psi'. It is shown that the
rate is about a factor of 3 smaller than the simple result without considering
the S-D mixing effect. Possible detecting channels are suggested and it is
shown that psi(1P1) is able to be found with the accumulation of 30 million
events of psi' at BEPC.
","[{""version"":""v1"",""created"":""Tue, 22 Jan 2002 22:49:36 GMT""},{""version"":""v2"",""created"":""Thu, 24 Jan 2002 10:02:27 GMT""},{""version"":""v3"",""created"":""Sun, 10 Feb 2002 11:00:48 GMT""},{""version"":""v4"",""created"":""Fri, 12 Apr 2002 13:21:26 GMT""}]","2009-11-07"
"hep-ph/0201212","Mariusz Sadzikowski","M. Sadzikowski (MIT, LNS & Cracow, INP)","Quark scattering at QGP/2SC interface","4 pages. Minor changes in ""Conclusions""","Acta Phys.Polon. B33 (2002) 1601-1608",,"MIT-CTP-3234","hep-ph",,"  We considered the phenomenon of the Andreev reflection of quarks at the
interface between the cold quark-gluon plasma phase and 2SC color
superconductor.
","[{""version"":""v1"",""created"":""Wed, 23 Jan 2002 00:16:15 GMT""},{""version"":""v2"",""created"":""Fri, 25 Jan 2002 22:37:25 GMT""}]","2007-05-23"
"hep-ph/0201213","Yongjun Zhang","Yong-Jun Zhang, Bo-Qiang Ma, Li-Ming Yang","Flavor Asymmetry of Nucleon Sea from Detailed Balance","4 pages and no figures. Talk presented at the Third
  Circum-Pan-Pacific Symposium on ""High Energy Spin Physics"", Oct. 8-13, 2001,
  Beijing, China","Int.J.Mod.Phys. A18 (2003) 1465-1468","10.1142/S0217751X03014915",,"hep-ph hep-ex nucl-ex nucl-th",,"  In this study, the proton is taken as an ensemble of quark-gluon Fock states.
Using the principle of detailed balance, we find $\bar{d}-\bar{u} \approx
0.124$, which is in surprisingly agreement with the experimental observation.
","[{""version"":""v1"",""created"":""Wed, 23 Jan 2002 00:19:49 GMT""}]","2009-11-07"
"hep-ph/0201214","Zoubs","Yong-Jun Zhang, Bing-Song Zou and Li-Ming Yang, (Peking University and
  Institute of High Energy Physics, CAS, Beijing, China)","Parton Distribution of Proton in a Simple Statistical Model","Postscript file, 8 pages","Phys.Lett. B528 (2002) 228-232","10.1016/S0370-2693(02)01215-7","BIHEP-TH-2002-6","hep-ph",,"  Taking proton as an ensemble of quark-gluon Fock states and using the
principle of detailed balance, we construct a simple statistical model for
parton distribution of proton. The recent observed Bjorken-$x$ dependent light
flavor sea quark asymmetry $\bar{d}(x)-\bar{u}(x)$ can be well reproduced by
Monte Carlo simulation as a pure statistical effect.
","[{""version"":""v1"",""created"":""Wed, 23 Jan 2002 01:34:36 GMT""}]","2009-11-07"
"hep-ph/0201215",,"Feodor F. Tikhonin (Institute for High Energy Physics, Protvino,
  Russia)","An Insight into the Anatomy of Electro-Gravitational Interactions","8 pages, LaTeX, 3 EPS figures. Minor changes in the 'Conclusion' are
  made on 24 Jan. Talk given at the Seventh International Wigner Symposium,
  24-29 August 2001. University of Maryland, College Park, Maryland, U.S.A. To
  appear in Proc. of 7th Int. Wigner Symp",,,"IHEP-02-XX","hep-ph",,"  An interplay between electromagnetic and gravitational interactions is
studied with particular emphasis on the particles mass dependence of
amplitudes. The cancellations between diagrams due to the gauge invarinace are
explicitly demonstrated.
","[{""version"":""v1"",""created"":""Wed, 23 Jan 2002 14:20:22 GMT""},{""version"":""v2"",""created"":""Thu, 24 Jan 2002 07:50:05 GMT""}]","2007-05-23"
"hep-ph/0201216","Nobuhito Maru","Naoyuki Haba and Nobuhito Maru","Light Higgs Triplets in Extra Dimensions","10 pages, LaTeX, the version to appear in PLB","Phys.Lett. B532 (2002) 93-98","10.1016/S0370-2693(02)01534-4","UT-02-10","hep-ph",,"  We discuss the possibility that the Higgs triplet can be light (1TeV in the
most interesting case) without contradictions with the proton stability %and
the gauge coupling unification in the context of higher dimensional theory. The
proton stability is ensured by the suppression of Yukawa coupling of the Higgs
triplet to the matter through its small overlap of wave functions in extra
dimensions. The light Higgs triplets might be detected in future collider
experiments as an alternative signature of GUT instead of the proton decay. The
gauge coupling unification can be preserved by introducing extra bulk matter
fields.
","[{""version"":""v1"",""created"":""Wed, 23 Jan 2002 10:49:34 GMT""},{""version"":""v2"",""created"":""Wed, 27 Feb 2002 07:46:08 GMT""}]","2009-11-07"
"hep-ph/0201217","Vladimir Galkin","D. Ebert, R. N. Faustov, V. O. Galkin, A. P. Martynenko","Mass spectra of doubly heavy baryons in the relativistic quark model","29 pages, 6 figures","Phys.Rev. D66 (2002) 014008","10.1103/PhysRevD.66.014008","HU-EP-02/01","hep-ph hep-ex",,"  Mass spectra of baryons consisting of two heavy (b or c) and one light quarks
are calculated in the framework of the relativistic quark model. The light
quark-heavy diquark structure of the baryon is assumed. Under this assumption
the ground and excited states of both the diquark and quark-diquark bound
system are considered. The quark-diquark potential is constructed. The light
quark is treated completely relativistically, while the expansion in the
inverse heavy quark mass is used revealing the close similarity with the mass
spectra of B and D mesons. We find that the relativistic treatment of the light
quark plays an important role. The level inversion of the p-wave excitations of
the light quark in doubly heavy baryons is discussed.
","[{""version"":""v1"",""created"":""Wed, 23 Jan 2002 11:48:45 GMT""}]","2009-11-07"
"hep-ph/0201219","Fawzi Boudjema","F. Boudjema and A. Semenov","Measurements of the SUSY Higgs self-couplings and the reconstruction of
  the Higgs potential","25 pages, 3 figures","Phys.Rev. D66 (2002) 095007","10.1103/PhysRevD.66.095007","LAPTH-880/01","hep-ph",,"  We address the issue of the reconstruction of the scalar potential of a
two-Higgs doublet model having in mind that of the MSSM.
  We first consider the general CP conserving dim-4 effective potential. To
fully reconstruct this potential, we show that even if all the Higgs masses and
their couplings to the standard model particles are measured one needs not only
to measure certain trilinear Higgs self-couplings but some of the quartic
couplings as well. We also advocate expressing the Higgs self couplings in the
mass basis. We show explicitly, that in the so-called decoupling limit, the
most easily accessible Higgs self-couplings are given in terms of the Higgs
mass while all other dependencies on the parameters of the general effective
potential are screened. This helps also easily explain how, in the
  MSSM, the largest radiative corrections which affect these self couplings are
reabsorbed by using the corrected Higgs mass. We also extend our analysis to
higher order operators in the effective Higgs potential. While the above
screening properties do not hold, we argue that these effects must be small and
may not be measured considering the foreseen poor experimental precision in the
extraction of the SUSY Higgs self-couplings.
","[{""version"":""v1"",""created"":""Wed, 23 Jan 2002 15:14:22 GMT""}]","2016-09-06"
"hep-ph/0201220","Shuquan Nie","Marc Sher and Shuquan Nie","Large Electric Dipole Moments of Heavy Neutrinos","22 pages, 9 figures","Phys.Rev. D65 (2002) 093018","10.1103/PhysRevD.65.093018","WM-02-101","hep-ph",,"  In many models of CP violation, the electric dipole moment (EDM) of a heavy
charged or neutral lepton could be very large. We present an explicit model in
which a heavy neutrino EDM can be as large as $10^{-16}$ e-cm, or even a factor
of ten larger if fine-tuning is allowed, and use an effective field theory
argument to show that this result is fairly robust. We then look at the
production cross section for these neutrinos, and by rederiving the Bethe-Block
formula, show that they could leave an ionization track. It is then noted that
the first signature of heavy neutrinos with a large EDM would come from
$e^+e^-\to \bar{N}N\gamma$, leading to a very large rate for single photon plus
missing energy events, and the rate and angular distribution are found.
Finally, we look at some astrophysical consequences, including whether these
neutrinos could constitute the UHE cosmic rays and whether their decays in the
early universe could generate a net lepton asymmetry.
","[{""version"":""v1"",""created"":""Wed, 23 Jan 2002 15:33:44 GMT""}]","2009-11-07"
"hep-th/0201173","Andrea Cappelli","Andrea Cappelli and Giuseppe D'Appollonio","Boundary States of c=1 and 3/2 Rational Conformal Field Theories","Latex, 46 pages, 1 figure","JHEP 0202:039,2002","10.1088/1126-6708/2002/02/039","preprint DFF 378/12/2001, PAR-LPTHE 01-79","hep-th",,"  We study the boundary states for the rational points in the moduli spaces of
c=1 conformal and c=3/2 superconformal field theories, including the isolated
Ginsparg points. We use the orbifold and simple-current techniques to relate
the boundary states of different theories and to obtain symmetry-breaking,
non-Cardy boundary states. We show some interesting examples of fractional and
twisted branes on orbifold spaces.
","[{""version"":""v1"",""created"":""Tue, 22 Jan 2002 16:53:30 GMT""}]","2010-02-03"
"hep-th/0201174","Edi Halyo","Edi Halyo","Strings and the Holographic Description of Asymptotically de Sitter
  Spaces","15 pages in phyzzx.tex, minor corrections","JHEP 0206 (2002) 012","10.1088/1126-6708/2002/06/012",,"hep-th",,"  Asymptotically de Sitter spaces can be described by Euclidean boundary
theories with entropies given by the modified Cardy--Verlinde formula. We show
that the Cardy--Verlinde formula describes a string with a rescaled tension
which in fact is a string at the stretched cosmological horizon as seen from
the boundary. The temperature of the boundary theory is the rescaled Hagedorn
temperature of the string. Our results agree with an alternative description of
asymptotically de Sitter spaces in terms of strings on the stretched horizon.
The relation between the two descriptions is given by the large gravitational
redshift between the boundary and the stretched horizon and a shift in energy.
","[{""version"":""v1"",""created"":""Tue, 22 Jan 2002 19:06:45 GMT""},{""version"":""v2"",""created"":""Mon, 18 Feb 2002 19:58:23 GMT""}]","2009-11-07"
"hep-th/0201175","Yasuaki Hikida","Yasuaki Hikida","Orientifolds of SU(2)/U(1) WZW Models","33 pages, 3 figures, the geometry of orientifolds corrected and the
  spectral flow identification reconsidered","JHEP 0211 (2002) 035","10.1088/1126-6708/2002/11/035",,"hep-th",,"  The orientifolds of SU(2)/U(1) gauged WZW models are investigated. In
particular, we construct the new type orientifolds and identify their
geometries. We closely follow the analysis of D-branes in the SU(2)/U(1) WZW
models, which was given by Maldacena, Moore and Seiberg.
","[{""version"":""v1"",""created"":""Tue, 22 Jan 2002 20:21:38 GMT""},{""version"":""v2"",""created"":""Sun, 27 Jan 2002 10:09:05 GMT""},{""version"":""v3"",""created"":""Thu, 22 Aug 2002 19:40:52 GMT""}]","2009-11-07"
"hep-th/0201176","Ysmyung","Y. S. Myung (Inje Univ)","Absorption cross section in de Sitter space","13 pages, version to appear in MPLA","Mod.Phys.Lett. A18 (2003) 617-628","10.1142/S0217732303009678","INJE-TP-02-01","hep-th",,"  We study the wave equation for a minimally coupled massive scalar in
three-dimensional de Sitter space. We compute the absorption cross section to
investigate its cosmological horizon in the southern diamond. Although the
absorption cross section is not defined exactly, we can be determined it from
the fact that the low-energy $s(j=0)$-wave absorption cross section for a
massless scalar is given by the area of the cosmological horizon. On the other
hand, the low-temperature limit of $j\not=0$-mode absorption cross section is
useful for extracting information surrounding the cosmological horizon. Finally
we mention a computation of the absorption cross section on the CFT-side using
the dS/CFT correspondence.
","[{""version"":""v1"",""created"":""Wed, 23 Jan 2002 01:43:36 GMT""},{""version"":""v2"",""created"":""Mon, 10 Feb 2003 22:27:57 GMT""}]","2009-11-07"
"hep-th/0201177","Shunsuke Teraguchi","Hiroyuki Hata, Sanefumi Moriyama and Shunsuke Teraguchi (Kyoto Univ)","Exact Results on Twist Anomaly","26 pages, one figure, LaTeX2e, v3: minor corrections","JHEP 0202 (2002) 036","10.1088/1126-6708/2002/02/036","KUNS-1753","hep-th",,"  In vacuum string field theory, the sliver state solution has been proposed as
a candidate of a D-brane configuration. Physical observables associated with
this solution, such as its energy density and the tachyon mass, are written in
terms of the Neumann coefficients. These observables, though vanish naively due
to twist symmetry, acquire non-vanishing values arising from their singular
behavior. Therefore, this phenomenon is called twist anomaly. In this paper we
present an analytical derivation of these physical observables with the help of
the star algebra spectroscopy. We also identify in our derivation the origin of
the twist anomaly in the finite-size matrix regularization.
","[{""version"":""v1"",""created"":""Wed, 23 Jan 2002 09:41:13 GMT""},{""version"":""v2"",""created"":""Fri, 8 Feb 2002 08:38:02 GMT""},{""version"":""v3"",""created"":""Wed, 27 Mar 2002 05:27:26 GMT""}]","2009-11-07"
"hep-th/0201178","Henric Larsson","Henric Larsson","Light-like noncommutativity and duality from open strings/branes","24 pages, Latex. v2:Comments and references added. v3:Version
  published in JHEP","JHEP 0203 (2002) 037","10.1088/1126-6708/2002/03/037",,"hep-th",,"  In this paper we perform some non-trivial tests for the recently obtained
open membrane/D-brane metrics and `generalized' noncommutativity parameters
using Dp/NS5/M5-branes which have been deformed by light-like fields. The
results obtained give further evidence that these open membrane/D-brane metrics
and `generalized' noncommutativity parameters are correct. Further, we use the
open brane data and supergravity duals to obtain more information about
non-gravitational theories with light-like noncommutativity, or `generalized'
light-like noncommutativity. In particular, we investigate various duality
relations (strong coupling limits). In the light-like case we also comment on
the relation between open membrane data (open membrane metric etc.) in six
dimensions and open string data in five dimensions. Finally, we investigate the
strong coupling limit (high energy limit) of five dimensional NCYM with
\Theta^{12}=\Theta^{34}. In particular, we find that this NCYM theory can be UV
completed by a DLCQ compactification of M-theory.
","[{""version"":""v1"",""created"":""Wed, 23 Jan 2002 10:21:54 GMT""},{""version"":""v2"",""created"":""Tue, 29 Jan 2002 13:53:48 GMT""},{""version"":""v3"",""created"":""Tue, 9 Apr 2002 10:52:07 GMT""}]","2009-11-07"
"hep-th/0201179","Y. M. Cho","Y.M. Cho","Monopole Condensation in SU(2) QCD","15 pages, 1 figure. PRD in press","Phys.Rev. D65 (2002) 074027",,,"hep-th",,"  Based on the gauge independent decomposition of the non-Abelian gauge field
into the dual potential and the valence potential, we calculate the one loop
effective action of SU(2) QCD in an arbitrary constant monopole background,
using the background field method. Our result provides a strong evidence for a
dynamical symmetry breaking through the monopole condensation, which can induce
the dual Meissner effect and establish the confinement of color, in the
non-Abelian gauge theory. The result is obtained by separating the topological
degrees which describe the non-Abelian monopoles from the dynamical degrees of
the gauge potential, and integrating out all the dynamical degrees of QCD.
","[{""version"":""v1"",""created"":""Wed, 23 Jan 2002 10:22:39 GMT""}]","2007-05-23"
"hep-th/0201180","Mariusz Dabrowski","Mariusz P. Dabrowski and Izabela Prochnicka","Null string evolution in black hole and cosmological spacetimes","version accepted to Phys. Rev. D, 12 pages, 2 postscript figures,
  REVTEX 4","Phys.Rev. D66 (2002) 043508","10.1103/PhysRevD.66.043508",,"hep-th astro-ph gr-qc",,"  We discuss the problem of the motion of classical strings in some black hole
and cosmological spacetimes. In particular, the null string limit (zero
tension) of tensile strings is considered. We present some new exact string
solutions in Reissner-Nordstr\""om black hole background as well as in the
Einstein Static Universe and in the Einstein-Schwarzschild (a black hole in the
Einstein Static Universe) spacetime. These solutions can give some insight into
a general nature of propagation of strings (cosmic and fundamental) in curved
backgrounds.
","[{""version"":""v1"",""created"":""Wed, 23 Jan 2002 13:24:32 GMT""},{""version"":""v2"",""created"":""Wed, 5 Jun 2002 15:47:32 GMT""}]","2009-11-07"
"hep-th/0201181","Paolo Provero","A. D'Adda and P. Provero","Two-dimensional gauge theories of the symmetric group S(n) and branched
  n-coverings of Riemann surfaces in the large-n limit","Talk presented at the ""Light-cone physics: particles and strings"",
  Trento, Italy, September 2001","Nucl.Phys.Proc.Suppl. 108 (2002) 79-83","10.1016/S0920-5632(02)01308-7","DFTT 04/2002","hep-th",,"  Branched n-coverings of Riemann surfaces are described by a 2d lattice gauge
theory of the symmetric group S(n) defined on a cell discretization of the
surface. We study the theory in the large-n limit, and we find a rich phase
diagram with first and second order transition lines. The various phases are
characterized by different connectivity properties of the covering surface. We
point out some interesting connections with the theory of random walks on group
manifolds and with random graph theory.
","[{""version"":""v1"",""created"":""Wed, 23 Jan 2002 15:07:58 GMT""}]","2009-11-07"
"math-ph/0201050","Clifford H. Taubes","Clifford H. Taubes","Partitioning of electric and magnetic energy in SU(2) gauge theory",,"Adv.Theor.Math.Phys.1:165-209,2001",,,"math-ph math.DG math.GT math.MP",,"  This article provides some estimates for the relative sizes of the electric
and magnetic contributions to the energy functional for the minimum energy
configuration of an SU(2) gauge field on R^3 in the presence of an source in a
fixed ball. The surprising fact is that the contribution to both energies from
the free field region increases at worst linearly with the coupling, rather
than quadratically. Moreover, the external electric field is severly surpressed
outside the source at large coupling while the magnetic field is concentrated
in a shell surrounding the source suggesting a classical mechanism for the
formation of the 'MIT bag'.
","[{""version"":""v1"",""created"":""Tue, 22 Jan 2002 21:50:31 GMT""}]","2008-11-26"
"math/0201209","Peter A. Hasto","Peter A. Hasto","Inequalities of relative weighted metrics","10 Pages",,,,"math.MG math.CA",,"  In this paper we present inequalities between two generalizations of the
hyperbolic metric and the j_G metric. We also prove inequalities between
generalized versions of the j_G metric and Seittenranta's metric.
","[{""version"":""v1"",""created"":""Tue, 22 Jan 2002 16:23:20 GMT""}]","2007-05-23"
"math/0201210","Deepak Parashar","Deepak Parashar","On the biparametric quantum deformation of GL(2) x GL(1)","16 pages LaTeX, published in JMP","J. Math. Phys. 42 (2001) 5431-5443","10.1063/1.1407280","MPI-MIS - 02/2002","math.QA math-ph math.MP",,"  We study the biparametric quantum deformation of GL(2) x GL(1) and exhibit
its cross-product structure. We derive explictly the associated dual algebra,
i.e., the quantised universal enveloping algebra employing the R-matrix
procedure. This facilitates construction of a bicovariant differential calculus
which is also shown to have a cross-product structure. Finally, a Jordanian
analogue of the deformation is presented as a cross-product algebra.
","[{""version"":""v1"",""created"":""Tue, 22 Jan 2002 18:19:40 GMT""}]","2009-11-07"
"math/0201211","Carlos Tomei","Carlos Tomei and Tania Vieira","The kernel of the adjacency matrix of a rectangular mesh","15 pages, 17 figures",,,,"math.CO",,"  Given an m x n rectangular mesh, its adjacency matrix A, having only integer
entries, may be interpreted as a map between vector spaces over an arbitrary
field K. We describe the kernel of A: it is a direct sum of two natural
subspaces whose dimensions are equal to $\lceil c/2 \rceil$ and $\lfloor c/2
\rfloor$, where c = gcd (m+1,n+1) - 1. We show that there are bases to both
vector spaces, with entries equal to 0, 1 and -1. When K = Z/(2), the kernel
elements of these subspaces are described by rectangular tilings of a special
kind. As a corollary, we count the number of tilings of a rectangle of integer
sides with a specified set of tiles.
","[{""version"":""v1"",""created"":""Tue, 22 Jan 2002 18:51:42 GMT""}]","2007-05-23"
"math/0201212","Frank Quinn","Frank Quinn","Lectures on controlled topology: mapping cylinder neighborhoods","19 pages, one figure",,,,"math.GT math.AT",,"  The existence theorem for mapping cylinder neighborhoods is discussed as a
prototypical example of controlled topology and its applications. The first of
a projected series developed from lectures at the Summer School on
High-Dimensional Topology, Trieste Italy 2001
","[{""version"":""v1"",""created"":""Tue, 22 Jan 2002 19:58:28 GMT""}]","2007-05-23"
"math/0201213","Tiberiu Constantinescu","T. Constantinescu and J. L. Johnson","Tensor algebras and displacement structure. II. Noncommutative Szego
  polynomials","17 pages",,,,"math.FA",,"  In this paper we continue to explore the connection between tensor algebras
and displacement structure. We focus on recursive orthonormalization and we
develop an analogue of the Szego type theory of orthogonal polynomials in the
unit circle for several noncommuting variables. Thus, we obtain the recurrence
equations and Christoffel-Darboux type formulas, as well as a Favard type
result. Also we continue to study a Szego kernel for the N-dimnesional unit
ball of an infinite dimensional Hilbert space.
","[{""version"":""v1"",""created"":""Tue, 22 Jan 2002 20:03:33 GMT""}]","2007-05-23"
"math/0201214","Alex Chigogidze","A.Chigogidze, A.Karasev, M.Rordam","Real rank and squaring mapping for unital C*-algebras",,,,,"math.FA math.GN",,"  It is proved that if X is a compact Hausdorff space of Lebesgue dimension
$\dim(X)$, then the squaring mapping $\alpha_{m} \colon
(C(X)_{\mathrm{sa}})^{m} \to C(X)_{+}$, defined by $\alpha_{m}(f_{1},...,
f_{m}) = \sum_{i=1}^{m} f_{i}^{2}$, is open if and only if $m -1 \ge \dim(X)$.
Hence the Lebesgue dimension of X can be detected from openness of the squaring
maps $\alpha_m$. In the case m=1 it is proved that the map $x \mapsto x^2$,
from the self-adjoint elements of a unital $C^{\ast}$-algebra A into its
positive elements, is open if and only if A is isomorphic to C(X) for some
compact Hausdorff space X with $\dim(X)=0$.
","[{""version"":""v1"",""created"":""Tue, 22 Jan 2002 20:51:56 GMT""}]","2007-05-23"
"math/0201215","Mu-Tao Wang","Mao-Pei Tsui & Mu-Tao Wang","A Bernstein type result for special Lagrangian submanifolds",,,,,"math.DG math.AP",,"  Let \Sigma be a complete minimal Lagrangian submanifold of \C^n.
  We identify regions in the Grassmannian of Lagrangian subspaces so that
whenever the image of the Gauss map of \Sigma lies in one of these regions,
then \Sigma is an affine space.
","[{""version"":""v1"",""created"":""Tue, 22 Jan 2002 21:05:31 GMT""}]","2016-09-07"
"math/0201216","Aleksey Zinger","A. Zinger","Completion of Katz-Qin-Ruan's Enumeration of Genus-Two Plane Curves","12 pages",,,,"math.AG",,"  We give a formula for the number of genus-two fixed-complex-structure
degree-d plane curves passing through 3d-2 points in general position. This is
achieved by completing Katz-Qin-Ruan's approach. This paper's formula agrees
with the one obtained by the author in a completely different way.
","[{""version"":""v1"",""created"":""Tue, 22 Jan 2002 21:39:38 GMT""}]","2007-05-23"
